[
  {
    "Names": {
      "Name": ["lu hui", "Aloe vera"],
      "Pharmaceutical": ["Herba Aloes"],
      "Biological": [
        "Aloe barbadensis Miller",
        "Aloe ferox miller",
        "Aloe arborescens",
        "Aloe perryi"
      ],
      "Common": [
        "aloe vera",
        "aloe",
        "burn plant",
        "lily of the desert",
        "elephant’s gall"
      ],
      "Other name": [],
      "Chinese": [
        "蘆薈",
        "好望角蘆薈",
        "木力蘆薈",
        "吉拉索蘆薈",
        "索科特拉蘆薈"
      ],
      "Pronunciation in Korean": ["nohwa"],
      "Pronunciation in Japanese": ["rokai"],
      "Pronunciation in Cantonese": ["lou4 wai3"],
      "Pinyin Pronunciation": []
    },
    "Type": "Herb",
    "Geography": [
      "Originally in Africa and Mediterranean",
      "Now also throughout southern China"
    ],
    "Properties": ["Bitter", "Cold"],
    "Meridians": ["Large Intestine", "Liver", "Stomach"],
    "Maladies Treated": [
      "Constipation due to heat buildup (yinxu (yin deficient)  with heat)",
      "Dizziness due to heat buildup (yinxu (yin deficient)  with heat)",
      "Red eyes due to heat buildup (yinxu (yin deficient)  with heat)",
      "Irritability due to heat buildup (yinxu (yin deficient)  with heat)",
      "Kills intestinal parasites, especially roundworms",
      "Ringworms",
      "Burns and wounds",
      "Liver yang over active"
    ],
    "Medical Function": [
      "Laxative effect",
      "Healing wounds and burns",
      "Antineoplastic effect on certain tumors and ascitic hepatic carcinoma",
      "Inhibitory effect on frog heart specimens",
      "Antifungal effect",
      "Strengthen immune system effect",
      "Anti-diabetic effect",
      "Transdermal drug delivery effect",
      "Hepatoprotective effect"
    ],
    "Dosage": "0.3 to 1.5 g in pill or powder form.",
    "Samples of Formulae": "dang gui long hui wan (當歸龍薈丸)",
    "Contraindications": "Contraindication during pregnancies and menstrual periods, rectal bleeding. Not to use in case of pixu (spleen deficient). Large amount or long term usage may cause irreversible damage to the kidneys. The toxic ingredients are aloin and aloe-emodin.",
    "Research": "[1] molecules 2008, 13, 1599-1616; DOI: 10.3390/molecules1308 1599",
    "Notes": "Ornamental type of Aloe Vera includes Aloe Mitriformis (不夜城蘆薈), Aloe Variegata (千代田錦), Aloe Aristata (綾錦).",
    "Chemical Ingredients": {
      "1": [
        "aloe-emodin (蘆薈大黃素)",
        "aloin (蘆薈甙)",
        "barbaloin",
        "isobarbaloin",
        "homonataloin",
        "chrysophanol",
        "chrysophanol glucoside",
        "anthranol",
        "isoelutherol glucoside",
        "aloesaponarin",
        "helminthosporin",
        "aloesin",
        "(6\"-O-p-coumaroylaloesin)",
        "(2\"-O-p-coumaroylaloesin)",
        "(2\"-O-p-feruloylaloesin)",
        "aloenin",
        "(7-hydroxyaloin)",
        "tetrahydroanthracene glucoside"
      ],
      "2": ["quercetin", "campherenol", "rutin"],
      "3": [
        "glucose",
        "mannose",
        "arabinose",
        "rhamnose",
        "fructose",
        "sucrose",
        "xylose",
        "glucuronic acid"
      ],
      "5": ["cholesterol", "campesterol", "sitosterol"],
      "6": [
        "capric acid",
        "lauric acid",
        "myristic acid",
        "pentadecanoic acid",
        "palmitic acid",
        "margaric acid",
        "stearic acid",
        "palmitoleic acid",
        "hexadecadienoic acid",
        "oleic acid",
        "linoleic acid",
        "linolenic acid",
        "succinic acid",
        "malic acid",
        "lactic acid",
        "P-coumaric acid"
      ],
      "8": ["beta-carotene"],
      "9": ["bradykininase", "magnesium lactate", "glyoxalase"]
    },
    "References": [
      "[1] molecules 2008, 13, 1599-1616; DOI: 10.3390/molecules1308 1599"
    ],
    "Further Reading": [],
    "Original Text": "lu hui, Aloe vera, Complementary and Alternative Healing UniversityComplementary and Alternative Healing University  Home  中藥詞典Search this siteList of Health ProblemsChinese Herb DictionaryQigongTraditional Chinese Medicine (TCM)AcupuncturePrescribed Drug DictionaryBiochemistry DictionaryLecture SlidesResearch LibrarianGeneral Online LibrarySearchResearch SitesViagraMassage/AcupressureHypnotherapyTell us what you wantNotify Changes & New Information \n lu hui, Aloe vera 蘆薈 Edited by: Joe Hing kwok ChuPharmaceutical name:英文藥名﹕Herba AloesBotanical name:學名﹕Aloe barbadensis Miller,Aloe ferox miller (好望角蘆薈)Aloe arborescens (木力蘆薈)Aloe vera (吉拉索蘆薈) Aloe perryi (索科特拉蘆薈)Pron. in Japanese:日語發音﹕rokaiPron. in Korean:韓語發音﹕nohwaPron. in Cantonese:粵音﹕lou4 wai3Other Names:別名﹕ Common Name:英文名﹕aloe vera, aloe, burn plant, lily of the desert, elephant�s gall.Distribution:產地﹕Originally in Africa and Mediterranean, now also throughout southern China原産非洲與地中海。現在中國南方\n地區亦有 。Properties(characteristics)﹕性味﹕bitter, cold.苦 ﹐ 寒 。Channels (meridians) entered: 歸經﹕large intestine, liver, stomach大 腸 ﹐ 肝 ﹐ 胃 。Medical functions:藥理﹕ \nLaxative effect\nHealing wounds and burns\nAntineoplastic effect on certain tumors and ascitic hepatic carcinoma.\nInhibitory effect on frog heart specimens\nAntifungal effect \nStrengthen \nimmune system effect [1]\nAnti-diabetic \neffect [1]\nTransderma drug delivery effect [1]\nHepatoproctive \neffect [1]致 瀉 作 用 。\n抗 腫 瘤 ﹐ 抗 腹 水 性 肝 癌 。\n抑 制 離 體 青 蛙 肝 臟 作 用 。\n抑 制黴 菌 作 用 。\n增強免疫作用。\n抗糖尿病作用。[1]\n透皮給藥作用。[1]\n保肝作用。[1]\n Actions & Indications:主治﹕for constipation, dizziness, red eyes, and irritability due to heat buildup (yinxu (yin deficient)  with heat) Kills intestinal parasites, especially roundworms. for treatment of ringworms. for burns and wounds for treatment of liver yang over active 陰虛 有 熱 而 便 秘 ﹐ 頭 暈 ﹐ 眼 紅 ﹐ 煩 躁 易 怒 。 殺 蟲。 治 金錢癬。 創 傷 ﹐ 燒 傷 。 治 肝 陽 上 昇 。Chemical ingredients:化學成份﹕1. aloe-emodin (蘆薈大黃素), aloin (蘆薈甙), barbaloin, isobarbaloin, homonataloin, chrysophanol, chrysophanol glucoside, anthranol, isoelutherol glucoside, aloesaponarin, helminthosporin, aloesin, (6\"-O-p-coumaroylaloesin), (2\"-O-p-coumaroylaloesin), (2\"-O-p-feruloylaloesin), aloenin, (7-hydroxyaloin), tetrahydroanthracene glucoside.2. quercetin, campherenol, rutin3. glucose, mannose, arabinose, rhamnose, fructose, sucrose, xylose, glucuronic acid, .5. cholesterol, campesterol, sitoterol.6. capric acid, lauric acid, myristic acid, pentadecanoic acid, palmitic acid, margaric acid, stearic acid, palmitoleic acid, hexadecadienoic acid, oleic acid, linoleic acid, linolenic acid, succinic acid, malic acid, lactic acid, P-coumaric acid.8. beta-carotene.9. bradykininase, magnesium lactate, glyoxalase.Dosage:用量﹕0.3 to 1.5 g in pill or powder form.Samples of formulae:處方舉例﹕dang gui long hui wan 當歸龍薈丸Modern Research:現代研究﹕ Toxicity & Cautions:毒素與禁忌﹕Contraindication during pregnancies and menstrual periods, rectal bleeding. Not to use in case of pixu (spleen deficient).Large amount or long term usage may cause irreversible damage to the kidneys.The toxic ingredients are aloin and aloe-emodin.懷孕或月經期間﹐或直腸出血 ﹐或脾虛者忌 用 。大量或長期服用可致無法挽回之腎臟損壞。有毒成份：蘆薈甙、蘆薈大黃素。　\nOther varieties\nOrnamental type of Aloe Vera:\n觀賞蘆薈:\nAloe Mitriformis\n不夜城蘆薈\nAloe Variegata  \n千代田錦\nAloe Aristata\n綾錦\n[1] molecules 2008, 13, 1599-1616; DOI: \n10.3390/molecules1308 1599Sponsors' Ads by Google 以下為谷歌所提供贊助者之廣告 A manuscript... writing, translating and proofreading  in         progress Problems with website? Please Click here for comment. (Not for inquiry )     Click here for inquiry  Copyright Notice 按此看關於 版權問題List of Health ProblemsChinese Herb DictionaryToxicity of Some HerbsSide Effect of Some HerbsHerbs that can be toxic to kidneysTraditional Chinese MedicineTCM DiagnosisSamples of FormulaeTerms of Traditional Chinese MedicineAcupuncturecopy right 版權所有Qigong (chi kung)Prescribed Drug DictionaryEmail our web master for  your suggestion (not for inquiry)Biochemistry DictionaryGeneral Online LibraryQigong classesFake Email WarningResearch LibrarianSearchQigong classesHomeWeather Report    Disclaimer\nLast update: Oct 30, 2011;  2:22 p.m. LAH  \n",
    "original_url": "http://alternativehealing.org/lu_hui.htm"
  },
  {
    "Names": {
      "Name": ["qin pi"],
      "Pharmaceutical": ["Cortex Fraxini"],
      "Biological": [
        "Fraxinius bungeana, D.C.",
        "Fraxinius bungeana, D.C. var. pubinervis, Bl.",
        "Fraxinus chinensis Roxb.",
        "F. rhynchophylla Hance",
        "F．chinensis var．acuminata Lingelsh.",
        "F．stylosa Lingelsh"
      ],
      "Common": ["Chinese Ash"],
      "Chinese": ["秦皮", "苦櫪白蠟樹", "尖葉白蠟樹", "宿柱白蠟樹"],
      "Pronunciation in Korean": ["chinp'i"],
      "Pronunciation in Japanese": ["shinpi"],
      "Pronunciation in Cantonese": ["ceong4 pei4"],
      "Pinyin Pronunciation": []
    },
    "Type": "Herb",
    "Geography": [
      "Shaanxi, China",
      "Sichuan, China",
      "Ningxia, China",
      "Yunnan, China",
      "Guizhou, China",
      "Hebei, China",
      "Korea",
      "Vietnam"
    ],
    "Properties": ["Bitter", "Cold"],
    "Meridians": ["Liver", "Gall bladder", "Large intestine"],
    "Maladies Treated": [
      "Diarrhea",
      "Blood in stool",
      "Urge of defecating caused by infection (tēnesmus)",
      "Swollen and red eyes caused by heat in liver",
      "Cataract",
      "Vaginal yeast or bacterial infection",
      "Chronic bronchitis",
      "Neurodermatitis"
    ],
    "Medical Function": [
      "Treats bacterial infection of intestines",
      "Treats enteritis"
    ],
    "Dosage": "3 ~12 g",
    "Samples of Formulae": "",
    "Contraindications": "Although the toxicity of decoction is low, occasionally it can cause nausea and vomiting. Do not use large amount. Large amounts of herb may cause lab animals to enter a sedative state, spasm, coma, respiratory arrest, and death. Qin pi is mainly used for acute bacterial infection of the intestine, and should not be used in chronic diarrhea caused by pixu (spleen deficient) or shenyangxu (kidney yang deficient) as it may further weaken the body. Incompatible with wu zhu yu (吳茱萸).",
    "Research": "",
    "Notes": "Do not use in chronic conditions without signs of damp heat. Large amounts can cause adverse effects in lab animals.",
    "Chemical Ingredients": {
      "": ["aesculin 秦皮甲素", "aesculetin 秦皮乙素"]
    },
    "References": [],
    "Further Reading": [],
    "Original Text": "qin pi, Complementary and Alternative Healing UniversityComplementary and Alternative Healing University  Home  現代 中藥辭典Search this site   Search this siteList of Health ProblemsChinese Herb DictionaryQigongTraditional Chinese Medicine (TCM)AcupuncturePrescribed Drug DictionaryBiochemistry DictionaryLecture SlidesResearch LibrarianGeneral Online LibrarySearchResearch SitesViagraMassage/AcupressureHypnotherapyTell us what you wantNotify Changes & New Information　　     　                                    qin pi 秦皮by Joe Hing Kwok ChuPharmaceutical name:英文藥名﹕Cortex FraxiniLatin name:學名﹕Fraxinius bungeana, D.C.Fraxinius bungeana, D.C. var. pubinervis, Bl.Fraxinus chinensis Roxb.F. rhynchophylla Hance 苦櫪白蠟樹 F．chinensis var．acuminata Lingelsh.尖葉白蠟樹F．stylosa Lingelsh 宿柱白蠟樹Pron. in Japanese:日語發音﹕shinpiPron. in Korean:韓語發音﹕chinp'iPron. in Cantonese:粵音﹕ceong4 pei4Other Names:別名﹕ Common Name:英文名﹕Chinese AshDistribution:產地﹕Shaanxi, Sichuan, Ningxia, Yunnan, Guizhou, Hebei provinces of China and also in Korea and Vietnam.主產陝西﹐ 四川﹐ 寧夏﹐云南﹐ 貴州﹐河北。Properties characteristics)﹕性味﹕bitter, cold.苦，寒。Channels  meridians) entered: 歸經﹕liver, gall bladder, large intestine channels肝，膽，大腸。Medical functions:藥理﹕  Actions & Indications:主治﹕diarrhea, blood in stool, urge of defecating caused by infection, (tēnesmus).swollen and red eyes caused by heat in liver, cataract.vaginal yeast or bacterial infectionchronic bronchitisneurodermatitis 治細菌性痢疾，腸炎，裡急後重。目赤腫痛，迎風流淚，目生翳膜。赤白帶下。慢性氣管炎。牛皮癬。Chemical ingredients:化學成份﹕aesculin 秦皮甲素 , aesculetin 秦皮乙素 .Dosage:用量﹕3 ~12 gSamples of formulae:處方舉例﹕ Modern Research:現代研究﹕ Toxicity & Cautions:毒素與禁忌﹕Although the toxicity of decoction is low, occasionally it can cause nausea and vomiting.Do not use large amount.  Large amount of herb causes lab animals into sedative state, spasm, coma, respiratory arrest, and death.Qin pi is mainly used in acute bacterial infection of intestine, not to use in chronic diarrhea cause by pixu (spleen deficient) shenyangxu (kidney yang deficient) or it may weaken the body further.Not to use with wu zhu yu.秦皮煎劑毒性雖低﹐偶然會有發生嘔吐現象。不可用大劑量。大劑量給藥後，實驗動物會出現鎮靜、驚厥、昏迷，呼吸麻痺而死亡。秦皮主要用於濕熱之象較盛的急性菌痢及腸炎。如病程已久，無濕熱之象，则不應使用。如属脾虛 ,腎陽虛的泄瀉，用秦皮會進一步傷及陽氣。畏吳茱萸。Sponsors' Ads by Google 以下為谷歌所提供贊助者之廣告  A manuscript... writing, translating and proofreading              in progressClick here for comment. (Not for inquiry )           Click here for inquiry   Copyright Notice 按此看關於版權問題List of Health ProblemsChinese Herb DictionaryToxicity of Some HerbsSide Effect of Some HerbsHerbs that can be toxic to kidneysTraditional Chinese MedicineTCM DiagnosisSamples of FormulaeAcupuncturecopy right 版權所有Qigong (chi kung)Prescribed Drug DictionaryEmail our web master for  your suggestion (not for inquiry)Biochemistry DictionaryGeneral Online LibraryQigong classesFake Email WarningResearch LibrarianSearchQigong classesHomeWeather Report    Disclaimer   Last update: Nov 2, 2010; 11:11 a.m. LAH  \n",
    "original_url": "http://alternativehealing.org/qin_pi.htm"
  },
  {
    "Names": {
      "Name": ["jiu cai", "jiu bai", "xie bai"],
      "Pharmaceutical": ["Herb Alliituberosi"],
      "Biological": ["Allium tuberosum Rottler"],
      "Common": ["Chinese leeks"],
      "Other name": [
        "jiu 韭",
        "shan jiu 山韭",
        "feng ben 豐本",
        "bian cai 扁菜",
        "cao zhong ru 草鐘乳",
        "qi yang cao 起陽草",
        "chang sheng jiu 長生韭",
        "lan ren cai 懶人菜",
        "kutsay (Tagalog, Cebuano)",
        "dundoku sag (Nepalese)",
        "bawang kucai (Indonesian)"
      ],
      "Chinese": ["韭菜", "韭白", "薤白"],
      "Pronunciation in Korean": [
        "buchu (부추)",
        "sol (솔)",
        "jeongguji (정구지)",
        "picha (seed)"
      ],
      "Pronunciation in Japanese": [
        "nira (kanji: 韮; hiragana: にら; katakana: ニラ)",
        "kyushi (seed)"
      ],
      "Pronunciation in Cantonese": ["gau2 coi3 (leaves)", "gau2 zi2 (seed)"],
      "Pinyin Pronunciation": []
    },
    "Type": "Herb",
    "Geography": ["Throughout China", "Cultivated nationwide"],
    "Properties": [
      "Leaves: Sweet, Acrid, Salty, Warm",
      "Seed: Acrid, Sweet, Warm",
      "Roots: Acrid"
    ],
    "Meridians": [
      "Seed: Kidney, Liver",
      "Leaves: Stomach, Liver, Kidney",
      "Roots: Liver"
    ],
    "Maladies Treated": [
      "Sweating during sleep due to liver-kidney yin deficiency",
      "Bed wetting",
      "Frequent urination",
      "Impotence",
      "Priapism",
      "Spermatorrhea",
      "Esophagus cancer",
      "Nausea",
      "Dysentery",
      "Abdomen pain",
      "Menses sickness",
      "Pain during menses",
      "Bleeding not during menses",
      "Vaginal discharge",
      "Injuries from impact",
      "Vomiting blood",
      "Nose bleeding",
      "Immature ejaculation"
    ],
    "Medical Function": [
      "Improving digestion",
      "Enhancing mental alertness",
      "Warming",
      "Anti inflammation",
      "Arresting bleeding and pain",
      "Jiu cai extract inhibited cancer cell growth and induced apoptosis in vitro",
      "Sulfur compound helps absorb vitamin A and B1",
      "Effect on cardiovascular system: sulfur containing substance and ascorbic acid improves activities of endothelial nitric oxide synthase (eNOs) promoting vasodilation, lowering blood pressure, improving capillary circulation, and anti arterio-sclerosis",
      "May inhibit stomach and esophagus cancer",
      "Oral administration of jiu cai extract significantly reduced lung metastases"
    ],
    "Dosage": "100 g to 200 g per meal. Seed used in decoction: 6~12 g; or make into powder or pills.",
    "Samples of Formulae": "jiu zi wan 韭子丸《聖濟總錄》",
    "Contraindications": "Not suitable for those who are yinxu (yin deficient). It contains coarse fiber which is not easy to digest, excess intake can irritate the intestines and cause diarrhea. According to Ben Cao Gang Mu, eating too much jiu cai can lead to blurry eyesight and confusion or even coma. It should be avoided especially after drinking alcohol. High oxalic acid content may cause calcium oxalate kidney stones, affecting those with metabolism issues such as diabetes. Calcium oxalate can damage the kidneys and cause coma.",
    "Research": "Study on Cell Agglutination and Sugar-inhibiting Action of the Lectin from jiu cai",
    "Notes": "",
    "Chemical Ingredients": {
      "": [
        "Four new steroidal saponins have been isolated from the seeds: 26-O-β-d-glucopyranosyl-(25S,20R)-20-O-methyl-5α-furost-22(23)-en-2α,3β,20,26-tetraol 3-O-α-l-rhamnopyranosyl-(1→2)-[α-l-rhamnopyranosyl-(1→4)]-β-d-glucopyranoside",
        "26-O-β-d-glucopyranosyl-(25S,20R)-5α-furost-22(23)-en-2α,3β,20,26-tetraol 3-O-α-l-rhamnopyranosyl-(1→2)-[α-l-rhamnopyranosyl-(1→4)]-β-d-glucopyranoside",
        "26-O-β-d-glucopyranosyl-(25S,20S)-5α-furost-22(23)-en-2α,3β,20,26-tetraol 3-O-α-l-rhamnopyranosyl-(1→2)-[α-l-rhamnopyranosyl-(1→4)]-β-d-glucopyranoside",
        "26-O-β-d-glucopyranosyl-(25S,20S)-5α-furost-22(23)-en-3β,20,26-triol 3-O-α-l-rhamnopyranosyl-(1→2)-[α-l-rhamnopyranosyl-(1→4)]-β-d-glucopyranoside",
        "Vitamin C, B1, B2, niacin, carotene, carbohydrates, minerals, high level of fiber"
      ]
    },
    "References": [
      "[4] http://cat.inist.fr/?aModele=afficheN&cpsidt=1882005",
      "[5] J Altern Complement Med. 2001 Oct;7(5):517-22.",
      "[1] http://pubs.acs.org/doi/abs/10.1021/jf001062b",
      "[7] Mentioned for cardiovascular effects"
    ],
    "Further Reading": [],
    "Original Text": "jiu cai, Complementary and Alternative Healing University\n\n\n\n\n\nComplementary and Alternative Healing \n    University \n \n\n\n\n\n\n中藥詞典    Chinese Herb Dictionary    \n     \n\n\nSearch this \n    site    \n    在本網站找資料\n\n\n\n\n\n \njiu cai 韭菜，jiu bai 韭白， xie bai 薤白by: Joe Hing kwok ChuPharmaceutical name:英文藥名﹕Herb AlliituberosiBotanical name:學名﹕Allium tuberosum RottlerPron. in Japanese:日語發音﹕nira (kanji: 韮; hiragana: にら; katakana: ニラ)， kyushi (seed)Pron. in Korean:韓語發音﹕buchu (부추), sol (솔), or jeongguji (정구지) , picha (seed)Pron. in Cantonese::粵音﹕gau2 coi3 (leaves). gau2 zi2 (seed)Other Names:別名﹕jiu 韭，shan jiu 山韭，feng ben 豐本，bian cai 扁 菜，cao zhong ru 草鐘乳，qi yang cao 起陽草，chang sheng jiu 長生韭，lan ren cai 懶 人菜。Common Name:其他外文名﹕English: Chinese leeksTagalog, Cebuan: kutsayNepalese: dundoku sagIndonesian: bawang kucaiDistribution:產地﹕whole China.全中國。Properties(characteristics)﹕性味﹕Seed: acrid, sweet, warm葉：甘 ，辛，鹹，溫。根：辛。韭子：辛，甘，溫。Channels (meridians) entered: 歸經﹕Seed: kidney, liver.Leaves: stomach, liver, kidney.Roots: liver.韭菜籽：腎，肝。葉：胃，肝，腎。根：肝。Medical functions:藥理﹕ The sulfur compound in jiu cai can help absorb vitamin A and B1.Effect on cardiovascular system: its sulfur containing substance and ascorbic acid can improve the activities of endotthelial nitric oxide synthase (eNOs) thus  promoting vasodilation and lowering blood pressure, improving capillary circulation, and anti arterio-sclerosis.[7]May inhibit stomach and asophagus cancer. [4]\n      jiu cai extract inhibited cancer cell growth and induced apoptosis in \n      vitro. Oral administration of jiu cai extract significantly reduced lung \n      metastases [5]韭菜中的硫化物能幫助人體吸收維 生素B1及維生素A有抗胃癌，食道癌之作用。[4]\n韭菜提取物抑制腫瘤細胞的生長和誘導的凋亡。中國韭菜提取物口服顯著降低肺癌的轉移[5]。Actions & Indications:主治﹕Jiu cai is used as stimulating tonic. It possesses the effects of improving digestion, enhancing mental alertness, warming. Roots and leaves and be juiced and can be used for anti inflammation, arresting bleeding and pain. It is suitable for gan shen yin xu (liver-kidney yin deficient) with sweating during sleep, bed wetting, frequent urination, impotence, priapism, spermatorrhea, esophagus cancer, nausea, dysentery, abdomen pain, menses sickness, pain during menses, bleeding not during menses, vagina discharge, injuries from impact, vomiting blood, nose bleeding.  Being use inyinxu (yin deficient), immature ejaculation and spermtorrhea.為振奮性強壯藥，有健胃，提神，溫暖作用。根，葉搗汁有消炎止血，止痛之功。適用於肝腎陰虚盜汗，遺尿，尿頻，陽痿，陽強不倒，遺精，夢遺，噎隔 (食管癌)，反胃，下痢，腹痛，婦女月經病，痛經，經漏，帶 下以及跌打損傷，吐血，鼻衄等症，用於補陰 虛，精關不固等。Chemical ingredients:化學成份﹕Four new steroidal saponins have been isolated from the seeds of Allium tuberosum: 26-O-β-d-glucopyranosyl-(25S,20R)-20-O-methyl-5α-furost-22(23)-en-2α,3β,20,26-tetraol 3-O-α-l-rhamnopyranosyl-(1→2)-[α-l-rhamnopyranosyl-(1→4)]-β-d-glucopyranoside (1); 26-O-β-d-glucopyranosyl-(25S,20R)-5α-furost-22(23)-en-2α,3β,20,26-tetraol 3-O-α-l-rhamnopyranosyl-(1→2)-[α-l- rhamnopyranosyl-(1→4)]-β-d-glucopyranoside (2); 26-O-β-d-glucopyranosyl-(25S,20S)-5α-furost-22(23)-en-2α,3β,20,26-tetraol 3-O-α-l-rhamnopyranosyl-(1→2)-[α-l- rhamnopyranosyl-(1→4)]-β-d-glucopyranoside (3); and 26-O-β-d-glucopyranosyl-(25S,20S)-5α-furost-22(23)-en-3β,20,26-triol 3-O-α-l-rhamnopyranosyl-(1→2)-[α-l-rhamnopyranosyl-(1→4)]-β-d-glucopyranoside (4).【1】The plant contains: vitamin C, B1, B2, niacin, carotene, carbohydrates, and mineral. It also contain high level of fiber.韭菜籽：四種新的甾體皂甙曾於韭菜籽分離出來。請看以上英文部分。韭菜含 ：維生素C，維生素B1，維生素B2，尼克酸，胡蘿卜素，碳水化合物及礦物質。韭菜還含有豐富的纖維素。Dosage:用量﹕100 g to 200 g per meal.Seed used in decoction: 6~12 g; or make into powder or pills.每餐100克至200克。韭子用量：6～12克，煎湯；或入丸散。 Samples of formulae:處方舉例﹕jiu zi wan 韭子丸《聖濟總錄》Modern Research:現代研究﹕  Study on Cell Agglutination and Sugar-inhibiting Action of the Lectin from jiu caiToxicity & Cautions:毒素與禁忌﹕It is not suitable for those who are yinxu (yin deficient). Because of its abundance of coarse fiber, it is not easy to be digested. Easting too much can irritate the the wall of the intestines and cause diarrhea.According to Ben Cao Gang Mu eating too much jiu cai can lead to blurry eyesight and confusion or even coma 【2】. It should be avoided especially after drinking alcohol.陰虛及 熱性病症的人不宜食用。韭菜的粗纖維多，不易消化吸收，，否則大量粗纖維可刺激腸壁而引起腹瀉。《本 草綱目》 ：�韭菜多食則神昏【3】目暗，酒後尤 忌�。凝集素 （lectins)【1】【1】http://pubs.acs.org/doi/abs/10.1021/jf001062b【2】Jiu cai (Chinese leek) is high in oxalic acid. People with metabolism problems such as diabetes may be prone to developing kidney stones of calcium oxalate. Calcium oxalate can damage the kidneys and cause coma.【3】神昏指昏迷，譫妄，昏蒙等神志異常的表現，是溫病常見的急危重證之一。本條是指腎臟機能衰竭而 致昏迷。韭菜含草酸很高。多吃（尤其有糖尿病者）能致草酸鈣之形成。草酸鈣的腎結石鋒利能損傷腎臟而致昏迷。[4] http://cat.inist.fr/?aModele=afficheN&cpsidt=1882005[5]\n    \n\n    J Altern Complement Med. 2001 Oct;7(5):517-22. \n\n\nSearch this \n    site \n\n\nProblems with website? Please \n\nClick \n    here for comment. (Not for inquiry )    \n    \n\n\nClick \n    here for inquiry \n\n\n\nCopyright Notice \n\n按此看關於版權問題\n\n\n\n\nSponsors' Ads by Google \n    以下為谷歌 所提供之廣告\n\n\n\nA manuscript... writing, translating and proofreading  in progress\n\n\n\n\n\n\n\n\nList \n        of Health Problems\n\n\n\n\nQigong \n        (chi kung)\n\n\n\n\nToxicity of Some Herbs\n\n\n\nSide Effect of Some Herbs\n\n\n\nHerbs that can be toxic to kidneys\n\n\n\n\n        Traditional Chinese Medicine\n \n\n\nTCM Diagnosis\n \n\n\n\n        Samples of Formulae\n\n\n\n\n        Terms of Traditional Chinese Medicine\n\n\n\n        Acupuncture\n\n\n\n\n\ncopy right\n \n\n\n版權所有\n\n\n\n\nQigong classes\n\n\n\n\n        Prescribed Drug Dictionary\n\n\n\n\n        Email our web master for  your suggestion (not for inquiry)\n\n\n\nBiochemistry Dictionary\n\n\n\n \n\n\n\nQigong \n        classes\n\n \n\n\n\nResearch Librarian\n\n \n\n\n\n \n\n\n\nHome\n\n\n\n\n        Weather Report\n\n\n\n\n        Disclaimer\n\n\nLast update: Aug 15, 2014;\n        3 p.m. LAH\n\n\n\n\n\n \n\n\n\n\n\n\n\n\n",
    "original_url": "http://alternativehealing.org/jiu_cai.htm"
  },
  {
    "Names": {
      "Name": ["luo bu ma 羅布麻"],
      "Pharmaceutical": ["Folium Apocyni veneti"],
      "Biological": ["Apocynum venetum L."],
      "Chinese": ["羅布麻"],
      "Common": ["dogbane leaves"],
      "Other name": [
        "hong ma 紅麻",
        "cha ye hua 茶葉花",
        "hong liu zi 紅柳子",
        "yang tu la jiao 羊肚拉角"
      ],
      "Pronunciation in Korean": [],
      "Pronunciation in Japanese": ["rafuma"],
      "Pronunciation in Cantonese": ["lo4 bou3 maa4"],
      "Pinyin Pronunciation": []
    },
    "Type": "Herb",
    "Geography": [
      "Mainly produced in Xinjiang",
      "Also found in Liaoning",
      "Jilin",
      "Inner Mongolia",
      "Gansu",
      "Shaanxi",
      "Shanxi",
      "Shandong",
      "Henan",
      "Hebei",
      "Jiangsu",
      "Northern Anhui"
    ],
    "Properties": ["Sweet", "Bitter", "Cool", "Slightly toxic"],
    "Meridians": ["Liver"],
    "Maladies Treated": [
      "Hypertension",
      "Hypertensive headache",
      "Dizziness",
      "Insomnia",
      "Irritability",
      "Liguria (lack of urine)",
      "Nephritic edema",
      "Cardiac edema",
      "Ascites of liver cirrhosis",
      "Increases renal blood flow",
      "Renal edema"
    ],
    "Medical Function": [
      "Cardiac stimulant",
      "Diuretic",
      "Hypotensive: inhibits angiotensin II-induced contraction via its superoxide scavenger scavenging properties and nitric oxide releasing effect",
      "Cooling",
      "Heart strengthening",
      "Promote urination",
      "Lowering blood pressure"
    ],
    "Dosage": "Take orally. For decoction 5 - 10 g. Or use as tea leaves.",
    "Samples of Formulae": "(1) For hepatitis and flatulence: luo bu ma 6g, gua di 4.5g, yan hu suo 6g, ding xiang 3g, mu xiang 9g. Make into powder, take 1.5g twice daily with boiled water. 《新疆中草藥手冊》 (2) For treatment of neurasthenia, vertigo, sequelae from concussion, palpitation, insomnia, hypertension, cirrhosis with edema: luo bu ma 3-9g, steep in boiling water as tea, do not boil. 《新疆中草藥手冊》",
    "Contraindications": "Long term usage may be toxic to kidneys.",
    "Research": "Vasodilation induced by luo bu ma extract is endothelium-dependent and mediated by endothelium-derived hyperpolarizing factor, which involves the activation of K(+)-channels. The higher concentrations of luo bu ma extract may enhance NO production/release to cause vasodilation.[1]",
    "Notes": "Classical medical text references: 《江蘇植藥志》: 'The sap of the plant can be used to heal wound.' 《中國藥植圖鑒》: 'The young leaves, after stir frying and rubbing can be used as tea leaf substitute. It is cooling and can be used to prevent dizziness, and is cardiac stimulant.' 《陝西中草藥》: 'The herb is cooling, heart strengthening to promote urination, lowering blood pressure, and for treatment of heart diseases, hypertension, neurasthenia, and nephritic edema.'",
    "Chemical Ingredients": {
      "Leaves": [
        "quercetin",
        "iso-quercitrin",
        "hyperoside",
        "rutin",
        "catechin",
        "anthraquinone",
        "glutamic acid",
        "alanine",
        "valine",
        "Kaempferol",
        "nona-cosane",
        "1-triacontanol",
        "hentriacontane",
        "lupenyl palmitate",
        "myricylpamitate",
        "hexadecyl palmitate",
        "meso-inositol",
        "β-sitosterol",
        "potassium chloride",
        "tannin",
        "polysaccharide",
        "lupeol",
        "isofraxidin",
        "scopoletin"
      ],
      "Roots": ["cymarin", "K-stro-phanthin-β", "strophanthidin"]
    },
    "References": [
      "[1] Yakugaku Zasshi. 2004 Nov;124 (11) :851-6.",
      "[2] J Ethnopharmacol. 2012 Sep 28;143(2):565-71. doi: 10.1016/j.jep.2012.07.012. Epub 2012 Jul 23."
    ],
    "Further Reading": [],
    "Original Text": "\n\n\nluo bu ma, Complementary and Alternative Healing University\n\n\n\n\n\n\n\n\nComplementary and Alternative Healing University \n    \nHome \n\n\n\n現代 中藥辭典\n\n\n\n\n\n\n\n\n\n\n\n\n\n\n\n\nSearch this \n        site\n\n\n\n\n\n\nList \n        of Health Problems\n\n\n\n\n\n\nChinese \n        Herb Dictionary\n\n\n\n\n\n\nQigong\n\n\n\n\n\n\n\n        Traditional Chinese Medicine TCM\n\n\n\n\n\n\n\n        Acupuncture\n\n\n\n\n\n\n\n        Prescribed Drug Dictionary\n\n\n\n\n\n\nBiochemistry \n        Dictionary\n\n\n\n\n\n\nLecture Slides\n\n\n\n\n\n\nResearch Librarian\n\n\n\n\n\n\nGeneral \n        Online Library\n\n\n\n\n\n\nSearch\n\n\n\n\n\n\nResearch Sites\n\n\n\n\n\n\n\n        Viagra\n\n\n\n\n\n\nMassage/Acupressure\n\n\n\n\n\n\nHypnotherapy\n\n\n\n\n\n\nTell us what you want\n\n\n\n\n\n\nNotify Changes \n        & New Information\n\n\n\n\n\n　\n\n　\n \nTo post your \n        discussion \n        click here.\n\n　\n \n \n \n \n \n \n \n \n \n \n \n \n \n \n \n \n \n \n \n \n \n\n　\n \n \n \n \n \n \n\n　\n\n　\n \n \n \n \n\n　\n\n　\n\n　\n\n　\n\n　\n \n \n \n \n \n \n \n \n \n \n \n \n \n \n \n \n \n \n \n \n \n \n \n \n \n \n \n \n \n \n \n \n \n \n \n \n \n \n \n \n \n \n \n \n \n \n \n\nLast update: Sept 8, 2013; 12:40 \n        a.m. LAH\n\n\n\n\n\nluo bu \n    ma 羅布麻  \n ( in English and Chinese 中英文)\nTranslated\n    \nby: \n    Joe Hing kwok Chu  \n  \n朱興國編 \n    譯  \n\n\n\n\nPharmaceutical \n        name:\n\n英文藥 \n        名﹕\n\n\nFolium Apocyni \n        veneti\n\n\n\n\n\nBotanical \n        name:\n拉丁生物學 \n        名﹕\n\n\nApocynum \n        venetum L.\n\n\n\n\nPron. in Japanese:\n日語發音﹕\n\n\nrafuma\n\n\n\n\nPron. in Korean:\n韓語發音﹕\n\n\n \n\n\n\n\n\n\n\n        Pron. in Cantonese::\n粵音﹕\n\n\nlo4 bou3 maa4\n\n\n\n\nOther Names:\n別名﹕\n\n\nhong ma 紅麻 \n        ，cha ye hua 茶葉花 ，hong liu zi 紅柳子，\nyang tu la \n        jiao 羊肚拉角。\n\n\n\n\nCommon Name:\n英文名﹕\n\n\ndogbane leaves\n\n\n\n\nDistribution:\n產地﹕\n\n\n主產於新疆。在遼寧， \n        吉林，內蒙古，甘肅，陝西，山西 ，\n山東，河南，河北，江 \n        蘇及安徽北 部等地也有分佈。\n\n\n\n\nProperties\ncharacteristics﹕\n性味﹕\n\n\nsweet, bitter, \n        cool, slightly toxic.\n甘，苦，涼 ，有小毒 \n        。\n\n\n\n\n\nChannels \n        meridians entered:\n \n\n歸經 \n        ﹕\n\n\nliver\n肝\n\n\n\n\n\n\n        Medical functions:\n \n\n\n        藥理﹕\n \n\n\n\n\n        The whole herb is;\n\n\n        cardiac stimulant,\n\n\n        diuretic\n\n\n        hypotensive: inhibits angiotensin II-induced contraction via \n\n\n\n        its superoxide scavenger \n\n\n        scavenging properties and nitric oxide releasing effect may \n\n\n\n        account for its\n\n\n        antihypertensive effect. [2]\n全株有強心，降壓， \n        利尿之作用。\n\n\n\n\n\nActions \n        & Indications:\n \n\n主治﹕\n\n\n\n\n        For treatment of hypertension, hypertensive headache, \n\n\n        dizziness, insomnia, irritability, \n        Liguria (lack of urine) and nephritic edema,\n        \n        cardiac edema and \n\n\n\n        ascites of liver cirrhosis..\n\n\n        It increases the renal blood flow and can be\n        \n        used in renal edema.\nThe sap of \n        the plant can be used to heal wound. \n(Jiangsu \n        Phyto-medicine \nJournal) \n        The young leaves, after stir frying and rubbing can be \nused  \n        as tea leaf substitute.\nIt is cooling \n        and can be used to prevent dizziness, and is cardiac \nstimulant. \n        (China Medical Plant Field Guide)\nThe herb \n        is cooling, heart strengthening to promote urination, \nlowering \n        blood pressure, and for treatment of heart diseases, \nhypertension, \n        neurasthenia, and nephritic\nedema. (Shaanxi \n        Chinese Herb)\n治高血壓，血壓高 \n        之頭疼，眩暈，失眠，心煩，尿少，腎炎浮腫 ，\n心臟衰弱，肝炎腹脹 \n        ，，心 臟衰弱之水腫。羅布麻能增加腎臟血流量，\n可以治腎臟衰弱之水 \n        腫。\n\n\n《江蘇植藥志》： \n          「乳汁可癒合傷口。」\n\n\n《中國藥植圖鑒》 \n          ：「嫩葉，蒸炒揉製後代茶，有清涼去火，\n\n\n防止頭暈和強心的 \n          功用。」\n\n\n《陝西中草藥》： \n          「清涼瀉火，強心利尿，降血壓。治心臟病，\n\n\n高血壓，神經衰弱 \n          ，腎炎浮腫。\n\n\n \n\n\n\n\n\nChemical \n        ingredients:\n \n\n化學成 \n        份﹕\n\n\n\n\n\nLeaves \n            contain:\n\n\n葉含：\n\n\n\n\n\nquercetin\n\n\n槲皮素\n\n\n\n\niso-quercitrin\n\n\n異槲皮甙\n\n\n\n\nhyperoside\n\n\n金絲桃甙\n\n\n\n\nrutin\n\n\n芸香甙\n\n\n\n\ncatechin\n\n\n右旋兒茶精\n\n\n\n\nanthraquinone\n\n\n恩醌\n\n\n\n\nglutamic \n            acid\n\n\n谷氨酸\n\n\n\n\nalanine\n\n\n丙氨酸\n\n\n\n\nvaline\n\n\n纈氨酸\n\n\n\n\n\n\nKaempferol\n\n\n\n山奈酚\n\n\n\n\nnona-cosane\n\n\n二十九烷\n\n\n\n\n1-triacontanol\n\n\n三十烷醇\n\n\n\n\nhentriacontane\n\n\n三十一烷\n\n\n\n\nlupenyl \n            palmitate\n\n\n羽扇豆醇棕櫚 \n            酸酯\n\n\n\n\nmyricylpamitate\n\n\n棕櫚酸蜂花醇 \n            酯\n\n\n\n\nhexadecyl \n            palmitate\n\n\n棕櫚酸十六醇 \n            酯\n\n\n\n\nmeso-inositol\n\n\n內消旋肌醇\n\n\n\n\nβ-sitosterol\n\n\nβ-谷甾醇\n\n\n\n\npotassium \n            chloride\n\n\n氯化鉀\n\n\n\n\ntannin\n\n\n鞣質\n\n\n\n\npolysaccharide\n\n\n多糖\n\n\n\n\nlupeol\n\n\n羽扇豆醇\n\n\n\n\nisofraxidin\n\n\n異秦皮定\n\n\n\n\nscopoletin\n\n\n東莨菪素\n\n\n\n\nRoots \n            contain:\n\n\n根含:\n\n\n\n\ncymarin\n\n\n加拿大麻甙\n\n\n\n\nK-stro-phanthin-β\n\n\nK-毒毛旋花 \n            子次甙-β\n\n\n\n\nstrophanthidin\n\n\n毒毛旋花子甙 \n            元\n\n\n\n\n\n\n\nDaly Dosage:\n每日用量﹕\n\n\nTake orally. \n        For decoction 5 - 10 g. Or use as tea leaves.\n內服：煎湯，5-10g； \n        或泡茶。\n\n\n\n\nSamples of formulae:\n \n處方舉例﹕\n\n\n \nA. For treatment \n        of hepatitis and flatulence: \nPrescription:\nluo bu ma \n        6 g, \ngua di 4.5 g,\n        yan hu suo 6 \n        g, \nding xiang 3 g, \n\n\n\n        mu xiang 9 g. Make into powder. Take 1.5 g \n        each time. Twice a day.\nTake with \n        boiled water. (source: Xinjiang Chinese Herb Medicine \nHandbook)\n \nB. For treatment \n        of neurasthenia, vertigo, sequelae from concussion, \npalpitation, \n        insomnia, hypertension, cirrhosis with edema: \nPrescription:\nluo bu ma \n        3 to 9 g. Pour in boiling water and use as tea.\nDo not boil \n        the herb. (Xinjiang Chinese Herb Medicine Handbook)\n \n(1) 治肝炎腹脹 \n        ：羅布麻二錢，甜瓜\n        蒂一錢五分，延胡索二錢，\n\n公丁\n        香一錢，木\n        香 三錢。\n共研末，一次五分 \n        ，一日二次，開水送服。(《新疆中草藥手冊》)\n \n(2) 治神經衰弱 \n        ，眩暈 ，腦震盪後遺症，心悸，失眠，高血壓，\n肝硬化腹水，浮腫：\n羅布麻一至三錢。 \n        開水沖泡當茶喝，不可煎煮。(《新疆中草藥手冊》)\n \n\n\n\n\n\nModern \n        Research:\n \n\n現代研 \n        究﹕\n\n\nVasodilation \n        induced by luo bu ma extract is endothelium-dependent\nand \n        mediated by endothelium-derived hyperpolarizing factor, which \ninvolves the activation \n        of K(+)-channels. The higher concentrations  \nof luo bu ma extract may \n        enhance NO production/release to cause\n vasodilation.[1]\n羅布麻擴張血管之 \n        作用是依靠血管內皮層細胞與受鉀通道影響的內\n皮層超極化因子。\n濃度越高的羅布麻 \n        的提取物可能增加一氧化氮而使血管擴張。[1]\n\n\n\n\n\nToxicity \n        & Cautions:\n\n毒素與 \n        禁忌﹕\n\n\nLong term \n        usage may be toxic to kidneys.\n長期 使用羅布麻可能 \n        對腎臟有毒。\n\n\n\n[1]\n    \n    Yakugaku Zasshi. 2004 Nov;124 (11) :851-6.\n[2] \n\n    J Ethnopharmacol. 2012 Sep 28;143(2):565-71. doi: 10.1016/j.jep.2012.07.012. \n    Epub 2012 Jul 23.\n\nSponsors' Ads by Google 以下為谷歌所提供贊助者之廣告\n\n\n \n \n\n\n\n\nA manuscript... writing, translating and proofreading  in progress\nProblems with website? Please\n    \nClick here \n    for comment. Not for inquiry     \n    \n\nClick \n    here for inquiry \n \n \n\nCopyright Notice \n    按此看關於 版權問題\n\n\n\n\n\nList \n        of Health Problems\n\n\n\n\nChinese \n        Herb Dictionary\n\n\n\n\nToxicity of Some \n        Herbs\n\n\n\nSide Effect of Some Herbs\n\n\nHerbs \n        that can be toxic to kidneys\n\n\n\n\n\n        Traditional Chinese Medicine\n\n\nTCM Diagnosis\n\nSamples \n        of Formulae\n\n\n\n\nTerms of Traditional Chinese Medicine\n\n\n\n        Acupuncture\n\n\n\n\n\n\ncopy right\n \n\n\n版權所有\n\n\n\n\nQigong \n        chi kung\n\n\n\n\n\n        Prescribed Drug Dictionary\n\n\n\n\nEmail \n        our web master for  your suggestion ,not for inquiry\n\n\n\n\nBiochemistry Dictionary\n\n\n\n\n\n\nGeneral Online Library\n\n\n\n\nQigong classes\n\n\n\n\nLecture Slides\n\n\n\n\nResearch Librarian\n\n\n\n\nSearch\n\n\n\n\n\n\nQigong classes\n\n\n\n\n\n\n\n\n\nHome\n\n\n\n\n\n        Weather Report\n\n\n\n Disclaimer\n\n\n\n\n\n\n\n\n\n\n\n\n\n\n",
    "original_url": "http://alternativehealing.org/luo_bu_ma.htm"
  },
  {
    "Names": {
      "Name": ["chi shi zhi"],
      "Pharmaceutical": ["Halloysitum Rubrum"],
      "Chemical": ["Al4(Si4O10)(OH)8·4H2O"],
      "Common": ["Kaolinite"],
      "Other name": [
        "chi fu",
        "hong gao ling",
        "chi shi tu",
        "chi you zhi",
        "hong tu"
      ],
      "Pronunciation in Korean": ["choksokchi"],
      "Pronunciation in Japanese": ["shakusekishi"],
      "Pronunciation in Cantonese": ["cek3 sek6 zi1"],
      "Chinese": ["赤石脂", "赤符", "紅高嶺", "赤石土", "吃油脂", "紅土"],
      "Pinyin Pronunciation": []
    },
    "Type": "Mineral",
    "Geography": [
      "Liaoning",
      "Inner Mongolia",
      "Hebei",
      "Shanxi",
      "Shaanxi",
      "Gansu",
      "Shandong",
      "Jiangsu",
      "Anhui",
      "Zhejiang",
      "Jiangxi",
      "Fujian",
      "Henan",
      "Hubei",
      "Hunan",
      "Guangdong",
      "Sichuan",
      "Xizang (Tibet) including Yangbajing"
    ],
    "Properties": ["Sweet", "Sour", "Astringent", "Warm"],
    "Meridians": ["Spleen", "Stomach", "Large Intestine"],
    "Maladies Treated": [
      "Chronic diarrhea",
      "Chronic dysentery",
      "Blood in stool",
      "Prolapse of rectum",
      "Spermatorrhea",
      "Heavy bleeding in the vagina not during menses",
      "Vaginal discharge",
      "Ulcer not healing",
      "Jaundice",
      "Scabies",
      "Nosebleeding",
      "Colitis with blood"
    ],
    "Medical Function": [
      "Taken internally, it can attach the toxic substances and abnormal substances from fermentation in the digestive tract.",
      "Local protective action on inflamed gastric and intestinal mucosa",
      "Hemostatic action on gastrointestinal tract bleeding",
      "Doses of 20, 40g/kg introduced into the stomach can shorten coagulation time in mice (using capillary method) and plasma recalcification time in rats",
      "Inhibition of ADP-induced platelet aggregation in rabbits and rats and intravascular ADP-induced platelet thrombus formation in mice"
    ],
    "Dosage": "Internal use: in decoction: 9 to 12 g; also can be put into pills or powder form. External use: grind into powder and apply to affected areas.",
    "Samples of Formulae": "Po Chai Pills (保濟丸)",
    "Contraindications": "Antagonistic with yuan hua (芫花), incompatible with da huang (大黃).",
    "Research": "",
    "Notes": "ADP (adenosine diphosphate) is one of the earliest discovered and most important substances that induce platelet aggregation in the body. In vitro experiments can observe two types of platelet aggregation induced by ADP.",
    "Chemical Ingredients": {
      "Mainly aluminum silicates": [
        "Silicon dioxide: 42.93%",
        "Aluminum oxide: 36.58%",
        "Iron oxide and manganese: 4.85%",
        "Magnesium and calcium: 0.94%",
        "Water: 14.75%"
      ]
    },
    "References": [],
    "Further Reading": [],
    "Original Text": "\n\n\nchi shi zhi, Complementary and Alternative Healing University\n\n\n\n\n\n\n\nComplementary and \n        Alternative Healing University\n        \n \n\n\n\n\n\n中藥詞典                 \n        Chinese Herb Dictionary     \n         Search \n        this site    \n        \n        在本網站找資料     Discussion \n        Form\n\n\n\n\n\n\n\n\n\n\n\n\n\n\nSearch \n            this site\n\n\n\n            List of Health Problems\n\n\n\n\n\n\n            Chinese Herb Dictionary\n\n\n\n\n\nQigong\n\n\n\n\n\n\n            Traditional Chinese Medicine (TCM)\n\n\n\n\n\n\n            Acupuncture\n\n\n\n\n\n\n            Prescribed Drug Dictionary\n\n\n\n\n\nBiochemistry Dictionary\n\n\n\n\n\nLecture Slides\n\n\n\n\n\nResearch Librarian\n\n\n\n\n\n\n            General Online Library\n\n\n\n\n\nResearch \n            Sites\n\n\n\n\n\n\n            Viagra\n\n\n\n\n\n\n            Massage/Acupressure\n\n\n\n\n\n\n            Hypnotherapy\n\n\n\n\n\nTell us what you \n            want\n\n\n\n\n\nNotify \n            Changes & New Information\n\n\n\n \n\n\n\n\n chi shi zhi 赤石脂\n \n\nby: Joe Hing kwok Chu\n\n\n\n\nPharmaceutical \n            name:\n英文藥名﹕\n\nHalloysitum Rubrum\n\n\n\nChemical  \n            name:\n化學名﹕\n\nAl4(Si4O10)(OH)8�4H2O\n\n\n\nPron. in Japanese:\n日語發音﹕\n\nshakusekishi\n\n\n\nPron. in Korean:\n韓語發音﹕\n\nchoksokchi\n\n\n\n\n\n            Pron. in Cantonese:\n粵音﹕\n\ncek3 sek6 zi1\n\n\n\nOther \n            Names:\n別名 \n            ﹕\n\n\n\n            chi fu 赤符， hong gao ling 紅高嶺，chi shi \n            tu  赤石土，  \n\n\n            chi you zhi 吃油脂，hong tu  紅土。\n\n\n\nCommon Name:\n英文名﹕\n\nKaolinite\n\n\n\nDistribution:\n產地﹕\n\nLiaoning, Inner \n            Mongolia, Hebei, Shanxi, Shaanxi, Gansu, Shandong, Jiangsu, Anhui, \n            Zhejiang, Jiangxi, Fujian, Henan, Hubei, Hunan, Guangdong, Sichuan, \n            Xizang provinces of China.\n            遼寧、內蒙古、河北、山西、陝西、甘肅、山東、江蘇、安徽、浙江、江西、福建、河南、湖北、湖南、廣東、四川等地，西藏羊八井也有分佈。\n\n\n\nProperties\n(characteristics)﹕\n性味﹕\n\nsweet, sour, \n            astringent, warm甘，酸，澀，温。\n\n\n\nChannels (meridians) \n            entered:\n \n歸經﹕\n\nspleen, stomach, \n            large intestine脾，胃，大腸。\n\n\nMedical \n            functions:藥理﹕\n \n\nTaken internally, it \n            can attach the toxic substances and abnormal  substances from \n            fermentation in the digestive tract.\n            Recalcification Time\n\n            內服能吸著消化道內有毒物質及食物異常發酵的產物等。對發炎的胃腸粘膜有局部保護作用，並對胃腸道出血有止血作用。赤石脂20、40g/kg灌胃，可縮短小鼠(毛細管法)凝血時間和大鼠血漿復鈣時間，對ADP誘導的兔、大鼠血小板聚集和小鼠體內ADP誘導的血小板血栓形成均有抑制作用。\n\n\n\n\nActions & Indications:\n\n主治﹕\n\nFor treatment of chronic diarrhea, chronic \n            dysentery, blood in \nstool, prolapse of retum, spermatorrhea, heavy \n            bleeding in the \nvagina not during menses, vagina discharge, \n            ulcer not healing, \njaundice, scabies, nose bleeding, colitis with \n            blood.\n\n\n            治久瀉，久痢，便血，脫肛，遺精，崩漏，帶下，潰瘍不斂，\n\n黃疸，疥癬，衄 血，腸風下血。\n\n\n\n\n\nChemical ingredients:\n\n化學成份﹕\n\nMainly aluminum silicates \n            . It contains a big portion of iron oxides.  \nIts constitution: silica\n            42.93%、aluminum  36.58%、iron \n            oxide\n            \n\n            manganese 4.85％、magnesium and \n            calcium 0.94%、water 14.75% 。\n\n\n            主要成分為水化硅酸鋁。尚含相當多的氧化鐵等物質。其組成如下：\n\n硅42.93%、 鋁 \n            36.58%、氧化鐵及錳4.85％、鎂及鈣0.94%、水分14.75% 。\n\n\n\n\nDosage:\n用量﹕\n\nInternal use： in \n            decoction: 9 to 12 g, also can be put into pills or powder \nform. External use: apply to affected areas.\n\n            內服：煎湯，9~12 克；或入丸、散。外用：研末撒\n\n\n\n\nSamples of formulae\n:處方舉例﹕\n\n\nPo Chai Pills\n\n保濟丸。\n\n\n\n\n\nModern Research:\n\n現代研究﹕\n\n \n\n\n\n\nToxicity & Cautions:\n\n毒素與禁忌﹕\n\nnot compatible with\n            yuan \n            hua，and\nda huang.\n惡芫\n            花，畏大\n            黃  。\n\n\n\n註：　二磷酸腺苷（adenosine \n        diphosphate；ADP）是人們發現最早、也是體內最重要的誘導血小板聚集的物質。在體外實驗中可觀察到ADP誘導的兩种血小板聚集類型。\n　\n\n   Search \n        this site \n\n\nProblems with website? Please \n\n\n        Click here for comment. (Not for inquiry )    \n        \n\n\n\n        Click here for inquiry\n\n\n\nCopyright Notice \n\n按此看關於版權問題\n\n\n\n\nA manuscript... writing, translating and proofreading  in progress\n\n\nSponsors' Ads by Google \n        以下為谷歌 所提供之廣告\n\n\n\n\n\n\n\n\n\n            List of Health Problems\n\n\n\n\n            Chinese Herb Dictionary\n\n\n\n\nToxicity of Some Herbs\n\n\n\nSide Effect of Some Herbs\n\n\n\nHerbs that can be toxic to \n            kidneys\n\n\n\n\n            Traditional Chinese Medicine\n \n\n\nTCM \n            Diagnosis\n \n\n\n            Samples of Formulae\n\n\n\n\n            Terms of Traditional Chinese Medicine\n\n\n\n            Acupuncture\n\n\n\n\n\ncopy \n            right\n \n\n\n版權所有\n\n\n\n\n            Qigong (chi \n            kung)\n\n\n\n\n            Prescribed Drug Dictionary\n\n\n\n\n            Email our web master for  your suggestion (not for inquiry)\n\n\n\nBiochemistry Dictionary\n\n\n\n\n\nGeneral Online Library\n\n\n\nQigong \n            classes\n\n\n\nFake \n            Email Warning\n\n\n\nResearch Librarian\n\n\n\nSearch\n\n\n\n\n\nQigong classes\n\n\n\nHome\n\n\n\n\n            Weather Report\n\n\n\n\nDisclaimer\n\n\nLast update: Mar 17, 2014; 11:40\n            p.m. LAH\n\n\n\n\n\n \n\n\n\n\n\n\n\n\n\n\n",
    "original_url": "http://alternativehealing.org/chi_shi_zhi.htm"
  }
]
