[
    {
        "Names": {
            "Name": [
                "huai niu xi",
                "懷牛膝"
            ],
            "Pharmaceutical": [
                "Radix Achyranthis Bidentatae"
            ],
            "Biological": [
                "Achyranthes bidentata Bl."
            ],
            "Common": [
                "achyranthes root"
            ],
            "Other": [
                "huai niu qi 淮牛膝",
                "huai qi 淮七"
            ],
            "Chinese": [
                "懷牛膝"
            ],
            "Pronunciation in Korean": [
                "usul"
            ],
            "Pronunciation in Japanese": [
                "goshitsu"
            ],
            "Pronunciation in Cantonese": [
                "ngau4 sat1"
            ],
            "Pinyin Pronunciation": []
        },
        "Type": "Herb",
        "Geography": [
            "Shaanxi",
            "Gansu",
            "Henan provinces",
            "ancient city of Huai Qing Fu (modern Jiaozuo City)",
            "500 to 1,300 meters altitude, wet moist areas next to ditches and streams or along the roads"
        ],
        "Properties": [
            "bitter",
            "sour",
            "neutral"
        ],
        "Meridians": [
            "liver",
            "kidney"
        ],
        "Maladies Treated": [
            "damp cold",
            "weakness and pain in loin and knees",
            "tight and spastic limbs",
            "irregular menses",
            "postpartum pain in abdomen due to blood stasis",
            "afterbirth not being expelled",
            "blood in urine",
            "physical injuries",
            "difficulty in bending knees",
            "Raw huai niu xi is effective for breaking blood stasis",
            "Cooked huai niu xi is effective for strengthening muscles and bones, promoting urination and strengthening essence of the body"
        ],
        "Medical Function": [
            "Anti-hypertensive effect: the ingredient alkaloid of niu xi possesses good antihypertensive effect. It is proven that combining with other antihypertensive medication can produce satisfactory and safe result.",
            "Anti-inflammatory and analgesic effect: the alcohol extract of niu xi promotes circulation and can arrest pain due to hematoma and possesses anti-inflammation and resolution effect.",
            "Improving immune system: the achyranthes bidentata polysaccharide can enhance the immune system.",
            "Stimulating uterus effect: the extract of niu xi can make the tense uterus muscles of guinea pigs relax thus can produce the strong contraction force.",
            "Anti-aging effect: the active ingredient ecdysterone can improve liver function, lower cholesterol, improve the activities of cells.",
            "Diuretic effect: giving anesthetized rabbits intravenous injection of niu xi decoction or alcohol extract has a mild diuretic effect.",
            "Anti spasm effect: it possesses a mild inhibiting effect on digestive tract."
        ],
        "Dosage": "9 to 15 g",
        "Samples of Formulae": "niu che shen qi wan 牛車腎氣丸",
        "Contraindications": "not to use during pregnancy, diarrhea due to pixu (spleen deficient), excessive menstruation or spermatorrhea due qixu (qi deficient). Not to use with bai qian.",
        "Research": "",
        "Notes": "",
        "Chemical Ingredients": {
            "Chemical Components": [
                "achyranthes bidentata polysaccharide",
                "ecdysterone (molding hormone of insects)",
                "inokosterone",
                "various insect adjustment hormones (昆虫變態激素)",
                "triterpenoid saponins",
                "mucilage",
                "potassium salts",
                "trace elements: nickel 5.4 ppm, iron 19.6 ppm, copper 6.3 ppm, manganese 33.5 ppm, chromium 1.5 ppm"
            ],
            "Specific Part": "roots and stems"
        },
        "References": [
            "Source: Zhong Hua Ben Cao 中華本草；Zhong Yao Da Ci Dian 中药大辞典"
        ],
        "Further Reading": [],
        "Original Text": "huai niu xi, Complementary and Alternative Healing UniversityComplementary and Alternative Healing University   中藥詞典    Chinese Herb Dictionary      Search this site     在本網站找資料 See more menu at the bottom of page  huai niu xi 懷牛膝  （in English and Chinese 中英文) by Joe Hing Kwok ChuClick here to see picture of herb.Pharmaceutical name:英文藥名﹕Radix Achyranthis BidentataeLatin name:學名﹕Achyranthes bidentata Bl.Pron. in Japanese:日語發音﹕goshitsuPron. in Korean:韓語發音﹕usulPron. in Cantonese:粵音﹕ngau4 sat1Other Names:別名﹕huai niu qi 淮牛膝，huai qi 淮七。Common Name:英文名﹕achyranthes rootDistribution:產地﹕Shaanxi, Gansu, Henan provinces, growing in mountainous areas of 500 to 1,300 meters altitude, in the  wet, moist areas next to ditches and streams or along the roads. It was mainly grown in the ancient city of Huai Qing Fu, where it get its name \"huai\" niu xi.陝西，甘肅，河南等省。生於海拔500-1300米山區的陰濕水溝邊，路旁和河 岸。 ，主產於河南，因產於古懷慶府(今焦作市)而得名。Properties characteristics)﹕性味﹕bitter, sour, neutral苦﹐酸﹐平。Channels  meridians) entered: 歸經﹕liver, kidney.肝﹐腎。Medical functions:藥理﹕ Anti-hypertensive effect: the ingredient alkaloid of niu xi possesses good antihypertensive effect. It is proven that combining with other antihypertensive medication can produce satisfactory and safe result.Anti-inflammatory and analgesic effect: the alcohol extract of niu xi promote circulation and can arrest pain due to hematoma and possesses anti-inflammation and resolution effect.Improving immune system: the achyranthes bidentata polysaccharide can enhance the immune system.Stimulating uterus effect: the extract of niu xi can make the tense uterus muscles of guinea pigs relax thus can produce  the strong contraction force.Anti-aging effect: the active ingredient ecdysterone can improve liver function, lower cholesterol, improve the activities of cells.diuretic effect:Anti spasm effect: it possesses a mild inhibiting effect on digestive tract.1，有降壓 作用。懷牛膝中所含生物鹼，具有良好的降壓作用，與其他藥物配合應用，治療高血壓病，心血管病，已取得安全，可靠的效果。 2，抗炎與鎮痛作用。牛膝酒制後，有明顯的活血止痛作用，對於淤血所致疼痛症狀有緩解作用。懷牛膝鎮痛效果最佳。牛膝提取液有強抗炎 消腫作用。其機理為提高機體免疫能力，擴張血管，改善循環，促進炎性病變吸收等。 3，增強免疫功能。傳統認為懷牛膝偏於補益肝腎，強壯筋骨，現代藥理研究表明，懷牛膝富含牛膝多糖，（半乳糖，葡萄糖，甘露糖）有明顯的增強體液 免疫功能作用。 4，興奮子宮作用。本品的流浸膏使豚鼠子宮的肌肉緊張多呈弛緩作用，使受孕子宮發生強有力的收縮。 5，懷牛膝有效成分及提取液均有一定的抗衰老作用。懷牛膝中所含的促脫皮甾酮能改善肝功能 ，降低血漿膽固醇，有增強細胞活性的作用。 6，有利尿作用。麻醉兔或大靜脈注射牛膝煎劑或醇提液有輕度利尿作用。 7，解痙作用。對動物胃 腸有輕度抑制作用。Actions & Indications:主治﹕damp cold, weakness and pain in loin and knees, tight and spastic limbs, irregular menses, postpartum pain in abdomen due to blood stasis, afterbirth not being expelled, blood in urine, physical injuries and difficulty in bending knees.Raw huai niu xi is effective for breaking blood stasis.Cooked huai niu xi is effective for strengthening muscles and bones, promoting urination and strengthening essence of the body.寒湿，腰膝骨疼，腰膝酸軟，四肢拘挛，經血不調，產後瘀血腹疼，胎衣不下，血淋，跌打損傷及屈膝 障碍 。生用可散惡 血，破癥結。 熟用可補肝腎，強筋骨，利尿強精。Chemical ingredients:化學成份﹕The roots and stems contain: achyranthes bidentata polysaccharide,  ecdysterone (molding hormone of insects), inokosterone, and various adjustment hormones of insect and triterpenoid saponins, mucilage, potassium salt, and trace elements of nickel 5.4, iron 19.6, copper 6.3, manganese, chronium 1.5 (ppm).根和莖包含：牛膝多醣，羥基促 脫皮甾酮（ecdysterone)，牛膝甾酮（inokosterone）等多種昆虫變態激素和三萜皂甙。此外尚含粘液質及鉀鹽。微量元素有鎳5.4， 鐵19.6，銅6.3，錳33.5，鉻1.5（ppm）。Dosage:用 量﹕9 to 15 g9~15 克。Samples of formulae:處方 舉例﹕niu che shen qi wan 牛車腎氣丸Modern Research:現代研究﹕ Toxicity & Cautions:毒素與禁忌﹕not to use during pregnancy, diarrhea due to pixu (spleen deficient) ,  excessive menstruation or spermatorrhea due qixu (qi deficient). Not to use with bai qian .懷孕﹐脾虛腹瀉﹐月經過多﹐ 氣虛遺精 忌用。 不可與白前同用。Source: Zhong Hua Ben Cao  中華本草:；: Zhong Yao Da Ci Dian 中药大辞典Search this siteProblems with website? Please Click here for comment. (Not for inquiry )    Click here for inquiryCopyright Notice 按此看關於版權問題Sponsors' Ads by Google 以下為谷歌 所提供之廣告A manuscript... writing, translating and proofreading  in progressMenu: List of Health ProblemsQigong (chi kung)Toxicity of Some HerbsSide Effect of Some HerbsHerbs that can be toxic to kidneysTraditional Chinese Medicine TCM Diagnosis Samples of FormulaeTerms of Traditional Chinese MedicineAcupunctureChinese Herb DictionaryQigong classesPrescribed Drug DictionaryEmail our web master for  your suggestion (not for inquiry)Biochemistry Dictionary Qigong classes Research Librarian copy right 版權所有HomeWeather ReportDisclaimerLast update: Nov 19, 2014; 11:30 p.m. LAH   ",
        "original_url": "http://alternativehealing.org/niu_xi.htm"
    },
    {
        "Names": {
            "Name": [
                "chan su",
                "蟾酥"
            ],
            "Pharmaceutical": [
                "Secreto Bufonis"
            ],
            "Biological": [
                "Bufo bufo gargarizans Cantor 中華大蟾蜍",
                "Bufo bufo melanostictua Schneider 黑眶蟾蜍"
            ],
            "Chemical": [],
            "Common": [
                "toad venom"
            ],
            "Other": [
                "cu qiu 促秋",
                "qiu shi 秋施",
                "qiu cu 菊促",
                "ku long 苦龍",
                "he pi 何皮",
                "lai ge ma 癩蛤蟆"
            ],
            "Chinese": [
                "蟾酥",
                "促秋",
                "秋施",
                "菊促",
                "苦龍",
                "何皮",
                "癩蛤蟆"
            ],
            "Pronunciation in Korean": [
                "somso"
            ],
            "Pronunciation in Japanese": [
                "senso"
            ],
            "Pronunciation in Cantonese": [],
            "Pinyin Pronunciation": []
        },
        "Type": "Animal",
        "Geography": [
            "Most areas in China",
            "Hebei",
            "Shandong",
            "Sichuan",
            "Hunan",
            "Jiangsu",
            "Zhejiang"
        ],
        "Properties": [
            "acrid",
            "warm",
            "toxic"
        ],
        "Meridians": [
            "Heart",
            "Kidney",
            "Stomach"
        ],
        "Maladies Treated": [
            "food poisoning resulting in stomach pain, bloating, continuous vomiting and diarrhea, even fainting; often combined with she xiang (musk), ding xiang (clove), cang zhu (atractylodes), such as in the formula chan su wan",
            "bunacles, scofula, swollen and painful throat, various types of toothache; combined with xiong huang (realgar), ku fan (calcined alum), zhu sha (cinnabar), made into mung bean-sized pills; taken with decoction of white parts of green onion as described in 'wai ke zheng zong' chan su wan",
            "scarlet fever (爛喉丹痧), throat wind (喉風), acute tonsillitis (乳蛾), swollen and painful throat (咽喉腫痛); commonly combined with niu huang (cattle gallstone), xiong huang (realgar), bing pian (borneol), such as in the formula liu shen wan",
            "various cancers (liver cancer, intestine cancer, leukemia, skin cancer), used orally or externally, achieving certain degrees of therapeutic effect according to some reports",
            "respiratory and circulatory exhaustion"
        ],
        "Medical Function": [
            "possesses rapid and long-lasting effect of raising blood pressure",
            "significantly stimulates respiratory functions"
        ],
        "Dosage": "Use appropriate amount externally, powdered and mixed with plaster to apply to affected area. Internally: 0.015 to 0.03g (highly toxic).",
        "Samples of Formulae": "liu shen wan (六神丸)",
        "Contraindications": "Not to be taken during pregnancy. When applying externally, avoid contact with the eyes. If poisoning occurs, decoction of gan cao (licorice) 30g, bai ji (Bletilla striata) 30g should be taken as antidote.",
        "Research": "",
        "Notes": "Chan su is a secretion obtained from the adrenal gland near the ear and skin glands of toads. The variety of chemical composition varies depending on original animal species, geographical origin, harvesting times, and processing methods.",
        "Chemical Ingredients": [
            "Steroid-type cardiac stimulant compounds (more than 10 types), mostly decomposition products resulting from drying processing, such as cinobufagin (approximately 5%), resibufogenin RBG (~3.4%), bufalin (~1.5%), telocinobufagin (~1.4%), marinobufagin and others. Other similar cardiac glycosides present include digitoxigenin, sarmentogenin. These compounds often form ester combinations with arginine or fatty acid derivatives like suberoylarginine, pimeloylarginine, succinoylarginine, suberic acid, sulfuric acid, etc., collectively termed bufotoxins, generally existing in the secretions of toads before processing.",
            "Indole type alkaloids including bufotenine, bufotenidine, dehydrobufotenine, bufothionine, serotonin.",
            "Sterols, epinephrine (adrenaline), various amino acids."
        ],
        "References": [],
        "Further Reading": [],
        "Original Text": "chan su, Complementary and Alternative Healing UniversityComplementary and Alternative Healing University  Home  現代 中藥辭典Search this site   Search this siteList of Health ProblemsChinese Herb DictionaryQigongTraditional Chinese Medicine (TCM)AcupuncturePrescribed Drug DictionaryBiochemistry DictionaryLecture SlidesResearch LibrarianGeneral Online LibrarySearchResearch SitesViagraMassage/AcupressureHypnotherapyTell us what you wantNotify Changes & New Information　　                                                  chan su 蟾酥by: Joe Hing Kwok Chu Pharmaceutical name:英文藥名﹕Secreto BufonisBotanical name:學名﹕Bufo bufo gargarizans Cantor中華大蟾蜍Bufo bufo melanostictua Schneider黑 眶蟾蜍 。Pron. in Japanese:日語發音﹕sensoPron. in Korean:韓語發音﹕somsoPron. in Cantonese:粵音﹕ Other Names:別名﹕chan su 蟾酥 、cu qiu 促秋、qiu shi 秋施、qiu cu 菊促、ku long 苦龍、he pi 何皮、lai ge ma 癩蛤蟆。Common Name:英文名﹕toad venomDistribution:產地﹕Most area in China. Mainly produced in Hebei, Shandong, Sichuan, Hunan, Jiangsu, Zhejiang provinces.全國大部分地區都有分布，主產於河北、山東、四川、湖南、江蘇、浙江等地。Properties(characteristics)﹕性味﹕acrid, warm, toxic.辛，溫。有毒。Channels (meridians) entered: 歸經﹕heart, kidney, stomach腎， 胃，心經。Medical functions:藥理﹕  Actions & Indications:主治﹕For food poisoning with stomach pain and bloating, vomiting with diarrhea, even fainting. Usually combine with she xiang, ding xiang, cang zhu, like formula called chan su wan.   For bunacles, scofula, painful and swollen throat and various kinds of toothache: combine with xiong huang, ku fan, zhu sha etc. Make into pills the sizes of mung beans. Take five pills each time with decoction of white portions of green onion. For scarlet fever usually combine with niu huang, xiong huang, bing pian, like liu shen wan. Being used in various types of cancer, like liver cancer, intestine cancer, leukemia, skin cancer etc. Taking orally or external application have been successful to certain degree, according to some reports. Being used in respiratory and in circulatory exhaustion. It possesses the effect of raising blood pressure for long time. It also possesses respiratory stimulating effect. 1. 用於痧脹腹痛，吐瀉，神昏。飲食不潔所致的痧脹腹痛、吐瀉不止、甚則昏厥 之証，常與麝香、丁香、蒼術等配伍，如蟾酥丸。  2. 用於惡瘡，瘰疬，咽喉腫痛及各種牙痛。與雄黃、 枯礬、朱砂等配伍，為丸綠豆大，每服五丸，蔥白湯下；如《外科正宗》蟾酥丸。治療爛喉丹痧(猩紅熱)、喉風、乳蛾及咽喉腫痛，常與牛黃、雄黃、冰片等 配伍，如六神九。  3. 治療各種癌腫，如用治肝癌、腸癌、白血病、皮膚癌等，內服或外用，均取得一定的療效。4. 用於呼吸、循環衰竭，有迅速而持久的升壓作用，並有顯著的興奮呼吸作用。Chemical ingredients:化學成份﹕1. steroid type of cardiac stimulant there are more than 10 types, mostly are the product of the drying process of chan su, like cinobufagin, about 5%, resibufogenin RBG,2. Indole type of alkaloidsbufotenine, bufotenidine, dehydrobufotenine, bufothionine, and serotonin etc.  Also contain sterole, epinephrine and different animo acid.1. 強心甾體化合物為結構類似強心甙而有毒性的蟾毒配基類化合物，已知有10餘種，大多是干燥加 工過程中的分解產物，如華蟾毒配基（又名華蟾毒精cinobufagin）約5%，脂蟾毒 配基（resibufogenin RBG）約3.4%，蟾毒靈約1.8%，羥基華蟾毒基 約1.6%，蟾毒配質 (bufotalin) 約1.5%，遠華蟾毒基 (telocinobufagin) 約1.4%及海 蟾蜍精 (marinobufagin) 等；另含洋地黃毒甙元、沙門甙元等。上述蟾毒配基常在C3與辛二酰精氨酸、庚二酰精氨酸、丁二酰精氨酸、辛二酸、硫酸等結合成酯類，統稱為蟾毒類 ，多存在於加工前 的蟾蜍分泌物中。蟾酥中蟾毒配基和蟾毒的種類及含量，可因原動物、產地、採制時間和方法不同而有差異。2. 吲哚類生物鹼 主要有蟾酥鹼 (bufotenine) 、蟾酥甲鹼 (bufotenidine) 、去氫蟾酥鹼 (dehydrobufotenine) 、蟾酥硫鹼 (bufothionine) 及5-羥色胺 等。 此外，含有甾醇類、腎上腺素及多種氨基酸。Dosage:用量﹕Use appropriate amount externally or mix with plaster and apply to affected areas. To take orally: 0.015 to 0.03g. (highly toxic).外用適量，研末調敷或入膏藥內貼患處。內服0.015～0.03g，入丸散。Samples of formulae:處方舉例﹕liu shen wan 六神丸Modern Research:現代研究﹕ Toxicity & Cautions:毒素與禁忌﹕Not to be taken during pregnancy. In externally application, avoid getting into the eyes. As antidote, make decoction with gan cao 30 g, bai ji 30 g and take orally.孕婦忌服。外用時注意不可入目。若 中毒時，可用甘 草30克 、白芨片30克煎服解之。  　蟾酥即蟾蜍耳上腺及皮膚腺 的分泌物。Sponsors' Ads by Google 以下為谷歌所提供贊助者之廣告  A manuscript... writing, translating and proofreading              in progressClick here for comment. (Not for inquiry )        Click here for inquiry   Copyright Notice 按此看關於版權問題List of Health ProblemsChinese Herb DictionaryToxicity of Some HerbsSide Effect of Some HerbsHerbs that can be toxic to kidneysTraditional Chinese MedicineTCM DiagnosisSamples of FormulaeAcupuncturecopy right 版權所有Qigong (chi kung)Prescribed Drug DictionaryEmail our web master for  your suggestion (not for inquiry)Biochemistry DictionaryGeneral Online LibraryQigong classesFake Email WarningResearch LibrarianSearchQigong classesHomeWeather Report    Disclaimer  Last update: Mar 8, 2009; 12:26 p.m. LAH  \n",
        "original_url": "http://alternativehealing.org/chan_su.htm"
    },
    {
        "Names": {
            "Name": [
                "mai ya",
                "jiao mai ya"
            ],
            "Pharmaceutical": [
                "Fructus Hordei Germinatus"
            ],
            "Biological": [
                "Hordeum sativum Jess. var. vulgar, Hack."
            ],
            "Common": [
                "barley grass",
                "hordeum vulgare grass",
                "pearl barley grass",
                "scotch barley grass"
            ],
            "Other": [
                "mai ya 麥芽",
                "da mai ya 大麥芽",
                "sheng mai ya 生麥芽",
                "chao mai ya 炒麥芽",
                "jiao mai ya 焦麥芽",
                "大麥糵",
                "麥糵",
                "大麥毛",
                "大麥芽"
            ],
            "Chinese": [
                "麥芽",
                "大麥芽",
                "生麥芽",
                "炒麥芽",
                "焦麥芽",
                "大麥糵",
                "麥糵",
                "大麥毛"
            ],
            "Pronunciation in Korean": [
                "maek'ga"
            ],
            "Pronunciation in Japanese": [
                "bakuga"
            ],
            "Pronunciation in Cantonese": [
                "mak6 ngaa4"
            ],
            "Pinyin Pronunciation": []
        },
        "Type": "Herb",
        "Geography": [
            "throughout China"
        ],
        "Properties": [
            "sweet",
            "neutral"
        ],
        "Meridians": [
            "spleen",
            "stomach"
        ],
        "Maladies Treated": [
            "ulcerated colitis",
            "peptic ulcer",
            "hypertension",
            "diabetes",
            "indigestion",
            "flatulence",
            "lack of appetite",
            "vomiting",
            "diarrhea"
        ],
        "Medical Function": [
            "reduce the risk of coronary heart disease",
            "lower blood sugar",
            "lower blood pressure",
            "beneficial for ulcerated colitis",
            "contains hordenine that may stimulate the sympathetic nervous system",
            "contains digestive enzymes that help digestion"
        ],
        "Dosage": "6 to 15 g",
        "Samples of Formulae": "For indigestion: jiao san xian. For digestion, the herb should be lightly stir fried and seep in hot water. Overheating can destroy the amylase for digesting carbohydrates. Jiao mai ya: slightly stir fry germinated barley seeds with small fire in a frying pan till yellowish brown. Take out and spray with clean water and dry under the sun. It is called jiao mai ya. Its function is to promote digestion.",
        "Contraindications": "To avoid increasing the drug effect, not to take with ma huang (ephedra), caffeine, blood sugar-lowering drugs, blood pressure-lowering drugs, and cardiac function-enhancing drugs.",
        "Research": "Per FDA, barley-containing foods must provide at least 0.75 gram of soluble fiber per serving to qualify for the health claim of reducing coronary heart disease risk.[1][2]",
        "Notes": "",
        "Chemical Ingredients": [
            "α-amylase",
            "β-amylase",
            "invertase",
            "limitdextrinase",
            "pullulanase",
            "cellulase",
            "b-glucanase",
            "phenolase",
            "acid phosphatase",
            "peptidase",
            "endorprotinase",
            "protinase",
            "phosphodiesterase",
            "lipase",
            "protease",
            "oxidase",
            "catalyticase",
            "cellobiase",
            "gentiobiase",
            "lichenase",
            "peroxidisomerase",
            "hordenine 0.13%~0.25%",
            "hordatine A",
            "hordatine B",
            "adenine (vitamin B4)",
            "choline 0.02%~0.1%",
            "betaine hydrochloride 0.06%",
            "lecithin",
            "amino acid",
            "vitamin B, D, E",
            "cane sugar",
            "cytochrome C",
            "tocoquinone (α-tocopheryl quinone, α-tocotrienol)",
            "saponarin",
            "lurlnarin",
            "leucoanthocyanins",
            "candicine (toxin of fructus Hordei Germinatus)"
        ],
        "References": [
            "[1] http://www.nlm.nih.gov/medlineplus/druginfo/natural/patient-barley.html",
            "[2] Per FDA, to qualify for the health claim, the barley-containing foods must provide at least 0.75 gram of soluble fiber per serving of the food. See [1]"
        ],
        "Further Reading": [],
        "Original Text": "mai ya,Complementary and Alternative Healing University\nComplementary and Alternative Healing University \n  中藥詞典                 Chinese Herb Dictionary      Search this site     在本網站找資料Search this siteList of Health ProblemsChinese Herb DictionaryQigongTraditional Chinese Medicine (TCM)AcupuncturePrescribed Drug DictionaryBiochemistry DictionaryLecture SlidesResearch LibrarianGeneral Online LibraryResearch SitesViagraMassage/AcupressureHypnotherapyTell us what you wantNotify Changes & New Information  mai ya 麥芽     jiao mai ya 大麥發芽而成  (in English and Chinese 中英文)by: Joe Hing kwok ChuClick here to see picture.Pharmaceutical name:英文藥名﹕Fructus Hordei GerminatusBotanical name:學名﹕Hordeum sativum Jess. var. vulgar, Hack.Pron. in Japanese:日語發音 ﹕bakugaPron. in Korean:韓語發音 ﹕maek'gaPron. in Cantonese:粵音﹕mak6 ngaa4Other Names:別名﹕prescription name in pinyin: mai ya 麥芽，da mai ya 大麥 芽，sheng mai ya 生麥芽，chao mai ya 炒麥芽，jiao mai ya 焦麥芽。大麥糵《藥性論》，麥糵《日華子本草》，大麥毛《滇南本草》 ，大麥芽《本草匯言》處方名：麥芽，大麥芽，生麥芽，炒麥芽，焦麥芽等。Common Name:英文名﹕barley grass, hordeum vulgare grass, pearl barley grass, scotch barley grassDistribution:產地﹕throughout China全中國。Properties(characteristics)﹕性味﹕sweet, neutral甘，平。Channels (meridians) entered: 歸經﹕spleen, stomach.脾，胃。Medical functions:藥理﹕ reduce the risk of coronary heart disease [2] lower blood sugar lower blood pressure beneficial for ulcerated colitis hordenine, a chemical in the root of developing barley, may stimulate the sympathetic nervous system.[1] digestive enzyme that help digestion 減低冠心病 降血糖 降血壓 對潰瘍性腸炎有效 麥芽素有增進自主神經作用 消化酶 有助消化作用Actions & Indications:主治﹕ulcerated colitis [1], peptic ulcer, hypertension, diabetes, indigestion, flatulence, lack of appetite, vomiting and diarrhea.用於治療 胃潰瘍，潰瘍性腸炎，高 血壓，糖尿病，食積不消，脘腹脹滿，食欲 不振，嘔吐瀉泄Chemical ingredients:化學成份﹕contain enzymes：含酶類:α-amylaseα- 澱粉酶b-amylaseb- 澱 粉酶invertase轉化糖酶limitdextrinase極限糊精 酶pullulanase普魯藍酶cellulase纖維素酶b- glucanaseβ-葡聚醣酶phenolase酚酶acid phosphatase酸性磷酸 脢peptidase蛋白酶endorprotinase內蛋白激酶protinase蛋白激酶phosphodiesterase磷酸二酯 酶lipase脂酶protease朊酶oxidase氧化酶catalyticase催化酶cellobiase纖維二糖酶gentiobiase龍膽二糖酶lichenase地衣聚糖酶peroxidisomerase過氧化異構酶also contain:另含:hordenine0.13%～0.25%大麥芽鹼 0.13%～0.25%hordatine A大麥鹼Ahordatine B大麥鹼Badenine (vitamin B4)腺嘌呤 (维生素B4)Choline 0.02%～0.1%膽鹼 0.02%～0.1%Betaine Hydrochloride 0.06%甜菜鹼 (三甲基甘氨酸）0.06%lecithin卵磷脂animo acid氨基酸vitamin B，D，E維生素 B，D，Ecane sugar蔗糖cytochrlme C細胞色素Calso contain tocoquinone：還含有生育醌:α-tocopheryl quinoneα-托科醌α-tocotrienolα-生育三烯酚saponarin肥皂草甙lurlnarin大麥黃甙leucoanthocyanins白 花色甙also contain toxin of fructus Hordei Germinatus：尚含麥毒：candicine白栝楼碱Dosage:用 量﹕6 to 15 g6~15 克。Samples of formulae:處方 舉例﹕For indigestion: jiao san xian. For digestion, the herb should be lightly stir fried and seep in hot water. Overheating can destroy the amylase for digesting carbohydrates.消化不良：焦 三仙。麥芽不應加熱過度。以免破壞其澱粉酶。應微炒冲服。Modern Research:現代研究﹕ Toxicity & Cautions:毒素與禁忌﹕To avoid  increasing the drug effect,  not to take with ma huang, caffeine, blood sugar lowering drug, blood pressure lowering drug, cardiac function enhancing drug,避免與以下各藥同用，以免過度增加藥力：麻 黄，降血糖藥，降血壓藥，咖啡因，強心劑。　[1]http://www.nlm.nih.gov/medlineplus/druginfo/natural/patient-barley.html[2] Per FDA, to qualify for the health claim, the barley-containing foods must provide at least 0.75 gram of soluble fiber per serving of the food. See [1] Jiao mai ya: slightly stir fry germinated barley seeds with small fire in a frying pan till yellowish brown. Take out and spray with clean water and dry under the sun. It is called jiao mai ya. Its function is to promote digestion. 焦麥芽經大麥發芽而成，將麥芽置鍋內微火炒至黃色，噴洒清水 ，取出晒亁，即為焦麥 芽。焦麥芽具有健脾和胃，舒肝化滯之功用 。 Search this siteProblems with website? Please Click here for comment. (Not for inquiry )    Click here for inquiryCopyright Notice 按此看關於版權問題A manuscript... writing, translating and proofreading  in progressSponsors' Ads by Google 以下為谷歌 所提供之廣告 List of Health ProblemsChinese Herb DictionaryToxicity of Some HerbsSide Effect of Some HerbsHerbs that can be toxic to kidneysTraditional Chinese Medicine TCM Diagnosis Samples of FormulaeTerms of Traditional Chinese MedicineAcupuncturecopy right 版權所有Qigong (chi kung)Prescribed Drug DictionaryEmail our web master for  your suggestion (not for inquiry)Biochemistry DictionaryGeneral Online LibraryQigong classesFake Email WarningResearch LibrarianSearchQigong classesHomeWeather ReportDisclaimerLast update: Mar 26, 2014; 850 a.m. LAH   \n",
        "original_url": "http://alternativehealing.org/mai_ya.htm"
    },
    {
        "Names": {
            "Name": [
                "gua lou zi",
                "gua lou ren",
                "瓜蔞子",
                "瓜蔞仁",
                "栝蔞仁"
            ],
            "Pharmaceutical": [
                "Semen Trichosanthis"
            ],
            "Biological": [
                "Trichosanthes kirilowii, Maxim",
                "Trichosanthes japonica, Regel."
            ],
            "Chemical": [],
            "Common": [
                "trichosanthes seed",
                "Chinese cucumber seed"
            ],
            "Other name": [
                "gua lou ren 瓜蔞仁",
                "gua lou ren 栝蔞仁"
            ],
            "Chinese": [
                "瓜蔞子",
                "瓜蔞仁",
                "栝蔞仁"
            ],
            "Pronunciation in Korean": [
                "kwalwiin"
            ],
            "Pronunciation in Japanese": [
                "karonin"
            ],
            "Pronunciation in Cantonese": [
                "kwaa1 lau5 jan4"
            ],
            "Pinyin Pronunciation": []
        },
        "Type": "Herb",
        "Geography": [
            "throughout China",
            "especially in Shandong",
            "Hebei",
            "Shanxi",
            "Shaanxi"
        ],
        "Properties": [
            "faint smell",
            "bland"
        ],
        "Meridians": [
            "lung",
            "stomach",
            "large intestine"
        ],
        "Maladies Treated": [
            "hot cough with sticky phlegm",
            "hot and dry bowel with constipation",
            "carbuncles"
        ],
        "Medical Function": [
            "promotes lactation",
            "treats hot cough with sticky phlegm",
            "treats hot and dry bowel with constipation",
            "treats carbuncles"
        ],
        "Dosage": "9～15 g daily",
        "Samples of Formulae": "",
        "Contraindications": "It is not suitable to use together with wu tou. Not to be taken by those who are pixu (spleen deficient) and/or with diarrhea.",
        "Research": "",
        "Notes": "",
        "Chemical Ingredients": {},
        "References": [],
        "Further Reading": [],
        "Original Text": "gua lou zi, Complementary and Alternative Healing University     現代中藥辭典Complementary and Alternative Healing University  Home  中藥詞典Search this siteList of Health ProblemsChinese Herb DictionaryQigongTraditional Chinese Medicine (TCM)AcupuncturePrescribed Drug DictionaryBiochemistry DictionaryLecture SlidesResearch LibrarianGeneral Online LibraryResearch SitesViagraMassage/AcupressureHypnotherapyTell us what you wantNotify Changes & New Information  gua lou zi  瓜蔞子 (chk code) （in English and Chinese 中英文)By: Joe Hing Kwok Chu Pharmaceutical name:英文藥名﹕Semen TrichosanthisBotanical name:拉丁生物學名﹕Trichosanthes kirilowii, Maxim, or Trichosanthes japonica, Regel.Pron. in Japanese:日語發音﹕karoninPron. in Korean:韓語發音﹕kwalwiinPron. in Cantonese:粵音﹕kwaa1 lau5 jan4Other Names:別名﹕gua lou ren 瓜蔞仁,gua lou ren 栝蔞仁，Common Name:\n英文名﹕trichosanthes seed, \nChinese cucumber seed.Distribution:產地﹕throughout China, especially in Shandong, Hebei, Shanxi, Shaanxi全中國，尤其是山東， 河北，山西，陕西。 Properties(characteristics)﹕性味﹕faint smell, bland.氣微，味淡。Channels (meridians) entered: 歸經﹕lung, stomach, large instestine肺，胃，大腸。Medical functions:藥理﹕ See tian hua fen page 看天花粉頁 Actions & Indications:主治﹕Being used in hot cough with sticky phlegm; hot and dry bowel with constipation. Also, being used in promoting mother's milk and for treating carbuncles.用於燥咳痰粘，腸燥便秘。下乳，治癰腫。Chemical ingredients:化學成份﹕ Daly Dosage:每日用量﹕9～15 gSamples of formulae:處方舉例﹕ Modern Research:現代研究﹕ Toxicity & Cautions:毒素與禁忌﹕It is not suitable to use together with wu tou. Not to be taken by those who are pixu (spleen deficient) and/or with diarrhea.不宜同烏頭類藥物同用。脾虛腹瀉者不可服用。Search this site Sponsors' Ads by Google 以下為谷歌 所提供之廣告 A manuscript... writing, translating and proofreading  in progress Problems with website? Please Click here for comment. (Not for inquiry )     Click here for inquiry  Copyright Notice 按此看關於 版權問題List of Health ProblemsChinese Herb DictionaryToxicity of Some HerbsSide Effect of Some HerbsHerbs that can be toxic to kidneysTraditional Chinese MedicineTCM DiagnosisSamples of FormulaeTerms of Traditional Chinese MedicineAcupuncturecopy right 版權所有Qigong (chi kung)Prescribed Drug DictionaryEmail our web master for  your suggestion (not for inquiry)Biochemistry DictionaryGeneral Online LibraryQigong classesFake Email WarningResearch LibrarianSearchQigong classesHomeWeather Report DisclaimerLast update: Aug \n17, 2013; 9:31 p.m. LAH  \n",
        "original_url": "http://alternativehealing.org/gua_lou_zi.htm"
    },
    {
        "Names": {
            "Name": [
                "huang qin"
            ],
            "Pharmaceutical": [
                "Radix Scutellariae Baicalensis"
            ],
            "Biological": [
                "Scutellaria baicalensis Georgi.",
                "Scutellaria amoena C.H. Wright (滇黃芩, in Southern part of China)",
                "Scutellaria viscidula Gge. (粘毛黃芩, in northeastern China)",
                "Scutellaria rehderiana Diels (甘肅黃芩)",
                "Scutellaria likiangensis Diels (麗江黃芩)",
                "Scutellaria hypericifolia Levl (川黃芩)"
            ],
            "Chemical": [],
            "Common": [
                "baiscal skullcap root",
                "scutellaria",
                "scute"
            ],
            "Other name": [
                "shan cha gen 山茶根",
                "huang qin cha 黃芩茶",
                "tu jin cha gen 土金茶根",
                "tiao qin 條芩",
                "ku qin 枯芩"
            ],
            "Chinese": [
                "黃芩",
                "滇黃芩",
                "粘毛黃芩",
                "甘肅黃芩",
                "麗江黃芩",
                "川黃芩"
            ],
            "Pronunciation in Korean": [
                "kwanggum"
            ],
            "Pronunciation in Japanese": [
                "egon"
            ],
            "Pronunciation in Cantonese": [
                "wong4 kam4"
            ],
            "Pinyin Pronunciation": []
        },
        "Type": "Herb",
        "Geography": [
            "Hebei",
            "Henan",
            "Shanxi",
            "Shandong",
            "Inner Mongolia",
            "Liaoning",
            "Jilin",
            "Southern China",
            "Northeastern China",
            "Gansu",
            "Lijiang"
        ],
        "Properties": [
            "bitter",
            "cold"
        ],
        "Meridians": [
            "gallbladder",
            "large intestine",
            "lung",
            "stomach"
        ],
        "Maladies Treated": [
            "jaundice",
            "hypertension",
            "anxiety",
            "headache due to cold or flu",
            "prostate cancer",
            "breast cancer",
            "red eyes and sore throat",
            "cough and asthma due to heat syndromes",
            "restlessness and agitation",
            "vomiting of blood, nosebleeds, excessive menstrual bleeding and spotting (崩漏)",
            "general cancers",
            "Breast Abscess (乳癰)",
            "blood heat condition (血熱)",
            "damp heat headache (濕熱頭痛)",
            "yellow skin (黃疸)"
        ],
        "Medical Function": [
            "Clears damp-heat and dries fire",
            "Stops bleeding",
            "Calms fetus",
            "Lowers liver fire",
            "promotes secretion of bile (alcohol extract or baicalin, animal experiment)",
            "promotes movements of extra body intestines of rabbits (Baicalein, animal experiment)",
            "mild diarrhea effect",
            "antihistamine effect: alkaloids inhibit edema of rats caused by carrageenin (animal experiment)",
            "anti-allergenic effects: inhibits acute asthma attack and allergenic eczema",
            "Baicalein has anti-toxin, inhibits permeability of capillaries, anti-acetylcholine and anti-anaphylaxis effects",
            "broad spectrum antibiotic effect",
            "prevents atherosclerosis: water extract orally administered to rabbits prevents experimentally-induced atherosclerosis (animal experiment)",
            "blood thinning effect: Oroxylin A can promote enzyme producing nitrogen oxide, potential therapy for stroke and myocardial infarction",
            "anti-hepatitis B virus [1]",
            "prevents and intervenes formation of liver cirrhosis (huang qin decoction) [2]"
        ],
        "Dosage": "6 to 15 g",
        "Samples of Formulae": "long dan xie gan tang (龍膽瀉肝湯), xiao xu ming tang (小續命湯), xiao chai hu tang (小柴胡湯), e jiao huang qin tang (阿膠黃芩湯)",
        "Contraindications": "not to use in case of pixu (spleen deficient) with weak digestion. Avoid using huang qin while on blood thinning medication.",
        "Research": "",
        "Notes": "Carrageenin: any of a group of closely related colloids derived from Irish moss and several other red algae, widely used as a thickening, stabilizing, emulsifying, or suspending agent in industrial, pharmaceutical, and food products (source: American Heritage Dictionary)",
        "Chemical Ingredients": {
            "Scutellaria baicalensis Georgi. root": [
                "baicalein",
                "neobaicalein (skullcapflavoneⅡ)",
                "baicalin",
                "wogonin",
                "wogonoside",
                "oroxylin A",
                "7-methoxbaicalein",
                "skullcapflavone",
                "dihydrooroxylin A",
                "chrysin",
                "2,5,8-trihydroxy-7-methoxy-flavone",
                "2,5,8-trihydroxy-6,7-dimethoxyflavone",
                "4,5,7-trihydroxy-6-methoxyflavanone",
                "2,3,5,6,7-pentahydroxyflavanone",
                "wogonin-5-β-D-glucoside",
                "β-sitosterol",
                "campesterol",
                "stigmasterol",
                "proline",
                "glucose",
                "sucrose"
            ],
            "Roots of Scutellaria amoena (滇黃芩) contain": [
                "Jing baicalein",
                "baicalein",
                "baicalin",
                "wogonoside",
                "skullcapflavoneⅡ",
                "oroxylin A",
                "scuteamoenoside",
                "(2S)-5,7,8-trihydroxyflavanone",
                "scuteamoenin",
                "(2R,3R)-3,5,7-trihydroxyflavanone",
                "2,3,5,6,7-pentahydroxyflavone",
                "chrysin",
                "β-sitosterol"
            ],
            "Roots of Scutellaria viscidula": [
                "baicalin",
                "wogonoside",
                "baicalein",
                "wogonin",
                "oroxylin A",
                "neobaicalein (skullcapflavoneⅡ)",
                "panicolin",
                "Viscidula scutellarein I, II, III"
            ],
            "Roots of Scutellaria likiangensis Diels": [
                "baicalein",
                "wogonin",
                "chrysin",
                "oroxylin A",
                "tenaxin II",
                "粘千周黃芩素Ⅰ"
            ],
            "Roots of Scutellaria rehderiana": [
                "rehderianin I",
                "Viscidula scutellarein III",
                "baicalin",
                "wogonin",
                "baicalein",
                "oroxylin A",
                "ganhuangenin"
            ],
            "Roots of Scutellaria hypericifolia": [
                "baicalin",
                "wogonoside",
                "baicalein",
                "Viscidula scutellarein I, II",
                "oroxylin A",
                "wogonin"
            ]
        },
        "References": [
            "[1] J Viral Hepat. 2013;20(7):445-452.",
            "[2] Hebei Journal of Traditional Chinese Medicine Issue 01, year 2013"
        ],
        "Further Reading": [],
        "Original Text": "huang qin, Complementary and Alternative Healing University  現代醫藥詞典Complementary and Alternative Healing University \n  中藥詞典                 Chinese Herb Dictionary      Search this site     在本網站找資料Search this siteList of Health ProblemsChinese Herb DictionaryQigongTraditional Chinese Medicine (TCM)AcupuncturePrescribed Drug DictionaryBiochemistry DictionaryLecture SlidesResearch LibrarianGeneral Online LibraryResearch SitesViagraMassage/AcupressureHypnotherapyTell us what you wantNotify Changes & New Information   huang qin 黃芩 (in English and Chinese）by: Joe Hing Kwok Chu Pharmaceutical name:英文藥 名 ：Radix Scutellariae BaicalensisBiological name:拉丁名 ：Scutellaria baicalensis Georgi.Scutellaria amoena C.H. Wright (in Southern part of China)(滇黃芩)Scutellaria viscidula Gge. ( in northeastern China) \n（粘毛黃芩）\nScutellaria rehderiana Diels  (甘肅黃芩)\nScutellaria likiangensis Diels (麗江黃芩)\nScutellaria hypericifolia Levl (川黃芩)Pron. in Japanese:日語發 音 ：egonPron. in Korean:韓語發 音 ：kwanggumPron. in Cantonese:粵語發 音 ：wong4 kam4Common Name:英文名 ：baiscal skullcap root, scutellaria, scute Other Name:別名：\nshan cha gen 山茶根，huang qin cha 黃芩茶，tu jin cha gen 土金茶根，\ntiao qin 條芩，ku qin 枯芩Distribution:Hebei, Henan, Shanxi, Shandong, Inner Mongolia, Liaoning, JilinProperties (characteristics)﹕性味﹕bitter,  cold苦﹐寒Channels (meridians) entered:歸經﹕gallbladder, large intestine, lung, stomach膽﹐大腸﹐肺 ﹐胃Actions & Indications:主治：\nclears damp-heat and dries fire, stops bleeding, calms fetus, l\nower liver fire , for jaundice,  hypertension , anxiety, headache  \ndue to cold or flu, prostate Cancer, \nbreast cancer,  red eyes and \nsore throat,  \ncough and asthma due to heat syndromes.去 濕熱  ﹐止血，安胎，降 肝陽之火，治煩躁不安，血壓高，  前列腺癌， \n乳癰，風 熱 濕 熱 頭 痛 ， 熱 嗽 喉 腥 ， 定 喘 嗽 ， \n黃 疸 ， 血 熱 ， 吐血，鼻衄， 崩 漏，目赤腫痛 ，乳癰 ，一般癌症 。MedicalFunction:藥理﹕Medical Function:1. effects on digestive system: alcohol extract of huang qin or its ingredient baicalin can promote secretion of bile but another ingredient wogonin does not have this effect. Baicalein can promote movements of extra body intestines of rabbits but wogonin does not have this effect. Huang qin possesses a mild diarrhea effect.2. anti - histamine effect: alkaloids of huang qin possesses antihistamine effect. It can inhibit edema of rats caused by carrageenin.3. anti allergenic effect: alcohol extract of huang qin inhibits acute asthma attack and allergenic eczema. Baicalein has anti-toxin effect,  inhibits permeability of capillaries and anti acetylcholine and anti anaphylaxis effects.4. broad spectrum antibiotic effect5. prevents atherosclerosis6. blood thinning effect: one of the ingredients, Oroxylin A, can  promote an enzyme to produce nitrogen oxide, a potential for stroke and myocardiac infarction therapy.7. anti hepatitis B virus [1]8. decoction of huang qin may prevent and intervene the formation of cirrhosis of the liver [2]藥理﹕一 . 對 消 化 系 統 影 響 : 本 品 醇 抽 取 物 或 其成 份 黃芩苷 ( baicalin )有 促 進 膽 汁 分 泌 作 用 ，　另 一 成份 漢黃芩素 ( wogonin ) 無 此 作 用 。黃 芩 素 ( baicalein ) 對 兔 離 體 腸 管 具 有 運 動亢 進 作 用 ， 但 漢 黃 芩 素 無 此 作 用 。 黃 芩具 有 緩 瀉 作 用 。二 . 抗 炎 症 作 用:  黃 芩鹼 素 類 ， 有 抗 炎 症作 用 ， 對 大 白 鼠 因 卡拉膠(carrageenin) \n  引 起 \n  浮 腫 有 顯 著 抑 制 作 用 。三 . 抗 過 敏 作 用 :黃 芩 醇 抽 取 物 抗 過 敏 作 用 ， 對 急 性 氣 喘 及過 敏 性 皮 膚 炎 有 抑 制 效 果 。 黃 芩 素 有 解毒 作 用 ， 抑 制 毛 細 血 管 透 過 性 作 用 ， 抗 乙醯 膽 素 (acetylcholine) 作 用 及 抗 全身型過敏性反應(anaphylaxis) 作 用 。四 . 廣 譜 抗 菌 作 用 : 本 品 濃 液 ， 在 試 管 內 對 革 蘭氏 陽 性 菌 有 抑 制 作 用 。五 . 防 止 粥 狀 動 脈 硬 化 作 用:本 品 水 浸 液 ， 連 續 經 口 給 藥 ， 對 兔 實 驗 性誘 發 之 粥 狀 動 脈 硬 化 症 有 預 防 作 用 。六.  治療腦中風及心肌梗塞等血管病﹕成分千層紙素A(Oroxylin A)，用以抑制誘導性 一氧化氮製造酵素，具治療腦中風及心肌梗塞等血管病的潛能。七. 抗乙型肝炎病毒[1]八.黃芩煎劑可預防和抑制肝硬化[2] Chemical ingredients:化學成 分： \n\n\nThe roots contain flavonoid:\n黃芩 根含黃酮類化合物：\n\n\nbaicalein\n黃芩素\n\n\nneobaicalein (skullcapflavoneⅡ)\n黃芩新素, (黃芩黃酮Ⅱ)\n\n\nbaicalin\n黃芩甙\n\n\nwogonin\n漢黃芩素\n\n\nwogonoside\n漢黃芩甙\n\n\noroxylin A\n木蝴蝶素A\n\n\n7-methoxbaic alein\n7-甲氧基黃芩素\n\n\nskullcapflavone\n黃芩黃酮\n\n\ndihydrooroxylin A\n二氫木蝴蝶素A\n\n\nchrysin\n白楊素\n\n\n2,5,8-trihydroxy-7-methoxy-flavone\n2，5，8-三羥基-7-甲氧基黃酮\n\n\n2,5,8-trihydroxy-6,7-dimethoxyflavone\n2，5，8-三羥基-6，7-二甲氧基黃酮(\n\n\n4，5，7-trhydroxy-6-methoxyflavanone\n4，5，7-三羥基-6-甲氧基黃烷酮\n\n\n2，3，5，6，7-pentahydroxyflavanone\n2，3，5，6，7-五羥基黃烷酮\n\n\nwogonin-5-β-D-glucoside\n漢黃芩素-5-β-D-葡萄糖甙\n\n\n\n      2-(3-hydroxy-4-methoxyphenyl)ethyl-1-O-α-L-rhamnosyl(1→3）-β-D-(4-feruloyl)glucoside\n\n      2-(3-羥基-4-甲氧基苯基）-乙基-1-O-α-L-鼠李糖基(1→3）-β-D(4-阿魏酰基）-葡萄糖\n\n\n\n      chrysin-6-C-β-D-glucoside-8-C-β-L-arabinoside\n白楊素-6-C-β-D--葡萄糖甙-8-C-β-L-阿拉伯糖甙\n\n\n\n      chrysin-6-C-α-L-arabi-noside-8-C-β-D-glucoside\n白楊素-6-C-α-L-阿拉伯糖甙-8-C-β-D-葡萄糖甙\n\n\n(2S）-25，6，7-terahydroxyflavanone\n(2S)-2，5，6，7-四羥基黃烷酮\n\n\n5，7，2，7-tetrahydroxyflavone\n5，7，2，6-四羥基黃酮\n\n\n5，8-dihydroxy-6,7-drimethoxyflavone\n5，8-二羥基-6，7-二甲氧基黃酮\n\n\n5，7，4-trihydroxy-8-methoxyflavone\n5，7，4-三羥基-8-甲氧基黃酮(\n\n\noroxylin A-7-O-glucuronide\n木蝴蝶素A-7-O-葡萄糖醛酸甙\n\n\n5，7，2-trihyroxy-6-methoxyflavone\n5，7，2-三羥基甲氧基黃酮\n\n\n5，2-dihydroxy-6,7,8-trimethoxyflavone\n5，2-二羥基-6，7，8-三甲氧基黃酮\n\n\n5-hydroxy-7,8-dimethoxy-flavone\n5-閎基-7，8-二甲氧基黃酮\n\n\nnorwogonin\n去甲漢黃芩素\n\n\ndihydro-baicalin\n二氫黃芩素\n\n\n5,7,2-trihydroxyflavone\n5，7，2-三羥基黃酮\n\n\n5，7，2-trihydroxy-8,6-dimethoxyflavone\n5，7，2-三羥基-8，6-二甲氧基黃酮\n\n\n\n      5，7，2，5-tetrahydroxy-8,6-dimethoxyflavone，(vis-ciduiin Ⅲ)\n5，7，2，5-四羥基-8。6-二甲氧基黃酮(粘毛黃芩素Ⅲ)\n\n\n5，2，5-trihy-droxy-6,7,8-trimethoxyflavone\n5，25-三羥基三甲氧基黃酮\n\n\nbaicalein-7-O-β-D-glucopyranoside\n黃芩素-7-O-β-D-吡喃葡萄糖甙\n\n\n5，7，2-trhiyroxy-8-methoxyflavone (tenax-in \n      Ⅱ\n5，7，2-三羥基-8-甲氧基黃酮(韌黃芩素Ⅱ)\n\n\n5,7,2-trihydroxy-6-methoxyflavone\n5，2，6-三羥基-7，8-二甲氧基黃酮(5,2,6-三羥基-6-甲氧基黃酮)\n\n\n5，7，2-trihydroxy-6-methoxyflavone\n5，7，2，3-四羥基黃酮(粘毛黃芩素I)\n\n\n5, 7, 2, 3-tetrahydroxyflavone\n5, 7, 2, 3-四閎基黃酮\n\n\n \n3, 5, 7, 2, 5, \n      6-五羥基黃酮(3,5,7,2,6-pentahydroxyflavone\n\n\n(2S)-7, 2, \n      6-trihydroxy-5-methoxyflavanone\n(2S）-7，2，6-三羥基-5-甲氧基黃烷酮\n\n\n2, 6, 2, 4-tetrahydroxy-6-methoxychalcone\n2, 6, 2, 4-四羥基-6-甲氧基查爾酮\n\n\n5, 7, 2, 5-tetrahydroxyflavone\n5, 72, 5-四羥基黃酮\n\n\neriodictyol\n 左旋聖草素\n\n\nrivularin\n半枝蓮種素\n\n\nviscidulin Ⅲ-2-O-β-D-glucoplyranoside\n粘毛黃芩素Ⅲ-2-O-β-D-吡喃葡萄糖甙\n\n\nAlso contain:\n另外還含:\n\n\nβ-sitosterol\nβ-榖甾醇\n\n\ncampesterol\n菜油甾醇\n\n\nstigmasterol\n豆甾醇\n\n\nproline\n\n\n      脯氨酸\n\n\nglucose\n葡萄糖\n\n\nsucrose\n蔗糖\n\n\n\n\nhuang qin roots of Yunnan contain:\n滇黃芩 根含:\n\n\nJing baicalein\n涇黃芩素\n\n\nbaicalein\n黃芩素\n\n\nbaicalin\n黃芩甙\n\n\nwogonoside\n漢黃芩甙\n\n\nskullcapflavoneⅡ\n黃芩黃酮Ⅱ\n\n\n2,5,7,2-trihydroxy-6-methoxyflavone-5-methoxyflavone\n2，5，7，2-三羥基-6-甲氧基黃酮\n\n\n(2S)-5，7，8-trihydroxyflavanone\n(2S)-5，7，8-三羥基黃烷酮\n\n\n(2S)-2,5,6,7-tetrahydroxylflavan \n      scutellarein\n(2S)-2,5,6,7-四羥基黃烷黃芩素\n\n\noroxylin A\n木蝴蝶素A\n\n\nscuteamoenoside\n滇黃芩新甙\n\n\n(2R，3R)-2，3，5，7-tetrahydrox-yflavanone\n(2R，3R）-2，3，5，7-四羥基黃烷酮[\n\n\n \n滇黃芩新素(scuteamoenin\n\n\n(2R，3R)-3，5，7-trihydroxyflavanon\n,(2R,3R)-3,5,7-三羥基黃烷酮-\n\n\n2, 3, 5, 6, 7-pentahydroxyflavone\n2, 3, 5, 6, 7-五羥基黃酮\n\n\nchrysin\n白楊素\n\n\nβ-sitosterol\nβ-榖甾醇\n\n\nRoot of Scutellaria viscidula \n      contains:\n3.粘毛黃芩 根含:\n\n\nbaicalin\n黃芩甙\n\n\nwogonoside\n漢黃芩甙\n\n\nbaicalein\n黃芩素\n\n\nwogonin\n漢黃芩素\n\n\noroxylin A\n木蝴蝶素A\n\n\nneobaicalein (skullcapflavoneⅡ)\n 黃芩新素\n\n\npanicolin\n5, 2-二羥基二甲氧基黃酮(黃芩黃酮Ⅰ)\n\n\nViscidula scutellarein I, II, III\n粘毛黃芩素I, II, III\n\n\n4. Root of Scutellaria likiangensis Diels contains:\n4.麗江黃芩 根含:\n\n\nbaicalein\n黃芩素\n\n\nwogonin\n漢黃芩素\n\n\nchrysin\n白楊素\n\n\noroxylin A\n木蝴蝶素A\n\n\ntenaxin II\n韌黃芩素Ⅱ\n\n\n \n粘千周黃芩素Ⅰ\n\n\n5. Root of Scutellaria rehderiana \n      contains:\n5. 甘肅黃芩根含:\n\n\nrehderianin I\n甘肅黃芩素I\n\n\nViscidula scutellarein III\n粘毛黃芩素III\n\n\nbaicalin\n黃芩甙\n\n\nwogonin\n漢黃芩素\n\n\nbaicalein\n黃芩素\n\n\noroxylin A\n木蝴蝶素A\n\n\nganhuangenin\n甘肅芩甙元\n\n\n6. Root of Scutellaria \n      hypericifolia contains:\n川黃芩根含:\n\n\nbaicalin\n黃芩甙\n\n\nwogonoside\n漢黃芩甙\n\n\nbaicalein\n黃芩素\n\n\nViscidula scutellarein I, II\n粘毛黃芩素I,II\n\n\noroxylin A\n木蝴蝶素A\n\n\nwogonin\n漢黃芩素\n\n\n Dosage:用量:6 to 15 g 3～15 克。Samples of formulae:處方舉例：long dan xie gan tang,  xiao xu ming tang,   xiao chai hu tang, e jiao huang qin tang 龍 膽瀉肝湯, 小續命湯, 小柴胡湯，阿膠黃芩湯。. Modern Research: to be loaded.Cautions:禁 忌 ﹕not to use in case of  pixu (spleen deficient) with weak digestion.  Avoid using huang qin while on blood thinning medication.脾 虛 ，少食，便溏者忌服。用抗凝藥時 須避免同時用黃芩。[1] J Viral Hepat. 2013;20(7):445-452. [2] Hebei Journal of Traditional Chinese Medicine Issue 01, year 2013    河北中医, 2013年 01期carrageenin : Any of a group of closely related colloids derived from Irish moss and several other red algae, widely used as a thickening, stabilizing, emulsifying, or suspending agent in industrial, pharmaceutical, and food products. (source: American Heritage Dictionary)Search this siteProblems with website? Please Click here for comment. (Not for inquiry )    Click here for inquiryCopyright Notice 按此看關於版權問題A manuscript... writing, translating and proofreading  in progressSponsors' Ads by Google 以下為谷歌 所提供之廣告 List of Health ProblemsChinese Herb DictionaryToxicity of Some HerbsSide Effect of Some HerbsHerbs that can be toxic to kidneysTraditional Chinese Medicine TCM Diagnosis Samples of FormulaeTerms of Traditional Chinese MedicineAcupuncturecopy right 版權所有Qigong (chi kung)Prescribed Drug DictionaryEmail our web master for  your suggestion (not for inquiry)Biochemistry DictionaryGeneral Online LibraryQigong classesFake Email WarningResearch LibrarianSearchQigong classesHomeWeather ReportDisclaimerLast update: \n  Dec 12, 2014; 11：30 p.m. LAH   \n",
        "original_url": "http://alternativehealing.org/huang_qin.htm"
    }
]