[
  {
    "Names": {
      "Name": ["mu tou hui"],
      "Pharmaceutical": ["Radix Patriniae heterophyllae"],
      "Botanical": [
        "Patrinia heterophylla Bunge (異葉敗醬)",
        "Patrinia scabra Bunge",
        "Patrinia rupestris sp. scabra (糙葉敗醬)"
      ],
      "Common": [
        "English: Diversifolious patrinia root; root of scabrous patrinia; scabrous patrinia root"
      ],
      "Other name": [
        "zhui feng jian 追風箭",
        "jiao han cao 腳汗草",
        "tong ban dao 銅班道",
        "hu ya cao 虎牙草",
        "bai zi cao 擺子草"
      ],
      "Chinese": ["墓頭回"],
      "Pronunciation in Korean": ["matalisog"],
      "Pronunciation in Japanese": ["ominaeshi (女郎花)"],
      "Pronunciation in Cantonese": ["mou6 tau4 wui4"],
      "Pinyin Pronunciation": []
    },
    "Type": "Herb",
    "Geography": [
      "Mainly produced in Shanxi, Henan, Hebei, Guangxi (China) [2]",
      "Distributed in Liaoning, Hebei, Shanxi, Henan, Shaanxi, Gansu, Guangxi (China) [1]"
    ],
    "Properties": ["Bitter", "Slightly sour", "Slightly astringent", "Cool"],
    "Meridians": ["Heart", "Liver"],
    "Maladies Treated": [
      "Uterine erosion",
      "Early cervical cancer",
      "Vaginal discharge",
      "Vaginal bleeding not during menses (崩漏)",
      "Malaria"
    ],
    "Medical Function": ["Anti-cancer", "Sedative effect"],
    "Dosage": "Oral: decoction 9–15 g. External application: appropriate amount; smash and apply.",
    "Samples of Formulae": "Vaginal bleeding and vaginal discharge: Use a handful of mu tou hui (diversifolious patrinia root), a pinch of new Hong Hua (safflower), and water and rice wine, half of each. Cook and simmer down to 70%. Drink before bedtime while warm. If the illness is recent, use one dose; if chronic, use three doses. Source: 《董炳集驗方》 [2]",
    "Contraindications": "",
    "Research": "",
    "Notes": "",
    "Chemical Ingredients": {
      "Patrinia rupestris sp. scabra (roots and rhizomes)": [
        "Volatile (evaporating) oil (unspecified percentage)",
        "β-caryophyllene",
        "α-humulene",
        "decahydro-4,8,8-trimethyl-9-methylene-1,4-methanoazulene",
        "3,7,11-trimethyl-1,3,6,10-dodecatetraene",
        "ξ-cadinol",
        "β-selinene",
        "α-gurjunene (reported in another source)",
        "β-gurjunene (reported in another source)",
        "n-hexadecane (reported in another source)"
      ],
      "Patrinia heterophylla Bunge (roots)": [
        "Volatile (evaporating) oil 0.63%",
        "Isovaleric acid",
        "Sesquiterpene",
        "Sesquiterpenoid",
        "Sesquiterpene alcohol",
        "Aldehyde",
        "Ketone",
        "Alcohol",
        "Monoterpene",
        "α-pinene (reported in another source)",
        "β-pinene (reported in another source)",
        "Limonene (reported in another source)",
        "γ-elemene (reported in another source)",
        "ξ-elemene (reported in another source)",
        "Borneol (reported in another source)",
        "α-terpineol (reported in another source)",
        "β-terpineol (reported in another source)",
        "β-maaliene (reported in another source)",
        "β-guaiene (reported in another source)",
        "ξ-cadinene (reported in another source)"
      ]
    },
    "References": [
      "[1] Zhong Yao Da Ci Dian 中藥大辭典",
      "[2] Zhong Hua Ben Cao 中華本草"
    ],
    "Further Reading": [],
    "Original Text": "mu tou hui , Complementary and Alternative Healing UniversityComplementary and Alternative Healing University   中藥詞典                 Chinese Herb Dictionary      Search this site     在本網站找資料     Discussion FormSearch this siteList of Health ProblemsChinese Herb DictionaryQigongTraditional Chinese Medicine (TCM)AcupuncturePrescribed Drug DictionaryBiochemistry DictionaryLecture SlidesResearch LibrarianGeneral Online LibrarySearchResearch SitesViagraMassage/AcupressureHypnotherapyTell us what you wantNotify Changes & New Information　　　                 　      　　 mu tou hui 墓頭回         (in English and Chinese 中英文) Translated by: Joe Hing kwok Chu 朱興國編譯Pharmaceutical name:英文藥名﹕Radix Patriniae heterophyllaeBotanical name:學名﹕Patrinia heterophylla Bunge, (異葉敗醬)Patrinia scabra Bunge Patrinia rupestris sp. scabra (糙葉敗醬)Pron. in Japanese:日語發音﹕ominaeshi (女郎花)Pron. in Korean:韓語發音﹕matalisogPron. in Cantonese::粵音﹕mou6 tau4 wui4Other Names:別名﹕zhui feng jian 追風箭、jiao han cao 腳汗草、tong ban dao 銅班道、hu ya cao 虎牙草、bai zi cao 擺子草Common Name:英文名﹕ Diversifolious patrinia root, root of scabrous patrinia, scabrous patrinia rootDistribution:產地﹕It is mainly produced in Shanxi, Henan, Hebei, Guangxi provinces of China.[2]It is distributed in Liaoning, Hebei, Shanxi, Henan, Shaanxi, Gansu, Guangxi provinces. [1]主產山西、河南、河北、廣西等地。[2]分佈於遼寧、河北、山西、河南、陝西、甘肅、廣西等地[1]Properties(characteristics)﹕性味﹕ bitter, slightly sour, slightly astringent, cool.苦, 微酸澀, 涼   Channels (meridians) entered: 歸經﹕heart, liver.心, 肝.Medical functions:藥理﹕ anti cancersedative effect抗癌鎮靜Actions & Indications:主治﹕For uterine erosion, early cervical cancer, vaginal discharge,  vaginal bleeding not during menses, malaria.用於子宮糜爛，早期宮頸癌，白帶，崩漏，瘧疾。Chemical ingredients: [2]化學成份﹕【2】The roots and stems of Patrinia rupestris sp. scabra contain evaporating oil, among them:糙葉敗醬 根及根莖含揮發油，其中主成分有：β-caryophylleneβ-丁香烯β-caryophylleneβ-丁香烯α-humuleneα-葎草烯decahydro-4,8,8-trimethyl-9-methylene-1,4-methanoazulene十氫-4，8，8-三甲基-9-亞甲基-1，4-亞甲基薁3,7,11-trimethyl-1,3,6,10-dodecatetraene3，7，11-三甲基-1，3，6，10-十二碳四烯ξ-cadinolξ-蓽澄茄醇β-selineneβ-芹子烯 另據報道，油中主成分還有：α-gurjunene, β-gurjuneneα-和β-古芸烯n-hexadecane正十六烷The roots of Patrinia heterophylla Bunge contain 0.63% of evaporating oil, among them:異葉敗醬 根含揮發油0.63%，主成分為:isovaleric acid異戊酸sesquiterpene倍半萜烯類sesquiterpenoid 倍半萜化合物sesquiterpene alcohol倍半萜醇類aldehyde醛ketone酮alcohol醇monoterpene單萜烯類Acording another report, the evaporating oil contains:另據報道揮發油中含α-pinene and  β-pineneα和β-蒎烯limolene檸檬烯γ-elemene, and ξ- elemeneγ-和ξ-欖香烯borneol龍腦α-terpineol, β-terpineolα和β-松油醇β-maalieneβ-橄欖烯β-guaieneβ-愈創木烯ξ-cadineneξ-蓽澄茄烯Dosage:用 量﹕oral: in decoction 9 to 15 g.External application: appropriate amount. Smash and apply.內服：煎湯，9-15g。外用：適量，搗敷。Samples of formulae:處方舉 例﹕Vaginal bleeding, vaginal discharge: use a handful of mu tou hui, a pinch of new hong hua and water and rice wine, half of each. Cook and simmer down to 70%. Drink before bed time. Use while warm. If sickness is new use one dose. If it is chronic, use 3 doses. [2]崩中， 赤白帶下： 墓頭回一把，酒水各半盞，新紅花一捻，煎七分，臥時溫服。 日近者一服，久則三服。《董炳集驗方》Modern Research:現代研究﹕ Toxicity & Cautions:毒素與禁忌﹕[1]  Zhong Yao Da Ci Dian 中藥大辭典[2] Zhong Hua Ben Cao 中華本草Problems with website? Please Click here for comment. (Not for inquiry )      Click here for inquiry    Ads by Google:   A manuscript... writing, translating and proofreading  in progress  Copyright Notice 按此看關於 版權問題List of Health ProblemsChinese Herb DictionaryToxicity of Some HerbsSide Effect of Some HerbsHerbs that can be toxic to kidneysTraditional Chinese Medicine TCM Diagnosis Samples of FormulaeTerms of Traditional Chinese MedicineAcupuncturecopy right 版權所有Qigong (chi kung)Prescribed Drug DictionaryEmail our web master for  your suggestion (not for inquiry)Biochemistry DictionaryGeneral Online LibraryQigong classesFake Email WarningResearch LibrarianSearchQigong classesDisclaimerHomeWeather ReportLast update: Nov 16, 2014; 11:30 p.m. LAH  ",
    "original_url": "http://alternativehealing.org/mu_tou_hui.htm"
  },
  {
    "Names": {
      "Name": ["Vinegar", "醋"],
      "Pharmaceutical": ["vinegar"],
      "Biological": [],
      "Chemical": [],
      "Common": ["vinegar"],
      "Other name": ["ku jiu 苦酒", "xian 酰", "chun cu 淳酢", "mi cu 米醋"],
      "Chinese": ["醋"],
      "Pronunciation in Korean": ["cho"],
      "Pronunciation in Japanese": ["su"],
      "Pronunciation in Cantonese": ["cou3"],
      "Pinyin Pronunciation": []
    },
    "Type": "Chemical",
    "Geography": [],
    "Properties": ["Sour", "Sweet", "Warm"],
    "Meridians": ["Liver", "Stomach"],
    "Maladies Treated": [
      "postpartum dizziness due to blood loss (產後血暈)",
      "abdominal masses (症瘕積聚)",
      "vomiting blood (吐血; hematemesis)",
      "epistaxis (衄血)",
      "blood in stool (便血)",
      "parasitic abdominal pain (虫積腹痛)",
      "food poisoning from fish, meat, or vegetables (魚肉菜毒)",
      "carbuncle and swollen sores (癰腫瘡毒)"
    ],
    "Medical Function": [
      "disperses blood stasis and reduces accumulations (散淤消積)",
      "stops bleeding (止血)",
      "expels roundworms (安蛔)",
      "detoxifies (解毒)",
      "improves digestion (消積)"
    ],
    "Dosage": "Oral: 10–30 ml; in decoction, or soaking, or mix with other food items.\nExternal use: appropriate amount; rinsing in the mouth, or mix with other herb and apply, or use in steaming or washing.",
    "Samples of Formulae": "For abdominal masses/tumor (治瘕症): Bie Jia (turtle shell) 鱉甲, He Zi peel (Chebula fruit peel) 訶子皮, Gan Jiang (dried ginger) 乾薑. Equal amounts of each. Grind into powder. Mix with starch glue made with vinegar. Make into pills, sizes like soy beans. Take orally 30 pills each time with drinking water during empty stomach. Source: Yi Xue Ru Men (醫學入門), formula name: Cu Bie Wan (醋鱉丸).\nFish bone lodged in throat（魚骨梗喉嚨）.",
    "Contraindications": "Use with care if dampness is heavy, the body is weak and muscles are in atrophy, or spastic, or during the early stage of cold or influenza.",
    "Research": "Insecticidal effect (in vitro): After exposure of protoscolex to 0.125%–0.25% acetic acid, within 2–3 minutes the skin started to blister, producing pricks, skin separating, dissolution, the body became dark, calcium granules reduced, and other morphological changes. In 5–10 minutes, 100% were killed. Protoscolex treated with acetic acid for 10 minutes and then used for intraperitoneal inoculation to mice did not develop into hydatid disease. [1]\nAntibacterial and antiviral effect: Acetic acid has good bacteriostatic and bactericidal effects on Streptococcus (甲型鏈球菌), Branhamella (Neisseria) catarrhalis (卡他球菌), Streptococcus pneumoniae (肺炎鏈球菌), Staphylococcus (白色葡萄球菌), influenza virus (流感病毒), and other pathogens. [1]",
    "Notes": "Protoscolex is the larval form of the tapeworm parasite of the genus Echinococcus. Hydatid is a cyst due to infection by larvae of some species of the tapeworm Echinococcus.\nThe chemical ingredients list is cited from [2].",
    "Chemical Ingredients": {
      "Vinegar (liquid)": [
        "acetic acid 3%–5%",
        "higher alcohols",
        "acetoin (3-hydroxybutanone)",
        "dihydroxyacetone",
        "tyrosol",
        "acetaldehyde",
        "formaldehyde",
        "acetal",
        "succinic acid",
        "oxalic acid",
        "sorbose"
      ]
    },
    "References": [
      "[1] Zhong Hua Ben Cao 中華本草",
      "[2] Zhong Yao Da Ci Dian 中藥大辭典"
    ],
    "Further Reading": [],
    "Original Text": "vinegar, Complementary and Alternative Healing UniversityComplementary and Alternative Healing University   中藥詞典                 Chinese Herb Dictionary      Search this site     在本網站找資料     Discussion FormSearch this siteList of Health ProblemsChinese Herb DictionaryQigongTraditional Chinese Medicine (TCM)AcupuncturePrescribed Drug DictionaryBiochemistry DictionaryLecture SlidesResearch LibrarianGeneral Online LibrarySearchResearch SitesViagraMassage/AcupressureHypnotherapyTell us what you wantNotify Changes & New Information　　　                 　      　　Vinegar 醋  (in English and Chinese 中英文)Translated by: Joe Hing kwok Chu 朱興國編譯Pharmaceutical name:英文藥名﹕vinegarBotanical name:學名﹕vinegarPron. in Japanese:日語發音﹕suPron. in Korean:韓語發音﹕choPron. in Cantonese::粵音﹕cou3Other Names:別名﹕ku jiu 苦酒、xian 酰、chun cu 淳酢、mi cu米醋Common Name:英文名﹕vinegarDistribution:產地﹕ Properties(characteristics)﹕性味﹕sour, sweet, warm.酸, 甘, 溫。  Channels (meridians) entered: 歸經﹕liver, stomach. 肝, 胃。Medical functions[1]:藥理﹕【1】 1. insecticidal effect in vitro tests: after exposure with 0.125%~0.25% acetic acid, within 2-3 minutes, the skin of protoscolex started to blister, producing pricks, skin separating, dissolution and the body became dark, reducing calcium and other morphological changes. In 5-10 minutes 100% were killed. Using protoscolex that had been treated with acetic acid for 10 minutes to intraperitoneal inoculate to mice and did not develop into hydatid disease.2. antibacterial, antiviral effect: acetic acid have a good bacteriostatic and bactericidal effect on Streptococcus, Branhamella (Neisseria) catarrhalis, Streptococcus pneumoniae, Staphylococcus, influenza virus and other pathogens.1.殺虫作用 體外試驗，0.125%-0.25%乙酸與原頭蚴接觸後可在2-3 分鐘內出 現皮層起泡，起刺，皮層分離，溶解及虫體發暗，鈣粒減少等形態結構變化。5-10 分鐘內可達到100%殺死原頭蚴的效果。原頭蚴經藥液處理10 分鐘後 ，給小鼠腹腔接種，均未發育成棘球坳。2.抗菌、抗病毒作用 乙酸對甲型鏈球菌、卡他球菌、肺炎鏈球菌、白色葡萄球菌、流感病毒等 致病菌，有很好的抑菌和殺菌作用。Actions & Indications:主治﹕getting rid of blood stasis and improving digestion. rid of roundworms; detoxification. For treatment of postpartum dizziness; lumps in abdomen; vomiting; epistaxis; blood in stool; parasitic abdominal pain; food poisoning; carbuncle and swollen sores散淤消 積；止血；安蛔；解毒。主產後血暈；症瘕積聚；吐血；衄血；便血；虫積腹痛；魚肉菜毒；癰腫瘡毒Chemical ingredients: [2]化學成份﹕【2】 Vinegar contains:醋含；acetic acid, 3%-5%乙酸 3%-5%higher alcohol高級醇類acetoin3-羥基丁酮dihydroxyacetone二羥基丙酮tyrosol酪醇acetaldehyde乙醛formaldehyde甲醛acetal乙縮醛succinic acid琥珀酸oxalic acid草酸sorbose山梨糖Click here to see cider vinegar chemical ingredients in USDA site. Dosage:用 量﹕oral: 10 - 30 ml. in decoction, or soaking or mix with other food items.external use: appropriate amount. Rinsing in the mouth, or mix with other herb and apply, or use in steaming or washing.內服：煎湯，10-30 毫升；或浸漬；或拌制。外用：適量，含漱；或調藥敷；或熏蒸；或浸洗。Samples of formulae:處方舉 例﹕For treatment of tumor：bi jie, he zi peel, gan jiang. Equal amount of each. Grind into powder. Mix with starch glue made with vinegar. Make into pills, sizes like soy beans. Take orally 30 pills each time with drinking water during empty stomachFish bone lodged in throat 治 瘕症：鱉 甲、訶 子皮、乾 薑各等分。為末，醋糊丸，梧子大，每服三十丸，空心白湯下。（《醫學入門》 醋鱉丸）魚骨梗喉嚨Modern Research:現代研究﹕ Toxicity & Cautions:毒素與禁忌﹕Use with care if dampness is heavy, the body is weak and muscles are in atrophy, or spastic, or during the early stage of cold or influenza.[2]脾胃濕 重， 身體痿弱，肌肉萎縮、筋脈攣 或外感初起者慎服。[2]Note:Protoscolex is the larval form of the tapeworm parasite of the genus Echinococcus. Hydatid is a cyst due to infection by larvae of some species of the tapeworm Echinococcus. [1] Zhong Hua Ben Cao   中華本草[2] Zhong Yao Da Ci Dian 中藥大 辭典 Problems with website? Please Click here for comment. (Not for inquiry )     Click here for inquiry   Ads by Google:   A manuscript... writing, translating and proofreading  in progress  Copyright Notice 按此看關於 版權問題List of Health ProblemsChinese Herb DictionaryToxicity of Some HerbsSide Effect of Some HerbsHerbs that can be toxic to kidneysTraditional Chinese Medicine TCM Diagnosis Samples of FormulaeTerms of Traditional Chinese MedicineAcupuncturecopy right 版權所有Qigong (chi kung)Prescribed Drug DictionaryEmail our web master for  your suggestion (not for inquiry)Biochemistry DictionaryGeneral Online LibraryQigong classesFake Email WarningResearch LibrarianSearchQigong classesDisclaimerHomeWeather ReportLast update: Sept 25, 2014; 11:50  a.m. LAH  ",
    "original_url": "http://alternativehealing.org/vinegar.htm"
  },
  {
    "Names": {
      "Name": ["huang qi"],
      "Pharmaceutical": ["Radix astragali"],
      "Biological": [
        "Astragalus henryi Oliv.",
        "Astragalus hoantchy Franch.",
        "Astragalus menbranaceus Fisch.",
        "Astragalus mongholicus Bunge"
      ],
      "Chemical": [],
      "Common": ["English: Astragalus root"],
      "Other name": [
        "bei qi (Northern huang qi; 北芪)",
        "dai shen (戴椹)",
        "shu zhi (蜀脂)",
        "mian huang qi (綿黃耆)",
        "du gen (獨根)",
        "er ren tai (二人抬)",
        "huang qi (written differently in Chinese: 黃芪)"
      ],
      "Chinese": [
        "黃耆",
        "黃芪",
        "北芪",
        "戴椹",
        "蜀脂",
        "綿黃耆",
        "獨根",
        "二人抬"
      ],
      "Pronunciation in Korean": ["hwanggi"],
      "Pronunciation in Japanese": ["ogi"],
      "Pronunciation in Cantonese": ["wong4 kei4"],
      "Pinyin Pronunciation": []
    },
    "Type": "Herb",
    "Geography": [
      "Shanxi (main production)",
      "Heilongjiang (main production)",
      "Inner Mongolia Autonomous Region (main production)",
      "Jilin",
      "Gansu",
      "Hebei",
      "Shaanxi",
      "Northeastern China"
    ],
    "Properties": ["Slightly sweet", "Almost no smell"],
    "Meridians": ["Lung", "Spleen"],
    "Maladies Treated": [
      "qixu (qi deficient)",
      "pixu (spleen deficient)",
      "yangxu (yang deficient)",
      "xinyangxu (heart yang deficient)",
      "shenyangxu (kidney yang deficient)",
      "Weakness and fatigue",
      "Numbness of limb",
      "Post-stroke sequelae (morbidity after stroke)",
      "Spontaneous sweating",
      "Diabetes",
      "Edema (reduced via promoting diuresis)"
    ],
    "Medical Function": [
      "Large dosage (above 35 grams) can lower blood pressure with vasodilation effect",
      "Small dosage (within 15 grams) can increase blood pressure",
      "Prolonging diuretic effect",
      "Lessening proteinuria",
      "Improving endurance",
      "Protecting liver function",
      "Regulate blood sugar",
      "Promotes pus discharge and tissue regeneration"
    ],
    "Dosage": "6–10 g per day. For use in hypertension, the dosage usually is above 30 g. Small dosage can have hypertensive effect.",
    "Samples of Formulae": "Bu Zhong Yi Qi Tang 補中益氣湯\nShi Quan Da Bu Tang 十全大補湯\nGui Pi Tang 歸脾湯\nYu Ping Feng San 玉屏風散",
    "Contraindications": "There are many varieties of astragalus; some are toxic. The varieties used in Chinese herbal medicine are relatively safe, but in rare cases it might cause skin rash, especially in patients with spleen deficiency (pixu) and serious kidney yang deficiency (shenyangxu).\n\nDo not use for liver yang ascending type of hypertension. It can be used for qi-deficient and blood-deficient types of hypertension.\n\nAs a strong tonic that warms and raises yang, it is not suitable in acute infections such as cold or flu, boils, skin ulcers, yin deficiency with fever, and digestive tract infection. Traditional cautions include exterior excess with strong pathogenic factor (biao shi), heat-toxin sores and swellings, yin deficiency with body heat, accumulation and stagnation with focal distention (ji zhi pi man), and liver yang rising.",
    "Research": "Astragaloside IV possesses potent anti-HBV activity. [1]",
    "Notes": "Quality assessment: Usually the smaller pieces are better than the large, wider pieces. Larger pieces can be reconstituted from small pieces or made from smaller roots soaked in water and mechanically pressed into wider pieces; during this process, effective ingredients may leach into the water.\n\nWild roots are the best. Typically, wild roots are not very large and have more distinctive fibers.",
    "Chemical Ingredients": {
      "Astralagus menbranaceus, (Fisch.) Beg.": [
        "astragaloside I",
        "astragaloside II",
        "daucosterol",
        "beta-sitosterol",
        "palmitic acid",
        "sucrose [1]",
        "Astragalus saponin A",
        "Astragalus saponin B",
        "Astragalus saponin C",
        "Astramenbrangenin (obtained after oxidization of astralagus menbranaceus saponin by Smith) [2]",
        "2',4'-dihydroxy-5, 6-dimethoxyisof lavane",
        "kumatakenin",
        "choline",
        "betaine",
        "folic acid [3,4]",
        "calyxosin",
        "formononetin",
        "cycloastragenol",
        "astragaloside I, II, III, IV [5]",
        "L-3-hydroxy-9-methoxpterocarpan (antibacterial ingredient) [6]"
      ]
    },
    "References": ["[1] Biol Pharm Bull 32(1):132-5 (2009), PMID 19122295"],
    "Further Reading": [],
    "Original Text": "huang qi, Complementary and Alternative Healing UniversityComplementary and Alternative Healing University   中藥詞典    Chinese Herb Dictionary      Search this site     在本網站找資料 See more menu at the bottom of pagehuang qi  黃耆By: Joe Hing Kwok Chu                        (in English and Chinese 中英文）herbplantPharmaceutical name:英文藥名：Radix astragaliBiological name:拉丁名：Astragalus henryi Oliv.Astragalus hoantchy  Franch.Astragalus menbranaceus Fisch.Astragalus mongholicus BungePron. in Japanese:日語發音：ogiPron. in Korean:韓語發音:hwanggiPron. in Cantonese粵語發音：wong4 kei4Other Names:別名：huang qi is more commonly prescribed as bei qi 北芪,meaning 'northern huang qi'. Northern huang qi is considered to be better; but usually the herb stores do not differentiate them.處方時黃芪常寫作為北芪， 意思是�北方産的黃芪�。一般認為北芪質量較好。但通常是藥店不加以區別。huang qi (it is written differently in Chinese)黃芪dai shen戴椹shu zhi蜀脂mian huang qi綿黃耆du gen獨根er ren tai二人抬Common Name:英文名：Astragalus rootDistribution:產地：Mainly produced in Shanxi, heilongjiang provinces and Inner Mongolia Autonomous Region, also produce in jilin, Gansu, hebei, Shaanxi and northeastern part of China.主產於山西，黑龍江， 內蒙。吉林，甘肅，陜西，東北亦有生產。Properties (characteristics)：性味：tastes slightly sweet and has almost no smell微甘，幾乎沒有氣味。Channels (meridians) entered:歸經：lung and spleen.肺，脾。Actions & Indications:主治 ：In qixu (qi deficient) , pixu (spleen deficient) and yangxu (yang deficient),  weakness and fatigue, numbness of limb, morbidity after stroke, sweating, promoting pus discharge and tissue regeneration. Promotes diuresis to reduce edema. Treatment of diabetes. Treatment of xinyangxu (heart yang deficient)  and shenyangxu.用於氣 虛， 脾虛，陽 虛，心 陽虛， 腎陽虛，體 弱疲倦，肢體麻木，中風後遺癥，自汗，糖尿病。可幫助排膿，生肌。利尿消腫。Medical Function:藥理： large dosage of above 35 grams can lower blood pressure with vaso-dilation effectsmall dosage within 15 grams can increase blood pressure prolonging diuretic effect lessening proteinuria improving endurance protecting liver function regulate blood sugarastragaloside IV possesses potent anti-HBV activity.[1] 大剤量，35克以 上，能降血壓，有擴張血管作用小剤量，15克以 內，有生壓作用延長利尿作用減輕蛋白尿增進耐力保護肝臟功能調整血糖黃芪皂甙IV具 有對抗HBV活性強效。[1]Chemical ingredients:化學成分：1. Astralagus menbranaceus, (Fisch.) Beg.astragaloside I, astragaloside II, daucosterol, beta-sitosterol, palmitic acid, sucrose [1]. Astragalus saponin A,B,C.  Astramenbrangenin was obtained after oxidization of astralagus menbranaceus saponinby Smith. [2].2',4'-dihydroxy-5, 6-dimethoxyisof lavane, kumatakenin, choline, betaine, folic acid [3,4], calyxosin, formononetin, cycloastragenol, astragaloside I,II,III,IV [5], and antibacterial ingredient, L-3-hydroxy-9-methoxpterocarpan[6].2. Astragalus mongholicus (Beg) Hsiao(more to upload)Dosage per day:每日用量：6-10 g. For use in hypertension, the dosage usually is above 30 g. Small dosage and can have hypertensive effect.6～10 克。治 療高血壓時，其用量一般在30克 以上。剤量小有生壓作用。Samples of formulae:Bu Zhong Yi Qi Tang 補中益氣湯﹐Shi Quan Da Bu Tang 十全大補湯,Gui Pi Tang 歸脾 湯,Yu Ping Feng San, 玉屏風散Modern Research:現代研究：(more to upload)Quality：質量：Usually the smaller pieces are better than the large, wider pieces.The larger pieces can be either reconstituted from the little pieces or made from the smaller roots that has been soaked in water and mechanically pressed into wider pieces. In the process, the effective ingredients may leach out into the water.The wild roots are the best. Usually the wild roots are not as large and the fibers are more distinctive一般較小片比寬大片較好。較大片的可能是用小片壓成的，或用較小的根浸泡在水中，浸軟後，用機器壓成的。在 這個過程中，有效成分可能浸出到水中。 野生的根是最好的。通常情況下，野生的根一般是不很大，而且纖維明顯。Cautions and Contra-indications:禁忌：There are many varieties of astragalus. Some are toxic. The varieties used in Chinese herbal medicine is relatively safe but in rare cases it might cause skin rash, especially in patients with pixu (spleen deficient)   and serious shenyangxu (kidney yang deficient) conditions.It cannot be used in liver yang ascending type of hypertension but can be use in qi deficient and blood deficient type of hypertension.Huang qi is a strong tonic and can raise the function of the body, thus it is not suitable to use in acute infections, like cold or flu,  boils, skin ulcers, yin deficient with fever, digestive tract infection.不能用於 肝陽上亢所引起的高血壓。但可以用於氣 虛與血虛型 的血壓高。而由於黃耆溫補升陽之力甚強。不宜用於是表實邪盛、熱毒瘡瘍、 陰虛身熱、積滯痞滿 、肝陽上亢者。黃芪有多種。有些有毒 。 中藥用的種類是相當安全的，但在很少情形下曾有發生皮疹, 尤其是脾 虛與 腎陽虛患 者。 [1] Biol Pharm Bull 32(1):132-5 (2009), PMID 19122295 If you need more information in a hurry, you can email our research librarian.Search this siteProblems with website? Please Click here for comment. (Not for inquiry )    Click here for inquiryCopyright Notice 按此看關於版權問題Sponsors' Ads by Google 以下為谷歌 所提供之廣告A manuscript... writing, translating and proofreading  in progressMenu: List of Health ProblemsQigong (chi kung)Toxicity of Some HerbsSide Effect of Some HerbsHerbs that can be toxic to kidneysTraditional Chinese Medicine TCM Diagnosis Samples of FormulaeTerms of Traditional Chinese MedicineAcupunctureChinese Herb DictionaryQigong classesPrescribed Drug DictionaryEmail our web master for  your suggestion (not for inquiry)Biochemistry Dictionary Qigong classes Research Librarian copy right 版權所有HomeWeather ReportDisclaimerLast update: June 8, 2016; 6 p.m. LAH   ",
    "original_url": "http://alternativehealing.org/huang_qi.htm"
  },
  {
    "Names": {
      "Name": ["yu jin xiang gen", "yu jin xiang hua"],
      "Pharmaceutical": [
        "Flos Tulipae gesnerianae",
        "Rhizome Tulipae gesnerianae"
      ],
      "Botanical": ["Tulipa gesneriana L. C."],
      "Chinese": ["鬱金香根", "鬱金香花"],
      "Common": ["tulips"],
      "Other name": [
        "yu xiang 鬱香",
        "hong lan hua 紅藍花",
        "zi shu xiang 紫述香"
      ],
      "Pronunciation in Korean": [],
      "Pronunciation in Japanese": ["ukonku"],
      "Pronunciation in Cantonese": ["wat1 gam1 heong1"],
      "Pinyin Pronunciation": ["y� jīn xiāng gēn", "y� jīn xiāng huā"]
    },
    "Type": "Herb",
    "Geography": [
      "Originally grown in Europe",
      "China (cultivated in gardens throughout the country; now in most parts of China)"
    ],
    "Properties": ["bitter", "acrid", "slightly toxic"],
    "Meridians": [],
    "Maladies Treated": [
      "Flowers: digestive tract yeast infection",
      "Flowers: flatulence",
      "Flowers: vomiting or burping with undigested food",
      "Flowers: abdominal pain",
      "Flowers: foul-smelling breath",
      "Flowers: tongue with oily, dirty fur (greasy tongue coating)",
      "Flowers: Spleen and Stomach damp-turbidity (脾胃濕濁)",
      "Flowers: chest and epigastric fullness/oppression (胸脘滿悶)",
      "Root: manic depression (臟躁症)"
    ],
    "Medical Function": ["Sedative (root)"],
    "Dosage": "Flowers: internal decoction 3–5 g; external use: appropriate amount.\nRoot: 1.5–9 g in pills or powder.",
    "Samples of Formulae": "",
    "Contraindications": "The bulb and the flowers have been known to cause dermatitis in sensitive people; its leaves and bulbs may cause skin allergy. Up to 5 bulbs a day can be eaten without ill effect. [1]\nOverconsumption can cause diarrhea. [1]",
    "Research": "Alcohol extract of leaves and stems possesses an inhibiting effect on Bacillus cereus and Bacillus mycoides.",
    "Notes": "",
    "Chemical Ingredients": {
      "Pollen": [
        "n-heptacosane (正-二十七烷)",
        "iso-heptacosane (異-二十七烷)"
      ],
      "Perianth (flower perianth)": [
        "isovitexin (異牡荊素)",
        "quercetin-3-glucoside (槲皮素-3-葡萄甙)",
        "quercetin-3-O-β-gentiobioside-7-O-β-glucuronide (槲皮素-3-O-β-D-龍膽二糖甙-7-O-β-葡萄糖醛酸甙)",
        "quercetin-3-O-β-rutinoside-7-O-β-glucuronide (槲皮素-3-O-β-芸香糖甙-7-O-β-葡萄糖醛酸甙)",
        "quercetin-3-O-β-glucoside-7-O-β-glucuronide (槲皮素-3-O-β-葡萄糖甙-7-O-β-葡萄糖醛酸甙)",
        "kaempferol-3-glucoside (山柰酚-3-葡萄糖甙)",
        "kaempferol-3-O-β-gentiobioside-7-O-β-glucuronide (山柰酚-3-O-β-龍膽二糖甙-7-O-β-葡萄糖醛酸甙)",
        "kaempferol-3-O-β-rutinoside-7-O-β-glucuronide (山柰酚-3-O-β-芸香糖甙-7-O-β-葡萄糖醛酸甙)",
        "kaempferol-3-O-β-glucoside-7-O-β-glucuronide (山柰酚-3-O-β-葡萄糖甙-7-O-β-葡萄糖醛酸甙)"
      ],
      "Flowers": [
        "gibberellin A5 (赤霉素A5)",
        "gibberellin A9 (赤霉素A9)",
        "gibberellin A13 (赤霉素A13)",
        "salicylic acid (水楊酸)"
      ],
      "Root (rhizome)": [
        "4-ethylglutamic acid (4-乙基谷氨酸)",
        "4-ethylideneglutamic acid (4-亞乙基谷氨酸)",
        "4-ethyl-4-hydroxyglutamic acid (4-乙基-4-羥谷氨酸)",
        "4-methylglutamic acid (4-甲基谷氨酸)",
        "4-methylene-glutamic acid (4-亞甲基谷氨酸)",
        "4-hydroxymethylglutamic acid (4-羥甲基谷氨酸)",
        "4-hydroxy-4-methylglutamic acid (4-羥基-4-甲基谷氨酸)",
        "fatty acids (主要為 octadecadienoic acid/十八碳二烯酸)",
        "sterols (主要為 sitosterol/谷甾醇, campesterol/菜油甾醇)",
        "glucose (葡萄糖)",
        "cane sugar (蔗糖)",
        "fructose (果糖)",
        "starch (澱粉)",
        "oligofructan (寡果聚糖)",
        "cytochrome P450 (細胞色素P450)",
        "agglutinin (凝聚素)"
      ],
      "Leaves": [
        "tuliposide A (郁金香甙A)",
        "tuliposide B (郁金香甙B)",
        "tuliposide C (郁金香甙C)",
        "10-nonacosanol (10-二十九烷醇)",
        "abscisic acid methyl ester (脫落酸甲酯)"
      ]
    },
    "References": [
      "[1] Frohne. D. and Pf鄚der. J. A Colour Atlas of Poisonous Plants. Wolfe 1984 ISBN 0723408394"
    ],
    "Further Reading": [
      "http://www.med126.com/pharm/2009/20090113050710_90411.shtml"
    ],
    "Original Text": "yu_jin_xiang_gen, Complementary and Alternative Healing UniversityComplementary and Alternative Healing University  Home 現代中藥辭典Search this siteList of Health ProblemsChinese Herb DictionaryQigongTraditional Chinese Medicine (TCM)AcupuncturePrescribed Drug DictionaryBiochemistry DictionaryLecture SlidesResearch LibrarianGeneral Online LibrarySearchResearch SitesViagraMassage/AcupressureHypnotherapyTell us what you wantNotify Changes & New Information　　　    　      　　    　　　　　                                          y� jīn xiāng gēn 鬱金香根y� jīn xiāng huā 鬱金香花by: Joe Hing kwok ChuPharmaceutical name:英文藥名﹕Flos Tulipae gesnerianaeRhizome Tulipae gesnerianaeBotanical name:學名﹕Tulipa gesneriana L. C.Pron. in Japanese:日語發音﹕ukonkuPron. in Korean:韓語發音﹕ Pron. in Cantonese::粵音﹕wat1 gam1 heong1Other Names:別名﹕yu xiang 鬱香，hong lan hua 紅藍花，zi shu xiang 紫述香。Common Name:英文名﹕tulipsDistribution:產地﹕Originally grown in Europe, now in most part of China.原產歐洲。我國各地庭園中多有栽培。 Properties(characteristics)﹕性味﹕bitter, acrid, slightly toxic.苦，辛，有小毒。Channels (meridians) entered: 歸經﹕Medical functions:藥理﹕ Alcohol extract of leaves and stems possess inhibiting effect on Bacillus cereus and bacillus mycoides.莖和葉的酒精提取液，對蠟樣芽胞桿菌 (Bacillus cereus)，和蕈狀桿菌 （bacillus mycoides）有抑制作用。Actions & Indications:主治﹕Flowers: for digestive tract yeast infection, flatulence, vomiting or burping with undigested food, abdomen pain, foul smelling breath, tongue with oily, dirty fur.Root being used as sedative. For treatment of manic depression.花：脾胃濕濁﹔胸脘滿悶﹔嘔逆腹痛﹔口臭苔膩根：為鎮靜藥。治臟躁症。Chemical ingredients:化學成份﹕Pollens contain:花粉含:n-heptacosane正-二十七烷iso-heptacosane異-二十七烷isovitexin花被含異牡荊素quercetin-3-glucoside槲皮素-3-葡萄甙quercetin-3-O-β-gentiobioside-7-O-β-glucuronide槲皮素-3-O-β-D-龍膽二糖甙-7-O-β-葡萄糖醛酸甙quercetin-3-O-β-rutinoside-7-O-β-glucuronide槲皮素-3-O-β-芸香糖甙-7-O-β-葡萄糖醛酸甙quercetin-3-O-β-glucoside-7-O-β-glucuronide槲皮素-3-O-β-葡萄糖甙-7-O-β-葡萄糖醛酸甙kaempferol-3-glucoside山柰酚-3-葡萄糖甙kaempferol-3-O-β-gentiobioside-7-O-β-glucuronide山柰酚-3-O-β-龍膽二糖甙-7-O-β-葡萄糖醛酸甙kaempferol-3-O-β-rutinoside-7-O-β-glucuronide山柰酚-3-O-β-芸香糖甙-7-O-β-葡萄糖醛酸甙kaempferol-3-O-β-glucoside-7-O-β-glucuronide山柰酚-3-O-β-葡萄糖甙-7-O-β-葡萄糖醛酸甙Flowers contain: 花含:gibberellin A5,A9,A13赤霉素A5，A9和A13salicylic acid水楊酸Root contains:根莖含:4-ethylglutamic acid4-乙基谷氨酸4-ethylideneglutamic acid4-亞乙基谷氨酸4-ethyl-4-hydroxyglutamic acid4-乙基-4-羥谷氨酸4-methylglutamic acid4-甲基谷氨酸4-methylene-glutamic acid4-亞甲基谷氨酸4-hydroxymethylglutamic acid4-羥甲基谷氨酸4-hydroxy-4-methylglutamic acid4-羥基-4-甲基谷氨酸fatty acids脂肪酸Mainly consists of:主要是:octadecadienoic acid十八碳二烯酸sterols甾醇類Mainly consists of:主要有:sitosterol谷甾醇campesterol菜油甾醇Also contains:還含有:glucose葡萄糖cane sugar蔗糖fructose果糖starch澱粉oligofructan寡果聚糖cytochrome P450細胞色素P450agglutinin凝聚素Leaves contain:葉含:tuliposide A-C郁金香甙A-C10-nonacosanol10-二十九烷醇Also contains:還含:abscisic acid methyl ester止杈酸(脫落酸)甲酯http://www.med126.com/pharm/2009/20090113050710_90411.shtmlDaly Dosage:每日用量﹕Flowers for decoction 3 to 5 g.  For external application: use appropriate amount.Root: 1.5 g to 9 g in pills or in powder form花：内服，煎湯 3～5克。外用適量。根：1.5 克～9克，入丸散。Samples of formulae:處方舉例﹕ Modern Research:現代研究﹕ Toxicity & Cautions:毒素與禁忌﹕The bulb and the flowers have been known to cause dermatitis in sensitive people, though up to 5 bulbs a day can be eaten without ill-effect. [1] It can cause diarrhea in some people if eaten too much. 鬱金香的花與球莖有一定毒性。其葉子和球莖 可能會引起一些人的皮膚出現過敏症狀。 每天食用五颗球莖一般是安全。【1】。過度服食可能引起腹瀉。[1] Frohne. D. and Pf鄚der. J. A Colour Atlas of Poisonous Plants. Wolfe 1984 ISBN 0723408394  Sponsors' Ads by Google 以下為谷歌所提供贊助者之廣告   A manuscript... writing, translating and proofreading  in progressProblems with website? Please Click here for comment. (Not for inquiry )      Click here for inquiry    Copyright Notice 按此看關於 版權問題List of Health ProblemsChinese Herb DictionaryToxicity of Some Herbs Side Effect of Some Herbs Herbs that can be toxic to kidneysTraditional Chinese MedicineTCM DiagnosisSamples of FormulaeTerms of Traditional Chinese MedicineAcupuncturecopy right 版權所有Qigong (chi kung)Prescribed Drug DictionaryEmail our web master for  your suggestion (not for inquiry)Biochemistry DictionaryGeneral Online LibraryQigong classesLecture SlidesResearch LibrarianSearchQigong classesHomeWeather Report DisclaimerLast update: Mar 23, 2010,  10:30 p.m. LAHSearch this site         ",
    "original_url": "http://alternativehealing.org/yu_jin_xiang.htm"
  },
  {
    "Names": {
      "Name": ["gou ji", "狗脊"],
      "Pharmaceutical": ["Rhizoma Cibotii Barometz"],
      "Biological": ["Cibotium barometz (Linn.) J. Sm."],
      "Common": ["chain fern rhizome", "cibota", "cibotum"],
      "Other name": ["jin mao gou ji", "金毛狗脊"],
      "Chinese": ["狗脊"],
      "Pronunciation in Korean": ["kuch'ok"],
      "Pronunciation in Japanese": ["kuseki"],
      "Pronunciation in Cantonese": ["gau2 zik3"],
      "Pinyin Pronunciation": []
    },
    "Type": "Herb",
    "Geography": ["Fujian", "Sichuan", "Yunnan", "Zhejiang"],
    "Properties": ["bitter", "sweet", "warm"],
    "Meridians": ["kidney", "liver"],
    "Maladies Treated": [
      "achy loin and knees due to liver and shenxu (kidney deficient)",
      "rheumatoid arthritis due to liver and shenxu (kidney deficient)",
      "loss of bladder control (gatism)"
    ],
    "Medical Function": [],
    "Dosage": "4.5 - 9 g in decoction. 4.5 ~ 9 克 。 煎服。",
    "Samples of Formulae": "For achy loin and knees due to liver and shenxu (kidney deficient): combine with tu xi zi, niu xi, du zhong etc.\nFor rheumatoid arthritis due to liver and shenxu (kidney deficient): combine with gui zhi, qin jiu, hai feng teng, niu xi etc.",
    "Contraindications": "Not to use in cases of difficulty in urination or heat from yinxu (yin deficient).",
    "Research": "",
    "Notes": "",
    "Chemical Ingredients": {},
    "References": [],
    "Further Reading": [],
    "Original Text": "\n\n\n\n\ngou ji,Complementary and Alternative Healing University\n\n\n\n\n\n\n\n\n\n\n\nComplementary and Alternative Healing University \n\nHome \n\n現代中藥辭典\n\n\n\n\n\n\n\n\n\n\n\n\n\n\n\nSearch this site\n\n\n\n\n\nList of Health Problems\n\n\n\n\n\nChinese Herb Dictionary\n\n\n\n\n\nQigong\n\n\n\n\n\nTraditional Chinese Medicine (TCM)\n\n\n\n\n\nAcupuncture\n\n\n\n\n\nPrescribed Drug \n            Dictionary\n\n\n\n\nBiochemistry \n            Dictionary\n\n\n\n\n\nLecture Slides\n\n\n\n\n\n            Research Librarian\n\n\n\n\n\nGeneral Online Library\n\n\n\n\n\nSearch this site\n\n\n\n\n\nResearch Sites\n\n\n\n\n\nViagra\n\n\n\n\n\nMassage/Acupressure\n\n\n\n\n\nHypnotherapy\n\n\n\n\n\nTell us what you want \n\n\n\n\n\nNotify Changes & New Information\n\n\n\n　\n　\n　\n \n \n \n \n　\n \n \n \n \n \n \n　\n　\n \n \n \n \n　\n　\n　\n　\n　\n \n \n \n \n\n\n\n\n\n\n\n\n\n\n\n\n\n\n         \n\ngou ji \n狗脊 \n\n\n\n\nby: Joe Hing kwok Chu\n\n\n\n\n\n    Pharmaceutical name:\n    英文藥名﹕\n\nRhizoma Cibotii Barometz \n\n\n\nBotanical name:\n\n    學名﹕\n\nCibotium barometz (Linn.) J. Sm.\n\n\n\nPron. in Japanese:\n日語發音﹕\n\nkuseki\n\n\n\nPron. in Korean:\n韓語發音﹕\n\nkuch'ok\n\n\n\n\nPron. in Cantonese:\n粵音﹕\n\n    gau2 zik3\n\n\n\n\n        \n        Other Names:\n\n        \n        別名﹕\n\njin mao gou ji,  金 毛 狗 脊 \n\n\n\nCommon Name:\n英文名﹕\n\nchain fern rhizome, cibota, cibotum\n\n\n\nDistribution:\n產地﹕\n\nFujian, Sichuan, Yunnan, Zhejiang\n福 建 ﹐ 四 川 ﹐  雲  南 ﹐  浙 江 。 \n\n\n\nProperties\n(characteristics)﹕\n性味﹕\n\nbitter, sweet, warm.\n            苦 ﹐ 甘 ﹐  溫 。 \n\n\n\nChannels (meridians)\n      entered:\n \n\n    歸經﹕\n\nkidney, liver.腎 ﹐ 肝 。 \n        \n\n\n\n\n\n        Medical functions:\n\n        藥理﹕ \n\n             \n\n\n\nActions & Indications:\n\n    主治﹕\n\n\nachy loin and knees due to liver and \n          shenxu \n          (kidney deficient)  \nrheumatoid arthritis due to liver and \n          shenxu \n          (kidney deficient)  \nloss of bladder control (gatism)\n\n \n\n\n\n腎虛肝不足﹐腰膝痠痛。\n\n\n腎虛肝不足﹐濕痺痛。\n\n\n腎虛肝不足﹐ 小便失禁 。\n          \n\n\n\n\n\n\n    Chemical ingredients:\n\n    化學成份﹕\n\n     \n\n\n\nDosage:\n用量﹕\n\n\n        4.5 - 9 g in decoction.4.5 ~ 9 克 。 煎服。\n\n\n\nSamples \n    of formulae:處方舉例﹕\n\n\nachy loin and knees due to liver and \n          shenxu \n          (kidney deficient) : combine with tu xi zi, niu xi, du zhong etc.\nrheumatoid arthritis due to liver and \n          shenxu \n          (kidney deficient)  : combine with gui zhi, \n          qin jiu, hai feng teng, niu xi etc.\n\n        \n         \n \n\n          腎虛肝不足\n          腰膝痠痛，常與菟絲子、牛膝、杜仲等品配伍。\n \n\n          腎虛肝不足\n          風濕痺痛,  常與桂枝、秦艽、海風藤、牛膝等配伍應用。\n\n \n\n\n\nModern Research:\n\n    現代研究﹕\n\n     \n\n\n\n\nToxicity & Cautions:\n\n毒素與禁忌﹕\n\nnot to use in cases of difficulty in urination or heat \n    from yinxu (yin \n    deficient) \n\n小 便 不 利 ﹐ 或\n  \n      \n      陰虛 有 熱 者 禁忌 \n        用 。\n        \n\n\n\n\n        　\n\n         \n\n\n\n\n\n\nA manuscript... writing, translating and proofreading  in progress\n\n         \n\n\n\nClick here for inquiry \n \n\n\nCopyright Notice 按此看關於版權問題\n\n\n\n\n\n\n              List of Health Problems\n\n\n\n\n              Chinese Herb Dictionary\n\n\n\n\n            Toxicity\n            of Some Herbs   \n\n\n\nSide\n            Effect of Some Herbs   \n\n\nHerbs that can be toxic to \n            kidneys\n\n\n\n\n              Traditional Chinese Medicine \n\n\nTCM Diagnosis\n              \n\n\nSamples of Formulae\n\n\n\n\n              Acupuncture\n\n\n\n\n\n\ncopy right\n \n\n\n版權所有\n\n\n\nQigong (chi kung)\n\n\n\n\n              Prescribed Drug Dictionary\n\n\nEmail our web master for  \n              your suggestion (not for inquiry)\n\n\n\nBiochemistry Dictionary\n\n\n\n\n\nGeneral Online \n              Library\n\n\n\n\n              Qigong classes\n\n\n\nLecture Slides\n\n\n\nResearch \n              Librarian\n\n\n\nSearch\n\n\n\n\n\nQigong classes \n\n\n\n\n\n\nHome\n\n\nWeather Report\n\n\n\n\n                  Disclaimer\n\n\n\n\n\n\n\n\nLast update: Mar 18, 2008; 3:17 p.m. \nLAH\n\n\n\n\n\n\n\n\n\n\nSearch this site     \npowered by FreeFind\n\n\n\n\n\n\n\n\n\n\n\n\n\n\n\n\n\n\n\n\n\n\n\n\n\n\n\n",
    "original_url": "http://alternativehealing.org/gou_ji.htm"
  }
]
