[
    {
        "Names": {
            "Name": [
                "qing hao su",
                "青蒿素"
            ],
            "Pharmaceutical": [
                "Arteannuin",
                "Artemisinin",
                "huang hao su (黃蒿素)",
                "Arteannuin"
            ],
            "Biological": [],
            "Chemical": [
                "Artemisinin",
                "huang hao su (黃蒿素)"
            ],
            "Common": [],
            "Other name": [],
            "Chinese": [
                "青蒿素",
                "黃蒿素"
            ],
            "Pronunciation in Korean": [],
            "Pronunciation in Japanese": [],
            "Pronunciation in Cantonese": [],
            "Pinyin Pronunciation": []
        },
        "Type": "Chemical",
        "Geography": [
            "China",
            "Developed at Pharmacology School of Beijing Medical School"
        ],
        "Properties": [],
        "Meridians": [],
        "Maladies Treated": [
            "Malaria that recurs every other day",
            "CNS type of malaria",
            "Malaria that has developed resistance to Chloroquine"
        ],
        "Medical Function": [
            "Very effective anti malaria chemical ingredient derived from qing hao (Artemisia annua)",
            "Combining usage of qing hao su (Artemisinin) and Chloroquine can drop the relapse rate of malaria to about 10%",
            "For malaria caused by drug-resistant strains",
            "High efficacy, quick effect, and low toxicity in the treatment of malaria",
            "Qing hao su isolated from Artemisia annua in 1972, showed 100% inhibition rate of Plasmodium (malaria parasite) in mice and monkeys",
            "Clinical studies consistent with laboratory results: artemisinin is a new type of anti-malarial drug, exhibiting high efficacy, quick effect and low toxicity"
        ],
        "Dosage": "Deep muscle injection: first time 200 mg, 6 to 8 hours later, another 100 mg, 2nd and 3rd day 100 mg. total dosage 500 mg. In serious cases, another dosage of 100 mg on the 4th day. Or use daily of 300 mg per day, total of 900 mg. Small children: 15 mg/kg and finish the dosages in 3 days.\n\nOral application: First take 1 g. After 6 to 8 hours take another 0.5 g. On 2nd and 3rd day take 0.5 g per day. Use it for 3 days. Total dosage is 2.5 g. Small children: 15 mg/kg. Use it for 3 days.",
        "Samples of Formulae": "Combining use of qing hao su (Artemisinin) and Chloroquine in malaria therapy drops relapse rate to about 10%.",
        "Contraindications": "",
        "Research": "Qing hao su (Artemisinin) was first extracted from huang hua hao (yellow flower hao, Artemisia annua) in 1971, Beijing Medical School. Over 380 mouse malaria screening tests were conducted, and in October 1971, successful results were achieved with Artemisia annua against malaria. Artemisinin isolated from Artemisia annua in 1972 showed a 100% inhibition rate for Plasmodium (malaria parasite) in mice and monkeys. Clinical studies in 1973 found results consistent with those in the laboratory. In 1981, an international symposium on artemisinin was held in Beijing, sponsored by the World Health Organization. At this conference, its unique chemical structure—a sesquiterpene lactone with a peroxide bridge—was discussed as significant for future drug synthesis. In 1986, artemisinin and later dihydroartemisinin were granted new drug certificates in China. These achievements received the National Invention Award and National Top Ten Science and Technology Achievements Award.",
        "Notes": "Malaria is known as an ancient and common disease in China, with records dating back to the 12th century BC. The earliest mention of using qing hao (Artemisia annua) for malaria treatment was in 340 AD, in the medical text 'Emergency Prescriptions Kept Up One's Sleeve' by Ge Hong (281–341 AD), a well-known medical scientist and alchemy chemist of the East Jin dynasty. The invention of artemisinin benefits greatly from traditional Chinese medicine. Artemisinin is a sesquiterpene lactone compound with a peroxide bridge, providing a novel class of anti-malarial drugs. Artemisinin and its derivatives are considered effective tools in the global fight against malaria, saving thousands of lives every day, and contributing significantly to world medicine. In 1998, the 51st World Health Assembly advocated \"Control of Malaria\" for the 21st century, recognizing artemisinin and its derivatives as important weapons in malaria prevention.",
        "Chemical Ingredients": {
            "Artemisinin": "Isolated from Artemisia annua; sesquiterpene lactone with a peroxide bridge"
        },
        "References": [
            "http://www.sina.com.cn 2003年12月04日14:08 科技日报",
            "World Health Organization, International Symposium on Artemisinin, Beijing, October 1981"
        ],
        "Further Reading": [],
        "Original Text": "\n\n\n\nqinghaosu, Complementary and Alternative Healing University\n\n\n\n\n\n\n\n\nComplementary and Alternative Healing\nUniversity\n Home\n         中 \n        藥詞典\n\n\n\n\n\n\n\n\n\n\n\n\n\n\n\n\n\n\n\n\n\n\n\n\n\n                  Search this site powered by\n                  \n                  FreeFind\n\n\n\n\n\n\n\n\n\n\n\n\n\n\nSearch this site\n\n\n\n\n\n\nList \n        of Health Problems\n\n\n\n\n\n\nChinese \n        Herb Dictionary\n\n\n\n\n\n\nQigong\n\n\n\n\n\n\n\n        Traditional Chinese Medicine (TCM)\n\n\n\n\n\n\n\n        Acupuncture\n\n\n\n\n\n\n\n        Prescribed Drug Dictionary\n\n\n\n\n\nBiochemistry \n        Dictionary\n\n\n\n\n\n\nLecture Slides\n\n\n\n\n\nResearch Librarian\n\n\n\n\n\n\nGeneral \n        Online Library\n\n\n\n\n\n\nSearch this site\n\n\n\n\n\n\nResearch Sites\n\n\n\n\n\n\n\n        Viagra\n\n\n\n\n\n\nMassage/Acupressure\n\n\n\n\n\n\nHypnotherapy\n\n\n\n\n\n\nTell us what you want\n\n\n\n\n\n\nNotify Changes \n        & New Information\n\n\n\n\n　\n\n\n\n\n\n\n\n    　\n\nqing hao su 青蒿素\n　\n\n\nTranslated and compiled \n\n\n    by: Joe Hing kwok Chu\n\n\n\n\n\nQing hao su (qinghaosu), also known as Arteannuin, \n    is a very effective anti malaria chemical ingredient derived from the herb\n    qing hao. It  \n    was first extracted from the herb huang hua hao (yellow flower hao) and the \n    chemical ingredient is called huang hao su (黃蒿素) or Artemisinin.\n\n\n\n\n\nThis herb was developed after the then most \n    effective anti malaria drug Chloroquine (Chloroquine Diphosphate) developed \n    drug resistance in malaria therapy during the Vietnam War period. The herb qing \n    hao su was developed in the Pharmacology School of Beijing Medical School in \n    1971.\n\n\n\n\nApplication:\n\n\n\n\nespecially for malaria \n      that recurs every other day,\n\n\n\n\nCNS type of malaria, also\n\n\n\n\neffective for malaria that has developed \n      drug resistance of Chloroquine.\n\n\n\nThe combining usage of \n    qing hao su and Chloroquine can drop the relapse rate to about 10%.\n\n\n\n\n\nDosage:\n\n\n\nDeep muscle injection: first time 200 mg, 6 to 8 hours \n      later, another  100 mg,  2nd and 3rd day 100 mg. total dosage 500 \n      mg. In serious cases, another dosage of 100 mg on the 4th day. Or use daily \n      of 300 mg per day, total of 900 mg. Small children: 15mg/kg and finished the \n      dosages in 3 days\n\n\n\nOral application: First take 1 g. After 6 to 8 hours take \n      another 0.5 g. On 2nd and 3rd day take  0.5g per day. Use it for 3 days. \n      Total dosage is 2.5 g. Small children: 15 mg/kg. Use it for 3 days.\n\n\n\nSee \n    mosquito repelling methods.\nSponsors' Ads by Google 以下為谷歌所提供贊助者之廣告\n\n\n　\n\nThe following will be translated:\nhttp://www.sina.com.cn 2003年12月04日14:08 科技日报\n屠呦呦﹐\n\n中國中醫研究院青蒿 與青蒿素研究中心主任\n　　20世\n    纪60年代越南 戰火瀰漫，瘧疾也大肆流行。當時，瘧原虫對王牌抗瘧藥氯喳產生了抗藥性，致使全球瘧疾的年發病人数達到数憶，病人死亡率急 劇上升。為此尋找新�遣c類型的抗瘧藥成為全球棘手的熱點和難點，人們對此進行了大量工作而未獲得\n    满意结果。在 這一背景下，我們於1969年開始了抗瘧藥研究。　瘧疾對世界來講是常見病，在中 \n    國還是一種古老的疾病，早在公元前12世 紀就有記載。我畢業於北京醫學院藥學系，工作後系統地 \n    學習過中醫藥。這使我�鶣H中醫藥學是一個偉大的寶庫，有許多值得我們努力探索的精華。我們經系統收集歷代醫籍、本草，從中整理歸\n    纳出200多方藥。歷經380多次樣品的鼠瘧篩選，1971年10月�� \n    於在經歷大量失敗後取得中藥青蒿抗瘧篩選的成功。中藥青\n    蒿治療瘧疾最早見於公元340年 \n    間的 \n    東晉《肘後備急方》，作者是東晉醫學家和練丹化學家葛洪(281-341AD)。青蒿素的發明就是得益於傳統中醫藥學。1972年從中藥青蒿中分離得到抗瘧有效單體，命名為青蒿素，對鼠瘧、猴瘧的原虫抑制率達到l00%。1973年經臨床研究取得與實驗室一致的結果，抗 \n    瘧新藥青蒿素由此誕生。青蒿素是具有過氧基團的倍半萜內酯化合物，正是我們苦苦尋找的全新�遣c類型的抗 \n    瘧藥。這充分�鰫�具有悠久歷史的中國醫藥學確有精華，經過繼承發揚﹐發掘提高，是可以為豐富世界醫學做出重要貢?的。青蒿素對瘧疾具有\"高效、速效、低毒\"的突出 \n    療效。1981年10月在中國北京召開的由世界衛生組織等主辦的首次\\\"青蒿素專題\\\"國際會議上，我曾以《青蒿素的化學研究》為題發言，引起與會代表的極大興趣，並認為\\\"這一新的發現更重要的意義是在於發現這種化合物 \n    獨特的化學結構，它將為進一步設計合成新藥指出方同 \n    \\\"。1986年，青蒿素獲得一類新藥證書，其後雙氫青蒿素也獲一類新藥證書。這些成果分別獲得國家發明獎和全國十大科技成就獎。\n    　　1998年，世界衛生組織第51屆大 會提出了在21世 紀\\\"控制瘧疾\\\"的響亮口號。青蒿素和它的衍生物就是我們的戰鬥武器，我 \n    們願這一發明每天能把數千危難中的人們從死亡線上挽救回來。作為青蒿素的發明者，我衷心希望它在新的世 紀為人 類健康做出新的貢獻，使我們的明天更加美好!\n    　　(本文作者為中國中醫研究院青蒿 與青蒿素研究中心主任，本文系作者在第二次世界知識產權組織創造力與發明國際論壇上的發言。)\n\n看驅蚊法。\n\n\n\n\n\n\nA manuscript... writing, translating and proofreading  in         \n        progress\n\n        　\n\nProblems with website? Please \n\nClick \n        here for comment. (Not for inquiry )     \n        \n\n\nClick \n        here for inquiry \n        \n\n        　\n\n\nCopyright Notice 按此看關於 版權問題\n\n\n\n\n\n\n            List of Health Problems\n\n\n\n\n\n            Chinese Herb Dictionary\n\n\n\n\n\nToxicity of Some Herbs\n\n\n\nSide Effect of Some Herbs\n\n\n\nHerbs that can be toxic to kidneys\n\n\n\n\n\n            Traditional Chinese Medicine\n\n\nTCM Diagnosis\n\n\nSamples \n            of Formulae\n\n\n\n\n\n            Terms of Traditional Chinese Medicine\n\n\n\n            Acupuncture\n\n\n\n\n\n\ncopy right\n\n            　\n\n\n版權所有\n\n\n\n\nQigong \n            (chi kung)\n\n\n\n\n\n            Prescribed Drug Dictionary\n\n\n\n\n\n            Email our web master for  your suggestion (not for inquiry)\n\n\n\n\nBiochemistry Dictionary\n\n\n\n\n\n\nGeneral Online Library\n\n\n\n\nQigong classes\n\n\n\n\nFake \n            Email Warning\n\n\n\n\nResearch Librarian\n\n\n\n\nSearch\n\n\n\n\n\n\nQigong classes\n\n\n\n\n\n\n\n\n\nHome\n\n\n\n\n\n            Weather Report\n\n\n\n    \n\nDisclaimer\n\n\n\n\n\n\n\n\n\nLast update: \n \nSept 15, 2009;\n1:15 p.m. \nLAH\n\n\n\n\n\n\n\n\n\n",
        "original_url": "http://alternativehealing.org/qing_hao_su.htm"
    },
    {
        "Names": {
            "Name": [
                "she gan"
            ],
            "Pharmaceutical": [
                "Rhizoma belamcandae"
            ],
            "Biological": [
                "Belamcanda chinensis (L.) DC."
            ],
            "Chemical": [],
            "Common": [
                "blackberry lily rhizome"
            ],
            "Other name": [
                "wu shan 烏扇",
                "wu pu 烏蒲",
                "huang yuan 黃遠",
                "wu sha 烏萐",
                "ye gan 夜幹",
                "wu sha 烏翣",
                "wu chui 烏吹",
                "cao jian 草薑",
                "gui shan 鬼扇",
                "feng yi 鳳翼",
                "xian ren zhang 仙人掌",
                "zi jin niu 紫金牛",
                "ye xuan hua 野萱花",
                "bian zhu 扁竹",
                "di bian zhu 地萹竹",
                "jiao jian cao 較剪草",
                "huang hua bian xu 黃花扁蓄",
                "ka hou jian 開喉箭",
                "huang zhi mu 黃知母",
                "jiao jian lan 較剪蘭",
                "jian dao gu 剪刀梏",
                "leng shui dan 冷水丹",
                "leng shui hua 冷水花",
                "bian zhu lan 扁竹蘭",
                "jin hu die 金蝴蝶",
                "jin jiao jian 金絞剪",
                "zi liang jiang 紫良薑",
                "tie bian dan 鐵扁擔",
                "liu jia hua 六甲花",
                "san ba cao 扇把草",
                "yu ci cao 魚翅草",
                "san pu san 山蒲扇",
                "jian dao cao 剪刀草",
                "lao jun san 老君扇",
                "gao shou shan 高搜山",
                "feng huang cao 鳳凰草"
            ],
            "Chinese": [
                "射幹",
                "寸幹"
            ],
            "Pronunciation in Korean": [
                "sagan"
            ],
            "Pronunciation in Japanese": [
                "yakan"
            ],
            "Pronunciation in Cantonese": [
                "se6 gon3"
            ],
            "Pinyin Pronunciation": []
        },
        "Type": "Herb",
        "Geography": [],
        "Properties": [
            "cold",
            "bitter",
            "slightly toxic"
        ],
        "Meridians": [
            "Lung"
        ],
        "Maladies Treated": [
            "cough with wheezing",
            "carbuncles and boils",
            "咽喉腫痛 (swollen and painful throat)",
            "咳逆上氣 (cough with counterflow qi ascending)",
            "痰涎壅盛 (abundant phlegm and saliva accumulation)",
            "瘰鬁結核 (scrofula, lymph node tuberculosis)",
            "瘧母 (chronic malaria with splenomegaly)",
            "閉經 (amenorrhea)",
            "癰腫瘡毒 (carbuncles, ulcers, and toxic swelling)",
            "chyluria (for she gan rhizome)",
            "chronic chyluria (she gan rhizome with chuan xiong [ligusticum wallichii root] and chi shao [red peony root])",
            "chyluria with blood in urine (she gan rhizome with sheng di [rehmannia glutinosa] and xian he cao [agrimony] each 15g)"
        ],
        "Medical Function": [
            "Phytoestrogens derived from Belamcanda chinensis have an antiproliferative effect on prostate cancer cells in vitro",
            "Tectorigenin extracted from Belamcanda chinensis rhizome can inhibit the proliferation of prostate cancer cells in vitro",
            "In animal experiments, tectorigenin has the effect of slowing the spread of prostate cancer cells"
        ],
        "Dosage": "",
        "Samples of Formulae": "yin qiao san (Yin Qiao Powder)\n\n Treating chyluria: she gan 15 g, boiled with water and add some sugar to taste. Make into 3 serving per day. Or make it into pills with water. Take 4 g each time, 3 times per day. 10 days is one therapy period. For chronic sickness, add chuan xiong 9 g, chi shao 12 g. For blood in the urine add sheng di, xian he cao 15 g each. Result: Treated 104 patients. Healed: 94 patients. Not effective: 10 patients. Among the healed, 9 had relapses within 1 to 6 months. After continuing with the above formula for one therapy period, all healed and no relapses. ",
        "Contraindications": "This herb may cause diarrhea.\n\nNot to use during pregnancy, or for cases without excess heat infection, or in those with pixu (spleen deficiency) with diarrhea.",
        "Research": "Phytoestrogens derived from Belamcanda chinensis have an antiproliferative effect on prostate cancer cells in vitro.\n\nTectorigenin extracted from the rhizome of Belamcanda chinensis can inhibit the proliferation of prostate cancer cells in vitro.\n\nIn animal experiments, tectorigenin from Belamcanda chinensis also slows the spread of prostate cancer cells.",
        "Notes": "",
        "Chemical Ingredients": {
            "": []
        },
        "References": [
            "[1] 李象復等，中醫雜誌 ，1981，（5） 44",
            "[2] J. Urol. 2004 Dec;172(6 Pt 1):2426-33."
        ],
        "Further Reading": [],
        "Original Text": "she gan,Complementary and Alternative Healing UniversityComplementary and Alternative Healing University  Home  現代 中藥辭典Search this siteList of Health ProblemsChinese Herb DictionaryQigongTraditional Chinese Medicine (TCM)AcupuncturePrescribed Drug DictionaryBiochemistry DictionaryLecture SlidesResearch LibrarianGeneral Online LibrarySearchResearch SitesViagraMassage/AcupressureHypnotherapyTell us what you wantNotify Changes & New Information　　　    　      　　          　           　     she gan 射幹 by: Joe Hing kwok Chu  朱興國譯Modern Application:現代應用：Treating chyluria: she gan 15 g, boiled with water and add some sugar to taste. Make into 3 serving per day. Or make it into pills with water. Take 4 g each time, 3 times per day. 10 days is one therapy period. For chronic sickness, add chuan xiong 9 g, chi shao 12 g. For blood in the urine add sheng di, xian he cao 15 g each. Result: Treated 104 patients. Healed: 94 patients. Not effective: 10 patients. Among the healed, 9 had relapses within 1 to 6 months. After continuing with the above formula for one therapy period, all healed and no relapses.治療乳糜尿：射幹15 克，水煎，加白糖適量。每天分三次服。或制成水丸。每次服4克。每 天三次。10天為一療程。病程長者加川芎9克，赤芍12克；血尿者加生地，仙鶴草各15克。共治療乳糜尿104例，痊愈94例，無效10例。痊愈 者之中有9例1～6月復發。繼續服上藥一療程後未再復發。[1] Pharmaceutical name:英文藥名﹕Rhizoma belamcandaeBotanical name:學名﹕Belamcanda chinensis (L.) DC.Pron. in Japanese:日語發音﹕yakanPron. in Korean:韓語發音﹕saganPron. in Cantonese:粵音﹕se6 gon3Other Names:別名 ﹕wu shan 烏扇，wu pu 烏蒲 ，huang yuan 黃遠 ，wu sha 烏萐 ，ye gan 夜幹 ，wu sha 烏翣，wu chui 烏吹，cao jian 草薑，gui shan 鬼扇 ，feng yi  鳳翼，xian ren zhang 仙人掌，zi jin niu 紫金牛 ，ye xuan hua 野萱花，bian zhu 扁竹 ，di bian zhu 地萹竹 ，jiao jian cao 較剪草，huang hua bian xu 黃花扁蓄，ka hou jian 開喉箭，huang zhi mu 黃知母 ，jiao jian lan 較剪蘭，jian dao gu 剪刀梏 ，leng shui dan 冷水丹，leng shui hua 冷水花 ，bian zhu lan 扁竹蘭 ，jin hu die 金蝴蝶，jin jiao jian 金絞剪 ，zi liang jiang 紫良薑，tie bian dan 鐵扁擔 ，liu jia hua 六甲花，san ba cao 扇把草，yu ci cao 魚翅草 ，san pu san 山蒲扇，jian dao cao 剪刀草，lao jun san 老君扇，gao shou shan 高搜山，feng huang cao 鳳凰草處方名：射幹，寸幹Prescription names: she gan 射幹，cun gan 寸幹.Common Name:英文名﹕blackberry lily rhizomeDistribution:產地﹕ Properties(characteristics)﹕性味﹕cold, bitter, slightly toxic.寒 ，苦，有小毒。Channels (meridians) entered: 歸經﹕lung肺Medical functions:藥理﹕  Actions & Indications:主治﹕being used in swollen and painful throat, cough with wheezing, abundance of phlegm, tuberculosis of lymph nodes, carbuncles and boils.[2]治咽 喉腫痛，咳逆上氣，痰涎壅盛，瘰鬁結核，瘧母，閉經，癰腫瘡毒。Chemical ingredients:化學成份﹕ Dosage:用 量﹕ Samples of formulae:處方 舉例﹕yin qiao san 銀翹散Modern Research:現代研究﹕Phytoestrogens Derived from Belamcanda Chinensis Have an Antiproliferative Effect on Prostate Cancer Cells in Vitro在體外實驗，射干的根莖中提取的鳶尾黃素可抑制前列腺癌細胞的生長。在動物實驗 中，鳶尾黃素也能起到減緩前列腺癌細胞擴散的作用。   Toxicity & Cautions:毒素與禁忌﹕this herb may cause diarrhea. Not to use during pregnancy or no infection with heat, or in cases of pixu (spleen deficient) with diarrhea.本品易致瀉。孕婦忌用，無實火，脾 虛便溏者不 宜用。[1] 李象復等，中醫雜誌 ，1981，（5） 44[2] J. Urol. 2004 Dec;172(6 Pt 1):2426-33.  Sponsors' Ads by Google 以下為谷歌所提供贊助者之廣告 A manuscript... writing, translating and proofreading  in progress Click here for inquiry  List of Health ProblemsChinese Herb DictionaryToxicity of Some HerbsSide Effect of Some HerbsHerbs that can be toxic to kidneysTraditional Chinese MedicineTCM DiagnosisSamples of FormulaeAcupuncturecopy right 版權所有Qigong (chi kung)Prescribed Drug DictionaryEmail our web master for  your suggestion (not for inquiry)Biochemistry DictionaryGeneral Online LibraryQigong classesLecture SlidesResearch LibrarianSearchQigong classesHomeWeather Report    DisclaimerLast update: Jan 26, 2010; 4:20 p.m. LAHSearch this site         ",
        "original_url": "http://alternativehealing.org/she_gan.htm"
    },
    {
        "Names": {
            "Name": [
                "huang lian",
                "xuan hu lian"
            ],
            "Pharmaceutical": [
                "Rhizoma Coptidis (huang lian)",
                "Rhizoma Picrorhizae (xuan hu lian)"
            ],
            "Biological": [
                "Coptis chinensis Franch. (huang lian)",
                "Coptis deltodea C.Y Cheng et Hsiao (huang lian)",
                "Coptis teeta Wall. (huang lian)",
                "Coptis quiquefolia Mig. (Taiwan huang lian)",
                "Picrorhiza scrophulariifolia Pennell (xuan hu lian)",
                "Picrorhiza kurrooa Royle ex Benth. (xuan hu lian)"
            ],
            "Common": [
                "coptis rhizome (huang lian)",
                "Figwortflower",
                "Picrorhiza Rhizome (xuan hu lian)"
            ],
            "Other name": [
                "chuan lian (川蓮)",
                "wei lian (味蓮, Coptis chinensis Franch.)",
                "ya lian (雅蓮, Coptis deltodea C.Y Cheng et Hsiao)",
                "yun lian (雲蓮, Coptis teeta Wall.)"
            ],
            "Chinese": [
                "黃連",
                "宣胡連"
            ],
            "Pronunciation in Korean": [
                "hwang lyon"
            ],
            "Pronunciation in Japanese": [
                "o ren"
            ],
            "Pronunciation in Cantonese": [
                "wong4 lin4"
            ],
            "Pinyin Pronunciation": []
        },
        "Type": "Herb",
        "Geography": [
            "huang lian: Sichuan, Xizang (Tibet), Hubei, Jiangxi, Shanxi",
            "xuan hu lian: Yunnan, Xizang (Tibet), Nepal, India"
        ],
        "Properties": [
            "bitter in taste",
            "cool"
        ],
        "Meridians": [
            "heart",
            "large intestine",
            "liver",
            "stomach"
        ],
        "Maladies Treated": [
            "relief of heat toxicity",
            "indigestion",
            "diabetes",
            "inflammation of intestine",
            "diarrhea caused by bacterial infection",
            "high fever",
            "restlessness and insomnia",
            "spitting blood",
            "nose bleeding due to heat in blood",
            "red eyes and excess stomach acid",
            "tooth ache",
            "boils",
            "external use: inflammation of the cornea",
            "external use: middle ear infection",
            "external use: ulceration of tongue and mouth",
            "external use: external ear infection",
            "external use: eczema",
            "Jiu huang lian (酒黃連): heat in the upper part of the body like red eyes, sores in the mouth",
            "Jiang huang lian (薑黃連): clearing the stomach, stop vomiting; coldness and heat intertwined in the abdomen area",
            "Yu huang lian (萸黃連): relieving the liver, stop vomiting; liver and stomach not in harmony, vomiting and excess stomach acid",
            "For damp-heat, swelling of liver and spleen, jaundice, indigestion, diabetes, vomiting and diarrhea, high fever, clouded mind, hyperactive heart fire, restlessness, insomnia, blood heat with spitting and nose bleeds, red eyes, aching eyes, tooth pain, swelling, boils",
            "External: wet sores, pus in the ear canal"
        ],
        "Medical Function": [
            "antibiotic and anti-amoeba",
            "effect on heart and blood vessels: small amount improves coronary blood vessel circulation while large amount suppresses it",
            "protects heart muscles in case of lack of blood circulation and anti arrhythmia",
            "relaxes blood vessels",
            "anti platelet coagulation",
            "shrinks red blood cells",
            "lowers blood sugar",
            "small amount improves function of acetylcholine while large amount suppresses it",
            "decoction of huang lian 5mg/ml/1 hr, kills 99.8% of H. pylori in vitro",
            "calcium channel blocker and it can prolong purkinje’s fibre and ventricular muscle cell action potential duration and effective refractory period",
            "third class antiarrhythmic drug, with no observed arrhythmogenic nor obvious side effect"
        ],
        "Dosage": "1.5 to 20 g. Concentrated extract: 0.5 g to 2 g.\n1.5～20克；濃縮中藥：0.5～2 克",
        "Samples of Formulae": "huang lian e jiao tang (Huang Lian & Ass-hide Gelatin Decoction)\nsan huang xie xin tang (Three Yellows Decoction for Draining Heart Fire)",
        "Contraindications": "It is being used in wind-heat type of cold or flu. Not to be used in cases of wind-cold type of cold or flu and deficient type of syndromes.\nNormal dosage is relatively safe with few side effects and no adverse effects from long term use. Large dosage can be toxic.\nNot to use in patients with glucose-6-phosphate dehydrogenase deficiency.\nClinical experiences and laboratory studies show that the toxic reactions include:\nacute deprivation of oxygen of the brain due to cardiac function\nshock due to allergenic reaction\nrash\ndizziness, tinnitus, nausea, vomiting, anxiety and fright, shortness of breath, joint pain\ndiarrhea, flatulence, rumbling noise in the intestines, frequent urination\ndecrease of heme and blood cells\nreport of sudden stoppage of circulation and breathing due to venous feeding of injections of huang lian",
        "Research": "Decoction of huang lian 5mg/ml/1 hr, kills 99.8% of H. pylori in vitro. [1]\nHuang lian possesses calcium channel blocker activity and can prolong Purkinje’s fibre and ventricular muscle cell action potential duration and effective refractory period. [2]\nHuang lian belongs to the third class of antiarrhythmic drugs, and no arrhythmogenic or significant side effects have been found. [3]",
        "Notes": "Hu huang lian (Picrorhiza scrophulariifolia Pennell) belongs to controlled material of CITES (Convention on International Trade in Endangered Species of Wild Fauna and Flora), under appendix II (permit required for import and export trade).",
        "Chemical Ingredients": {
            "huang lian (Coptis spp.) rhizome": [
                "berberine (C20H17NO3)",
                "colchicine (C21H25NO5)",
                "coptisine (C19H15NO5)",
                "worenine (C21H15NO4)",
                "palmatine (C22HC24 H24O5 N.OHO5NOH)",
                "jatrorrhizine",
                "magnoflorine"
            ],
            "xuan hu lian (Picrorhiza scrophulariifolia Pennell) root": [
                "kutkin 3.4%",
                "D-Mannitol 0.5%",
                "Vanillic acid 0.1%",
                "Kutkiol",
                "Kutkisterol 0.18%",
                "Apocynin",
                "Kutkin is a stable crystallized mixture of Picroside I and Kutkoside and contains Picroside II"
            ],
            "xuan hu lian (Picrorhiza scrophulariifolia Pennell) fruits": [
                "vitamin C",
                "sugar",
                "starch",
                "protein"
            ],
            "xuan hu lian (Picrorhiza scrophulariifolia Pennell) roots and stems": [
                "iridoid glycosides including picroside I, II, III",
                "free organic acids: vanillic acid, cinnamic acid, ferulic acid"
            ]
        },
        "References": [
            "[1] 四川省农业信息工程技术研究中心",
            "[2] 馬英，朱飛奇．黃連素的藥理研究進展及在心血管、神經系統疾病的應用前景[J]．鄖陽醫學院學報，2006，25(6)：377",
            "[3] Zong XH， Zeng XJ， LiYY， et a1．Efficacy and safety of berberine for congestive heart failure secondary to ischemic or idiopathic dilated cardiomyopathy [J ]． Am J Cardiol，2003，92 (2)：173-176"
        ],
        "Further Reading": [],
        "Original Text": "huang lian, Coptis chinensis, Complementary and Alternative Healing University     現代中藥辭典Complementary and Alternative Healing University  Discussion Form中藥詞典; Chinese Herb Dictionary;  Search this site;   在本網站找資料; Search this siteList of Health ProblemsChinese Herb DictionaryQigongTraditional Chinese Medicine (TCM)AcupuncturePrescribed Drug DictionaryBiochemistry DictionaryLecture SlidesResearch LibrarianGeneral Online LibraryResearch SitesViagraMassage/AcupressureHypnotherapyTell us what you wantNotify Changes & New Information  huang lian 黃連; xuan hu lian 宣胡連 By: Joe Hing Kwok Chu Pharmaceutical name:Rhizoma Coptidis (huang lian)Rhizoma Picrorhizae (xuan hu lian)Biological name:拉丁學名﹕huang lian:Coptis chinensis Franch.Coptis deltodea C.Y Cheng et HsiaoCoptis teeta Wall.Coptis quiquefolia Mig. (台灣黃連)xuan hu lianPicrorhiza scrophularfifolia Pennell (胡黃連)Picrorhiza kurrooa Royle ex Benth.(印度胡黃連)Other names:別名：chuan lian,川 蓮，wei lian 味 蓮  (Coptis chinensis Franch.),ya lian 雅 蓮 (Coptis deltodea C.Y Cheng et Hsiao) ,yun lian雲 蓮  (Cotis teeta Wall.)Pron. in Japanese:日語發音：o renPron. in Korean:韓語發音：hwang lyonPron. in Cantonese:粤語發音：wong4  lin4Common Name:英文名：coptis rhizome (huang lian)Figwortflower, Picrorhiza Rhizome (xuan hu lian)Distribution:分佈﹕huang lian: Sichuan四川, Xizang 西藏, Hubei 湖 北, Jiangxi 江西, Shanxi 陝西 , Shanxi   江 西xuan hu lian: Yunnan, Xizang, Nepal, India,Properties (characteristics):性 味:bitter in taste; cool苦 ， 寒 。Channels (meridians) entered:歸經： heart, large intestine, liver, and stomach channels.心﹐大腸﹐肝﹐胃。Actions & Indications:主治：For relief of heat toxicity, indigestion, diabetes, inflammation of intestine,  diarrhea caused by bacterial infection, high fever, restlessness and insomnia, spitting blood, nose bleeding due to heat in blood, red eyes and excess stomach acid, tooth ache, boils.External uses: inflammation of the cornea,  middle ear infection, ulceration of tongue and mouth, external ear infection and eczema.Jiu huang lian: for heat in the upper part of the body like red eyes, sores in the mouth.Jiang huang lian: for clearing the stomach, stop vomiting; for coldness and heat intertwined in the abdomen area.Yu huang lian: for relieving the liver, stop vomiting; for liver and stomach not in harmony, vomiting and excess stomach acid. 用 於 濕 熱 肝脾腫脹 ，黃 疸 ，消化不良﹐糖 尿病﹐ 嘔 吐 瀉 痢 ，  高 熱 神 昏 ﹐ 心 火 亢 盛 ﹐ 心 煩 不 寐 ， 血 熱 吐 衄 ， 目 赤 吞 酸 ， 牙 痛 ，  癱 腫 疔 瘡 。外 治 : 濕 疹 ，濕 瘡 ， 耳 道 流 膿 。酒 黃 連﹕ 清 上 焦 火 熱 。 用 於 目 赤 ， 口 瘡 。薑 黃 連 ﹕清 胃 和 胃 止 嘔 。 用 於 寒 熱 互 結 ， 瀛 熱 中 阻 ， 痞 滿 嘔 吐 。萸 黃 連 ﹕舒 肝 和 胃 止 嘔 。 用 於 肝 胃 不 和 ， 嘔 吐 吞 酸 。Medical function:药理：        1. antibiotic and anti-amoeba2. effect on heart and blood vessels (1) small amount improves coronary blood vessel circulation while large amount suppresses it.(2) protects heart muscles in case of lack of blood circulation and anti arrhythmia.(3) relaxes blood vessels(4) anti palette coagulation(5) shrinks red blood cells(6) lowers blood sugar3. small amount improves function of acetylcholine while large amount suppresses it.4. decoction of huang lian 5mg/ml/1 hr, kills 99.8% of H. pylori in vitro.[1]Huang lian possesses calcium channel blocker and it can prolong purkinje′s fibre黃連具有鈣離子通道阻滯作用，可以延長蒲肯野纖維和心 室肌細胞的動作電位時間和有效不應期[2]黃連屬第三類抗心律失常藥，且沒有發現其致心律失 常和明顯副作用[3]Samples of formulae:處方舉例：huang lian e jiao tang 黃 連阿膠湯san huang xie xin tang 三黄瀉心湯Chemical ingredients:化學成份：berberine C20H17NO3小檗碱colchicine  C21H25NO5秋水仙胺coptisine C19H15NO5黃連鹹worenine C21H15NO4甲基川連鹼palmatine C22HC24 H24O5 N.OHO5NOH棕 鹼jatrorrhizine藥根碱magnoflorine木蘭鹼See:Chemical ingredients of  xian hu lianDosage:用量：1.5 to 20 g. Concentrated extract: 0.5 g to 2 g.1.5～20克；濃縮中藥：0.5～2 克Toxicity:不良反應 ：It is being used in wind heat type of cold or flu. Not to to be used  in cases of wind cold type type of cold or flu and deficient type of syndromes.Normal dosage is relatively safe with few side effects and no adverse effects from long term use. Large dosage can be toxic.Not to use in patients with glucose-6-phosphate dehydrogenase deficiency.Clinical experiences and laboratory studies show that the toxic reactions include:acute deprivation of oxygen of the brain due to cardiac functionshock due to allergenic reactionrashdizziness, tinnitus, nausea, vomiting, anxiety and fright, short of breath, joint paindiarrhea, flatulence, rumbling noise in the intestines, frequent urinationdecrease of heme and blood cellsreport of sudden stoppage of circulation and breathing due to venous feeding of injectiones of huang lian 患有葡萄糖-六-磷酸鹽去氫酵素缺乏症(蠶豆 症)之病人 忌用。 只適用於  風熱感 冒和實熱性病証。不可用於風 寒感冒 和虛寒 証。 臨床和實驗研究表明，本品有以下毒副反應：[1]急性心 源性腦 缺氧综合征；過 敏 性休克；麻疹样 药疹和荨麻疹型药疹；頭 晕,耳 鳴 ,惡 心 ,嘔 吐 ,心慌,氣 短,關 節 痛等；腹瀉 ,腹脹 ,腸 鳴 ,多尿；血色素 及血细胞减少。静滴黄連 素曾引致 三 例循 環 呼吸骤停。 [1]四 川省农业信息工程技术研究中心Chemical ingredients of hu huang liang (Picrorhiza scrophularfifolia Pennell):胡黃連化學成份﹕Roots of  Picrorhiza scrophularfifolia Pennell contain:胡黄 連根含:Kutkin 3.4%*胡 黄連素 3.4%*D�Mannitol 0．5%D�甘 露醇 0．5%Vanillic acid 0．1%香 荚藍酸  0．1%Kutkiol胡 黄連醇Kutkisterol 0.18％黄 連甾醇 0.18％Apocynin香 荚藍乙 酮Kutkin is not a simple chemical compound, it is:胡黄連素并不是一个的 簡單化合物, 它是﹕a stable crystalized mixture of Picroside  I and Kutkoside and contains Picroside  II胡 黄連苦甙 I和胡黄連甙的 稳定混晶, 並含﹕胡黄連苦甙 ⅡFruits contain:果實 含:vitamin C抗 壞血酸sugar糖 类starch澱 粉protein蛋 白質Roots and stems contain:根茎含:iridoid glycoside. The ingredients are: picroside  I﹐II﹐III環烯醚萜甙成分為胡黄連甙I﹐II﹐IIIfree organic acid: Vanillic Acid, Cinnamic acid and  ferulic acid.游离有机酸，主要為香草酸﹐桂皮酸﹐阿魏酸。Hu huang lian belongs to controlled material of CITES (Convention on International Trade in Endangered Species of Wild Fauna and Flora),  under append. II (permit required for import and export trade):  胡黃連屬於《華約》附錄二品種 管 制的藥材種類。  須 按 預先申請的許可証進行貿易 。[1] 劉波 李雪駝 等. 中國科學院大連化學 物理研究所生物技術部,大連116023[2]馬 英，朱飛奇．黃連素的藥理研究進展及在心血管、神經系 統疾病的應用前景[J]．鄖陽醫學院學報，2006，25(6)：377 [3] Zong XH， Zeng XJ， LiYY， et a1． Efficacy and safety of berberine for congestive hean failure secondary to ischemic or idiopathic dilated cardiomyopathy [J ]． Am J Cardiol，2003，92 (2)：173�176   Search this siteProblems with website? Please Click here for comment. (Not for inquiry )    Click here for inquiryCopyright Notice 按此看關於版權問題A manuscript... writing, translating and proofreading  in progressSponsors' Ads by Google 以下為谷歌 所提供之廣告 List of Health ProblemsChinese Herb DictionaryToxicity of Some HerbsSide Effect of Some HerbsHerbs that can be toxic to kidneysTraditional Chinese Medicine TCM Diagnosis Samples of FormulaeTerms of Traditional Chinese MedicineAcupuncturecopy right 版權所有Qigong (chi kung)Prescribed Drug DictionaryEmail our web master for  your suggestion (not for inquiry)Biochemistry DictionaryGeneral Online LibraryQigong classesFake Email WarningResearch LibrarianSearchQigong classesHomeWeather ReportDisclaimerLast update: April 28, 2014; 7:12 p.m. LAH   ",
        "original_url": "http://alternativehealing.org/huang_lian.htm"
    },
    {
        "Names": {
            "Name": [
                "wu yao"
            ],
            "Pharmaceutical": [
                "Radix Linderae"
            ],
            "Biological": [
                "Lindera aggregata (Sims) Kosterm.",
                "Cocculus laurifolius D.C. (Heng Zhou wu yao 衡州烏藥)"
            ],
            "Chemical": [],
            "Common": [
                "lindera root"
            ],
            "Other name": [
                "tian tai wu yao 天台烏藥",
                "tai wu yao 台烏藥",
                "ai zhang 矮樟",
                "xiang gui zhang 香桂樟",
                "bai ye chai 白葉柴"
            ],
            "Chinese": [
                "烏藥"
            ],
            "Pronunciation in Korean": [
                "oyak"
            ],
            "Pronunciation in Japanese": [
                "uyaku"
            ],
            "Pronunciation in Cantonese": [
                "wu1 joek6"
            ],
            "Pinyin Pronunciation": []
        },
        "Type": "Herb",
        "Geography": [
            "Anhui",
            "Jiangsu",
            "Zhejiang",
            "Fujian",
            "Taiwan",
            "Guangdong",
            "Guangxi",
            "Jiangxi",
            "Hubei",
            "Hunan",
            "Shaanxi",
            "Mainly produced in Zhejiang, Hunan, Anhui, Guangdong, Guangxi provinces of China"
        ],
        "Properties": [
            "Acrid",
            "Warm"
        ],
        "Meridians": [
            "Lung",
            "Spleen",
            "Kidney",
            "Bladder"
        ],
        "Maladies Treated": [
            "Frequent urination or lack of control",
            "Flatulence and pain",
            "Frequent urination",
            "Enuresis (bed wetting)",
            "Hernia",
            "Dysmenorrhea",
            "Irregular menses due to shenyangxu (kidney yang deficient)",
            "Chest and abdominal fullness and pain",
            "Rebellious qi and panting",
            "Hernia",
            "Painful menstruation",
            "Irregular menstruation",
            "Deficiency and cold type of frequent urination",
            "Stomach and lower abdomen flatulence and pain"
        ],
        "Medical Function": [
            "Increases or decreases peristalsis of digestive tract",
            "Expels intestinal gas",
            "Shrinks urine",
            "Analgesic",
            "Anti-inflammatory",
            "Prevents or stops vomiting",
            "Promotes perspiration (diaphoretic)",
            "Stimulates sympathetic nervous system",
            "Hypertensive",
            "Arrests bleeding; can accelerate blood clotting",
            "Increases metabolism",
            "Antibiotic",
            "Anti-viral",
            "Induces interferon"
        ],
        "Dosage": "Oral, for decoction: 3–10 g.\n內服，煎湯：3 ~ 10 克。",
        "Samples of Formulae": "For deficient and cold type of frequent urination: often combine with yi zhi ren (Alpinia oxyphylla seed).\nFor stomach and lower abdomen flatulence and pain: often combine with xiang fu zi (Cyperus rotundus rhizome), yan hu suo (Corydalis yanhusuo tuber).",
        "Contraindications": "Not to use in cases of qixu (qi deficient) or with yinxu (yin deficient).\n氣虛或有陰虛者忌服。",
        "Research": "",
        "Notes": "",
        "Chemical Ingredients": {
            "Leaves": [
                "Evaporating oil",
                "Hydrocarbon",
                "Ester",
                "Acidic sesquiterpenoids",
                "6-Acetyllindenanolide B-1 and B-2",
                "Dehydrolindestrenolide",
                "Hydroxy linderstrenolide",
                "Linderalactone",
                "Kaempferol",
                "β-sitosterol"
            ],
            "Rhizome": [
                "Monoterpenoids of hydrocarbon including linderol (borneol)",
                "α-terpinene"
            ],
            "Sesquiterpenoids (root/rhizome and leaves)": [
                "Isolinderoxide",
                "Linderene",
                "Isogermafurene",
                "Linderane",
                "Linderalactone",
                "Isolinderalactone",
                "Neolinderalactone",
                "Hydroxylindestrenolide",
                "Lindenenone",
                "Laurolitsine",
                "Isogermafurenolid",
                "Hyroxylisogermafurenolid",
                "Epidihydroisolinderalactone",
                "Macrocyclic sesquiterpenoids",
                "Lindestrene",
                "Lindestrenolide",
                "Linderenol",
                "Linderoxide",
                "Isolinderoxide",
                "Linderenone",
                "Hydroxylindestrenolide"
            ]
        },
        "References": [
            "[1] China Journal of Chinese Materia Medica 2001,26(11):765.; 中国中药杂志,2001,26(11):765",
            "[2] Zhong Hua Ben Cao   中華本草",
            "《本草綱目‧木一‧烏藥》﹝集解﹞引 蘇頌 曰：  (烏藥)今台州 、 雷州 、 衡州皆有之， 以天台者為勝。"
        ],
        "Further Reading": [],
        "Original Text": "\n\n\nwu yao, Complementary and Alternative Healing University\n\n\n\n\n\n\n\nComplementary \n    and Alternative Healing University\n\n\n\n\n\n\n\n中藥詞典                 \n    Chinese Herb Dictionary    \n     Search \n    this site    \n    在本網站找資料\n\n\n\n\n\n\n\n\n\n\n\n\n\n\n\n\nSearch this \n        site\n\n\nList \n        of Health Problems\n\n\n\n\n\n\nChinese \n        Herb Dictionary\n\n\n\n\n\n\nQigong\n\n\n\n\n\n\n\n        Traditional Chinese Medicine (TCM)\n\n\n\n\n\n\n\n        Acupuncture\n\n\n\n\n\n\n\n        Prescribed Drug Dictionary\n\n\n\n\n\n\nBiochemistry Dictionary\n\n\n\n\n\n\nLecture Slides\n\n\n\n\n\n\nResearch Librarian\n\n\n\n\n\n\nGeneral \n        Online Library\n\n\n\n\n\n\nResearch Sites\n\n\n\n\n\n\n\n        Viagra\n\n\n\n\n\n\nMassage/Acupressure\n\n\n\n\n\n\nHypnotherapy\n\n\n\n\n\n\nTell us what you want\n\n\n\n\n\n\nNotify Changes \n        & New Information\n\n\n\n\n \n\n\n\n\n\n\n \n\nwu yao \n    烏 藥\nEdited \n\nby: \n    Joe Hing kwok Chu\n\n\n\n\nPharmaceutical name:\n英文藥名﹕\n\n\n\nRadix Linderae\n\n\n\n\nBotanical name:\n學名﹕\n\n\nLindera aggregata（Sims）Kosterm.\nCocculus laurifolius D.C. \n        (Heng Zhou wu yao  衡州烏藥)\n\n\n\n\nPron. in Japanese:\n日語發音﹕\n\n\nuyaku\n\n\n\n\nPron. in Korean:\n韓語發音﹕\n\n\noyak\n\n\n\n\n\n\n        Pron. in Cantonese:\n粵音﹕\n\n\nwu1 joek6\n\n\n\n\nOther Names:\n別名﹕\n\n\ntian tai wu yao 天台烏藥，tai wu yao \n        台烏藥，ai zhang 矮樟,\nxiang gui zhang 香桂樟，bai ye chai \n        白葉柴。\n\n\n\n\nCommon Name:\n英文名﹕\n\n\n\nlindera root\n\n\n\n\nDistribution:\n產地﹕\n\n\nDistribution: Anhui, Jiangsu, \n        Zhejiang, Fujian, Taiwan, Guangdong, Guangxi, Jiangxi, Hubei, Hunan, Shaanxi.\nThe herb is mainly produced in \n        Zhejiang, Hunan, Anhui, Guangdong, Guangxi provinces of China.\n分佈於安徽、江蘇、浙江、福建、台灣、廣東、廣西、江西、湖北 \n        、湖南、陝西等地。藥材主產於浙江、湖南、安徽、廣東、廣西。\n\n\n\n\nProperties\n(characteristics)﹕\n \n性味﹕\n\n\n\nacrid, warm.\n辛，温。　\n        　　\n\n\n\n\nChannels (meridians) \n        entered:\n \n歸經﹕\n\n\n\nlung, spleen, kidney, bladder.\n肺，脾，腎，膀胱。\n\n\n\nMedical functions:\n藥理﹕\n \n\n\n\n\n\nMedical functions:\n\n\nincreases\n          or decreases peristalsis \n          of digestive tract,\n\n\nexpels intestinal \n          gas,\n\n\n\nshrinks urine,\n\n\nanalgesic,\n\n\nanti-inflammatory,\n\n\n\nprevents or stops vomiting,\n\n\n\npromote perspiration (diaphoretic),\n\n\n\nstimulates sympathetic nervous system ,\n\n\nhypertensive,\n\n\n\narrests bleeding,\n\n\n\nincreases metabolism,\n\n\nantibiotic,\n\n\nanti-viral,\n\n\n\ninduces interferon\n\n\n藥\n        理﹕\n\n\n對胃腸平滑肌有雙 向\n          作用，能促進或抑制胃腸活動\n\n\n排屁作 用\n\n\n收斂小便作 用\n\n\n止痛\n\n\n消炎\n\n\n防止嘔 吐\n\n\n發汗\n\n\n促進交感神經活 動\n\n\n增 高血壓\n\n\n止血，能促進血液 凝\n          固\n\n\n促進新陳代 謝\n\n\n抑菌\n\n\n抗病毒\n\n\n增進干擾素\n\n\n\n\n\n\nActions \n        & Indications:\n主 \n        治﹕\n\n\n\nfrequent urination or lack of control,\nfor treatment of\n        flatulence and pain, \n\nfrequent urination, enuresis\n\n(bed wetting), \nhernia, dysmenorrhea, irregular menses. \n        due to\n\nshenyangxu (kidney \n        yang deficient).\n1.順氣止痛: 胸腹 \n        脹痛，氣逆喘急，疝氣，痛經, 月 經 不 調 。\n        2.溫腎散寒：治腎 \n        陽虛，小便頻數及遺尿。 \n \n\n\n\n\nChemical \n        ingredients:[2]\n化 \n        學成份﹕【2】\n\n\n\n\n\nThe Leaves contain evaporating oil, mainly:\n\n葉含揮發油，主要成分：\n\n\nhydrocarbon,\n烴類\n\n\nester\n酯類\n\n\nacidic sesquiterpenoids\n酸性倍半萜\n\n\n\nThe rhizome contains　monoterpenoids of hydrocarbon \n            of :\n根莖含單 萜碳氫化合物：\n\n\nlinderol (borneol)\n釣樟醇\n\n\nα-terpinene\nα-松油烯\n\n\nsesquiterpenoids：\n倍半萜：\n\n\n\nisolinderoxide\n異氧化釣樟素\n\n\nlinderene　\n釣樟烯醇\n\n\nisogermafurene\n異已夫喃\n\n\n\nlinderane\n\n釣樟環氧內酯\n\n\nlinderalactone\n釣樟內酯\n\n\n\nisolinderalactone\n\n異釣樟內酯\n\n\nneolinderalactone\n新釣樟內酯\n\n\nhydroxylindestrenolide\n羥基烏藥根內酯\n\n\n\nlindenenone\n\n烏藥烯酮\n\n\nlaurolitsine\n新木薑子鹼（月桂木姜鹼）\n\n\n\nisogermafurenolid\n異牻牛兒呋內酯\n\n\nhyroxylisogermafurenolid\n羥基異 牻牛兒呋內酯\n\n\n\nepidihydroisolinderalactone\n\n表二氫異 烏藥內酯\n\n\nmacrocyclic sesquiterpenoids\n大環 倍半萜類\n\n\nlindestrene\n香樟烯\n\n\nlindestrenolide\n香樟內酯\n\n\nlinderenol\n烏藥醇\n\n\nlinderoxide\n烏藥醚\n\n\nisolinderoxide\n異烏藥醚\n\n\nlinderenone\n烏藥酮\n\n\n\nhydroxylindestrenolide\n\n羥基香樟內酯\n\n\n\n\n\n\nLeaves，anti-inflammation, antibiotic \n            ingredients: [1]\n葉的抗炎，抗菌成份：[1]\n\n\n\n\n\n\n\n\n            6-Acetyllindenanolide B-1 and B-2\n\n\n6-acetyl lindenanolide B-1和B-2\n\n\n\n\n            dehydrolindestrenolide\n\n\n去氫香樟內酯\n\n\n\n\n            hydroxy linderstrenolide\n\n\n羥基香樟內酯\n\n\n\n\n            linderalactone\n\n\n烏藥內酯\n\n\n\n\n            kaempfero\n\n\n山柰酚\n\n\n\n\n\nβ-sitosterol\n\n\n β-谷甾醇\n\n\n\n\n\n\n\nDosage:[2]\n用量﹕[2]\n\n\nOral, for \n        decoction: 3～10 g.\n內服，煎湯：3 ~ 10 克。\n\n\n\n\nSamples of \n        formulae:\n處方舉例﹕\n\n\nfor deficient and cold type of \n        frequent urination: often combine with\n        \nyi zhi \n        ren.\nfor stomach and lower abdomen \n        flatulence and pain: often combine with\n\nxiang fu zi,\n        \nyan hu suo.\n用於下焦虛寒之小便頻數: \n        配益智仁。\n胃脘及小腹脹痛:\n        配香 \n        附子、延\n        胡索。\n\n\n\n\nModern \n        Research:\n現 \n        代研究﹕\n\n\n \n\n\n\n\nToxicity & Cautions:\n毒 素與禁忌﹕\n\n\n\nnot to use in cases of \nqixu (qi deficient)\n         or with \nyinxu (yin deficient).\n\n氣虛或 \n        有陰\n        虛者忌服。\n\n\n\n \n\n    [1] China Journal of Chinese Materia Medica \n    2001,26(11):765.;    中国中药杂志,2001,26(11):765\n\n    [2]\n    \nZhong Hua Ben Cao   中華本草\n \n 《 \n    本草綱目‧木一‧烏藥》﹝集解﹞引 蘇頌 曰： �﹝烏藥﹞今台州 、 雷州 、 衡州皆有之， 以天台者為勝。\n\n\n\n\n\nSearch this site\n\n\nProblems with website? Please \n\nClick here \n    for comment. (Not for inquiry )   \n    \n\n\nClick \n    here for inquiry\n\n\nCopyright Notice \n\n按此看關於版權問題\n\n \n\nSponsors' Ads \n    by Google 以下為谷\n    歌 所提供之廣告\n\n\n\n\n\n\n\n\n\nList \n        of Health Problems\n\n\n\n\nChinese \n        Herb Dictionary\n\n\n\n\n\nToxicity of Some Herbs\n\n\n\nSide Effect of Some Herbs\n\n\n\nHerbs that can be toxic to kidneys\n\n\n\n\n\n        Traditional Chinese Medicine\n\n\nTCM Diagnosis\n\nSamples \n        of Formulae\n\n\n\n\n\n        Terms of Traditional Chinese Medicine\n\n\n\n        Acupuncture\n\n\n\n\n\n\ncopy right\n \n\n\n版權所有\n\n\n\n\nQigong \n        (chi kung)\n\n\n\n\n\n        Prescribed Drug Dictionary\n\n\n\n\nEmail \n        our web master for  your suggestion (not for inquiry)\n\n\n\n\nBiochemistry Dictionary\n\n\n\n\n\n\nGeneral Online Library\n\n\n\n\nQigong classes\n\n\n\n\nFake Email \n        Warning\n\n\n\n\nResearch Librarian\n\n\n\n\nSearch\n\n\n\n\n\n\nQigong classes\n\n\n\n\n\n\n\n\nHome\n\n\n\n\n\n        Weather Report\n\n\n\n\nDisclaimer\n\n\n\n\n\n\nLast \nupdate: Sept 27, 2013; 9:15 P.m. LAH\n \n\n\n\n\n\n\n\n\n\n",
        "original_url": "http://alternativehealing.org/wu_yao.htm"
    },
    {
        "Names": {
            "Name": [
                "gan cao",
                "gan cao shao",
                "zhi gan cao"
            ],
            "Pharmaceutical": [
                "Radix Glycyrrhizae Uralensis"
            ],
            "Biological": [
                "Glycyrrhiza uralensis Fisch.",
                "Glycyrrhiza glabra L. var. glandulifera Rega",
                "Glycyrrhiza inflata Batal."
            ],
            "Chinese": [
                "甘草",
                "甘草梢",
                "炙甘草"
            ],
            "Common": [
                "Licorice root"
            ],
            "Other name": [
                "lin cao 靈草",
                "mei cao 美草",
                "mi cao 蜜草",
                "mi gan 蜜甘",
                "tong lin 通靈",
                "lu cao 露草",
                "ji cao 薺草",
                "cao gu 草古",
                "fen cao 汾草",
                "fen cao 粉草",
                "bang cao 棒草",
                "tian gen zi 甜根子"
            ],
            "Pronunciation in Korean": [
                "kamch'o"
            ],
            "Pronunciation in Japanese": [
                "kanzo"
            ],
            "Pronunciation in Cantonese": [
                "gam1 cou2"
            ],
            "Pinyin Pronunciation": []
        },
        "Type": "Herb",
        "Geography": [
            "Mainly produced in Inner Mongolia, Gansu, Shaanxi, Shanxi, Liaoning, Jilin, Heilongjiang, Hebei, Qinghai, Xinjiang"
        ],
        "Properties": [
            "Sweet in smell",
            "Peculiarly sweet in taste",
            "About five hundred times the sweetness of cane sugar",
            "gan cao shao: Cold"
        ],
        "Meridians": [
            "All 12 channels",
            "Heart",
            "Lung",
            "Spleen",
            "Stomach"
        ],
        "Maladies Treated": [
            "Spleen and stomach weakness",
            "Tired and lack of strength",
            "Palpitation and short of breath",
            "Cough with abundance of phlegm",
            "Stomach and solar plexus pain",
            "Decrease of hypophysis frontal lobe function after childbirth",
            "Haemophilus influenzae type b (Hib) cerebrospinal meningitis",
            "Addison's Disease (adrenocortical hypofunction)",
            "Ulcers of duodenum and stomach",
            "Infant constipation",
            "Hepatitis B",
            "Colitis of colon with ulcers",
            "Arrhythmia",
            "Lung tuberculosis",
            "Chronic prostate inflammation and impotence",
            "Urine retention after surgery",
            "gan cao shao (tip or fine root): infection, pain in the penis, and gonorrhea"
        ],
        "Medical Function": [
            "Tonifies pi (spleen)",
            "Enhances qi",
            "Clears heat",
            "Rids of toxins",
            "Expels phlegm and stops cough",
            "Stops pain",
            "Synergizes other herbs",
            "Adrenocortical hormone function: Gan cao extract showed mineralocorticoid characteristics. Glycyrrhiza is metabolically converted to glycyrrhetic acid (GA). GA, when incubated in-vitro with adrenal gland cells, increases DHEA production.",
            "Effects on digestive system: anti ulcer, anti convulsion, promotes secretion of insulin, protects liver from toxin.",
            "Anti inflammation",
            "Anti allergy",
            "Anti cancer: Saponins stimulate the immune system and inhibit Epstein-Barr virus expression and possess in-vitro anti-cancer activities. Glycyrrhiza contains quercetin with anticancer effects. Glycyrrhiza lowers serum testosterone levels and correspondingly increases estrogen levels by inducing two enzymes (17-β-hydroxysteroid dehydrogenase and aromatase) thus inhibiting prostate cancer cells.",
            "Antivirus and antibacteria: anti HIV, anti HBV, anti amoeba and bacteria",
            "Effect on blood vessels: lowers blood lipids. Both saponins and licoflavones are known to bind to cholesterol and bile acids and have surfactant properties.",
            "Glycyrrhizin is beneficial in chronic viral hepatitis.",
            "Glycyrrhizin is effective in inhibiting Pseudomonas aeruginosa where antibiotic failed.",
            "Glycyrrhizin can reverse or stop the process of liver cirrhosis and early cirrhosis.",
            "Baking or stir frying with honey (zhi gan cao) can improve its function in strengthening the digestive system and immune system."
        ],
        "Dosage": "Normally 9 to 12 g. Large dosages can be up to 30 g. gan cao shao: 1.5 g to 4.5 g in decoction.",
        "Samples of Formulae": "Ba Zheng San (八正散, Ba Zheng Powder), Bai Hu Tang (白虎湯, White Tiger Decoction), Ban xia bai zhu tian ma tang (半夏白朮天麻湯, Pinellia, White Atractylodes and Gastrodia Decoction), Bu Zhong Yi Qi Tang (補中益氣湯, Tonify the Middle and Augment the Qi Decoction), Chai Ge Jie Ji Tang (柴葛解肌湯, Bupleurum and Kudzu Decoction to Release the Muscle Layer), Ding Chuan Tang (定喘湯, Arrest Wheezing Decoction), Gan Ma Da Zao Tang (甘麥大棗湯, Licorice, Wheat & Jujube Decoction), Gui zhi tang (桂枝湯, Cinnamon Twig Decoction), Gui pi tang (歸脾湯, Restore the Spleen Decoction), Jiao ai tang (膠艾湯, Gelatin and Mugwort Decoction), Jju pi zhu ru tang (橘皮竹茹湯, Tangerine Peel and Bamboo Shavings Decoction), Ma huang tang (麻黃湯, Ephedra Decoction), Ren Shen Bai Du San (人參敗毒散, Ginseng Powder to Overcome Pathogenic Influences), sang ju yin (桑菊 飲, Mulberry Leaf and Chrysanthemum Decoction), Long Dan Xie Gan Tang (龍膽瀉肝湯, Gentiana Longdancao Decoction to Drain the Liver), Shi quan da bu tang (十全大補湯, All-Inclusive Great Tonifying Decoction), Suan Zao Ren Tang (酸棗仁湯, Sour Jujube Decoction), Tiao Wei Cheng Qi Tang (調胃承氣湯, Regulate the Stomach and Order the Qi Decoction), Wen jing tang (温經湯, Warm the Menses Decoction), Yin qiao san (銀翹散, Honeysuckle and Forsythia Powder), xiao feng san (消風散, Eliminate Wind Powder), Xue Fu Zhu Yu Tang (血府逐淤湯, Drive Out Stasis in the Mansion of Blood Decoction).",
        "Contraindications": "Small dosages are used as moderating and synergizing herbs while large dosages can increase blood pressure. Long term usage of large dosage can also cause edema and hypokalemia. Using gan cao with aspirin may increase the irritation of the stomach. Gan cao antagonizes gan sui, da ji, hai zao (sea weed), yuan hua. Long term or large dosage use of gan cao may cause pseudoaldosteronism, edema, hypertension, arrhythmia, myocardium injury, muscular weakness. Clinical reports include anaphylactic shock, drug rash, hypokalemia, allergic laryngeal edema, penis shrinkage in adult men, pubic hair loss, testicular atrophy to the size of a bean, acute respiratory failure in infants, poisoning in newborns. 甘草反甘遂，大戟，海藻，芫花.",
        "Research": "Glycyrrhizin restores the impaired production of β-defensins in tissues surrounding the burn area and improves the resistance of burn mice to Pseudomonas aeruginosa wound infection. [2]\n\nEffect of glycyrrhizin on HepG2.2.15 cell line supernatant HBeAg and HBV DNA levels may have a two-way, with a dose-dependent inhibition of HBsAg, suggesting that the use of glycyrrhizin should select the appropriate dosage. [3]",
        "Notes": "Gan cao shao is the tips of the root or the fine roots of the herb gan cao. The property is cold. It is used for treating infection, pain in the penis and gonorrhea. Dosage: 1.5 g to 4.5 g in decoction. \n Zhi gan cao is gan cao coated with honey and baked to dark brown color, used often in tonic. Baking or stir frying with honey (zhi gan cao) can enhance function for strengthening the digestive system and immune system. \n Qing zhi cao is plain baked gan cao without honey.",
        "Chemical Ingredients": {
            "gan cao root and rhizome": [
                "Glycyrrhizic acid (potassium and calcium salt are the sweet components, content 5–11%)",
                "Glycyrrhetinic acid (content 3–7%)",
                "24-hydroxyglycyrrhetic acid",
                "licorice saponins A3, B2, C2, D3, F3, G2, H2, J2, K, and K2",
                "uralenic acid (produced by hydrolysis)",
                "Flavonoids: licochalcone A, licochalcone B, licoflavone, liquiritin, liquiritigenin, isoliquiritigenin, ononin, 4′,7-dihydroxyflavone",
                "β-sitosterol",
                "Deoxyglycyrrhetic acid I, II",
                "Liquiritic acid",
                "Liquiritoside",
                "Liquiritogenine",
                "Neoisoliquiritin",
                "Licochalcone A, B"
            ],
            "Glycyrrhiza inflata (produced in Gansu)": [
                "Eight flavonoids: licochalcone A, licochalcone B, licoflavone, liquiritin, liquiritigenin, isoliquiritigenin, ononin, 4′,7-dihydroxyflavone",
                "Three triterpenoids: glycyrrhizic acid, glycyrrhetinic acid, 11-deoxyglycyrrhetinic acid",
                "β-sitosterol"
            ],
            "Hydrolyzed product": [
                "Two molecules of glucuronic acid and one molecule 18β-glycyrrhetinic acid"
            ]
        },
        "References": [
            "[1] ACTA Botanica Sinica 植物學報, 楊世林　劉永漋",
            "[2] http://www.jleukbio.org/content/87/1/35.abstract",
            "[3] http://journal.9med.net/html/qikan/zgyx/zgzyyxxzz/20099169/syyj/20100121091410194_503695.html",
            "[4] 《中藥不良反應概論》. 北京大學醫學出版社. 2005: 179.",
            "[5] Chun J. Dig. Dec 2001, vol 21, No. 12 只好消化雜誌，2001 年，12 月，第21卷，第12期"
        ],
        "Further Reading": [],
        "Original Text": "gan cao, licorice, Glycyrrhiza glabra L., Complementary and Alternative Healing UniversityComplementary and Alternative Healing University \n  中藥詞典    Chinese Herb Dictionary      Search this site     在本網站找資料 See more menu at the bottom of page gan cao 甘草, gan cao shao 甘草梢, zhi gan cao 炙甘草 By: Joe Hing Kwok Chu 朱興國 编譯   (in English and Chinese 中英文） Zhi gan cao is gan cao that has been coated with honey and baked to darkbrown color and often it is being used in tonic. Sheng gan cao is untreated gan cao. Click to see picture of herb.Pharmaceutical name:英文藥名：Radix Glycyrrhizae UralensisBiological name:拉丁名：Glycyrrhiza uralensis Fisch.Glycyrrhiza glabra L. var. glandulifera, RegaGlycyrrhiza inflata Batal. (脹果甘草)Pron. in Japanese:日語發音： kanzoPron. in Korean:韓語發音：kamch'oPron. in Cantonese:粤語發音：gam1  cou2   Other names:別名：lin cao 靈草，mei cao 美草，mi cao 蜜草，mi gan 蜜甘，tong lin 通靈，lu cao 露草，ji cao 薺草，cao gu 草古，fen cao 汾草，fen cao 粉草，bang cao 棒草，tian gen zi 甜根子。Common Name:英文名:Licorice rootDistribution:分布：It is mainly produced in Inner Mongolia, Gansu, Shaanxi, Shanxi, Liaoning, Jilin, Heilongjiang, Hebei, Qinghai andXinjiang .主產於內蒙，甘肅，陜西，山西，遼寧，吉林，黑龍江，河北，青海, 新疆。Properties (characteristics)：性味：Sweet in smell and peculiarly sweet in taste. It is about five hundred times the sweetness of cane sugar.味甘。較蔗糖甜500 倍。Channels (meridians) entered:歸經：all 12 channels, mainly the heart, lung, spleen and stomach channels.全部12 經。主要是心，肺，脾，與胃經。Actions & Indications:主治：tonifies pi (spleen), enhances qi, clears heat, rids of toxins, expels phlegm and stops cough, stops pain, synergizes other herbs. Being used in spleen and stomach weakness, tired and lack of strength, palpitation and short of breath, cough with abundance of phlegm, stomach and solar plexus pain,益脾，補氣，清熱，去毒，排痰，止咳，止痛，和其他藥味。 用於脾虚消化不良，疲倦，無力，心跳，氣短，痰多咳嗽，胃部與鸠尾痛。  Medical Function:藥理：1. adrenocortical hormone function：  As early as 1946 gan cao extract showed the characteristics of mineralcorticoid.    Glycyrrhiza is metabolically converted to glycyrrhetic acid (GA). GA, when incubated in-vitro with adrenal gland cells increases DHEA production.2. effects on digestive system:   (a). anti ulcer   (b). anti convulsion.  (c).  promotes secretion of insulin.  (d). protects liver from toxin.3. anti inflammation4. anti allergy5. anti cancer:  Saponins stimulate the immune system and inhibit Epstein-Barr virus expression and possess in-vitro (in the test tube) anti-cancer activities. Epstein_Barr virus is associated in certain cancer development. Glycyrrhiza also contains quercetin that has anticancer effects. Glycyrrhiza lowers serum testosterone levels and correspondingly increases estrogen levels by inducing two enzymes called 17-�-hydroxysteroid dehydrogenase and aromatase thus inhibit prostate cancer cells.6. anti virus and bacteria:   a. anti HIV, anti HBV   b. anti amoeba and bacteria7. effect on blood vessels:   a. lower blood lipids.  Both saponins and licoflavones are known to bind to cholesterol and bile acids and have surfactant properties.glycyrrhizin is beneficial in chronic viral hepatitisglycyrrhizin was effective in inhibiting Pseudomona Aeruginosa where antibiotic failed.[2]glycyrrhizin \n  can reverse or stop the process of liver cirrhosis and early cirrhosis. [5] 1. 腎上腺 皮質素 作用：早自 1946 年， 已知甘 草提取物有顯示 鹽激素 之作用。甘草之甘草酸與腎腺上细胞放入孵化器内可增加産生脫氫表雄酮 (DHEA)*。2. 對消化系统之作用：(a). 抗潰瘍   (b). 抗痙攣  (c).  增進胰島素的分泌.  (d). 對抗毒素而有保肝作用3. 抗炎4. 抗過敏5. 抗癌：其皂素有刺激增進免疫系统 ，抑制愛潑斯坦－巴爾二氏病毒。體外試验有抗癌作用。愛潑斯坦－巴爾二氏病毒與某種癌症有關。 甘草含有 槲皮素 。槲皮素有抗癌作用。甘草有降低血清之睾酮同時引起两種酶：17β-羥 基類固醇脫氫酶與芳香酵素(芳香酶)而增加雌激素而抑制前列腺癌细胞。.6. 抗病毒與细菌   a. 抗 愛滋病毒，抗乙型抗炎病毒   b. 抗阿米巴7. 對血管之作用：   a. 降血脂.  皂素與甘草黄酮可 與膽固醇與膽酸結合，有乳化作用。甘草甜素對慢性病 毒性肝炎有效。有時抗生素對抑制 緑膿桿菌無效時，用甘草甜素 有效。 【2】\n    甘草甜素可逆轉及阻斷肝臟纖維化及早期肝硬化*註：脫氫表雄酮(DHEA)可 自動轉化為雄性或雌性激素，促進性激素增加，使雌雄激素水平升高；具有增強性功能，抗衰老，推遲更年期，抗腫瘤，提高免疫力等功效Chemical ingredients:化學成分：Glycyrrhizic acid, its potassium and calcium salt provide the sweet tastes of glycyrrhizin. The herb contains 5 to 11% of glycyrrhizin and  3 to 7% of Glycyrrhetinic Acid.Glycyrrhizic acid can be hydrolized into two molecules glucuronic acid and one molecule 18 b-glycyrrhetinic acid.It also contains 24-hydroxyglycyrrhetic acid [1] , licorice saponins A3, B2,C2,D3, F3, G2, H2, J2, K, and K2. The hydrolized substance also contains uralenic acid.Zhang guo gan cao (Glycyrrhiza inflata Bat.)：Its main ingredients is like those of gan cao。The 12 ingredients isolated from  zhang guo gan cao produced in Gansu include: 8 flavonoids): licochalcone A, licochalcone B, licoflavone,  liquiritin, liquiritigenin, isoliquiritigenin, ononins and 4′，7-dihydroxyflavone;  another 3 kinds are triterprenoids，e.g. glycyrrhizic acid, glycyrrhetinic acid,  11-deoxyglycyrrhetinic acid and β-sitosterol. [1]根及根莖含三萜類化合物甘草甜素（Glycyrrhizin） ，主要為甘草酸（Glycyrrhizic acid）的鉀，鈣鹽，為乾草的甜味成分。甘 草甜素 含量在5～11％，甘草次酸含量在3～7％ 。甘草酸水解後產生二分子葡萄糖醛酸 (glucuronic acid )和一分子18β－ 甘草次酸（18β－Glycyrrhetinic acid）。尚含24－羥基甘草次酸（24－Hydroxyglycyzzhetec aced）。尚含甘 草皂素A3, B2,C2,D3, F3, G2, H2, J2, K,  K2。水解物中尚 含烏 熱酸 （uralenic acid）。甘草尚含黃酮類化合物，主要有甘草甙（Liquiritin） ，甘草甙元（Liquiritigenin） ，異甘草甙（Iso-Liquiritin） ，新甘草甙（Neo-Liquiritin）異甘草甙元（Iso-Liquiritigenin） ，新異甘草甙（Neoisoliquiritin）等。還含β－ 穀甾醇等。  脹果甘草：主要成分與甘草相似。甘肅產脹果 甘草(Glycyrrhiza inflata Bat．)中分出12種成分，其中8種為黃酮類 (flavonoids) 化合物，即甘草查爾酮甲(licochalcone A)，甘草查爾酮 乙(licochalcone B)， 甘草黃酮 (licoflavone)，甘草甙(1iquiritin)，甘草甙元(1iquiritigenin)， 異甘草甙元 (isoliquiritigenin)，芒柄花甙(ononin)和4′，7-二羥基黃酮(4′，7-dihydroxyflavone)， 另外3種為三萜類化合物，即甘草酸(glycyrrhizic acid)，甘草次酸(去 糖基甘草酸) (glycyrrhetinic acid) 和11-脫氧甘草次酸(11-deoxyglycyrrhetinic acid)以及β-谷甾醇(β-sitosterol)。 其中除甘草查爾酮甲外，其余均為首次從脹果甘草中分得，4′，7-二羥基黃酮和芒柄花甙為首次從本屬植物中分得。[1]光果甘草：主要成分與甘草相似。還含去氧甘草次酸Ⅰ，Ⅱ(Deoxyglycyrrhetic acid Ⅰ，Ⅱ)，異甘草次酸（Liquiritic acid ）及黃酮類化合物光果甘草甙（Liquiritoside） ，光果甘草 甙元（Liquiritogenine），甘草查耳酮（Licochalcone）A.B等 。Dosage:用量：Normally 9 to 12 g. Large dosages can be up to 30 g. See Caution.一般用9～12 克。大劑量有用到30克。看禁忌條 。Samples of formulae:處方舉例：Ba Zheng San 八正散,Bai Hu Tang 白虎湯,Ban xia bai zhu tian ma tang 半夏白朮天麻湯,Bu Zhong Yi Qi Tang 補中益氣湯,Chai Ge Jie Ji Tang,Ding Chuan Tang 定喘湯,Gan Ma Da Zao Tang 甘麥大棗湯,Gui zhi tang 桂枝湯,Gui pi tang 歸脾湯,Jiao ai tang 膠艾湯,Jju pi zhu ru tang 橘皮竹茹湯Ma huang tang 麻黃湯,Ren Shen Bai Du San 人參敗毒散,sang ju yin 桑菊 飲,Long Dan Xie Gan Tang 龍膽瀉肝湯,Shi quan da bu tang 十全大補湯,　Suan Zao Ren Tang 酸棗仁湯,Tiao Wei Cheng Qi Tang 調胃承氣湯Wen jing tang 温經湯,Yin qiao san 銀翹散,xiao feng san 消風散Xue Fu Zhu Yu Tang 血府逐淤湯。Modern Applications：现代應用：Decrease of hypophysis frontal lobe function after child birth.Haemophilus influenzae type b (Hib) cerebrospinal meningitisAddison's DiseaseUlcers of duodenum and stomachInfant constipationHepatitis BColitis of colon with ulcersArrhythmiaLung TBChronic prostate inflammation and impotenceUrine retention after surgery 用於産 後腦下垂體前頁功能减退B型流搆嗜血桿菌疫苗腦脊髓膜炎艾迪生病 (腎上腺皮質機能不足)十二指腸與胃之潰瘍婴兒便秘乙型肝炎大腸炎兼有潰瘍心律不整肺痨慢性前列腺炎與陽萎手術後尿潴留Modern Research:現代研究：For original report, click on the links.Glycyrrhizin restores the impaired restores the impaired production of β-defensins in tissues surrounding the burn area and improves the resistance of burn mice to Pseudomonas aeruginosa wound infection.  [2] 甘草甜 素可恢復小鼠被焼傷組織部份之防御素之生産語對抗化膿桿菌。 [2]Effect of glycyrrhizin on HepG2.2.15 cell line supernatant HBeAg and HBV DNA levels may have a two-way, with a dose-dependent inhibition of HBsAg, suggesting that the use of the glycyrrhizin should select the appropriate dosage. [3]甘草甜素對HepG2.2.15細胞株上清中的HBeAg和HBV DNA水平可能具有雙向作用,而對HBsAg具有劑量依賴的抑制作用,提示GL的使用應注意選擇適應証及合適的劑量。[3]Cautions:禁忌：Small dosages are used as moderating and synergizing herbs while large dosages can increase blood pressure. Long term usage of large dosage can also cause edema and hypokalemia.Using gan cao with aspirin may increase the irritation of the stomach.Gan cao antagonizes gan sui, da ji, hai zao (sea weed), yuan hua.小剤量能調和配方中的 药 物。大剤量能升高血壓。。長期或大劑量服用甘草可引起「假性醛固酮增多症」， 水腫， 高血壓， 心律失常， 心肌損傷， 肌肉無力。有臨床報導，口服複 方甘草片導致過敏性休克， 藥疹， 低血鉀， 過敏性喉頭水腫， 成年男子陰莖縮小， 陰毛脫落， 睪丸萎縮至蠶豆大小， 嬰兒急性呼吸衰竭， 新生兒中毒等症狀[4]。甘草與水 楊酸鹽類如Aspirin 同用能刺激胃臟。甘草反甘 遂，大 戟， 海藻，芫 花。[1] ACTA Botanica Sinica 植物學報, 楊世林　劉永漋[2] http://www.jleukbio.org/content/87/1/35.abstract[3]http://journal.9med.net/html/qikan/zgyx/zgzyyxxzz/20099169/syyj/20100121091410194_503695.html[4] 《中藥不良反應概論》. 北京大學醫學出版社. 2005: 179.\n\n[5] Chun J. Dig. Dec 2001, vol 21, No. 12  只好消化雜誌， \n  2001 年，12 月，第21卷， 第12期Gan cao shao is the tips of the root or the fine roots of the herb gan cao. The property is cold. It is used for treating infection, pain in the penis and gonorrhea. Dosage: 1.5 g to 4.5 g in decoction.Zhi gan cao is when adding honey to gan cao bake to brown color. Baking or stir frying with honey can improve its function in strengthening the digestive system and immune system.Qing zhi cao is just plain baked gan cao without added honey.甘草梢為豆科植物甘草的根的末梢部分或細根。 【性味】性寒。 【功用主治】清火，解毒。治陰莖中疼痛及淋濁。 【用量】內服：煎湯，0.5～1.5錢。 炙甘草是甘草加蜜糖烘乾的。蜜炙後可增加補中益氣作用。清炙草只是生甘草烘乾的（沒加蜜糖）。Search this siteProblems with website? Please Click here for comment. (Not for inquiry )    Click here for inquiryCopyright Notice 按此看關於版權問題Sponsors' Ads by Google 以下為谷歌 所提供之廣告A manuscript... writing, translating and proofreading  in progressMenu: List of Health ProblemsQigong (chi kung)Toxicity of Some HerbsSide Effect of Some HerbsHerbs that can be toxic to kidneysTraditional Chinese Medicine TCM Diagnosis Samples of FormulaeTerms of Traditional Chinese MedicineAcupunctureChinese Herb DictionaryQigong classesPrescribed Drug DictionaryEmail our web master for  your suggestion (not for inquiry)Biochemistry Dictionary Qigong classes Research Librarian copy right 版權所有HomeWeather ReportDisclaimerLast update:June \n    29, 2015; 2: 35 p.m. LAH   \n",
        "original_url": "http://alternativehealing.org/gan_cao.htm"
    }
]