[
  {
    "Names": {
      "Name": ["ji xue teng"],
      "Pharmaceutical": ["Radix et Caulis Jixueteng"],
      "Biological": [
        "Millettia dielsiana Harms (香花岩豆藤, 山雞血藤)",
        "Millettia reticulata Benth (昆明雞血藤)",
        "Spatholobus suberectus Dunn (密花豆屬密花豆)",
        "Kadsura interior A.C. Smith (内南五味子)",
        "Kadsura heteroclita (Roxb.) Craib (異形南五味子)"
      ],
      "Common": [
        "Diel's millettia (Millettia dielsiana) (Spatholobus suberectus)"
      ],
      "Other name": [
        "feng xue teng 風血藤",
        "ma lu teng 馬鹿藤",
        "zi geng teng 紫梗藤"
      ],
      "Chinese": [
        "雞血藤",
        "香花岩豆藤",
        "山雞血藤",
        "昆明雞血藤",
        "密花豆屬密花豆",
        "内南五味子",
        "異形南五味子",
        "風血藤",
        "馬鹿藤",
        "紫梗藤"
      ],
      "Pronunciation in Korean": ["kyehyoltung"],
      "Pronunciation in Japanese": ["keiketto"],
      "Pronunciation in Cantonese": ["gai1 hyut3 tang4"],
      "Pinyin Pronunciation": ["ji xue teng"]
    },
    "Type": "Herb",
    "Geography": ["Guangdong", "Guangxi", "Yunnan"],
    "Properties": ["Bitter", "Slightly sweet", "Warm", "Nontoxic"],
    "Meridians": ["Heart", "Spleen", "Liver"],
    "Maladies Treated": [
      "Irregular menses",
      "Menstrual flow not smooth",
      "Menostasis due to blood deficiency",
      "Patterns due to blood deficiency or blood stasis",
      "Leukopenia (white blood cell count decrease): ji xue teng syrup reported certain efficacy",
      "Low platelet count: ji xue teng syrup is being used and getting some result",
      "Rheumatoid arthritis, especially chronic patients with blood deficiency and blood stasis pattern",
      "Rheumatic arthralgia with numbness of hands and feet",
      "Paralysis of limbs",
      "Sequelae of stroke with limb paralysis; to be combined with herbs that benefit qi, nourish blood, invigorate blood, and open the collaterals",
      "Blood deficiency with sallow complexion; to be combined with qi and blood tonics"
    ],
    "Medical Function": [
      "Invigorates blood and supplements blood; suitable for blood stasis and blood deficiency patterns",
      "Regulates menstruation in cases with blood deficiency or blood stasis where the menstrual flow is not smooth"
    ],
    "Dosage": "10–20 g.\nConcentrated extract: 0.5–2 g.",
    "Samples of Formulae": "For blood stasis and to regulate menses: Ji Xue Teng (Diel's millettia / Spatholobus suberectus) + Hong Hua (Safflower) + Chuan Xiong (Ligusticum chuanxiong rhizome) + Xiang Fu (Cyperus rhizome); indicated to invigorate blood, transform stasis, and regulate menstruation.\n\nFor blood deficiency and to regulate menses: Ji Xue Teng (Diel's millettia / Spatholobus suberectus) + Shu Di Huang (Prepared rehmannia root) + Dang Gui (Angelica sinensis root); indicated to nourish blood and regulate menstruation.",
    "Contraindications": "Use with care in patterns of yinxu with fire (陰虛火旺).",
    "Research": "Decoction of Millettia dielsiana (山雞血藤) or Spatholobus suberectus (密花豆) improved experimentally induced anemia in rabbits and showed anti-inflammatory effects (animal experiment).\n\nSmall doses enhanced rhythmic uterine contractions of rabbits; larger doses produced stronger contractions. Pregnant uteri were more sensitive (animal experiment).\n\nDecoction of Millettia dielsiana (山雞血藤) inhibited Staphylococcus aureus in vitro.\n\nEnhanced macrophage function and improved immune function (experimental observation).\n\nIn vitro, inhibited platelet aggregation induced by adenosine diphosphate or collagen; lowered vascular resistance; increased coronary artery blood flow of isolated heart preparations and femoral artery blood flow (in vitro/isolated organ experiments).\n\nImproved reduced white blood cell counts in laboratory mice caused by cyclophosphamide (環磷醯胺) (animal experiment).\n\nLowered total cholesterol and increased high-density cholesterol in quails (animal experiment); exhibited cardiac inhibitory and blood pressure–lowering effects.\n\nModern Research: Spatholobus suberectus 密花豆 — see Medical function on other items; remaining details are covered under pharmacology above.",
    "Notes": "",
    "Chemical Ingredients": {
      "Compounds": [
        "jixuetengsterol",
        "Organic acids",
        "Tannic acid (tannins)",
        "Friedelin",
        "Friedelin sterol",
        "Taraxerone",
        "β-Sitosterol",
        "Stigmasterol",
        "Campesterol",
        "Calcium oxalate"
      ]
    },
    "References": [
      "[1] 王巍等，中西醫结合杂誌，1988; 8（10）: 620",
      "[2] 王巍等，中西醫结合杂誌，1991; 16（5）: 299"
    ],
    "Further Reading": [],
    "Original Text": "ji xue teng, Millettia Dielsiana, Complementary and Alternative Healing University\nComplementary and Alternative Healing University \n  中藥詞典                 Chinese Herb Dictionary      Search this site     在本網站找資料Search this siteList of Health ProblemsChinese Herb DictionaryQigongTraditional Chinese Medicine (TCM)AcupuncturePrescribed Drug DictionaryBiochemistry DictionaryLecture SlidesResearch LibrarianGeneral Online LibraryResearch SitesViagraMassage/AcupressureHypnotherapyTell us what you wantNotify Changes & New Information  ji xue teng 雞血藤 Translated by: Joe Hing kwok Chu\nHerb圖片來源﹕:中國科普博覽會植物館雞血藤莖葉 \nPlantPresent Day Applications:現代應用﹕ji xue teng syrup is being used in low platelet count and getting some result..近代以雞血藤糖漿治白血球細胞減少症有一定療效.Pharmaceutical name:英文藥名﹕Radix et Caulis JixuetengBiological name:拉丁文學名﹕Millettia Dielsiana Harms  (香花岩豆藤 (山雞血藤).)Millettia reticulata Benth , (昆明雞血藤)Spatholobus suberectus Dunn (密花豆屬密花豆)Kadsura interior A.c.Smith  (内南五味子)Kadsura heteroclita (Roxb.) Craib．(異形南五味子)Pron. in Japanese:日語發音﹕keikettoPron. in Korean:韓語發音﹕kyehyoltungPron. in Cantonese:粵音﹕gai1 hyut3 tang4Other Names:別名﹕feng xue teng 風血藤,  ma lu teng 馬鹿藤,  zi geng teng 紫梗藤.Common Name:英文名﹕Diel's millettia (Millettia Dielsiana) (Spatholobus suberectus)Distribution:產地﹕Guangdong, Guangxi, Yunnan provinces of China.分 佈 於 廣 東 ﹐ 廣 西﹐ 雲南  。Properties(characteristics)﹕性味﹕bitter, slightly sweet, warm and nontoxic.味苦﹐微甘，性溫﹐無毒。Channels (meridians) entered: 歸經﹕heart, spleen, liver.歸心﹐脾﹐肝經。　　Medical functions:藥理﹕ Medical functions:Decoction of Millettia Dielsiana Harms   (山雞血藤) or Spatholobus suberectus Dunn (密花豆), showed that it could improve the anemia condition (created in laboratory) of rabbits and possessed anti-inflammatory effect.Small amount can enhance the rhythmic contraction of the uteri of rabbits, and in larger amount the effect is even stronger. Conceived uteri are sensitive.Decoction of Millettia Dielsiana (山雞血藤) can inhibit Staphylococcus aureusDecoction of Millettia Dielsiana (山雞血藤) enhance the function of macrophages and improve immune system.Inhibits platelet coagulation caused by adenosine diphosphate (in vitro), thus lower the vaso-resistance and improved the circulation of the coronary arteries and the circulation in the thigh.improved the low white cell count of lab mice caused by  cyclophosphamide  (環磷醯胺).lowered total cholesterol and increased the low density cholesterol of quails藥理﹕密花豆及山雞血藤煎劑對實驗性貧血的家兔均有補血作用，有抗炎作用。小劑量能增強子宮節律性收縮，較大劑量收縮更顯著，已孕子宮較未孕子宮敏感。山雞血藤煎劑體外試驗對金黃葡萄球菌有抑制作用。增強巨噬細胞功能。增強免功能。對環磷醯胺所致的小白鼠白血球細胞下降有顯著的治療作用。在體外能抑制二磷腺甘或膠原誘導的血小板聚集。降低血管阻力，如能增加離體免心冠脈血流量﹐股動脈的血流量等。降低鹌鹑的總胆固醇，提高高密度胆固醇：抑制心脏與降低血压作用 Actions & Indications:主治﹕Actions & Indications: irregular menses, flow of menses not smooth, menostasis due to blood deficient  , suitable for diseases due to blood deficient or blood stasis   . low platelet count rheumatoid arthritis, especially with blood deficient and blood stasis. seguelae of strokes; combine other herbs with blood and qi tonic properties. blood deficient; combine other herbs with qi and blood tonic properties. 用於月經不調﹐經行不暢﹐血虛經閉等症。 治白血球細胞減少症。 雞血藤既能活血，又能補血，對 血瘀﹐血虛 之症均適用。 風濕性關節炎，尤其是慢性患者有血虛血瘀的更為適宜。用於風濕痺痛及手足麻木﹐肢體癱瘓﹐血虛萎黃等，配祛風濕藥同用。 治中風後肢體癱瘓，配益氣養血活血通絡藥同用。 用於血虛萎黃，則配補益氣血藥同用Chemical ingredients:化學成份﹕ jixuetengsterol雞血藤醇organic acid有機酸tannin acid鞣質friedelin無羈friedelinsterol無羈醇taraxerone蒲公英賽酮β- Sitosterolβ-谷甾醇stigmasterol豆甾醇campesterol菜油固醇calcium oxalate草酸鈣Dosage:用量﹕10 to 20 g. Concentrate extract 0.5 ~ 2 g.10～20克；濃縮中藥：0.5～2 克。Samples of formulae:處方舉例﹕For blood stasis: ji xue teng, hong hua, chuan xiong , xiang fuFor blood deficient: ji xue teng,  shu di huang, dang gui.瘀滯者，配 紅花﹐川 芎﹐香附子﹐等以活血化瘀調經。血虛者，配 熟地黃﹐當 歸, 等以養血調經。Modern Research:現代研究﹕Spatholobus suberectus 密花豆See medical function on other items  .其餘請看藥理條。 Cautions:禁忌﹕Use with care for those with yinxu with fire syndrome. 陰虚火旺者慎用。　[1] 王巍等，中西醫结合杂誌，1988; 8 （10）620[2] 王巍等，中西醫结合杂誌，1991; 16 (5) 299Search this siteProblems with website? Please Click here for comment. (Not for inquiry )    Click here for inquiryCopyright Notice 按此看關於版權問題 Sponsors' Ads by Google 以下為谷歌 所提供之廣告 List of Health ProblemsChinese Herb DictionaryToxicity of Some HerbsSide Effect of Some HerbsHerbs that can be toxic to kidneysTraditional Chinese MedicineTCM DiagnosisSamples of FormulaeTerms of Traditional Chinese MedicineAcupuncturecopy right 版權所有Qigong (chi kung)Prescribed Drug DictionaryEmail our web master for  your suggestion (not for inquiry)Biochemistry DictionaryGeneral Online LibraryQigong classesFake Email WarningResearch LibrarianSearchQigong classesHomeWeather ReportDisclaimerLast update: Sept 26, 2013; 11:15 a.m. LAH   \n",
    "original_url": "http://alternativehealing.org/ji_xue_teng.htm"
  },
  {
    "Names": {
      "Name": ["xu chang qing", "徐長卿"],
      "Pharmaceutical": ["Radix Cynanchi paniculati"],
      "Botanical": ["Cynanchum paniculatum (Bge.) Kitag"],
      "Chinese": ["徐長卿"],
      "Common": [],
      "Other": [
        "liao tiao zhu 寮刁竹",
        "xiao yao zhu 逍遙竹",
        "yao zhu xiao 遙竹逍",
        "yao shan zhu 瑤山竹",
        "liao tiao zhu 了刁竹",
        "dui jie lian 對節蓮",
        "zhu ye xi xin 竹葉細辛",
        "tong luo cao 銅鑼草",
        "yi zhi xiang 一枝香",
        "ying xiaon cao 英雄草"
      ],
      "Pronunciation in Korean": [],
      "Pronunciation in Japanese": ["jiyochougou"],
      "Pronunciation in Cantonese": ["ceoi4 ceong4 hing1"],
      "Pinyin Pronunciation": []
    },
    "Type": "Herb",
    "Geography": [
      "Distributed in most part of China.",
      "Inner Mongolia",
      "Jiangsu",
      "Hebei",
      "Hunan",
      "Anhui",
      "Guizhou",
      "Guangxi",
      "Northeastern provinces of China"
    ],
    "Properties": ["Acrid", "Warm"],
    "Meridians": ["Liver", "Stomach"],
    "Maladies Treated": [
      "Stomach sicknesses",
      "Toothache",
      "Wind-damp bi pain (rheumatism pain)",
      "Lumbago",
      "Abdominal pain",
      "Urination difficulty",
      "Diarrhea",
      "Dysentery",
      "Eczema",
      "Hives",
      "Poisonous snake bites",
      "Gastric pain",
      "Shingles (帶狀疱疹)",
      "Cirrhosis ascites (肝硬化腹水)",
      "Irregular menstruation (月經不調)",
      "Dysmenorrhea (痛經)",
      "Heart–Stomach qi pain (心胃氣痛)",
      "Traumatic injury swelling and pain (跌打腫痛)",
      "Contact dermatitis",
      "Tinea (頑癬)"
    ],
    "Medical Function": [
      "Arresting pain; stopping itching; reducing swelling.",
      "Qufeng (dispelling wind) and stopping pain; detoxification and reducing swelling; warming the meridian and activating the collaterals. [1]"
    ],
    "Dosage": "3–12 g (3～12 克).",
    "Samples of Formulae": "For poisonous snake bite: Xu Chang Qing [Cynanchum paniculatum root] with Ban Bian Lian [Lobelia chinensis]; boil with water. Take orally and/or apply externally. [1]\n\nFor eczema, hives, contact dermatitis, tinea: Xu Chang Qing 6–12 g each time; prepare as decoction for oral use and/or external wash; can also be prepared as injections. Treated 36 cases: 24 healed, 8 improved, 4 ineffective. [1]",
    "Contraindications": "Use with care if the patient is weak. [1]",
    "Research": "Sedation: Paeonol (牡丹酚) has a sedative effect. [2]\n\nHeart rate lowering and blood pressure–lowering effects. [2]\n\nLipid-lowering effect. [2]\n\nSmooth muscle relaxation. [2]\n\nAntibacterial effect: Cynanchum whole-plant decoction at 1:4 shows inhibition against Shigella (福氏痢疾杆菌) and Salmonella typhi (傷寒杆菌); at 1:2 shows inhibition against Pseudomonas aeruginosa (綠膿杆菌), Escherichia coli (大腸杆菌), and Staphylococcus aureus (金色葡萄球菌). Paeonol in vitro: at 1:15000 shows inhibition against Escherichia coli and Bacillus subtilis (枯草杆菌); at 1:2000 shows inhibition against Staphylococcus aureus. [2]\n\nPaeonol anti-tumor effect. [3]\n\nThe ethanol extract of Xu Chang Qing prevented apoptosis in a neuron cell model and reduced the apoptosis rate in brain tissue after herpes simplex virus encephalitis in lab mice. [5]",
    "Notes": "",
    "Chemical Ingredients": {
      "Whole herb": [
        "Paeonol (牡丹酚), about 1%",
        "Sarcostin (肉珊瑚甙元)",
        "Deacylcynanchogenin (去酚牛皮消甙元)",
        "Tomentogenin (茸毛牛奶藤甙元)",
        "Substances similar to deacylmetaplexigenin (和去酰蘿甙元極為相似的物質)",
        "Acetic acid (醋酸)",
        "Cinnamic acid (桂皮酸) and others"
      ],
      "Root": [
        "Glycosides (黃酮甙)",
        "Sugars (糖類)",
        "Amino acids (氨基酸)",
        "Paeonol (牡丹酚)",
        "C21 steroids (C21甾類化合物)"
      ],
      "Hydrolyzates": [
        "Sarcostin (肉珊瑚甙元)",
        "Deacyl-metaplexigenin (去乙酰蘿藦甙元)",
        "Deacylcynanchogenin (去乙酰牛皮消甙元)",
        "Tomentogenin (托曼甙元)",
        "4-Acetylphenol (4-羥基苯乙酮)",
        "2,5-dihydroxy-4-methoxyacetophenone (2,5-二羟基-4'-甲氧基苯乙酮)",
        "2,3-dihydroxy-4-methoxyacetophenone (2,3-二羟基-4'-甲氧基苯乙酮)",
        "Acetoveratrone (乙酰藜蘆酮)",
        "2,5-dimethoxyhydroquinone (2,5-二甲氧基對苯二酚)",
        "Vanillic acid (香莢蘭酸)",
        "Resacetophenone (二羥基苯乙酮)",
        "m-Acetylphenol (m-乙酰苯酚)",
        "3,5-dimethylhydroquinone (3,5-二甲基氫醌)"
      ],
      "Also contains": [
        "D-cymarose (D-加拿大麻糖)",
        "D-digitoxose (D-洋地黃毒糖)",
        "L-oleandrose (L-夾竹桃糖)",
        "D-sarmentose (D-沙門糖)"
      ],
      "Other reports": [
        "C21 deformed steroidal glycosides compounds (C21變形甾甙類化合物)",
        "Glaucogenin D (由芫花葉白前甙元D)",
        "Cynapanoside A, B, C (不同糖鏈成的徐長卿甙A，B，C)",
        "Glaucogenin B (芫花葉白前甙元B)",
        "Cyna-tratside B (白薇甙B)",
        "Isopaeonol (異丹皮酚)",
        "Decyl stearate (硬脂酸癸酯)",
        "Triacontane (蜂花烷)",
        "Hexadecene (十六烯)",
        "β-sitosterol (β-谷甾醇)",
        "D-erythritol (phycitol, meso-erythritol, L-erythritol, erythrit) (D-赤絲草醇)"
      ]
    },
    "References": [
      "[1] Zhong Yao Da Ci Dian    中藥大辭典",
      "[2] Zhong Hua Ben Cao      中華本草",
      "[3] Li Na, Anhui Medical University, 2007.     安徽医科大学 2007年; 李娜",
      "[4] doi: 10.1007/s12272-012-0404-4. Epub 2012 May 3.",
      "[5] Int J Immunopathol Pharmacol. 2012 Jan-Mar;25(1):259-66."
    ],
    "Further Reading": [],
    "Original Text": "xu chang qing, uses, side effects, drug interaction, toxicity and caution ,Complementary and Alternative Healing UniversityComplementary and Alternative Healing University   中藥詞典                 Chinese Herb Dictionary      Search this site     在本網站找資料     Discussion FormSearch this siteList of Health ProblemsChinese Herb DictionaryQigongTraditional Chinese Medicine (TCM)AcupuncturePrescribed Drug DictionaryBiochemistry DictionaryLecture SlidesResearch LibrarianGeneral Online LibrarySearchResearch SitesViagraMassage/AcupressureHypnotherapyTell us what you wantNotify Changes & New Information　　　                 　      　　 xu chang qing 徐長卿            (in English and Chinese 中英文)Translated by: Joe Hing kwok Chu 朱興國編譯Pharmaceutical name:英文藥名﹕Radix Cynanchi paniculatiBotanical name:學名﹕Cynanchum paniculatum (Bge.) KitagPron. in Japanese:日語發音﹕jiyochougouPron. in Korean:韓語發音﹕ Pron. in Cantonese::粵音﹕ceoi4 ceong4 hing1Other Names:別名﹕liao tiao zhu 寮刁竹、xiao yao zhu 逍遙竹、yao zhu xiao 遙竹逍、yao shan zhu 瑤山竹、liao tiao zhu 了刁竹、dui jie lian 對節蓮、zhu ye xi xin 竹葉細辛 、tong luo cao 銅鑼草、yi zhi xiang 一枝香、ying xiaon cao 英雄草Common Name:外文名﹕ Distribution:產地﹕Distributed in most part of China. Being produced in Inner Mongolia, Jiangsu, Hebei, Hunan, anhui, Guizhou, Guangxi, and northeastern provinces of China.全國大部分地區均有分佈。產於內蒙古，江蘇、河北、湖南、安徽、貴州、廣西及東北等地。Properties(characteristics)﹕性味﹕acrid, warm.辛，溫。Channels (meridians) entered: 歸經﹕liver, stomach.肝，胃。Medical functions:藥理﹕ Sedation: Peony phenol sedative [2]Heart rate lowering blood pressure  [2]Lipid-lowering effect  [2]Smooth muscle relaxation  [2]Antibacterial effect: Cynanchum whole plant decoction 1:4 against Shigella, Salmonella typhi; 1:2 against Pseudomonas aeruginosa, Escherichia coli, Staphylococcus aureus inhibition. Peony phenol in vitro, 1:15000 Escherichia coli, Bacillus subtilis, Staphylococcus aureus 1:2000 inhibition  [2]Peony phenol anti-tumor effect [3]the ethanol extract of xu chang qing could prevent apoptosis in the neuron cell model and reduce apoptosis rate in brain tissue after herpes simplex virus encephalitis of lab mice. [5] 鎮靜作用：牡丹酚有鎮靜作用【2】減慢心率降血壓【2】降血脂作用【2】鬆馳平滑肌作用【2】抗菌作用：徐長卿全植物煎劑1：4對福氏痢疾杆菌、傷寒杆菌；1：2對綠膿杆菌、大腸杆菌、金色葡萄球菌有抑制作用。牡丹酚在體外，1：15000對大腸杆菌、枯草杆菌，1：2000對金黃色葡萄球菌有抑制作【2】牡丹酚有抗腫瘤作用【3】在小鼠單純皰疹病毒性腦炎後試驗中，徐長卿的乙醇提取物能防止，或降低腦組織細胞凋亡率。【5】  Actions & Indications:主治﹕It can be used in arresting pain, stopping itching; reducing swelling. For: stomach sicknesses; toothache; pain in rheumatoid arthritis; lumbago; abdominal pain; toothache; urination difficulty; diarrhea; dysentery; eczema; hives; snakebites[1]\"Common Usage of Chinese Herbal Medicine Handbook of Guangzhou forces\": \"Arresting  pain; detoxification and reducing swelling; warming the meridian and activating the collatorals. For treatment of: poisonous snake bites, pain in rheumatism, gastric pain, shingles, cirrhosis, irregular menstruation. , dysmenorrhea.\" [1]《廣州部隊常用中草藥手冊》：\"祛風止痛，解毒消腫，溫經通絡。治毒蛇咬傷，風濕骨痛，心胃氣痛，跌打腫痛，帶狀疱疹，肝硬化腹水，月經不調，痛經。\"止痛止痒；消腫。主胃病；牙痛；風濕痺痛；腰痛；脘腹疼痛； 牙痛；小便不利；泄瀉；痢疾；濕疹；荨麻疹；毒蛇咬傷。【1】Chemical ingredients: [2] [4]化學成份﹕【2】【4】Whole herb contains: 全草含：Paeonol, about l%牡丹酚約l%Sarcostin肉珊瑚甙元Deacylcynanchogenin去酚牛皮消甙元Tomentogenin茸毛牛 奶藤甙元Substances similar to deacylmetaplexigenin和去 酰蘿甙元極為相似的物質Acetic acid醋酸 、Cinnamic acid etc桂皮酸等Root contains:根含：Glycosides黃酮甙Sugars糖類Amino acids氨基酸Peonol牡丹酚C21 steroidsC21甾類化合物The hydrolyzates:水解產物中含：Sarcostin肉珊瑚甙元Deacyl-metaplexigenin去乙酰蘿藦甙元Deacylcynan-chogenin去乙酰牛皮消甙元Tomentogenin 托曼甙元4-Acetylphenol4-羥基苯乙酮2,5-dihydroxy-4-methoxyacetophenone2,5-二羟基-4'-甲氧基苯乙酮2,3-dihydroxy-4-methoxyacetophenone2,3-二羟基-4'-甲氧基苯乙酮Acetoveratrone乙酰藜蘆酮2,5-dimethoxyhydroquinone 2,5-二甲氧基對苯二酚Vanillic acid香莢蘭酸Resacetophenone二羥基苯乙酮m-acetylphenolm-乙酰苯酚3,5-dimethyl hydroquinone3,5-二甲基氫醌Also contains:尚含：D-cymaroseD-加拿大麻糖D-digitoxoseD-洋地黃毒糖L-oleandroseL-夾竹桃糖D-sarmentoseD-沙 門糖In other reports, it contains:另有報道含：C21 deformed steroidal glycosides compoundsC21變形甾甙類化合物Glaucogenin D由芫花葉白前甙元DCynapanoside A，B，C不同糖鏈成的徐長卿甙A，B，CGlaucogenin B芫花葉白前甙元BCyna-tratside B白薇甙BIsopaeonol異丹皮酚Decyl stearate硬脂酸癸酯Ttriacontane蜂花烷Hexadecene十六烯β-sitosterolβ-谷甾醇D-erythritol (phycitol, meso-erythritol, L-erythritol, erythrit)D-赤絲草醇Dosage:用 量﹕3～12 克。Samples of formulae:處方舉 例﹕For treatment of poisonous snake bite: xu chang qing, ban bian lian boil with water, Take orally or/also apply externally.. [1]It is effective for eczema, hives, contact dermatitis, tinea, etc.  Therapy method: xu chang qing 6 to 12 grams; each time,  make into decoction. Oral consumption, or/also for external application; or can be made into injectiones. Treated 36 cases: Result: 24 cases healed, 8 cases improved, 4 cases ineffective. [1]治毒蛇咬傷：徐長卿，半邊蓮水煎，內服；或外用。【1】治濕疹、麻疹、接觸性皮炎、頑癬等均有效果。用法：每次用徐長卿2-4錢，水煎服，亦可外洗。或制成注射劑、配劑等應用。 治36例： 結果，痊愈者24例，顯效8例，無效4例。【1】Modern Research:現代研究﹕ Toxicity & Cautions:毒素與禁忌﹕Use with care, if the patient is weak.[1]體弱者慎服。【1】[1]Zhong Yao Da Ci Dian    中藥大辭典[2] Zhong Hua Ben Cao      中華本草[3] Li Na, Anhui Medical University, 2007.     安徽医科大学 2007年; 李娜[4] doi: 10.1007/s12272-012-0404-4. Epub 2012 May 3.[5] Int J Immunopathol Pharmacol. 2012 Jan-Mar;25(1):259-66. Problems with website? Please Click here for comment. (Not for inquiry )      Click here for inquiry    Ads by Google:   A manuscript... writing, translating and proofreading  in progress  Copyright Notice 按此看關於 版權問題List of Health ProblemsChinese Herb DictionaryToxicity of Some HerbsSide Effect of Some HerbsHerbs that can be toxic to kidneysTraditional Chinese Medicine TCM Diagnosis Samples of FormulaeTerms of Traditional Chinese MedicineAcupuncturecopy right 版權所有Qigong (chi kung)Prescribed Drug DictionaryEmail our web master for  your suggestion (not for inquiry)Biochemistry DictionaryGeneral Online LibraryQigong classesFake Email WarningResearch LibrarianSearchQigong classesDisclaimerHomeWeather ReportLast update: Oct 25, 2014; 12:27:p.m. LAH  ",
    "original_url": "http://alternativehealing.org/xu_chang_qing.htm"
  },
  {
    "Names": {
      "Name": ["tie xian cai"],
      "Pharmaceutical": ["Herba Acalyphae"],
      "Botanical": ["Acalypha australis Linn."],
      "Chinese": [
        "鐵莧菜",
        "人莧",
        "血見愁",
        "海蚌含珠",
        "撮斗裝珍珠",
        "葉裡含珠",
        "野麻草",
        "燈盞窩"
      ],
      "Common": ["Virginia copperleaf", "Asian copperleaf"],
      "Other": [
        "ren xian",
        "xue jian chou",
        "hai pang han zhu",
        "cuo dou zhuang zhen zhu",
        "ye li han zhu",
        "ye ma cai",
        "deng zhan wo"
      ],
      "Pronunciation in Korean": ["cheol xi跣 chae"],
      "Pronunciation in Japanese": [],
      "Pronunciation in Cantonese": ["tit3 jin6 coi3"],
      "Pinyin Pronunciation": ["Tiě Xi跣 C跬"]
    },
    "Type": "Herb",
    "Geography": [
      "China: south of the Yangtze River; middle and lower reaches of the Yellow River; coastal regions; southwest and south China provinces and regions",
      "North Korea",
      "Vietnam",
      "Japan",
      "Philippines",
      "United States: New York State"
    ],
    "Properties": ["Bitter", "Tart", "Cool"],
    "Meridians": ["Heart", "Lung", "Large Intestine", "Small Intestine"],
    "Maladies Treated": [
      "Enteritis",
      "Bacterial dysentery",
      "Amoebic dysentery",
      "Diarrhea (decoction, internal)",
      "Pediatric malnutrition/infantile malnutrition (小兒疳積) (fresh herb with pig liver, internal)",
      "Hepatitis",
      "Malaria",
      "Vomiting blood",
      "Epistaxis (nose bleeding)",
      "Hematuria",
      "Blood in the stool",
      "Uterine bleeding (fresh herb juice or decoction, internal)",
      "Carbuncle sores (癰癤瘡瘍) (topical)",
      "Traumatic bleeding (fresh herb smashed with a little sugar, topical)",
      "Traumatic injuries/traumatic wounds (decoction, internal)",
      "Eczema (external wash or juice applied topically)",
      "Dermatitis (external wash)",
      "Snake bites (with ban bian lian and da qing ye; internal)",
      "Asthma (decoction, internal)",
      "Cough (decoction, internal)",
      "Coughing up blood (decoction, internal)",
      "Lack of mother's milk (乳汁不足) (fresh 15–30 g or dried 6–9 g, decocted with fish; internal)",
      "Infantile bloating, testicular enlargement (fresh herb, decoction; internal)",
      "Necrosis fistula/osteomyelitic sinus (附骨疽瘘管) (with gou er cha rhizome; simmered with wine and water; internal)"
    ],
    "Medical Function": [
      "Clears heat and toxin (清熱解毒)",
      "Resolves accumulation / improves nutrition (消積)",
      "Stops dysentery (止痢)",
      "Arrests bleeding (止血)"
    ],
    "Dosage": "Daily dosage: 15–30 g (0.5–1 liang). External use: appropriate amount; use fresh herb, smash and apply to affected area.",
    "Samples of Formulae": "Enteritis, diarrhea, vomiting blood, nose bleeding, blood in the stool, cough, asthma: dried tie xian cai (Acalypha australis) 30–60 g. Decoction, taken orally. Source: Guangzhou armed forces \"Chinese Herbal Medicine Handbook\".\nDermatitis, eczema: use tie xian cai (Acalypha australis) decoction as an external wash. Source: Guangzhou armed forces \"Chinese Herbal Medicine Handbook\".\nTraumatic bleeding: fresh tie xian cai (Acalypha australis) appropriate amount with a little sugar. Smash and apply topically.\nSnake bites: tie xian cai (Acalypha australis), ban bian lian (Lobelia chinensis), da qing ye (Isatis leaf) 30 g each. Decoction, taken orally. Source: \"Jiangxi Herbs\".\nTraumatic injuries/wounds: xue jian chou (tie xian cai) (Acalypha australis) 18–30 g (six qian to one liang). Decoction, taken orally. Source: \"Shanghai Chinese Herbal Medicine\".\nInfantile malnutrition: fresh tie xian cai (Acalypha australis) 30–60 g. Make soup with pig liver and take orally. Source: \"Zhejiang Folk Commonly Used Herbs\".\nInfantile bloating, testicular enlargement: fresh tie xian cai (Acalypha australis) 30–60 g. Decoction, taken orally. Source: \"Zhejiang Folk Commonly Used Herbs\".\nUterine bleeding: fresh tie xian cai (Acalypha australis) 30–60 g. Smash to make juice or decoct; take orally. Source: \"Northeast Chinese Herbal Medicine Handbook\".\nLack of mother's milk: fresh tie xian cai (Acalypha australis) 15–30 g, or dried herb 6–9 g. Decoct with fish and take orally. Source: \"Northeast Chinese Herbal Medicine Handbook\".\nScarlet fever rash and eczema: deng zhan wo (tie xian cai) (Acalypha australis) smash, extract juice, and apply externally. Source: \"Guizhou medicine\".\nAsthma or coughing up blood: deng zhan wo (tie xian cai) (Acalypha australis) 60 g (two liang). Decoct and take orally. Source: \"Guizhou medicine\".\nNecrosis fistula (附骨疽瘘管): dried tie xian cai (Acalypha australis) 60–90 g, dried gou er cha (Berchemia rhizome) 60 g. Simmer with wine and water; take orally. Source: \"Fujian Chinese Herbal Medicine\".",
    "Contraindications": "Do not use during pregnancy. Those who are old or weak with qi deficiency should use less. Source: 《泉州本草》.",
    "Research": "In vitro, tie xian cai decoction showed antibacterial activity against several common Shigella species, especially Shigella dysenteriae (2-fold dilution method). At a dilution of 1:256, it exhibited not only bacteriostatic but also bactericidal effects. Activity against Shigella flexneri and Shigella boydii (Freund) was weaker, and activity against Shigella sonnei was the weakest. Tablets made from tie xian cai also showed anti-Shigella effects in vitro.\nIn vitro, a 50% tie xian cai decoction exhibited varying degrees of inhibitory effects on Staphylococcus aureus, Vibrio cholerae, Bacillus anthracis, and Shigella flexneri (agar plate method). Antibacterial constituents are present in the roots, stems, and leaves; the antibacterial potency appears to differ among plant parts and target bacteria. An alcohol extract of tie xian cai also showed antibacterial activity.",
    "Notes": "",
    "Chemical Ingredients": [],
    "References": [
      "[1] http://plants.usda.gov/java/profile?symbol=ACAU6",
      "Guangzhou armed forces \"Chinese Herbal Medicine Handbook\"",
      "Jiangxi Herbs",
      "Shanghai Chinese Herbal Medicine",
      "Zhejiang Folk Commonly Used Herbs",
      "Northeast Chinese Herbal Medicine Handbook",
      "Guizhou medicine",
      "Fujian Chinese Herbal Medicine",
      "《泉州本草》",
      "中文摘錄:《全國中草藥匯編》"
    ],
    "Further Reading": [],
    "Original Text": "tie xian cai, Complementary and Alternative Healing UniversityComplementary and Alternative Healing University   中藥詞典                 Chinese Herb Dictionary      Search this site     在本網站找資料Search this siteList of Health ProblemsChinese Herb DictionaryQigongTraditional Chinese Medicine (TCM)AcupuncturePrescribed Drug DictionaryBiochemistry DictionaryLecture SlidesResearch LibrarianGeneral Online LibraryResearch SitesViagraMassage/AcupressureHypnotherapyTell us what you wantNotify Changes & New Information  tie xian cai  鐵莧菜  (in English and Chinese 中英文)Translated by: Joe Hing kwok ChuPharmaceutical name:英文藥名﹕Herba AcalyphaeBotanical name:拉丁生物學名﹕Acalypha australis Linn.Pron. in Japanese:日語發音﹕ Pron. in Korean:韓語發音﹕cheol xi跣 chaePron. in Cantonese::粵音﹕tit3 jin6 coi3Other Names:別名﹕Other names:ren xian人莧xue jian chou血見愁hai pang han zhu海蚌含珠cuo dou zhuang zhen zhu撮斗裝珍珠ye li han zhu葉裡含珠ye ma cai野麻草deng zhan wo燈盞窩【pinyin name, 拼音名】Tiě Xi跣 C跬Common Name:英文名﹕Virginia Copperleaf. Asian copperleaf [1]Distribution:產地﹕Distributed in the south of the Yangtze River, middle and lower end of Yellow River, coastal and southwest and south China provinces other regions in China; additionally, in North Korea, Vietnam, Japan, the Philippines, New York state of the United States, .在中國分佈於長江以南，黃河中下游，沿海及西南、華南各省區；此外，朝鮮、越南、日本、菲律賓, 美國的紐約州也有。Properties(characteristics)﹕性味﹕bitter, tart, cool.苦、澀，涼。Channels (meridians) entered: 歸經﹕heart, lung, large intestine, small intestine.心，肺，大腸，小腸。Medical functions:藥理﹕ Medical function: In vitro tie xian cai decoction possesses antibiotic effect on several common Shigella antibacterial, especially on Shigella dysentery bacillus (2-fold dilution method in vitro). The dilution of 1:256, not only possesses bacteria inhibition effect also possesses bactericidal effect. Antibiotic effect on Shushi and Freund Shigella is less, and the antibiotic effect of Shigella sonnei bacilli is least. In vitro the tablets made ​​of tie xian cai also possesses anti Shigella effect.  In vitro, 50% tie xian cai decoction possesses various degrees of inhibitory effect on Staphylococcus aureus, Vibrio cholerae, Bacillus anthracis, Shushi Shigella (using agar plate method). The antibacterial effect seems to be different on different parts of the roots, stems, and leaves, and on  different bacteria. Tie xian cai alcohol extract also possesses  antibacterial effect. 藥理﹕鐵莧水煎液在體外對幾種常見的痢疾杆菌都有抗菌作用，尤其對志賀氏痢疾杆菌效果好（試管內2倍稀釋法），在稀釋度為1:256時，不但有抑菌效力，且有殺菌作用。對舒氏和弗氏痢疾杆菌作用次之，對宋內氏痢疾杆菌效果最差。以鐵莧制成的片劑，在體外亦有同樣抗痢疾杆菌之效。50％鐵莧煎劑在體外對金黃色葡萄球菌、霍亂弧菌、炭疽杆菌、舒氏痢疾杆菌有不同程度抑菌作用（瓊脂平板法）；其根，莖、葉中皆含抗菌成分，但對不同細菌，用植物的不同部分其抗菌效力似有差異；鐵莧醇提物亦有同樣抗菌作用。Actions & Indications:主治﹕Detoxifies, improves nutrition, stops dysentery, arrests bleeding. For treatment of enteritis, dysentery, amoebic dysentery, malnutrition in children, hepatitis, malaria, vomiting blood, epistaxis, hematuria, blood in the stool, uterine bleeding; topical treatment of carbuncle sores, traumatic bleeding, eczema, dermatitis, snake bites.清熱解毒，消積，止痢，止血。用於腸炎，細菌性痢疾，阿米巴痢疾，小兒疳積，肝炎，瘧疾，吐血，衄血，尿血，便血，子宮出血；外用治癰癤瘡瘍，外傷出血，濕疹，皮炎，毒蛇咬傷。  Chemical ingredients:化學成份﹕ Daly Dosage:每日用量﹕15 to 30 g.External use: appropriate amount. Use fresh herb. Smash and apply to affected area.0.5～1兩。外用適量，鮮品搗爛敷患處。Samples of formulae:處方舉例﹕Treatment of enteritis, diarrhea, vomiting blood, nose bleeding, blood in the stool, cough, asthma: dried tie xian cai 30 to 60 g. Make into decoction and take orally. (Guangzhou armed forces \"Chinese Herbal Medicine Handbook\")Treatment of dermatitis, eczema: wash the Jianshui outside oftie xian cai. (Guangzhou armed forces \"Chinese Herbal Medicine Handbook\")Treatment of traumatic bleeding: fresh tie xian cai , appropriate amount, and a little sugar. Smash and apply topically.Treatment of snake bites: tie xian cai, ban bian lian, da qing ye,  30 g each. Make into decoction and take orally. (Jiangxi Herbs)Treating traumatic wounds: tie xian cai 18 to 30 g. Make into decoction and take orally. (\"Shanghai Chinese Herbal Medicine)Treatment of Infantile Malnutrition: fresh tie xian cai 30 to 60 g. Make soup with pig liver. Take orally. (\"Zhejiang Folk Commonly Used Herbs\")Treatment of Infantile bloating, testicular enlargement: fresh tie xian cai 30 to 60 g  products. Make into decoction. Take orally. (\"Zhejiang Folk Commonly Used Herbs\")Treatment of uterine bleeding: fresh tie xian cai 30 to 60 g. Smash and make juice or make into decoction. Take orally. (Northeast Chinese Herbal Medicine Handbook)Treatment of Lack of mother's milk: fresh tie xian cai15 to 30 g. or use dried herb 6 g to 9 g. make into decoction with fish. Take orally. (Northeast Chinese Herbal Medicine Handbook)Treatment of scarlet fever, eczema: fresh tie xian cai, smash and make juice. Apply to affected area. (\"Guizhou medicine\")Treatment of asthma or coughing up blood:  fresh tie xian cai 30 g. Make into decoction and take orally. (\"Guizhou medicine\")Treatment of necrosis fistula: dried tie xian cai dry 60 to 90 g, dried gou er cha  (rhizome berchemia) 60 g. Simmer with wine and water. Take orally.  (Fujian Chinese Herbal Medicine) 治腸炎，痢疾，吐血，衄血，便血，咳嗽氣喘：鐵莧乾品一至二兩。水煎服。（廣州部隊《常用中草藥手冊》）  治皮炎，濕疹：鐵莧煎水外洗。（廣州部隊《常用中草藥手冊》）  治外傷出血：鮮鐵莧菜適量，白糖少許。搗爛外敷。  治蛇咬傷：鐵莧菜、半邊蓮、大青葉各一兩。水煎服。《江西草藥》  治跌打創傷：血見愁(鐵莧菜) 六錢至-兩。水煎服。《上海常用中草藥》  治小兒疳積：鮮鐵莧菜一至二兩，和豬肝煎汁服。《浙江民間常用草藥》  治小兒腹脹，睪丸腫大：鐵莧菜鮮品一至二兩。水煎服。《浙江民間常用草藥》  治子宮出血：鐵莧菜鮮品一至二兩。搗汁服或水煎服。《東北常用中草藥手冊》  治乳汁不足：鐵莧菜鮮晶五錢至一兩，或乾品二至三錢。煎水，煮魚服。《東北常用中草藥手冊》  治丹疹，濕疹：燈盞窩(鐵莧菜)搗絨，取汁外擦。《貴州草藥》  治哮喘或咳血：燈盞窩(鐵莧菜)二兩。煎水服。《貴州草藥》  治附骨疽瘘管：鐵莧菜乾品二至三兩，勾兒茶乾根莖二兩。酒、水煎服。《福建中草藥》Modern Research:現代研究﹕ Toxicity & Cautions:毒素與禁忌﹕ Do not use during pregnancy. Those who are old or weak with qi deficient should use less.\"孕婦忌用，老弱 氣虛者少用。\" 《泉州本草》 中文摘錄:《全國中草藥匯編》[1] http://plants.usda.gov/java/profile?symbol=ACAU6Search this siteProblems with website? Please Click here for comment. (Not for inquiry )    Click here for inquiryCopyright Notice 按此看關於版權問題 Sponsors' Ads by Google 以下為谷歌 所提供之廣告 List of Health ProblemsChinese Herb DictionaryToxicity of Some HerbsSide Effect of Some HerbsHerbs that can be toxic to kidneysTraditional Chinese MedicineTCM DiagnosisSamples of FormulaeTerms of Traditional Chinese MedicineAcupuncturecopy right 版權所有Qigong (chi kung)Prescribed Drug DictionaryEmail our web master for  your suggestion (not for inquiry)Biochemistry DictionaryGeneral Online LibraryQigong classesFake Email WarningResearch LibrarianSearchQigong classesHomeWeather ReportDisclaimerLast update: Sept 28, 2013; 9:15 P.m. LAH   ",
    "original_url": "http://alternativehealing.org/tie_xian_cai.htm"
  },
  {
    "Names": {
      "Name": ["xiang lin tou", "pandan leaves", "香林投"],
      "Pharmaceutical": ["Folium Pandani amaryllifolii"],
      "Biological": [
        "Pandanus amaryllifolius Roxb. Hort. Beng.",
        "Pandanus odoratissimus auct.",
        "Pandanus odorus Ridl.",
        "Pandanus veitchii Mast & T. Moore"
      ],
      "Chemical": [],
      "Common": [
        "Danish: Skruepalme",
        "Dutch: Schroefpalm, Pandan",
        "English: Umbrella tree, Screw pine, Screw tree, Pandan leaves",
        "Estonian: L鬒nav pandan, Kruvipuu",
        "Finnish: Kairapalmu",
        "French: Pandanus",
        "German: Schraubenbaum, Schraubenpalme",
        "Hebrew: הפאנדאנוס Ha-pandanus (refers to entire genus)",
        "Hind:i रंपे, Rampe",
        "Hungarian: Pandanusz lev幨, Panpung lev幨, Csavarp嫮ma lev幨",
        "Indonesian/Malay: Daun pandan, Pandan wangi",
        "Italian: Pandano",
        "Japanese: ニオイタコノキ, ニオイアダン, Nioi-takonoki, Nioi-adan",
        "Khmer: Taey",
        "Korean: 판다누스, Pandanusu",
        "Lao: ໃບເຕີຍ, ເຕີຍ, ເຕີຍຫອມ, ເຕີຍບ້ານ Bai teuy, Teuy, Tey Ban, Tey hom",
        "Lithuanian: Amarilinis pandanas",
        "Malayalalam: ബിരിയാണിക്കൈത Biriyanikkaita",
        "Marathi: आंबेमोहोर पत्ता Ambemohor patta",
        "Norwegian: Skrupalme",
        "Portuguese: Pandano",
        "Sinhala: රම්පා, රම්පේ, රම්පෙ Rampa, Rampeh, Rampe",
        "Spanish: Pandan, Pandano",
        "Swedish: Skruvpalm",
        "Tagalog: Pandan, Pandan mabango",
        "Tamil: ரம்பா Ramba",
        "Thai: ใบเตย, เตยหอม, เตย Panae-wo-nging, Bai Toey, Toey-hom, Toei",
        "Vietnamese: C漧 cơm nếp, Dứa thơm, L� dứa",
        "Yiddish: שרױפֿנבױם Shroyfnboym (refers to the entire genus)"
      ],
      "Other name": [
        "ban lan (斑蘭) (used in Indonesian, Malaysian, Singaporean Chinese)",
        "cheng xiang lan (稱香蘭)",
        "bi xue shu (碧血樹)",
        "xiang lan (香蘭)",
        "qi ye lan (七葉蘭)",
        "xiang lan ye (香蘭葉)"
      ],
      "Chinese": [
        "香林投",
        "斑蘭 (used in Indonesian, Malaysian, Singaporean Chinese)",
        "稱香蘭",
        "碧血樹",
        "香蘭",
        "七葉蘭",
        "香蘭葉"
      ],
      "Pronunciation in Korean": ["pandanusu"],
      "Pronunciation in Japanese": ["nioiadan (ニオイアダン)"],
      "Pronunciation in Cantonese": ["heong1 lam4 tau4"],
      "Pinyin Pronunciation": []
    },
    "Type": "Herb",
    "Geography": [],
    "Properties": ["Sweet", "Bland", "Cold"],
    "Meridians": [],
    "Maladies Treated": [
      "Hepatitis with jaundice: fresh pandan leaves (leaf) 60 g used with xi shu guo (noni fruit) 30 g and sabah snake grass (you dun cao) 30 g; boiled with water and taken orally. Source: Hulu.com, Section of Experienced Formulae."
    ],
    "Medical Function": [
      "Blackening hair: washing hair with pandan leaf decoction combined with juice of ripe noni fruit; used three times per week until results are seen."
    ],
    "Dosage": "Oral: decoction, 15–30 g dried leaf; fresh herb 60–120 g. Alternatively, squeeze for juice and mix with honey and take orally, or make into juice and gargle.\n\nExternal: appropriate amount; wash, smash and apply topically, or decoct to wash affected areas, or sun-dry and powder for dressing, or prepare as topical ointment or cream for application to affected areas.",
    "Samples of Formulae": "Hepatitis with jaundice: xi shu guo (noni fruit) 30 g, you dun cao (sabah snake grass) 30 g, fresh pandan leaves 60 g. Boil with water and take orally. Source: Hulu.com, Section of Experienced Formulae. Note: See Possible Toxicity and Cautions.\n\nBlacken hair: pandan leaves (as many as 7 leaves), washed and cut into pieces. Boil with 1 liter of water until the color turns green. Let the decoction sit overnight. The next morning, squeeze juice from 3 ripe xi shu guo (noni fruit). Mix the noni juice with the pandan leaf decoction prepared earlier. Use the mixture to wash hair. Apply 3 times per week until hair turns black. Source: Indonesian Ministry of Agriculture website [4].",
    "Contraindications": "Leaves of some Pandanus species are known to contain calcium oxalate crystals; may be harmful to individuals with decreased kidney function.\n\nPossible liver toxicity of noni fruit: The Panel on Dietetic Products, Nutrition and Allergies of the European Food Safety Authority concluded that “Morinda citrifolia (Noni) fruit puree and concentrate as novel food ingredients” under the specified conditions are considered safe for the general population. However, the Panel considers that the increasing number of case reports might indicate that some individuals have particular sensitivity for hepatotoxic effects to noni fruit products. Noni fruit (and its products) are listed by the U.S. State Food and Drug Administration (FDA) as toxic items. Reports indicate: (1) those with renal dysfunction had higher chance for renal damage; (2) more cases of acute hepatitis have been reported after consumption of noni products.",
    "Research": "Pandanus amaryllifolius contains lectin with anti-human viruses including herpes simplex virus type 1 (HSV-1) and influenza virus (H1N1). [2]\n\nP. amaryllifolius ethanol extract induced apoptosis in vitro on the hormone-independent breast cancer cell line MDA-MB-231. [1]\n\nLeaf extract significantly retarded oil oxidation and deterioration.",
    "Notes": "",
    "Chemical Ingredients": [
      "Leaves: non-specific lipid-transfer protein",
      "Leaves: lectins",
      "Leaves: alkaloids",
      "Leaves: 6E-pandanamine",
      "Leaves: pandamarilactonine-C",
      "Leaves: pandamarilactonine-D",
      "Leaves: pandamarilactonine-A",
      "Leaves: pandamarilactonine-B",
      "Leaves: diaportheone A",
      "Leaves: diaportheone B",
      "Leaves (some Pandanus species): calcium oxalate crystals",
      "Root: pandamarilactonine-H"
    ],
    "References": [
      "[1] BMC Complement Altern Med. 2012 Aug 22;12:134. doi: 10.1186/1472-6882-12-134.",
      "[2] Int J Biochem Cell Biol. 2004 Aug;36(8):1440-6.",
      "[3] http://gernot-katzers-spice-pages.com/",
      "[4] http://agricenter.jogjaprov.go.id/index.php?action=generic_content.main&id_gc=256",
      "[5] 参考文献　〔有用事典〕　７７1　〔花木〕　１９２ (in Japanese)",
      "[6] 参考文献 (in Japanese)"
    ],
    "Further Reading": [
      "Reference material: Annals of Vegetation of China 《中國植物誌》"
    ],
    "Original Text": "xiang lin tou, pandan leaves,Complementary and Alternative Healing UniversityComplementary and Alternative Healing University   中藥詞典    Chinese Herb Dictionary    Search this site     在本網站找資料 xiang lin tou, 香林投 (in English and Chinese 中英文)Translated by: Joe Hing kwok Chu    朱興國編譯Pharmaceutical name:英文藥名﹕Folium Pandani amaryllifoliiBotanical name:學名﹕Pandanus amaryllifolius Roxb. Hort. Beng.Synonyms:Pandanus odoratissimus auct.Pandanus odorus Ridl.Pandanus veitchii Mast & T. MoorePron. in Japanese:日語發音﹕nioiadan (ニオイアダン) [6]Pron. in Korean:韓語發音﹕pandanusuPron. in Cantonese::粵音﹕heong1 lam4 tau4Other Chinese Names:中文別名﹕ban lan （Being used in Indonesian, Malaysian, Singaporean Chinese) 斑蘭(用於印尼，馬來西亞，新加坡)， cheng xiang lan 稱香蘭，bi xue shu 碧血樹，xiang lan 香蘭，qi ye lan 七葉蘭，xiang lan ye 香蘭葉Common Name: [3]外文名﹕[3]Chinese: See Other Chinese Names aboveDanish: Skruepalme Dutch: Schroefpalm, Pandan English: Umbrella tree, Screw pine, Screw tree, Pandan leaves Estonian: L鬒nav pandan, Kruvipuu Finnish: Kairapalmu French: Pandanus German: Schraubenbaum, Schraubenpalme Hebrew: הפאנדאנוס  Ha-pandanus (refers to entire genus) Hind:i रंपे, Rampe Hungarian: Pandanusz lev幨, Panpung lev幨, Csavarp嫮ma lev幨 Indonesian/Malay: Daun pandan, Pandan wangi Italian: Pandano Japanese:  ニオイタコノキ, ニオイアダン, Nioi-takonoki, Nioi-adan Khmer: Taey Korean: 판다누스, Pandanusu Lao:  ໃບເຕີຍ, ເຕີຍ, ເຕີຍຫອມ, ເຕີຍບ້ານ Bai teuy, Teuy, Tey Ban, Tey hom Lithuanian:: Amarilinis pandanas Malayalalam: ബിരിയാണിക്കൈത Biriyanikkaita Marathi: आंबेमोहोर पत्ता Ambemohor patta Norwegian: Skrupalme Portuguese: Pandano Sinhala: රම්පා, රම්පේ, රම්පෙ  Rampa, Rampeh, Rampe Spanish: Pandan, Pandano Swedish: Skruvpalm Tagalog : Pandan, Pandan mabango Tamil: ரம்பா Ramba Thai: ใบเตย, เตยหอม, เตย Panae-wo-nging, Bai Toey, Toey-hom, Toei Vietnamese: C漧 cơm nếp, Dứa thơm, L� dứa Yiddish: שרױפֿנבױם Shroyfnboym (refers to the entire genus)Distribution:產地﹕ Properties(characteristics)﹕性味﹕sweet, bland, cold.味甘，淡，性寒。Channels (meridians) entered: 歸經﹕Medical functions:藥理﹕ P. amaryllifolius contains lectin with anti-human viruses like: herpes simplex virus type 1 (HSV-1), influenza virus (H1N1) [2]P. amaryllifolius ethanol extract in vitro induced apoptosis on hormone independent breast cancer cell line MDA-MB-231. [1]The leaf extract can significantly retarded oil oxidation and deterioration.香林投所含的凝集素具有抗 人類病毒，如：單純性疱疹病毒１型(HSV-1)，感冒 病毒(H1N1)的作用。[2]香林投的乙醇提取物，能使 非依賴激素性乳腺癌細胞系MDA-MB-231在體外誘導的細胞凋亡。 [1]香林投葉子的提取物能延遲食物油的氧化和腐壞。Actions & Indications:主治﹕ Chemical ingredients:化學成份﹕Leaves contain non-specific lipid-transfer protein, lectins, alkaloids, 6E-pandanamine, pandamarilactonine-C, pandamarilactonine-D, pandamarilactonine-A, pandamarilactonine-B, diaportheone A, diaportheone B. The leaves of some Pandanus species are known to contain calcium oxalate crystals. The root contains pandamarilactonine-H.Dosage:用 量﹕For oral consumption: decoction, 15 ~ 30g, Fresh herb 60 ~ 120g; or squeeze for juice and mix with honey and take orally or make into juice and gargle. External use: appropriate amount, wash, smash and apply topically or washed affected areas or sun dried and make into powder and make into dressing or topical ointment or cream ​​for applying to affected areas.內服：煎湯，15~30g，鮮者60~120g；或絞汁蜜調服或搗汁含漱。外用： 適量，洗淨，攪爛外敷或煎水洗或晒乾研末調敷或製成外用藥膏或面霜作塗敷用。Samples of formulae:處方舉 例﹕Hepatitis with jaundice: xi shu guo (noni fruit) 30 g, sabah snake grass (you dun cao) 30 克，fresh pandan leaves 60 克. Boil with water and take orally. (Source: Hulu.com, Section of Experienced Formulae)* See Possible Toxicity and Cautions:.To blacken hair : pandan leaves,  as much as 7 sheets, washed and cut into pieces . Boil with 1 liter of water until the color is green . Let the decoction sit overnight before cooking water . The next morning ,  squeeze 3 ripe noni fruitt to get juice. Mix with the leaf decoction made earlier. Use the mixture to wash hair . Do it 3 times week , until you see the results. (translated from Indonesian (Translated from[4])黃疸型肝炎：諾利果30gm，沙巴蛇草(憂遁 草)30gm，香林投鮮 葉60gm，水煎服。(葫蘆網．驗方組) * 看可能對肝臟有毒。黑髮方：香蘭葉 (香林投葉)，洗淨，切成片，可多達7張。 加水1公升，燒開，燉直到水色成綠色。將湯汁放過夜。第二天早上，將成熟的諾麗果(檄樹 果) 擠汁。混合混入香蘭葉煎劑。使用混合物洗頭。每週三次，直到頭髮變黑。 （編者譯自印尼農業部網站[4]）Modern Research:現代研究﹕ Toxicity & Cautions:毒素與禁忌﹕The leaves of some Pandanus species are known to contain calcium oxalate crystals. It may be harmful to those with decreased kidney function.有些香林投種類的葉子含草酸鈣晶體，對腎臟功能不佳者可能不利。Possible liver toxicity of noni fruit:The Panel on Dietetic Products, Nutrition and Allergies of European Food Safety Authority concludes that �Morinda citrifolia (Noni) fruit puree and concentrate as novel food \ningredients� under the specified conditions are considered safe for the general population. \nHowever the Panel considers that the increasing number of case reports might indicate that some individuals have a particular sensitivity for hepatotoxic effects to noni fruit products.  Noni fruit (and its products) are listed by the U.S. State Food and Drug Administration (FDA) as toxic items.\nThere are reports that:\n(1) those with renal dysfunction had higher chance for renal damage.\n(2) more cases of acute hepatitis have been reported after consumption of noni products. 諾利果可能對肝臟有毒：歐洲食品安全局的飲食產品，營養和過敏專家小組得出結論認為諾麗諾麗果漿和濃縮新型食品\n對於一般人群，在特定條件下被認為是安全的。\n然而，小組認為，越來越多的病例報告可能表明，一些人對諾麗果產品的肝毒性作用特別敏感。 諾利果(及其產品)被美國國家藥物食品管理局(FDA)列為有毒植物。有報告指出：(1)腎功能低下的人，更會造成腎功能的傷害。(2)多例在食用諾麗產品後，造成急性肝炎。 Reference material : Annals of Vegetation of China  參考資料]《中國植物誌》[1] BMC Complement Altern Med. 2012 Aug 22;12:134. doi: 10.1186/1472-6882-12-134.[2] Int J Biochem Cell Biol. 2004 Aug;36(8):1440-6.[3] http://gernot-katzers-spice-pages.com/[4] http://agricenter.jogjaprov.go.id/index.php?action=generic_content.main&id_gc=256[5][6] 参考文献　〔有用事典〕　７７1　〔花木〕　１９２(日文) (in Japanese)Problems with website? Please Click here for comment. (Not for inquiry )     Click here for inquiry    Search this siteProblems with website? Please Click here for comment. (Not for inquiry )    Click here for inquiryCopyright Notice 按此看關於版權問題Sponsors' Ads by Google 以下為谷歌 所提供之廣告A manuscript... writing, translating and proofreading  in progress List of Health ProblemsQigong (chi kung)Toxicity of Some HerbsSide Effect of Some HerbsHerbs that can be toxic to kidneysTraditional Chinese Medicine TCM Diagnosis Samples of FormulaeTerms of Traditional Chinese MedicineAcupuncturecopy right 版權所有Qigong classesPrescribed Drug DictionaryEmail our web master for  your suggestion (not for inquiry)Biochemistry Dictionary Qigong classes Research Librarian  HomeWeather ReportDisclaimerLast update: June 23, 2014; 12 p.m. LAH   ",
    "original_url": "http://alternativehealing.org/xiang_lin_tou.htm"
  },
  {
    "Names": {
      "Name": [
        "bai shao",
        "chi shao",
        "shao yao",
        "bai shao yao",
        "chi shao yao"
      ],
      "Pharmaceutical": ["Radix Paeoniae Lactiflorae"],
      "Biological": ["Paeonia lactiflora Pall."],
      "Chemical": [],
      "Common": ["white dahlia root", "Chi shao yao means red dahlia"],
      "Other name": [
        "hang bai shao 杭白芍",
        "hang shao 杭芍",
        "hang shao yao 杭芍藥",
        "bai shao yao 白芍藥",
        "shao yao 芍藥",
        "jin shao yao 金芍藥",
        "li cao gen 離草根",
        "ke li gen 可離根",
        "jiang li gen 將離根",
        "yu rong gen 余容根",
        "qi ji gen 其積根",
        "jie cang gen 解倉根",
        "li shi gen 犁食根",
        "yan gen 蜒根",
        "mei gen hua gen 沒骨花根",
        "lan wei chun gen 婪尾春根",
        "tian dou 天斗",
        "yu dou 玉斗",
        "tian kui 天魁",
        "yu kui 玉魁",
        "fu ding 伏丁",
        "gu gong 伏貢",
        "fu wang 伏王",
        "yan you 艷友",
        "guan fang 冠芳",
        "dian chun ke 殿春客"
      ],
      "Chinese": ["白芍", "白芍藥", "赤芍藥", "芍藥"],
      "Pronunciation in Korean": ["paekchak (白 芍)"],
      "Pronunciation in Japanese": ["byakushaku (白芍)"],
      "Pronunciation in Cantonese": ["baak6 zeok3 (白芍)", "cik3 zeok3 (赤芍)"],
      "Pinyin Pronunciation": []
    },
    "Type": "Herb",
    "Geography": [
      "Provinces of Zhejiang, Anhui, Sichuan, Guizhou, Shandong of China"
    ],
    "Properties": ["bitter", "sour", "cool"],
    "Meridians": ["Liver", "Spleen"],
    "Maladies Treated": [
      "Bai shao: menstrual dysfunction (addressing blood stasis).",
      "Bai shao: vagina yeast infection (addressing blood stasis).",
      "Bai shao: uterine bleeding (addressing blood stasis).",
      "Bai shao: alleviates abdominal pain.",
      "Bai shao: headache and dizziness due to liver yang ascending.",
      "Bai shao: spermatorrhea.",
      "Bai shao: pain in abdomen and diarrhea.",
      "Bai shao: common cold and flu (as in gui zhi tang and ma huang tang).",
      "Chi shao: injuries like broken bones, dislocated joints, sprains and injuries from impacts (removing blood stasis; stronger than bai shao).",
      "Chi shao: blood clots (removing blood stasis; stronger than bai shao).",
      "Chi shao: child birth difficulty.",
      "Muscle spasm: limbs, back, neck, face; jerky legs.",
      "Bone spurs of the heels.",
      "Viral hepatitis.",
      "Chronic constipation.",
      "Asthma.",
      "Whooping coughs.",
      "Diabetes.",
      "Ulcer of duodenum and stomach.",
      "Raw bai shao: liver yang ascending.",
      "Chao bai shao (stir-fried bai shao): pixu (spleen deficient) with abdominal pain and diarrhea.",
      "Jiu bai shao (rice wine treated bai shao): liver overactive and blood deficient with blood stasis.",
      "Cu bai shao (vinegar treated bai shao): arresting pain in the liver; gan ji shi rou (肝急失柔)."
    ],
    "Medical Function": [
      "Removing blood stasis (bai shao; chi shao stronger).",
      "Mild analgesic by addressing blood stasis.",
      "Lessens liver yang ascending.",
      "Antispastic.",
      "Lowers blood pressure.",
      "Dilates peripheral blood vessels; lowers peripheral resistance.",
      "Dilates coronary arteries.",
      "Anticonvulsant.",
      "Analgesic.",
      "Sedative effect.",
      "Antipyretic.",
      "Anti-inflammatory.",
      "Antibiotic.",
      "Neutralizes the carcinogenic effect of aflatoxins.",
      "Chi shao: tonic.",
      "Chi shao: pain killer.",
      "Chi shao: diuretic.",
      "Chi shao: rids gas from stomach and intestine."
    ],
    "Dosage": "6–15 grams (6~15 克).",
    "Samples of Formulae": "For common cold and flu: gui zhi tang (Cinnamon Twig Decoction), ma huang tang (Ephedra Decoction).\nFormulas including shao yao: bai zhu shao yao san (Atractylodes and Peony Powder); dang gui jian zhong tang (Tangkuei Decoction for the Middle); dang gui shao yao san (Tangkuei and Peony Powder); gui zhi tang (Cinnamon Twig Decoction); ma huang tang (Ephedra Decoction); shi quan da bu tang (All-Inclusive Great Tonifying Decoction); si wu tang (Four-Substance Decoction); ren shen yang rong tang (Ginseng Nourishing Decoction); wan dai fang (Complete Belt Formula).",
    "Contraindications": "Do not use raw bai shao in case of pain in abdomen or with diarrhea due to pixu (spleen deficient). Use chao bai shao (stir fried bai shao) instead.\nPostpartum: do not use chi shao.",
    "Research": "Protective effect: extract from bai shao and huang qi against liver injury induced by bacillus Calmette-Gu廨in and lipopolysaccharide in mice.\nIn vitro studies found inhibition of hepatitis B virus [3].\nOne of the active components, paeoniflorin, has been reported to be able to reverse or alleviate behavioral and cognitive impairments [4].\nAntidepressant effect in animal models of depression; the action of Paeonia lactiflora may be mediated via the central monoaminergic neurotransmitter system [5].\nThe acute oral toxicity of aconitine in rats was significantly reduced by paeoniflorin [1].",
    "Notes": "Bai shao is used for removing blood stasis and as a mild analgesic by addressing blood stasis.\nChi shao has a much stronger effect in removing blood stasis and is used more often than bai shao in traumatic injuries and blood clots.\nRaw bai shao is used for lian yin ping gan (斂陰平肝), especially liver yang ascending and internal stirring of liver wind.\nChao bai shao (stir-fried) excels at nourishing blood and the liver; often used when the liver is exuberant and the spleen is deficient with pain and diarrhea.\nJiu bai shao (rice wine treated) tends toward nourishing blood and activating blood; most suitable for blood deficiency with cold congealing and blood stasis.\nCu bai shao (vinegar treated) enhances softening the liver and relieving pain; commonly used when the liver is urgent and loses softness (肝急失柔).",
    "Chemical Ingredients": {
      "General (unspecified part)": [
        "paeonol",
        "paeonin",
        "triterpenoids",
        "sistosterol",
        "benzoic acid",
        "β sitosterol",
        "gallotannin",
        "pedunculagin",
        "1-O-Galloylpedunculagin",
        "eugeniin",
        "tannin acid",
        "fat",
        "essential oil",
        "resin",
        "sugar",
        "starch",
        "protein"
      ],
      "Roots contain": [
        "paeoniflorin (芍藥甙)",
        "oxypaeoniflorin (氧化芍藥甙)",
        "benzoylpaeoniflorin (苯甲酰芍藥甙)",
        "albiflorin (白芍甙)",
        "paeoniflorigenone (芍藥甙無酮)",
        "galloylpaeoniflorin (沒食子酰芍藥甙)",
        "z−1s,5R-β-pinen-10-yl-β-vicianoside (β-蒎-10-烯基-β-巢菜甙)",
        "lacioflorin (芍藥新甙)",
        "paeoni-lactone A, B, C (芍藥內酯)",
        "β-siiosierol",
        "daucosterol (胡蘿蔔甙)"
      ],
      "From root tannin": [
        "1,2,3,6-tetra-O-galloyl-β-D-glucose (1，2，3，6-四沒食子酰基葡萄糖)",
        "1,2,3,4,6-penta-O-galloyl-β-D-glucose (1,2,3,4，6-五沒食子酰基葡萄糖)",
        "hexagalloylglucose (六沒食子酰基葡萄糖)",
        "heptagalloylglucose (七沒食子酰基葡萄糖)"
      ],
      "Volatile oil (evaporating oil)": [
        "benzoic acid (苯甲酸)",
        "paeonol (牡丹酚)",
        "33 kinds of other alcohol and phenol compounds (及其他33種醇類和酚類成份)"
      ]
    },
    "References": [
      "[1] J Ethnopharmacol. 2012 Jun 1;141(2):701-8. doi: 10.1016/j.jep.2011.09.005. Epub 2011 Sep 10.",
      "[2] Basic Clin Pharmacol Toxicol. 2008 Aug;103(2):143-9. doi: 10.1111/j.1742-7843.2008.00243.x.",
      "[3] Biol Pharm Bull. 2006 Oct;29(10):2131-4.",
      "[4] Evid Based Alternat Med. March 7(1), 3-10",
      "Phytother Res. 2008 Nov;22(11):1496-9. doi: 10.1002/ptr.2519."
    ],
    "Further Reading": [],
    "Original Text": "bai shao, chi shao, shao yao, Complementary and Alternative Healing University    現代中藥辭典Complementary and Alternative Healing University   中藥詞典    Chinese Herb Dictionary      Search this site     在本網站找資料 See more menu at the bottom of page shao yao 白芍; bai shao yao, 白芍藥 ;chi shao yao 赤芍藥    By: Joe Hing Kwok Chu    (in English and Chinese 中英文)Click here to see picture. 按此看圖。Pharmaceutical name:英文 藥名﹕Radix Paeoniae LactifloraeBiological name:拉丁 名﹕Paeonia lactiflora Pall.Pron. in Japanese:日語 發音﹕byakushaku (白芍)Pron. in Korean:韓語 發音﹕paekchak (白 芍)Pron. in Cantonese:粤語發音：baak6  zeok3  (白芍) ,  cik3 zeok3  (赤芍)Other Names:別名 ﹕hang bai shao 杭白芍，hang shao 杭芍，hang shao yao 杭芍藥，bai shao yao 白芍藥，shao yao 芍藥，jin shao yao 金芍藥，li cao gen 離草根，ke li gen 可離根，jiang li gen 將離根，yu rong gen 余容根，qi ji gen 其積根，jie cang gen 解倉根，li shi gen 犁食根，yan gen 蜒根，mei gen hua gen 沒骨花根，lan wei chun gen 婪尾春根，tian dou 天斗，yu dou 玉斗，tian kui 天魁，yu kui 玉魁，fu ding 伏丁，gu gong 伏貢，fu wang 伏王，yan you 艷友，guan fang 冠芳，dian chun ke 殿春客。Common Name:英文 名﹕white dahlia root, Chi shao yao means red dahliaDistribution:Provinces of Zhejiang, Anhui, Sichuan, Guizhou, Shandong of China中國的浙江,安徽,四川,貴州,山東等省Properties (characteristics)性味 ﹔bitter, sour, cool苦﹐酸﹐涼。Channels (meridians) entered:歸經 ﹕liver, spleen肝﹐脾。Medical Function:藥理 ﹕anti-spasticlowers blood pressure, dilates peripheral blood vessels, lower resistantdilates coronary arteriesanticonvulsant, analgesic, sedative effectantipyretic, anti-inflammatory, antibioticneutralizes the carcinogenic effect of aflatoxinsprotective effect of extract from bai shao and huang qi  against liver injury induced by bacillus Calmette-Gu廨in and lipopolysaccharide in mice.inhibit hepatitis B virus in vitro studies [3]One of the active components, paeoniflorin, has also been reported to be able to reverse or alleviate behavioral and cognitive impairments[4]antidepressant effect of animal models of depression. The action of Paeonia lactiflora may be mediated via the central monoaminergic neurotransmitter system. [5] 解痙降血壓，能擴張外周血管 ，降低外周阻力擴張冠狀動脈鎮靜、鎮痛及抗驚厥解熱、抗炎及抗菌對致癌物質黃霉素有解毒 作用芍藥與黃芪提取物，抗卡介苗和脂多醣引起的小鼠肝損傷有保護作。在體外實驗，發現有抑制乙型肝炎病毒作用[3]有報導說其中的活性成份，芍藥苷， 能夠逆轉或減輕損傷和認知損傷[4]在動物試驗中, 本品顯示有抗抑鬱作用。芍藥的作用可能通過中樞的單胺神經遞質系統介導的。 [5]Actions & Indications:主治 ﹕Bai shao is being used for removing blood stasis and as a mild analgesic by addressing blood stasis . For menstrual dysfunction, vagina yeast infection, uterine bleeding. Lessens liver yang ascending , alleviates abdominal pain. For headache and dizziness due to  liver yang ascending. For spermatorrhea. For pain in abdomen and diarrhea. For common cold and flu. (as in gui zhi tang, ma huang tang)Chi shao yao has a much stronger effect in removing blood stasis . It is being used more often than bai shao in injuries like broken bones, dislocated joints, sprains and injuries from impacts also in blood clots. It is use as a tonic, pain killer, diuretic and for ridding of gas from stomach and intestine and for child birth difficulty. Do not use chi shao after giving birth.白芍常用于驅淤血并略 有止痛作用。用于月经不調，带下，子宫出血，遗精，肝 陽上亢所致的頭痛，晕眩。。 改善肝 陽上亢症狀，减輕腹痛.。用于傷 風感冒 如 桂枝湯，, 麻黄湯。赤芍對驅 淤血功效較白芍强。常用於跌打損傷， 折骨，脱胶，扭傷。可作補藥，止痛 (因驅 淤血作用)，利尿，驅腸胃氣，難産。産後忌用赤芍。Dosage:用量 ﹕6 ~ 15 grams6~15 克。Chemical ingredients: paeonol, paeonin,  triterpenoids, sistosterol,  , benzoic acid, β sitosterol, gallotannin, pedunculagin, 1-O-Galloylpedunculagin , eugeniin,  tannin acid, fat, essential oil, resin, sugar, starch, and protein.Roots contain:根含:paeoniflorin芍藥甙oxypaeoniflorin氧化芍藥甙benzoylpaeoniflorin,苯甲酰芍藥甙albiflorin白芍甙paeoniflorigenone芍藥甙無酮galloylpaeoniflorin沒食子酰芍藥甙z－1s，5R-β-pinen-10-yl-β-vicianosideβ-蒎-10-烯基-β-巢菜甙lacioflorin芍藥新甙paeoni-lactone)A、B、C芍藥內酯β-siiosierolβ-谷甾醇daucosterol胡蘿蔔甙Also isolated from the tannin of the roots:還從根的鞣質中分得:1，2，3，6-tetra-O-galloyl-β-D-glucose1，2，3，6-四沒食子酰基葡萄糖1,2,3,4，6-penta-O-galloyl-β-D-glucose,2,3,4,6-五沒食子酰基葡萄糖六沒食子酰基葡萄糖七沒食子酰基葡萄糖Also  contain:l又含:catechin右旋兒茶精evaporating oi:揮發油:benzoic acid苯甲酸,paeonol牡丹酚and 33 kinds of other alcohol and phenol compounds及其他33 種醇類和酚類成份Modern use:現代 應 用﹕Being used in:muscle spasm of limbs, back and neck, face. Jerky legs.relieving pain,bone spurs of the heels,viral hepatitis,chronic constipation,asthma,whooping coughs,diabetes,ulcer of duodenum and stomach.用於﹕肌肉痙 攣﹕四肢﹐頸部﹐背部﹐臉﹐腿不 安。止痛。腳跟骨刺。病毒性肝炎。慢性便秘。哮喘。百日咳。糖尿病。十二指腸與胃之潰瘍。Samples of Formulae:處方舉例﹕bai zhu shao yao san 白朮芍藥散dang gui jian zhong tang 當歸键中湯dang gui shao yao san 當歸芍藥散gui zhi tang 桂枝 湯ma huang tang 麻黃湯shi quan da bu tang 十全大補湯si wu tang 四物湯,ren shen yang rong tang 人参養湯wan dai fang 完帶方Modern Study:現代研究﹕The acute oral toxicity of aconitine in rats was significantly reduced by paeoniflorin[1].在大鼠口服烏頭鹼的激烈毒性反應被芍藥甙顯著地減低.[1] Cautions: 禁忌 do not use raw bai shao in case of pain in abdomen or/with diarrhea due to pixu (spleen deficient) . Use chao bai shao (stir fried bai shao) instead. 脾 虛腹痛泄瀉者忌用生白芍。應用炒白芍。産後忌用赤芍。[1] J Ethnopharmacol. 2012 Jun 1;141(2):701-8. doi: 10.1016/j.jep.2011.09.005. Epub 2011 Sep 10.[2] Basic Clin Pharmacol Toxicol. 2008 Aug;103(2):143-9. doi: 10.1111/j.1742-7843.2008.00243.x.[3] Biol Pharm Bull. 2006 Oct;29(10):2131-4.[4] Evid Based Alternat Med. March 7(1), 3-10Phytother Res. 2008 Nov;22(11):1496-9. doi: 10.1002/ptr.2519.Raw bai shao is being used in liver yang ascending.Chao bai shao is being used inpixu (spleen deficient)Jiu bai shao (rice wine treated bai shao) is suitable for liver over active and in blood deficient with blood stasis.Cu bai shao (vinegar treated bai shao) is often used in arresting pain in the liver.生用斂陰平肝作用較強，常用於 肝 陽上亢、 肝風內動之症。 炒白芍長於養血和肝，多用於肝旺脾 虛痛瀉者。 酒白芍偏於養血活血，血 虛兼寒凝 血淤之症最宜。 醋白芍增強柔肝止痛之力，肝急失柔之症常投。Search this siteProblems with website? Please Click here for comment. (Not for inquiry )    Click here for inquiryCopyright Notice 按此看關於版權問題Sponsors' Ads by Google 以下為谷歌 所提供之廣告A manuscript... writing, translating and proofreading  in progressMenu: List of Health ProblemsQigong (chi kung)Toxicity of Some HerbsSide Effect of Some HerbsHerbs that can be toxic to kidneysTraditional Chinese Medicine TCM Diagnosis Samples of FormulaeTerms of Traditional Chinese MedicineAcupunctureChinese Herb DictionaryQigong classesPrescribed Drug DictionaryEmail our web master for  your suggestion (not for inquiry)Biochemistry Dictionary Qigong classes Research Librarian copy right 版權所有HomeWeather ReportDisclaimerLast update: July 16,  2016; 10:39 p.m. LAH   ",
    "original_url": "http://alternativehealing.org/bai_shao.htm"
  }
]
