[
  {
    "Names": {
      "Name": ["bi cheng qie", "dou chi jiang"],
      "Pharmaceutical": [
        "Fructus Litseae (bi cheng qie 蓽澄茄)",
        "Radix et Ramus Litseae cubebae (dou chi jiang 豆豉姜)"
      ],
      "Botanical": ["Litsea cubeba (Lour.) Pers.", "Litsea citrata Blume"],
      "Chinese": ["蓽澄茄", "豆豉姜"],
      "Common": ["aromatic titsea root and stem"],
      "Other name": [
        "木漿子根 (《分類草藥性》)",
        "滿山香 (廣州空軍《常用中草藥手冊》)",
        "澄茄根",
        "木姜子根 (《四川中藥誌》)",
        "過山香",
        "槍子蔃 (《廣東中藥》)",
        "山蒼子",
        "山雞椒",
        "山香椒",
        "山香根",
        "豆豉姜",
        "木姜子 [海南]"
      ],
      "Pronunciation in Korean": [
        "bijing ga (bi cheng qie)",
        "tugogang (dou chi jiang)"
      ],
      "Pronunciation in Japanese": [
        "hitchoka (bi cheng qie)",
        "toshikyo (dou chi jiang)"
      ],
      "Pronunciation in Cantonese": [],
      "Pinyin Pronunciation": []
    },
    "Type": "Herb",
    "Geography": [],
    "Properties": [
      "bi cheng qie (Fructus Litseae): acrid, warm",
      "dou chi jiang (Radix et Ramus Litseae cubebae): acrid, aromatic, warm"
    ],
    "Meridians": [
      "bi cheng qie (Fructus Litseae): Spleen, Stomach, Kidney, Bladder",
      "dou chi jiang (Radix et Ramus Litseae cubebae): Liver, Lung"
    ],
    "Maladies Treated": [
      "Root (根): vomiting due to Stomach cold (胃寒嘔逆).",
      "Root (根): cold pain in the epigastrium and abdomen (脘腹冷痛).",
      "Root (根): abdominal pain due to cold shan (寒疝腹痛).",
      "Root (根): cold-damp congealing and stagnation (寒濕郁滯).",
      "Root (根): turbid/cloudy urination (小便渾濁).",
      "Leaves (葉, external use): carbuncles/boils with swelling and pain (癰癤腫痛).",
      "Leaves (葉, external use): mastitis (乳腺炎).",
      "Leaves (葉, external use): insect and snake bites (蟲蛇咬傷).",
      "Leaves (葉, external use): prevention of mosquito and insect bites (預防蚊蟲叮咬).",
      "Fruit/Seed (子): headache due to common cold (感冒頭痛).",
      "Fruit/Seed (子): indigestion (消化不良).",
      "Fruit/Seed (子): stomach pain (胃痛)."
    ],
    "Medical Function": [
      "Warms the middle and disperses cold (溫中散寒).",
      "Promotes the flow of qi and relieves pain (行氣止痛)."
    ],
    "Dosage": "Fruit/Seed (子): 1.5–3 g.\nChinese unit given: 子 1～3 錢.\nLeaves (葉, external): appropriate amount; mash fresh leaves and apply to the affected area (鮮葉搗爛敷患處).",
    "Samples of Formulae": "",
    "Contraindications": "Not specified. The page lists: Toxicity & Cautions: [1][2].",
    "Research": "",
    "Notes": "",
    "Chemical Ingredients": {},
    "References": [],
    "Further Reading": [],
    "Original Text": ", Complementary and Alternative Healing UniversityComplementary and Alternative Healing University   中藥詞典                 Chinese Herb Dictionary      Search this site     在本網站找資料     Discussion FormSearch this siteList of Health ProblemsChinese Herb DictionaryQigongTraditional Chinese Medicine (TCM)AcupuncturePrescribed Drug DictionaryBiochemistry DictionaryLecture SlidesResearch LibrarianGeneral Online LibrarySearchResearch SitesViagraMassage/AcupressureHypnotherapyTell us what you wantNotify Changes & New Information　　　                 　      　　 bi cheng qie 蓽澄茄dou chi jiang 豆豉姜         (in English and Chinese 中英文)Translated by: Joe Hing kwok Chu 朱興國編譯Pharmaceutical name:英文藥名﹕Fructus Litseae (bi cheng qie 蓽澄茄)Radix et Ramus Litseae cubebae  (dou chi jiang 豆豉姜)Botanical name:學名﹕Litsea cubeba （Lour.） Pers.Litsea citrata BlumePron. in Japanese:日語發音﹕hitchoka （bi cheng qie 蓽澄茄)toshikyo （dou chi jiang 豆豉姜）Pron. in Korean:韓語發音﹕bijing ga (（bi cheng qie 蓽澄茄)tugogang （dou chi jiang 豆豉姜）Pron. in Cantonese::粵音﹕ Other Names:別名﹕木漿子根(《分類草藥性》)，滿山香(廣州空軍《常用中草藥手冊》)，澄茄根、木姜子根(《四川中藥誌》)，過山香、槍子蔃(《廣東中藥》)。山蒼子、山雞椒、山香椒、山香根、豆豉姜、木姜子[海南]Common Name:外文名﹕aromatic titsea root and stemDistribution:產地﹕ Properties(characteristics)﹕性味﹕bi cheng qie: acrid, warm.dou chi jiang: acrid, aromatic, warm.蓽澄茄: 辛，溫。豆豉姜: 辛，香，溫。Channels (meridians) entered: 歸經﹕bi cheng qie: spleen, stomach, kidney, bladder.dou chi jiang: liver, lung.蓽澄茄: 脾、胃、腎、膀胱。豆豉姜：肝，肺。Medical functions:藥理﹕  Actions & Indications:主治﹕ 溫中散寒，行氣止痛。根：用於胃寒嘔逆，脘腹冷痛，寒疝腹痛，寒濕郁滯，小便渾濁。葉：外用治癰癤腫痛，乳腺炎，蟲蛇咬傷，預防蚊蟲叮咬。子：感冒頭痛，消化不良，胃痛。Chemical ingredients: [2]化學成份﹕【2】 Dosage:用 量﹕Fruit: 1.5～3g；Leaves: external use. Use appropriate amount. Smash and apply to affected area.子：1～3錢;   葉外用適量，鮮葉搗爛敷患處。Samples of formulae:處方舉 例﹕ Modern Research:現代研究﹕ Toxicity & Cautions:毒素與禁忌﹕[1][2]Problems with website? Please Click here for comment. (Not for inquiry )      Click here for inquiry    Ads by Google:   A manuscript... writing, translating and proofreading  in progress  Copyright Notice 按此看關於 版權問題List of Health ProblemsChinese Herb DictionaryToxicity of Some HerbsSide Effect of Some HerbsHerbs that can be toxic to kidneysTraditional Chinese Medicine TCM Diagnosis Samples of FormulaeTerms of Traditional Chinese MedicineAcupuncturecopy right 版權所有Qigong (chi kung)Prescribed Drug DictionaryEmail our web master for  your suggestion (not for inquiry)Biochemistry DictionaryGeneral Online LibraryQigong classesFake Email WarningResearch LibrarianSearchQigong classesDisclaimerHomeWeather ReportLast update: Sept 16, 2014; 11:50  a.m. LAH  ",
    "original_url": "http://alternativehealing.org/bi_cheng_qie.htm"
  },
  {
    "Names": {
      "Name": ["chuan niu xi", "川牛膝"],
      "Pharmaceutical": ["Radix Cyathulae"],
      "Botanical": ["Cyathula officinalis Kuan"],
      "Chinese": [
        "川牛膝",
        "牛膝 (四川，貴州，雲南)",
        "天全牛膝",
        "都牛膝",
        "米心牛膝",
        "家牛膝",
        "肉牛膝",
        "大牛膝",
        "拐牛膝",
        "甜牛膝",
        "甜川牛膝",
        "龍牛膝 (四川)"
      ],
      "Common": ["Cyathula Root"],
      "Other name": [
        "niu xi (in Sichuan, Guizhou, Yunnan)",
        "tian quan niu xi",
        "du niu xi",
        "mi xin niu xi",
        "jia niu xi",
        "ruo niu xi",
        "da niu xi",
        "guai niu xi",
        "tian niu xi",
        "tian chuan niu xi",
        "long niu xi (in Sichuan)"
      ],
      "Pronunciation in Korean": ["cheon useul"],
      "Pronunciation in Japanese": ["sengoshitsu"],
      "Pronunciation in Cantonese": ["cyun1 ngau4 sat1"],
      "Pinyin Pronunciation": ["chuan niu xi"]
    },
    "Type": "Herb",
    "Geography": [
      "Main production areas: Sichuan, Yunnan, Guizhou.",
      "Recently cultivated/propagated in: Shaanxi, Hubei, Hunan."
    ],
    "Properties": ["Sweet", "Slightly bitter", "Neutral"],
    "Meridians": ["Liver", "Kidney"],
    "Maladies Treated": [
      "Rheumatism.",
      "Low back and knee pain due to dampness (濕腰膝疼痛).",
      "Leg flaccidity with tendon spasms (腳痿筋攣).",
      "Blood strangury (xue lin) and hematuria (血淋，尿血).",
      "Amenorrhea (婦女經閉).",
      "Abdominal/pelvic masses (症瘕): fibroids of the uterus, ovarian cysts, endometriosis, pelvic inflammatory mass, menstrual blood retention due to gynatresia (陰道閉鎖的月經瀦留), old/existing extra-uterine (ectopic) pregnancy, teratoma of the internal genital organs, or certain gynecologic malignancies presenting as pelvic masses with distension pain or uterine bleeding."
    ],
    "Medical Function": [
      "Effects on the uterus (relaxant/contractile actions; observed in animals).",
      "Anti-pregnancy/anti-implantation activity (observed in animals).",
      "Effects on blood circulation/anticoagulation.",
      "Effects on metabolism and anabolic activity.",
      "Cholagogue (promotes bile secretion).",
      "Lipid-lowering and anti-atherosclerotic effects.",
      "Immunomodulatory effects.",
      "Hepatoprotective support in heliotrine-induced hepatitis (observed in animals)."
    ],
    "Dosage": "Decoction: 6–10 g. May also be used in pills or powder form. Can be soaked in alcohol for drinking.",
    "Samples of Formulae": "Name: xie qing tang with adjustment (加減瀉青丸). Source notes: listed as 小兒藥證直訣; excerpted in 《雜病証治新義》.\nApplication: Hypertension with headache, qi excess with constipation; pulse stringy, stiff and large at the three positions.\nComposition (water decoction): Fang Feng (Saposhnikovia root) [防風], Long Dan Cao (Chinese Gentian root) [龍膽草], Shan Zhi Zi (Gardenia fruit) [山梔子], Da Huang (Rhubarb root/rhizome) [大黃], Huang Qin (Baikal skullcap root) [黃芩], Chuan Niu Xi (Cyathula root) [川牛膝].",
    "Contraindications": "Contraindicated during pregnancy, in cases of excessive menstrual bleeding, and in spermatorrhea.",
    "Research": "Uterine effects: Extract of the herb relaxed the pregnant and non-pregnant uteri of guinea pigs and the non-pregnant uterus of cats, and caused contraction of the pregnant and non-pregnant uteri of rabbits and the pregnant uterus of cats [1,2].\n\nAnti-fertility/anti-implantation: Benzene extract 2.5 g (raw herb)/kg administered by gavage to mice for 3 consecutive days starting on day 7 of pregnancy achieved 100% anti-pregnancy effectiveness (15 mice), with embryos expelled, death, or vaginal bleeding [3]. Additional report: benzene extract 250 mg/kg achieved 100% anti-fertility effectiveness; 500 mg/kg achieved 100% anti-implantation effectiveness; the ethyl acetate extract was less effective, and the alcohol extract was the weakest [4].\n\nHemorheology and anticoagulation: Decoction 10 g/kg by gavage, twice daily for 3 days, showed no significant effect on multiple hemorheologic indices in normal rats and in an acute blood stasis rat model. In anticoagulation testing, it significantly prolonged rat plasma recalcification time, indicating some blood-activating (anticoagulative) action, though weaker than Huai Niu Xi (懷牛膝) [5].\n\nMetabolic/anabolic effects: Ecdysterone administered to young mice for 60 days markedly promoted body weight gain and increased hepatic and renal protein synthesis; hepatocytes showed proliferative activation with giant nuclei, binuclear or multinuclear cells. These effects were weaker in mature mice [6]. In rats, orally administered ecdysterone exerted anabolic effects: increased levator ani muscle weight in immature castrated male rats; in immature and mature rats it increased body weight, viscera and skeletal muscle weights, and total protein. It significantly affected carbohydrate metabolism by increasing hepatic and muscle glycogen, with minimal impact on fat metabolism [7]. Other reports found no androgen-like effects in castrated animals [8].\n\nCholeretic: Ecdysterone 5 mg/(kg/day) by gavage, single dose or daily for 7 days, increased bile secretion in rats and altered bile composition by increasing bile acids and bilirubin and decreasing cholesterol [9].\n\nLipid-lowering/anti-atherosclerotic: Ecdysterone 10 mg/kg by gavage inhibited WR-1339–induced hypercholesterolemia and hypertriglyceridemia in rats, and suppressed experimental atherosclerosis in rabbits [10].\n\nImmune modulation and cell effects: Ecdysterone 1 mg/kg intraperitoneally increased antibody-forming spleen cells in mice immunized with sheep red blood cells. It promoted protein synthesis in cultured human skin fibroblasts, while generally inhibiting DNA synthesis of cultured human lymphocytes stimulated by phytohemagglutinin [11].\n\nHepatoprotection: Ecdysterone accelerated normalization of liver function in rats with heliotrine-induced hepatitis [9].",
    "Notes": "Page translated by Joe Hing kwok Chu. Last update noted as Sept 28, 2013; 10 p.m. LAH.",
    "Chemical Ingredients": {
      "Root": ["β-ecdysterone (β-蛻皮甾酮).", "Trace titanium: 12.5 μg/g."]
    },
    "References": [
      "In-text citations present: [1], [2], [3], [4], [5], [6], [7], [8], [9], [10], [11] (full citations not provided on the page).",
      "Chinese source noted: http://www.hulu.com.tw/"
    ],
    "Further Reading": [],
    "Original Text": "chuan niu xi,Complementary and Alternative Healing University\n\n\n\n\n\n    Complementary and Alternative Healing University\n\n\n\n\n\n\n\n中藥詞典                 \n    Chinese Herb Dictionary    \n     Search \n    this site    \n    在本網站找資料\n\n\n\n\n\n\n\n\n\n\n\n\n\n\nSearch this \n        site\n\n\nList \n        of Health Problems\n\n\n\n\n\n\n        Chinese Herb Dictionary\n\n\n\n\n\nQigong\n\n\n\n\n\n\n        Traditional Chinese Medicine (TCM)\n\n\n\n\n\n\n        Acupuncture\n\n\n\n\n\n\n        Prescribed Drug Dictionary\n\n\n\n\n\nBiochemistry Dictionary\n\n\n\n\n\nLecture Slides\n\n\n\n\n\nResearch Librarian\n\n\n\n\n\n\n        General Online Library\n\n\n\n\n\nResearch \n        Sites\n\n\n\n\n\n\n        Viagra\n\n\n\n\n\n\n        Massage/Acupressure\n\n\n\n\n\nHypnotherapy\n\n\n\n\n\nTell us what you want\n\n\n\n\n\nNotify Changes \n        & New Information\n\n\n\n \n\n\n\n\n\n \nchuan niu xi 川牛膝  \n(in English and Chinese 中英文) \nTranslated \nby: Joe Hing kwok Chu\n\nPharmaceutical name:\n英文藥名﹕\nRadix Cyathulae\nBotanical name:\n學名﹕\nCyathula officinalis Kuan\nPron. in Japanese:\n日語發音﹕\nsengoshitsu\nPron. in Korean:\n韓語發音﹕\ncheon useul\nPron. in Cantonese:\n粵音﹕\ncyun1 ngau4 sat1\nOther Names:\n別名 ﹕\n\n\n\nniu xi (in Sichuan, Guizhou, Yunnan) \n\n\n牛膝 \n        (四川，貴州，雲南)\n\n\n\ntian quan niu \n        xi \n\n天全牛膝\n\n\n\ndu niu xi\n\n都牛膝\n\n\n\nmi xin niu \n        xi\n\n米心牛膝\n\n\n\njia niu xi\n\n家牛膝\n\n\n\nruo niu xi\n\n肉牛膝\n\n\n\nda niu xi\n\n大牛膝\n\n\n\nguai niu xi\n\n拐牛膝\n\n\n\ntian niu xi \n\n\n甜牛膝\n\n\n\ntian chuan niu \n        xi\n\n甜川牛膝\n\n\n\nlong niu xi \n        ( in Sichuan) \n\n龍牛 膝 (四川)\n\n\n\nCommon Name:\n英文名﹕\nCyathula Root\nDistribution:\n產地﹕\nmainly being produced in Sichuan, Yunnan, and Guizhou.  \nRecently also propagated in Shaanxi, Hubei, and Hunan.\n主產於四川、雲南、貴州。近年來陝西、湖北、湖 南有栽培。\nProperties\n(characteristics)﹕\n性味﹕\nsweet, slightly bitter, neutral.\n甘，微苦，平。\nChannels (meridians) entered: \n歸經﹕\nliver, kidney.\n入肝，腎經。\nMedical functions:\n藥理﹕ \n1. effects on uterus: \n      the extract of this herb can relax the the pregnant and \n      non-pregnant uteri of guinea pigs and non-pregnant cats.\n2. anti-pregnancy: using \n      benzene extract of chuan niu xi 2.5 g (raw herb)/kg, continuously feeding \n      lab mice for 3 days, starting from 7th days of pregnancy. The \n      anti-pregnancy rate is 100% (15 mice) with fetuses aborted, or death or \n      bleeding from the vagina. [3]\n3. effect on blood circulation\n4. effect on metabolism\n5. cholagogue (promotes \n      bile secretion) \n6. lowers lipids\n7. effect on immune system\n8. promotes recovery of liver function of laboratory rats from  \nhepatitis caused by heliotrine.\nThe following will be translated.\n\n1.\n對子宮的作用： \n本品的流浸膏能使豚鼠已孕及未孕子宮和貓的未孕子宮弛緩，\n使家兔 已孕及未孕子宮和貓的已孕子宮收縮[1,2]。\n2.\n抗生育作用： \n川牛膝的苯提取物2.5g(生 藥)/kg，從小白鼠妊娠第7日 開始，連續灌服3日\n          。抗生育的有效率為100%(15只)， 使胚胎排出，死亡或陰道流血[3]。又報道，本品苯提取物250mg/kg抗 生育有效率為100%，500mg/kg抗 著床的有效率也為100%，而乙酸乙酯提取物效果較差，醇提取物作用最弱[4]。\n3.\n對血液流變學的影響： \n川牛膝煎劑l0g/kg灌 胃，每日2次，連續3日，對正 常及急性血淤模型大鼠的各項血液流變學指標均無明顯影響。在抗凝實驗中，對大鼠血漿復鈣時間明顯延長，表明本品有一定活血作用，但其效果 不如懷牛膝[5]。\n4.\n對代謝的影響： \n給幼鼠連續投與蛻皮甾酮60日 ，除明顯促進體重增加及肝腎蛋白合成增加外，尚可發現肝細胞處於分裂活化狀態，生成巨核，雙核或多核細胞。這些作用在成熟小鼠表現較弱[6]。 大鼠灌服蛻皮甾酮有同化作用，能增加未成熟閹割雄大鼠提肛肌重量，對未成熟及成熟大鼠可增加體重，內臟及骨骼肌重量和總蛋白量，對糖代謝 也有明顯影響，使肝糖原及肌糖原含量增加，但對脂肪代謝影響很小[7]。也有報道認 為本品對閹割動物無雄激素樣作用[8]。\n5.\n利膽作用： \n蛻皮甾酮5mg/(kg/d)灌 胃1次或連用7日，均能促進大 鼠膽汁分泌，並能改變膽汁的成分，使膽酸及膽紅素含量增加，膽固醇含量降低[9]。\n6.\n降脂作用： \n蛻皮甾酮10mg/kg灌 胃能抑制WR-1339所致大鼠高膽固醇血症及高甘油三酷血症，對兔實驗性動脈硬化 也有抑制作用[10]。\n7.\n對免疫功能的影響： \n蛻皮甾酮1mg/kg腹 腔注射，能使羊紅細胞免疫小鼠的脾臟抗體形成細胞增加。此外，能促進培養人皮膚成纖維細胞的蛋白質合成，但通常抑制植物血凝素刺激的培養 人淋巴細胞的DNA合成[11]。\n8.\n其他作用： \n蛻皮甾酮對天芥菜鹼(heliotrine)所 致肝炎大鼠，有加速肝功能恢復正常的作用[9]。\n以上中文取材自http://www.hulu.com.tw/\nActions & Indications:\n主治﹕\nrheumatism, hematuria, amenorrhea, abdominal mass （fibroids of the uterus, ovarian cysts, endometriosis, pelvic inflammation, blood retention due to gynatresia, extra-uterine pregnancy, bleeding in the uterus, and other pelvic masses)\n濕腰膝疼痛，腳痿筋攣，血淋，尿血，婦女經閉，症瘕（子宮肌瘤，卵巢囊腫，子宮內膜異位症, 盆腔炎性包 塊, 陰道閉鎖的月經瀦留, 陳舊性宮外孕, 內生殖器的畸胎瘤, 或某些婦科癌變等所表現的盆腔腫塊, 脹痛, 或出血。 ）\nChemical ingredients:\n化學成份﹕\nroot contains β-ecdysterone and trace amount of titanium (12.5ug/g).\n根含β-蛻皮甾酮(β-ecdysterone)及微量元素 鈦(12.5ug/g)等]。\nDosage:\n用量﹕\nfor decoction: 6 to 10 g, or use in pills or in powder form. It can be used for soaking in alcohol for drinking.\n煎湯: 6～10g；或入丸，散，亦可 泡酒飲。\nSamples of formulae:\n處方舉例﹕\n\n1. Name of \n    formula: xie qing tang with adjustment\n\nApplication: \n    hypertension with headache, constipation, \n    stringy, stiff and large on the 3 positions of the pulse.\n\nComposition:\n    fang feng,\n long dan \n    cao,  shan \n    zhi zi,  da \n    huang,  huang \n    qin,  chuan \n    niu xi. \n \n加減瀉青丸 (小兒藥證直訣)\n    主治：功能主治 \n    高血壓頭痛，氣實便結，脈三部弦硬而大者。\n    處方 \n防風、龍膽草、山梔子、大黃  、黃芩、川牛膝。  用法用量 水煎服。 摘錄 《雜病証治新義》\n    \n \nModern Research:\n現代研究﹕ \nToxicity & Cautions:\n毒素與禁忌﹕\nnot to use in case of pregnancy, excess bleeding during menstruation and spermatorrhea\n懷孕，經期出血過多，遺精者忌用。　\n\n\n\n\nSearch this \n    site \n\n\nProblems with website? Please \n\nClick \n    here for comment. (Not for inquiry )    \n    \n\n\nClick \n    here for inquiry \n\n\n\nCopyright Notice \n\n按此看關於版權問題\n\n \nSponsors' Ads by Google 以下為谷歌 所提供之廣告\n\n\n\n\n\n\n\n\nList \n        of Health Problems\n\n\n\n\n        Chinese Herb Dictionary\n\n\n\n\nToxicity of Some Herbs\n\n\n\nSide Effect of Some Herbs\n\n\n\nHerbs that can be toxic to kidneys\n\n\n\n\n        Traditional Chinese Medicine\n\n\nTCM Diagnosis\n\n\n        Samples of Formulae\n\n\n\n\n        Terms of Traditional Chinese Medicine\n\n\n\n        Acupuncture\n\n\n\n\n\ncopy right\n \n\n\n版權所有\n\n\n\nQigong \n        (chi kung)\n\n\n\n\n        Prescribed Drug Dictionary\n\n\n\n\n        Email our web master for  your suggestion (not for inquiry)\n\n\n\nBiochemistry Dictionary\n\n\n\n\n\nGeneral Online Library\n\n\n\nQigong \n        classes\n\n\n\nFake \n        Email Warning\n\n\n\nResearch Librarian\n\n\n\nSearch\n\n\n\n\n\nQigong classes\n\n\n\n\n\n\nHome\n\n\n\n\n        Weather Report\n\n\n\n\n        Disclaimer\n\n\n\n\n\n\nLast update: Sept 28, 2013; 10 P.m. \nLAH\n \n\n\n\n\n\n\n\n\n",
    "original_url": "http://alternativehealing.org/chuan_niu_xi.htm"
  },
  {
    "Names": {
      "Name": ["suan zao ren", "酸棗仁"],
      "Pharmaceutical": ["Semen Zizyphi Spinosae"],
      "Biological": ["Ziziphus jujuba var. spinosa (Bunge) Hu ex H. F. Chow"],
      "Common": ["sour jujube seed"],
      "Other name": [],
      "Chinese": ["酸棗仁"],
      "Pronunciation in Korean": ["sanchoin"],
      "Pronunciation in Japanese": ["sansonin"],
      "Pronunciation in Cantonese": ["syun1 zou2 jan4"],
      "Pinyin Pronunciation": ["suan zao ren"]
    },
    "Type": "Herb",
    "Geography": [
      "Hebei (China)",
      "Shaanxi (China)",
      "Liaoning (China)",
      "Henan (China)"
    ],
    "Properties": ["sweet", "sour", "neutral", "non toxic"],
    "Meridians": ["gallbladder", "heart", "liver", "spleen"],
    "Maladies Treated": [
      "anxiety",
      "insomnia",
      "excessive dreams",
      "palpitations (怔忡)",
      "weak memory/forgetfulness",
      "dizziness (head dizziness)",
      "night sweating",
      "spontaneous (instant) sweating",
      "vexation and insomnia due to yin and blood deficiency, with many dreams, palpitations, dizziness, forgetfulness, spontaneous sweating, and night sweating (pattern-level TCM context; part used: seeds/Semen Zizyphi Spinosae)"
    ],
    "Medical Function": [
      "calming; nourishes the Heart and calms the Shen; tonifies yin; astringes to prevent abnormal sweating",
      "promotes sleep (鎮靜催眠)",
      "relieves pain (鎮痛)",
      "anti-epilepsy/anticonvulsant (抗驚厥)",
      "lowers blood pressure (降血壓)",
      "anti-arrhythmia (抗心律不整)",
      "anti–myocardial hypoxia (anti lack of oxygen in heart muscle)",
      "lowers lipids (降血脂)",
      "prevents and treats atherosclerosis (防治動脈粥樣硬化)"
    ],
    "Dosage": "10–20 g. Concentrated extract: 0.5–2 g.",
    "Samples of Formulae": "Suan Zao Ren Tang (酸棗仁湯).",
    "Contraindications": "Use with caution in chronic diarrhea. Avoid or use cautiously when anxiety/restlessness of the spirit is due to excess pathogens with constrained fire, such as damp-phlegm and heat causing unsettled Shen. Caution in cases with poor appetite (納少) and profuse sweating.滑泄症者慎服.",
    "Research": "Modern Research: to be loaded.",
    "Notes": "",
    "Chemical Ingredients": {
      "Alkaloids": [
        "sanjoinine A (frangufoline; 酸棗仁鹼A，歐鼠李葉鹼) — in the seeds",
        "sanjoinine B — in the seeds",
        "sanjoinine D — in the seeds",
        "sanjoinine E (nuciferine; 荷葉鹼) — in the seeds",
        "sanjoinine F — in the seeds",
        "sanjoinine G1 — in the seeds",
        "sanjoinine G2 — in the seeds",
        "sanjoinine Ia (nornuciferine; 原荷葉鹼) — in the seeds",
        "sanjoinine Ib (norisocorydine; 去甲異紫堇定) — in the seeds",
        "sanjoinine K (coclaurine; 右旋的衡州烏藥鹼) — in the seeds",
        "N-methylasimilobine — in the seeds",
        "zizyphusine (酸李鹼) — in the seeds",
        "5-hydroxy-6-methoxynoraporphine (5-羥基-6-甲氧基去甲阿朴啡) — in the seeds",
        "amphibine D (安木非賓鹼D) — in the seeds",
        "sanjoinenine — in the seeds",
        "suan zao ren cyclopeptide (酸棗仁環肽; listed under alkaloids in the source) — in the seeds"
      ],
      "Triterpenoids": [
        "betulinic acid (白樺脂酸) — in the seeds",
        "betulin (白樺脂醇) — in the seeds",
        "ceanothic acid (美洲茶酸) — in the seeds",
        "alphitolic acid (麥珠子酸) — in the seeds",
        "jujuboside A (酸棗皂甙A) — triterpenoid saponin in the seeds",
        "jujuboside B (酸棗皂甙B) — triterpenoid saponin in the seeds",
        "daucosterol (胡蘿卜甙) — in the seeds"
      ],
      "Flavonoids": [
        "spinosin (2''-O-β-D-glucopyranosyl swertisin; 斯皮諾素) — in the seeds",
        "zivulgarin (酸棗黃素) — in the seeds",
        "6''-p-coumaroylspinosin (6''-對香豆酰斯皮諾素) — in the seeds",
        "swertisin (當藥素) — in the seeds",
        "vicenin (6,8-di-C-glucosyl apigenin) — in the seeds",
        "vicenin II (apigenin-6-C-[(6-O-p-hydroxybenzoyl)-β-D-glucopyranosyl(1→2)]-β-D-glucopyranoside; 芹菜素-6-C-[(6-O-對羥基苯甲酰)-β-D-吡喃葡萄糖基(1→2)]-β-D-吡喃葡萄糖甙) — in the seeds"
      ],
      "Other": [
        "Amino acids: threonine (蘇氨酸), valine (纈氨酸), methionine (蛋氨酸), leucine (亮氨酸), isoleucine (異亮氨酸), lysine (賴氨酸), phenylalanine (苯丙氨酸) — in the seeds",
        "Elements: K, Na, Ca, Zn, Fe, Cu, Mn（鉀，鈉，鈣，鋅，鐵，銅，錳） — in the seeds",
        "cGMP (環鳥苷單磷酸) — in the seeds",
        "cAMP (環腺苷單磷酸) — in the seeds",
        "ferulic acid (阿魏酸) — in the seeds",
        "phytosterol (植物甾醇) — in the seeds",
        "vitamin C (維生素C) — in the seeds"
      ]
    },
    "References": [],
    "Further Reading": [],
    "Original Text": "suan zao ren, Complementary and Alternative Healing UniversityComplementary and Alternative Healing University  Home  現代中藥辭典Search this siteList of Health ProblemsChinese Herb DictionaryQigongTraditional Chinese Medicine (TCM)AcupuncturePrescribed Drug DictionaryBiochemistry DictionaryLecture SlidesResearch LibrarianGeneral Online LibrarySearchResearch SitesViagraMassage/AcupressureHypnotherapyTell us what you wantNotify Changes & New Information　　To post your discussion click here.　　　  　 　　　   　                                        suan zao ren 酸棗仁 by: Joe Hing Kwok Chu Pharmaceutical name:英文藥名 ：Semen Zizyphi SpinosaeBiological name:拉丁名：Ziziphus jujuba var. Spinosa (Bunge) Hu ex H. F. ChowPron. in Japanese:日語發音 ：sansoninPron. in Korean:韓語發音 ：sanchoinPron. in Cantonese:粵語發音 ：syun1 zou2 jan4Common Name:英文名：sour jujube seedDistribution:分布：Hebei, Shaanxi, Liaoning, Henan河北，陜西，遼寧，河南。Properties (characteristics):性味：sweet, sour, neutral , non toxic.味甘,酸，性平, 無 毒。Channels (meridians) entered:歸經：gallbladder, heart, liver, spleen膽﹐心﹐肝﹐脾。Actions & Indications:主治：calming, tonic yin, prevent abnormal sweating, anxiety, insomnia, excessive dream, palpitation, weak memory, dizziness, night sweating, instant sweating.有養心安神，益陰斂汗的功能。用於陰血不足，虛煩失眠，多夢， 心悸怔忡，頭暈，健忘，自汗盜汗等。Medical Function:藥理：calming,promote sleeprelieves pain,anti epilepsylowers blood pressureanti-arrhythmiaanti lack of oxygen in heart musclelowering lipidsprevent atherosclerosis  鎮靜催眠鎮痛抗驚厥降血壓抗心律不整降血脂防治動脉粥樣硬化Chemical ingredients:化學成分 ：Alkaloids:sanjoinine A (frangufoline)，B，D，E (nuciferine)，F，G1，G2，Ia (nornuciferine)，Ib (norisocorydine），K （coclaurine） （N-methylasimilobine）（zizyphusine）（caaver-ine，5- hydroxy-6-methoxynoraporphine） （amphibine D）生物鹼：酸棗仁鹼 A (歐鼠李葉鹼)，B，D，E (荷葉鹼)，F，G1，G2，Ia (原荷葉鹼)，Ib (去甲異紫堇定)，K （右旋的衡州烏藥鹼），N-甲基巴婆鹼，酸李鹼，5-羥基-6-甲氧基去甲阿朴啡，安木非賓鹼Dsanjoinenine酸棗仁環肽Triterpenoids:三萜類：betulinic acid白樺脂酸betulin白樺脂醇ceanothic acid美洲茶酸alphitolic acid麥珠子酸jujuboside A,B酸棗皂甙A，Bdaucosterol胡蘿卜甙Flavonoids:黃酮類：spinosin （2�-O-β-D-glucopyrano-　 　sylswertisin斯皮諾素，(2�- O-β-D-吡喃葡萄糖基當藥素)zivulgarin酸棗黃素6\"-p-coumaroylspinosin6\"-對香豆酰斯皮諾素swertisin當藥素vicenin6，8-二-C-葡萄糖基芹菜素[apigenin-6-C-[（6-O-p- hydroxybenzoyl）-β-D-glucopyranosyl（1→2）]-β-D-glucopyranoside]6，8-二-C-葡萄糖基芹菜素（vicenin Ⅱ），芹菜素-6-C- 　　[（6-O-對羥基苯甲酰）-β-D-吡喃葡萄糖基（1→2）]-β-D-吡喃葡萄糖甙Other:其他：threonine蘇氨酸valine纈氨酸methionine蛋氨酸leucine亮氨酸isoleucine異亮氨酸lysine賴氨酸phenylalanine苯丙氨酸K, Na, Ca, Zn, Fe, Cu, Mn鉀，鈉，鈣，鋅，鐵，銅，錳等cGMP環鳥苷單磷酸cAMP環腺苷單磷酸ferulic acid阿魏酸phytosterol植物甾醇vitamin C維生素CDosage:用量：10～20g。Concentrated extract: 0.5 ~2 g10～20公克。濃縮中藥：0.5～2 公克。Samples of formulae:處方舉例：suan zao ren tang 酸棗仁湯Modern Research:現代研究 ：to be loadedCautions:禁忌：use with caution in case of chronic diarrhea,  or in case of anxiety due to chronic bronchitis, yeast or bacterial infection.心悸,納少,多汗者,有實邪鬱火,如濕痰邪熱所致的心神不安者 忌用及滑泄症者慎服。Sponsors' Ads by Google 以下為谷歌所提供贊助者之廣告 Click here for inquiry  List of Health ProblemsChinese Herb DictionaryToxicity of Some HerbsSide Effect of Some HerbsHerbs that can be toxic to kidneysTraditional Chinese MedicineTCM DiagnosisSamples of FormulaeAcupuncturecopy right 版權所有Qigong (chi kung)Prescribed Drug DictionaryEmail our web master for  your suggestion (not for inquiry)Biochemistry DictionaryGeneral Online LibraryQigong classesFake Email WarningResearch LibrarianSearchQigong classesHomeWeather Report DisclaimerLast update: May 9; 12:41 a.m. LAH  ",
    "original_url": "http://alternativehealing.org/suan_zao_ren.htm"
  },
  {
    "Names": {
      "Name": ["su mu"],
      "Pharmaceutical": ["Lignum Sappan"],
      "Biological": ["Caesalpinia sappan L."],
      "Common": ["sappan wood"],
      "Other name": ["su fang mu", "hong chai"],
      "Chinese": ["蘇木", "蘇枋木", "紅柴"],
      "Pronunciation in Korean": ["somok"],
      "Pronunciation in Japanese": ["soboku"],
      "Pronunciation in Cantonese": ["sou1 muk6"],
      "Pinyin Pronunciation": []
    },
    "Type": "Herb",
    "Geography": [
      "Taiwan",
      "Guangdong",
      "Guangxi",
      "Guizhou",
      "Yunnan (China)"
    ],
    "Properties": ["Neutral", "Sweet", "Salty"],
    "Meridians": ["Liver", "Stomach", "Large Intestine"],
    "Maladies Treated": [
      "Vomiting due to pixu (spleen deficient) cold or dampness, or fungal infection",
      "Hiccups due to pixu (spleen deficient) cold or dampness, or fungal infection",
      "Burping due to pixu (spleen deficient) cold or dampness, or fungal infection",
      "Indigestion due to pixu (spleen deficient) cold or dampness, or fungal infection",
      "Gastric distension/flatulence due to pixu (spleen deficient) cold or dampness, or fungal infection",
      "Difficulty in expelling phlegm",
      "Phlegm accumulation with qi counterflow",
      "Stubborn phlegm congealing",
      "Unsmooth coughing and expectoration",
      "Focal distention in the chest",
      "Chronic bronchitis",
      "Traumatic injuries from impact",
      "Dysentery",
      "Tetanus"
    ],
    "Medical Function": ["Lessening the rejection effect in organ transplants"],
    "Dosage": "10 to 20 g.\nConcentrated extract: 0.5 to 2 g.",
    "Samples of Formulae": "Cheng Shang San (澄傷散).\nSee formula for Torticollis (external use) 落枕.\nDa Cheng Tang (大成湯).",
    "Contraindications": "Not suitable in cases of blood deficiency without blood stasis.\nContraindicated in pregnancy.\nAvoid iron (《綱目》: 忌鐵).\nAfter postpartum lochia has ceased, abdominal pain due to blood deficiency: not suitable to use (《本草經疏》).\nProhibited for loose stools (《本經逢原》).\nMarket adulterants exist: dyed wood sold as fake su mu. When soaked in hot water, the water turns light yellow, yellow, or orange; distinguish carefully.",
    "Research": "Cardio-vascular effect: When injected into the lower limbs of toads, water extract of su mu mildly constricted blood vessels; subsequent use of sodium nitrite could not dilate them. In vitro, an appropriate amount of aqueous solution of su mu increased the strength of contraction of frog hearts (animal experiments on toads and frogs).\n\nEffect on central nervous system inhibition: Appropriate amounts of aqueous solution of su mu, delivered by various methods, promoted sleep in mice, rabbits, and guinea pigs. Large amounts caused anesthesia effects and even death. It inhibited the stimulating effects of strychnine or cocaine, but not the stimulating effect of morphine (animal experiments on mice, rabbits, and guinea pigs).\n\nAntibacterial effects: A 10% decoction of su mu exhibited a strong bactericidal effect on Staphylococcus spp. and typhoid bacillus. It was effective against both Gram-negative and Gram-positive bacilli.\n\nTransplanted heart study: Results announced by Heilongjiang Traditional Chinese Medical School showed that su mu distinctly prolonged the lifespan of transplanted hearts. The pathological morphology and ultrastructural changes of myocardial cells were markedly milder than in the model control group and closer to those of the Cyclosporin A group. Further observations via molecular biology and immunology indicated that su mu inhibited gene expression of perforin and granzyme B released by cytotoxic T cells, reducing host rejection reactions and thereby protecting the transplanted heart.",
    "Notes": "",
    "Chemical Ingredients": {
      "Wood": [
        "Brasilin 2%, which is easily oxidized in air to brasilein (responsible for the red color of su mu)",
        "Sappanine",
        "Volatile oil: major components d-α-phellandrene and ocimene (responsible for the fragrance of su mu)",
        "Tannic acid"
      ]
    },
    "References": [],
    "Further Reading": [],
    "Original Text": "su mu, Complementary and Alternative Healing UniversityComplementary and Alternative Healing University   中藥詞典                 Chinese Herb Dictionary      Search this site     在本網站找資料Search this siteList of Health ProblemsChinese Herb DictionaryQigongTraditional Chinese Medicine (TCM)AcupuncturePrescribed Drug DictionaryBiochemistry DictionaryLecture SlidesResearch LibrarianGeneral Online LibraryResearch SitesViagraMassage/AcupressureHypnotherapyTell us what you wantNotify Changes & New Information  su mu 蘇木   (in English and Chinese 中英文) by: Joe Hing kwok Chu    朱興國編譯Present Day Applications:現代應用﹕for lessening the rejection effect in organ transplants.Pharmaceutical name:英 文藥名﹕Lignum SappanBiological name:拉 丁文學名﹕Caesalpinia sappan L.Pron. in Japanese:日語發音﹕sobokuPron. in Korean:韓語發音﹕somokPron. in Cantonese粵音﹕sou1 muk6Other Names:別名﹕su fang mu 蘇枋木, hong chai   紅柴Common Name:英文名﹕sappan woodDistribution:產地﹕mainly in Taiwan, Guangdong, Guangxi, Guizhou, Yunnan provinces of China.主產台灣，廣東，廣西， 貴州， 云南等 省區。Properties(characteristics)﹕性味﹕neutral, sweet, salty.性平，味甘﹐鹹。Channels (meridians) entered: 歸經﹕liver, stomach, large intestine肝, 胃, 大腸.Medical functions:藥理﹕ cardio-vascular effect: injected into the lower limbs of toads, water extract of su mu could mildly constrict the blood vessels. Later using sodium nitrite could not dilate them. In vitro appropriate amount of water solution of su mu could increase the strength of constriction of the hearts of frogs.Effect on CNS inhibition: appropriate amount of water solution of su mu, using various delivery methods, promoted sleep in mice, rabbit, and guinea pigs. Large amount created anesthesia effects even death. It can inhibit the stimulating effect of strychnine or cocaine but not the stimulating effect of morphine.anti bacteria effects: su mu decoction of 10% posseses a strong killing effect on Staphylococcus spp. and typhoid bacillus. It is effective on Gram-negative and positive bacilli Actions & Indications:主治﹕For vomiting, hiccups, burping, indigestion, and  flatulence due to pixu (spleen deficient) or fungal infection; and for difficulty in expelling phlegm; chronic bronchitis; injuries from impact, dysentery, tetanus.治脾 虛寒或濕之嘔吐，呃逆，噫氣， 消化不良，胃部膨脹。痰壅氣逆，頑痰膠結，咳吐不爽，胸中痞悶，慢性氣管炎。跌打損傷﹐ 痢疾﹐ 破傷風 。Chemical ingredients:化學成份﹕The wood contains:brasilin 2%, which is oxidized easily into brasilein (which is the red color of su mu)sappaninevaporating oil: d-α- phellandrene, ocimene (which is the fragrance of su mu)tannin acid木材含：2％巴西蘇木素，在空氣中易被氧化成紅色的巴西蘇木色素（這是紅顏色的蘇木）蘇木酚揮發油：主要成份為：d-α-水芹烯，羅勒烯（這是蘇木的清香成份）鞣酸。Dosage:用量﹕10 to 20 g.Concentrated extract: 0.5 to 2 g.10～20克。 濃縮中藥：0.5～2.0克 。Samples of formulae:處方舉例﹕cheng_shang_san chengda cheng tangSee formula for Torticollis  (external use)澄傷散看落枕 外用藥方。大成湯Modern Research:現代研究﹕Using su mu can distinctly prolong the life span of transplanted heart and the change of the cells of the myocardum and the change of the ultrastructures of the cells are milder than the control group, and closer to that of Cyclosporin A group; thus announced by Heilongjiang Traditional Chinese Medical School. Further observation by molecular biology and immunology, su mu can inhibit T cells toxin and can reduce the host rejection reaction, thus protect the transplanted heart.黑龍江中醫藥大學研究的結果表明，蘇木可以明顯延長移植心臟的存活時間，其心肌細 胞的病理形態學和細胞超微結構的變化要明顯輕於模型對照組，接近於環孢素 A組。經分子生物學及免疫學進一步觀察，蘇木可以抑制細胞毒性T細胞釋 放的穿孔素和顆粒 B的基因表達，從而減輕宿主的抗排斥反應，使被移植的心臟得到保護。Cautions:禁忌﹕Not suitable in cases of  blood deficient   and without  blood stasis . Not to use in cases of pregnancy.There are fake su mu in the market. Those are dyed wood. When the fake su mu is soaked in water, the water shows light yellow, yellow or orange color.血虛無淤者 不宜，孕婦忌服。《綱目》：�忌鐵。�《本草經疏》：�產後惡露已淨，由血虛腹痛者不宜用。�《本經逢原》：�大便不實者禁用。�  市場上發現用木材染色偽制蘇木，該品浸熱水中，水顯淺黃色, 黃色, 橙黃色等。應注意鑒別 。   　Search this siteProblems with website? Please Click here for comment. (Not for inquiry )    Click here for inquiryCopyright Notice 按此看關於版權問題 Sponsors' Ads by Google 以下為谷歌 所提供之廣告 List of Health ProblemsChinese Herb DictionaryToxicity of Some HerbsSide Effect of Some HerbsHerbs that can be toxic to kidneysTraditional Chinese Medicine TCM Diagnosis Samples of FormulaeTerms of Traditional Chinese MedicineAcupuncturecopy right 版權所有Qigong (chi kung)Prescribed Drug DictionaryEmail our web master for  your suggestion (not for inquiry)Biochemistry DictionaryGeneral Online LibraryQigong classesFake Email WarningResearch LibrarianSearchQigong classesDisclaimerHomeWeather Report Last update: Aug 5, 2014; 10 p.m. LAHL   ",
    "original_url": "http://alternativehealing.org/su_mu.htm"
  },
  {
    "Names": {
      "Name": ["ai ye 艾葉"],
      "Pharmaceutical": ["Folium artemisiae argyi"],
      "Biological": [
        "Artemisia argyi Levl.et Vant.",
        "Artemisia vulgaris",
        "Artemisia lavandulaefolia DC"
      ],
      "Common": ["mugwort leaf"],
      "Other": [
        "qi ai",
        "ai rong",
        "cu ai ye",
        "cu ai rong",
        "ai tan",
        "qi ai (祁艾)",
        "chen ai ye",
        "chen ai",
        "ai ye tan",
        "chao ai ye"
      ],
      "Chinese": [
        "艾葉",
        "蘄艾",
        "艾絨",
        "醋艾葉",
        "醋艾絨",
        "艾炭",
        "祁艾",
        "陳艾葉",
        "陳艾",
        "艾葉炭",
        "炒艾葉"
      ],
      "Pronunciation in Korean": ["aeyop"],
      "Pronunciation in Japanese": ["gaiyo"],
      "Pronunciation in Cantonese": ["ngaai6 jip6"],
      "Pinyin Pronunciation": []
    },
    "Type": "Herb",
    "Geography": [
      "throughout China, especially in Anhui, Shandong, Hubei and Hebei provinces",
      "most parts of south east Asia"
    ],
    "Properties": ["bitter", "acrid", "warm"],
    "Meridians": ["Spleen", "Liver", "Kidney"],
    "Maladies Treated": [
      "uterine bleeding due to deficiency cold (虚寒證子宫出血); for stronger hemostasis the charred form ai tan (艾炭) is used",
      "threatened abortion",
      "infertility due to uterine deficiency cold (子宫虚寒不孕)",
      "dysmenorrhea due to cold (虚寒痛經)",
      "heavy menses or bleeding during pregnancy",
      "vomiting blood",
      "nose bleeding",
      "blood in stool",
      "bleeding in hemorrhoids",
      "chronic diarrhea",
      "chronic hepatitis",
      "chronic bronchitis",
      "asthma",
      "irregular menses",
      "habitual miscarriage",
      "sinus inflammation (chronic sinusitis)",
      "itchy scrotal area (陰囊發癢)",
      "stubborn hiccups"
    ],
    "Medical Function": [
      "relaxes the smooth muscles of bronchi (bronchial smooth muscle relaxation)",
      "antibiotic",
      "antivirus",
      "stop bleeding",
      "warms the womb",
      "improves blood forming",
      "used as material for moxibustion (moxa; ai rong/艾絨)"
    ],
    "Dosage": "1 ~ 3 qian. Qian = 3.75 grams (traditional) or approximately 4 to 11 grams.",
    "Samples of Formulae": "For heavy menses or bleeding during pregnancy: Ai Ye (Mugwort leaf) with Dang Gui (Angelica sinensis root) 3 qian each, Bai Shao (White peony root) 3 qian, Sheng Di Huang (Rehmannia root) 3 qian, Chuan Xiong (Szechuan lovage rhizome) 1 qian; boil with water and take orally.\n\nFor vomiting blood, nose bleeding, blood in stool, bleeding in hemorrhoids: Ai Ye (Mugwort leaf) 3 qian, Sheng Di Huang (Rehmannia root) 3 qian, Bo Ye [Bai Ye/柏葉] (Platycladus/Chinese arborvitae leaf) 3 qian, He Ye (Lotus leaf) 2 qian; boil with water and take orally.\n\nFor chronic diarrhea: Ai Ye (Mugwort leaf) 7.5 g, Sheng Jiang (Fresh ginger) 12 g, Chen Pi (Aged tangerine peel) 4 g; boil into a thick extract and take orally while warm.\n\nUse as fuel in moxibustion.\n\nBoil with water to be used as bath water.\n\nFor threatened abortion: Gu Shen An Tai Yin (固腎安胎飲).",
    "Contraindications": "Use caution in cases of yin deficiency or xue re (heat in blood). The effective ingredient is the volatile oil and it is the toxic ingredient which can cause inflammation of the skin and mucous membranes. Taken orally it can irritate the digestive tract. After absorption it can reach the liver and obstruct hepatic metabolism and can cause jaundice-type hepatitis. Its effect toward the central nervous system is prominent; in toxic reaction the central nervous system becomes overactive and can induce seizure. Due to changes of neural reflexes it can damage blood vessel walls and cause reactive hyperemia of the uterus and bleeding. Oral toxic range: 20 ~ 30 g. [12]",
    "Research": "A report from Shanghai Donghua Hospital and others: Using ai ye disinfection incense (made by Shanghai Everyday Chemical Products), which consists of 30% of Cang Zhu (Atractylodes rhizome) powder and 20% of Ai Ye (mugwort leaf) powder, smoking for 4 hours can kill β-Hemolytic streptococcus - A group, Pneumonococcus, Hemophilus influenzae, and Staphylococcus aureus. Smoking for 8 hours can kill Pseudomonas aeruginosa and can inhibit the growth of Bacillus subtilis.",
    "Notes": "Li Shizhen stated: “Ai ye of Qizhou is superior; it is used to fill prescriptions, valued under heaven, and is called Qi Ai (蘄艾).”\n\nPrescription-name processing notes: When written as Ai Ye (艾葉/艾叶) it refers to raw, dry ai ye. Ai Rong (艾絨) is the smashed leaves and branches made into a woolly material for moxa. Cu Ai Ye (醋艾葉) or Cu Ai Rong (醋艾絨) is prepared by mixing clean ai ye or ai rong with rice vinegar, allowing it to be absorbed, then stir-frying over low heat until slightly scorched. Ai Tan (艾炭; also Ai Ye Tan, 艾葉炭) is made by stir-frying clean ai ye over low heat until brown and charred, then removing, spraying with water to extinguish sparks, and drying under the sun.\n\nMoxibustion material note: For moxibustion, stale ai ye more than a year old should be used, because fresh ai ye contains more essential oil, burns faster, and the fumes are harmful.",
    "Chemical Ingredients": {
      "Volatile oils": [
        "alpha -phellandrene",
        "camphenbe",
        "alpha-cedrene",
        "transcarveol",
        "bornyl acetate",
        "elemol",
        "isoborneol",
        "alpha-terpineol",
        "beta-caryophyllene",
        "carvone [1]",
        "cadinene",
        "thujylalcohol [2]"
      ],
      "Triterpenes": [
        "alpha-amyrin",
        "beta-amyrin",
        "friedelin",
        "9beta,methoxy-9beta, 10 cylolanost -23 (E)-en25, 26-diol [3]"
      ],
      "Terpenes of 1.5": [
        "matricarin",
        "hanphyllin [4]",
        "11,13-dihydroalteglasin A [5]"
      ],
      "Others": [
        "flavone alcohol",
        "eupatilin",
        "beta-sitostero [6]",
        "silicon and non-organic elements"
      ]
    },
    "References": [],
    "Further Reading": [],
    "Original Text": "ai ye, Complementary and Alternative Healing UniversityComplementary and Alternative Healing University \n  中藥詞典                 Chinese Herb Dictionary      Search this site     在本網站找資料Search this siteList of Health ProblemsChinese Herb DictionaryQigongTraditional Chinese Medicine (TCM)AcupuncturePrescribed Drug DictionaryBiochemistry DictionaryLecture SlidesResearch LibrarianGeneral Online LibraryResearch SitesViagraMassage/AcupressureHypnotherapyTell us what you wantNotify Changes & New Information  ai ye 艾葉          (in English and Chinese 中英文)By: Joe Hing Kwok ChuClick here to see picture of herb. 按此看艾葉圖。Pharmaceutical name:英文藥名：Folium artemisiae argyiBiological name:拉丁名：Artemisia argyi Levl.et Vant.Artemisia vulgarisArtemisia lavandulaefolia DCPron. in Japanese:日語發音： gaiyoPron. in Korean:韓語發音： aeyopPron. in Cantonese:粵語發音： ngaai6 jip6Other Name:別名：Prescription names:ai ye 艾葉，qi ai 蘄艾，ai rong 艾絨，cu ai ye 醋艾葉，cu ai rong 醋艾絨，ai tan 艾炭，qi ai 祁艾，chen ai ye 陳艾葉，chen ai 陳艾，ai ye tan 艾葉炭，chao ai ye 炒艾葉。 Clink here to read the explanantion on prescription names.按此看處方名 解釋。Common Name:英文名： mugwort leafDistribution:分布： throughout China, especially in Anhui, Shandong Hubei and Hebei provinces and in most parts of south east Asia.全中國，尤其是安徽，山東，湖北，和河北省。大部分東南亞也有。李時珍稱：「艾葉以蘄州者為勝，用充方物，天下重之，謂之蘄艾。」Properties (characteristics)：氣味： bitter, acrid, warm苦，辛，溫。Channels (meridians) entered:歸經： spleen, liver, kidney.脾，肝，腎。 Medical Functions:藥理﹕Medical Functions:relaxes the smooth muscles of bronchiantibioticantivirusstop bleeding藥理﹕平喘，能鬆弛支氣 管平滑肌抗菌﹐抗病毒止血。.Actions & Indications: 主治與用途﹕Actions & Indications:warms the womb and stops bleeding, (usually made into almost like burnt carbon by stir frying)pacifies the fetus,for infertility due to cold womb,improve blood forming.As material for moxibustion.主治與用途﹕温經止血：用于虚 寒證子宫出血。為加强止血常炒炭 (艾炭)用。安胎暖宫散寒：用于子 宫虚寒不孕﹐虚寒痛經 。補血作灸治燃料Chemical ingredients:化學成分：Volatile oils:alpha -phellandrene, camphenbe, alpha-cedrene, transcarveol, bornyl acetate, elemol, isoborneol, alpha-terpineol, beta-caryophyllene, carvone[1], cadinene, thujylalcohol[2].Triterpenes:alpha-amyrin, beta-amyrin, friedelin, 9beta,methoxy-9beta, 10 cylolanost -23 (E)-en25, 26-diol[3]Terpenes of 1.5:matricarin, hanphyllin[4], 11,13-dihydroalteglasin A[5]Othersflavone alcohol, eupatilin, beta-sitostero[6], silicon and non-organic elements.Dosage:用量：1 ~ 3 qian. Qian = 3.75 grams (traditional) or appr. 4 to 11 grams.1~ 3 錢。（舊制，錢=3.75 克）Samples of formulae:處方舉例：For heavy mensus or bleeding during pregnancy: combine with dang gui , bai shao , di huang  3 qian each, chuan xiong  1 qian. Boil with water. Taken orally.For vomiting blood, nose bleeding, blood in stool, bleeding in hemorrhoids: combine with sheng di huang , bo ye 3 qian each, he ye  2 qian. Boil with water. Take orally.For chronic diarrhea: ai ye 7.5 g,  sheng jiang 12 g , chen pi 4 g ; boiled into thick extract. Taken orally while warm.Use as fuel in moxibustion.Boiled with water to be used as bath water.For threaten abortion: gu shen an tai yin經期流血過多或 懷孕流血用﹕艾葉﹐當\n  歸  ,  白\n  芍 , 生地黃  各三錢,  川\n  芎 一錢﹔水煎服。 吐血﹐鼻血﹐便 血﹐痔瘡流血用﹕艾葉三錢﹐生地黃 三錢,  柏\n  葉 三錢﹐荷\n  葉二錢﹔水煎服。 長期腹瀉用﹕艾葉 二錢﹐  生\n  姜 三錢,  陳皮 一錢﹔ 煎濃湯。溫服。水煮作浴湯用。先兆流產： 固腎安胎飲Modern Usage:現代應用：Modern Usage:1. chronic hepatitis2.  chronic bronchitis3. asthma4. irregular menses5. habitual miscarriage6. painful menses7. sinus inflammation8. itchy testicle area9. stubborn type of hiccups現代應用：慢性肝炎慢性支氣管炎哮喘月經不正常經痛慢性鼻竇炎陰囊發癢頑固性打\n  呃Cautions and toxicity:毒素與禁忌：use caution in case of yin deficiency or xue re (heat in blood) 血熱.  The effective ingredient is the volatile oil and it is the toxic ingredient which can cause inflammation of the skin mucus. Taken orally can cause irritation of the of the digestive tract. After absolving, it can arrive at the liver and can obstruct the metabolism of the liver and can cause jaundice type of hepatitis. Its effect toward the central nervous system is prominent. In toxic reaction, the central nervous system becomes over active and can induce seizure. Because of the changes of the reflex of the nerves, it can damage the walls of  blood vessels and causes hyperemia (increase of blood flow to the part of body) of the uterus and causes bleeding. Toxic range 20 ~ 30 g if taken orally. [12]有陰\n    虛或血\n    熱 情形，須小心應用。其有效成份發揮油有毒能使皮膚粘膜發炎。內服能刺激消化道。吸收後會達到肝臟而影 響肝臟的新陳代謝而致黃疸。其對中區神經尤為厲害。中區神經會過度活動而引起癲癇。 因為它改變神經反應而損害血管而導致子 宮反應性充血而流血。其有毒口服劑量為20～30克。 Note：Ai ye when used in moxibustion, stale ai ye more than a year old should be use. It is because the the fresh on contains more essential oil and it burns faster and the fumes is harmful.注：灸用陳年之艾葉較有好。新艾含揮發油較多，燃燒較快，釋放對身體有害的氣體。一般用一年以上的陳艾。 A report from Shanghai Donghua Hospital and others: Using ai ye disinfection incense, (made by Shanghai Everyday Chemical Products), which consists of 30% of cang zhu   powder and 20% of ai ye powder, smoking 4 hours, can kill off β-Hemolytic streptococcus- A group﹐Pneumonococcus﹐Hemophilus Influenzae and Staphylococcus aureus etc. Smoking 8 hours can kill off Pseudomonas aeruginosa)，and can inhibit the growth of Bacillus subtilis.上海華東醫院等單位報導，用含艾葉的消毒香(上海日用化學品試制，含蒼 朮粉30％，艾葉粉20％) 烟熏4小時能殺滅乙型 溶血性鏈球菌A群 （β-Hemolytic streptococcus- A group）﹐ 肺炎球菌 (Pneumonococcus)﹐流感桿菌 (Hemophilus influenzae)和 金黄色葡萄球菌 （Staphylococcus aureus）等，烟熏8小時能殺 滅綠膿 桿菌 (Pseudomonas aeruginosa).， 并能 抑制枯草桿菌 （Bacillus subtilis）的生長。In prescription:When it is written as ai ye (艾葉，艾叶）it refers to raw ai ye, dry ai ye.ai rong （艾絨）is the smashed leaves and branches of the herb and is made into wooly material for moxa.cu ai ye （醋艾葉）is using rice vinegar to soak and mix with ai ye and using low heat to stir fry until slightly brown.ai tan （艾炭）is using low heat to stir fry ai ye until burning brown. Spray with water and dry under the sun. It can be used for warming the channels and ridding of coldness and for arresting bleeding.處方名：處方中寫艾葉，蘄艾， 祁艾指生艾葉，乾艾葉。為原藥去梗去雜質生用入藥者。艾絨為淨艾葉及枝碾碎 成絨者。醋艾葉，醋艾絨又稱醋 炒艾葉或醋炒艾絨。為淨艾葉或淨艾絨用米醋拌勻，吸干後用文火炒至微焦而入藥者。以增強溫經散寒作用。艾炭又稱艾葉炭。為淨 艾葉用文火炒至焦褐色，取出噴洒澆水，滅盡火星，然後晒干入藥者。既可溫經散寒，又可收斂止血。Search this siteProblems with website? Please Click here for comment. (Not for inquiry )    Click here for inquiryCopyright Notice 按此看關於版權問題 Sponsors' Ads by Google 以下為谷歌 所提供之廣告 List of Health ProblemsChinese Herb DictionaryToxicity of Some HerbsSide Effect of Some HerbsHerbs that can be toxic to kidneysTraditional Chinese MedicineTCM DiagnosisSamples of FormulaeTerms of Traditional Chinese MedicineAcupuncturecopy right 版權所有Qigong (chi kung)Prescribed Drug DictionaryEmail our web master for  your suggestion (not for inquiry)Biochemistry DictionaryGeneral Online LibraryQigong classesFake Email WarningResearch LibrarianSearchQigong classesDisclaimerHomeWeather ReportLast update: Nov 30, 2014; 3 p.m. LAH    \n",
    "original_url": "http://alternativehealing.org/ai_ye.htm"
  },
  {
    "Names": {
      "Name": ["gao ben"],
      "Pharmaceutical": ["Rhizoma Ligustici"],
      "Botanical": [
        "Ligusticum sinense Oliv. (篙本)",
        "Ligusticumjeholense Naki et Kitag. (遼篙本)"
      ],
      "Common": ["English: Chinese lovage root, ligusticum root"],
      "Other name": [
        "gao ba 篙茇",
        "gui qing 鬼卿",
        "di xin 地新",
        "shan ju 山苣",
        "wei xiang 蔚香",
        "wei jing 微茎",
        "gao ban 篙板"
      ],
      "Chinese": ["藁本", "篙本", "遼篙本"],
      "Pronunciation in Korean": ["kobon"],
      "Pronunciation in Japanese": ["kohon"],
      "Pronunciation in Cantonese": ["hou1 bun2"],
      "Pinyin Pronunciation": ["gǎo běn"]
    },
    "Type": "Herb",
    "Geography": ["Hunan (China)", "Sichuan (China)", "Liaoning (China)"],
    "Properties": ["Acrid", "Warm"],
    "Meridians": ["Bladder"],
    "Maladies Treated": [
      "wind cold type of influenza",
      "headache on top of head",
      "rheumatoid arthritis with achy arms (風濕肢節臂痹)"
    ],
    "Medical Function": [],
    "Dosage": "4 to 12 g.",
    "Samples of Formulae": "Jiang Huo Sheng Shi Tang (薑活勝濕湯).\n\nWen Feng San (温風散) — Trigeminal neuralgia or toothache [1]. Composition: Dang Gui (Chinese angelica root) 6g, Xi Xin (Asarum) 4.5g, Chuan Xiong (Szechuan lovage rhizome) 6g, Bi Bo (Long pepper fruit) 6g, Gao Ben (Ligusticum rhizome) 6g, Bai Zhi (Angelica dahurica root) 6g, Lu Feng Fang (Hornet's nest) 18g. Modification for trigeminal neuralgia: add Ma Huang (Ephedra stem) 9g, Chuan Fu Zi (Processed aconite lateral root) 12g, Qiang Huo (Notopterygium root and rhizome) 6g. Toothache (not swollen, severe pain, prefers hot drinks; cold-type toothache): add Qiang Huo (Notopterygium root and rhizome), Ma Huang (Ephedra stem), Chuan Fu Zi (Processed aconite lateral root) to warm and disperse. Note: Tian Xiong refers to the long and slender form of Fu Zi (aconite lateral root) or Cao Wu Tou (wild aconite root).",
    "Contraindications": "Contraindicated in xue xu (blood deficiency), yinxu (yin deficiency), liver yang ascending, and headaches due to warm-heat pattern (溫熱證頭痛).",
    "Research": "",
    "Notes": "",
    "Chemical Ingredients": {
      "Volatile oil": ["3-But-ylphthalide", "Cnidilide", "Methyl eugenol"]
    },
    "References": ["[1] 醫宗金鑒 (Yi Zong Jin Jian)."],
    "Further Reading": [],
    "Original Text": "gao ben, Complementary and Alternative Healing University     現代中藥辭典Complementary and Alternative Healing University  Home  中 藥詞典Search this site       Search this siteList of Health ProblemsChinese Herb DictionaryQigongTraditional Chinese Medicine (TCM)AcupuncturePrescribed Drug DictionaryBiochemistry DictionaryLecture SlidesResearch LibrarianGeneral Online LibrarySearchResearch SitesViagraMassage/AcupressureHypnotherapyTell us what you wantNotify Changes & New Information  gǎo běn  藁本 by: Joe Hing kwok ChuPharmaceutical name:英文藥名﹕Rhizoma LigusticiBotanical name:學名﹕Ligusticum sinense Oliv. (篙本)Ligusticumjeholense Naki et Kitag. (遼篙本)Pron. in Japanese:日語發音﹕kohonPron. in Korean:韓語發音﹕kobonPron. in Cantonese:粵音﹕hou1 bun2Other Names:別名﹕gao ba 篙茇, gui qing 鬼卿, di xin 地新, shan ju  山苣, wei xiang 蔚香, wei jing 微茎, gao ban 篙板.Common Name:英文名﹕Chinese lovage root, ligusticum rootDistribution:產地﹕Hunan, Sichuan, Liaoning provinces of China.湖 南 ﹐ 四 川 ﹐ 遼 寧 。Properties(characteristics)﹕性味﹕acrid, warm.辛，温。Channels (meridians) entered: 歸經﹕bladder膀胱Medical functions:藥理﹕  Actions & Indications:主治﹕for wind cold type of influenza, headache on top of head, rheumatoid arthritis with achy arms.用于風 寒感冒，巅頂 頭 痛，風 濕 肢節 臂痹。Chemical ingredients:化學成份﹕Contains evaporating oil. Main ingredients of the oil:含揮 發 油﹐  主 要 成 份 為 ﹕3-But-ylphthalide3-正丁基篙本内 酯Cnidilide川芎内酯Methyl eugenol甲基丁香油酚Dosage:用量﹕4  to 12 g.4~ 12 克 。Samples of formulae:處方舉例﹕jiang huo sheng shi tang 薑活勝濕湯wen feng san 温風散Trigeminal neuralgia or toothacheName of Formula: wen feng san\n\n[1]Composition:三叉神經痛，或 牙痛： 溫風散\n\n[1] 當 歸 6克，細 辛 4.5克，川 芎 6克，蓽 撥 6克，篙 本 6克，白 芷 6克，露 蜂房18克。三叉神經痛：本方 加麻 黃 9克，川附子 12克，羌活 6克， 牙痛：不腫痛甚，喜飲熱湯，為寒牙痛，宜本方再加羌活，麻 黃，川附子溫而散之。 註：天雄為附子或草烏頭之形長而細者。Modern Research:現代研究﹕ Toxicity & Cautions:毒素與禁忌﹕ It is contra-indicated to those with xue xu (blood deficient) or with yinxu (yin deficient) or with  liver yang ascending syndromes. 陰 虛 或   血虛， 或   肝 陽 上亢 及 温 熱 證 頭 痛  忌 服 。\n[1]\n\nYi Zong Jin Jian  醫宗金鑒Sponsors' Ads by Google 以下為谷歌 所提供之廣告 A manuscript... writing, translating and proofreading  in progress Problems with website? Please Click here for comment. (Not for inquiry )   Click here for inquiry  Copyright Notice 按此看關於 版權問題List of Health ProblemsChinese Herb DictionaryToxicity of Some HerbsSide Effect of Some HerbsHerbs that can be toxic to kidneysTraditional Chinese MedicineTCM DiagnosisSamples of FormulaeTerms of Traditional Chinese MedicineAcupuncturecopy right 版權所有Qigong (chi kung)Prescribed Drug DictionaryEmail our web master for  your suggestion (not for inquiry)Biochemistry DictionaryGeneral Online LibraryQigong classesFake Email WarningResearch LibrarianSearchQigong classesHomeWeather Report    DisclaimerLast update: April 7, 2012; 5:22 p.m. LAH  \n",
    "original_url": "http://alternativehealing.org/gao_ben.htm"
  },
  {
    "Names": {
      "Name": ["can dou", "蠶豆"],
      "Pharmaceutical": ["Semen Viciae fabae"],
      "Botanical": ["Vicia faba L."],
      "Common": ["broad bean", "horse bean", "fava bean"],
      "Other name": [
        "fo dou (Buddha bean) 佛豆",
        "hu dou (foreigner bean) 胡豆",
        "nan dou (southern bean) 南豆",
        "ma chi dou (horse tooth bean) 馬齒豆",
        "shu dou (pointing up bean) 豎豆",
        "xian dou (angel bean) 仙豆",
        "han dou (cold bean) 寒豆",
        "wan dou 灣豆",
        "lou fan dou 羅泛豆",
        "xia dou (summer bean) 夏豆",
        "da dou (from a dialect of Yan Qing) 大豆（延慶方言）",
        "lan hua dou (orchid bean) 蘭花豆"
      ],
      "Chinese": [
        "蠶豆",
        "佛豆",
        "胡豆",
        "南豆",
        "馬齒豆",
        "豎豆",
        "仙豆",
        "寒豆",
        "灣豆",
        "羅泛豆",
        "夏豆",
        "大豆（延慶方言）",
        "蘭花豆"
      ],
      "Pronunciation in Korean": ["jamdu"],
      "Pronunciation in Japanese": [
        "yamatomame",
        "toumame",
        "natsumame",
        "utsukimame",
        "satsukimame",
        "amame",
        "yukiwarimame",
        "fuyumame"
      ],
      "Pronunciation in Cantonese": ["caam4 dau6"],
      "Pinyin Pronunciation": ["can dou"]
    },
    "Type": "Herb",
    "Geography": [],
    "Properties": ["sweet", "acrid", "neutral"],
    "Meridians": ["heart", "spleen", "stomach"],
    "Maladies Treated": [
      "fatigue and short of breath",
      "loose stool and diarrhea",
      "edema from heart or kidney disease",
      "difficulty in urination",
      "bleeding (pods, flowers, and leaves)"
    ],
    "Medical Function": ["lowering blood pressure (flowers)"],
    "Dosage": "15 -30 g",
    "Samples of Formulae": "For treatment of edema: Composition: can dou (fava bean) 60 g; dong gua pi (winter melon peel) 60 g. Preparation: Boil with water. Administration: Take orally. Indication: edema.",
    "Contraindications": "Must be thoroughly cooked before eating.\nIndividuals with favism or a family history of favism (lack of glucose-6-phosphate dehydrogenase) should avoid fava beans.\nThose with spleen deficiency should not eat too much.",
    "Research": "Clinical/toxic observations related to favism: A small percentage of people (men and children especially) after ingestion of broad beans or inhalation of its pollen may develop acute hemolytic anemia, with hemoglobinuria, shock, fatigue, dizziness, gastrointestinal disorders, and increased urinary excretion of bile pigment. In more severe cases, pallor, jaundice, vomiting, back pain, and weakness may occur. After eating raw beans, symptoms generally occur 5 to 24 hours later; sometimes stir-fried beans can also cause symptoms. Inhalation of pollen can trigger faster onset.\n\nProposed cause of favism: A congenital biochemical defect in some individuals—erythrocytes lack glucose-6-phosphate dehydrogenase—results in very low reduced glutathione. Upon invasion by fava bean cicine, blood cell lysis can occur.\n\nAnimal feeding experiment: Mixing cicine from fava bean into food (1%) and feeding to chicks or rats inhibited their natural growth (animal experiment). Some believe other factors in fava beans, in addition to cicine, can also cause similar hemolysis.\n\nConstituents noted in the root and their biological activities: The root contains serotonin–uracil (5-hydroxyuracil), a metabolic antagonist, and 2,6-diaminopurine, which can inhibit lactic acid bacteria; this inhibition can be reversed by adenosine. These substances can cause bone marrow depletion and injure colon and jejunum epithelium of dogs and rats; they are described as carcinogens (animal observations). The role of DAP (2,6-diaminopurine) is not through pentose nucleic acids; it interferes with the basic metabolic functions of adenosine and guanidine.",
    "Notes": "",
    "Chemical Ingredients": {
      "Seeds": [
        "lecithin",
        "phosphatidyl ethanolamine",
        "phosphatidyl inositol",
        "galactosyl diglyceride",
        "phosphatide",
        "choline",
        "pipecolic acid",
        "putrescine",
        "spermidine",
        "spermine",
        "norspermine",
        "ascorbic acid",
        "cicine",
        "convicine"
      ],
      "Roots": [
        "fumaric acid",
        "betulin",
        "D-glyceric acid",
        "poly-β-hydroxybutyric acid",
        "serotonin–uracil (5-hydroxyuracil)",
        "2,6-diaminopurine (DAP)"
      ]
    },
    "References": [
      "[1] 《Zhong Hua Ben Cao 中華本草 》",
      "[2] Commonly Used Herb Medicine Edition 《民間常用草藥匯編》"
    ],
    "Further Reading": [],
    "Original Text": "\n\n\n, Complementary and Alternative Healing University\n\n\n\n\n\n\n\n\nComplementary and Alternative Healing University \n    Home\n\n\n現代中藥辭典\n\n\n\n\n\n\n\n\n\n\n\n\n\n\n\n\nSearch this \n            site\n\nSearch this site\n\n\n\n\n\n\nList of Health Problems\n\n\n\n\n\n\nChinese Herb Dictionary\n\n\n\n\n\n\nQigong\n\n\n\n\n\n\nTraditional Chinese Medicine \n        TCM\n\n\n\n\n\n\nAcupuncture\n\n\n\n\n\n\nPrescribed Drug Dictionary\n\n\n\n\n\n\nBiochemistry Dictionary\n\n\n\n\n\n\nLecture \n        Slides\n\n\n\n\n\n\nResearch Librarian\n\n\n\n\n\n\nGeneral Online Library\n\n\n\n\n\n\nSearch this site\n\n\n\n\n\n\nResearch \n        Sites\n\n\n\n\n\n\nViagra\n\n\n\n\n\n\nMassage/Acupressure\n\n\n\n\n\n\nHypnotherapy\n\n\n\n\n\n\nTell us what \n        you want\n\n\n\n\n\n\nNotify \n        Changes & New Information\n\n\n\n\n\n　\n\n　\n \nTo post your discussion \n        click here.\n\n　\n \n \n \n \n\n　\n \n \n \n \n \n \n\n　\n\n　\n \n \n \n \n\n　\n\n　\n\n　\n\n　\n\n　\n \n \n \n \n \n \n \n \n \n \n \n \n \n \n \n \n \n \n \n \n \n \n \n \n \n \n \n \n \n \n \n \n \n \n \n \n \n \n \n \n \n \n \n \n \n \n \n \n \n \n \n \n \n \n \n \n \n \n \n \n \n \n \n \n \n \n \n \n \n \n \n \n \n \n \n \n \n \n \n \n \n \n \n\nLast update: \n        Aug 21 , 2013;  11:25 p.m. \n        LAH\n \n\n\n\n\n\ncan dou 蠶豆  \n ( \n    in English and Chinese 中英文)\n\n\nby: Joe Hing kwok Chu \n    \n \n    \n朱興國編\n    譯    \n\n\n\nPharmaceutical name:\n英文藥名﹕\n\nSemen Viciae fabae\n\n\n\nBotanical name:\n拉丁生物學名﹕\n\nVicia faba L.\n\n\n\nPron. in Japanese:\n日語發音﹕\n\nyamatomame, toumame, natsumame, \n        utsukimame, satsukimame, amame, yukiwarimame, fuyumame\n\n\n\nPron. in Korean:\n韓語發音﹕\n\njamdu\n\n\n\n\n\n        Pron. in Cantonese::\n粵音﹕\n\ncaam4 dau6\n\n\n\nOther Names:\n別名﹕\n\n\n        Other Names:\n\nfo dou (Buddha bean)\n佛豆\n\n\nhu dou (foreigner bean)\n胡豆\n\n\nnan dou (southern bean)\n南豆\n\n\nma chi dou (horse tooth bean)\n馬齒豆\n\n\nshu dou (pointing up bean)\n豎豆\n\n\nxian dou (angel bean)\n仙豆\n\n\nhan dou (cold bean)\n寒豆\n\n\nwan dou\n灣豆\n\n\nlou fan dou\n羅泛豆\n\n\nxia dou (summer bean)\n夏豆\n\n\nda dou (from a dialect of Yan Qing)\n大豆（延慶方言）\n\n\nlan hua dou (orchid bean)\n蘭花豆\n\n\n\n\n\n\nCommon Name:\n英文名﹕\n\nbroad bean, horse bean, fava bean.\n\n\n\nDistribution:\n產地﹕\n\n \n\n\n\nProperties\ncharacteristics﹕\n性味﹕\n\nsweet, acrid, neutral.甘，辛，平。\n\n\n\nChannels meridians entered:\n \n歸經﹕\n\n\n        heart, spleen, stomach.心，脾，胃。\n\n\nMedical functions:\n藥理﹕\n \n\n\nMedical function: \nThere are some people (men and kids, especially) after ingestion of \n        broad beans or inhalation of its pollen , may result in acute hemolytic \n        anemia, with symptoms of hemoglobinuria, shock, fatigue, dizziness, \n        gastrointestinal disorders and increased urinary excretion of bile \n        pigment. In more severe cases, pallor, jaundice, vomiting, back pain, \n        weakness may happen. After eating raw beans, generally 5 to 24 hours, \n        symptoms may occur; but sometimes eating the beans that have been stir \n        fried may also occur. Inhalation of its pollen, the attack can occur \n        faster. \nCauses of of the sickness (favism):\n\nA small percentage of the population have a congenital biochemical \n          defect, that is, its blood cells lack of glucose 6 - phosphate \n          dehydrogenase, and thus its reduced form of glutathione content is \n          very low, in the fava bean cicine invasion, may cause blood cell lysis.\nMixing cicine of the fava bean in food (1%) feeding to chicks or \n          rats can inhibit their natural growth. Some people also believe that, \n          in addition fava bean cicine,  there are other factors can also \n          cause a similar hemolysis. \nThe root contains serotonin - uracil, as a metabolic antagonist, \n          and contains 2,6 - diamine purine, can inhibit lactic acid bacteria. \n          Such inhibition can be reversed by adenosine. These substances can \n          make the bone marrow depletion, and hurt the dog and rat colon, \n          jejunum epithelium. It is a  kind of carcinogens. \nDAP's role is not through the pentose nucleic acids. It is the \n          interference of adenosine, guanidine basic metabolic functions.\n\n【藥理作用】極少數人(男小孩較多)在食入蠶豆或吸入其花粉後，可發生急性溶血性貧血，症狀有血色素尿、休克、乏力、眩暈，胃腸紊亂及尿膽素的排泄增加；更重者有蒼白、黃疸、嘔吐、腰痛、衰弱。一般吃生蠶豆後5～24小時後即發生，但有時食炒熱的也可發生。如系吸入其花粉，則發作更快。\n發生蠶豆黃病的原因，是少數人有一種先天性的生化缺陷，即其血細胞中缺乏葡萄糖-6-磷酸脫氫酶，因而其還原型的谷胱甘肽含量也很低，在巢菜鹼甙侵入後，可發生血細胞溶解。將巢菜鹼甙混於食物中(1%)飼喂大鼠或小雞可抑制其自然生長。有人還認為，除巢菜鹼甙外，蠶豆中還有其他因子也能引起類似的溶血作用。根含5羥-尿嘧啶，為一種代謝拮抗劑，並含有2，6-二胺嘌呤，可抑制乳酸杆菌，此種抑制可被腺甙所翻轉；上述物質可使骨髓耗竭，並傷害犬及大鼠結腸、空腸的上皮細胞，是-種致癌物質。DAP之作用並非通過戊糖核酸，而是由於干擾了腺甙、胍的基本代謝功能所致。\n        　　\n\n\n\nActions & Indications:\n主治﹕\n\n\nfatigue \n        and short of breath, loose stool and diarrhea, edema from heart or \n        kidney disease, difficulty in urination.\nPods, \n        flowers and leaves are being used in arresting bleeding.\nFlowers \n        are also being used in lowering blood pressure.\n\n        倦怠少氣，腹瀉便溏，心臟病水腫，腎臟病水腫，小便不通。\n\n        蠶豆莢，花，葉用於止血用。\n花用於降血壓。\n\n\n\nChemical ingredients:[1]\n化學成份﹕[1]\n\nChemical ingredients:\n\nThe seeds contain:\n\n            種子含：\n\n\nlecithin\n\n    卵磷脂\n\n\nphosphatidyl ethanolamine\n\n    磷脂酰乙醇胺\n\n\nphosphatidyl inositol\n\n    磷脂酰肌醇\n\n\ngalactosyl diglyceride\n\n    半乳糖基甘油二酯\n\n\nAlso contain:\n\n    尚含:\n\n\nphosphatide\n\n    磷脂\n\n\ncholine\n\n    膽鹼\n\n\npipecolic acid\n\n    哌啶-2-酸\n\n\nputrescine\n\n    腐胺\n\n\nspermidine\n\n    精味\n\n\nspermine\n\n    精胺\n\n\nnorspermine\n\n    去甲精胺\n\n\nascorbic acid\n\n    抗壞血酸\n\n\ncicine\n\n    巢菜鹼甙\n\n\nconvicine\n\n            伴巢菜鹼甙\n\n\nRoots contain:\n\n            根含：\n\n\nfumaric acid\n\n            延胡索酸\n\n\nbetulin\n\n            白樺脂醇\n\n\nD-glyceric acid\n\n            D-甘油酸 \n\n\npoly-β-hydroxybutyric acid\n\n            聚β-羥基丁酸 \n\n\n\n\n\n\nDaly Dosage:\n每日用量﹕\n\n15 -30 g\n\n\n\nSamples of formulae:\n處方舉例﹕\n\nFor treatment of edema: can dou 60 g,\n        \ndong gua pi 60 g. Boil with water and take \n        orally.治水腫：蠶豆二兩，冬瓜皮二兩，水煎服。\n\n\n\nModern Research:\n現代研究﹕\n\n \n\n\n\n\nToxicity & Cautions:\n\n毒素與禁忌﹕\n\n\n        Those with family history of favism ( lack of lack of glucose 6 - phosphate dehydrogenase) should not eat \n        fava beans.Those with \nspleen deficient\n        should not eat too much.\n蠶豆一定要煮熟後才能食用。有蠶豆病及有蠶豆病家族發病史的人(缺乏葡萄糖-6-磷酸脫氫酶者），忌食蠶豆。 \n        脾虛者應少食。\n \n\n\n\n\n[1]\n《Zhong \n    Hua Ben Cao 中華本草 》\n[2]  Commonly Used Herb Medicine Edition \n    《民間常用草藥匯編》\n \n\nSponsors' Ads by Google 以下為谷歌所提供贊助者之廣告\n\n\n \n \n\n\n\n\nA manuscript... writing, translating and proofreading  in progress\n\nProblems with website? Please \n\nClick here for comment. \n    Not for inquiry  \n\n           \n\n\n\nClick here for inquiry \n \n \n \n\nCopyright Notice 按此看關於 版權問題\n\n\n\n\n\nList of Health Problems\n\n\n\nChinese Herb Dictionary\n\n\n\n\nToxicity \n        of Some Herbs  \n\nSide Effect \n        of Some Herbs  \n\n\n\nHerbs that can be toxic to kidneys\n\n\n\n\nTraditional Chinese Medicine\n\n\nTCM \n        Diagnosis\n\n\nSamples of \n        Formulae\n\n\n\nTerms of Traditional \n        Chinese Medicine\n\n\nAcupuncture\n\n\n\n\n\n\ncopy right\n \n\n\n版權所有\n\n\n\n\nQigong \n        chi kung\n\n\n\nPrescribed Drug Dictionary\n\n\n\nEmail our web master for  your \n        suggestion ,not for inquiry\n\n\n\n\nBiochemistry Dictionary\n\n\n\n\n\n\nGeneral Online Library\n\n\n\nQigong classes\n\n\nLecture \n        Slides\n\n\n\nResearch \n        Librarian\n\n\n\n\nSearch\n\n\n\n\n\n\nQigong classes \n\n\n\n\n\n\nHome\n\n\n\nWeather Report\n\n\n Disclaimer\n\n\n\n\n\n\n\n\n\n\n\n\n\n\n",
    "original_url": "http://alternativehealing.org/can_dou.htm"
  },
  {
    "Names": {
      "Name": ["xuan shen"],
      "Pharmaceutical": ["Radix Scrophulariae Ningpoensis"],
      "Biological": ["Scrophularia mingpeonsis Hemsl."],
      "Chemical": [],
      "Common": ["ningpo figwort root", "scrophularia"],
      "Other name": ["yuan shen", "hei shen", "hei xuan shen"],
      "Chinese": ["玄参", "元参", "黑参", "黑玄参"],
      "Pronunciation in Korean": ["hyonsam"],
      "Pronunciation in Japanese": ["genjin"],
      "Pronunciation in Cantonese": ["yuen sam"],
      "Pinyin Pronunciation": ["xuan shen"]
    },
    "Type": "Herb",
    "Geography": ["Zhejiang", "Hubei", "Jiangsu", "Jiangxi", "Sichuan"],
    "Properties": ["Salty", "Sweet", "Bitter", "Cold"],
    "Meridians": ["Kidney", "Lung", "Stomach"],
    "Maladies Treated": [
      "Infection with high fever, red tongue, and thirst",
      "Habitual constipation",
      "Cold with sore throat",
      "Renal hypertension"
    ],
    "Medical Function": [
      "Cooling blood (涼血)",
      "Promotes yin (滋陰)",
      "Clears heat and toxin (清熱解毒)",
      "Relieves vexation (除煩)",
      "Soothes the throat (利咽喉)",
      "Effect on heart and blood vessels: lowers blood pressure due to vasodilation, especially in renal hypertension",
      "Antibacterial effect",
      "Lowers blood sugar concentration",
      "Anti-inflammatory effect",
      "Sedative effect",
      "Antipyretic effect"
    ],
    "Dosage": "9 to 30 g.",
    "Samples of Formulae": "(1) For infection with high fever, red tongue, and thirst: Xuan Shen (Ningpo figwort root), Sheng Di Huang (Raw Rehmannia root), Mai Dong (Ophiopogon tuber), Jin Yin Hua (Honeysuckle flower), Lian Qiao (Forsythia fruit), Huang Liang (Coptis rhizome). Boil with water to make tea.\n\n(2) For habitual constipation: Xuan Shen (Ningpo figwort root) 15 g, Dang Gui (Angelica sinensis root) 14 g, Tian Hua Fen (Trichosanthes root) 15 g, Lai Fu Zi (Radish seed) 30 g. Make into powder. Take 6 g each time, 3 times a day. Ten days is one treatment. Result: among 96 patients, using 1 to 3 treatments, 86 were healed; 7 were effective and 3 were not effective.\n\n(3) For cold with sore throat 感冒喉痛.",
    "Contraindications": "Do not use in cases of spleen or stomach dampness without heat (huo), or diarrhea due to pixu (spleen deficiency).\n\nSome sources mentioned that xuan shen is incompatible with Huang Qi (astragalus), Gan Jiang (dried ginger), Da Zao (jujube), Li Lu (Veratrum), Ku Shen (Sophora root) and Shan Zhu Yu (cornus fruit).\n\nLi Lu, Ku Shen and xuan shen may trigger irregular heart rate (arrhythmia) and blood pressure drop; combining these herbs may intensify toxicity.",
    "Research": "",
    "Notes": "",
    "Chemical Ingredients": [
      "harpagoside",
      "harpagide",
      "aucubin",
      "6-methylcatapol",
      "ningpogoside A",
      "ningpogoside B",
      "mingpogenin",
      "scropoliside A",
      "angoroside",
      "trace amount of evaporing oil",
      "glucose",
      "oleic acid",
      "linoleic acid",
      "stearic acid",
      "carotene",
      "saponins"
    ],
    "References": [],
    "Further Reading": [],
    "Original Text": "xuan shenComplementary and Alternative Healing University  Home  現代 中藥辭典Search this siteList of Health ProblemsChinese Herb DictionaryQigongTraditional Chinese Medicine (TCM)AcupuncturePrescribed Drug DictionaryBiochemistry DictionaryLecture SlidesResearch LibrarianGeneral Online LibrarySearchResearch SitesViagraMassage/AcupressureHypnotherapyTell us what you wantNotify Changes & New Information                                                xuan shen 玄参 By: Joe Hing Kwok ChuClick here to see picture of xuan shen herb. 按此看玄参圖。 Pharmaceutical name:英文药名：Radix Scrophulariae NingpoensisBiological name:拉丁學名：Scrophularia mingpeonsis Hemsl.Pron. in Japanese:日語發音：genjinPron. in Korean:韓語發音：hyonsamPron. in Cantonese:粤語發音：yuen samCommon Name:英文名：ningpo figwort root, scrophulariaOther Names:別名：yuan shen, hei shen, hei xuan shen元参，黑参，黑玄参。Distribution:分佈：Zhejiang, Hubei, Jiangsu, Jiangxi, Sichuan浙江，湖北，江蘇，江西，四川。Properties (characteristics):性味﹕salty, sweet, bitter, cold味﹕鹹﹐ 甜﹐苦。性﹕寒Channels (meridians) entered:歸經﹕kidney, lung stomach腎﹐肺﹐胃Actions & Indications:主治﹕cooling blood, promote yin, rid of toxin and heat,and soothing the throat.清 熱 解 毒 ， 滋 陰 除 煩 ， 利 咽 喉 。Medical Function:藥理﹕Medical Function:Effect on heart and blood vessels: lower blood pressure due to vasso-dilation, especially in renal hypertension.Anti bacterial effect:Effect on concentration of blood sugarAnti inflammatory effectSedative effectAnti-pyretic藥理﹕擴 張 血 管抗菌降 低 血 醣抗炎解 熱鎮靜Chemical ingredients:化學成份：harpagoside, harpagide, aucubin, 6-methylcatapol, ningpogoside A, B, mingpogenin scropoliside A, angoroside, trace amount of evaporing oil, glucose,  oleic acid, linoleic acid, stearic acid, carotene and saponins.Dosage per day:每日用量﹕9 to 30 g9 ~ 30 克Samples of formulae:處方舉例：(1). For infection with high fever, red tongue, & thirst: xuan shen, sheng di huang, mai dong, jin yin hua, lian qiao and huang liang. Boil with water to make tea.(2). For habitual constipation: xuan shen 15 g, dang gui 14 g, tian hua fen 15 g, \nlai fu zi 30 g. Make into powder. Take 6 g each time, 3 times a day. 10 days is one treatment.  Result: among 96 patients, using 1 to 3 treatments, 86 were healed; 7 were effective and 3 were not effective.(3). For cold with sore throat 感冒喉痛感染而有高熱，舌紅，口渴：玄参，生地黄， 麥東 ， 金銀 花， 連翹，黄 連。.水 煎服。長期便秘：玄参15 g, 當歸 14 g, 天花粉 15 g, \n萊菔子30 g。共為末。每次服6 g。每天3次。十日為一療程。 療效：96病例。用1～3療程。86痊愈。7例 有效。3例無效。按此看感 冒喉痛處方。Modern Research:现代研究： to be uploadedCautions:禁忌：not to use in cases of spleen or stomach dampness without heat (huo) , or diarrhea due to pixu.Some sources mentioned that xuan shen is incompatible with huang qi, gan jiang, da zao, li lu, ku shen and shan zhu yu.li lu, ku shen and xuan shen may trigger irregular heart rate. The combinations of the herb may intensify the effect.脾虛泄瀉者或寒濕而無火者忌用。藜蘆，苦參及 玄參三者均易引致心律失常，血壓下降等反應，配伍應用可 能增強毒性作 用。 Sponsors' Ads by Google 以下為谷歌所提供贊助者之廣告 A manuscript... writing, translating and proofreading                  in progress Click here for inquiry  Copyright Notice 按此看關於版權問題List of Health ProblemsChinese Herb DictionaryToxicity of Some HerbsSide Effect of Some HerbsHerbs that can be toxic to kidneysTraditional Chinese MedicineTCM DiagnosisSamples of FormulaeAcupuncturecopy right 版權所 有Qigong (chi kung)Prescribed Drug DictionaryEmail our web master for  your suggestion (not for inquiry)Biochemistry DictionaryGeneral Online LibraryQigong classesFake Email WarningResearch LibrarianSearchQigong classesHomeWeather Report    DisclaimerLast update: Feb 8, 2010;  4:36 p .m. LAH  \n",
    "original_url": "http://alternativehealing.org/xuan_shen.htm"
  },
  {
    "Names": {
      "Name": ["shui niu jiao"],
      "Pharmaceutical": ["Cornu Bubali"],
      "Biological": ["Bubalus bubalis"],
      "Chemical": [],
      "Common": ["water buffalo horn"],
      "Other": [],
      "Chinese": ["水牛角"],
      "Pronunciation in Korean": ["mulso gak"],
      "Pronunciation in Japanese": ["sui gyuu kaku"],
      "Pronunciation in Cantonese": ["seoi2 ngau4 gok3"],
      "Pinyin Pronunciation": []
    },
    "Type": "Animal",
    "Geography": ["China: mainly produced in eastern and southern parts"],
    "Properties": ["Salty", "Cold"],
    "Meridians": ["Heart", "Liver", "Spleen", "Stomach"],
    "Maladies Treated": [
      "Treats headache from febrile disease, high fever with unconsciousness, rashes, vomiting blood, nosebleed, pediatric convulsions, throat obstruction, and throat swelling.",
      "Purpura and different types of bleeding where heat is high, resulting in blood being forced to move recklessly (horn; internal use). \n If the subcutaneous purpura or gum bleeding is due to spleen deficiency and the spleen failing to control blood, then water buffalo horn must not be used to stop bleeding.",
      "Skin allergy: grind the horn with water and apply externally to the affected area (horn; external application)."
    ],
    "Medical Function": [
      "Sedative effect.",
      "Anticonvulsant.",
      "Antibiotic.",
      "Anti-inflammatory.",
      "Anti-virus.",
      "Shortens bleeding time.",
      "Lowers the penetrating quality (permeability) of capillaries."
    ],
    "Dosage": "Internal consumption by grinding with water: 6–15 g.\nIn decoction: 30–120 g.\nMay be made into pill or powder form.\nExternal use: grind with water and apply to affected areas.",
    "Samples of Formulae": "Xi Jiao Di Huang Tang (xi jiao [rhinoceros horn] and rehmannia decoction): shui niu jiao (water buffalo horn) can be used instead of xi jiao.",
    "Contraindications": "Adverse reactions reported in a small number of patients include stomach discomfort, abdominal distension (flatulence), diarrhea, nausea, and insomnia.\nNot for use during pregnancy.\nNot to be used when there is no heat. Not suitable in cases of pixu (spleen deficiency) or for bleeding due to spleen failing to govern the blood (e.g., subcutaneous purpura, gum bleeding from spleen deficiency).",
    "Research": "",
    "Notes": "This animal material is used as a substitute for rhino horn (xi jiao), whose trade is illegal.",
    "Chemical Ingredients": [
      "Horn: cholesterol.",
      "Horn: amino acid alanine.",
      "Horn: amino acid arginine.",
      "Horn: amino acid aspartic acid.",
      "Horn: amino acid cystine.",
      "Horn: amino acid leucine.",
      "Horn: amino acid proline.",
      "Horn: amino acid tyrosine.",
      "Horn: amino acid histidine.",
      "Horn: amino acid valine.",
      "Horn: amino acid serine.",
      "Horn: amino acid glycine.",
      "Horn: amino acid lysine.",
      "Horn: amino acid threonine.",
      "Horn: amino acid glutamic acid.",
      "Horn: amino acid methionine.",
      "Horn: amino acid isoleucine.",
      "Horn: amino acid phenylalanine.",
      "Horn: peptides (unspecified)."
    ],
    "References": [],
    "Further Reading": [],
    "Original Text": "x,Complementary and Alternative Healing UniversityComplementary and Alternative Healing University  Home  現代中藥辭典Search this siteSearch this siteList of Health ProblemsChinese Herb DictionaryQigongTraditional Chinese Medicine (TCM)AcupuncturePrescribed Drug DictionaryBiochemistry DictionaryLecture SlidesResearch LibrarianGeneral Online LibrarySearchResearch SitesViagraMassage/AcupressureHypnotherapyTell us what you wantNotify Changes & New Information　　                                                shui niu jiao  水牛角  (in English and Chinese 中英文)Translated by: Joe Hing kwok ChuPharmaceutical name:英文藥名﹕Cornu BubaliZoological name water buffalo:水 牛 學名﹕Bubalus bubalisPron. in Japanese:日語發音﹕sui gyuu kakuPron. in Korean:韓語發音﹕mulso gakPron. in Cantonese::粵音﹕seoi2 ngau4 gok3Other Names:別名﹕mainly produced in eastern and southern parts of China.主產於華東，華南地區。Common Name:英文名﹕water buffalo hornDistribution:產地﹕ Properties(characteristics)﹕性味﹕salty, cold.鹹. 寒。Channels (meridians) entered: 歸經﹕heart, liver, spleen, stomach.心 ，肝，脾，胃Medical functions:藥理﹕ sedative effect, anticonvulsant, antibiotic, anti-inflammatory, anti-virus, shortens bleeding time, lowers the penetrating quality of capillaries.鎮靜，鎮 驚 ，抗菌， 抗炎，抗 病毒，縮 短出血，降 低毛细血管通透性等。Actions & Indications:主治﹕Being used in febrile diseases resulting in  headache, delirium, manic behavior, rash, vomiting of blood, nose bleeding, convulsion of children, painful and swollen throat.For skin allergy: grind with water and apply to affected area.It is suitable where heat is high resulting in purpura and different types of bleeding. It is not suitable for bleeding due topixu (spleen deficient) .治熱病頭痛，發 高 熱 神昏，斑疹，吐血 ﹐ 鼻衄，小兒驚風，喉痺咽腫。用 水 研 磨 ﹐外 敷 治 皮 膚 過 敏 反 應 。水牛角適 用 於 熱 盛 而迫血妄行的皮下血斑等多種 出血。如果是因脾虛，脾不统血的皮下血斑，牙龈 出血者，則 不 可 用水牛角止血。Chemical ingredients:化學成份﹕Cholesterol膽甾醇Amino acids氨基酸:Alanine丙氨酸Arginine精氨酸Aspartic acid天冬氨酸Cystine胱氨酸Leucine亮氨酸Proline脯氨酸Tyrosine酪氨酸Histidine組氨酸Valine纈氨酸Peptide肽類serine絲氨酸glycine甘氨酸lysine賴氨酸arginine精氨酸threonine蘇氨酸glutamic acid谷氨酸methionine蛋氨酸isoleucine異亮氨酸phenylalanine苯丙氨酸Dosage:用量﹕Internal consumption with grinding with water: 6 to 15 g.In decoction: 30 to 120 g, orMake into pill or powder formExternal use: grind with water and apply to affected areas. 内服: 磨汁或研末，6～15 克 ；煎湯 ，30 ~ 120 克 ；或人丸，散。外用: 磨汁塗 患 處 。Samples of formulae:處方舉例﹕xi jiao di huang tang (shui niu jiao can be used instead of xi jiao)犀角地黃湯  (水牛角可以用來代替犀角)Modern Research:現代研究﹕ Toxicity & Cautions:毒素與禁忌﹕A small number of patients, after taking this herb, showed discomfort of the stomach, flatulence, diarrhea, nausea, or insomnia.Not to use during pregnancy. Not to use where there is no heat orin cases of pixu (spleen deficient) .少数病人服用後 出現 胃部不 適 ，腹 部 脹 ，腹瀉 ，惡 心 等。亦有少数病人出现失眠。孕婦慎用。 非實 熱 者不宜用。脾 虛者不宜使用。Note: this herb is being used as substitute for rhino horn, which is illegal for commerce.註： 水牛角現用來代替犀牛角用。現犀牛角被禁止買賣。Sponsors' Ads by Google 以 下為谷歌所提供之廣告  A manuscript... writing, translating and proofreading                          in progressClick here for comment. (Not for inquiry )      Click here for inquiry   Copyright Notice 按此看關於版權問題List of Health ProblemsChinese Herb DictionaryToxicity of Some HerbsSide Effect of Some HerbsHerbs that can be toxic to kidneysTraditional Chinese MedicineTCM DiagnosisSamples of FormulaeTerms of Traditional Chinese MedicineAcupuncturecopy right 版權所 有Qigong (chi kung)Prescribed Drug DictionaryEmail our web master for  your suggestion (not for inquiry)Biochemistry DictionaryGeneral Online LibraryQigong classesFake Email WarningResearch LibrarianSearchQigong classesHomeWeather Report Disclaimer  Last update: Aug 9,  2013, 7:48 p.m. LAH  ",
    "original_url": "http://alternativehealing.org/shui_niu_jiao.htm"
  },
  {
    "Names": {
      "Name": ["ban xia", "半夏"],
      "Pharmaceutical": ["Rhizoma Pinelliae Ternatae"],
      "Biological": ["Pinellia ternata (Thunb.) Breit"],
      "Chinese": [
        "半夏",
        "三不掉",
        "裂刀草",
        "地巴豆",
        "麻芋果",
        "地雷公",
        "地文",
        "生半夏",
        "清半夏",
        "姜半夏",
        "法半夏",
        "半夏麴"
      ],
      "Common": ["pinellia rhizome"],
      "Other name": [
        "san bu tiao (三不掉)",
        "lie dao cao (裂刀草)",
        "di ba dou (地巴豆)",
        "ma yu guo (麻芋果)",
        "di lei gong (地雷公)",
        "di wen (地文)",
        "sheng ban xia (生半夏)",
        "qing ban xia (清半夏)",
        "jiang ban xia (姜半夏)",
        "fa ban xia (法半夏)",
        "ban xia qu (半夏麴)"
      ],
      "Pronunciation in Korean": ["panha"],
      "Pronunciation in Japanese": ["hange"],
      "Pronunciation in Cantonese": ["bun3 haa6"],
      "Pinyin Pronunciation": []
    },
    "Type": "Herb",
    "Geography": ["Sichuan", "Hubei", "Henan", "Guizhou", "Anhui"],
    "Properties": ["Acrid", "Warm", "Toxic (especially raw ban xia)"],
    "Meridians": ["Lung", "Spleen", "Stomach"],
    "Maladies Treated": [
      "Vomiting (stopped with jiang ban xia [ginger-processed pinellia])",
      "Cough (ban xia qu used to transform phlegm and stop cough)",
      "Swelling and nodules: external application using sheng ban xia (raw pinellia) to reduce swelling and disperse nodules",
      "Elevated intraocular pressure",
      "Focal distension (pi)"
    ],
    "Medical Function": [
      "Stops vomiting (止嘔).",
      "Induces vomiting (催吐).",
      "Transforms phlegm (化痰).",
      "Dries dampness (燥濕).",
      "Disperses nodules and eliminates focal distension (散結消痞).",
      "Calming; sedative (鎮靜).",
      "Lowers intraocular pressure (降眼壓).",
      "Sheng ban xia (raw pinellia): for external use to reduce swelling and disperse nodules; very toxic.",
      "Qing ban xia (alum-processed pinellia): used for transforming phlegm.",
      "Jiang ban xia (ginger- and alum-processed pinellia): effective in stopping vomiting.",
      "Fa ban xia (processed with gan cao and lime water): effective in drying dampness.",
      "Ban xia qu (fermented pinellia mass made from ground fa ban xia with wheat flour): effective in transforming phlegm and in helping digestion; stops cough; taste bitter, neutral; enters Lung, Spleen, and Large Intestine channels.",
      "Anti-vomiting effect.",
      "Anti-nephritis effect.",
      "Expectorant effect.",
      "Anti-convulsion effect.",
      "Toxic effect: see coniine."
    ],
    "Dosage": "4.5 to 12 g.\nConcentrated extract: 0.5 to 2 g per day.\nAdjust the dosage according to syndrome and body condition.",
    "Samples of Formulae": "ban xia bai zhu tian ma tang (半夏白朮天麻湯)\nban xia xie xin tang (半夏瀉心湯)\ner chen tang (二陳湯)\nchai hu gui zhi tang (柴胡桂枝湯)\nliu jun zi tang (六君子湯)",
    "Contraindications": "Do not use in any cough with bleeding due to yinxu or in those with liver diseases [1].\nUse caution in cases of heat.\nNot compatible with wu tou (aconite).\nRaw ban xia (sheng ban xia) is very toxic. See coniine.\nToxic for the liver.\nAntidote for poisoning: use sheng jiang (raw ginger) juice, or decoct sheng jiang (raw ginger), lu dou (mung bean), fang feng (siler), and gan cao (licorice) and drink frequently to detoxify.",
    "Research": "",
    "Notes": "Sheng ban xia processing procedure: soak in clean water until the center shows no white core when cut; remove and drain; slice to about 3 mm thickness; sun-dry or dry over low heat. Raw ban xia is strong and toxic; generally used externally for reducing swelling and dispersing nodules.\n\nBan xia qu: made by grinding fa ban xia, adding wheat flour, forming into cookie shapes, and fermenting. Its properties are bitter and neutral; it enters the Lung, Spleen, and Large Intestine channels.",
    "Chemical Ingredients": [
      "β-sitosterol (β-谷甾醇)",
      "Choline (胆碱)",
      "Daucosterol (胡蘿蔔甾醇)",
      "3,4-Dihydroxybenzaldehyde (3,4二羥基苯甲醛)",
      "Coniine (毒芹鹼)",
      "Protoanemonin (原白頭翁素)",
      "1-Ephedrine hydrochloride (1-麻黃鹼鹽酸鹽)",
      "Guanosine (鳥苷)",
      "Homogentisic acid (龍膽酸)"
    ],
    "References": [
      "[1] Chinese Journal of Basic Medicine of Traditional Chinese Medicine; 2005, Vol 11, No. 12; 中國中醫基礎醫藥雜誌; 2005 年，第11卷，第12期。"
    ],
    "Further Reading": [],
    "Original Text": "ban xia, Complementary and Alternative Healing University  現代中藥辭典\n\n\n\n\nComplementary and Alternative Healing \n    University \n \n\n\n\n\n\n中藥詞典    Chinese Herb Dictionary    \n     \n\n\nSearch this \n    site    \n    在本網站找資料\n\n\n\n\n\n \nban xia 半夏  by: Joe Hing kwok Chu See picture of herb here.  按此看圖。\nPharmaceutical name:英文药名：\nRhizoma Pinelliae TernataeBiological name:拉丁學名：\nPinellia ternata (Thunb.) BreitPron. in Japanese:日語發音：\nhangePron. in Korean:韓語發音：\npanhaPron. in Cantonese:粤語發音：\nbun3  haa6Common Name:英文名：\npinellia rhizomeOther Name:別 名:\nsan bu tiao, lie dao cao, di ba dou, ma yu guo, di lei gong, di wen三不掉，裂刀草， 地巴豆， 麻芋果，地雷公，地文 Distribution:分佈：\nSichuan, Hubei, Henan, Guizhou, Anhui四川，湖北，河南，贵州，安徽。Properties (characteristics)：性味：\nacrid, warm, toxic (especially raw ban xia)辛，温，有毒 （尤其是生半夏）。Channels (meridians) entered:歸經：\nlung, spleen, stomach肺，脾，胃。Actions & Indications:主治：\n\nstops vomiting, promote vomiting, rids of phlegm \n         nodules, \n\n        calming, lower pressure in the eyes.\n \nSheng ban xia: \n        raw, not processed. It is washed, rid of external \n\n\n        skin, and fine roots then dry under the sun. It is toxic. Usually it is \n\n\n        for external use.\n \nQing ban xia: those have \n        been soaked in alum water solution. Often it is used in transforming \n        phlegmJiang ban xia: those have been soak in ginger (jiang) \n        and alum solution. It is effective in stopping vomiting.\nFa ban xia: those have been soak in gan cao \n        and lime water solution. It is effective in getting rid of dampness.\nBan xia qu: made from ground fa ban xia \n        with added wheat flour and make into the shape of cookie and fermented. \n        It is effective in transforming phlegm and in helping digestion. Its \n        properties are bitter in taste, neutral in characteristics. It enters \n        lung, spleen and large intestine channels.\n燥濕 祛痰，止 嘔，散結消痞，催吐，鎮靜，降眼壓。\n \n\n生半夏﹕加 清水浸泡，至切開中心無白心時﹐取 出，瀝乾水份。切片约３ｍｍ厚。晒乾或用文火烘乾。生 半夏 力強 而有 毒﹐外 用於消 腫散結。因有毒一 般不內服 。\n\n清半夏：經白礬水浸漬者。常用於 化痰。\n\n姜半夏：用生薑，白礬水浸漬者。常用於止 嘔。\n\n法半夏：經甘草，石灰液浸漬者。常用於燥 濕。\n\n半夏麴：法半夏研細加麵粉，製成餅狀並發酵者。常用於化痰止咳，消食 。味苦，性平，歸肺，脾，大腸經。\n\n\nMedical Function:藥理:\nanti vomiting effectanti nephritis effectexpectorant effectanti convulsion effecttoxic effect: see coniine鎮吐作用抗腎炎作用化痰作用抗驚厥作用毒性作用：看毒芹鹼Chemical Ingredients:化學成份:\n β-sitosterolβ-谷甾醇choline胆碱daucosterol胡蘿蔔甾醇3,4-dihydroxybenzaldehyde3,4二羥基苯甲醛coniine  毒芹鹼protoanemonin原白頭翁素1-ephedrine hydrochloride1-麻黃鹼鹽酸鹽guanosine鳥苷homogentisic acid龍膽酸Dosage:用量：\n \n      4.5 to 12 g. Concentrated extract: 0.5 to 2 gper day. Adjust the dosage according to syndrome andbody condition.4.5 to 12 克。濃 縮中藥：0.5～2.0克 。可依病症與體質酌 量增減使用量。 Commonly Used formulae:常用配方:\nban xia bai zhu tian ma tang 半夏白朮天麻湯ban xia xie xin tang 半夏瀉心湯er chen tang 二陳湯chai hu gui zhi tang 柴胡桂枝湯liu jun zi tang 六君子湯Modern Research:\n Cautions:注意：\ndo not use in any cough with bleeding due to yinxu or those with liver   diseases [1]. Use caution in cases of heat. Not compatible with wu tou..Raw ban xia (sheng ban xia) is very toxic. See coniine.\nBan xie is toxic for the \n        liver.Antidote: use sheng jiang (raw ginger) juice, or just sheng jiang, lu dou,  fang feng, gan cao to make into decoction. Drink frequently to rid of the toxin. 陰虛咳血不可用。有肝病者忌用【1】。有熱者小心應用。反烏\n        頭。生半夏有大毒。看毒芹鹼。\n本品對肝臟有毒。中毒可用生薑汁或生\n        薑，綠\n        豆，防風，甘\n        草煎湯頻服以解毒。 [1] Chinese Journal of Basic Medicine of Traditional Chinese Medicine; 2005, Vol 11, No. 12[1]中國中醫基礎醫藥雜誌; 2005 年，第11卷，第12期。\n \n\n\nSearch this \n    site \n\n\nProblems with website? Please \n\nClick \n    here for comment. (Not for inquiry )    \n    \n\n\nClick \n    here for inquiry \n\n\n\nCopyright Notice \n\n按此看關於版權問題\n\n\n\n\nSponsors' Ads by Google \n    以下為谷歌 所提供之廣告\n\n\n\nA manuscript... writing, translating and proofreading  in progress\n\n\n\n\n\n\n\n\nList \n        of Health Problems\n\n\n\n\nQigong \n        (chi kung)\n\n\n\n\nToxicity of Some Herbs\n\n\n\nSide Effect of Some Herbs\n\n\n\nHerbs that can be toxic to kidneys\n\n\n\n\n        Traditional Chinese Medicine\n \n\n\nTCM Diagnosis\n \n\n\n\n        Samples of Formulae\n\n\n\n\n        Terms of Traditional Chinese Medicine\n\n\n\n        Acupuncture\n\n\n\n\n\ncopy right\n \n\n\n版權所有\n\n\n\n\nQigong classes\n\n\n\n\n        Prescribed Drug Dictionary\n\n\n\n\n        Email our web master for  your suggestion (not for inquiry)\n\n\n\nBiochemistry Dictionary\n\n\n\n \n\n\n\nQigong \n        classes\n\n \n\n\n\nResearch Librarian\n\n \n\n\n\n \n\n\n\nHome\n\n\n\n\n        Weather Report\n\n\n\n\n        Disclaimer\n\n\nLast update: Dec \n        13, 2014; 5 a.m. \n        LAH\n\n\n\n\n\n \n\n\n\n\n\n\n\n\n",
    "original_url": "http://alternativehealing.org/ban_xia.htm"
  }
]
