[
  {
    "Names": {
      "Name": ["qin jiao"],
      "Pharmaceutical": ["Radix Gentianae macrophylliae"],
      "Botanical": [
        "Gentiana macrophyllia Pall.",
        "Gentiana straminea Maxim.",
        "Gentiana crassicaulis Duthie et Burk.",
        "Gentiana dahurica Fisch"
      ],
      "Chinese": ["秦艽"],
      "Common": ["gentiana macrophylla root"],
      "Other name": [
        "xi qin jiao 西秦艽",
        "zuo qin jiao 左秦艽",
        "qin jiao 秦膠",
        "qin jiu 秦糾",
        "zuo niu 左扭"
      ],
      "Pronunciation in Korean": ["chin'gyo"],
      "Pronunciation in Japanese": ["jingyo"],
      "Pronunciation in Cantonese": ["ceon4 gau2"],
      "Pinyin Pronunciation": []
    },
    "Type": "Herb",
    "Geography": [
      "Gansu",
      "Shanxi",
      "Shaanxi",
      "Inner Mongolia",
      "throughout northeastern China"
    ],
    "Properties": ["acrid", "bitter", "neutral"],
    "Meridians": ["stomach", "liver", "gall bladder"],
    "Maladies Treated": [
      "rheumatoid arthritis; 風濕痺痛",
      "hepatitis",
      "jaundice; 濕熱黃疸",
      "spastic muscles",
      "achy joints",
      "TB with hot flashes; 骨蒸潮熱 (結核病潮熱)",
      "parasite infection in children with fever; 小兒寄生蟲兼發熱"
    ],
    "Medical Function": [
      "anti-inflammatory",
      "effect on CNS",
      "effect on circulation",
      "effect on blood sugar",
      "anti-allergenic shock and anti-histamine",
      "effect on smooth muscles",
      "toxic effect"
    ],
    "Dosage": "4.5–12 g",
    "Samples of Formulae": "TB with hot flashes (骨蒸潮熱): Composition: Qin Jiao (gentiana macrophylla root), Bie Jia (soft-shelled turtle shell), Zhi Mu (anemarrhena rhizome), Di Gu Pi (lycium bark).",
    "Contraindications": "Reports of nausea and vomiting occurred during the period of taking 100 mg of gentianine 3 times daily for 4–13 days.\n1 patient had palpitation and slow heart rate after taking 100 mg of gentianine; recovered after discontinuation.",
    "Research": "",
    "Notes": "",
    "Chemical Ingredients": {
      "Whole herb": [
        "Alkaloids: gentianine A, B, C",
        "gentianidine",
        "gentianol",
        "Gentiopicrin 0.1–1.5% (source of bitterness)",
        "Evaporating oil (volatile oil)",
        "Sugar",
        "Amarogentin",
        "Qin jiao C (秦艽丙素)",
        "苦龍膽酯甙"
      ]
    },
    "References": [],
    "Further Reading": [],
    "Original Text": "qin jiao, Complementary and Alternative Healing UniversityComplementary and Alternative Healing University  Home  現代中藥辭典Search this siteList of Health ProblemsChinese Herb DictionaryQigongTraditional Chinese Medicine (TCM)AcupuncturePrescribed Drug DictionaryBiochemistry DictionaryLecture SlidesResearch LibrarianGeneral Online LibrarySearchResearch SitesViagraMassage/AcupressureHypnotherapyTell us what you wantNotify Changes & New Information　　　    　      　　    　　　　　             qin jiao 秦艽 \n                 \n  (in English and Chinese 中英文) Edited by: Joe Hing kwok ChuPharmaceutical name:英文藥名﹕Radix Gentianae macrophylliaeBotanical name:學名﹕Gentiana macrophyllia Pall.Gentiana straminea Maxim.Gentiana crassicaulis Duthie et Burk.Gentiana dahurica FischPron. in Japanese:日語發音﹕jingyoPron. in Korean:韓語發音﹕chin'gyoPron. in Cantonese:粵音﹕ceon4 gau2Other Names:別名﹕xi qin jiao 西秦艽﹐zuo qin jiao 左秦艽, qin jiao 秦膠,  qin jiu 秦糾、zuo qin jiao 左秦艽, zuo niu 左扭.Common Name:英文名﹕gentiana macrophylla rootDistribution:產地﹕Gansu, Shanxi, Shaanxi, Innerg Mongolia, throughtout northeastern China甘肅﹐山西﹐陝西﹐內蒙﹐東北各地。Properties(characteristics)﹕性味﹕acrid, bitter, neutral辛﹐苦﹐平。Channels (meridians) entered: 歸經﹕stomach, liver, gall bladder胃﹐肝﹐膽。Medical functions:藥理﹕ anti-inflammatoryeffect on CNSeffect on circulationeffect on blood sugaranti-allergenic shock and anti-histamineeffect on smooth musclestoxic effectMore explanation will be uploaded 抗發炎 對神經系统作用 對循環系统作用 對血糖作用 抗過敏性休克，抗組胺 對平滑肌作用 有毒作用  Actions & Indications:主治﹕rheumatoid arthritis, hepatitis, jaundice, spastic muscles, achy joints, TB with hot flashes, parasite infection in children with fever.用於風濕痺痛, 濕熱黃疸, 骨蒸潮熱 (結核病潮熱)﹐ 小兒寄生蟲兼發熱。Chemical ingredients:化學成份﹕The alkaloids: gentianine A，B,C﹐gentianidine﹐gentianolIts source of bitterness: （gentiopicrin） 0.1 ~1.5%,Evaporating oil,Sugar, Amarogentin 生物鹼﹔龍膽碱A、B、C, 龍膽次碱. 秦艽丙素苦味來源﹕龍膽苦甙 0.1  1.5%揮發油糖類苦龍膽酯甙Dosage:用量﹕4.5 to 12 g.4.5~12 克。Samples of formulae:處方舉例﹕ TB with hot flashes: qin jiao, bie jia, zhi mu, di gu pi.骨蒸潮熱﹕秦艽﹐鱉甲﹐知母﹐地骨皮等配伍。Modern Research:現代研究﹕ Toxicity & Cautions:毒素與禁忌﹕There are reports of nausea, vomiting during the period of  taking 100 mg of gentianine 3 times daily, 4 ~ 13 days. There was 1 patient had palpitation and slow heart rate after taking 100 mg of gentianine but recovered after discontinued taking it.有報導說：用龍膽碱100 mg 每日3次，4～13日。有一病人用100mg後發生心律不整，心律缓慢但停药後即復原。　 Sponsors' Ads by Google 以下為谷歌所提供贊助者之廣告A manuscript... writing, translating and proofreading  in progress Click here for inquiry  List of Health ProblemsChinese Herb DictionaryToxicity of Some Herbs  Side Effect of Some Herbs  Herbs that can be toxic to kidneysTraditional Chinese MedicineTCM DiagnosisSamples of FormulaeAcupuncturecopy right 版權所有Qigong (chi kung)Prescribed Drug DictionaryEmail our web master for  your suggestion (not for inquiry)Biochemistry DictionaryGeneral Online LibraryQigong classesFake Email WarningResearch LibrarianSearchQigong classes HomeWeather Report    DisclaimerLast update: \n    Aug 7, 2009; 2 p.m. LAHSearch this site         \n",
    "original_url": "http://alternativehealing.org/qin_jiao.htm"
  },
  {
    "Names": {
      "Name": ["tian nan xing"],
      "Pharmaceutical": ["Rhizoma Arisaematis"],
      "Botanical": ["Arisaema heterophyllum Blume"],
      "Chinese": ["天南星", "南星", "大野芋頭", "獨角蓮", "虎掌", "膽南星"],
      "Common": ["Jack In The Pulpit", "Jack-In-The-Pulpit"],
      "Other": ["da ye yu tou", "du jiao lian", "hu zhang", "nan xing"],
      "Pronunciation in Korean": ["chonnamsong"],
      "Pronunciation in Japanese": ["tennan sho"],
      "Pronunciation in Cantonese": ["tin1 naam4 sing1"],
      "Pinyin Pronunciation": [""]
    },
    "Type": "Herb",
    "Geography": [
      "China: produced in most provinces; except northwest area and Xizang (Tibet)."
    ],
    "Properties": ["Warm", "Bitter", "Acrid"],
    "Meridians": [],
    "Maladies Treated": [
      "stroke with abundance of phlegm",
      "deviation of mouth and eyes (口眼喎斜)",
      "hemiplegia (半身不遂)",
      "paralysis",
      "epilepsy",
      "tetanus (破風傷)",
      "tumors",
      "carbuncles and swellings (癰腫)",
      "arrhythmia",
      "insect bites (external application: grind with vinegar or water and apply to affected area)",
      "snake bites (external application: grind with vinegar or water and apply to affected area)",
      "dan nan xing: cough with heat and yellow phlegm",
      "dan nan xing: stroke with phlegm",
      "dan nan xing: epilepsy"
    ],
    "Medical Function": [
      "anti convulsion",
      "expectorant",
      "sedation",
      "analgesia",
      "anti-cancer",
      "dan nan xing: clears heat and transforms phlegm",
      "dan nan xing: extinguishes wind and calms fright"
    ],
    "Dosage": "Internal: 3–10 g in decoction; mainly using the prepared herb.\nExternal: appropriate amount.",
    "Samples of Formulae": "For acute lymphoma (失荣症; 急性淋巴癌): He Rong San Jian Wan (和榮散堅丸).",
    "Contraindications": "The whole plant is toxic; the herb must be prepared before use.",
    "Research": "",
    "Notes": "Dan nan xing (arisaema cum bile) is made by mixing prepared tian nan xing fine powder with bile of cow, sheep, goat, or pig; or by mixing raw tian nan xing fine powder with those bile and processing through fermentation. It is described as more effective and safer.\nDan nan xing characteristics: bitter, slightly acrid, cool; enters Liver and Gallbladder channels. /n It is being used in cough with heat and yellow phlegm, stroke with phlegm,  epilepsy. \n Dosage: 3 to 6 g in decoction; or use in pill or powder form. \n Do not use dan nan xing in cold type of cough or in condition of pixu (spleen deficient)",
    "Chemical Ingredients": {},
    "References": [],
    "Further Reading": [],
    "Original Text": "tian nan xing,Complementary and Alternative Healing UniversityComplementary and Alternative Healing University  Home 現代 中藥辭典Search this siteList of Health ProblemsChinese Herb DictionaryQigongTraditional Chinese Medicine (TCM)AcupuncturePrescribed Drug DictionaryBiochemistry DictionaryLecture SlidesResearch LibrarianGeneral Online LibrarySearchResearch SitesViagraMassage/AcupressureHypnotherapyTell us what you wantNotify Changes & New Information　　　    　      　　    　　　　　                tian nan xing 天南星 by: Joe Hing Kwok Chuwith addendum: dan nan xing   按此看膽南星 Pharmaceutical name:英文藥名﹕Rhizoma ArisaematisBotanical name:學名﹕Arisaema heterophyllum BlumePron. in Japanese:日語發音﹕tennan shoPron. in Korean:韓語發音﹕chonnamsongPron. in Cantonese:粵音﹕tin1 naam4 sing1Other Names:別名﹕da ye yu tou 大野芋頭，du jiao lian 獨角蓮，hu zhang 虎掌，nan xing 南星。Common Name:英文名﹕Jack In The Pulpit,  Jack-In-The-Pulpit,Distribution:產地﹕Produced in most provinces of China, except northwest area and Xizang (Tibet).除西北、西藏外，大部分省區都有分佈。Properties(characteristics)﹕性味﹕warm, bitter, acrid.温，苦、辛。Channels (meridians) entered: 歸經﹕Medical functions:藥理﹕ anti convulsion, expectorant, sedation, analgesia, sedation anti-cancer抗惊厥，化痰，鎮靜，止痛，抗癌作用。Actions & Indications:主治﹕being used in stroke with abundance of phlegm, paralysis, epilepsy, tetanus, tumors, arrhythmia.External use:  insect and snake bites (grind with vinegar or water and apply to affected area)治療中風痰壅，口眼喎斜，半 身不遂，癲癇，破風傷，癰腫，心律不整等疾病。外用：蛇蟲. 咬傷 （以醋磨汁塗或研末調敷）。Chemical ingredients:化學成份﹕ Dosage:用 量﹕Taking orally: mainly using the prepared herb, 3 to 10 g in decoction. External Use: appropriate amount.煎服，3～10g，多製用。外用適量。Samples of formulae:處方 舉例﹕For acute lymphoma: he rong san jian wan用于治療失荣症 (急性淋巴癌）： 和榮散堅丸Modern Research:現代研究﹕ Toxicity & Cautions:毒素與禁忌﹕The whole plant is toxic. The herb must be prepared before use. Dan nan xing is prepared by using pig's bile. It is more effective and safer.天南星全株有毒，根、莖等部份都含有毒的生物鹼及苛辣性毒素。Addendum: dan nan xing (arisaema cum bile) is made of mixing prepare nan xing with bile of cow, sheep, goat, or pig. It is also made of mixing sheng nan xing (raw nan xing) with those bile and through fermentation.Characteristics: bitter, cool. Enter: liver and bile channel (meridian).It is being used in cough with heat and yellow phlegm, stroke with phlegm,  epilepsy.Dosage: 3 to 6 g in decoction; or use in pill or powder form.Do not use dan nan xing in cold type of cough or in condition of pixu (spleen deficient) 備註膽南星：.本品為製天南星的細粉與牛、羊或豬膽汁經加工而成，或為生天南星細粉與牛、羊或豬膽汁經發酵加工而成。藥性苦、微辛，涼；歸肝膽經。功能主治：清熱化痰，息風定驚。用於痰熱咳嗽，咯痰黃稠，中風痰迷，癲狂驚癰。 用量：內服：煎湯，3-6g，或入丸、散。 禁忌：寒痰及脾虛者慎服。 Sponsors' Ads by Google 以下為谷歌所提供贊助者之廣告 A manuscript... writing, translating and proofreading  in progressProblems with website? Please email: Click here for comment. (Not for inquiry )   Click here for inquiry  Copyright Notice 按此看關於 版權問題List of Health ProblemsChinese Herb DictionaryToxicity of Some Herbs Side Effect of Some Herbs Herbs that can be toxic to kidneysTraditional Chinese MedicineTCM DiagnosisSamples of FormulaeAcupuncturecopy right 版權所有Qigong (chi kung)Prescribed Drug DictionaryEmail our web master for  your suggestion (not for inquiry)Biochemistry DictionaryGeneral Online LibraryQigong classesLecture SlidesResearch LibrarianSearchQigong classesHomeWeather Report    DisclaimerLast update: Oct 13, 2009;  11:56 p.m. LAHSearch this site         ",
    "original_url": "http://alternativehealing.org/tian_nan_xing.htm"
  },
  {
    "Names": {
      "Name": ["xi he liu"],
      "Pharmaceutical": ["Cacumen Tamaricis"],
      "Botanical": [
        "Tamarix chinensis Lour.",
        "T. juniperina Bge. (華北檉柳)",
        "T. pentandra (Desv.) Pall (五蕊檉柳)"
      ],
      "Chinese": ["西河柳", "山川柳", "三春柳", "西湖柳", "赤檉柳"],
      "Common": [
        "Chinese tamarisk twig",
        "Salt cedar twig",
        "Tamarisk twig",
        "fivestamen tamarisk twig"
      ],
      "Other": ["Shan Chuan Liu", "San Chun Liu", "Xi Hu Liu", "Chi Cheng Liu"],
      "Pronunciation in Korean": ["seohalyu"],
      "Pronunciation in Japanese": ["seikaryu"],
      "Pronunciation in Cantonese": ["sai1 ho4 lau5"],
      "Pinyin Pronunciation": [""]
    },
    "Type": "Herb",
    "Geography": [
      "Hebei (主産於河北)",
      "Henan (河南)",
      "Other parts of China (中國各地均有)"
    ],
    "Properties": ["Sweet", "Bland", "Acrid", "Neutral"],
    "Meridians": ["Heart", "Lung", "Stomach"],
    "Maladies Treated": [
      "Measles not ripening (麻疹不透).",
      "Pain in rheumatoid arthritis; wind-damp Bi pain (風濕痺痛).",
      "Early stage of measles where the rashes do not fully develop; asthma; nasal congestion; runny nose; mild chills; high fever; manic disorder; sore throat; dry lips; thirst; tongue with thin yellow fur and dry; floating and rapid pulse."
    ],
    "Medical Function": [],
    "Dosage": "Take orally: 1.3–9 g for decoction.\n\nFor external use: 60–90 g. Make into decoction and steam and wash affected area while liquid is warm.",
    "Samples of Formulae": "Name of formula: zhu ye liu bang tang 竹葉柳蒡湯 [2]\nIndications: During the early stage of measles, the rashes do not fully develop; asthma; nasal congestion; runny nose; mild chills; high fever; manic disorder; sore throat; dry lips; thirst; tongue with thin yellow fur and dry; floating and rapid pulse.\nComposition: Dan Zhu Ye (淡竹叶) 12 g, Xi He Liu (西河柳) 12 g, Ge Gen (葛根) 10 g, Niu Bang Zi (牛蒡子) 9 g, Zhi Mu (知母) 6 g, Can Yi (蝉蜕) 4 g, Jing Jie (荆芥) 8 g, Bo He (薄荷, cook last) 4 g, Xuan Shen (玄参) 8 g, Raw Gan Cao (生甘草) 3 g, Mai Dong (麦冬) 8 g. \n Modification: If the fever is high, add Raw Shi Gao (生石膏) 10 g and Rice (Oryza sativa, 粳米) 15 g.",
    "Contraindications": "",
    "Research": "",
    "Notes": "",
    "Chemical Ingredients": [
      "Resin",
      "Tannin",
      "Quercetin-monomethylether",
      "Salicin"
    ],
    "References": [
      "[1] Zhong Yao Da Ci Dian 中藥大辭典",
      "[2] 先醒齋醫學廣筆記"
    ],
    "Further Reading": [],
    "Original Text": "xi he liu , Complementary and Alternative Healing UniversityComplementary and Alternative Healing University  Home   中藥詞典                 Chinese Herb Dictionary               Search this siteSearch this siteSearch this siteList of Health ProblemsChinese Herb DictionaryQigongTraditional Chinese Medicine (TCM)AcupuncturePrescribed Drug DictionaryBiochemistry DictionaryLecture SlidesResearch LibrarianGeneral Online LibrarySearch this siteResearch SitesViagraMassage/AcupressureHypnotherapyTell us what you wantNotify Changes & New Information　　 To post your discussion click here.　                     　      　　    　　　　        Last update:Sept 14, 2013; 12:40 a.m. LAH xi he liu 西河柳  (in English and Chinese 中英文)by: Joe Hing kwok Chu    朱興國編 譯    Pharmaceutical name:英文藥名﹕Cacumen TamaricisBotanical name:拉丁生物學名﹕Tamarix chinensis Lour.T. juniperina Bge. (華北檉柳)T. pentandra (Desv.) Pall (五蕊檉柳)Pron. in Japanese:日語發音﹕seikaryuPron. in Korean:韓語發音﹕seohalyuPron. in Cantonese::粵音﹕sai1 ho4 lau5Other Names:英文名﹕Chinese tamarisk twig, Salt cedar twig , Tamarisk twig , fivestamen tamarisk twig.Common Name:別名﹕shan chuan liu 山川柳、san chun liu 三春柳、xi hu liu 西湖柳、chi cheng liu 赤檉柳。Distribution:產地﹕mainly in Hebei, Henan provinces and also produced in other parts of China.主産於河北，河南。中國各地均有。Properties(characteristics)﹕性味﹕sweet, bland, acrid, neutral.甘，淡，辛，平。Channels (meridians) entered: 歸經﹕heart, lung, stomach.心，肺，胃。Medical functions:藥理﹕   Actions & Indications:主治﹕Being used in measles not ripening, pain in rheumatoid arthritis.用於麻疹不透、風濕痺痛。Chemical ingredients:[1]化學成份﹕[1]resin樹脂tannin鞣質quercetin-monomethylether槲皮素-甲醚salicin水楊甙  Daly Dosage:每日用量﹕Take orally: 1.3 - 9 g. for decoction.For external use: 60 - 90 g. Make into decoction and steam and wash affected area while liquid is warm1.3 克~9 克，煎服。外用60克~90 克，煎湯乘熱熏洗；Samples of formulae:處方舉例﹕Name of formula: zhu ye liu bang tang [2]Indications: During the early stage of measles, the rashes do not fully develop, asthma, nasal congestion, runny nose, mild chills, high fever, manic disorder, sore throat, dry lips, thirst, tongue with thin yellow fur and dry, floating and rapid pulseComposition:dan zhu ye 12 g, xi he liu 12 g, ge gen10 g, niu bang zi 9 g, zhi mu 6 g,  can yi 4 g,  jing jie 8 g,  bo he（cook last）4 g, xuan shen 8 g, raw gan cao 3 g, mai dong 8 克.If the fever is high add： raw shi gao 10 g, rice (Oryza sativa) 15 g 竹葉柳蒡湯《先醒齋醫學廣筆記》主治：痧疹初起，透發不出。喘嗽，鼻塞流涕，惡寒輕，發熱重，煩悶躁亂，咽喉腫痛，唇乾口渴，苔薄黃而乾，脈浮數。組成：淡竹葉 12 克，西河柳 12 克，葛根10 克，牛蒡子 9 克，知母 6 克， 蟬衣 4 克， 荊芥 8 克， 薄荷（後下）4 克，玄參 8克， 生甘草3 克，麥冬 8 克。熱甚者 加： 生石膏10 克，粳米 Oryza sativa 15 克。Modern Research:現代研究﹕ Toxicity & Cautions:毒素與禁忌﹕[1] Zhong Yao Da Ci Dian 中藥大辭典[2] 先醒齋醫學廣筆記 Sponsors' Ads by Google 以下為谷歌所提供贊助者之廣告   A manuscript... writing, translating and proofreading  in progressProblems with website? Please Click here for comment. (Not for inquiry )   Click here for inquiry  Copyright Notice 按此看關於 版權問題List of Health ProblemsChinese Herb DictionaryToxicity of Some Herbs Side Effect of Some Herbs Herbs that can be toxic to kidneysTraditional Chinese MedicineTCM DiagnosisSamples of FormulaeTerms of Traditional Chinese MedicineAcupuncturecopy right 版權所有Qigong (chi kung)Prescribed Drug DictionaryEmail our web master for  your suggestion (not for inquiry)Biochemistry DictionaryGeneral Online LibraryQigong classesLecture SlidesResearch LibrarianSearchQigong classesHomeWeather Report Disclaimer  ",
    "original_url": "http://alternativehealing.org/xi_he_liu.htm"
  },
  {
    "Names": {
      "Name": ["jie geng"],
      "Pharmaceutical": ["Radix Platycodi grandiflori"],
      "Biological": ["Platycodon grandiflorum (Jacq.) A. DC."],
      "Chinese": ["桔梗"],
      "Common": ["root of balloon flower"],
      "Other name": [
        "jin geng 津梗",
        "fu lu 符蔰",
        "bai yao 白藥",
        "li ru 利如",
        "geng cao 梗草",
        "lu ru 盧如",
        "fang tu 房圖",
        "qi ni 薺苨",
        "ku geng 苦梗",
        "ku jie geng 苦桔梗",
        "da yao 大藥",
        "bao fu hua 包袱花",
        "si ye cai 四葉菜",
        "sha you cai 沙油菜",
        "shan ling dang hua 山鈴鐺花"
      ],
      "Pronunciation in Korean": ["kilgyong"],
      "Pronunciation in Japanese": ["kikyo"],
      "Pronunciation in Cantonese": ["kit gang"],
      "Pinyin Pronunciation": []
    },
    "Type": "Herb",
    "Geography": [],
    "Properties": ["Bitter", "Acrid", "Neutral"],
    "Meridians": ["Lung"],
    "Maladies Treated": [
      "bronchitis",
      "tonsilitis",
      "sore throat",
      "lung abscess (fei yong)",
      "purulent diseases"
    ],
    "Medical Function": [
      "rids of phlegm",
      "inhibits cough",
      "has effect of loosening phlegm and discharging puss",
      "anti-inflammatory",
      "anti ulcers",
      "lower blood sugar"
    ],
    "Dosage": "3 to 10 g",
    "Samples of Formulae": "Jie Geng Tang (桔梗湯): For fei yong (lung abscess). Symptoms: cough with chest fullness, chills with rapid pulse, throat dry without thirst, occasionally expectorates turbid foul-smelling sputum, over time spits pus like rice congee. Composition: Jie Geng (Platycodon root) 6 g, Gan Cao (Licorice) 12 g. Water decoction taken warm.\nJie Geng Bai San (桔梗白散).",
    "Contraindications": "Not to use in case of yinxu (yin deficient) with chronic cough, breathing difficulty and vomiting blood. 陰虛久咳，氣逆及咳血者忌服。",
    "Research": "",
    "Notes": "",
    "Chemical Ingredients": [
      "Root: contains many saponins.",
      "Hydrolysis separates: platycodigenin (main saponin).",
      "Root: small amount of polygalacic acid.",
      "Root: platycogenic acid A; platycogenic acid B; platycogenic acid C.",
      "From saponins the following are separated: prosapogenin; 3-O-β-glucose; platycodoside C; platycogenin-3-O-β-glucoside (platycodigenin); glucose; xylose.",
      "From total saponins: platycodoside C; hydrolysis produces platycodigenin and glucose, xylose, rhamnose, arabinose (2:1:1:1).",
      "Previously reported platycidin was proven to be a mixture.",
      "Root: α-spinasterol; α-spinasterol-β-D-glucoside; betulin; platycodinin.",
      "Root: contains 14 amino acids; total content 1.22%."
    ],
    "References": [],
    "Further Reading": [],
    "Original Text": "jie geng, Complementary and Alternative Healing University     現代中藥辭典Complementary and Alternative Healing University   中藥詞典                 Chinese Herb Dictionary      Search this site     在本網站找資料Search this siteList of Health ProblemsChinese Herb DictionaryQigongTraditional Chinese Medicine (TCM)AcupuncturePrescribed Drug DictionaryBiochemistry DictionaryLecture SlidesResearch LibrarianGeneral Online LibraryResearch SitesViagraMassage/AcupressureHypnotherapyTell us what you wantNotify Changes & New Information  jie geng  桔 梗   (in English and Chinese 中英文) Translated and edited by: Joe Hing Kwok Chu              朱興國編譯 Click here to see picture of herb. 按此看桔梗飲片 圖。Pharmaceutical name:Radix Platycodi grandifloriBiological name:Platycodon grandiflorum (Jacq.) A. DC.Pron. in Japanese:kikyoPron. in Korean:kilgyongPron. in Cantonese:kit gang Other Names:別名:jin geng 津梗，fu lu 符蔰，bai yao 白藥，li ru 利如，geng cao 梗草，lu ru 盧如，fang tu 房圖，qi ni 薺苨，ku geng 苦梗，ku jie geng 苦桔梗，da yao 大藥，bao fu hua 包袱花，si ye cai 四葉菜，sha you cai 沙油菜，shan ling dang hua  山鈴鐺花。Common Name:root of balloon flowerDistribution: Properties (characteristics):藥 性:bitter, acrid neutral味苦，辛，性 平Channels (meridians) entered:歸經:lung肺Actions & Indications:rids of phlegm, inhibits cough, treats bronchitis, rids of puss, for tonsilitis, and sore throat.可袪痰，鎮咳，治療支氣管炎，排膿，化膿性疾病，扁桃線炎，咽喉痛。有鬆痰排膿之效。Medical Function:藥理:(1) expels phlegm and inhibits cough(2) anti-inflammatory(3) anti ulcers(4) lower blood sugar(l)袪痰鎮 咳；(2)抗炎，(3)抗潰瘍；(4)降血糖。Chemical ingredients:化學成 分　　　　　　　　The root contains many saponins. Ingredients are separated with hydrolysis process: platycodigenin (main saponin), small amount of polygalacic acidplatycogenic acid A, platycogenic acid BC, platycogenic acid C. From saponins the following are separated: prosapogenin, 3-O-β-glucose, platycodoside C, platycogenin-3-O-β-glucoside platycodigenin, glucose, xylose. etc , 根含多种皂貳，水解後分 得 ：桔 梗皂貳元（platycodigenin）,為主要的皂貳元，以及少量的新遠志酸（polygalacic acid） ，桔梗酸A（platycogenic acid A），桔梗酸B（platycogenic acid B），桔梗酸C（platycogenic acid C）。此外，從皂貳 中尚分得 前皂貳元（prosapogenin）,為次級　，是桔梗皂貳元-3-O-β-葡萄糖貳(platycogenin-3-O-β-glucoside)　 。由總皂中分得桔梗皂貳C（platycodoside C）,水解生成桔梗皂貳元（platycodigenin）和葡萄糖，木糖，鼠李糖 ，阿拉伯 糖（2:1:1:1）。以前報道的桔梗皂貳　（platycidin）經証明為一混合貳　。根另含α-菠菜甾醇，α-菠菜甾醇-β-D-葡 萄糖　，樺 皮醇（betulin） ，桔梗聚果糖（platycodinin）。根中尚含14种氨基酸，總含量達1.22%。   Dosage:用量:3 to 10 g3～10克Samples of formulae:常用處 方：jie geng tang,jie geng bai san桔梗湯：治肺癰。症狀：咳而胸滿，振寒脈數，咽乾不喝，時出 濁唾腥臭，久久吐膿如米粥者。組成﹕桔梗 6 克﹐甘 草12 克。 水煎服。桔梗白散。 Modern Research:to be loadedCautions:禁忌:Not to use in case of yinxu (yin deficient)  with chronic cough, breathing difficulty and vomiting blood. 陰 虛久咳， 氣逆及咳血者忌服。      Search this siteProblems with website? Please Click here for comment. (Not for inquiry )    Click here for inquiryCopyright Notice 按此看關於版權問題A manuscript... writing, translating and proofreading  in progressSponsors' Ads by Google 以下為谷歌 所提供之廣告 List of Health ProblemsChinese Herb DictionaryToxicity of Some HerbsSide Effect of Some HerbsHerbs that can be toxic to kidneysTraditional Chinese Medicine TCM Diagnosis Samples of FormulaeTerms of Traditional Chinese MedicineAcupuncturecopy right 版權所有Qigong (chi kung)Prescribed Drug DictionaryEmail our web master for  your suggestion (not for inquiry)Biochemistry DictionaryGeneral Online LibraryQigong classesFake Email WarningResearch LibrarianSearchQigong classesHomeWeather ReportDisclaimerLast update: July 2, 2014; 8 a.m. LAH   ",
    "original_url": "http://alternativehealing.org/jie_geng.htm"
  },
  {
    "Names": {
      "Name": ["Radix Sophorae", "苦參"],
      "Pharmaceutical": [],
      "Biological": [],
      "Chemical": [],
      "Common": [],
      "Other name": [],
      "Chinese": ["苦參"],
      "Pronunciation in Korean": [],
      "Pronunciation in Japanese": [],
      "Pronunciation in Cantonese": [],
      "Pinyin Pronunciation": []
    },
    "Type": "Herb",
    "Geography": [],
    "Properties": [],
    "Meridians": [],
    "Maladies Treated": [
      "acute diarrhea due to infection",
      "inflammation of the intestine due to fungal infection",
      "trichomoniasis infection of the intestine",
      "chronic inflammation of the rectum",
      "giardiasis infection",
      "pinworm infection",
      "eczema",
      "palpitation",
      "asthma",
      "hepatitis B",
      "inflammation of the esophagus",
      "tonsillitis",
      "insomnia",
      "decrease of white cell count",
      "vaginal infection",
      "scalding injuries"
    ],
    "Medical Function": [],
    "Dosage": "",
    "Samples of Formulae": "",
    "Contraindications": "",
    "Research": "",
    "Notes": "",
    "Chemical Ingredients": [],
    "References": [],
    "Further Reading": [],
    "Original Text": "Radix Sophorae, Complementary and Alternative Healing University\n\n\n\n\n\nComplementary and Alternative Healing \n    University \n \n\n\n\n\n\n中藥詞典    Chinese Herb Dictionary    \n     \n\n\nSearch this \n    site    \n    在本網站找資料\n\n\n\n\n\n \n\n    See more menu at the \n    bottom of page \n \nRadix Sophorae 苦參 (in Enlgish and Chinese 中英文)\nBy: Joe Hing Kwok Chu\nPresent Day Applications:\n現代應用﹕\nApplication:\n主治：acute diarrhea due to infection\n急性感染性腹瀉\ninflammation of the intestine due to fungal infection\n霉菌感染的腸炎\ntrichomoniasis infection of the intestine\n腸滴虫病\nchronic inflammation the rectum\n直腸慢性發炎\ngiardiasis infection\n腸梨形鞭毛蟲病感染\npinworm infection\n蟯蟲感染\neczema\n濕疹\npalpitation\n心悸\nasthma\n哮喘\nhepatitis B\n乙型肝炎inflammation of the aesophagus\n食道發炎\ntonsillitis\n扁桃腺炎\ninsomnia\n失眠\ndecrease of white cell count\n白血球减少\nvagina infection\n陰道感染\nscalding injuries\n燙傷Read More.........................  看全 篇... \n\n\n\n\n\nSearch this \n    site \n\nProblems with website? \n    Please \nClick \n    here for comment. (Not for inquiry )    \n    \n\nClick \n    here for inquiry \n\n\n\nCopyright Notice \n\n按此看關於版權問題\n\n\n\n\nSponsors' Ads by Google \n    以下為谷歌 所提供之廣告\n\n\n\nA manuscript... writing, translating and proofreading  in progress\n\nMenu:\n\n\n\n\n\n\n\n\n\nList \n        of Health Problems\n\n\n\n\nQigong \n        (chi kung)\n\n\n\n\nToxicity of Some Herbs\n\n\n\nSide Effect of Some Herbs\n\n\n\nHerbs that can be toxic to kidneys\n\n\n\n\n        Traditional Chinese Medicine\n \n\n\nTCM Diagnosis\n \n\n\n        Samples of Formulae\n\n\n\n\n        Terms of Traditional Chinese Medicine\n\n\n\n        Acupuncture\n\n\n\n\n\nChinese Herb Dictionary\n\n\n\n\n\nQigong classes\n\n\n\n\n        Prescribed Drug Dictionary\n\n\n\n\n        Email our web master for  your suggestion (not for inquiry)\n\n\n\nBiochemistry Dictionary\n\n\n\n \n\n\n\nQigong \n        classes\n\n \n\n\n\nResearch Librarian\n\n \n\n\n\n\n\n\ncopy right\n \n\n\n版權所有\n\n\n\nHome\n\n\n\n\n        Weather Report\n\n\n\n\n        Disclaimer\n\n\nLast update: May \n        21, 1015; 2 p.m. LAH\n\n\n\n\n\n \n\n\n\n\n\n\n\n\n",
    "original_url": "http://alternativehealing.org/ku_shen.htm"
  }
]
