[
    {
        "Names": {
            "Name": [
                "shi jun zi",
                "使君子"
            ],
            "Pharmaceutical": [
                "Fructus Quisqualis"
            ],
            "Biological": [
                "Quisqualis indica L."
            ],
            "Common": [
                "Rangoon creeper Fruit"
            ],
            "Other": [
                "shan yang shi (droppings of goats) 山羊屎",
                "se gan zi 色干子",
                "liu qiu zi 留球子",
                "shi jun zi 史君子",
                "wu leng zi 五稜子",
                "dong jun zi 冬均子",
                "bing gan zi 病柑子"
            ],
            "Chinese": [
                "使君子",
                "山羊屎",
                "色干子",
                "留球子",
                "史君子",
                "五稜子",
                "冬均子",
                "病柑子"
            ],
            "Pronunciation in Korean": [
                "saguncha"
            ],
            "Pronunciation in Japanese": [
                "shikunshi"
            ],
            "Pronunciation in Cantonese": [
                "si2 gwan1 zi2"
            ],
            "Pinyin Pronunciation": []
        },
        "Type": "Herb",
        "Geography": [
            "Sichuan, China",
            "Guangdong, China",
            "Guangxi, China",
            "Yunnan, China"
        ],
        "Properties": [
            "sweet",
            "warm",
            "slightly toxic"
        ],
        "Meridians": [
            "spleen",
            "stomach",
            "large intestine"
        ],
        "Maladies Treated": [
            "round worms: fruit, leaves and root all used, but fruit has stronger effect",
            "middle ear infection: root used for its anti-inflammatory and antibiotic effects",
            "prolapse of rectum: root used",
            "hiccups: root used with anti-inflammatory properties",
            "cough: root used with anti-inflammatory properties"
        ],
        "Medical Function": [
            "Fruit, leaves and root can be used for improving digestion (strengthening spleen and digestion).",
            "Roots possess anti-inflammatory and antibiotic effect and can relieve hiccups and coughing.",
            "shi jun zi water extract can inhibit certain skin fungi."
        ],
        "Dosage": "3 to 9 g; or stir fry to heat up seeds. For children use one seed for every year old. Adult dosage: 10 to 15 seeds. Take on empty stomach. Chew and swallow.",
        "Samples of Formulae": "",
        "Contraindications": "Taking large dosage may induce hiccups, dizziness, lack of energy, nausea, even vomiting, and diarrhea. Do not take with tea; taking with tea may induce hiccups or diarrhea immediately. Symptoms subside once stopped taking herb. If toxic reaction occurs, cloves decoction can be used frequently as an antidote. According to Ben Cao Gang Mu, drinking hot tea with this herb immediately causes diarrhea.",
        "Research": "shi jun zi water extract can inhibit certain skin fungi.",
        "Notes": "",
        "Chemical Ingredients": {
            "Seeds": [
                "Potassium quisqualate (C5H6O5N3K)",
                "Quisqualic acid (C10H6O10)",
                "Trigonelline (C7H7O2N)",
                "Fatty oil content approximately 20～24%",
                "Cane sugar",
                "Fructose",
                "quisqualate 0.5%"
            ],
            "Leaves": [
                "Trigonelline (C7H7O2N)",
                "Proline",
                "Aspartic acid",
                "Potassium quisqualate (C5H6O5N3K)"
            ]
        },
        "References": [],
        "Further Reading": [],
        "Original Text": "\n\n\n\n\nshi jun zi, Complementary and Alternative Healing University\n\n\n\n\n\n\n\n\n\n\n\nComplementary and Alternative Healing\n        University \n\n現代中藥辭典\n\n\n\n\n\n\n\n\n\n\n\n\n\n\n\nSearch this site\n\n\n\n\n\nList of Health Problems\n\n\n\n\n\nChinese Herb Dictionary\n\n\n\n\n\nQigong\n\n\n\n\n\nTraditional Chinese Medicine (TCM)\n\n\n\n\n\nAcupuncture\n\n\n\n\n\nPrescribed Drug \n            Dictionary\n\n\n\n\nBiochemistry \n            Dictionary\n\n\n\n\n\nLecture Slides\n\n\n\n\n            Research Librarian\n\n\n\n\n\nGeneral Online Library\n\n\n\n\n\nSearch\n\n\n\n\n\nResearch Sites\n\n\n\n\n\nViagra\n\n\n\n\n\nMassage/Acupressure\n\n\n\n\n\nHypnotherapy\n\n\n\n\n\nTell us what you want \n\n\n\n\n\nNotify Changes & New Information\n\n\n\n　\n　\n　\n \n \n \n \n \n \n \n \n　\n \n \n \n \n \n \n \n \n \n \n \n \n \n \n \n \n \n \n \n \n \n \n \n \n \n \n \n　\n　\n \n \n \n \n　\n　\n　\n　\n　\n \n \n \n \n \n \n \n \n \n \n \n \n \n \n \n \n \n\n　\n\n\n\n\n\n\n\n\n\n\n\n\n\n         \n\nshi jun zi \n使君子\n\n         \n\n\n         by: Joe Hing kwok Chu\n\n         \n\n\n        See picture of plants\n\n\nA manuscript... writing and translation in progress\n\n\n\n\n\n    Pharmaceutical name:\n    英文藥名﹕\n\nFructus Quisqualis\n\n\n\nBotanical name:\n\n    學名﹕\n\n\n\n        Quisqualis indica \n        L.\n\n\n\nPron. in Japanese:\n日語發音﹕\n\n    shikunshi\n\n\n\nPron. in Korean:\n韓語發音﹕\n\n    saguncha\n\n\n\n\nPron. \n            in Cantonese:\n\n粵音﹕\n\nsi2 gwan1 zi2\n\n\n\n\n        \n        Other Names:\n\n        \n        別名﹕\n\n shan yang shi \n        (droppings of goats) 山羊屎﹐se gan zi 色干子, \n        liu qiu zi \n        留球子﹐shi jun zi 史君子﹐wu \n        leng zi 五稜子﹐dong jun zi 冬均子﹐bing \n        gan zi 病柑子。\n\n\n\nCommon Name:\n英文名﹕\n\n\n        Rangoon creeper Fruit\n\n\n\nDistribution:\n產地﹕\n\n        Mainly produced in Sichuan, Guangdong, Guangxi, Yunnan provinces of \n        China.主產於中國四川﹐廣東﹐廣西﹐雲南等地。 \n\n\n\nProperties\n(characteristics)﹕\n性味﹕\n\n            sweet, warm, slightly toxic.\n甘，溫。有小毒。\n\n\n\nChannels (meridians)\n      entered:\n \n\n    歸經﹕\n\n\n        spleen, stomach, large intestine.\n\n歸脾﹐胃﹐大腸經。\n\n\n\n\n        Medical functions:\n\n        藥理﹕ \n\n             \n\n\n\nActions & Indications:\n\n    主治﹕\n\n        \n        Fruit, leaves and root can be used for getting rid of round worms and \n        for improving digestion.Fruit are better in getting rid of round \n        worms.\nRoots can also be used for arresting cough, hiccups and possess \n        anti-inflammatory, antibiotic effect. It is also used in middle ear \n        infection and prolapse of rectum.\n果實、葉、根: \n        驅蛔，消疳積，健脾助消化。\n驅蛔蟲作用則以果實較強。\n\n        根有解毒消炎作用。可治呃逆﹐咳嗽等。可用於中耳炎、脫肛。\n\n\n\n\n    Chemical ingredients:\n\n    化學成份﹕\n\n\n\nSeeds contain:\n\n\n種子含\n\n\nC5H6O5N3K\n使君子酸鉀(C5H6O5N3K)\n\n\n\nC5H6O5N3K\n\n君子酸鉀(C5H6O5N3K)\n\n\n\nC10H6O10\n\n使君子酸(C10H6O10)\n\n\n\n\n        trigonelline，C7H7O2N\n\n胡蘆巴鹼(trigonelline，C7H7O2N)\n\n\n\n\n        quisqualate 0.5%\n使君子氨酸 0.5%\n\n\nfat \n20～24%\n\n脂肪油約20～24%\n\n\ncane sugar, fruitose\n\n\n蔗糖﹐果糖\n\n\nLeave contain:\n\n\n葉含\n\n\ntrigonelline，C7H7O2N\n\n\n胡蘆巴鹼 \n        \nC7H7O2N\n\n\nproline\n\n\n脯氨酸\n\n\naspartic acid\n\n\n天門冬氨酸\n\n\nC5H6O5N3K\n使君子酸鉀(C5H6O5N3K)\n\n\n \n\n\n\nDosage:\n用量﹕\n\n        3 to 9 g; or stir fry to heat up seeds. For children use one seed for \n        every year old. Adult dosage: 10 to 15 seeds. Take with empty stomach. \n        Chew and swallow. \n\n用量3～9克; 或取仁炒熟，兒童每歲1粒，成人10～15粒，空腹1次嚼服。\n\n\n\nSamples \n    of formulae:處方舉例﹕\n\n         \n\n\n\nModern Research:\n\n    現代研究﹕\n\n    shi jun zi water extract can inhibit certain skin fungi.\n使君子水浸劑對某些皮膚真菌有抑制作用。\n\n\n\n\nToxicity & Cautions:\n\n毒素與禁忌﹕\n\n    Taking large dosage may induce hiccups, dizziness, lack of energy, nausea, \n    even vomiting, and diarrhea. Taking with tea may induce hiccups or diarrhea. \n    Symptoms will subside once stop taking the herb. If it result in toxic \n    reaction, cloves decoction can be used as antidote.According to\n    Ben Cao \n    Gang Mu , using hot tea with this herb can cause diarrhea \n    immediately.\n\n\n    大量服用能引起呃逆﹐眩暈﹐精神不振﹐噁心，甚至嘔吐﹐腹瀉。不可與茶同服，若同服亦能引起呃逆。一般停藥後即可恢復。如出現中毒反應，用丁香泡茶頻服，可以解毒。\n\n《本草綱目》：\"忌飲熱茶犯之即瀉。\"\n\n\n\n        　\n\n\n\n\n\n\nA manuscript... writing, translating and proofreading  in progress\n\n\n\n\n\nClick here for inquiry \n \n\nCopyright Notice 按此看關於版權問題\n\n\n\n\n\n\n              List of Health Problems\n\n\n\n\n              Chinese Herb Dictionary\n\n\n\nToxicity\n            of Some Herbs   \n\n \nSide\n            Effect of Some Herbs   \n\n\nHerbs that can be toxic to \n            kidneys\n\n\n\n\n              Traditional Chinese Medicine \n\n\nTCM Diagnosis\n              \n\n\nSamples of Formulae\n\n\n\n\n              Acupuncture\n\n\n\n\n\ncopy right\n \n\n\n版權所有\n\n\n\nQigong (chi kung)\n\n\n\n\n              Prescribed Drug Dictionary\n\n\nEmail our web master for  \n              your suggestion (not for inquiry)\n\n\n\nBiochemistry Dictionary\n\n\n\n\n\nGeneral Online \n              Library\n\n\n\n              Qigong classes\n\n\n\nLecture Slides\n\n\n\nResearch \n              Librarian\n\n\n\nSearch\n\n\n\n\n\nQigong classes \n\n\n\n\n\n\n\n\n\n\nWeather Report\n\n\n\n\n\n\n                  Disclaimer\n\n\n\n\n\n\n\n\n\n\n\n\n\n\nLast update: April 19, 2006; 4:17 p.m. \nRC\n\n\n\n\n\n\n\n\n\n　\n\n\n\n\n\n\n\n\nSearch this site     \npowered by FreeFind\n\n\n\n\n\n\n\n\n\n\n\n\n\n\n\n\n\n\n\n\n\n\n\n\n\n\n\n",
        "original_url": "http://alternativehealing.org/shi_jun_zi.htm"
    },
    {
        "Names": {
            "Name": [
                "man jing zi"
            ],
            "Pharmaceutical": [
                "Fructus Viticis"
            ],
            "Botanical": [
                "Vitex rotundifolia Linn.",
                "Vitex trifolia Linn"
            ],
            "Common": [
                "vitex fruit"
            ],
            "Other": [
                "jing zi"
            ],
            "Chinese": [
                "蔓荊子",
                "荊子"
            ],
            "Pronunciation in Korean": [
                "manhyongja"
            ],
            "Pronunciation in Japanese": [
                "mankeishi"
            ],
            "Pronunciation in Cantonese": [
                "maan4 ging1 zi2"
            ],
            "Pinyin Pronunciation": []
        },
        "Type": "Herb",
        "Geography": [
            "Shandong",
            "Jiangxi",
            "Zhejiang",
            "Fujian"
        ],
        "Properties": [
            "bitter",
            "acrid",
            "slightly cold"
        ],
        "Meridians": [
            "liver",
            "stomach",
            "bladder"
        ],
        "Maladies Treated": [
            "cold from exterior",
            "wind-heat dizziness",
            "headache",
            "migraine headache",
            "swollen and painful gum",
            "wind-heat with swollen and painful red eyes, with excessive tears"
        ],
        "Medical Function": [
            "sedative effect",
            "inhibit pain",
            "antipyretic effect"
        ],
        "Dosage": "Decoction: 6 to 12 g, or make into alcohol extract. External application: smash and apply on affected parts.",
        "Samples of Formulae": "For treatment of failure of clear yang to rise, causing formation of eye opacity, tinnitus and deafness: Yi Qi Cong Ming Tang. For treating wind-dampness Bi (painful obstruction): Jiang Huo Sheng Shi Tang.",
        "Contraindications": "Use with care in cases of headache, blurry vision with blood deficient and heat or in cases of pixu (spleen deficient).",
        "Research": "Anti PMS",
        "Notes": "",
        "Chemical Ingredients": [
            "Leaves and fruits of Vitex rotundifolia contain: Camphene, Flavone, Pigments, Vitexicarpin, Rotundifuran, Agnuside, Artemetin, vitamin A.",
            "Fruits of Vitex trifolia contain: casticin, α-Pinene, β-sitosterol, vitamin A."
        ],
        "References": [],
        "Further Reading": [],
        "Original Text": "man jing zi, Complementary and Alternative Healing UniversityComplementary and Alternative Healing University  Home  現代 中藥辭典Search this siteList of Health ProblemsChinese Herb DictionaryQigongTraditional Chinese Medicine (TCM)AcupuncturePrescribed Drug DictionaryBiochemistry DictionaryLecture SlidesResearch LibrarianGeneral Online LibrarySearchResearch SitesViagraMassage/AcupressureHypnotherapyTell us what you wantNotify Changes & New Information　　          　                                     man jing zi 蔓荊子 Edited by: Joe Hing kwok ChuA manuscript... writing and translation in progressPharmaceutical name:英文藥名﹕Fructus ViticisBotanical name:學名﹕Vitex rotundifolia Linn.  單葉蔓荊Vitex trifolia Linn 三葉蔓荊Pron. in Japanese:日語發音﹕mankeishiPron. in Korean:韓語發音﹕manhyongjaPron. in Cantonese粵音﹕maan4 ging1 zi2Other Names:別名﹕jing zi 荊子 Common Name:英文名﹕vitex fruitDistribution:產地﹕Shandong, Jiangxi, Zhejiang, Fujian/山東﹐ 江西﹐ 浙江﹐ 福建。Properties(characteristics)﹕性味﹕bitter, acrid, slightly cold.苦，辛﹐微寒。Channels (meridians) entered: 歸經﹕liver, stomach, bladder.肝﹐胃﹐膀胱Medical functions:藥理﹕ sedative effect inhibit pain antipyretic effect 鎮靜 止痛 解熱Actions & Indications:主治﹕cold from exterior, wind-heat dizziness, headache migraine headache swollen and painful gum wind-heat with swollen and painful red eyes, with excessive tears 外感風熱頭昏﹐頭痛 偏頭痛 齒齦腫痛 風熱目赤腫痛﹐多淚。Chemical ingredients:化學成份﹕Leave and fruits of Vitex rotundifolia contain:單葉蔓荊果實和葉含Camphene茨烯Flavone黃酮Pigments色素Vitexicarpin蔓荊子黃素Rotundifuran蔓荊呋喃Agnuside牡荊Artemetin青蒿亭vitamin A維生素甲Fruits of Vitex trifolia三葉蔓荊果實含:casticin紫花牡荊素α-Pineneα-蒎烯β-sitosterol-β-麥胚固醇vitamin A維生素甲Dosage:用量﹕Decoction: 6 to 12 g, or make into alcohol extract. External application: smash and apply on affected parts. 煎湯﹕6~12 g 浸酒 外用：搗敷。Samples of formulae:處方舉例﹕治清陽不升，目生翳障，耳鳴耳聾﹕益氣聰明湯。  治風濕痺痛﹕姜活勝濕湯。 Modern Research:現代研究﹕Anti PMSToxicity & Cautions:毒素與禁忌﹕Use with care in cases of headache, blurry vision with blood deficient  and heat or in cases of pixu (spleen deficient) .血虛有火之頭痛目眩及脾虛 者慎服。　  Sponsors' Ads by Google 以下為谷歌所提供贊助者之廣告  A manuscript... writing, translating and proofreading              in progressProblems with website? Please Click here for comment. (Not for inquiry )   Click here for inquiry   Copyright Notice 按此看關於版權問題List of Health ProblemsChinese Herb DictionaryToxicity of Some HerbsSide Effect of Some HerbsHerbs that can be toxic to kidneysTraditional Chinese MedicineTCM DiagnosisSamples of FormulaeAcupuncturecopy right 版權所有Qigong (chi kung)Prescribed Drug DictionaryEmail our web master for  your suggestion (not for inquiry)Biochemistry DictionaryGeneral Online LibraryQigong classesFake Email WarningResearch LibrarianSearchQigong classesHomeWeather Report    Disclaimer   Last update: Dec 17, 2008; 6:07 a.m. LAH  ",
        "original_url": "http://alternativehealing.org/man_jing_zi.htm"
    },
    {
        "Names": {
            "Name": [
                "ji nei jin",
                "雞內金"
            ],
            "Pharmaceutical": [
                "Endothelium Corneum Gigeriae Galli"
            ],
            "Biological": [
                "Gallus gallus domesticus Brisson"
            ],
            "Common": [
                "Chicken Gizzard's Stomach Lining"
            ],
            "Other": [
                "ji zhun pi",
                "nei jin",
                "jiu ji jin",
                "hua shi dan",
                "ji zhen pi",
                "ji jin",
                "雞肫皮",
                "內金",
                "炙雞金",
                "化石膽",
                "雞胗皮",
                "雞筋"
            ],
            "Chinese": [
                "雞內金"
            ],
            "Pronunciation in Korean": [
                "myongnaegkim"
            ],
            "Pronunciation in Japanese": [
                "keinaikin"
            ],
            "Pronunciation in Cantonese": [
                "gai1 noi6 gam1"
            ],
            "Pinyin Pronunciation": []
        },
        "Type": "Animal",
        "Geography": [
            "throughout China"
        ],
        "Properties": [
            "sweet",
            "neutral"
        ],
        "Meridians": [
            "Spleen",
            "Stomach",
            "Small intestine",
            "Bladder"
        ],
        "Maladies Treated": [
            "weak digestion",
            "vomiting",
            "diarrhea",
            "children worm parasites",
            "bed wetting",
            "spermatorrhea",
            "amenorrhea",
            "food stagnation and indigestion",
            "urinary tract stones",
            "gallbladder and liver stones"
        ],
        "Medical Function": [
            "increases digestive juices thus shortens the emptying time of the bowels"
        ],
        "Dosage": "For decoction: 3 to 10 g. In Powder Form: 1.5 to 3 g. The effect is deemed to be better than that of decoction.",
        "Samples of Formulae": "For stones in the urinary tract: jin qian cao (lysimachia / gold coin grass), ji nei jin (Chicken Gizzard's Stomach Lining). For children's bed wetting and adults' frequent urination: sang piao xiao (mantis egg-case), long gu (dragon bone), mo li (oyster shell).",
        "Contraindications": "",
        "Research": "",
        "Notes": "",
        "Chemical Ingredients": {
            "Ingredients": [
                "ventriculin",
                "keratin",
                "bilatriene",
                "vitamin B1",
                "vitamin B2"
            ]
        },
        "References": [
            "[1] 張錫純《醫學衷中参西錄》"
        ],
        "Further Reading": [],
        "Original Text": "\n\n\n\nji nei jin,Complementary and Alternative Healing University\n\n\n\n\n\n\n\n\n\n\n\nComplementary and Alternative Healing University \n        \nHome  \n\n\n現代 中藥辭典\n\n\n\n\n\n\n\n\n\n\n\n\n\n\n\nSearch this site\n\n\n\n\n\n\n\n            List of Health Problems\n\n\n\n\n\n\n\n            Chinese Herb Dictionary\n\n\n\n\n\n\nQigong\n\n\n\n\n\n\n\n            Traditional Chinese Medicine (TCM)\n\n\n\n\n\n\n\n            Acupuncture\n\n\n\n\n\n\n\n            Prescribed Drug Dictionary\n\n\n\n\n\n\n            Biochemistry Dictionary\n\n\n\n\n\n\nLecture Slides\n\n\n\n\n\nResearch Librarian\n\n\n\n\n\n\nGeneral \n            Online Library\n\n\n\n\n\n\nSearch this site\n\n\n\n\n\n\nResearch \n            Sites\n\n\n\n\n\n\n\n            Viagra\n\n\n\n\n\n\n\n            Massage/Acupressure\n\n\n\n\n\n\nHypnotherapy\n\n\n\n\n\n\nTell us what you want\n\n\n\n\n\n\nNotify Changes \n            & New Information\n\n\n\n\n\n \n \n \n \n \n \n \n \n \n \n \n \n \n \n \n \n \n \n \n \n \n \n \n \n \n \n \n \n \n \n \n \n \n \n \n \n\n\n\n\n\n\n \n\nji nei jin 雞內金\n \n\n\n\n        by: Joe Hing kwok Chu\n \n\n        Click \n        here \n        to see picture.        按此看圖。\n\n\n\n\nPharmaceutical \n            name:\n英文藥名﹕\n\n\n\nEndothelium Corneum Gigeriae Galli.\n\n\n\n\nZoological \n            name:\n學名﹕\n\n\nGallus \n            gallus domesticus Brisson\n\n\n\n\nPron. in Japanese:\n日語發音﹕\n\n\nkeinaikin\n\n\n\n\nPron. in Korean:\n韓語發音﹕\n\n\nmyongnaegkim\n\n\n\n\n\n\n            Pron. in Cantonese:\n粵音﹕\n\n\ngai1 noi6 \n            gam1\n\n\n\n\nOther \n            Names:\n別名﹕\n\n\nji zhun \n            pi, nei jin, jiu ji jin, hua shi dan, ji zhen pi, ji jin.\n雞肫皮，內金 \n            、炙雞金，化石膽，雞胗皮，雞筋。\n\n\n\n\nCommon Name:\n英文名﹕\n\n\nChicken \n            Gizzard's Stomach Lining\n\n\n\n\nDistribution:\n產地﹕\n\n\nthroughout \n            China\n全國都有。\n\n\n\n\nProperties\n(characteristics)﹕\n性味﹕\n\n\nsweet, \n            neutral.\n甘，平。\n\n\n\n\nChannels (meridians) \n            entered:\n \n歸經﹕\n\n\nspleen, \n            stomach, small intestine, bladder.\n脾﹐胃﹐小腸 \n            ﹐膀胱。\n\n\n\nMedical \n            functions:藥理﹕\n \n\n\nincreases \n            digestive juices thus shortens the emptying time of the bowels\n增加消化液﹐ \n            縮短排便時間。\n\n\n\n\n\nActions & Indications:\n主治﹕\n\n\nBeing \n            used in weak digestion, vomiting, diarrhea, children worm parasites \n            , bed wetting, spermatorrhea. amenorrhea.\n用于食積不消 \n            ，嘔吐瀉痢，小儿疳積，尿路結 石 ﹐肝胆結石﹐遺尿﹐遺精﹐閉經[1]。\n\n\n\n\n\nChemical ingredients:\n化學成份﹕\n\n\nventriculin, \n            keratin, bilatriene, vitamin B1, B2\n胃激素, 角\n            蛋白, 膽汁三烯, 維生素B1﹐維生素B2。\n\n\n\n\nDosage:\n用量﹕\n\n\nFor decoction: \n            3 to 10 g.\nIn Powder Form: 1.5 to 3 \n            g.  The effect is deemed to be better than that of decoction.\n煎劑﹕  3－10 g。\n研末服﹕每次1.5－3g，效果可能比入煎 劑 好。\n\n\n\n\nSamples \n            of formulae:\n處方舉\n            例﹕\n\n\nstones \n            in the urinary tract:jin \n            qian cao,, ji nei jin\nbed wetting \n            of children and adult frequent urination : sang piao xiao, long gu, \n            mo li\n尿石﹕金 \n            錢草﹐雞 內金\n小兒尿失禁﹐ \n            成人尿頻﹕桑螵蛸﹐ 龍骨﹐牡 \n            蠣 。\n\n\n\n\n\nModern Research:\n現代研究﹕\n\n\n \n\n\n\n\n\nToxicity & Cautions:\n毒素與禁忌﹕\n\n\n\n\n\n\n　\n[1] 張錫純《醫學衷中参西錄》\n　 Sponsors' Ads by Google 以下為谷歌所提供贊助者之廣告\n\n\n\n\n\n\nA manuscript... writing, translating and proofreading              \n            in progress\n\n\n\n            Click here for comment. (Not for inquiry )     \n            \n\nClick here for inquiry\n \n \n\n\nCopyright Notice \n            按此看關於版權問題\n\n\n\n\n\n\n                List of Health Problems\n\n\n\n\n\n                Chinese Herb Dictionary\n\n\n\n\n\nToxicity of Some Herbs\n\n\n\nSide Effect of Some Herbs\n\n\n\nHerbs that can be toxic to kidneys\n\n\n\n\n\n                Traditional Chinese Medicine\n\n\nTCM Diagnosis\n\n\n\n                Samples of Formulae\n\n\n\n\n\n                Terms of Traditional Chinese Medicine\n\n\n\n                Acupuncture\n\n\n\n\n\n\ncopy \n                right\n \n\n\n版權所\n                有\n\n\n\n\nQigong \n                (chi kung)\n\n\n\n\n\n                Prescribed Drug Dictionary\n\n\n\n\n\n                Email our web master for  your suggestion (not for inquiry)\n\n\n\n\nBiochemistry Dictionary\n\n\n\n\n\n\nGeneral Online Library\n\n\n\n\nQigong \n                classes\n\n\n\n\nFake \n                Email Warning\n\n\n\n\nResearch Librarian\n\n\n\n\nSearch\n\n\n\n\n\n\nQigong classes\n\n\n\n\n\n\n\n\n\nHome\n\n\n\n\n\n                Weather Report\n\n\n\n    \n\nDisclaimer\n\n\n\n\n\n\n\n\n\n\n\n\nLast \n        update: Jan 30, 2012  12:15 a.m. LAH\n\n\n\n\n\n\n\n\n\n\n\n\n\n\n\n\n",
        "original_url": "http://alternativehealing.org/ji_nei_jin.htm"
    },
    {
        "Names": {
            "Name": [
                "quan niu hua",
                "shan jin hua"
            ],
            "Pharmaceutical": [
                "Flos Arnicae"
            ],
            "Biological": [
                "Arnica Montana L."
            ],
            "Chemical": [],
            "Common": [
                "leopard's bane",
                "wolf's bane",
                "mountain tobacco",
                "mountain arnica"
            ],
            "Other": [
                "shan jin che hua 山金車花"
            ],
            "Chinese": [
                "山金花",
                "山金車花"
            ],
            "Pronunciation in Korean": [],
            "Pronunciation in Japanese": [
                "arunika"
            ],
            "Pronunciation in Cantonese": [
                "saan1 gam1 faa1"
            ],
            "Pinyin Pronunciation": []
        },
        "Type": "Herb",
        "Geography": [
            "Northern and Middle parts of Europe"
        ],
        "Properties": [
            "acrid",
            "sweet"
        ],
        "Meridians": [],
        "Maladies Treated": [
            "Used externally only: sprains and bruises, muscle pain, arthritis pain and stimulating the immune system."
        ],
        "Medical Function": [
            "Analgesic",
            "Helenalin, an active ingredient of Arnica, is an anti-inflammatory sesquiterpene lactone from Arnica, selectively inhibits transcription factor NF-kappaB.",
            "Anti-oxidant",
            "Anti tumor",
            "Choleretic",
            "Uterine stimulant"
        ],
        "Dosage": "",
        "Samples of Formulae": "",
        "Contraindications": "Do not use during breast feeding or during pregnancy.",
        "Research": "",
        "Notes": "",
        "Chemical Ingredients": {
            "Ingredients": [
                "helenalin"
            ]
        },
        "References": [],
        "Further Reading": [],
        "Original Text": "quan niu hua,Complementary and Alternative Healing University\n\n\n\n\n\n\n\nComplementary and Alternative Healing University \n        \nHome  \n\n\n現代 中藥辭典\n\n\n\n\n\n\n\n\n\n\n\n\n\nSearch this site\n\n\n\n\n\n\n            List of Health Problems\n\n\n\n\n\n\n            Chinese Herb Dictionary\n\n\n\n\n\nQigong\n\n\n\n\n\n\n            Traditional Chinese Medicine (TCM)\n\n\n\n\n\n\n            Acupuncture\n\n\n\n\n\n\n            Prescribed Drug Dictionary\n\n\n\n\n\n            Biochemistry Dictionary\n\n\n\n\n\nLecture Slides\n\n\n\n\nResearch \n            Librarian\n\n\n\n\n\n\n            General Online Library\n\n\n\n\n\nSearch this site\n\n\n\n\n\nResearch \n            Sites\n\n\n\n\n\n\n            Viagra\n\n\n\n\n\n\n            Massage/Acupressure\n\n\n\n\n\n\n            Hypnotherapy\n\n\n\n\n\nTell us what you \n            want\n\n\n\n\n\nNotify \n            Changes & New Information\n\n\n\n　\n　\nTo post your\n            discussion \n            click here.\n \n \n \n \n \n \n \n \n \n \n \n \n \n \n \n \n \n \n \n \n \n \n \n \n \n \n\n\n\n\n \n\nshan jin hua    山金花\n\nby: Joe Hing kwok Chu\nPharmaceutical name:\n英文藥名﹕Flos Arnicae\nBotanical name:\n學名﹕Arnica Montana L.\nPron. in Japanese:\n日語發音﹕\n            arunika\nPron. in Korean:\n韓語發音﹕ \n\n\n                Pron. in Cantonese:\n粵音﹕\n            saan1 gam1 faa1\nOther Names:\n別名﹕\n        shan jin che hua 山金車花\nCommon Name:\n英文名﹕\n\n\n        leopard's bane, wolf's bane，mountain \n        tobacco ， mountain arnica\nDistribution:\n產地﹕\n            Originally produced in northern and middle part of Europe.\n            產歐洲北部和中部。\nProperties\n(characteristics)﹕\n性味﹕\n            acrid, sweet.辛，甘。\nChannels (meridians) entered: \n歸經﹕\nMedical functions:\n藥理﹕ \n            1. Analgesic,\n2. Helenalin, an active ingredient of Arnica, is an anti-inflammatory sesquiterpene lactone from Arnica, selectively inhibits transcription factor NF-kappaB.\n3. Anti-oxidant\n4. Anti tumor\n5. Choleretic\n6. Uterine stimulant\n\n止痛作用\n消炎作用\n抗氧\n抗瘤\n利膽\n刺激子宮\n\n\nActions & Indications:\n主治﹕external use only: sprains and bruises, muscle \n            pain, arthritis pain and for stimulating the immune system.\n            外用：治療淤血，扭傷，肌肉痛、風濕痛及刺激免疫系統。\nChemical ingredients:\n化學成份﹕helenalin\nDosage:\n用量﹕ \nSamples of formulae:\n處方舉例﹕ \nModern Research:\n現代研究﹕ \nToxicity & Cautions:\n毒素與禁忌﹕\n        do not use during breast feeding or during pregnancy.授乳期間或懷孕期間忌用。　  \n\n\n\n\n\n\n\n\n\n\n\n\n\n\n\n\n\n\n\n\n\n\n\n\n\n\n\n\n\nSponsors' Ads by Google\n        以 \n        下為谷歌所提供之廣告\n\n\n \n\n\n\n\n\n\n\nA manuscript... writing, translating and proofreading                          in progress\n\n\n\n            Click here for comment. (Not for inquiry )     \n            \n\nClick here for inquiry\n \n \n\n\nCopyright Notice \n            按此看關於版權問題\n\n\n\n\n\n\n                List of Health Problems\n\n\n\n\n                Chinese Herb Dictionary\n\n\n\n\nToxicity of Some Herbs\n\n\n\nSide Effect of Some Herbs\n\n\n\nHerbs that can be toxic to kidneys\n\n\n\n\n                Traditional Chinese Medicine\n\n\nTCM \n                Diagnosis\n\n\n\n                Samples of Formulae\n\n\n\n\n                Terms of Traditional Chinese Medicine\n\n\n\n                Acupuncture\n\n\n\n\n\n\n                copy right\n \n\n\n版權所 \n                有\n\n\n\nQigong \n                (chi kung)\n\n\n\n\n                Prescribed Drug Dictionary\n\n\n\n\n                Email our web master for  your suggestion (not for inquiry)\n\n\n\nBiochemistry Dictionary\n\n\n\n\n\nGeneral Online Library\n\n\n\n\n                Qigong classes\n\n\n\n\n                Fake Email Warning\n\n\n\nResearch Librarian\n\n\n\nSearch\n\n\n\n\n\nQigong classes\n\n\n\n\n\n\n\n\nHome\n\n\n\n\n                Weather Report\n\n\n    \n\n\n                Disclaimer\n\n\n\n\n\n\n\n\n\n\n\n\n\n\n\n\n\n\n\n\n\n\n\n\n\n\n\n\n\n\n        Last update: Aug 9, 2013; 12:45 a.m. LAH\n\n\n\n\n\n\n\n\n\n\n\n\n",
        "original_url": "http://alternativehealing.org/shan_jin_hua.htm"
    },
    {
        "Names": {
            "Name": [
                "shan dou gen",
                "山豆根"
            ],
            "Pharmaceutical": [
                "Rhizoma Sophorae subprostratae",
                "Radix Sophorae subprostratae"
            ],
            "Biological": [
                "Sophora subprostrata Chun et T. Chen",
                "Sophora tonkinensis Gapnep",
                "Euchresta japonica Benth."
            ],
            "Common": [
                "sophora root"
            ],
            "Other": [
                "guang dou gen",
                "廣豆根"
            ],
            "Chinese": [
                "山豆根",
                "廣豆根"
            ],
            "Pronunciation in Korean": [
                "santugun"
            ],
            "Pronunciation in Japanese": [
                "sanzukon"
            ],
            "Pronunciation in Cantonese": [
                "saan1 dau6 gan1"
            ],
            "Pinyin Pronunciation": []
        },
        "Type": "Herb",
        "Geography": [
            "Guangxi",
            "Guangdong",
            "Jiangxi",
            "Guizhou provinces of China"
        ],
        "Properties": [
            "bitter",
            "cold",
            "toxic"
        ],
        "Meridians": [
            "lung",
            "stomach"
        ],
        "Maladies Treated": [
            "swelling of throat due to infection",
            "swelling of gums",
            "cough due to infection of lungs",
            "hepatitis due to viral infection",
            "hepatitis B surface antigen carriers without symptoms",
            "arrhythmia",
            "cervical erosion",
            "warts of palms of the feet: Use shan dou gen (sophora root), ban lan gen (isatis root) 60 g each. Add water 3000 c.c. Bring to boil for 10 minutes. Cool to bath water temperature, soak feet for 30 minutes once a day. For larger warts, use moxibustion for 10 minutes each time. Treated 54 patients. Number of warts per patient ranged from 5 to 27. Healed 43 cases, ineffective in 11 cases. Healing required 3-9 doses.",
            "hemorrhoids: use northern variety of shan dou gen (sophora root). Wash and moisten for 30 minutes. Add 500 ml of water. Boil for 30 minutes, filter, soak gauze in hot (60°C) solution and apply to hemorrhoid for 30 minutes. Treated 30 cases: all showed good inflammatory relief and analgesic effect.",
            "bladder cancer",
            "acute tonsillitis",
            "psoriasis",
            "anesthesia in surgeries",
            "leptospirosis: used with da qing ye (isatis leaf) and gan cao (licorice root)",
            "early-stage lung cancer",
            "early-stage throat cancer",
            "early-stage bladder cancer"
        ],
        "Medical Function": [
            "used clinically to clear heat toxin causing severe sore throat. In mild cases used alone by decoction or as a rinse; for severe cases combined with xuan shen (scrophularia root), ban lan gen (isatis root), she gan (belamcanda) to increase efficacy",
            "used alone or combined with shi gao (gypsum), huang lian (coptis), sheng ma (black cohosh), mu dan pi (tree peony bark) for relieving swelling and pain of gums; used as mouth rinse",
            "treatment of cervical erosion",
            "Antiviral treatment in hepatitis.",
            "Beneficial for viral hepatitis cases where no symptoms are present but hepatitis B surface antigen carrier state exists"
        ],
        "Dosage": "For internal use (decoction): 6–10 g each day. For external application: use an appropriate amount.",
        "Samples of Formulae": "",
        "Contraindications": "This herb is very cold and very bitter. It can cause over-excitement of the vegetative nervous system. Overdose can lead to digestive disorders such as nausea, vomiting, poor appetite, stomachache, diarrhea, tightness in the chest area, and palpitation. Use with caution in conditions of pixu (spleen deficiency).",
        "Research": "In a lab test on rats, shan dou gen demonstrated the ability to lower AST, total protein, albumin, and cholesterol.[5]",
        "Notes": "",
        "Chemical Ingredients": [
            "alkaloids including sophocarpine, matrine, oxymatrine, anagyrine (methylcytisine), (-)-cytisine, dauricine, (+)-sophoramine N-oxide, (+)-sophoranol, dauraicoline",
            "flavonoids including sophoranone, sophoradin, sophoranochromene, sophoradochromene, genistein",
            "other ingredients: pterocarpine, maackian, trifolirhizin, phytosterols, higher alcohol ester of caffeic acid"
        ],
        "References": [
            "[1] 姜忠義，中藥通報1982；7 (5):29 Jiang Zhong-YI, Chinese Medical Journal 1982;7 (5):29",
            "[2] 窦金辉等，中國中藥雜志，1989; 14(5):40. Dou Jin-Hui, Chinese Medical Magazine, 1989;14(5):40.",
            "[3] 江蘇新醫學院；中药大辭典，上海，上海科學技術出版社；1991；182 Chinese Medicine Dictionary by Jiangsu New Medical School, Shanghai. Published by Shanghai Science and Technology Publication. 1991;182",
            "[4] 方立瓊，上海醫科大學學報；1992；19 (2); 124。 Fang L.Q. et al. Journal of Shanghai Medical University 1992;19(2);124",
            "[5] 中國中醫基礎醫藥雜誌; 2005年，第11卷，第12期. Chinese Journal of Basic Medicine of Traditional Chinese Medicine; 2005, Vol 11, No.12",
            "[13] 李枫；廣西中醫藥；1983；6（4）15",
            "[15] 張路青；中國醫院醫學雜誌；1988；8（8）292"
        ],
        "Further Reading": [],
        "Original Text": "shan dou gen, Complementary and Alternative Healing UniversityComplementary and Alternative Healing University  Home 現代中藥辭典Search this siteList of Health ProblemsChinese Herb DictionaryQigongTraditional Chinese Medicine (TCM)AcupuncturePrescribed Drug DictionaryBiochemistry DictionaryLecture SlidesResearch LibrarianGeneral Online LibrarySearchResearch SitesViagraMassage/AcupressureHypnotherapyTell us what you wantNotify Changes & New Information　　　    　      　　    　　　　　                                                       shan dou gen 山豆根by: Joe Hing kwok ChuPharmaceutical name:英文藥名﹕Rhizoma Sophorae subprostratae   Radix Sophorae subprostratae Latin botanical  name:拉丁生物學名﹕Sophora subprostrata Chun et T. ChenSophora tonkinensis GapnepEuchresta japonica  Benth.Pron. in Japanese:日語發音﹕sanzukonPron. in Korean:韓語發音﹕santugunPron. in Cantonese::粵音﹕saan1 dau6 gan1Other Names:別名﹕guang dou gen 廣豆根Common Name:英文名﹕sophora rootDistribution:產地﹕mainly in Guangxi, Guangdong, Jiangxi, Guizhou provinces of China.主產於中國廣西，廣東，江西，貴州等省。Properties(characteristics)﹕性味﹕bitter, cold, toxic.苦，寒，有毒。Channels (meridians) entered: 歸經﹕lung, stomach.肺，胃。Medical functions:藥理﹕  Clinical application：:臨床應用﹕For treatment of: Swelling of throat due to infection. For mild cases, use decoction of this herb to rinse the mouth. In more serious cases add xuan shem, ban lan gen, she gan to enhance the efficacy. Swelling of gum: Cough due to infection of lungs. Hepatitis due to viral infection. Hepatitis B surface Antigent carriers but do not have symptoms Arrhythmia Cervical erosion Warts of palms of the feet: use shan dou gen,ban lan gen 60 g each. Add water 3000 c.c. Bring to boil for 10 minutes. Cool to bath water temperature. Soak feet for 30 minutes, once a day. For larger once use moxibustion for 10 minutes each time. Treated 54 patients. The smallest amount of warts on the feet is 8 and largest number is 27. Healed: 43. Ineffective: 11. The healed patients used 3 to 9 doses.【13】 Hemorrhoids: Cancer of the bladder Acute tonsillitis Small childrenpsoriasis Psoriasis For use as anesthesia in surgeries. 治病毒性肝炎 【1】： 用於熱毒蘊結，咽喉腫痛。 輕者可單用本品，水煎服或含嗽；重者須配玄 參，板藍根，射 干等藥，以增強療效。 用於牙齦腫痛。 可單用煎湯嗽口，或與石膏，黃連，升麻，牡丹皮等同用。 肺熱咳嗽: 癰腫瘡毒等症。 子宮頸糜爛 治脚底疣：用山豆根，板藍根 各60克。加水3公升。煮沸30分鐘。待稍凉時泡脚半小時。每日一次。對較大的疣體，加艾灸，每次10分鐘。共治療54例。（脚底疣數最少5個。最多27個）。治愈43例。無效11例。治愈病例用藥3～9剤。【13】   用於鉤端螺旋體病 早期肺癌，喉癌， 治痔瘡：取北山豆根洗净濕潤30分鐘。加水500毫升。煮沸30分鐘。過滤。用纱布浸滤液，趁熱（60 度）敷在痔處。保持30分鐘。治30例。均受到良好消炎止痛效果。【15】 治膀胱癌腫： 治急性扁桃腺炎:    近年用於鉤端螺旋體病及早期肺癌，喉癌，膀胱癌等，均有一定的療效。    用治鉤端螺旋體病多與大青葉，甘草合用；    用治癌症，常與白花蛇舌草，魚腥草配伍。    治 銀痟病   Chemical ingredients:化學成份﹕Contains Alkaloids, as: 【1, 2】含生 物鹼如：【1, 2】sophocarpine搜果鹼matrine苦參鹼oxymatrine氧化苦參鹼anagyrine臭豆鹼(methylcytisine甲基金雀花鹼(-)-cytisine金雀花鹼dauricine山豆根鹼(+)-sophoramine N-oxide氧化槐果鹼(+)-sophoranol槐醇dauraicoline 【4】山豆根二醇 【4】Also contains various flavonoids, as:另還含有多種黃酮 類, 如：sophoranone柔枝槐酮sophoradin柔枝槐素sophoranochromene柔枝槐酮色烯sophoradochromene柔枝槐素色烯genistein 【3】染料木素 【3】Other ingredients:其他成份：pterocarpine紫檀素maackian山槐素trifolirhizin紅車軸草根甙phytosterols甾醇higher alcohol ester of caffeic acid 【3】咖啡酸的高级脂 肪醇酯 【3】Daly Dosage:每日用量﹕For decoction: 6 - 10 g. For external application: use appropriate amount.作煎剤，内服： 6～10 克。外用：適量。Samples of formulae:處方舉例﹕ Modern Research:現代研究﹕in lab test on rats, it showed shan dou gen could lower AST, total protein,  albumin, and cholesterol. [5]Toxicity & Cautions:毒素與禁忌﹕This herb is very cold and very bitter. It can cause over excitement of the vegetative nervous system. Over dose can cause disorder of the digestive system and can cause nausea, vomiting, lack of appetite, stomachache, diarrhea, tightness in chest area, and palpitation.Use with care in cases of pixu (spleen deficient)山豆根大苦大寒，能使植物神經過度興奮，過量服 用能引起胃腸功能紊亂，易引起悪心，嘔吐，纳差，腹痛，腹瀉，胸悶，心悸等副作用，故用量不宜過大。  脾虛者慎用。Chemical ingredients:【1】姜忠義，中藥通報1982；7 （5）29Jiang Zhong-YI, Chinese Medical Journal 1982；7 （5）29【2】窦金辉等，中國中藥雜志，1989; 14 (5) 40.Dou Jin-Hui, Chinese Medical Magazine, 1989; 14 (5) 40.【3】江蘇新醫學院；中药大辭典，上海，上海科學技術出版社；1991；182Chinese Medicine Dictionary by Jiangsu New Medical School, Shanghai. Published by Shanghai Science and Technology Publication. 1991; 182【4】 方立瓊，上海醫科大學學報； 1992；19 (2); 124。 Fang L.Q. et al. Journal of Shanghai Medical University  1992；19 (2); 124Clinical application:【5】中國中醫基礎醫藥雜誌; 2005 年，第11卷，第12期。Chinese Journal of Basic Medicine of Traditional Chinese Medicine; 2005, Vol 11, No. 12【13】李枫； 廣西中醫藥；1983；6（4） 15【15】張路青；中國醫院醫學雜誌；1988；8 （8）292  Sponsors' Ads by Google 以下為谷歌所提供贊助者之廣告   A manuscript... writing, translating and proofreading  in progressProblems with website? Please Click here for comment. (Not for inquiry )      Click here for inquiry    Copyright Notice 按此看關於 版權問題List of Health ProblemsChinese Herb DictionaryToxicity of Some Herbs Side Effect of Some Herbs Herbs that can be toxic to kidneysTraditional Chinese MedicineTCM DiagnosisSamples of FormulaeTerms of Traditional Chinese MedicineAcupuncturecopy right 版權所有Qigong (chi kung)Prescribed Drug DictionaryEmail our web master for  your suggestion (not for inquiry)Biochemistry DictionaryGeneral Online LibraryQigong classesLecture SlidesResearch LibrarianSearchQigong classesHomeWeather Report DisclaimerLast update: Jan 5,  2012, 11 a.m. LAHSearch this site         ",
        "original_url": "http://alternativehealing.org/shan_dou_gen.htm"
    }
]