[
    {
        "Names": {
            "Name": [
                "qing long yi"
            ],
            "Pharmaceutical": [
                "Pericarpium Juglans"
            ],
            "Biological": [
                "Juglans mandshurica Maxim",
                "Juglans regia L."
            ],
            "Chemical": [],
            "Common": [
                "Manchurian walnut skin"
            ],
            "Other name": [],
            "Chinese": [
                "青龍衣",
                "核桃青衣"
            ],
            "Pronunciation in Korean": [],
            "Pronunciation in Japanese": [],
            "Pronunciation in Cantonese": [
                "cing1 lung4 ji1"
            ],
            "Pinyin Pronunciation": [
                "qing long yi"
            ]
        },
        "Type": "Herb",
        "Geography": [],
        "Properties": [
            "Bitter",
            "Astringent",
            "Neutral",
            "Toxic"
        ],
        "Meridians": [
            "Liver",
            "Spleen",
            "Stomach"
        ],
        "Maladies Treated": [
            "stomachache",
            "diarrhea",
            "boils",
            "chronic fungal infection of skin"
        ],
        "Medical Function": [
            "anti-inflammation, antibiotic. [1]"
        ],
        "Dosage": "For taking orally, make into decoction: 10 ~ 15 g.\nExternal use: appropriate amount.",
        "Samples of Formulae": "",
        "Contraindications": "",
        "Research": "Zhou Yuan Yuan, Wang Dong, Niu Feng isolated the 8 ingredients: [2]",
        "Notes": "",
        "Chemical Ingredients": [
            "α-hvdrojuglone-4-β-D－glucoside",
            "(E)-4,8-dimethyl-1, 3, 7-nonatriene",
            "pinocarvone 松香芹酮",
            "pinocarveol 松香芹醇",
            "myrtenal 桃金娘烯醛",
            "myrtenol 桃金娘烯醇",
            "(E, E)-4, 8, 12-trimethyl-1, 3, 7, 11-tridecatetraene",
            "8-hydorxyanthraquinone-1-carboxylic acid",
            "kaempferol 山柰酚",
            "myricitrin 楊梅苷(甙)",
            "quercitrin; quercitroside 槲皮苷(甙) (又稱櫟素, 橡皮苷)",
            "4,5,8-三羥基-α-萘酮-5-O-β-D-吡喃葡萄糖苷(甙)",
            "4,5,8-三羥基-α-萘酮-5-O-β-D-(6'-O-沒食子酰基)葡萄糖苷",
            "20(S)-protopanaxadiol-3-one",
            "dammara-20, 24-dien-3β-ol",
            "galeon 茸毛香楊梅酮",
            "juglanin A (4), 2α, 3β, 23-trihydroxy olean-12-en-28-oic acid 胡桃寧A",
            "2α, 3β, 23-trihydroxy -12-en-28-oleanolic acid",
            "2α, 3β, 23-trihydroxy -12-en-28-ursolic acid",
            "oleanolic acid 齊墩果酸",
            "ursolic acid 熊果酸"
        ],
        "References": [
            "[1］劉勇民，等.維吾爾藥誌（下冊).烏魯木齊:新 疆科技衛生出版社（K)，1999.539",
            "[2] 中草藥 > 2010年1期 > 抗腫瘤中藥青 龍衣化學成分的研究"
        ],
        "Further Reading": [],
        "Original Text": "qing long yi, Complementary and Alternative Healing UniversityComplementary and Alternative Healing University   中藥詞典                 Chinese Herb Dictionary      Search this site     在本網站找資料     Discussion FormSearch this siteList of Health ProblemsChinese Herb DictionaryQigongTraditional Chinese Medicine (TCM)AcupuncturePrescribed Drug DictionaryBiochemistry DictionaryLecture SlidesResearch LibrarianGeneral Online LibraryResearch SitesViagraMassage/AcupressureHypnotherapyTell us what you wantNotify Changes & New Information  qing long yi 青龍衣 （核桃青衣)by: Joe Hing kwok ChuPharmaceutical name:英文藥名﹕Pericarpium JuglansLatin botanical  name:拉丁生物學名﹕Juglans mandshurica MaximJuglans regia L.Pron. in Japanese:日語發音﹕ Pron. in Korean:韓語發音﹕ Pron. in Cantonese::粵音﹕cing1 lung4 ji1Other Names:別名﹕ Common Name:英文名﹕Manchurian walnut skinDistribution:產地﹕ Properties(characteristics)﹕性味﹕bitter, astringent, neutral, toxic.苦，澀，平， 有毒.。   Channels (meridians) entered: 歸經﹕liver, spleen, stomach.肝，脾，胃。Medical functions:藥理﹕ anti-inflammation, antibiotic. 【1】消炎，殺菌。【1】Actions & Indications:主治﹕being used in stomachache, diarrhea, boils, chronic fungal infection of skin.用於胃腹疼痛，水痢，癰腫瘡毒,頑癬。Chemical ingredients:化學成份﹕ α-hvdrojuglone-4-β-D－glucosideα-氫化胡桃醌-4-β-D-葡萄糖苷E）-4，8-dimethyl-1, 3, 7-nonatriene（E）-4, 8-二甲基-1, 3, 7-壬三烯 （pinocarvone松香芹酮pinocarveol松香芹醇myrtenal桃金娘烯醛myrtenol桃金娘烯醇(E, E)-4, 8, 12-trimethyl-1, 3, 7, 11- tridecatetraene（ E, E）-4, 8, 12-三甲基-1, 3, 7, 11-十三碳四烯8-hydorxyanthraquinone-1-carboxylic acid8-羥基蒽醌-1-羧酸kaempferol山柰酚myricitrin楊梅苷 (甙)quercitrin;quercitroside槲皮苷 (甙) (又稱櫟素, 橡皮苷) 4,5,8-三羥基-α-萘酮-5-O-β-D-吡 喃葡萄糖苷 (甙) 4,5,8-三羥基-α-萘酮-5-O-β-D-(6'-O-沒 食子酰基)葡萄糖苷Zhou Yuan Yuan, Wang Dong, Niu Feng isolated the 8 ingredients:[2]周媛媛, 王棟, 牛峰分離到：[2]20(S)-protopanaxadiol-3-one20(S)-原人參二醇-3-酮 dammara-20, 24-dien-3β-ol達瑪烷-20,24-二烯-3β-醇galeon茸毛香楊梅酮 juglanin A (4), 2α, 3β, 23-trihydroxy olean-12-en-28-oic acid胡桃寧A(juglanin A2α, 3β, 23-trihydroxy -12-en-28-oleanolic acid2α,3β,23-三羥基-12-烯-28-齊 墩果酸2α, 3β, 23-trihydroxy -12-en-28-ursolic acid2α,3β-23-三羥基-12-烯-28-熊 果酸oleanolic acid齊墩果酸ursolic acid熊果酸  Daly Dosage:每日用量﹕For taking orally, make into decoction:10 ~ 15 g. External use: appropriate amount.内服，煎湯：10 ～ 15 克。 外用適量。Samples of formulae:處方舉例﹕ Modern Research:現代研究﹕ Toxicity & Cautions:毒素與禁忌﹕[1］劉勇民，等.維吾爾藥誌（下冊).烏魯木齊:新 疆科技衛生出版社（K)，1999.539[2]  中草藥 > 2010年1期 > 抗腫瘤中藥青 龍衣化學成分的研究    Search this siteProblems with website? Please Click here for comment. (Not for inquiry )    Click here for inquiryCopyright Notice 按此看關於版權問題A manuscript... writing, translating and proofreading  in progressSponsors' Ads by Google 以下為谷歌 所提供之廣告 List of Health ProblemsChinese Herb DictionaryToxicity of Some HerbsSide Effect of Some HerbsHerbs that can be toxic to kidneysTraditional Chinese Medicine TCM Diagnosis Samples of FormulaeTerms of Traditional Chinese MedicineAcupuncturecopy right 版權所有Qigong (chi kung)Prescribed Drug DictionaryEmail our web master for  your suggestion (not for inquiry)Biochemistry DictionaryGeneral Online LibraryQigong classesFake Email WarningResearch LibrarianSearchQigong classesHomeWeather ReportDisclaimerLast update: Feb 26, 2014; 11 a.m. LAH   ",
        "original_url": "http://alternativehealing.org/qing_long_yi.htm"
    },
    {
        "Names": {
            "Name": [
                "xiang ru",
                "xiāng r�"
            ],
            "Pharmaceutical": [
                "Herba Elsholtziae seu Moslae"
            ],
            "Botanical": [
                "Elsholtzia splendens Nakai ex Mackwa",
                "Elscholtzia patrini Garche.",
                "Mosla chinensis Maxim .cv. Jiangxi-angr",
                "Mosla chinensis Maxim. [Orrthodon chinensis (Maxim.) Kudo ]"
            ],
            "Chinese": [
                "香薷",
                "西香薷",
                "香菜",
                "香茅",
                "香絨",
                "石香茅",
                "石香薷",
                "香茸",
                "紫花香茅",
                "蜜蜂草",
                "香薷",
                "細葉香薷",
                "小香薷",
                "小葉香薷",
                "香草",
                "滿山香",
                "青香薷",
                "香茹草",
                "土香薷",
                "土香草",
                "石艾",
                "七星劍"
            ],
            "Common": [
                "aromatic madder",
                "Chinese Mosla Herb",
                "herb of Haichow Elsholtzia"
            ],
            "Other": [
              "Xi Xiang Ru",
                  "Xiang Cai",
                  "Xiang Mao",
                  "Xiang Rong",
                  "Shi Xiang Mao",
                  "Shi Xiang Ru",
                  "Xiang Rong (variant)",
                  "Zi Hua Xiang Mao",
                  "Mi Feng Cao",
                  "Xiang Ru",
                  "Xi Ye Xiang Ru",
                  "Xiao Xiang Ru",
                  "Xiao Ye Xiang Ru",
                  "Xiang Cao",
                  "Man Shan Xiang",
                  "Qing Xiang Ru",
                  "Xiang Ru Cao",
                  "Tu Xiang Ru",
                  "Tu Xiang Cao",
                  "Shi Ai",
                  "Qi Xing Jian"

            ],
            "Pronunciation in Korean": [
                "hyangyu"
            ],
            "Pronunciation in Japanese": [
                "koju"
            ],
            "Pronunciation in Cantonese": [
                "heong1 jyu4"
            ],
            "Pinyin Pronunciation": []
        },
        "Type": "Herb",
        "Geography": [
            "Elsholtzia is grown in Jiangxi, Hebei, Henan, Anhui; the largest production is in Jiangxi.",
            "Mosla is grown in Guangxi, Hunan, Hubei."
        ],
        "Properties": [
            "Acrid",
            "Slightly warm"
        ],
        "Meridians": [
            "Lung",
            "Stomach"
        ],
        "Maladies Treated": [
            "Catching cold during summer months (夏月外感風寒，內傷於濕)",
            "Chill and fever (惡寒發熱)",
            "Headache with no sweat (頭痛無汗)",
            "Epigastric and abdominal pain (脘腹疼痛)",
            "Vomiting and diarrhea (嘔吐腹瀉)",
            "Urination not smooth/dysuria (小便不利)",
            "Edema (水腫)"
        ],
        "Medical Function": [
            "Diuretic effect: the volatile oil contained is excreted by the kidneys, promoting renal vasodilation and hyperemia and increasing filtration pressure."
        ],
        "Dosage": "3~10 g daily.",
        "Samples of Formulae": "Name of formula: Xiang Ru Yin (香薷飲)\nSource: Tai Ping Hui Min He Ji Ju Fang (《太平惠民和劑局方》)\nApplication: cold or flu during summer; for patterns with summer-heat and dampness (夏季感冒，夾暑濕証).\nFunction: 解表清暑，健脾利濕.\nComposition: Xiang Ru (Chinese Mosla Herb) 10 g, Hou Po (Magnolia bark) 5 g, Bai Bian Dou (Hyacinth bean) 5 g.\nPreparation: Cut Xiang Ru and Hou Po into small pieces. Stir fry Bai Bian Dou until brown and smash. Put all herbs into a warm thermos and pour in boiling water. Cover and keep warm for 1 hour. Or boil with water on the stove and simmer for 45 minutes.",
        "Contraindications": "Do not use in case external deficient with instant sweating or yin deficient with heat. 表虚自汗，陰虛有熱者禁用.",
        "Research": "",
        "Notes": "",
        "Chemical Ingredients": {
            "Flavonoids": [
                "5-hydroxy-6,7-dime-thoxyflavone",
                "5-羥基-6，7-二甲氧基黃酮",
                "5-hydroxy-7,8-dime-thoxyflavone",
                "5-羥基-7，8-二甲氧基黃酮",
                "5，7-dihydroxy-4-me-thoxyflavone",
                "5，7-二羥基-4-甲氧基黃酮",
                "5-hydroxy-7,4- di-methoxyflavanonol",
                "5-羥基-7，4二甲氧基黃烷醇",
                "5-hydroxy-6-methylflavanone-7- O-α-D-galacopyranoside",
                "5-羥基-6-O-α-D-吡喃半乳糖甙"
            ],
            "Steroids": [
                "acacetin-7-O-β-D- glucoside",
                "刺槐素-7-O-β-D-葡萄糖甙",
                "β-sitosterol",
                "β-谷甾醇",
                "β-sitosterol-3-O-β-D-glucoside 胡蘿卜甙"
            ],
            "Triterpenoids": [
                "ursolic acid 熊果酸",
                "tormentic acid 委陵菜酸",
                "2-α-hydroxyursolic acid 2-α-羥基熊果酸2"
            ],
            "Alkanes": [
                "6-methyl-trtriacontane 6-甲基三十三烷",
                "13-cyclohxyl-bexacosane 13-環已基二十六烷"
            ]
        },
        "References": [
            "[1] 《Zhong Hua Ben Cao 中華本草》"
        ],
        "Further Reading": [],
        "Original Text": "xiang ru, Complementary and Alternative Healing UniversityComplementary and Alternative Healing University  Home 現代中藥辭典Search this siteList of Health ProblemsChinese Herb DictionaryQigongTraditional Chinese Medicine TCMAcupuncturePrescribed Drug DictionaryBiochemistry DictionaryLecture SlidesResearch LibrarianGeneral Online LibrarySearchResearch SitesViagraMassage/AcupressureHypnotherapyTell us what you wantNotify Changes & New Information　　 To post your discussion click here.　    　      　　    　　　　　                                                            Last update: Aug 16 , 2013; 11 p.m. LAH xiāng r� 香薷  ( in English and Chinese 中英文)by: Joe Hing kwok Chu    朱興國編 譯  Pharmaceutical name:英文藥名﹕Herba Elsholtziae seu MoslaeBotanical name:拉丁生物學名﹕Elsholtzia splendens Nakai ex Mackwa Elscholtzia patrini Garche. Mosla chinensis Maxim .cv. Jiangxi-angr Mosla chinensis Maxim. [Orrthodon chinensis (Maxim.) Kudo ]Pron. in Japanese:日語發音﹕kojuPron. in Korean:韓語發音﹕hyangyuPron. in Cantonese::粵音﹕heong1 jyu4Other Names:別名﹕xi xiang ru 西香薷，xiang cai 香菜，xiang mao 香茅，xiang rong 香絨，shi xiang mao 石香茅，shi xiang ru 石香薷，xiang rong 香茸，zi hua xiang mao 紫花香茅，mi feng cao 蜜蜂草，xiang ru 香薷，xi ye xiang ru 細葉香薷，xiao xiang ru 小香薷，xiao ye xiang ru 小葉香薷，xiang cao 香草，man shan xiang 滿山香，qing xiang ru 青香薷，xiang ru cao 香茹草，tu xiang ru 土香薷，tu xiang cao 土香草，shi ai 石艾，qi xing jian 七星劍Common Name:英文名﹕aromatic madder, Chinese Mosla Herb, herb of Haichow ElsholtziaDistribution:產地﹕Elsholtzia is  grown in Jiangxi, Hebei, Henan, Anhui. The largest production is in Jiangxi.Mosla is grown in Guangxi, Hunan, Hubei.Elsholtzia 產於江西，河北，河南，安徽。江西產量最大。Mosla 産於廣西，湖南，湖北。Propertiescharacteristics﹕性味﹕Acrid, slightly warm.辛，微溫。Channels meridians entered: 歸經﹕lung, stomach.肺，胃。Medical functions:藥理﹕ 利尿作用: 其利尿作用是因其所含的揮發油，經過腎臟排泄時，能促使腎血管擴張 充血，濾過壓增大。Actions & Indications:主治﹕For treatment of catching cold during summer months, chill and fever, headache with no sweat, stomach ache, vomiting and diarrhea, urination not smooth, edema.主夏月外感風寒，內傷於濕，惡寒發熱，頭痛無汗，脘腹疼痛 ，嘔吐腹瀉，小便不利，水腫。Chemical ingredients:[1]化學成份﹕[1]Flavonoids:黃酮類：5-hydroxy-6,7-dime- thoxyflavone5-羥基-6，7-二甲氧基黃酮5-hydroxy-7,8-dime-thoxyflavone5-羥基-7，8-二甲氧基黃酮5，7-dihydroxy-4-me-thoxyflavone5，7-二羥基 -4-甲氧基黃酮5-hydroxy-7,4- di-methoxyflavanonol5-羥基-7，4二甲氧基黃烷醇5-hydroxy-6-methylflavanone-7- O-α-D-galacopyranoside5-羥基-6-O-α-D-吡喃半乳糖甙Steroids:甾醇類：acacetin-7-O-β-D- glucoside刺槐素-7-O-β-D-葡萄糖甙β-sitosterolβ-谷甾醇β-sitosterol-3-O-β-D-glucoside胡蘿卜甙Triterpenoids三萜類：ursolic acid熊果酸tormentic acid委陵菜酸-α-hydroxyursolic acid2-α-羥基熊果酸2Alkane:烷烴類：6-methyl-trtriacontane6-甲基三十三烷13-cyclohxyl-bexacosane13-環已基二十六烷Daly Dosage:每日用量﹕3~10 g3~10 克Samples of formulae:處方舉例﹕Name of Formula: xiang ru yin (Source:Tai Ping Hui Min He Ji Ju Fang)Application: cold or flu during summer.Composition： xiang ru 10 g, hou po 5 g, bai bian dou 5 g.Cut xiang ru and hou po into small pieces. Stir fry bai bian dou until brown, smash. Put all herb into a warm thermos and pour in boiling water. Cover and keep warm for an hour. Or, it can be boiled on stove with water. Simmer for 45 minutes.  藥方名：香薷飲 《太平惠民和劑局 方》功能主治：解表清 暑，健脾利濕。適用於夏季感冒，夾暑濕証。 處方：香薷10克，厚 樸 5克，白 扁豆 5克。 制法：將香薷、厚 樸剪碎，白 扁豆炒黃搗碎，放入保溫杯中，以沸水沖泡，蓋嚴溫浸1小時。  Modern Research:現代研究﹕ Toxicity & Cautions:毒素與禁忌﹕Do not use in case external deficient with instant sweating or yin deficient with heat. 表 虚自汗， 陰虛有熱者禁用。[1] 《Zhong Hua Ben Cao 中華本草 》 Sponsors' Ads by Google 以下為谷歌所提供贊助者之廣告   A manuscript... writing, translating and proofreading  in progressProblems with website? Please Click here for comment. Not for inquiry      Click here for inquiry    Copyright Notice 按此看關於 版權問題List of Health ProblemsChinese Herb DictionaryToxicity of Some HerbsSide Effect of Some HerbsHerbs that can be toxic to kidneysTraditional Chinese MedicineTCM DiagnosisSamples of FormulaeTerms of Traditional Chinese MedicineAcupuncturecopy right 版權所有Qigong chi kungPrescribed Drug DictionaryEmail our web master for  your suggestion ,not for inquiryBiochemistry DictionaryGeneral Online LibraryQigong classesLecture SlidesResearch LibrarianSearchQigong classesHomeWeather Report Disclaimer　  ",
        "original_url": "http://alternativehealing.org/xiang_ru.htm"
    },
    {
        "Names": {
            "Name": [
                "da qing yan"
            ],
            "Pharmaceutical": [
                "halitum"
            ],
            "Botanical": [
                "halitum"
            ],
            "Chinese": [
                "大青鹽",
                "戎鹽",
                "胡鹽",
                "禿登鹽",
                "陰土鹽",
                "石鹽",
                "羌鹽",
                "青鹽",
                "岩鹽"
            ],
            "Common": [
                "English: halite"
            ],
            "Other name": [
                "rong yan",
                "hu yan",
                "tu deng yan",
                "yin tu yan",
                "shi yan",
                "qiang yan",
                "qing yan",
                "yan yan"
            ],
            "Pronunciation in Korean": [
                "am yeon"
            ],
            "Pronunciation in Japanese": [
                "gan'en (岩塩)"
            ],
            "Pronunciation in Cantonese": [
                "cing1 jim4"
            ],
            "Pinyin Pronunciation": []
        },
        "Type": "Mineral",
        "Geography": [
            "Qing hai (main production area).",
            "shaanxi",
            "Shandong",
            "Anhui",
            "Yunnan",
            "Gansu",
            "Xinjiang",
            "Neimenggu (inner Mongolia)."
        ],
        "Properties": [
            "Salty",
            "Cold"
        ],
        "Meridians": [
            "Heart",
            "Liver",
            "Lung",
            "Kidney",
            "Bladder"
        ],
        "Maladies Treated": [
            "blood in urine",
            "spitting blood",
            "gum and tongue bleeding",
            "swollen red eyes",
            "blepharitis",
            "toothache",
            "constipation"
        ],
        "Medical Function": [],
        "Dosage": "oral: 0.9～1.5 g in decoction, or make into pills, or powder. External use: use appropriate amount.",
        "Samples of Formulae": "Grind into powder and rub the teeth (研末揩牙).\nDissolve in water to gargle (漱口) or wash the eyes (洗目).",
        "Contraindications": "Not to be used in case of edema or vomiting.",
        "Research": "",
        "Notes": "",
        "Chemical Ingredients": {
            "General": [
                "Sodium chloride (NaCl) as the main component.",
                "Potassium chloride (KCl).",
                "Magnesium chloride (MgCl2).",
                "Calcium chloride (CaCl2).",
                "Magnesium sulfate (MgSO4).",
                "Calcium sulfate (CaSO4).",
                "Iron (Fe)."
            ]
        },
        "References": [],
        "Further Reading": [],
        "Original Text": "qing yan, Complementary and Alternative Healing UniversityComplementary and Alternative Healing University  Home 現代中藥辭典Search this siteSearch this siteList of Health ProblemsChinese Herb DictionaryQigongTraditional Chinese Medicine (TCM)AcupuncturePrescribed Drug DictionaryBiochemistry DictionaryLecture SlidesResearch LibrarianGeneral Online LibrarySearchResearch SitesViagraMassage/AcupressureHypnotherapyTell us what you wantNotify Changes & New Information　　　    　      　　    　　　　　                    da qing yan 大青鹽    (in English and Chinese 中英文)by: Joe Hing kwok ChuPharmaceutical name:英文藥名﹕halitumBotanical name:拉丁生物學名﹕halitumPron. in Japanese:日語發音﹕gan'en  (岩塩)Pron. in Korean:韓語發音﹕am yeonPron. in Cantonese::粵音﹕cing1 jim4Other Names:別名﹕rong yan戎鹽hu yan胡鹽tu deng yan禿登鹽yin tu yan陰土鹽shi yan石鹽qiang yan羌鹽qing yan青鹽yan yan岩鹽da qing yan大青鹽Common Name:外文名﹕haliteDistribution:產地﹕Qing hai, shaanxi, Shandong, Anhui, Yunnan, Gansu, Xinjiang, Neimenggu (inner Mongolia).主產於 青海，而其他省份如陝西、山東、安徽、雲南、甘肅、新疆、內蒙古也産。Properties(characteristics)﹕性味﹕salty, cold.鹹，寒。Channels (meridians) entered: 歸經﹕heart, liver, lung, kidney, bladder.心，肝，肺 ，腎，膀胱。Medical functions:藥理﹕  Actions & Indications:主治﹕for treatment of blood in urine, spitting blood, gum and tongue bleeding, swollen red eyes,  blepharitis, toothache, constipation. 主尿血；吐血；齒 舌出血；目赤腫痛；眼瞼發炎；牙痛；大便秘結 研末揩牙；或水化漱口、洗目。Chemical ingredients:化學成份﹕Mainly contains sodium chloride, and other impurities like potassium chloride, magnesium chloride, calcium chloride, magnesium sulfate, calcium sulfate, iron.主含氯化鈉(NaCl)。還 雜質如氯化 鉀(KCl)、氯化鎂(MgCl2)、氯化鈣(CaCl2)、硫酸鎂(MgSO4)、硫酸鈣(CaSO4)和鐵(Fe)等。Daly Dosage:每日用量﹕oral: 0.9～1.5 g in decoction, or make into pills, or powder. External use: use appropriate amount.內服：煎湯，0.9-1.5g；或入丸、散。外用：適量，Samples of formulae:處方舉例﹕ Modern Research:現代研究﹕ Toxicity & Cautions:毒素與禁忌﹕Not to be used in case of edema or vomiting.水腫忌服，嘔吐者禁用。 Sponsors' Ads by Google 以下為谷歌所提供贊助者之廣告   A manuscript... writing, translating and proofreading  in progressProblems with website? Please Click here for comment. (Not for inquiry )     Click here for inquiry    Copyright Notice 按此看關於 版權問題List of Health ProblemsChinese Herb DictionaryToxicity of Some HerbsSide Effect of Some HerbsHerbs that can be toxic to kidneysTraditional Chinese MedicineTCM DiagnosisSamples of FormulaeTerms of Traditional Chinese MedicineAcupuncturecopy right 版權所有Qigong (chi kung)Prescribed Drug DictionaryEmail our web master for  your suggestion (not for inquiry)Biochemistry DictionaryGeneral Online LibraryQigong classesLecture SlidesResearch LibrarianSearchQigong classesHomeWeather Report Disclaimer　Last update: July 19, 2013,  9: 27 p.m. LAH  ",
        "original_url": "http://alternativehealing.org/qing_yan.htm"
    },
    {
        "Names": {
            "Name": [
                "fang feng"
            ],
            "Pharmaceutical": [
                "Radix Saposhnikoviae divaricatae"
            ],
            "Biological": [
                "Siler divaricatum (Turcz.) Benth. et Hook. f.",
                "Saposhnikovia divaricata (Turcz.) Schischk (synonym)",
                "Cachrys seseloides (Hoffm.) M. Bieb.",
                "Johrenia seseloides (Hoffm.) Koso-Pol.",
                "Laser divaricatum (Turcz.) Thell.",
                "edebouriella divaricata (Turcz.) M. Hiroe",
                "Ledebouriella seseloides (Hoffm.) H. Wolff",
                "Rumia seseloides Hoffmann",
                "Stenocoelium divaricatum Turcz.",
                "Trinia dahurica Turcz. ex Bosser",
                "Trinia seseloides (Hoffm.) Ledeb."
            ],
            "Common": [
                "Saposhniovia divaricate root"
            ],
            "Other name": [
                "guan fang feng 關防風",
                "dong fang feng 東防風"
            ],
            "Chinese": [
                "防風"
            ],
            "Pronunciation in Korean": [
                "bangp'ung"
            ],
            "Pronunciation in Japanese": [
                "bafu"
            ],
            "Pronunciation in Cantonese": [
                "fong4 fung3"
            ],
            "Pinyin Pronunciation": []
        },
        "Type": "Herb",
        "Geography": [
            "Northern China (cultivated)",
            "Chang Jiang (Yangtse) River valley (cultivated)"
        ],
        "Properties": [
            "acrid",
            "sweet",
            "slightly warm"
        ],
        "Meridians": [
            "bladder",
            "liver",
            "spleen"
        ],
        "Maladies Treated": [
            "Headache and dizziness due to externally contracted wind-cold",
            "Stiff neck and back pain",
            "Wind-cold-damp type of joint and muscle pain; bone and joint soreness and pain",
            "Spastic and tight limbs",
            "Tetanus"
        ],
        "Medical Function": [
            "Antipyretic",
            "Inhibits pain",
            "Antibiotic",
            "Antiviral",
            "Relieves pain without creating dryness; a moistening herb among wind herbs"
        ],
        "Dosage": "For ridding of wind chill: 3–9 g.\nFor stiff neck and back pain and spastic, tight limbs: more than 20 g are used.",
        "Samples of Formulae": "yu ping feng san 玉屏風散\nsheng yang chu shi fang feng tang 生陽除濕防風湯",
        "Contraindications": "Use care in cases of blood deficient or yinxu (yin deficient) with heat and headache.",
        "Research": "",
        "Notes": "",
        "Chemical Ingredients": {
            "Components": [
                "fangfengalpyrimidine",
                "clemiscosin A",
                "5-hydroxy-8-methoxypsoralen",
                "sec-O-glucosylhamaudol",
                "hamaudol",
                "nodakenetin",
                "prim-O-glucosylcimifugin",
                "cimifugin",
                "4'-O-beta-D-glucosyl-5-O-methylvisamminol",
                "5-O-methylvisamminol",
                "marmesin",
                "adenosine",
                "daucosterol",
                "beta-sitosterol"
            ]
        },
        "References": [
            "[1] Yao Xue Xue Bao. 2007 May;42(5):505-10. 藥學學報 ACTA PHARMACEUTICA SINICA，2007年，五月；42(5):505-10."
        ],
        "Further Reading": [],
        "Original Text": "fang feng, Complementary and Alternative Healing UniversityComplementary and Alternative Healing University  Home 現代中藥辭典Search this siteList of Health ProblemsChinese Herb DictionaryQigongTraditional Chinese Medicine (TCM)AcupuncturePrescribed Drug DictionaryBiochemistry DictionaryLecture SlidesResearch LibrarianGeneral Online LibrarySearchResearch SitesViagraMassage/AcupressureHypnotherapyTell us what you wantNotify Changes & New Information　　　　　　 　　　　　                       　                    fang feng  防風 （in English and Chinese 中英文)  by: Joe Hing kwok ChuPharmaceutical name:英文藥名﹕Radix Saposhnikoviae divaricataeBiological name:拉丁文學名﹕Siler divaricatum (Turcz.) Benth. et Hook. f.  Saposhnikovia divaricata (Turcz.) Schischk   (synonym )Pron. in Japanese:日語發音﹕bafuPron. in Korean:韓語發音﹕bangp'ungPron. in Cantonese粵音﹕fong4 fung3Other Names:別名﹕ guan fang feng 關防風﹐dong fang feng 東防風。Common Name:英文名﹕ Saposhniovia divaricate rootDistribution:產地﹕Being grown in northern part of China and the Chang Jiang River (Yangtse River) valley.在中國北方及長江流域均有栽培。Properties(characteristics)﹕性味﹕acrid, sweet, slightly warm.辛﹐甘，微温。Channels (meridians) entered: 歸經﹕bladder, liver, spleen.膀胱﹐肝﹐脾經。Medical functions:藥理﹕ antipyretic inhibits pain antibiotoc antiviral 解熱﹐ 鎮痛 抗菌 抗病毒Actions & Indications:主治﹕For treatment of:blurry vision and headache due to wind chill;stiff neck and pain back;wind cold and damp type of joint and muscle pain;spastic and tight limbs;tetanus;This herb can relieve pain and does not create dryness. 治:外 感 風 寒 之 頭 痛 目 眩 ，脊 痛 項 強 ，風 寒 濕 痺 ，骨 節 酸 痛 ，四 肢 攣 急 ，破 傷 風 ， 祛 風而不燥。 為風藥中之潤 藥 。Chemical ingredients:化學成份﹕fangfengalpyrimidine  , clemiscosin A , 5-hydroxy-8-methoxypsoralen, sec-O-glucosylhamaudol , hamaudol , nodakenetin , prim-O-glucosylcimifugin , cimifugin , 4'-O-beta-D-glucosyl-5-O-methylvisamminol , 5-O-methylvisamminol , marmesin , adenosine , daucosterol ,  beta-sitosterol [1]防風嘧啶(1),clemiscosin A (2),5-羥基-8-甲氧基補骨脂 素(3),亥茅酚苷(4),亥茅酚(5),紫花前胡苷元(6),升麻素苷(7),升麻素(8),5-O-甲基維斯阿米醇苷(9),5-O-甲基維 斯阿米醇(10),異紫花前胡苷(11),腺苷(12),胡蘿卜苷(13)和β-谷甾醇(14)[1]Dosage:用 量﹕For ridding of wind chill: 3－9 g. Larger amount of more than 20 g are being used in muscle spasm.用於外感風寒：3～9 克。用於脊痛項強 ，四肢攣急，有用多過20 克。Samples of formulae:處方 舉例﹕yu ping feng san 玉屏風散sheng yang chu shi fang feng tang 生陽除濕防風湯Modern Research:現代研究﹕ Cautions:禁忌﹕Use care in cases of blood deficient   or yinxu (yin deficient)  with heat and headache..凡血 虛及陰 虛火旺頭痛者慎用。　[1] Yao Xue Xue Bao. 2007 May;42(5):505-10. 藥學學報 ACTA PHARMACEUTICA SINICA，2007年，五月；42(5):505-10. Synonyms:Cachrys seseloides (Hoffm.) M. Bieb. Johrenia seseloides (Hoffm.) Koso-Pol. Laser divaricatum (Turcz.) Thell. edebouriella divaricata (Turcz.) M. Hiroe Ledebouriella seseloides (Hoffm.) H. Wolff Rumia seseloides Hoffmann Siler divaricatum (Turcz.) Benth. et Hook. f. Stenocoelium divaricatum Turcz. Trinia dahurica Turcz. ex Bosser Trinia seseloides (Hoffm.) Ledeb.Sponsors' Ads by Google 以下為谷歌所提供贊助者之廣告 A manuscript... writing, translating and proofreading  in progressClick here for comment. (Not for inquiry )    Click here for inquiry  Copyright Notice 按此看關於版權問題List of Health ProblemsChinese Herb DictionaryToxicity of Some HerbsSide Effect of Some HerbsHerbs that can be toxic to kidneysTraditional Chinese MedicineTCM DiagnosisSamples of FormulaeAcupuncturecopy right 版權所有Qigong (chi kung)Prescribed Drug DictionaryEmail our web master for  your suggestion (not for inquiry)Biochemistry DictionaryGeneral Online LibraryQigong classesFake Email WarningResearch LibrarianSearchQigong classesHomeWeather Report    DisclaimerLast update: Dec 31, 2011; 10:35 a.m. LAHSearch this site           ",
        "original_url": "http://alternativehealing.org/fang_feng.htm"
    },
    {
        "Names": {
            "Name": [
                "gou wen"
            ],
            "Pharmaceutical": [
                "Folium Gelsemii",
                "Radix Gelsemii",
                "Herba Gelsemii"
            ],
            "Botanical": [
                "Gelsemium elegans Benth.",
                "Gelsemium sempervirens Ait."
            ],
            "Biological": [],
            "Chemical": [],
            "Common": [
                "poison hemlock",
                "graceful jesamine"
            ],
            "Other name": [
                "duan chang cao 斷腸草",
                "ye ge 野葛",
                "da cha teng 大茶藤"
            ],
            "Chinese": [
                "鉤吻"
            ],
            "Pronunciation in Korean": [],
            "Pronunciation in Japanese": [
                "kofun"
            ],
            "Pronunciation in Cantonese": [
                "ngau1 man5"
            ],
            "Pinyin Pronunciation": [
                "gou wen"
            ]
        },
        "Type": "Herb",
        "Geography": [
            "Gelsemium elegans Benth.: Zhejiang, Fujian, Guangdong, Guangxi, Guizhou, Yunnan (China).",
            "Gelsemium sempervirens Ait.: North America."
        ],
        "Properties": [
            "Acrid",
            "Warm",
            "Very toxic"
        ],
        "Meridians": [
            "Heart",
            "Lung",
            "Large Intestine",
            "Small Intestine"
        ],
        "Maladies Treated": [
            "liver cancer",
            "esophagus cancer",
            "gastric cancer and other digestive system tumors",
            "lymphosarcoma",
            "osteosarcoma",
            "skin cancer",
            "wind-damp bi pain (風濕痺痛)",
            "furuncle sores swelling toxins (癤瘡腫毒)",
            "scabies (疥癬)",
            "skin damp eruption (皮膚濕診)",
            "parasites (external use; smash and apply to affected area, remove after half an hour or may irritate the skin and form blisters)",
            "rheumatoid arthritis (external use; smash and apply to affected area)"
        ],
        "Medical Function": [
            "Anti-tumor effect",
            "Sedative and pain arresting effect",
            "Effect on immune system: possible bi-directional modulation (enhancing and inhibiting)",
            "Blood synthesizing effect (promoting hematopoietic function)",
            "Cardiovascular effect: anti-arrhythmia, anti-hypertensive",
            "Pupil dilation effect",
            "Effect on skin: therapeutic effect on neurodermatitis and psoriasis",
            "Fattening farm animal effect",
            "Toxic effect"
        ],
        "Dosage": "daily dosage: 0.1 g to 0.15 g",
        "Samples of Formulae": "External use for parasites and rheumatoid arthritis: Smash the herb and apply to the affected area. Remove after half an hour or it may irritate the skin and form blisters.\n\nFor treatment of rheumatoid arthritis: gou teng (Uncaria stem with hooks) 30 g, fang feng (Saposhnikovia root) 6 g, du huo (Angelica pubescens root) 3 g. Grind into coarse powder, roll with paper, light with fire, and smoke the affected areas.",
        "Contraindications": "Whole plant is toxic. Usually for external use only. The young leaves are especially toxic.\n\nThere is no effective antidote. Commonly used therapy: gastric lavage, promoting vomiting, and diarrhea.",
        "Research": "Rujjanawate C, Kanjanapothi D, Panthong A. Laboratory of Natural Products, Faculty of Medicine, Chulabhorn Research Institute, Research Center at Chiangmai University, Chiangmai University, Chiangmai 50200, Thailand. crujjana@med.cmu.ac.th\n\nGelsemium elegans Benth. (Loganiaceae), a toxic plant indigenous to southeastern Asia, is well known among hill tribes as an effective means for committing suicide. A crude alkaloidal fraction from its leaves was isolated by conventional acid-base extraction. Tests in animals showed that the alkaloids exerted analgesic and anti-inflammatory effects. At a lethal dose, the alkaloids produced violent clonic convulsions that led to respiratory failure. Since the convulsions could be prevented by pentobarbital or diazepam and potentiated by reserpine, it is postulated that the alkaloids act centrally against GABA action. PMID: 14522437 [PubMed - indexed for MEDLIA]",
        "Notes": "Classical and veterinary notes on livestock: 《唐本草》 states: “People or livestock eating its leaves all die; goats that eat it become very fat; pigs eating it can treat heat-type diseases.” 《廣西中藥志》 records: “When a pig has poor appetite, feeding with it can increase appetite.” 《廣東中獸醫常用草藥》 notes: “Gou wen, when regularly given to pigs and sheep, has insecticidal, stomach-strengthening, and fattening effects.” H. Green (former superintendent of the Hong Kong Botanical Garden) reportedly added a small amount of gou wen leaves to pig feed; not only did the pigs not get poisoned, their skin and hair became glossier, showing a nourishing effect.\n\nEditor’s note: Low γ-aminobutyric acid (GABA) can lead to clonic convulsions.\n\nThe Chinese text additionally states: “北美鉤吻 (Gelsemium elegans Benth.) produced in the Americas.”",
        "Chemical Ingredients": [],
        "References": [
            "[1] Guangxi Medical Plants Illustrated《廣西藥植圖志》",
            "[2] http://www.med.sti.gd.cn/Html/mag/Class1237/Class1259/25235920081202104400.html",
            "http://www.ncbi.nlm.nih.gov/entrez/query.fcgi?cmd=Retrieve&db=PubMed&list_uids=14522437&dopt=Abstract"
        ],
        "Further Reading": [],
        "Original Text": "gou wen, Complementary and Alternative Healing UniversityComplementary and Alternative Healing University  Home  現代 中藥辭典Search this siteList of Health ProblemsChinese Herb DictionaryQigongTraditional Chinese Medicine (TCM)AcupuncturePrescribed Drug DictionaryBiochemistry DictionaryLecture SlidesResearch LibrarianGeneral Online LibrarySearchResearch SitesViagraMassage/AcupressureHypnotherapyTell us what you wantNotify Changes & New Information　　    To post your discussion click here.      　                                                gou wen 鉤吻   （in English and Chinese 中英文）   Edited by: Joe Hing kwok ChuPharmaceutical name:英文藥名﹕Folium Gelsemii; Radix Gelsemii; Herba GelsemiiBotanical name:學名﹕Gelsemium elegans  Benth.Gelsemium sempervirens AitPron. in Japanese:日語發音﹕kofunPron. in Korean:韓語發音﹕ Pron. in Cantonese:粵音﹕ngau1 man5Other Names:別名﹕duan chang cao 斷腸草, ye ge 野葛, da cha teng 大茶藤Common Name:英文名﹕poison hemlock, graceful jesamineDistribution:產地﹕Gelsemium elegans  Benth.: Zhejiang, Fujian, Guangdong, Guangxi, Guizhou, Yunnan provinces of China.Gelsemium sempervirens Ait：North America. 浙江，福建，廣東，廣西，貴州，雲南。北美鉤吻 (Gelsemium elegans  Benth.) 産於美洲。Properties(characteristics)﹕性味﹕acrid, warm, very toxic辛﹐溫﹐大毒。Channels (meridians) entered: 歸經﹕heart, lung, large intestine, small intestine.心，肺，大腸，小腸。Medical functions:[2]藥理﹕[2] Anti-tumor effectsedative and pain arresting effectimmune system both directions (enhancing and inhibiting) effectblood synthesizing effectcardiovascular effect: anti arrhythmia, anti hypertensivepupil dilation effecteffect on skin: therapeutic effect on neurodermatitis and psoriasisfattening farm animal effecttoxic effect 抗腫瘤作用鎮痛鎮靜作用對免疫功能的影響 ,鉤吻對免疫功能可能具有雙向調節作用促進造血功能作用心血管作用： 抗心律失常，降壓。擴瞳作用對皮膚病的作用：治療神經性皮炎和銀屑病畜禽復壯作用《唐本草》云�人或畜食其葉皆死,羊食則大肥,豬食之能治熱性病�。《廣西中藥志》記載�當豬胃納不良時,用以飼喂,能增進食欲�。《廣東中獸醫常用草藥》中有�鉤吻,常定期對豬羊服本藥,有殺虫、健胃、肥之效�。 香港植物園前園長格林氏(H.Green)曾將鉤吻葉少許,加於豬的飼料中,非獨食之不曾中毒,且豬的皮毛反增加光澤而呈現一種滋補作用。鉤吻的毒性作用  　　  Actions & Indications:主治﹕1. liver cancer, esophagus cancer, cancer of the digestive tract, lymphatic cancer, skin cancer.2. rheumatoid artritis, bMainly for external use.For getting rid of parasites, rheumatoid arthritis. Smash and apply to affected area. Remove after half an hour or may irritate the skin and form blisters.主治：（1）肝癌、食管癌、胃癌等消化系統腫瘤及淋巴肉瘤、骨肉瘤、皮膚癌等。（2）風濕痺痛、癤瘡腫毒、疥癬、皮膚濕診等。主要外用。 驅蟲﹐治風濕關節炎。搗爛敷於患處。半小時後 除去﹐不然可能生刺激皮膚而水泡。Chemical ingredients:化學成份﹕ Dosage:用量﹕daily dosage: 0.1 g to 0.15 g每日量﹕0.1 克~ 0.15 克。Samples of formulae:處方舉例﹕For treatment of rheumatoid arthritis: gou teng 30 g, fang feng 6 g, du huo 3 g. Grind into coarse powder. Roll with paper. Light with fire and smoke the affected areas.治風濕關節痛方：干斷腸草一兩，防風二錢，獨 活一錢，共研粗末，用紙卷燒煙熏患處。[1]  Modern Research:現代研究﹕Rujjanawate C, Kanjanapothi D, Panthong A.Laboratory of Natural Products, Faculty of Medicine, Chulabhorn Research Institute, Research Center at Chiangmai University, Chiangmai University, Chiangmai 50200, Thailand. crujjana@med.cmu.ac.thGelsemium elegans Benth. (Loganiaceae), a toxic plant indigenous to southeastern Asia, is well known among hill tribes as an effective means for committing suicide.A crude alkaloidal fraction from its leaves was isolated by conventional acid-base extraction. Tests in animals showed that the alkaloids exerted analgesic and anti-inflammatory effects. At a lethal dose, the alkaloids produced violent clonic convulsions that led to respiratory failure. Since the convulsions could be prevented by pentobarbital or diazepam and potentiated by reserpine, it is postulated that the alkaloids act centrally against GABA action.PMID: 14522437 [PubMed - indexed for MEDLIA crude alkaloidal fraction from its leaves was isolated by conventional acid-base extraction. Tests in animals showed that the alkaloids exerted analgesic and anti-inflammatory effects. At a lethal dose, the alkaloids produced violent clonic convulsions that led to respiratory failure. Since the convulsions could be prevented by pentobarbital or diazepam and potentiated by reserpine, it is postulated that the alkaloids act centrally against GABA action.鉤吻是一種有毒之植物。原生長於東南亞。在山地居民中，它是一種知名用來自殺的東西。用常規的酸鹼萃取法在樹葉中提出了一種粗生物鹼。用動物實驗表明這生物鹼有止痛和抗炎作用。在致命的劑量下它能致陣攣性抽搐而能導致呼吸衰竭。此抽搐可用戊基巴比妥或地西泮，加上利血平增進藥效以防止。有認為此生物鹼能對抗腦內 γ-氨基丁酸。（朱興國譯）。看英文原文第一段。编者註：γ-氨基丁酸低下可導致陣攣性抽搐。Toxicity & Cautions:毒素與禁忌﹕Whole plant is toxic. It is usually for external use only. The young leaves are especially toxic.There is no effective antidote. The commonly used therapy is gastric lavage, promoting vomiting and diarrhea. See \"Modern Research\" item above.全株有毒。一般只作外用。新生幼葉尤毒。沒有特效藥 解毒。一般處理方法﹕洗胃﹐催嘔﹐催瀉。看上條 �現代研究�。[1] Guangxi Medical Plants Illustrated《廣西藥植圖志》[2] http://www.med.sti.gd.cn/Html/mag/Class1237/Class1259/25235920081202104400.htmlhttp://www.ncbi.nlm.nih.gov/entrez/query.fcgi?cmd=Retrieve&db=PubMed&list_uids=14522437&dopt=AbstractSponsors' Ads by Google 以下為谷歌所提供贊助者之廣告  A manuscript... writing, translating and proofreading              in progressClick here for comment. (Not for inquiry )        Click here for inquiry   Copyright Notice 按此看關於版權問題List of Health ProblemsChinese Herb DictionaryToxicity of Some HerbsSide Effect of Some HerbsHerbs that can be toxic to kidneysTraditional Chinese MedicineTCM DiagnosisSamples of FormulaeAcupuncturecopy right 版權所有Qigong (chi kung)Prescribed Drug DictionaryEmail our web master for  your suggestion (not for inquiry)Biochemistry DictionaryGeneral Online LibraryQigong classesFake Email WarningResearch LibrarianSearchQigong classesHomeWeather Report    Disclaimer   Last update: Jan 3, 2012; 10:11 p.m. LAH  \n",
        "original_url": "http://alternativehealing.org/gou_wen.htm"
    }
]
