[
  {
    "Names": {
      "Name": ["ze lan"],
      "Pharmaceutical": ["Herba Lycopi"],
      "Biological": [
        "Lycopus lucidus Turcz. var. hirtus Regel",
        "Lycopus lucidus Turcz.",
        "Lycopus Lucidus Turcz. Var. taiwanensis Hayata",
        "Lycopus parviflorus Maxim.",
        "Lycopus Maackianus (Maxim.) Mak.",
        "Lycopus Coreanus Levl.",
        "Lycopus europaeus L.",
        "Eupatorium chinense L.",
        "Eupatorium Japonicum Thunb.",
        "Eupatorium fortunei Turcz.",
        "Eupatorium adenophorum Spreng"
      ],
      "Common": ["bugleweed"],
      "Other name": [
        "ze lan ye 澤蘭葉",
        "mao ye di yi 毛葉地笋",
        "di yi 地笋",
        "gan lu yang 甘露秧",
        "di gua er miao 地瓜兒苗",
        "shui xiang 水香",
        "feng yao 風藥",
        "hu lan 虎蘭",
        "hai er ju 孩兒菊",
        "hu pu 虎蒲"
      ],
      "Chinese": [
        "澤蘭",
        "台灣地瓜兒苗",
        "小花地瓜兒苗",
        "狭葉地瓜兒苗",
        "朝鲜地瓜兒苗",
        "歐地瓜兒苗",
        "華澤蘭",
        "山蘭",
        "佩蘭"
      ],
      "Pronunciation in Korean": ["t'aekuan"],
      "Pronunciation in Japanese": ["takuran"],
      "Pronunciation in Cantonese": ["zaak6 laan4"],
      "Pinyin Pronunciation": []
    },
    "Type": "Herb",
    "Geography": [
      "Lycopus lucidus Turcz. var. hirtus Regel: Liaoning, Jilin, Heilongjiang, Hebei, Shanxi, Neimenggu, Shaanxi, Gansu, Hubei, Hunan, Guangdong, Guangxi, Zhejiang, Anhui, Fujian, Jiangxi, Shandong, Taiwan, Yunnan, Guizhou, Sichuan provinces of China",
      "Lycopus europaeus L.: in Sinkiang",
      "Eupatorium adenophorum Spreng: Yunnan (滇南一帶), originally from Central America and Mexico, now widely distributed in Yunnan area of China"
    ],
    "Properties": ["bitter", "sweet", "acrid", "slightly warm"],
    "Meridians": ["liver", "spleen"],
    "Maladies Treated": [
      "menostasis due to blood stasis",
      "scanty flow in menses",
      "edema after birth",
      "swelling from impact injuries",
      "pain and swelling in joints",
      "injuries",
      "edema due to blood stasis",
      "swelling from boils",
      "lochia after giving birth"
    ],
    "Medical Function": ["promotes menses", "diuretics", "inhibits pain"],
    "Dosage": "10 to 20 g. Concentrated extract: 0.5 to 2 g.",
    "Samples of Formulae": "For promoting ovulation: Name of Formula: Pai Luan Fang",
    "Contraindications": "Use with caution in cases of pregnancies or in cases without blood stasis. \nThe use of ze lan (Eupatorium fortunei Turcz.) and pei lan (Eupatorium japonicum Thunb) are often intermixed in the provinces of Hunan, Fujian, Guangdong, Guizhou. These are different herbs with different applications. They should not be used as substitutes for each other.",
    "Research": "Ze lan can be used to mitigate the damage of the liver caused by carbon tetrachloride, according to researchers Xie Renming et al. at Shaanxi Traditional Chinese Medical School of Shaanxi TCM Research Institute. Ze lan can lower the SGOT (AST) and SGPT (ALT) of laboratory mice that were given carbon tetrachloride for 3 months and resulted cirrhosis of the liver.",
    "Notes": "Eupatorium chinense L. (hua ze lan), Eupatorium Japonicum Thunb (shan lan), and Eupatorium fortunei Turcz. (pei lan) are sometimes incorrectly used as substitutes for ze lan, but are completely different herbs with different medical functions. \nEupatorium adenophorum Spreng (紫莖澤蘭) is not the same plant as ze lan and is not used in Chinese herbal medicine. It originates from central America and Mexico and is now widely distributed in Yunnan area of China, where it is harmful to husbandry.",
    "Chemical Ingredients": {
      "Lycopus species": [
        "hexanal",
        "cis-3-hexen-1-ol",
        "trans-2-hexen-1-ol",
        "hexanol",
        "alpha-thujene",
        "alpha-pinene",
        "sabinene",
        "myrcene",
        "trans-pinocarveol",
        "myrtenol",
        "alpha-cubebin",
        "beta-elemene",
        "{E}-geranylacetone",
        "beta-selinene",
        "nerolidol",
        "stachyose",
        "lycopose",
        "oleanolic acid",
        "betulinic acid",
        "3-epimaslinic acid",
        "euscaphic acid",
        "2-alpha-hydroxyursolic acid",
        "tormentic acid",
        "acacin",
        "linarin"
      ],
      "Eupatorium adenophorum Spreng (not medicinal)": [
        "n-dotriacontane (正三十二烷)",
        "β-sitosterol (β-穀甾醇)",
        "stigmasterol (豆甾醇)",
        "taraxasteryl palmitate (蒲公英醇棕榈酸酯)",
        "taraxasteryl acetate (蒲公英醇乙酸酯)"
      ]
    },
    "References": [],
    "Further Reading": [],
    "Original Text": "ze lan, Complementary and Alternative Healing University\nComplementary and Alternative Healing University  Home  現代 中藥辭典Search this siteList of Health ProblemsChinese Herb DictionaryQigongTraditional Chinese Medicine (TCM)AcupuncturePrescribed Drug DictionaryBiochemistry DictionaryLecture SlidesResearch LibrarianGeneral Online LibrarySearchResearch SitesViagraMassage/AcupressureHypnotherapyTell us what you wantNotify Changes & New Information　　          　                                                      ze lan 澤蘭         \n  (in English and Chinese 中英文) Translated and edited by: Joe Hing kwok ChuPharmaceutical name:英文藥名﹕Herba LycopiBiological name:拉丁文學名﹕Lycopus lucidus Turcz. var. hirtus Regel 毛葉地瓜兒苗 (澤 蘭) Lycopus Lucidus   Turcz.  Var. taiwanensis Hayata; 台灣地瓜兒苗 Lycopus  parviflorus Maxim.小花地瓜兒苗 Lycopus Maackianus（Maxim.)  Mak. 狭葉地瓜兒苗 Lycopus Coreanus  Levl．朝鲜地瓜兒苗 Lycopus europaeus  L. 歐地瓜兒苗 (in Sinkiang) Eupatorium  chinense  L. 華澤 蘭 (hua ze lan, incorrectly used as ze lan. It is a completely difference herb with different medical function) Eupatorium Japonicum Thunb 山蘭 (shan lan, incorrectly used as ze lan. It is a completely difference herb with different medical function) Eupatorium fortunei  Turcz. 佩蘭 (pei lan, incorrectly used as ze lan. It is a completely difference herb with different medical function)Pron. in Japanese:日語發音﹕takuranPron. in Korean:韓語發音﹕t'aekuanPron. in Cantonese粵音﹕zaak6 laan4Other Names:別名﹕ze lan ye 澤蘭葉， mao ye di yi 毛葉地笋 ， di yi 地笋， gan lu yang甘露秧， di gua er miao 地瓜 兒苗﹐ shui xiang 水香﹐ feng yao 風藥﹐ hu lan 虎蘭﹐ hai er ju 孩兒菊﹐ hu pu 虎蒲。Common Name:英文名﹕bugleweedDistribution:產地﹕Lycopus lucidus Turcz. var. hirtus Regel: liaoning, Jilin, Heilongjiang, hebei, shanxi, Neimenggu,Shaanxi, Gansu, Hubei, Hunan, Guangdong, Guangxi, Zhejiang,Anhui, Fujian,Jiangxi, Shandong, Taiwan, Yunnan,Guizhou, Sichuan provinces of China. 分佈於遼寧﹐ 吉林﹐黑龍江﹐河北﹐山西﹐内蒙古，陕西﹐甘肅﹐湖北﹐湖南﹐廣東﹐廣西﹐浙江﹐安徽﹐福建﹐江西﹐山東﹐台灣﹐雲南﹐貴州﹐四川等省區。Properties(characteristics)﹕性味﹕bitter, sweet, acrid, slightly warm.味苦﹐甘 ﹐辛，性微溫。Channels (meridians) entered: 歸經﹕liver, spleen.入肝﹐脾二經。Medical functions:藥理﹕ promotes menses, diuretics, inhibits pain.通經，利尿，鎮痛。Actions & Indications:主治﹕Actions & Indications:For menostasis due to blood stasis. scanty flow in menses, edema after birth, swelling from impact injuries, pain and swelling in joints,  injuries, edema due to blood stasis, swelling from boils, lochia after giving birth.主治﹕血淤經 閉，月經稀發，經痛，產後浮腫，跌打瘀腫，關節扭傷腫痛，鬱血性水腫， 癰腫，產後惡露。Chemical ingredients:化學成 份﹕1. hexanal, [cis-3-hexen-1-ol], 9trans-2-hexen-1-ol], [trans-2-hexen-1-ol], -1[hexanol], [alpha-thujene], [alpha-pinene], [sabinene], [myrcene], [trans-pinocarveol],  [myrtenol], [alpha-cubebin],  [beta-elemene],[{E}-geranylacetone], [beta-selinene], [nerolidol].2. [stachyose], [lycopose].(1)3. [oleanolic acid], [betulinic acid], [3-epimaslinic acid], [euscaphic acid] (2), [2-alpha-hydroxyursolic acid], [tormentic acid]{3}4. [acacin, linarin].Dosage:用 量﹕10 to 20 g. Concentrated extract: 0.5 to 2 g.10～20克；濃縮中藥：0.5～2克Samples of formulae:處方舉例﹕For promoting ovulation: Name of Formula: Pai Luan Fang Modern Research:現代研 究﹕ze lan can be used to mitigate the damage of the liver caused by carbon tetrachloride, according to researchers Xie Renming et al at Shaanxi Traditional Chinese Medical School of Shaanxi TCM Research Institute. Ze lan can lower the \nSGOT (AST) and SGPT (ALT) of laboratory mice that were given carbon tetrachloride for 3 months and resulted cirrhosis of the liver.\n\nCautions:\n注意﹕\nUse with caution in cases of pregnancies or in cases without blood stasis The use ze lan (Eupatorium fortunei Turcz.) and pei lan (Eupatorium japonicum Thunb) are often intermixed in the provinces of Hunan, Fujian, Guangdong, Guizhou.. These are different herbs with different applications. Should not use as substitutes for each other.\n懷孕期間﹐或無血 淤者，小心應用。\n佩蘭 (Eupatorium fortunei Turcz.) 與山蘭 (Eupatorium japonicum Thunb)存在混用情况。在湖南，福建，廣東，貴州等省部分地區，以菊科草本植物佩蘭 (Eupatorium fortunei Turcz).或山蘭 (E. japonicum Thunb.) 當作澤蘭用 。佩蘭或山蘭二藥功能主治 與澤蘭不同，不宜混用。菊科佩蘭與 澤蘭最易識別之 處为草 質茎圆柱形。\n　\nNote: Eupatorium adenophorum Spreng is not the same plant being used in Chinese herb medicine. It was originated from central America and Mexico. Now it is widely distributed in Yunan area of China. It is harmful to husbandry. The chemical ingredients include: 正三十二烷n-dotriacontane(1),β-穀甾醇 β-sitosterol  （2），豆甾醇 stigmasterol(3)， 蒲公英醇棕榈酸酯 taraxasteryl palmitate（4），蒲公英醇乙酸酯 taraxasteryl acetate(5) .\n \n紫莖澤蘭 (Eupatorium adenophorum Spreng)不是藥用澤蘭。 原產中美墨西哥，现 在滇南一带廣泛分佈，對林﹐牧業生產造成嚴重危害。從紫茎澤蘭的葉和花序中 ，分到九個單體，經詳細光譜解析和與標準品對照,其中五个成分的化學勾結分別為 ：正三十二烷n-dotriacontane(1),β-穀甾醇 β-sitosterol  （2），豆甾醇 stigmasterol(3)， 蒲公英醇棕榈酸酯 taraxasteryl palmitate（4），蒲公英醇乙酸酯 taraxasteryl acetate(5) 。\n \nSponsors' Ads by Google 以 下為谷歌所提供之廣告 \n \n\nA manuscript... writing, translating and proofreading              in progress\nProblems with website? Please Click here for comment. (Not for inquiry )  \nClick here for inquiry  \n \nCopyright Notice 按此看關於版權問題\nList of Health Problems\nChinese Herb Dictionary\nToxicity of Some Herbs\nSide Effect of Some Herbs\nHerbs that can be toxic to kidneys\nTraditional Chinese Medicine\nTCM Diagnosis\nSamples of Formulae\nAcupuncture\ncopy right\n \n版權所有\nQigong (chi kung)\nPrescribed Drug Dictionary\nEmail our web master for  your suggestion (not for inquiry)\nBiochemistry Dictionary\nGeneral Online Library\nQigong classes\nFake Email Warning\nResearch Librarian\nSearch\nQigong classes\n\nHome\nWeather Report\n Disclaimer\n \n\n \n \n\n\n\n\n\n\n\n\n\n\n\n\n\n\n\n\n\n\n\n\n\n\n\n\n\nLast update: Jan 14, 2013; 11:40 p LAH\n  \n",
    "original_url": "http://alternativehealing.org/ze_lan.htm"
  },

  {
    "Names": {
      "Name": ["qu mai"],
      "Pharmaceutical": ["Herba Dianthi"],
      "Biological": ["Dianthus superbus L."],
      "Chinese": [
        "瞿麥",
        "野麥",
        "巨句麥",
        "大蘭",
        "山瞿麥",
        "石竹子花",
        "洛陽花",
        "十樣景花",
        "竹節草",
        "鋸句麥",
        "大菊",
        "大半",
        "石竹",
        "南天竺草"
      ],
      "Common": ["fringed pink", "lilac pink", "large pink"],
      "Other name": [
        "ye mai",
        "ju ju mai",
        "da lan",
        "shan qu mai",
        "shi zhu zi hua",
        "luo yang hua",
        "shi yang jing hua",
        "zhu jie cao",
        "da ju",
        "da ban",
        "shi zhu",
        "nan tian zhu cao",
        "Qu mai is also pronounced as ju mai"
      ],
      "Pronunciation in Korean": ["kumack"],
      "Pronunciation in Japanese": ["kubaku"],
      "Pronunciation in Cantonese": ["goei3 mak6"],
      "Pinyin Pronunciation": []
    },
    "Type": "Herb",
    "Geography": [
      "Mainly being produced in Hebei, Henan, Liaoning, Hubei, Jiangxi, Zhejiang provinces of China"
    ],
    "Properties": ["Bitter", "Cold"],
    "Meridians": ["Heart", "Small intestine", "Bladder"],
    "Maladies Treated": [
      "Gonorrhea",
      "Edema",
      "Urinary tract inflammation",
      "Difficulty in urination",
      "Irregular menses",
      "Amenorrhea",
      "Dystocia",
      "Carbucle"
    ],
    "Medical Function": [
      "Methyl 3,4-dihydroxybenzoate showed potent anti-pregnancy activity, given 200 μg/kg to pregnant rat can terminate pregnancy at its early stage of pregnancy"
    ],
    "Dosage": "6 to 12 g. Large dosage can be up to 24 g.",
    "Samples of Formulae": "bie jia jian wan\n\nguo luo qu mai wan\n\nZhongjing formula: bie jia jian wan (Soft-shelled turtle shell decoction pill), guo luo qu mai wan (Trichosanthes and qu mai pill)",
    "Contraindications": "Not to use in case of pixu (spleen deficient) or shenxu (kidney deficient) or during pregnancy. In early stages of pregnancy it can induce an abortion.",
    "Research": "Methyl 3,4-dihydroxybenzoate showed potent anti-pregnancy activity, given 200 μg/kg to pregnant rat can terminate pregnancy at its early stage of pregnancy.[1]",
    "Notes": "",
    "Chemical Ingredients": [
      "Emodin (大黄素)",
      "Methyl 3,4-dihydroxybenzoate (大黄素甲醚, 3，4-二羟基苯甲酸甲酯, methyl 3,4-dihydroxybenzoate)",
      "3-(3′，4′-dihydroxyphenyl) propionate (3-(3′，4′-二羟基苯基)丙酸甲酯)",
      "β-sitosterol-3-O-glucoside (β-谷甾醇苷)",
      "emodin-8-O-glucoside (大黄素-8-O-葡萄糖苷)",
      "isoorientin (異紅草素)",
      "Dianthus saponin A~D (瞿麥皂甙A～D), with one of the saponins as gypsogenin (絲石竹皂甙元)",
      "phycion",
      "emodin",
      "methyl 3,4-dihydroxybenzoate",
      "methyl 3-(3,4-dihydroxyphenyl) propionate",
      "β-sito-sterol-3-O-glucoside",
      "emodin-8-O-glucoside",
      "isoorientin",
      "dianthus saponin A~D (one of the saponins is gypsogenin)"
    ],
    "References": [
      "[1] Studies on the Chemical Constituents of Fringed Pink (Dianthus superbus); by: Department of Pharmacy， Nanjing Zhongshan Hospital (Nanjing 210014)　Wang Xianghai; College of Chemistry and Chemical Engineering, Nanjing University　Chao Qirong; College of Chinese Materia Medica, China Pharmaceutical University　Huang Hao; Department of Pharmacology， China Pharmaceutical University　Wang Ting"
    ],
    "Further Reading": [],
    "Original Text": "qu mai, Complementary and Alternative Healing University\n\n\n\n\nComplementary and \n    Alternative Healing University\n    \n \n\n\n\n\n\n中藥詞典                 \n    Chinese Herb Dictionary    \n     Search \n    this site    \n    在本網站找資料\n\n\n\n\n\n\n\n\n\n\n\n\n\n\nSearch this \n        site\n\n\nList \n        of Health Problems\n\n\n\n\n\n\n        Chinese Herb Dictionary\n\n\n\n\n\nQigong\n\n\n\n\n\n\n        Traditional Chinese Medicine (TCM)\n\n\n\n\n\n\n        Acupuncture\n\n\n\n\n\n\n        Prescribed Drug Dictionary\n\n\n\n\n\nBiochemistry Dictionary\n\n\n\n\n\nLecture Slides\n\n\n\n\n\nResearch Librarian\n\n\n\n\n\n\n        General Online Library\n\n\n\n\n\nResearch \n        Sites\n\n\n\n\n\n\n        Viagra\n\n\n\n\n\n\n        Massage/Acupressure\n\n\n\n\n\nHypnotherapy\n\n\n\n\n\nTell us what you want\n\n\n\n\n\nNotify Changes \n        & New Information\n\n\n\n \n\n\n\n\n\n \n\nqu mai 瞿麥   \n(in English and Chinese\n    中英文)\nby: Joe Hing kwok Chu\n\n\nPharmaceutical name:\n英文藥名﹕\nHerba Dianthi\n\nBotanical name:\n學名﹕\nDianthus superbus L.\n\nPron. in Japanese:\n日語發音﹕\nkubaku\nPron. in Korean:\n韓語發音﹕\nkumack\n\nPron. in Cantonese\n粵音﹕\ngoei3 mak6\n\nOther Names:\n別名﹕\nye mai, ju ju mai, da lan, shan qu mai, shi zhu zi hua, luo yang hua, shi yang jing hua, \n        zhu jie cao, ju ju mai, da ju, da ban, shi zhu, nan tian zhu cao. (Qu \n        mai is also pronounced as ju mai)\n        野麥、巨句麥、大蘭、山瞿麥、石竹子花、洛陽花、十樣景花，竹節草、鋸句麥、大菊、大半、石竹、南天竺草 。\n\nCommon Name:\n英文名﹕\nfringed pink, lilac pink, and large pink.\n\nDistribution:\n產地﹕\nmainly being produced in  Hebei, Henan, Liaoning, Hubei, Jiangxi, Zhejiang provinces of China.\n主產於河北、河南、遼寧、湖北、江蘇、浙江等地。\n\nProperties\n(characteristics)﹕\n性味﹕\nbitter, cold.\n味苦、寒。\n\nChannels (meridians) entered: \n歸經﹕\nheart, small intestine, bladder.\n歸心、小腸、膀胱經\nMedical functions:\n藥理﹕ \n \nActions & Indications:\n主治﹕\ngonorrhea, edema, urinary tract inflammation, difficulty in urination, irregular menses, amenorrhea, dystocia, carbucle\n淋病，水腫，膀胱炎，尿道炎，小便不利，月經不調，經閉，難產，癰腫。\n\nChemical ingredients:[1]\n化學成份﹕[1]\n大黄素甲醚 \n 大黄素 \n3，4-二羟基苯甲酸甲酯, \n3-(3′，4′-二羟基苯基)丙酸甲酯 \nβ-谷甾醇苷 \n大黄素-8-O-葡萄糖苷 \n異紅草素 \n\n\n          瞿麥皂甙A～D \n          (one of the saponins is (gypsogenin) \nphycion ， \nemodin , \nmethyl 3,4-dihydroxybenzoate ， \nmethyl 3-(3,4-dihydroxyphenyl) propionate ， \nβ-sito-sterol-3-O-glucoside  \nemodin-8-O-glucoside\n\nisoorientin\n\ndianthus \n    saponin A~D \n          (其中之一的皂苷元為絲石竹皂甙元)\n \nDosage:\n用量﹕\n6 to 12 g. Large dosage can be up to 24 g.\n6~12 克。 大剤量可用至24克。\nSamples of formulae\n:處方舉例﹕\n\nbie jia jian wan\nguo luo qu mai wan\n仲景方： 鱉甲煎丸 栝蔞瞿麥丸\n\nModern Research:\n現代研究﹕\nmethyl 3,4-dihydroxybenzoate showed potent anti-pregnancy activity, given 200 μg/kg to pregnant rat can terminate pregnancy at its early stage of pregnancy.[1]\n3，4-二羥基苯甲酸甲酯 (200 μg/kg) 對受孕大鼠具有明顯抗早孕作用。[1]\n\nToxicity & Cautions:\n毒素與禁忌﹕\nNot to use in case ofpixu (spleen deficient) \n        orshenxu \n        (kidney deficient)   or during pregnancy. In early stages \n        of pregnancy it can induce an abortion.\n脾虛或腎虛者或懷孕\n        期間忌用。懷孕初期如用瞿麥可能導致流産。\n　\n[1] Studies on the Chemical Constituents of Fringed Pink (Dianthus superbus); by:\n\nDepartment of Pharmacy， Nanjing Zhongshan Hospital (Nanjing 210014)　Wang Xianghai\nCollege of Chemistry and Chemical Engineering, Nanjing University　Chao Qirong\nCollege of Chinese Materia Medica, China Pharmaceutical University　Huang Hao\nDepartment of Pharmacology， China Pharmaceutical University　Wang Ting\n\n\n\n\n\nSearch this \n    site \n\n\nProblems with website? Please \n\nClick \n    here for comment. (Not for inquiry )    \n    \n\n\nClick \n    here for inquiry \n\n\n\nCopyright Notice \n\n按此看關於版權問題\n\n\n\nA manuscript... writing, translating and proofreading  in progress\n\n\nSponsors' Ads by Google \n    以下為谷歌 所提供之廣告\n\n\n\n\n\n\n\n\nList \n        of Health Problems\n\n\n\n\n        Chinese Herb Dictionary\n\n\n\n\nToxicity of Some Herbs\n\n\n\nSide Effect of Some Herbs\n\n\n\nHerbs that can be toxic to kidneys\n\n\n\n\n        Traditional Chinese Medicine\n \n\n\nTCM Diagnosis\n \n\n\n        Samples of Formulae\n\n\n\n\n        Terms of Traditional Chinese Medicine\n\n\n\n        Acupuncture\n\n\n\n\n\ncopy right\n \n\n\n版權所有\n\n\n\nQigong \n        (chi kung)\n\n\n\n\n        Prescribed Drug Dictionary\n\n\n\n\n        Email our web master for  your suggestion (not for inquiry)\n\n\n\nBiochemistry Dictionary\n\n\n\n\n\nGeneral Online Library\n\n\n\nQigong \n        classes\n\n\n\nFake \n        Email Warning\n\n\n\nResearch Librarian\n\n\n\nSearch\n\n\n\n\n\nQigong classes\n\n\n\n\n\n\nHome\n\n\n\n\n        Weather Report\n\n\n\n\n        Disclaimer\n\n\n\n\n\n\nLast update: Oct 7, 2013; 11 p.m. LAH\n \n\n\n\n\n\n\n\n\n",
    "original_url": "http://alternativehealing.org/ju_mai.htm"
  },
  {
    "Names": {
      "Name": ["di long"],
      "Pharmaceutical": ["Lumbricus"],
      "Biological": [
        "Allolobophora calinosa (Savigny) trapezoides (Ant. Duges)",
        "Pheretima asiatica (縞蚯蚓又名：土地龍)",
        "Pheretima aspergillum (Perricr) (三環毛蚓又名：廣地龍)"
      ],
      "Chinese": ["地龍", "蚯蚓", "廣地龍", "乾地龍", "土地龍"],
      "Common": ["earth worm", "lumbricus"],
      "Other name": [
        "qiu yin 蚯蚓",
        "guang di long 廣地龍",
        "gan di long 乾地龍"
      ],
      "Pronunciation in Korean": ["chiyong"],
      "Pronunciation in Japanese": ["jiryu"],
      "Pronunciation in Cantonese": ["dei6 lung4"],
      "Pinyin Pronunciation": []
    },
    "Type": "Animal",
    "Geography": ["Guangdong", "Guangxi", "Fujian", "throughout China"],
    "Properties": ["salty", "cold"],
    "Meridians": ["stomach", "bladder", "liver", "lung", "spleen"],
    "Maladies Treated": [
      "high fever and spasms",
      "convulsions",
      "painful joints due to arthritis and paralysis",
      "heat type of wheezing/asthma",
      "injuries and pain",
      "edema and difficulty in urination"
    ],
    "Medical Function": [
      "anti-histamine and calming asthma",
      "expand bronchi",
      "antipyretic",
      "sedative and anti-convulsion",
      "lower blood pressure",
      "diuretic effect"
    ],
    "Dosage": "For decoction: 4 g ~12 g.\nIn powder form: 2 g to 4 g. Concentrated extract: 0.5 ~ 2 g.",
    "Samples of Formulae": "Wheezing cough due to lung heat: di long (earth worm), ma huang (ephedra), xing ren (apricot kernel), huang qin (baical skullcap root).\nLower back and leg pain due to physical injuries: di long (earth worm), dang gui (angelica sinensis), rou gui (cinnamon bark).\nHot painful urinary dysfunction with stones, urine retention, or edema: di long (earth worm), niu xi (achyranthes root), dong kui zi (malva seed), jin qian cao (lysimachia / gold coin grass).\nHypertension with liver yang ascending: di long (earth worm), dan shen (salvia miltiorrhiza), ci shi (magnetitum).",
    "Contraindications": "Large amount can be toxic.\nSymptoms include headache, dizziness, palpitation, difficulty in breathing, and initially the blood pressure goes up and then goes down.\nSometimes the digestive tract may show bleeding.",
    "Research": "",
    "Notes": "",
    "Chemical Ingredients": {
      "": [
        "lumbrofefbrine",
        "lumbritin",
        "terrestro-lumbrolysin",
        "hypoxanthine",
        "xanthine",
        "adenine",
        "guanine",
        "choline",
        "guanidine",
        "ornithine",
        "lysine",
        "serine",
        "proline",
        "glycine",
        "cystine",
        "valine",
        "phenylalanine",
        "tryptophan",
        "neutral lipids",
        "cholesterol",
        "free fatty acids",
        "triglycerides",
        "complex lipids",
        "phosphatidylcholine",
        "phosphatidyl ethanolamine",
        "phosphatidylserine",
        "dehydrogenase isoenzyme",
        "esterase isoenzyme"
      ]
    },
    "References": [],
    "Further Reading": [],
    "Original Text": "di long, earth worm, lumbricus, Complementary and Alternative Healing UniversityComplementary and Alternative Healing University  Home  現代 中藥辭典Search this siteList of Health ProblemsChinese Herb DictionaryQigongTraditional Chinese Medicine (TCM)AcupuncturePrescribed Drug DictionaryBiochemistry DictionaryLecture SlidesResearch LibrarianGeneral Online LibrarySearchResearch SitesViagraMassage/AcupressureHypnotherapyTell us what you wantNotify Changes & New Information　　      　                                          di long 地龍 Edited by: Joe Hing kwok ChuA manuscript... writing and translation in progressPharmaceutical name:英文藥名 ﹕LumbricusBotanical name:學名﹕ Allolobophora calinosa (Savigny) trapezoides (Ant. Duges)Pheretima asiatica (縞 蚯蚓又 名：土地龍)Pheretima aspergillum (Perricr) (三 環毛蚓 又名：廣地龍)Pron. in Japanese:日語發音﹕jiryuPron. in Korean:韓語發音﹕chiyongPron. in Cantonese:粵音﹕dei6 lung4Other Names:別名﹕qiu yin 蚯蚓, guang di long 廣地龍, gan di long 乾地龍Common Name:英文名﹕earth worm, lumbricusDistribution:產地﹕Guangdong, Guangxi, Fujian, and throughout ChinaProperties(characteristics)﹕性味﹕salty, cold.鹹，寒。Channels (meridians) entered: 歸經﹕stomach, bladder, liver, lung, spleen.入胃，膀胱﹐脾，肝 ，腎經。Medical functions:藥理﹕ anti-histamine and calming asthmaexpand bronchiantipyreticsedative and anti-convulsionlower blood pressurediuretic effect 抗組織胺和平喘作用擴張支氣管解熱作用鎮靜抗驚厥作用降血壓作用利尿作用Actions & Indications:主治﹕high fever and spasms, convulsions,painful joints due to arthritis and paralysis,heat type of wheezing/asthma,  (single item of ground up di long can be used )injuries and painedema and difficulty in urination 高熱抽搐等症。風濕痹痛，半身不遂等症。熱症哮喘。可研末單用。跌打疼痛小便不利，水腫等症。Chemical ingredients:化學成份﹕lumbrofefbrine, lumbritin, terrestro-lumbrolysin, hypoxanthine, xanthine, adenine, guanine, choline, guanidine, ornithine, lysine, serine, proline, glycine, cystine, valine, phenylalanine, tryptophan, neutral lipids, cholesterol, free fatty acids, triglycerides, complex lipids, phosphatidylcholine, phosphatidyl ethanolamine, phosphatidylserine, dehydrogenase isoenzyme, esterase isoenzyme.Dosage:用量﹕for decoction: 4 g ~12 g.  In powder form: 2 g to 4 g. Concentrated extract: 0.5 ~ 2 g.4 g ~12 g，煎服。研末吞服，每次 2 g to 4 g。 濃 縮中藥：0.5～2 gSamples of formulae:處方舉例﹕Wheezing cough due to lung heat: di long, ma huang , xing ren , huang qin.Lower back and leg pain due to physical injuries: di long, dang gui, rou guihot painful urinary dysfunction with stones, urine retention, or edema: di long, niu xi,  dong kui zi,  jin qian cao.hypertension with liver yang ascending : di long, dan shen  , ci shi (magnetitum)肺熱喘咳：地龍，麻 黃，杏仁，黃 芩。  腰腿受傷疼痛：地龍，當 歸 , 肉 桂   。尿道熱痛，結石，尿潴留，或水腫：地龍，牛膝 ，冬葵 子 ，金錢草。血壓高而有肝陽 上亢証：地龍，丹參，磁石。Modern Research:現代研究﹕ Toxicity & Cautions:毒素與禁忌﹕large amount can be toxic. Symptoms include headache, dizziness, palpitation, difficulty in breathing, and initially the blood pressure goes up and then goes down, sometimes the digestive tract may show bleeding.大劑量會有毒。症狀包括頭痛﹐頭暈 ﹐心悸﹐呼吸困難﹐血壓初始上昇然後下降﹐有時消化道會有出血症狀。　Sponsors' Ads by Google 以下為谷歌所提供贊助者之廣告  A manuscript... writing, translating and proofreading              in progressClick here for inquiry  Copyright Notice 按此看關於版權問題List of Health ProblemsChinese Herb DictionaryToxicity of Some HerbsSide Effect of Some HerbsHerbs that can be toxic to kidneysTraditional Chinese MedicineTCM DiagnosisSamples of FormulaeTerms of Traditional Chinese MedicineAcupuncturecopy right 版權所有Qigong (chi kung)Prescribed Drug DictionaryEmail our web master for  your suggestion (not for inquiry)Biochemistry DictionaryGeneral Online LibraryQigong classesFake Email WarningResearch LibrarianSearchQigong classesHomeWeather Report    Disclaimer   Last update: Dec 22; 2009; 3:47 p.m. LAH  ",
    "original_url": "http://alternativehealing.org/di_long.htm"
  },
  {
    "Names": {
      "Name": ["qi zi", "gou qi zi"],
      "Pharmaceutical": ["Fructus Lycii"],
      "Biological": [
        "Lycium barbarum L.",
        "Lycium chinense Mill",
        "Lycium exsertum A. Gray"
      ],
      "Common": [
        "Chinese wolfberry fruit",
        "lycium fruit",
        "goji berries",
        "desert-thorn",
        "Christmas berry",
        "wolfberry",
        "matrimony vine",
        "Duke of Argyll's tea tree"
      ],
      "Other name": [
        "di gu pi (bark of the plant)",
        "gou qi ye (leaves of the plant)"
      ],
      "Chinese": ["枸杞子", "地骨皮", "枸杞葉"],
      "Pronunciation in Korean": ["kugicha"],
      "Pronunciation in Japanese": ["kukoshi"],
      "Pronunciation in Cantonese": ["gau2 gei2 zi2"],
      "Pinyin Pronunciation": []
    },
    "Type": "Herb",
    "Geography": [
      "Ningxia (L. barbarum)",
      "Gansu (L. barbarum)",
      "Qinghai (L. barbarum)",
      "Inner Mongolia (L. barbarum)",
      "Hebei (L. chinense)",
      "America (Lycium exsertum A. Gray, often sold as 'Lycium barbarum')",
      "Zhong Ning Area (noted for best quality of gou qi zi)",
      "Shandong (noted for flavonoid content analysis)",
      "Xinjiang (products sometimes misrepresented as Ningxia product)",
      "Xizang (Tibet; products sometimes misrepresented as Ningxia product)"
    ],
    "Properties": ["Sweet", "Neutral"],
    "Meridians": ["Liver", "Lung", "Kidney"],
    "Maladies Treated": [
      "Deficiency of Kidney marked by spermatorrhea",
      "Weak and sore lower back, knees",
      "Dizziness, blurred vision",
      "Diabetes",
      "Premature white hair",
      "Consumption ('虚勞')",
      "Night vision, blurred vision",
      "Pain in back, leg, and stomach",
      "The leaves and bark: hot flashes and cough due to consumption",
      "The leaves: deficiency, to get rid of anxiety",
      "The leaves: pain in joints and skin",
      "The leaves: removes toxin from boils"
    ],
    "Medical Function": [
      "Nourishes and tonifies the liver and kidney",
      "Regulates and improves immune system; can significantly increase phagocyte percentage and index, improve lymphocyte transformation rate and phagocyte rate in patients with impaired immunity caused by radiotherapy or malignant tumors, thus boosting immune capability",
      "Anti-aging properties: study on 43 healthy senior adults taking 50g gou qi zi per day for 10 days showed improved immune indicators (IgA, IgG, lymphocyte transformation rate), elevated cAMP, decreased cGMP, healthy cAMP/cGMP ratios, and elevated testosterone. Indicators showed reversal toward youthfulness",
      "Lowers blood lipids",
      "Elevates testosterone secretion",
      "Strengthening (body)",
      "Protects liver function, inhibits deposition of fat in liver cells, promotes regeneration of liver cells (water infusion of gou qi zi had mild effect against carbon tetrachloride-induced liver damage)",
      "Anti-cancer properties",
      "Stimulates estrogen secretion",
      "Promotes recovery of hematopoietic function; clinically considered for co-use with chemotherapy drugs to prevent/relieve leukopenia",
      "Improves white blood cell counts during chemotherapy",
      "Fruit, stems, and leaves lower blood sugar",
      "Fruit, stems, and leaves lower blood pressure",
      "Promotes uterine weight increase in mature and immature mice",
      "Antioxidant",
      "Enhances memory",
      "Lutein and zeaxanthin prevent macular degeneration caused by free radicals or external causes",
      "Improves diabetic retinopathy",
      "Protects against Abeta (beta-amyloid) neurotoxicity",
      "Toxicity is minimal",
      "The extract of Lycium barbarum demonstrates neuroprotective effects: pre-treatment with aqueous extract reduced LDH release and Abeta peptide-activated caspase-3-like activity in rat cortical neurons exposed to beta-amyloid peptides; neuroprotection showed a dose-dependent effect over a wide dose range; reduced phosphorylation of JNK-1 and c-Jun substrates (animal model)",
      "Different cultivation regions result in significant variation in flavonoid (rutin) content among gou qi zi: Ningxia (4853.0mg/kg), Hebei (4993.3mg/kg), Inner Mongolia (3613.0mg/kg), Shandong (2680.0mg/kg)"
    ],
    "Dosage": "Root, bark, and fruit: 6 to 15 g per day.\nLeaves are used as a vegetable.",
    "Samples of Formulae": "For spermatorrhea: gou qi zi (Lycium fruit) 6 g, wu wei zi (Schisandra fruit) 2 g, rou cong rong (Cistanche stem) 2 g, ren sheng (Ginseng root) 2 g, fu ling (Poria) 3 g, shu di huang (Prepared Rehmannia root) 3 g, da zao (Jujube) 3 g, sheng jiang (Fresh ginger) 2 g, gan cao (Licorice root) 2 g. Cook in 600 cc of water and simmer to 300 cc. Make into 3 servings per day. (source: He Han Yao Yin Yong Fang)\n\nFor improving sperm count and sperm activity: wu zi yan zong wan (Five Seed Progeny Pill)\n\nFor premature white hair: gou qi zi (Lycium fruit) 15 g, rice 30 g. Make into porridge. Use daily. (folk formula)\n\nFor dry eyes and blurry eyesight: retinitis, glaucoma, geriatric cataract, optic nerve atrophy, detachment of retina, sequela of concussion, high blood lipids: qi ju di huang wan (Lycium Fruit, Chrysanthemum, and Rehmannia Pill)",
    "Contraindications": "Not to use in cases of external heat (such as cold or flu, swelling with inflammation), or spleen deficient (pixu) with dampness and loose stool or diarrhea.\nAn increased INR value was noted with concurrent use of warfarin and qi zi. Thus, combination of L. barbarum L. and warfarin should be avoided.\nIf artificially colored, or treated with alum (aluminum potassium sulfate) or sulfur for processing, may be toxic or lower nutritional value. Alkaline-treated berries can have reduced nutritional value and a bitter taste. Long-term use of alum can cause osteoporosis, bone loss, and memory loss.",
    "Research": "Protective effect of Lycium barbarum on cancer drug, Doxorubicin-induced Cardiotoxicity [1]\n\nNeuroprotective effects of anti-aging oriental medicine Lycium barbarum against beta-amyloid peptide neurotoxicity (Yu MS, Leung SK, Lai SW, Che CM, Zee SY, So KF, Yuen WH, Chang RC. Laboratory of Neurodegenerative Diseases, Department of Anatomy, The University of Hong Kong):\nAs aged population dramatically increases in these decades, efforts should be made on the intervention for curing age-associated neurodegenerative diseases such as Alzheimer's disease (AD). Natural plant extracts of Lycium barbarum are well-known to exhibit anti-aging effects. Primary rat cortical neurons exposed to Abeta peptides resulted in apoptosis and necrosis. Pre-treatment with extract isolated from Lycium barbarum significantly reduced the release of lactate dehydrogenase (LDH). It also attenuated Abeta peptide-activated caspase-3-like activity. The extract elicited a typical dose-dependent neuroprotective effect, with an effective dosage broader than that of lithium chloride (LiCl). Abeta peptides induce a rapid activation of c-Jun N-terminal kinase (JNK) by phosphorylation. Pre-treatment of aqueous extract markedly reduced the phosphorylation of JNK-1 (Thr183/Tyr185) and its substrates c-Jun-I (Ser 73) and c-Jun-II (Ser 63). Study on anti-aging herbal medicine like L. barbarum may open a new therapeutic window for the prevention of AD. [PubMed: 16139464]\n\nNote: Abeta peptide (amyloid β peptides) is the precursor of β-amyloid which is toxic for the neurons. Lactate dehydrogenase (LDH) is an enzyme that catalyzes the inter-conversion of lactate and pyruvate. It is abundant in kidney, skeletal muscle, liver and myocardium and in other tissues. It appears in elevated concentrations when these tissues are injured.\n\n<<中國中醫藥科技>>2004年 第11卷 第02期  作者: 張穎, 張立睦, 周紅英, 齊永秀, 蘇雪惠,   期刊-核心期刊 QCode : zgzyykj200402018. Study objective: Determine flavonoid content in gou qi zi from different origins. Method: Using rutin as standard, spectrophotometric method to measure flavonoid content in gou qi zi from Ningxia, Hebei, Inner Mongolia, Shandong. Results: Average content: Ningxia 4853.0mg/kg, Hebei 4993.3mg/kg, Inner Mongolia 3613.0mg/kg, Shandong 2680.0mg/kg; recovery rate 100.9%; RSD 1.21%. Conclusion: Flavonoid content varies significantly by origin.\n\nRutin (蘆丁) - Also known as: 芸香甙, 維生素 P, 紫槲皮甙, Rutoside, Violaquereitrin. Chemical name: 4H-1-Benzopyran-4-one ,3-[(6-O-(6-deoxy-α-L-mannopyranosyl)-β-D-glucopyranosyl]oxy]-2-(3,4-dihydroxyphenyl)-5,7-dihydroxy-. Molecular formula and weight: C27H30O16:610.51",
    "Notes": "The variety commonly found in nurseries and grown in America is Lycium exsertum A. Gray, which has shorter fruit compared to Lycium barbarum. Plants sold in the US are often incorrectly labeled as Lycium barbarum. Gou qi leaves are usually available in Chinese groceries and are consumed as a vegetable or as soup greens.\n\nBest quality gou qi zi is from Zhong Ning Area in Ningxia province, China. Many products marketed as Ningxia product originate from Xinjiang or Xizang (Tibet) and are sold at higher prices.\n\nQuality identification details (中寧枸杞辨認七法):\n- Shape: oblong, not round, not thin (中寧枸杞呈橢圓扁長而不圓，呈長形而不瘦)\n- Petal area: obviously white; if artificial color has been added, the petal areas will be tinted. Artificial coloring indicates lower quality and can be toxic (中寧枸杞果臍白色明顯)\n- Color: red or purplish red except for petal area (顏色呈紅色或紫紅色)\n- Dryness: water content should be 12-13%. Seeds should not clump together. Test by squeezing together then releasing pressure - good quality seeds should become loose when pressure is released (中寧枸杞乾果含水量在12％-13％之間，包裝不結塊，就是擠壓成塊，失壓後能自動鬆散)\n- Sinking test: when dropped in water, should float for some time and not sink quickly (中寧枸杞放入清水杯子中在短時間內不下沉)\n- Taste: sweet, no acrid taste or other off-flavors (中寧枸杞皮薄肉厚，口感純正，甘甜，無苦澀味和其它異味)\n- Smell: fragrant once package is opened (中寧枸杞一旦打開密封的包裝就有一般特殊的香味)\n\nProcessing warnings:\n- Watch for white crystalline residue under sunlight - may indicate alum or sulfur treatment\n- If soaked in alum water: herbs feel coarse, dry, and stiff to touch; taste is sour/astringent when licked\n- National Quality Inspection Agency of China has banned sulfur dioxide for preservation\n- Some farms use saturated alkaline water to shorten drying time - these berries appear bright red and attractive but have greatly reduced nutritional value and bitter taste\n- Merchants sometimes sell cheaper Xizang (Tibetan) or Xinjiang gou qi zi as Ningxia gou qi zi for higher prices\n\nNutritional notes:\n- Lutein and zeaxanthin help protect eyes from damaging sunrays and prevent macular degeneration as people age\n- Gou qi leaves are sold in Chinese grocery markets as vegetables and can be used in soups\n\nSide effects of alum (aluminum potassium sulfate or aluminum sulfate):\n- Calcium depletion through excretion (urine and stool) caused by aluminum sulfate\n- Depletes phosphorus in the body; long-term use can bring phosphorus to unnaturally low levels\n- Can cause osteoporosis, bone loss, and memory loss\n\nChemical source reference: 中文化學成份來源：浙江中醫大學",
    "Chemical Ingredients": {
      "quercetin-rhamno-di-hexoside (largest mass fraction in seed)": "438.6 microg/g",
      "quercetin-3-O-rutinoside": "281.3 microg/g",
      "dicaffeoylquinic acid isomers": "250.1 microg/g",
      "chlorogenic acid": "237.0 microg/g",
      "quercetin-di-(rhamnohexoside)": "117.5 microg/g",
      "quercetin-di-(rhamno)-hexoside": "116.8 microg/g",
      "kaempferol-3-O-rutinoside": "97.7 microg/g",
      "isorhamnetin-3-O-rutinoside": "72.1 microg/g",
      "p-coumaric acid": "64.0 microg/g",
      "caffeic acid": "23.7 microg/g",
      "vanillic acid": "22.8 microg/g",
      "betaine": "",
      "beta-sitosterol": "",
      "linoleic acid": "",
      "physalien": "",
      "cryptoxanthin": "",
      "atropine": "",
      "hyoscyamine": "",
      "scopoletin": "",
      "trace minerals": "",
      "amino acids": "",
      "ash": "1.7%",
      "Physalein": "",
      "Zeaxanthin dipalmitate": "",
      "Every 100g of seed contains: carotene": "3.96mg",
      "lutein": "<30mg",
      "zeaxanthin": "30mg",
      "thiamine": "0.23mg",
      "riboflavin": "0.33mg",
      "nicotinic acid": "1.7mg",
      "ascorbic acid": "3mg",
      "calcium": "150mg",
      "phosphorus": "67mg",
      "iron": "3.4mg",
      "water extract pH": "5.5",
      "AcДaHoB (Russia) seed analysis": "",
      "fat": "17.21%",
      "oil refractive index": "1.4743",
      "total acidity": "1.28",
      "total iodine": "119.2",
      "sugar": "22-52%",
      "protein": "13-21%",
      "coarse fat": "8-14%"
    },
    "References": [
      "[1] Ann Pharmacother. 2001 Oct;35(10):1199-201.",
      "[2] J Pharm Biomed Anal. 2010 Feb 5;51(3):549-56. Epub 2009 Sep 11.",
      "[3] Exp Gerontol. 2005 Aug-Sep;40(8-9):716-27.",
      "<<中國中醫藥科技>>2004年 第11卷 第02期  作者: 張穎, 張立睦, 周紅英, 齊永秀, 蘇雪惠,   期刊-核心期刊 QCode : zgzyykj200402018",
      "Yu MS, Leung SK, Lai SW, Che CM, Zee SY, So KF, Yuen WH, Chang RC. Neuroprotective effects of anti-aging oriental medicine Lycium barbarum against beta-amyloid peptide neurotoxicity. Laboratory of Neurodegenerative Diseases, Department of Anatomy, The University of Hong Kong, Hong Kong. PMID: 16139464 [PubMed - indexed for MEDLINE]"
    ],
    "Further Reading": [
      "http://www.paper.edu.cn/index.php/default/famous/famous_detail/2087/",
      "http://www.tuftsmedicalcenter.org/apps/Healthgate/Article.aspx?chunkiid=21763#ref16",
      "PMID: 16139464 - Neuroprotective effects of anti-aging oriental medicine Lycium barbarum against beta-amyloid peptide neurotoxicity",
      "Ann Pharmacother. 2001 Oct;35(10):1199-201",
      "J Pharm Biomed Anal. 2010 Feb 5;51(3):549-56. Epub 2009 Sep 11",
      "Exp Gerontol. 2005 Aug-Sep;40(8-9):716-27"
    ],
    "Original Text": "qi zi, gou qi zi,Lycium barbarum L., Lycium chinense MillComplementary and Alternative Healing University   中藥詞典                 Chinese Herb Dictionary      Search this site     在本網站找資料Search this siteList of Health ProblemsChinese Herb DictionaryQigongTraditional Chinese Medicine (TCM)AcupuncturePrescribed Drug DictionaryBiochemistry DictionaryLecture SlidesResearch LibrarianGeneral Online LibraryResearch SitesViagraMassage/AcupressureHypnotherapyTell us what you wantNotify Changes & New Information                                                                                                                                                                                  gou_qi_zi.htm lycium_barbarum.htm qi_zi.htm    gou qi zi (fruit) 枸杞子          (in English and Chinese 中英文)di gu pi (bark of the plant) 地骨皮gou qi ye (leaves of the plant) 枸 杞葉Translated and edited by: Joe Hing Kwok ChuTo enlarge, click on the picture.Pharmaceutical name:英文藥名Fructus LyciiBiological name:拉丁文學名Lycium barbarum L.or L chinense MillPron. in Japanese:日語發音﹕kukoshiPron. in Korean:韓語發音﹕kugichaPron. in Cantonese:粵音﹕gau2 gei2 zi2Common Name:英文名：Chinese wolfberry fruit, lycium fruit, goji berries, desert-thorn, Christmas berry, wolfberry ,  matrimony vine, and Duke of Argyll's tea tree.Distribution:分佈：Ninxia, Gansu, Qinghai, Inner Mongolia (L. barbarum), Hebei (L. chinense)寧夏﹐甘肅﹐ 青海﹐內蒙 (L. barbarum), 河北 (L. chinense)Properties (characteristics)：性味：sweet, neutral甜﹐ 平。Channels (meridians) entered:歸經：liver, lung, kidney肝﹐肺﹐腎。Actions & Indications:主治：nourishes and tonifies the liver and kidney; alleviates sore back, leg, and stomach; improves night vision, blurred vision, diabetes, premature white hair and consumption. The leaves and bark can be used for hot flashes and cough due to consumption.  The leaves can be used for tonifying deficiency and to get rid of anxiety, pain in joints and skin, and the toxin from boils.有補腎，滋陰，養肝， 明目，益氣等功 效。適用於腎虧遺精，腰膝酸軟，頭暈目眩，兩眼昏花，糖尿病，鬚髮早白，虚勞。其葉與皮可用於陣 熱，勞咳。葉亦可用於補虚，去煩，關節或皮膚疼痛，瘡毒。Medical Function:藥理：Medical Function:improves and regulates immune system.anti-aging properties  : a study on 43 healthy senior adults in which each ate 50 grams of qi zi continuously for 10 days (as a therapy period). The blood tests showed that immune indicators IgA, IgG and lymph cell conversion rate were elevated, cAMP increased, cGMP decreased. The ratios of cAMP/cGMP were elevated to healthy levels. Testosterone were elevated.lowers blood lipids,elevate level of testosteroneprotects liver function, prevents fatty livercontains anti-cancer propertiessimulates estrogensimproves white blood cell counts during chemotherapyfruit, stems and leaves can lowers blood sugarfruit, stems and leaves can lower blood pressureanti-oxidanttaking gou qi zi can increase the weight of the uteri of mature and immature mice.enhance memoryits chemical ingredients lutein and zeaxanthin can prevent macula degeneration caused by free radicals or external causes.improves condition of diabetic retinopathy [3]against Abeta (beta-amyloid) neurotoxicitytoxicity is minimal藥理：對機體免疫功能的作用 ﹕能顯著提高吞噬細胞的吞噬百分率和吞噬指數，還可提高因放 射療法或惡性腫 瘤所導致的免疫功能下降的患者的淋巴細胞轉化率，和吞噬細胞的吞噬率，以提高患者的免疫能力。抗衰老之作用 ﹕曾實驗四十三 例無明顯疾病的志願老人，每日嚼服50g，連續十天為一療程，療程結束後抽血檢查，免疫功能指標可見IgA﹐IgG 和淋巴 細胞轉換率明顯提高，反應有向年輕化逆轉的傾向。降血脂促進高睪丸酮之分泌，起著強壯 的作用。對肝臟的保護作用﹕枸杞水浸液 對四氯化碳引起的肝損害，有輕微的抑制脂肪在肝細胞內沈積，和促進肝細胞新生的作用。抗癌作用促進雌激素之分泌。對造血系統的影響 ﹕枸杞可促 進造血機能恢復，臨床可以考慮與化療藥物合用，預防和緩解白細胞減少症。枸杞 葉與枸杞子 都有降血糖作用枸杞 葉與枸杞子 都有降血壓作用對子宮的作用 ﹕枸杞子對未成 熟或成熟的小鼠，均有明顯的促進子宮增重的作用。抗氧化作用增強記憶力其玉 蜀黍黄素與 葉黃素對於眼睛因為自由基或是外在因素所造成的視網膜黃斑部退化症有預防作 用改善糖尿病的視網膜病變對抗β-澱粉樣蛋白( Abeta)之神經毒性【3】毒性小Chemical ingredients:化學成份：,quercetin-rhamno-di-hexoside was present in largest mass fraction (438.6microg/g), followed by quercetin-3-O-rutinoside (281.3microg/g), dicaffeoylquinic acid isomers (250.1microg/g), chlorogenic acid (237.0microg/g), quercetin-di-(rhamnohexoside) (117.5microg/g), quercetin-di-(rhamno)-hexoside (116.8mug/g), kaempferol-3-O-rutinoside (97.7microg/g), isorhamnetin-3-O-rutinoside (72.1microg/g), p-coumaric acid (64.0microg/g), caffeic acid (23.7microg/g) and vanillic acid (22.8microg/g).[2]betaine甜菜碱β-sitosterolβ-穀甾醇linoleic acid亞麻油酸physalien酸漿果紅素cryptoxanthin隱黃素atropine阿托品hyoscyamine莨菪鹼scopoletin香豆素trace minerals微量礦物 質amino acids氨基酸ash: 1.7%其灰分约1.7%Physalein:酸漿红素  Zeaxanthin 玉蜀黍黄素  dipalmitate 雙 棕 櫚 酸酯Every 100 g of seed contains:每100g枸杞子 含 ﹕carotene胡萝卜素3.96mglutein <30 痢葉黃素 <30 痢zeaxanthin 30 mg玉蜀黍黄素 30 mgthiamine维生素B10.23mg 或稱硫胺素riboflavin维生素B20.33mg(核 黃素)nicotinic acid烟酸1.7mgascoric acid维生素C3mgcalium 150mg鈣 150mgphosperous 67mg磷67mgiron 3.4mg鐵 3.4mgwater extract pH5.5浸出液pH5.5According to AcДaHoB of Russia, the seed contain:蘇 聯 AcДaHoB等分析, 種 子 含 :fat 17.21%脂肪油量為 17.21%oil refractive Index: 1.4743油折光率為 1.4743total acidity: 1.28酸價為 1.28total iodine: 119.2碘價為 119.2sugar 22～52%含總糖量22～52%protein 13～21%蛋白质13～21%coarse fat 8～14%粗脂肪8～14%Dosage:用量：root, bark and fruit: 6 to 15 g per day.  Leaves are used as a vegetable.地骨皮，杞子：6 ～15克葉作菜用。Samples of formulae:處方舉例：For spermatorrhea: gou qi zi 6 g, wu wei zi 2 g, rou cong rong 2 g, ren sheng 2 g, fu ling 3 g, shu di huang 3 g, da zao 3 g, sheng jiang 2 g, gan cao 2 g. Cook in 600 cc of water and simmer to 300 cc. Make into 3 servings per day. (source He Han Yao Yin Yong Fang)For improving sperm count and sperm activity: wu zi yan zong wanFor premature white hair: gou qi zi 15 g, rice 30 g. Make into porridge. Use daily. (folk formula)For dry eyes and blurry eye sight: retinitis, glaucuma, geriatric cataract, optic nerves atrophy, detachment of retina, sequela of concussion, high blood lipids: qi ju di huang wan遺精：枸杞子 6 克， 五味子  2 克， 肉從蓉 2 克，人参 2 克，茯苓 3 克，熟 地黄 3 克，大棗 3 克，生姜 2 克，甘草 2 克.。加水600毫升。煎成300毫 升。分三次服。（和漢藥應用方）增强精 虫活性與數量：五 子衍宗丸少年白 髮：枸杞子15克，米30克。煮成粥。每日服用。（民間驗方）乾眼與視力 模糊：視網 膜炎 ，青光眼，老年性白內障，視神經乳頭炎，視神經萎縮，視網膜脫落等，腦震蕩後遺 症，高脂血症等 。：杞 菊地黃丸Modern Research:現代研究：neuro-protective effect 保護神經系统 作用Protective effect of Lycium barbarum on the cancer drug, Doxorubicin-induced Cardiotoxicity [1]Caution:禁忌﹕Not to use in cases external heat, (like cold or flu,  swelling with inflammation), spleen deficient (pixu) with dampness and loose stool or diarrhea.An increased INR value was noted with concurrent use of warfarin and qi zi.Thus, combination of L. barbarum L. and warfarin should be avoided.  [1]外感實 熱﹐脾 虛濕滯及腸滑便溏者忌服。發現與華佛林（warfarin) 同用 INR 值會增高。所以两者不應同用。[1]Quality:品質鑒別﹕The better quality qi zi is from Zhong Ning Area. Quality identification:Shape: oblong--not round--but not thin.Color: red or purplish red except for petals.Petal area: obviously white. If artificial color has been added, the areas where the petals are will be tinted. Artificial coloring is a sign that the seed is of lower quality. Artificial coloring can be toxic.Dryness: the water content should be about 12% to !3%. The seeds should not lump together. Test for dryness by  squeezing them together and then releasing pressure.  Good quality seeds should not lump together; they should become loose when the pressure is released.Taste: sweet. The seeds should not taste acrid.Smell: the smell is fragrant once the package is opened.Sinking test: When dropped into water, the seeds should  float for sometimes and should not sink in a short time.Watch for glister under the sun. It can be residue of alum or sulfur that has been sublimated from smoking where most sulfur has turned to sulfur dioxide and a small portion can be sublimated to the fruits. If alum has been added the herb feel coarse and dry to touch, and will taste tart or/and sour by licking the herb.National Quality Inspection Agency of China has banned the use of sulfur dioxide to preserve the fruit.Addendum:  Carefully examine under the light to see if there is white crystal powder . If so, it may be soaked in alum water (harmful to health); or smoked with sulfur. The white powdery crystal may be the sublimation of sulfur or the residue of alum. If the berries have been soaked in alum water, they feel stiff and the taste can be sour, astringent. The side effects of alum (aluminum potassium sulfate) are osteoporosis, bone loss and memory loss. To shorten the drying time, some small farms often use saturated alkaline water to soak the berries before drying. These processed berries seem to be bright red in color and very attractive, but their nutritional value can greatly reduced. Alkaline treated berries possess a bitter tasteIn China, gou qi zi from Ningxia province is considered the best. There are merchant selling Xizang （Tibetan) gou qi zi and Xinjiang gou qi zi as Ningxia gou qi zi to fetch better prices. 中 寧枸杞辨認七法： 中寧枸杞已被引種到全國十五個省市自治區，但無論引種到何方，均由於缺少中寧所特有的種植枸杞子的土壤條件和地理環境，使中寧枸 杞同其他引種產 區生產出的枸杞產品外觀及營養成份含量上有明顯的區別。  看果形：中寧枸杞呈橢圓扁長而不圓，呈長形而不瘦。 看果臍：中寧枸杞果臍白色明顯。 看頗色：顏色呈紅色或紫紅色。 看結塊：中寧枸杞乾果含水量在12％-13％之間，包裝不結塊，就是擠壓成塊，失壓後能 自動鬆散。 試下沉：中寧枸杞放入清水杯子中在短時間內不下沉。 品味道：中寧枸杞皮薄肉厚，口感純正，甘甜，無苦澀味和其它異味。 聞氣味：凡是中寧枸杞一旦打開密封的包裝就有一般特殊的香味。中寧枸杞子辨認资 料来源：摘自�美食導報�2002﹐11﹐15國 家 質 檢 總 局 嚴 禁 用 硫 磺 加 工 。補充﹕在 光照下，小心察看杞子上有無附著白色的結晶。那可能是浸過明礬水(對健康有害)﹔或是熏硫磺時﹐部份硫磺昇華結晶 於杞 子上。 浸過明 礬水的﹐觸 手會有僵硬﹐乾澀的感 覺﹔ 如輕舔藥材表面，會有酸﹐澀的味道。明礬 （硫酸鋁鉀(鉀鋁礬))的副作用可使鈣質與磷質流失而導致骨骼疏鬆，記憶減退。為了縮短晾晒時間，有些小農場往往用超飽和的濃鹼水 浸泡枸杞，然後再加晾晒。這樣處理過的枸杞看來色澤鮮紅，十分誘人，但其營養萬分已大大降低。用鹼水處理過的枸杞有苦澀感。有些藥商把價錢較便宜的西藏枸杞子與新疆枸杞子當作寧夏枸杞子賣，以取得較高價錢。看關於二 氧化硫處理過的乾貨。Note: the variety which is popularly sold in nurseries and grown in America is Lycium exsertum A. Gray. The fruit are not as long as Lycium barbarum which is grown in western part of China and is mainly used in traditional Chinese medicine. Usually the plants sold in America are labeled incorrectly as Lycium barbarum.在美國一般在苗圃所賣的和一般所種的是 Lycium exsertum A. Gray。 這種杞子比起寧夏杞子較短。一般在美國賣的枸杞子樹苗都錯誤地標為 Lycium barbarum.  [1]Ann Pharmacother. 2001 Oct;35(10):1199-201.[2]J Pharm Biomed Anal. 2010 Feb 5;51(3):549-56. Epub 2009 Sep 11.[3] Exp Gerontol. 2005 Aug-Sep;40(8-9):716-27.The side effect of alum (aluminum potassium sulfate or aluminum sulfate) can includecalcium depletion through excretion (both urine and stool) caused by aluminum sulfate.It can also depletes phosphorus in the normal body, and long-term use can bring phosphorusdown to an unnaturally low level which may cause adverse effect on memory.中 文 化 學 成 份 來 源 ﹕ 浙 江 中 醫 大 學 。Lutein and zeaxanthin help protect the eyes from damaging sunrays. As people get older, these carotenoids decline in the eyes, and may cause macular degeneration. Note: Gou qi leaves are usually sold in Chinese grocery market as vegetable. The fresh leaves can be used as soup vegetable.　More info in Chinese. 中文網站。.The following study has been published.Neuroprotective effects of anti-aging oriental medicine Lycium barbarum against beta-amyloid peptide neurotoxicity.Yu MS, Leung SK, Lai SW, Che CM, Zee SY, So KF, Yuen WH, Chang RC.Laboratory of Neurodegenerative Diseases, Department of Anatomy,The University of Hong Kong, Hong Kong.As aged population dramatically increases in these decades, efforts should be made on the intervention for curing age-associated neurodegenerative diseases such as Alzheimer's disease (AD). Natural plant extracts of Lycium barbarum are well-known to exhibit anti-aging effects. We therefore hypothesized that they exhibit neuroprotectiveeffects against toxins in aging-related neurodegenerative diseases. In this study, we aimed to investigate whether extracts from L. barbarum have neuroprotective effects against toxicity of fibrillar Abeta(1-42) and Abeta(25-35) fragments. Primary rat cortical neurons exposed to Abeta peptides resulted in apoptosis and necrosis. Pre-treatment with extract isolated from L. barbarum significantly reduced the release of lactatedehydrogenase (LDH). In addition, it attenuated Abeta peptide-activated caspases-3-like activity. The extract elicited a typical dose-dependent neuroprotective effect. Effective dosage of this extract was wider than that of a well-known western neuroprotective medicine lithium chloride (LiCl). We have further examined the underlying mechanismsof the neuroprotective effects. In agreement with other laboratories, Abeta peptides induce a rapid activation of c-Jun N-terminal kinase (JNK) by phosphorylation. Pre-treatment of aqueous extract markedly reduced the phosphorylation of JNK-1 (Thr183/Tyr185) and itssubstrates c-Jun-I (Ser 73) and c-Jun-II (Ser 63). Taken together, we have proved our hypothesis by showing neuroprotective effects of the extract from L. barbarum. Study on anti-aging herbal medicine like L. barbarum may open a new therapeutic window for the prevention of AD.PMID: 16139464 [PubMed - indexed for MEDLINE]Note:Abeta peptide (amyloid β peptides) is the precursor of β-amyloid which is toxic for the neurons.Lactate dehydrogenase (LDH) is an enzyme that catalyzes the inter-conversion of lactate and pyruvate. It is abundant in kidney, skeletal muscle, liver and myocardium and in other tissues..It appears in elevated concentrations when these tissues are injured.c-Jun N-terminal kinase:see Alzheimer's disease. <<中國中醫藥科技>>2004年 第11卷 第02期  作者: 張穎, 張立睦, 周紅英, 齊永秀, 蘇雪惠,   期刊-核心期刊 QCode : zgzyykj200402018 目的:測定不同產地枸杞子中黃酮的含量.方法:以蘆丁為標准品,用分光光度法測定寧夏，河北，內蒙，山東枸杞子中黃酮的含量.結果:其平均含量分別為4853.Omg/kg，4993.3mg/kg，3613.0mg/kg，2680.0mg/kg;回 收率為100.9%;RSD為1.21%.結論:不同產地枸杞子中黃酮含量存在一定差異. 蘆丁 Rutin 異名：芸香甙 ,維生素 P, 紫槲皮甙,  Rutoside , Violaquereitrin 化學名： 4H-1-Benzopyran-4-one ,3 -[(6-O-(6-deoxy-α-L-mannopyranosyl)-β-D- glucopyranosyl ]oxy]-2-(3,4-dihydroxyphenyl)-5,7-dihydroxy- 分子式及分子量： C27H30O16:610.51Search this siteProblems with website? Please Click here for comment. (Not for inquiry )    Click here for inquiryCopyright Notice 按此看關於版權問題A manuscript... writing, translating and proofreading  in progressSponsors' Ads by Google 以下為谷歌 所提供之廣告 List of Health ProblemsChinese Herb DictionaryToxicity of Some HerbsSide Effect of Some HerbsHerbs that can be toxic to kidneysTraditional Chinese Medicine TCM Diagnosis Samples of FormulaeTerms of Traditional Chinese MedicineAcupuncturecopy right 版權所有Qigong (chi kung)Prescribed Drug DictionaryEmail our web master for  your suggestion (not for inquiry)Biochemistry DictionaryGeneral Online LibraryQigong classesFake Email WarningResearch LibrarianSearchQigong classesHomeWeather ReportDisclaimerLast update: Dec 2, 2013; 10:00 a.m. LAH   ",
    "original_url": "http://alternativehealing.org/qi_zi.htm"
  }
]
