[
    {
        "Names": {
            "Name": [
                "tian hua fen",
                "天花粉",
                "gua lou gen"
            ],
            "Pharmaceutical": [
                "Radix Trichosanthis",
                "Semen Trichosanthis",
                "Pericarpium Trichosanthis"
            ],
            "Biological": [
                "Trichosanthes kirilowii Maxim.",
                "Trichosanthes japonica Regel."
            ],
            "Chemical": [],
            "Common": [
                "trichosanthes root",
                "Chinese cucumber root"
            ],
            "Other name": [
                "tian hua fen originally was called gua lou gen"
            ],
            "Chinese": [
                "天花粉",
                "瓜蔞根",
                "花粉"
            ],
            "Pronunciation in Korean": [
                "chonhwabun"
            ],
            "Pronunciation in Japanese": [
                "tenkafun"
            ],
            "Pronunciation in Cantonese": [
                "tin1 faa1 fan2"
            ],
            "Pinyin Pronunciation": []
        },
        "Type": "Herb",
        "Geography": [
            "throughout China, especially in Shandong, Hebei, Shanxi, Shaanxi"
        ],
        "Properties": [
            "root: sweet, slightly bitter, slightly cold",
            "gua lou pi (pericardium trichosanthis): caramel-like smell, bland, slightly sour"
        ],
        "Meridians": [
            "Lung",
            "Stomach"
        ],
        "Maladies Treated": [
            "Lung heat, dissolves phlegm: for cough with thick phlegm",
            "Treatment of chlorion epithelioma (choriocarcinoma)",
            "Hydatidiform mole (hydatidiform tumor, trophoblastic disease, gestational trophoblastic neoplasia)",
            "Heat disease vexation thirst (热病烦渴)",
            "Lung heat dry cough (肺热燥咳)",
            "Internal heat wasting thirst (内热消渴)",
            "Ulcer swelling and toxicity (疮痈肿毒)",
            "Expels pus",
            "Anti-ulcer effect: reduces ulcers caused by acid"
        ],
        "Medical Function": [
            "Clears lung heat, dissolves phlegm",
            "Expels pus",
            "Rid of toxicity",
            "Trichosanthes can increase coronary blood flow",
            "Injection of trichosanthes bark (gua lou pi) decoction and alcohol precipitation concentrates on in vitro guinea pig hearts can expand coronary artery and can empower coronary blood flow by about 60% on acute myocardial ischemia and can have a significant protective effect. The strength of coronary artery expansion effect of the different parts of the herb is: Trichosanthes skin (gua lou pi) > gua lou xiang > Trichosanthes sub > Trichosanthes Ren > Trichosanthes shell",
            "Tian hua fen has antiarrhythmic effects",
            "Tian hua fen can inhibit cardiac function",
            "Tian hua fen can significantly reduce heart rate, left ventricular pressure peak, dp/dtmax, Rdp/dtmaxVmax and Vpm indicators, but also significantly reduce arterial pressure peak, DPB and MAP",
            "Tian hua fen has expectorant effect. The active ingredient is the total amino acids of the skin of the fruit",
            "Tian hua fen has purgative effect: the intensity is Trichosanthes Ren > Trichosanthes skin > Tian hua fen cream",
            "Possesses anticancer effects",
            "Possesses hypoxia tolerance",
            "Tian hua fen inhibits platelet aggregation, and its active ingredient is tian hua fen acids",
            "Tian hua fen can significantly reduce the hematocrit and blood viscosity",
            "Tian hua fen can elevate blood sugar",
            "Tian hua fen can inhibit intestinal contractions",
            "Tian hua fen possesses antibacterial effect on a variety of bacteria, including cocci, bacilli, and Audubon Ang's small spores rubrum (奥杜盎氏小芽孢癬菌)",
            "Anti HIV effect",
            "Tian hua fen can significantly reduce gastric acid secretion and gastric acid concentration, and have anti-ulcer effect, but also reduce ulcers caused by acid",
            "Tian hua fen effects on macrophages: administered at low concentrations, enhances the role of macrophages, but at high concentrations of short duration also show enhancing effect, however for a long duration (72 hours) can cause damage to the macrophages",
            "Tian hua fen has anti-aging effect",
            "Tian hua fen possesses the effects of abortion and inducing delivery",
            "In large dosage and prolonged administration it can inhibit the immune system",
            "Inhibits protein synthesis"
        ],
        "Dosage": "9–15 g",
        "Samples of Formulae": "chai hu gui zhi gan jiang tang (柴胡桂枝乾薑湯)\nSan Zhong Kui Jian Tang (散腫潰堅湯)\n\nFor hydatidiform tumor: Tian zao combination formula: tian hua fen (天花粉) 60 mg, ya zao jiao (椰枣胶) 25 mg ground into fine powder and put into capsules. Insert into vagina once every 5 to 7 days. Treated 7 patients: among those who had hydatidiform tumors (5 patients) all healed. Two patients with chorion-epithelioma had no effect. Using tian zao combination formula and chemotherapy: in 19 patients, 13 healed, 6 ineffective. Using tian zao combination formula and chemotherapy plus surgery: in 65 patients, 54 healed, 11 ineffective.",
        "Contraindications": "Not to be used by pregnant women or in cases of pixu (spleen deficiency) or weixu (stomach deficiency).\nLarge dosages and/or long-term usage can be toxic to kidneys.",
        "Research": "Tian hua fen possesses anti-cancer effect.\nTian hua fen has anti-HIV effect.\nTrichosanthin is being used clinically in inducing delivery and it possesses effects of anti-hydatidiform tumor (葡萄胎) and anti-HIV.\nKarasurin possesses the effects of abortion and inducing delivery in pregnant laboratory mice. It also inhibits the immune system.\nModern application: For hydatidiform tumor: see Samples of Formulae for detailed study results (7 patients: 5 healed, 2 not effective; combination with chemotherapy: 13/19 healed; combination with chemo and surgery: 54/65 healed). [4]",
        "Notes": "Source (Chinese): Zhong Hua Ben Cao 中華本，Zhong Yao Da Zhi Dian 中藥大辭典.\nHydatidiform tumor alternative names: hydatidiform mole, trophoblastic disease, gestational trophoblastic neoplasia.\nDefinition: A hydatidiform tumor occurs when a fetus is not able to fully form in the uterus and the fetal tissue becomes a tumor.",
        "Chemical Ingredients": [
            "Protein: Trichosanthin (天花粉蛋白) with molecule weight of 24,000, isoelectric point 9.4, a simple protein without phosphorous acid groups. Used clinically in inducing delivery. Possesses anti-hydatidiform tumor and anti-HIV effects.",
            "Karasurin (堕胎蛋白), molecule weight 28,000, possesses effects of abortion and inducing delivery in pregnant laboratory mice. Inhibits immune system.",
            "α-momorcharin (α-苦瓜素), molecule weight 29,000 and β-momorcharin, molecule weight 28,000, with 1.6% and 1.3% neutral sugar, contain asparagic acid and glutamic acid, no cysteine.",
            "Polysaccharides: consist of glucose, fructose, galactose (cerebrose), mannose, xylose, and small amount of protein. Source of calories. Improves the immune system. Possesses anti-cancer and toxic activities from the cells.",
            "Plant agglutinin: TKI, TKII, TKIII",
            "Enzyme",
            "Amino acids",
            "Others: β-sitosterol, α-spinasteryl-beta-D-glucoside, α-spinasterol-palmitate, ∆-7-stigmastenol-6'-(Z,Z)-9,12-octadecadienoyl-beta-d-glucopyranoside",
            "Newly isolated: 1-deoxy-1-[2'-oxo-1'-pyrrolidinyl]-2-n-butyl-α-fructofuranoside and isoarvenin III (異海綠甾苷)"
        ],
        "References": [
            "[1] J Asian Nat Prod Res. 2012;14(6):528-32. doi: 10.1080/10286020.2012.672410"
        ],
        "Further Reading": [],
        "Original Text": "tian hua fen\n\n\n\nComplementary and \n    Alternative Healing University\n    \n \n\n\n\n\n\n中藥詞典                 \n    Chinese Herb Dictionary     \n     Search this \n    site     \n\n在本網站找資料\n\n\n\n\n\n\n\n\n\n\n\n\n\n\nSearch this \n        site\n\n\nList \n        of Health Problems\n\n\n\n\n\n\n        Chinese Herb Dictionary\n\n\n\n\n\nQigong\n\n\n\n\n\n\n        Traditional Chinese Medicine (TCM)\n\n\n\n\n\n\n        Acupuncture\n\n\n\n\n\n\n        Prescribed Drug Dictionary\n\n\n\n\n\nBiochemistry Dictionary\n\n\n\n\n\nLecture Slides\n\n\n\n\n\nResearch Librarian\n\n\n\n\n\n\n        General Online Library\n\n\n\n\n\nResearch \n        Sites\n\n\n\n\n\n\n        Viagra\n\n\n\n\n\n\n        Massage/Acupressure\n\n\n\n\n\nHypnotherapy\n\n\n\n\n\nTell us what you want\n\n\n\n\n\nNotify Changes \n        & New Information\n\n\n\n \n\n\n\n\n tian hua fen, 天花粉  (in English and Chinese 中英文）gua lou gen 瓜蔞根Translated by: Joe Hing Kwok Chu 朱興國編譯Pharmaceutical name:英文药名：Radix TrichosanthisSemen TrichosanthisPericarpium TrichosanthisBiological name:拉丁學名：Trichosanthes kirilowii, Maxim, or Trichosanthes japonica, Regel.Pron. in Japanese:日語發音：tenkafunPron. in Korean:韓語發音：chonhwabunPron. in Cantonese:粤語發音：tin1 faa1 fan2Other Names:別名：tian hua fen originally was called gua lou gen, also called hua fen.原名括簍根，栝樓根， 簡稱花粉Common Name:英文名：trichosanthes root, Chinese cucumber rootDistribution:分佈：throughout China, especially in Shandong, Hebei, Shanxi, Shaanxi全中國，尤其是山東， 河北，山西，陕西。Properties (characteristics)root: sweet, slightly bitter, slightly cold瓜蔞根：味甘微苦酸微 寒gua lou pi (pericardium trichosanthis): carmel like kind of smell, bland, slightly sour.瓜蔞皮：具焦糖氣，味淡、微 酸。Channels (meridians) entered:lung, stomach歸肺、胃經Actions & Indications:Clears lung heat, dissolves phlegm, for cough with thick phlegm, rid of toxicity, expels pus; for treatment of chlorion epithelioma, hydatidiform mole.用於熱病煩渴， 肺熱 燥咳， 內熱消渴 ， 瘡瘍腫毒﹐治絨毛膜上皮癌及惡性葡萄胎。Modern Applications:hydatidiform tumor:tian zao combination formula: tian hua fen 60mg, ya zao jiao 25 mg ground into fine powder and put into capsules. Insert into vagina once every 5 to 7 day. Treated 7 patients. Those had hydatiform tumors, 5 patients, all healed. 2 patients with chorion-epothelioma (絨癌 ), not effective. Using tian zao combination formula and chemo therapy: 19 patients, healed 13, ineffective 6. Using tian zao combination formula and chemo therapy plus surgery: 65 patients, healed 54, ineffective 11. [4] Medical Function:Tian hua fen effects on the cardiovascular system: Tian hua fen can increase coronary blood flow. Injectiones of trichosanthes bark (gua lou pi) decoction and alcohol precipitation concentrates on in vitro guinea pig hearts can expand coronary artery and can empower coronary blood flow by about 60% on acute myocardial ischemia and can have a significant protective effect. The strength of coronary artery expansion effect of the different parts of the herb is: Trichosanthes skin> gua lou xiang> Trichosanthes sub> Trichosanthes Ren> Trichosanthes shell. Tian hua fen have antiarrhythmic effects. Tian hua fen can inhibit cardiac function.  Tian hua fen can significantly reduce heart rate, left ventricular pressure peak, dp / dtmax, Rdp / dtmaxVmax and Vpm other indicators, but also significantly reduce arterial pressure peak, DPB and MAP.Tian hua fen has expectorant effect. The active ingredient is the total amino acids of the skin of the fruit.Tian hua fen has purgative effects: the intensity is Trichosanthes Ren> Trichosanthes skin> Tian hua fen cream.  Tian hua fen possesses anticancer effects.  Tian hua fen possesses hypoxia tolerance.  Tian hua fen on the blood system: Tian hua fen inhibits platelet aggregation, and its active ingredient is tian hua fen acids. Tian hua fen can significantly reduce the hematocrit and blood viscosity.  Tian hua fen can elevated blood sugar.  Tian hua fen can inhibit intestinal contractions.  Tian hua fen possesses antibacterial effect on a variety of bacteria, bacteria and Audubon Ang's small spores rubrum   Anti HIV effect.Tian hua fen can significantly reduce gastric acid secretion and gastric acid concentration, and have anti-ulcer effect, but also reduce ulcers caused by acid.  Tian hua fen effects on macrophages:  administered at low concentrations, Tian hua fen can enhance the role of macrophages, but at high concentrations of short duration it also show enhancing effect but for a long duration (72 hours) it can cause damage to the macrophages.  Tian hua fen has anti-aging effectTian hua fen possesses the effects of abortion and inducing deliveryIn large dosage and prolong administering it can inhibit the imumme system.Anti-cancer effectInhibits protein synthesis瓜蔞對心血管系統的作 用：  瓜蔞可增加冠脈流量。瓜蔞皮水煎醇沉濃縮劑瓜蔞注射液對豚鼠離體心臟均有擴張冠脈作用，能使冠脈血流量增加約60%，對大鼠急性心肌缺血有明顯的保護作用 。其不同部位擴冠作用強度是：瓜蔞皮＞瓜蔞霜＞瓜蔞子＞瓜蔞仁＞瓜蔞殼。  瓜蔞有抗心律失常作用 。  瓜蔞對心功能有抑制作 用。 瓜蔞可顯著降低心律、左室內壓峰值、dp/dtmax、Rdp/dtmaxVmax及Vpm等指標，還能顯著降低動脈壓峰值、DPB和MAP。  瓜蔞有祛痰作用，其有效成分是從瓜蔞皮中分得的總氨基酸。  瓜蔞有瀉下作用，強度 是瓜蔞仁＞瓜蔞皮＞瓜蔞霜。  瓜蔞有抗癌作用。  瓜蔞有耐缺氧作用。  瓜蔞對血液系統的影響 ：瓜蔞有抑制血小板聚集作用，其有效成分是瓜蔞酸。瓜蔞可明顯降低紅細胞壓積及血液粘度。  瓜蔞有升高血糖的作用 。  瓜蔞有抑制腸管收縮的 作用。瓜蔞有抗菌作用，對多 種球菌、桿菌及奧杜盎氏小芽孢癬菌等有一定抑制作用。瓜蔞能明顯降低大鼠胃 酸分泌及胃酸的濃度，有抗潰瘍作用，還能減輕乙酸引起的潰瘍。瓜蔞對巨噬細胞的影響 ：在低濃度給藥條件下，瓜蔞對巨噬細胞有促進作用，高濃度短時間內也表現為促進作用，而長時間（72小時）後則呈損傷狀態。大劑量可能抑制免疫系統。抗癌作用抑制蛋白質生成。 瓜蔞有延緩衰老作用抗人類免疫缺陷病毒(HIV)Chemical ingredients:化學成份：1. Protein (蛋白質)Trichosanthin (天花粉蛋白)with molecule weight of 24,000, and the isoelectric point (等電點 ) is 9.4, is a simple protein that does not possess phosphorous acid groups. Trichosanthin is being used clinically in inducing delivery and it possesses effects of anti hydatiform tumor (葡萄胎 ) and HIV.Karasurin (堕胎蛋白)with molecule weight of 28,000, possesses the effects of abortion and inducing delivery in pregnant laboratory mice. It also inhibits the imumme systemα-momorcharin (α-苦瓜素), molecule weight 29,000 and beta-momorcharin, molecule  weight 28,000, both contain 1.6% and 1.3% of neutral sugar. Like trichosanthin,  they also contain asparagic acid  (天 冬氨酸)and glutamic acid (麩氨酸), and do not contain cysteine (半胱氨酸 ). 2. Polysaccharides (多糖類)It is a source of calories. It improves the imumme system, and possesses effects of anti cancer and the toxic activities from the cells. The multi-sugar consists of glucose(葡萄糖), fruitose (果糖), cerebrose (半乳糖 )， mannose (甘露糖 ), xylose (木糖 ) and small amount of protein.3. Plant Agglutinin （ 凝集素 )TK I, TK II, TK II4. Enzyme (酶)5. Amino Acids (氨基酸)6. Others (其他): β-sitosterol, α-spinasteryl-beta-D-glucoside, α-spinasterol- palmitate, ∆-7-stigmastenol-6'-(Z,z)-9,12-octadecadienoyl-beta-d-glucopyranoside,7. Newly isolated: 1-deoxy-1-[2'-oxo-1'-pyrrolidinyl]-2-n-butyl-α-fructofuranoside and isoarvenin III (異海綠甾苷） [1]Dosage:用量：9 - 15 gSamples of formulae:處方舉例：chai hu gui zhi gan jiang tang 柴胡桂枝乾薑湯San Zhong Kui Jian Tang 散腫 潰堅湯Modern Research:现代研究：to be loadedCautions:禁忌：not to be used by pregnant women or in cases of pixu (speen deficient) or weixu (stomach deficient)。Large dosages and/or long term usage can be toxic to kidneys. 懷孕或脾\n      虛者忌用。大劑量或長期服用可能對腎臟有毒。Source （in Chinese）：Zhong Hua Ben Cao 中華本， Zhong Yao Da zhi Dian 中藥大辭典。[1] J Asian Nat Prod Res. 2012;14(6):528-32. doi: 10.1080/10286020.2012.672410Hydatidiform tumor Alternative Names﹕ hydatidiform mole, trophoblastic disease, gestational trophoblastic neoplasia  Definition: A hydatidiform tumor occurs when a fetus is not able to fully form in the uterus and the fetal tissue becomes a tumor.\n \n\n   Search \n    this site \n\n\nProblems with website? Please \n\nClick \n    here for comment. (Not for inquiry )    \n    \n\n\nClick \n    here for inquiry \n\n\n\nCopyright Notice \n\n按此看關於版權問題\n\n\n\n\nA manuscript... writing, translating and proofreading  in progress\n\n\nSponsors' Ads by Google \n    以下為谷歌 所提供之廣告\n\n\n\n\n\n\n\n\nList \n        of Health Problems\n\n\n\n\n        Chinese Herb Dictionary\n\n\n\n\nToxicity of Some Herbs\n\n\n\nSide Effect of Some Herbs\n\n\n\nHerbs that can be toxic to kidneys\n\n\n\n\n        Traditional Chinese Medicine\n \n\n\nTCM Diagnosis\n \n\n\n        Samples of Formulae\n\n\n\n\n        Terms of Traditional Chinese Medicine\n\n\n\n        Acupuncture\n\n\n\n\n\ncopy right\n \n\n\n版權所有\n\n\n\nQigong \n        (chi kung)\n\n\n\n\n        Prescribed Drug Dictionary\n\n\n\n\n        Email our web master for  your suggestion (not for inquiry)\n\n\n\nBiochemistry Dictionary\n\n\n\n\n\nGeneral Online Library\n\n\n\nQigong \n        classes\n\n\n\nFake \n        Email Warning\n\n\n\nResearch Librarian\n\n\n\nSearch\n\n\n\n\n\nQigong classes\n\n\n\nHome\n\n\n\n\n        Weather Report\n\n\n\n\n        Disclaimer\n\n\nLast update: Feb 11, 2014; 7 p.m. \n        LAH\n\n\n\n\n\n \n\n\n\n\n\n\n\n\n",
        "original_url": "http://alternativehealing.org/tian_hua_fen.htm"
    },
    {
        "Names": {
            "Name": [
                "qing hao"
            ],
            "Pharmaceutical": [
                "Herba Artemisiae Annuae"
            ],
            "Biological": [
                "Artemisia apiacea Hance",
                "Artemisia annua L.",
                "Artemisia capillaris Thunb.",
                "Artemisia Scoparia Waldst. Et Kitaib.",
                "Artemisia japonica Thunb."
            ],
            "Chemical": [],
            "Common": [
                "worm wood",
                "ching hao"
            ],
            "Other name": [],
            "Chinese": [
                "青蒿",
                "黄花蒿 (Artemisia annua L.)",
                "茵陈蒿 (Artemisia capillaris Thunb.)",
                "滨蒿 (Artemisia Scoparia Waldst. Et Kitaib.)",
                "牡蒿 (Artemisia japonica Thunb.)"
            ],
            "Pronunciation in Korean": [
                "ch'ongho"
            ],
            "Pronunciation in Japanese": [
                "seiko"
            ],
            "Pronunciation in Cantonese": [
                "cing1 hou1"
            ],
            "Pinyin Pronunciation": []
        },
        "Type": "Herb",
        "Geography": [
            "Hebei",
            "Shandong",
            "Jiangsu",
            "Hubei",
            "Fujian"
        ],
        "Properties": [
            "bitter",
            "cold"
        ],
        "Meridians": [
            "kidney",
            "liver",
            "gallbladder"
        ],
        "Maladies Treated": [
            "malaria",
            "warm sickness",
            "for treatment of lupus",
            "for treatment of schistosomiasis",
            "chronic bronchitis",
            "for flu with fever and chills, sweating, heaviness in the head, tired, fullness in the chest (in combination in formulae)",
            "malaria and warm illness with fever in the evening and cool in the morning, thirst, wanting to drink water (in combination in formulae)",
            "gu zheng lao re: fatigue, flushed cheeks, night sweats, and progressive emaciation (in combination in formulae)"
        ],
        "Medical Function": [
            "anti-malaria",
            "the essential oil of qing hao is effective for chronic bronchitis",
            "qinghaosu can elevate the calcium ions of leukemia white cells, thus induces the diseased white cell to change and die"
        ],
        "Dosage": "3 to 12 g. If heat is high, the dosage can be up to 24 g. Do not boil for long time.",
        "Samples of Formulae": "For flu with fever and chills, sweating, heaviness in the head, tired, fullness in the chest. \nName of formula: huang qin qing dan tang. Composition: qing hao (Artemisia annua), huang qin (Scutellaria, Baikal skullcap root), ban xia (Pinellia tuber), chen pi (Aged tangerine peel), jie ke (Bitter orange), zhu ru (Bamboo shavings), fu ling (Poria), bi yi san (Bi yi powder).\n\nFor malaria and warm illness with fever in the evening and cool in the morning, thirst, wanting to drink water. \nName of formula: qing hao bie jia tang. Composition: qing hao (Artemisia annua), bie jia (Turtle shell), zhi mu (Anemarrhena asphodeloides), sheng di huang (Rehmannia root), dan pi (Moutan bark).\n\nFor gu zheng lao re: fatigue, flushed cheeks, night sweats, and progressive emaciation.\nName of formula: qing gu san. Composition: qing hao (Artemisia annua), di gu pi (Lycium bark), yin chai hu (Stellaria root), hu huang lian (Picrorhiza rhizome), qin jiu (Gentiana macrophylla), bie jia (Turtle shell), zhi mu (Anemarrhena asphodeloides), gan cao (Licorice).\n\n蒿芩清膽湯《通俗傷寒論》(Huang qin qing dan tang according to 'Popular Treatise on Cold Damage'): qing hao (Artemisia annua), huang qin (Baikal skullcap root), ban xia (Pinellia tuber), chen pi (Aged tangerine peel), zhi ke (Bitter orange), zhu ru (Bamboo shavings), fu ling (Poria), bi yu san (Bi yu powder). For external contracted damp heat, unresolved fever with mild chills, sweating unresolved, heaviness of the head and tired limbs, chest tightness and fullness.",
        "Contraindications": "Not to use in post partum women with blood deficiency or cold from pixu (spleen deficiency with cold in the stomach).\n反當歸 (incompatible with Dang Gui, Angelica sinensis root), 生地黃 (Rehmannia root, raw, is incompatible).\nSide effect of decoction or pill forms: only a small number of patients showed nausea, vomiting, diarrhea or stomach ache. Most patients did not show any side effect. A small number of patients showed skin allergy. No abnormal liver, kidney, or ECG findings observed.",
        "Research": "See qing hao su for malaria treatment.",
        "Notes": "Only the young leaves are effective.",
        "Chemical Ingredients": [
            "青蒿素 (Qinghaosu, Artemisinin)",
            "青蒿甲素 (Qinghaosu-I, Artemisinin-I)",
            "青蒿乙素 (Qinghaosu-II, Artemisinin-II)",
            "青蒿丙素 (Qinghaosu-III, Artemisinin-III)",
            "青蒿丁素 (Qinghaosu-IV, Artemisinin-IV)",
            "青蒿戊素 (Qinghaosu-V, Artemisinin-V)",
            "青蒿酸 (Qinghao acid)",
            "青蒿酸甲酯 (Qinghao acid methyl ester)",
            "青蒿醇 (Artemisinol)",
            "棕榈酸 (Palmitic acid)",
            "香豆素 (Coumarin)",
            "莨菪亭 (Scopoletin)",
            "3,5-二羟基-6,7,3′,4′-四甲氧基黄酮醇 (3,5-Dihydroxy-6,7,3′,4′-teramethoxyflavonol)",
            "3,5,3′-三羟基-6,7,4′-三甲氧基黄酮醇 (3,5,3′-Trihydroxy-6,7,4′-trimethoxyflavonol)",
            "5-羟基-3,6,7,3′,4′-五甲氧基黄酮 (5-Hydroxy-3,6,7,3′,4′-pentamethoxyflavone)",
            "5-羟基-3,6,7,4′-四甲氧基黄酮 (5-Hydroxy-3,6,7,4′-tetramethoxyflavone)",
            "廿八烷醇 (Octacosanol)",
            "廿九烷 (Nonacosane)",
            "廿五烷 (Pentacosane)",
            "廿三烷酮 (Tricosanone)",
            "β-香樹酯醇乙酸酯 (β-Amyrine acetate)",
            "β-谷甾醇 (β-Sitosterol)",
            "豆甾醇 (Stigmasterol)",
            "dipeptide compounds",
            "alkyne compounds",
            "volatile oil contains: 蒿酮 (Artemisia ketone), 異蒿醇 (Iso-artemisia ketone), 桉葉素 (Cineole), 左旋樟脑 (l-Camphor), β-石竹烯 (β-Caryophyllene), 反式-石竹烯 (trans-Caryophyllene), α,β-蒎烯 (α,β-pinene), 莰烯 (Camphene), 月桂烯 (Myrcene), 檸檬烯 (Limonene), γ-松油烯 (γ-Terpinene), α-松油醇 (α-Terpineol), 反式-β-金合欢烯 (trans-β-Farnesene), α,β,γ-榄香烯 (α,β,γ-Elemene), γ,δ-毕橙茄烯 (γ,δ-Cadinene), 顺式-香苇醇 (cis-Carveol), 古吧烯 (Copaene), β-馬啊里烯 (β-Maalinene), γ-衣兰油烯 (γ-Muurolene), 乙酸龙脑脂 (Bornyl acetate), 異戊酸龙脑酯 (Bornyl isovalerate)"
        ],
        "References": [],
        "Further Reading": [],
        "Original Text": "qing hao, Complementary and Alternative Healing UniversityComplementary and Alternative Healing University  Home  現代 中藥辭典Search this siteList of Health ProblemsChinese Herb DictionaryQigongTraditional Chinese Medicine (TCM)AcupuncturePrescribed Drug DictionaryBiochemistry DictionaryLecture SlidesResearch LibrarianGeneral Online LibrarySearchResearch SitesViagraMassage/AcupressureHypnotherapyTell us what you wantNotify Changes & New Information　　          　                                                                     qing hao 青蒿 Edited by: Joe Hing kwok ChuPharmaceutical name:英文藥名﹕Herba Artemisiae AnnuaeBotanical name:學名﹕Artemisia apiacea Hance 青蒿Artemisia  annua  L.， 黄花蒿Artemisia capillaris Thunb．茵 陈蒿Artemisia Scoparia  Waldst．Et  Kitaib．滨蒿 Artemisia japonica  Thunb．牡蒿Pron. in Japanese:日語發音﹕seikoPron. in Korean:韓語發音﹕ch'onghoPron. in Cantonese:粵音﹕cing1 hou1Other Names:別名 ﹕ Common Name:英文名﹕worm wood, ching haoDistribution:產地﹕Hebei, Shandong, Jiangsu, Hubei, Fujian.河北﹐ 山東﹐ 江蘇﹐ 湖北﹐ 福建。按此看各地區當青蒿所用的植物Properties(characteristics)﹕性味﹕bitter, cold.苦﹐寒。Channels (meridians) entered: 歸經﹕kidney, liver, gallbladder.腎﹐肝﹐膽。Medical functions:藥理﹕ anti malaria for treatment of lupus for treatment of schistosomiasis the essential oil of qing hao is effective for chronic bronchitis qinghaosu can elevate the calcium ions of leukemia white cells, thus induces the diseased white cell to change and die. 抗瘧 治療盤狀红斑狼瘡 血吸虫病 感染 青蒿揮 發油對慢性氣管炎有效 青蒿素能使白血病细胞内的鈣離子水平升高，導致白血病细胞的變性和壞死。Actions & Indications:主治﹕for treatment of malaria, warm sickness治瘧疾, 溫病。Chemical ingredients:化學成份﹕青蒿素(Qinghaosu)， 青蒿甲素(Qinghaosu-I) ， 青蒿乙素(Qinghaosu-II)， 青蒿丙素 (Qinghaosu-III) ， 青蒿丁素(Qinghaosu-IV) ， 青蒿戊素(Qinghaosu-V) 青蒿酸(Qinghao acid)， 青蒿酸甲酯， 青蒿醇(Artemisinol)， 棕榈酸(Palmitic acid)， 香豆素(Coumarin)， 莨菪亭(Scopoletin)， 3,5-二羟基-6,7,3′,4′-四甲氧基黄酮醇(3,5- Dihydroxy-6,7,3′,4′-teramethoxyflavonol)， 3,5, 3′-三羟基- 6,7,4′-三甲氧基黄酮醇(3,5, 3′-Trihydroxy-6,7,4′-trimethoxyflavonol)， 5-羟基-3,6,7,3′, 4′-五甲氧基黄酮（5-Hydroxy-3,6,7,3′, 4′-pentamethoxyflavone）， 5-羟基-3,6,7, 4′-四甲氧基黄酮（5-Hydroxy-3,6,7, 4′-tetramethoxyflavone）， 廿八烷醇(Octacosanol)， 廿九烷（Nonacosane）， 廿五烷 (Pentacosane)， 廿三烷酮(Tricosanone)， β-香樹酯醇乙酸酯（β-Amyrine acetate）， β-谷甾醇（β-Sitosterol）， 豆甾醇（Stigmasterol），二肽化合物，烯炔化合物。 其揮 發油含有 蒿酮（Artemisia ketone）， 異蒿醇（Iso-artemisia ketone）， 桉葉素(Cineole)， 左旋樟脑(l-Camphor)， β-石竹烯（β-Caryophyllene）， 反式-石竹烯（traans-Caryophyllene）， α，β-蒎烯（α，β-pinene）， 莰烯（Camphene）， 月桂烯（Myrcene）， 檸檬烯（Limonene）， γ-松油烯（γ-Terpinene）， α-松油醇（α-Terpineol）， 反式-β-金合欢烯（trans-β- Farnesene）， α，β；γ-榄香烯(α，β,γ-Elemene)，γ， δ-畢橙茄烯（γ，β-Cadinene）， 顺式-香苇醇(cis- Carveol)， 古吧烯（Copaene）， β-馬啊里烯（β-Maalinene）， γ-衣蘭油烯（γ-Muurolene）， 乙酸龍腦脂（Bornyl acetate）， 異戊酸龍腦酯（Bornyl isovalerate）Dosage:用量﹕3 to 12 g. If heat if high, the dosage can be up to 24 g. Do not boil for long time.3 ~ 12克。熱盛者﹐可用至24克。不耐久煎。Samples of formulae:處方舉例﹕For flu with fever and chills, sweating, heaviness in the head, tired, fullness in the chest.Name of formula: huang qin qing dan tangComposition: qing hao, huang qin, ban xia, chen pi, jie ke, zhu ru, fu ling, bi yi san. For malaria and warm illness with fever in the evening and cool in the morning, thirty, wanting to drink water.Name of formula: qing hao bie jia tangComposition: qing hao, bie jia, zhi mu, sheng di huang, dan pi. For gu zheng lao re: fatigue, flushed cheeks, night sweats, and progressive emaciation.Name of formula:  qing gu sanComposition:  qing hao, di gu pi, yin chai hu, hu huang lian, qin jiu, bie jia, zhi mu, gan cao. 蒿芩清膽湯《通俗傷寒論》：青蒿，黃芩，半夏 ，陳皮，枳殼，竹茹，茯苓，碧玉散。治外感濕熱之邪，留戀不解 ，微惡寒而發熱，有汗不解 ，頭重肢倦，胸悶痞滿等症。 青蒿鱉甲湯《溫病條辨》：青蒿，鱉甲，知母，生地， 丹皮。治瘧疾及溫病之暮熱早涼汗解渴飲者。 清骨散《證治準繩》：青蒿，地骨皮，銀柴胡， 胡黃連，秦艽，鱉甲，知母，甘草。治骨蒸勞熱。Modern Research:現代研究﹕See qing hao su for malaria treatment.Toxicity & Cautions:毒素與禁忌﹕Not to use in post partum women with blood deficient  or cold from  pixu (spleen deficient with cold in the stomach.The side effect of decoction or pill forms: only a small number of patients showed nausea, vomiting, diarrhea or stomach ache. Most patients did not show any side effect. A small number of patients showed skin allergy.產後血虛﹐ 或 脾虛 胃寒忌用。反當歸﹐生地黃。水煎劑或口服 片劑，僅有少數人出現噁心，嘔吐，腹痛，腹瀉，絕大多數人未見毒副作用﹔肝臟﹐腎臟﹐與心電圖未見到過有異常。少數人曾經發 現有皮膚過敏。　Bi yi san: Composition: hua shi (3 MgO . 4 SiO 2. H2O) , qing dai , sheng gan cao. 碧玉散 ﹕組成﹕滑石，青 黛，生 甘 草。 Also see: Artemisia capillaris Thunb．茵陈蒿Note: only the young leaves are effective.  Sponsors' Ads by Google 以下為谷歌所提供贊助者之廣告  A manuscript... writing, translating and proofreading              in progressClick here for comment. (Not for inquiry ) Click here for inquiry   Copyright Notice 按此看關於版權問題List of Health ProblemsChinese Herb DictionaryToxicity of Some HerbsSide Effect of Some HerbsHerbs that can be toxic to kidneysTraditional Chinese MedicineTCM DiagnosisSamples of FormulaeAcupuncturecopy right 版權所有Qigong (chi kung)Prescribed Drug DictionaryEmail our web master for  your suggestion (not for inquiry)Biochemistry DictionaryGeneral Online LibraryQigong classesFake Email WarningResearch LibrarianSearchQigong classesHomeWeather Report    Disclaimer   Last update: July 22, 2009; 11:38 a.m. LAH  ",
        "original_url": "http://alternativehealing.org/qing_hao.htm"
    },
    {
        "Names": {
            "Name": [
                "ba jiao hui xiang",
                "八角茴香"
            ],
            "Pharmaceutical": [
                "Fructus Illicii Veri"
            ],
            "Biological": [
                "Illicium verum Hook. f."
            ],
            "Chemical": [],
            "Common": [
                "Fructus Anisi stellati",
                "star anise",
                "star aniseed",
                "Chinese star anise"
            ],
            "Other name": [
                "da hui xiang 大茴香",
                "da liao 大料",
                "wu xiang ba jiao 五香八角",
                "po shang hui xiang 舶上茴香",
                "po hui xiang 舶茴香",
                "hui xiang ba jiao zhu 茴香八角珠",
                "ba jiao xiang 八角香",
                "ba jiao da hui 八角大茴",
                "ba jiao 八角",
                "yuan you hui 原油茴"
            ],
            "Chinese": [
                "八角茴香",
                "大茴香",
                "大料",
                "五香八角",
                "舶上茴香",
                "舶茴香",
                "茴香八角珠",
                "八角香",
                "八角大茴",
                "八角",
                "原油茴"
            ],
            "Pronunciation in Korean": [
                "parkak"
            ],
            "Pronunciation in Japanese": [
                "toushikimi"
            ],
            "Pronunciation in Cantonese": [
                "baat3 gok3 wui4 hoeng1 (八角茴香)",
                "baat3 gok3 (八角)"
            ],
            "Pinyin Pronunciation": []
        },
        "Type": "Herb",
        "Geography": [
            "Guangdong, Yunnan, Guizhou, Hunan, Taiwan provinces of China, southeast Asia, India"
        ],
        "Properties": [
            "Acrid",
            "Warm"
        ],
        "Meridians": [
            "Liver",
            "Kidney",
            "Spleen",
            "Stomach"
        ],
        "Maladies Treated": [
            "cold type of hernia",
            "chronic lower back pain with shenxu (kidney deficient)",
            "vomiting due to coldness in stomach",
            "pain and coldness in stomach",
            "hernia",
            "swelling of testes, pain cannot be tolerated",
            "hernia: xiao hui xiang (fennel fruit) with ba jiao hui xiang (star anise) and ru xiang (frankincense)",
            "hernia: ba jiao hui xiang (star anise), xiao hui xiang (fennel fruit) with ru xiang (frankincense)",
            "hernia: ba jiao hui xiang (star anise) and xiao hui xiang (fennel fruit), powder form, used with pig's urinary bladder, boiled in wine, for hernia with testicle drooping (偏墜)",
            "lower back heaviness and stabbing distention",
            "lower back pain like stabbing: ba jiao hui xiang (star anise, fried and pounded), internal with salted soup, external with hot sticky rice bag on painful spot",
            "constipation of both urination and defecation, abdominal fullness and distention like a drum, dyspnea",
            "wind toxin dampness with ulcers, purple skin, pus and rotting of flesh, weakness of limbs, skin redness and heat"
        ],
        "Medical Function": [
            "strong inhibition effect on Staphylococcus aureus, Corynebacterium diphtheriae, Bacillus Subtilis, Vibro cholerae, Salmonella typhi, Shigella dysenteriae, Escherichia coli, and common pathogenic skin fungi (ethanol extract of ba jiao hui xiang)",
            "clears wind-cold, regulates qi and stops pain (温阳散寒，理气止痛)",
            "induce sweating when taken hot in tea (as described in formula for hernia)",
            "warming yang and dispelling cold, regulating qi, stopping pain"
        ],
        "Dosage": "3–6 g (3~6 克).",
        "Samples of Formulae": "1. For hernia: ba jiao hui xiang (star anise), xiao hui xiang (fennel fruit) 9 g each, ru xiang (frankincense) small amount. Boil with water. Use as tea. Cover the body to induce sweating.\n\n2. Li zhi san (from 'Zheng Zhi Zhun Sheng') for hernia, swelling of testes, unbearable pain. Composition: li zhi he (lychee kernel, fresh, bake till dark) 14 pieces, ba jiao hui xiang (star anise, stir fry), chen xiang (aloeswood), mu xiang (costus root), qing yan (coarse lake salt), table salt 3 g each, chuan lian zi (toosendan fruit), xiao hui xiang (fennel fruit) 6 each. Take 9 g each time, mix with warm rice wine on an empty stomach.\n\n3. Hernia with testicle prolapse: ba jiao hui xiang (star anise), xiao hui xiang (fennel fruit) 3 qian (about 11.25g) each, ru xiang (frankincense) small amount. Decoction for sweating. (Renzhai Zhizhi Fang)\n\n4. Hernia with one-sided prolapse: powder of ba jiao hui xiang (star anise) and xiao hui xiang (fennel fruit) 1 liang (about 37.5g) each. Place both powders inside a pig's bladder, add the urine, tie and cook with wine until rotten, pound into balls size of wutong seeds. Take 50 pills per dose, with plain soup. (Weisheng Zaxing)\n\n5. Heaviness and stabbing pain/distention of lower back: ba jiao hui xiang (star anise), fried and powdered, take before meals with wine, 2 qian (about 7.5g). (Renzhai Zhizhi Fang)\n\n6. Lower back pain like stabbing: ba jiao hui xiang (star anise, fried and powdered), take 2 qian (about 7.5g) before meals with salted soup. Externally, use 1–2 sheng of glutinous rice, fried hot, bagged, tied to the affected area. (Jianbian Danfang)\n\n7. Constipation of urination and defecation, abdominal distension: da ma zi (hemp seed, fried and shelled) 1/2 liang (~18.75g), ba jiao hui xiang (star anise) 7 pieces, mash with 3–7 scallion whites, decoct, and mix with wu ling san powder for administration. (Yong Lei Qian Fang)\n\n8. Wind-toxin dampness with ulcers, purple/rotten skin, weakness, and heat: ba jiao hui xiang (star anise, fried), di long (earthworm, fried and cleaned), chuan wu (aconite root, prepared and peeled), wu yao (lindera root, sliced), qian niu zi (morning glory seed, fried), each 1 liang (~37.5g). Grind, use wine paste to form balls size of wutong seeds. Take 15 pills on empty stomach with salted soup, twice daily. (Jiaoqi Zhifa Zongyao, Hui Xiang Wan)",
        "Contraindications": "Use with care in cases of yin deficiency with heat.\n\nSometimes Chinese star anise (Illicium verum) is adulterated with Japanese star anise (Illicium anisatum L) which is toxic and may cause acute-onset irritability, jitteriness, clonus or myoclonus, increased deep tendon reflexes, nystagmus, vomiting, and seizures, especially in infants. Do not use star anise in infants.",
        "Research": "Ethanol extract of ba jiao hui xiang (star anise) demonstrated strong inhibitory effects against Staphylococcus aureus, Pneumococcus, Corynebacterium diphtheriae, Bacillus subtilis, Vibrio cholerae, Salmonella typhi, Paratyphoid bacteria, Shigella dysenteriae, Escherichia coli, and common pathogenic skin fungi.\n\nOne study reported that safrole was not found in Illicium verum but was detected in all toxic Illicium species, but not in Illicium verum. [2]",
        "Notes": "Source: partially obtained from 'Whole National Herb Edition' (《全國中草藥匯編》)。",
        "Chemical Ingredients": {
            "": [
                "seeds contain 4–9% evaporating oil (about 5% in general; more in skin of seeds)",
                "main evaporating oil is anethole (about 80–90%)",
                "d-pinene",
                "l-phellandrene",
                "α-terpineol",
                "small amount of safrole (see research regarding safrole absence in Illicium verum)",
                "methyl chavicol",
                "about 22% fat (mainly in seed)",
                "protein",
                "resin",
                "rubber",
                "leaves contain evaporating oil including anethole and anisaldehyde"
            ]
        },
        "References": [
            "[1] http://tw.18dao.net/%E9%A6%96%E9%A0%81",
            "[2] http://jama.ama-assn.org/cgi/content/full/291/5/562"
        ],
        "Further Reading": [],
        "Original Text": "ba jiao hui xiang, star anise, Complementary and Alternative Healing UniversityComplementary and Alternative Healing University   中藥詞典    Chinese Herb Dictionary      Search this site     在本網站找資料 See more menu at the bottom of page ba jiao hui xiang  八角茴香     (in Engish and Chinese 中英對照) Edited by: Joe Hing kwok ChuPharmaceutical name:英文藥名﹕ Fructus Illicii VeriBotanical name:學名﹕Illicium verum Hook. f.Pron. in Japanese:日語發音﹕toushikimiPron. in Korean:韓語發音﹕parkakPron. in Cantonese:粵音﹕baat3 gok3 wui4 hoeng1 (八角茴香); baat3 gok3 (八角)Other Names:別名﹕da hui xiang 大茴香，da liao 大料，wu xiang ba jiao 五香八角，po shang hui xiang 舶上茴香、po hui xiang 舶茴香、hui xiang ba jiao zhu 茴香八角珠、ba jiao xiang 八角香、ba jiao da hui 八角大茴、ba jiao 八角、yuan you hui 原油茴。Common Name:英文普通名﹕Fructus Anisi stellati, star anise, star aniseed, Chinese star anise.Distribution:產地﹕in Guangdong, Yunnan, Guizhou, Hunan, Taiwan provinces of China, also in southeast Asia and India etc.廣西、雲南、貴州 、廣東，湖南，台灣與東南亞，印度等地。Properties(characteristics)﹕性味﹕acrid, warm.辛，溫。Channels (meridians) entered: 歸經﹕liver, kidney, spleen, stomach.肝，腎，脾，胃。Medical functions:藥理﹕ Antibiotic effect: it has a strong inhibiton effect on Staphylococcus aureus,  Corynebacterium diphtheriae, (Bacillus Subtilis, Vibro cholerae, Salmonella typhi, Shigella dys, and  Escherichia coli,抑菌試驗：八角茴香的乙醇提取物對金黃色葡萄球菌，肺炎球菌，白喉杆菌，枯草杆菌，霍亂弧菌，傷寒杆菌，副傷寒杆菌，痢疾杆菌，大腸杆菌及 常見致病性皮膚真菌均有強的抑制作用。Actions & Indications:主治﹕being used in cold type of hernia, chronic lower back pain with shenxu (kidney deficient), vomiting due to coldness in stomach, pain and coldness in stomach.溫陽散寒，理氣止痛。用於寒疝腹痛， 腎虛腰痛，胃寒嘔吐，脘腹冷痛。Chemical ingredients:化學成份﹕The seed containsevaporating oil about 4 to 9%. In general it contains about 5% and more of it in the skin of the seeds. The main evaporating oil is anethole (about 80 to 90%). Usually it separates itself when it is cold. The remainder are d-pinene, I--phellandrene, α-terpineol and small amount of safrole*, methyl chavicol.fat about 22% (mainly in seed)protein, resin, rubber etc.leaves contain: evaporating oil which consists of anethole, anisaldehyde etc.*In one study, it mentioned the safrole was not found in Illicium verum but found in all toxic Illicium species, but not in Illicium verum.[2]果實含揮發油4～9％，一般約為5％(果皮中較多)，脂肪油約22％(主存於種子中)及蛋白質，樹膠，樹脂等。揮發油中主要成份為茴香醚(anethole) 約80～90％，冷時常自油中析出，其餘為d-蒎烯 (d-pinene)，l- 水芹烯  (I--phellandrene) ，α-萜品醇  (α-terpineol)及 少量黃樟醚 (safrole)** ，甲基胡椒酚(methyl chavicol)。葉含揮發油，油中含茴香醚 (anethole)，茴香醛  (anisaldehyde)等**有研究报告說本品(Illicium verum)不含黃樟醚 (safrole)，但其他有毒的品種則含黃樟醚 [2]。Dosage:用 量﹕ 3～6g,3~6 克。Samples of formulae:處方舉例﹕1. Hernia: ba jiao hui xiang, xiao hui xiang 9 g each, ru xiang small amount. Boil with water. Use as tea. Cover the body to induce sweating.  2. li zhi san  (source: Zheng Zhi Zhun Sheng):Application: For hernia, swelling of testes, pain cannot be tolerated.Composition: li zhi he (fresh, bake till dark) 14 pieces, star anise (stir fry), chen xiang. mu xiang, qing yan (coarse lake salt), table salt 3 g each,  chuan lian zi fruit, xiao hui xiang 6 each.Take 9 g each time. Mix with warm rice wine and take with empty stomach 1. 疝氣：八角茴香，小 茴香， 各9克，, 乳香 些少。水煎服。蓋被取汗。  2, 荔枝散 (證治准繩)：  主治:   疝氣﹐睾 丸腫 大，痛不可忍組成：荔 枝核（用新鮮者，燒炭存性）14 枚，八 角茴香（炒）、沉 香、木 香 、青鹽、食 鹽 各3g，川 楝子肉、小茴香各6g。上為細末。 用法：每服9g，空腹時熱酒調下。 Modern Research:現代研究﹕ Toxicity & Cautions:毒素與禁忌﹕Use with care in cases of yinxu (yin deficient)  with heat.  Sometimes the Chinese star anise (Illicium verum) is adulterated with Japanese star anise (Illicium anisatum L) which can be toxic and may have side effects for infants.  The side effects can include: signs of acute-onset irritability, jitteriness, clonus or myoclonus, increased deep tendon reflexes, nystagmus, vomiting, and seizures.[2]  It is not advisable to use star anise on infants.陰虛火 旺者慎服。有時八角茴香 (Illicium verum)之商品可能混有日本産的八角茴香而對婴兒可能産生急 性發作之煩躁不安，顫抖，抽筋或肌陣攣，增加深部肌腱反射，眼 球震顫，嘔吐和癲癇。不應用之於婴兒。　   Source: partially obtained from \"Whole National Herb Edition� (in Chinese) 【摘錄】《全國中草藥匯編》  The following formulae will be translated on demand:【附方】  ①治小腸氣墜：八角茴香，小茴香各三錢，乳 香少許。水(煎)服取汗。(《仁齋直指方》)  ②治疝氣偏墜：八角茴香末一兩，小茴香末一兩。用豬尿胞一個，連尿入二末於內，系定罐內，以酒煮爛，連胞搗丸如梧子大。每服五十丸，白湯下。(《衛生雜興》 )  ③治腰重刺脹：八角茴香，炒，為末，食前酒服二錢。(《仁齋直指方》)  ④治腰痛如刺：八角茴香(炒研)每服二錢，食前鹽湯下。外以糯米一，二升，炒熱，袋盛，拴於痛處。(《簡便單方》)  ⑤治大小便皆秘，腹脹如鼓，氣促：大 麻子(炒，去殼)半兩，八角茴香七個。上作末，生蔥白三七個，同研煎湯，調五 苓散服。(《永類鈐方》)  ⑥治風毒濕氣，攻疰成瘡，皮肉紫破膿壞，行步無力，皮肉焮熱：八角茴香(炒)，地 龍 (去土，炒)，川 烏(炮，去皮尖)，烏 藥(銼)，牽牛子(炒)各一兩。 研杵勻細，酒煮糊為丸，如梧桐子大(如胡椒粒大小)。每服空心鹽湯下十五丸，日二。(《腳氣治法總要》茴香丸 )  註：疰 zh�: 有灌注和久住之意,多指具有傳染性和病程長的慢性病,主 要指勞瘵。如:疰忤(中醫病名 。猶中惡);疰夏(中醫學名詞。通常指夏季身倦、體熱、食少等症狀)[1] http://tw.18dao.net/%E9%A6%96%E9%A0%81[2] http://jama.ama-assn.org/cgi/content/full/291/5/562 Search this siteProblems with website? Please Click here for comment. (Not for inquiry )    Click here for inquiryCopyright Notice 按此看關於版權問題Sponsors' Ads by Google 以下為谷歌 所提供之廣告A manuscript... writing, translating and proofreading  in progressMenu: List of Health ProblemsQigong (chi kung)Toxicity of Some HerbsSide Effect of Some HerbsHerbs that can be toxic to kidneysTraditional Chinese Medicine TCM Diagnosis Samples of FormulaeTerms of Traditional Chinese MedicineAcupunctureChinese Herb DictionaryQigong classesPrescribed Drug DictionaryEmail our web master for  your suggestion (not for inquiry)Biochemistry Dictionary Qigong classes Research Librarian copy right 版權所有HomeWeather ReportDisclaimerLast update: Sept 4, 2015; 9:30  p.m. LAH   ",
        "original_url": "http://alternativehealing.org/ba_jiao_hui_xiang.htm"
    },
    {
        "Names": {
            "Name": [
                "tu fu ling",
                "土茯苓"
            ],
            "Pharmaceutical": [
                "Rhizoma Smilacis glabrae"
            ],
            "Biological": [
                "Smilax glabra Roxb.",
                "Smilax china L. (ba qi 菝葜)"
            ],
            "Common": [
                "glabrous greenbrier rhizome",
                "smilax"
            ],
            "Other name": [
                "shan gui lai 山歸來",
                "tu fu 土茯",
                "di fu ling 地茯苓",
                "shan yu liang 山餘糧",
                "ling fan tuan 苓飯團",
                "shan di shu 山地薯",
                "cai yu yu liang 草禹餘糧",
                "ci zhu ling 刺豬苓",
                "xian yi gen 仙遺根",
                "guo gang long 過崗龍",
                "hong tu ling 紅土苓",
                "qi liang 奇良"
            ],
            "Chinese": [
                "土茯苓",
                "山歸來",
                "土茯",
                "地茯苓",
                "山餘糧",
                "苓飯團",
                "山地薯",
                "草禹餘糧",
                "刺豬苓",
                "仙遺根",
                "過崗龍",
                "紅土苓",
                "奇良"
            ],
            "Pronunciation in Korean": [
                "t'obongnyong"
            ],
            "Pronunciation in Japanese": [
                "do bukuryo"
            ],
            "Pronunciation in Cantonese": [
                "tou2 fuk6 fook ling4"
            ],
            "Pinyin Pronunciation": []
        },
        "Type": "Herb",
        "Geography": [
            "Yangtse River valley and all of the southern provinces of China"
        ],
        "Properties": [
            "Sweet",
            "Bland",
            "Cool",
            "Non-toxic"
        ],
        "Meridians": [
            "Stomach",
            "Kidney"
        ],
        "Maladies Treated": [
            "Skin ulcer",
            "Joint pain due to dampness and heat",
            "Secondary problems in syphilis",
            "Rashes",
            "Turbid urine due to damp heat toxin",
            "Leptospirosis",
            "Acute dysentery",
            "Acute or chronic inflammation of kidneys",
            "Mercury toxin",
            "Psoriasis",
            "Fungal infection",
            "Damp heat sore toxin",
            "Eczema",
            "Malignant sores with ulcerous swelling and toxin",
            "Syphilis",
            "Spasm and pain of sinews and bones",
            "Unfavorable flexion and extension of joints",
            "Hot stranguria with red, astringent and painful urine",
            "Chronic atrophic gastritis",
            "Thrombocytopenic purpura (ITP)",
            "Phlebitis",
            "Gonorrhea",
            "Urinary tract infections",
            "Non-infection type of urinary tract syndrome",
            "Painful menses",
            "Fibroids in the ovaries",
            "Skin disease of babies"
        ],
        "Medical Function": [
            "Clears heat, eliminates dampness, rids of toxin",
            "Relieves itching",
            "Unblocks channels and connections (通絡)",
            "Inhibits aflatoxin B1-induced rat hepatoma development: feed containing tu fu ling extract (377.7g/kg) resulted in slightly fewer and significantly smaller r-GT-positive liver cell foci versus control group",
            "Detoxification of gossypol: aqueous decoction, dilute ethanol extract, and crude flavonoids of tu fu ling (water decoction: per animal, daily dose 1g and 0.5g; dilute ethanol extract: dose of 1g and 2g raw herb equivalents; crude flavonoids: 50mg and 100mg; polysaccharide: 0.5ml and 1.0ml; ferrous sulfate: 8mg)—in animals given pure gossypol 650mg/kg, 850mg/kg, and 100mg/kg—demonstrated antagonistic effect against acute and subacute gossypol poisoning (P<0.05, P<0.001, and P<0.001 respectively)",
            "Dilute ethanol extract of tu fu ling, when antagonizing gossypol toxicity, does not interfere with the spermatostatic effect of gossypol in male rats"
        ],
        "Dosage": "For concoction: 15g to 30g per day.\nFor external use: make into powder.",
        "Samples of Formulae": "Used for interstitial cystitis (間質性膀胱炎). \nUsed for psoriasis (銀痟病).",
        "Contraindications": "Use caution in cases of gan shen yin xu (liver-kidney yin deficiency). Do not take with tea. During the medication period, avoid drinking tea.",
        "Research": "Anti-tumor effect: In a study on the impact of chemical carcinogenesis in rat bladder, female Wistar rats (body weight 70-110g) received intragastric (ig) BBN (N-(4-hydroxybutyl) nitrosamine) in 36% ethanol solution—0.25ml (90mg) twice weekly for 12 weeks, total BBN dose per rat 2.16g. Tu fu ling group: BBN treatment as above with diet containing 120g tu fu ling dry powder per 1kg feed. At week 30, animals were sacrificed for histological analysis of bladder, ureter, renal pelvis, kidney, liver, and spleen. Results: tu fu ling group showed no significant inhibition of BBN-induced bladder tumors and a higher occurrence of squamous cell tumors. Conclusion: caution is advised when using tu fu ling for the prevention or treatment of bladder tumors.\n\nInhibition of aflatoxin B1 effect: In a rat hepatoma model, female Wistar rats (8 weeks old) were fed with tu fu ling-containing feed from 10 days before AFB1 injection to 3 days after. AFB1 (aflatoxin B1) was administered intraperitoneally (280ug/kg, 6 times/week x 2 weeks), followed by 2 weeks of feed containing 0.015% 2-acetyl aminofluorene (2AAF). Rats were sacrificed 10 days after surgical removal of liver lobes for r-glutamyl GGT (r-GT) staining. Results: r-GT-positive liver cell foci (pre-cancerous) were slightly fewer and markedly smaller in tu fu ling group (diet 377.7g/kg) compared to control. Conclusion: tu fu ling exhibits practical efficacy in prevention of liver cancer in this model.\n\nDetoxification of gossypol: In male rats, aqueous decoction, dilute ethanol extract, crude flavonoids, and polysaccharide preparations of tu fu ling (each given for 3 days in various dosages), as well as ferrous sulfate, were tested for antagonism against pure gossypol administration (650mg/kg, 850mg/kg, and 100mg/kg). Results: Tu fu ling water decoction, dilute ethanol extract, and crude flavonoid preparations each antagonized both acute and subacute gossypol poisoning (statistical significance: P<0.05, P<0.001, and P<0.001). Ferrous sulfate, generally used for antagonizing gossypol poisoning, can affect its spermatostatic effects, but dilute ethanol extract of tu fu ling did not interfere with gossypol induced spermatostasis in male rats.",
        "Notes": "",
        "Chemical Ingredients": {
            "": [
                "β-sitosterol palmitate (β-谷甾醇棕櫚酸酯)",
                "β-sitosterol (β-谷甾醇)",
                "daucosterol (胡蘿卜苷)",
                "1-O-hexadecanoyl-3-O-β-D-galactopyranosyl-glycerol (41-棕櫚酰基-3-O-β-D-半乳糖基甘油酯)",
                "astilbin (落新婦苷)",
                "quercetin (槲皮素)",
                "taxifolin (花旗鬆素)",
                "quercetin-4′-O-β-D-pyranglucoside (槲皮素-4′-O-β-D-吡喃葡萄糖苷)",
                "isoastilbin (異落新婦苷)"
            ]
        },
        "References": [
            "[1] 吴博； 馬躍平； 袁久志； 孫啟時； 【機構】 沈 陽藥科大學中藥學院",
            "[1] WU Bo,MA Yue-ping,YUAN Jiu-zhi,SUN Qi-shi (School of Traditional Chinese Materia Medica,Shenyang Pharmaceutical University,Shenyang 110016,China)",
            "[2] Zhong Hua Ben Cao 中華本草"
        ],
        "Further Reading": [],
        "Original Text": "tu fu ling, Complementary and Alternative Healing UniversityComplementary and Alternative Healing University \n  中藥詞典                 Chinese Herb Dictionary      Search this site     在本網站找資料     Discussion FormSearch this siteList of Health ProblemsChinese Herb DictionaryQigongTraditional Chinese Medicine (TCM)AcupuncturePrescribed Drug DictionaryBiochemistry DictionaryLecture SlidesResearch LibrarianGeneral Online LibraryResearch SitesViagraMassage/AcupressureHypnotherapyTell us what you wantNotify Changes & New Information  tu fu ling 土茯苓 （in English and Chinese 中英文)Translated by: Joe Hing Kwok Chu 朱興國編譯\nClick here to See plant in another sitePharmaceutical name:英文藥名：Rhizoma Smilacis \n    glabraeBiological name:拉丁學名：Smilax glabra Roxb. also see Smilax china. L (ba qi 菝葜 )Pron. in Japanese:日語發音：do bukuryoPron. in Korean:韓語發音：t'obongnyongOther Names:別名：shan gui lai 山歸來,tu fu 土茯,di fu ling 地茯苓,shan yu liang  山餘糧,ling fan tuan  苓飯團,shan di shu 山地薯 ,cai yu yu liang 草禹餘糧,ci zhu ling 刺豬苓,xian yi gen 仙 遺根,guo gang long 過崗龍,hong tu ling 紅土苓qi liang 奇良Pron. in Cantonese:粤語發音：tou2 fuk6  fook ling4Common Name:英文名：glabrous greebrier rhizome, smilaxDistribution:分佈﹕Yangtse River valley and all of the southern provinces of China.長江流域南部各省皆有 有分佈。Properties (characteristics)﹕ 性味﹕sweet, bland, cool and non-toxic.味甘﹐淡，性涼無毒。Channels (meridians) entered:歸經﹕stomach and kidney channels.入肝與胃經。Actions & Indications:主治：　For clearing heat, eliminates dampness, rid of toxin. Used in skin ulcer, joint pain due to dampness and heat, secondary problems in syphilis, rashes, turbid urine due to damp heat toxin, leptospirosis, acute dysentery, acute or chronic inflammation of kidneys, mercury toxin, psoriasis, and fungal infection.有清熱解毒﹐利 濕止 癢﹐ 通絡的功能。用於濕熱瘡毒﹐濕疹﹐惡瘡潰瀾腫毒﹐ 梅毒﹐筋骨拘攣疼痛﹐屈伸不利﹐熱淋尿赤澀痛等。可用於鉤 端螺旋體病﹐ 急性下痢﹐急慢性腎炎﹐汞中毒﹐銀 屑病, 黴菌感染。Medical Function:[2]药理：[2]1. anti-tumor effect:Anti-tumor effect1.1 impact of chemical carcinogenesis in the rat bladder.  Experiment animals： female Wistar rats, with 70-110g body weight.  Carcinogenic agents： NJ group an N-(4 - hydroxybutyl) nitrosamine (BBN), Experiment： 20% ethanol BBN dope formulated as a 36% solution.  Normal control group: In the ether under light anesthesia, purely using solvent (20% ethanol) 0.25 ml catheter ig, twice a week for a total of 12 wk.  Pathological group: 36% BBN solution 0.25ml (90 mg) ig, twice a week, a total of 12 wk, each rat the BBN total dose 2.16g. Tu fu ling: BBN treatment with pathological control group, diet for 1 kg 120g  tu fu ling dry powder. To wk 30 end of the experiment, the animals were sacrificed, bladder, ureter, renal pelvis, kidney, liver, and spleen for histological examination. The results: showed that the the  of tu fu ling group of BBN bladder tumors showed no significant inhibition, instead it occurred more squamous cell tumors. Conclusion:  be cautious in using tu fu ling in prevention and treatment of bladder tumor.  2. inhibit aflatoxin effect: preventing liver cancer1.2 effect of aflatoxin B1, on rat hepatoma Test animals: female Wistar rats, 8 week old Test: From 10 days before the AFB1injection to 3 days after ending the AFB1 injection, the rats were eating feed that contained the test animal feed. The hepatoma promoting dose: (ip) AFB1 (the 280 ug/kg, 6 / wkx2) for 2 weeks,  Tumor promotion program: feeding for 2 weeks with 0.015% 2 - acetyl aminofluorene (2AAF)  Then the liver lobes and left lateral lobes were removed at the end of one week.  After 10 days, the rats were sacrificed by neck breaking method. The liver were taken for r-glutamyl GGT (r-GT) staining.  Results: rat hepatic precancerous lesions with r-GT staining showed positive liver cell foci and slightly less in tu fu ling group (feed containing 377.7g/kg) lesions, and significantly less than the control group.  Conclusion: tu fu ling showed some practical value to prevent liver cancer.3. detoxification of gossypol1.抗腫瘤作用:1.1對大鼠膀胱化學致癌的影響:  實驗動物：雌 Wistar 大鼠，體重70-110g。 致癌劑：N-J基一N（4-羥丁基）亞硝胺（BBN）。 實驗：以20%乙醇將 BBN 原液配成36%的溶液。正常對照組：在乙醚淺麻醉下，單純以溶劑（20%乙醇）0.25ml經導管ig，每周2次，共12wk。 病理對照組：36%BBN溶液0.25ml（90mg）ig，每周2次，共12wk、 每隻鼠BBN總劑量2.16g。土茯苓組：BBN處理同病理對照組，以每1 kg含120g土茯苓乾粉的飲食飼養。 至wk30實驗結束，處死動物，取膀胱、輸尿管、腎盂，腎、肝和脾作組織學檢查。 結果：土茯苓組對BBN膀胱腫瘤的發生無明顯抑制作用，而且發生了較多的鱗狀細胞型腫瘤。 結論：因此在使用本品防治膀胱腫瘤時，應持慎重態度。  1.2對黃曲霉毒素B1致大鼠肝癌作用的影響  試驗動物：雌性 Wistar 大鼠，8wk齡， 試驗： 大鼠從注射AFB1前10d起，至停注AFB1後3d止，進食含受試物飼料。 肝癌啟動剤：(ip)AFB1（280ug/kg，6次/wkx2）。2 wk 後， 施以促癌程序：給含0.015% 2-乙酰氨基芴（2AAF）飼料2wk， 在 一周後，切除大鼠肝中葉和左外側葉。 10 d 後，斷頸處死大鼠，肝臟取材作 r-谷氨酰轉肽酶（r-GT）染色。 結果：大鼠肝癌前病變 r-GT染色陽性肝細胞灶。土茯苓組（飼料中含377.7g/kg）的病灶也稍少，且顯著小於對照組。  結論：提示土茯苓對預防肝癌有一定的實用價值。  2.對棉酚的解毒作用試驗動物：雄性大鼠採用土茯苓水煎劑（劑量：每鼠每日相當生藥1g和0.5g兩種），土茯苓稀醇制劑（劑量：相當生藥1g和2g），土茯苓粗黃酮（劑量：50mg和100mg），土茯苓多糖（劑量：0.5ml和1.0ml），硫酸亞鐵（劑量8mg），每組用藥3d後分別 igl 次純棉酚650mg/kg、850mg/kg和100mg/kg，觀察解毒作用。 結果：土茯苓水煎劑、稀醇制劑和粗黃酮均具有拮抗急性和亞急性棉酚中毒（P＜0.05，P＜0.001和P＜0.001）。一般棉酚中毒時可用硫酸亞鐵拮抗，但能影響抑精作用。土茯苓稀醇提取物在拮抗棉酚毒性的同時不影響棉酚對雄性大鼠的抑精作用。 編者按：ip 是 intraperitoneal 的縮寫。是指�腹腔內�（給藥）。AFB1 是Aflatoxin B1 的縮寫。中文是黃黴素B1。黃黴素是黃黴的毒素，是致肝癌的毒素。Wk 是 week (週) 的縮寫。d 是 day (天)的縮寫。Chemical ingredients:化學成份：[1]β-sitosterol palmitateβ-谷甾醇棕櫚酸酯β-sitosterolβ-谷甾醇daucosterol胡蘿卜苷1-O-hexadecanoyl-3-O-β-D-galactop yranosyl-glycerol,41-棕櫚酰基-3-O-β-D-半乳糖基甘油酯astilbin落新婦苷quercetin槲皮素taxilfolin花旗鬆素quercetin-4′-O-β-D-pyranglucoside槲皮素-4′-O-β-D-吡喃葡萄糖苷isoastilbin異落新婦苷Dosage:用量：for concoction: 15g to 30 g per day.for external use: make into powder.內服入煎劑15～30克 。外用：研末調敷。Samples of formulae:處方舉例：Interstitial cystitis 間質性膀胱炎 ﹐psoriasis 銀痟病Present applications:现代應用：chronic atrophic gastritis, thrombocytopenic purpura (ITP), phlebitis, gonnorhea, urinary tract infections, non-infection type of urinary tract syndrome, painful menses, fibroids in the ovaries, skin disease of babies.慢性萎縮性胃炎 ﹐血小板 减少性紫瘢﹐ 血栓性靜脈炎﹐ 淋病﹐泌尿系統感染﹐非感染性尿道綜合症﹐經痛﹐卵巢囊腫﹐小兒皮膚病。Cautions:禁忌：Use caution  in cases of gan shen yin xu (liver-kidney yin deficient)  Do not take with tea.　肝腎陰虚.者慎服。服藥期間避免喝茶。[1]吴博； 馬躍平； 袁久志； 孫啟時； 【機構】 沈 陽藥科大學中藥學院[1] WU Bo,MA Yue-ping,YUAN Jiu-zhi,SUN Qi-shi(School of Traditional Chinese Materia Medica,Shenyang Pharmaceutical University,Shenyang 110016,China)[2] Zhong Hua Ben Cao 中華本草    Search this siteProblems with website? Please Click here for comment. (Not for inquiry )    Click here for inquiryCopyright Notice 按此看關於版權問題A manuscript... writing, translating and proofreading  in progressSponsors' Ads by Google 以下為谷歌 所提供之廣告 List of Health ProblemsChinese Herb DictionaryToxicity of Some HerbsSide Effect of Some HerbsHerbs that can be toxic to kidneysTraditional Chinese Medicine TCM Diagnosis Samples of FormulaeTerms of Traditional Chinese MedicineAcupuncturecopy right 版權所有Qigong (chi kung)Prescribed Drug DictionaryEmail our web master for  your suggestion (not for inquiry)Biochemistry DictionaryGeneral Online LibraryQigong classesFake Email WarningResearch LibrarianSearchQigong classesHomeWeather ReportDisclaimerLast update: Feb 28, 2014; 4;31 p.m. LAH   \n",
        "original_url": "http://alternativehealing.org/tu_fu_ling.htm"
    },
    {
        "Names": {
            "Name": [
                "qian jin ba",
                "千斤拔"
            ],
            "Pharmaceutical": [
                "Radix Moghaniae philippinensis"
            ],
            "Biological": [
                "Flemingia philippinensis Merr.et Rolfe",
                "Moghania philippinensis (Merr.et Rolfe) Li"
            ],
            "Common": [
                "Flemingia Root"
            ],
            "Other name": [
                "chou kong zi 臭空仔",
                "kao shu wei 考鼠尾",
                "tou di long 透地龍",
                "niu da li 牛大力",
                "qian li ma 千里馬"
            ],
            "Chinese": [
                "千斤拔"
            ],
            "Pronunciation in Korean": [
                "cheongeunbal (千斤拔)"
            ],
            "Pronunciation in Japanese": [
                "enokimame （榎豆）"
            ],
            "Pronunciation in Cantonese": [
                "cin1 gan1 bat6"
            ],
            "Pinyin Pronunciation": []
        },
        "Type": "Herb",
        "Geography": [
            "Fujian",
            "Taiwan",
            "Hubei",
            "Hunan",
            "Guangdong",
            "Hainan",
            "Guangxi",
            "Guizhou",
            "Yunnan"
        ],
        "Properties": [
            "sweet",
            "tart",
            "neutral"
        ],
        "Meridians": [
            "liver",
            "kidney"
        ],
        "Maladies Treated": [
            "rheumatoid arthritis",
            "injury of the loin muscles",
            "heat in lungs",
            "cough due to lung deficiency",
            "tuberculosis",
            "chronic asthma",
            "chronic hepatitis",
            "spermatorrhea",
            "leukorrhea",
            "weakness in the arms and legs",
            "injury from impact and sprain"
        ],
        "Medical Function": [
            "strong lymphocyte proliferation inhibitory activity [2]"
        ],
        "Dosage": "15～30 g.",
        "Samples of Formulae": "",
        "Contraindications": "Long term usage or using large amount can be toxic to the kidneys.",
        "Research": "Strong lymphocyte proliferation inhibitory activity [2].",
        "Notes": "",
        "Chemical Ingredients": [
            "flemiphilippinin C",
            "flemiphilippinin D",
            "5,7,3',4'-tetrahydroxy-6,8-diprenylisoflavone",
            "flemichin D",
            "lupeol",
            "β-sitosterol",
            "carboxylic (alkanoic) acid with carbon atom number of 22-30",
            "flemicoumestan A 1",
            "lupinifolin",
            "5,7,3',4'-tetrahydoxyl isoflavone",
            "5,7,2',3',4'-5-hydroxyl isoflavone",
            "genistin",
            "sophoricoside",
            "chrysophanol",
            "emodinmono methyl ether",
            "emodin",
            "islandicin",
            "caffeic acid acid octacosyl ester",
            "monopalmitic acid glycerol ester",
            "scoparone",
            "salicylic acid",
            "propyl paraben",
            "betulinic acid",
            "羽扇豆醇 (lupeol duplicate in English above)"
        ],
        "References": [
            "[1] DOI： CNKI:SUN:AHNY.0.2008-27-082",
            "[2] Fitoterapia. 2011 Jun;82(4):615-9. Epub 2011 Jan 28."
        ],
        "Further Reading": [
            "http://www.niubiao.com/yiyao/6196.html"
        ],
        "Original Text": "qian jin ba,Complementary and Alternative Healing University\n\n\n\n\n\n    Complementary and Alternative Healing University  \n\n\n中藥詞典                 \n    Chinese Herb Dictionary             \n     Search \n    this site\n\n\n\n\nSearch this site\n\nList of Health Problems\n\nChinese Herb Dictionary\n\nQigong\n\nTraditional Chinese Medicine (TCM)\n\nAcupuncture\n\nPrescribed Drug Dictionary\n\nBiochemistry Dictionary\n\nLecture Slides\n\nResearch Librarian\n\nGeneral Online Library\n\nSearch\n\nResearch Sites\n\nViagra\n\nMassage/Acupressure\n\nHypnotherapy\n\nTell us what you want\n\nNotify Changes & New Information\n　\n　\nTo blog or to post your discussion click here.                                     \n\nLast update: \nSept 21 2011; 11:00 p.m. LAH \n\n\nqian jin ba  千斤拔 \n(in English and Chinese 中英文)\nby: Joe Hing kwok Chu \n\nPharmaceutical name:英文藥名﹕\nRadix Moghaniae philippinensis\nBotanical name:學名﹕\nFlemingia philippinensis Merr.et Rolfe\nMoghania philippinensis (Merr.et Rolfe) LiPron. in Japanese:日語發音﹕\n\n  enokimame （榎豆）Pron. in Korean:韓語發音﹕\ncheongeunbal (千斤拔)\nPron. in Cantonese:\n粵音﹕\ncin1 gan1 bat6Other Names:別名﹕\nchou kong zi 臭空仔，kao shu wei 考鼠尾，tou di long 透地龍，niu da li 牛大力，qian li ma 千里馬。Common Name:英文名﹕\nFlemingia RootDistribution:產地﹕\nFujian, Taiwan, Hubei, Hunan, Guangdong, Hainan, Guangxi, Guizhou, Yunnan provinces.\n福建，臺灣，湖北，湖南，廣東，海南，廣西，貴州，雲南等地。Properties(characteristics)﹕性味﹕\nsweet, tart, neutral.\n甘，涩，平。\nChannels (meridians) entered: \n歸經﹕\nliver, kidney.\n肝，腎。Medical functions:藥理﹕ \n\nstrong lymphocyte proliferation inhibitory activity [2]\n有強的抑制淋巴細胞增殖作用 [2]Actions & Indications:主治﹕\nFor treatment of rheumatoid arthritis, injury of the loin muscles, heat in lungs, cough due to lung deficient, tuberculosis, chronic asthma,  chronic hepatitis, spermatorrhea, leukorrhea, weakness in the arms and legs, and  injury from impact and sprain.\n用於腰肌勞損，風濕性關節炎，治肺熱，肺虛咳嗽，肺結核，慢性支氣管炎，慢性肝炎，遺精，白帶，手脚無力，跌打損傷。Chemical ingredients:化學成份﹕\n\nflemiphilippinin C, D [1]\n\n蔓性千斤拔素C，D\n\n5,7,3�,4-tetrahydroxy-6,8-diprenylisoflavone\n\n5，7，3＇，4＇-四羥基-6，8-雙異戊烯基異黃酮\n\nflemichin D\n\n千斤拔素 D\n\nlupeol\n\n羽扇豆醇\n\nβ-sitosterol\n\nβ-谷甾醇\n\ncarboxylic (alkanoic) acid with  carbon atom number of 22-30\n\n碳原子數為22-30的正烷酸\n\nflemicoumestan A 1\n \n\n\n    lupinifolin\n \n\n\n    5,7,3',4'-tetrahydoxyl isoflavone\n\n\n    5,7,3',4'-四羥基異黃酮\n\n\n    5,7,2',3',4'-5-hydroxyl \n    isoflavone\n\n    5,7,2',3',4'-五羥基異黃酮\n\ngenistin\n\n\n    染料木苷\n\nsophoricoside\n\n\n    槐屬苷\n\nchrysophanol\n\n\n    大黃酚\n\n\n    emodinmono methyl ether\n\n\n    大黃素甲醚\n\nemodin\n\n\n    大黃素\n\n\n    islandicin\n\n\n    島青霉素\n\ncaffeic acid\n    acid octacosyl ester\n\n\n    咖啡酸二十八烷酯\n\nmonopalmitic \n    acid glycerol ester\n\n\n    單棕櫚酸甘油酯\n\n\nscoparone\n\n\n    濱蒿內酯\n\nsalicylic acid\n\n\n    水楊酸\n\npropyl paraben\n\n\n    對甲氧基苯丙酸\n\n\nbetulinic acid\n\n\n    白樺酸\n\n\n    lupeol\n\n\n    羽扇豆醇\n \n \n \n \nDosage:用量﹕\n15～30 g.Samples of formulae:處方舉例﹕\n \nModern Research:現代研究﹕\n \nToxicity & Cautions:毒素與禁忌﹕\nlong term usage or using large amount can be toxic to the kidneys.\n長期服用或用量過大可能對腎臟有毒。　\n[1] DOI： CNKI:SUN:AHNY.0.2008-27-082\n[2]\n\nFitoterapia. 2011 Jun;82(4):615-9. Epub 2011 Jan 28. \n\nMore on chemical ingredients: http://www.niubiao.com/yiyao/6196.html\n看化學成份更多資料：http://www.niubiao.com/yiyao/6196.html  Sponsors' Ads by Google 以 下為谷 歌所提供之廣告  A manuscript... writing, translating and proofreading                  in progressClick here for comment. (Not for inquiry )      Click here for inquiry   Copyright Notice 按此看關 於版權 問題\n\nList of Health Problems\n\nChinese Herb Dictionary\n\nToxicity of Some Herbs\n\nSide Effect of Some Herbs\n\nHerbs that can be toxic to kidneys\nTraditional Chinese Medicine\nTCM Diagnosis\nSamples of Formulae\n\nTerms of Traditional Chinese Medicine\n\nAcupuncture\n\ncopy right\n \n\n版權所有\n\n\nQigong (chi kung)\n\nPrescribed Drug Dictionary\n\nEmail our web master for  your suggestion (not for inquiry)\n\nBiochemistry Dictionary\n\nGeneral Online Library\n\nQigong classes\n\nFake Email Warning\n\nResearch Librarian\n\nSearch\n\nQigong classes\n \n\nHome\n\nWeather Report\n\n    \n\nDisclaimer   \n",
        "original_url": "http://alternativehealing.org/qian_jin_ba.htm"
    }
]