[
    {
        "Names": {
            "Name": [
                "bie jia"
            ],
            "Pharmaceutical": [
                "Carapax trionycis"
            ],
            "Biological": [
                "Trionyx sinensis Wiegmann"
            ],
            "Chemical": [],
            "Common": [
                "hard shell of soft shell turtle"
            ],
            "Other name": [
                "tuan yu jia 團魚甲",
                "shui yu jia 水魚甲"
            ],
            "Chinese": [
                "鱉甲"
            ],
            "Pronunciation in Korean": [
                "pyolgap"
            ],
            "Pronunciation in Japanese": [
                "bekko"
            ],
            "Pronunciation in Cantonese": [
                "bit3 gaap3"
            ],
            "Pinyin Pronunciation": []
        },
        "Type": "Animal",
        "Geography": [
            "Mainly produced in Hubei, Anhui, Jiangsu, Henan, Zhejiang, Jiangxi provinces of China"
        ],
        "Properties": [
            "salty",
            "neutral"
        ],
        "Meridians": [
            "liver",
            "spleen",
            "kidney"
        ],
        "Maladies Treated": [
            "yinxu (yin deficient) with flashes: usually combine with qing hao (Artemisia annua), di gu pi (Lycium root bark)",
            "yinxu with heat and pain: usually combine with gui ban (turtle shell), mu li (oyster shell), bai shao (white peony root), e jiao (donkey hide gelatin)",
            "chronic malaria, pain in rib and chest, amenorrhea, cirrhosis (hardening and swelling) of liver and spleen: usually combine with san leng (Sparganium), e zhu (Curcuma zedoaria), qing pi (unripe tangerine peel), xiang fu zi (nutgrass rhizome), hong hua (Carthamus safflower), tao ren (peach kernel)",
            "enlargement of liver and spleen",
            "enlargement of thyroid glands",
            "enlargement of lymphatic glands",
            "aplastic anemia (bone marrow hypoplasia)"
        ],
        "Medical Function": [
            "prevent cirrhosis of liver and spleen",
            "improves immune system",
            "anti-tumor effect: soft shell turtle shell powder, for oral use of 280 mg/kg in mice with transplanted cancer MH134, inhibited tumors with reduced diameter, and significantly reduced tumor weight; but for ascites carcinoma there was no significant effect",
            "on nude mice with transplanted human colon cancer cells, given daily dose of 800mg/kg of soft shell turtle shell powder for 35 days, the inhibitory rate was 92.15%, and tumor necrosis area was 67%; compared to using the drug 5-fluorouracil (5-Fu), the advantage was that it did not cause white blood cell count to decrease; this indicates that the turtle shell powder can inhibit colorectal cancer in humans, with only small side effect and bone marrow suppression effect is much less than that of 5-Fu",
            "suppresses yang by promoting yin (when used untreated/raw)",
            "softens hardness and disperses clumps (when roasted in sand)"
        ],
        "Dosage": "For internal use: 10 to 24 g in decoction. For external use: make into powder. Use appropriate amount and apply to affected area.",
        "Samples of Formulae": "For enlargement of liver and spleen: bie jia jian wan (Bie Jia Decoction Pill). \n Bie jia should be cooked first (cook longer than other herbs) or roasted in sand.\n In promoting yin and and suppressing yang, bie jia should be use untreated. \n For treating breast tumors, it should be roasted in sand first.",
        "Contraindications": "Not to use in cases of lack of appetite, loose stool due to pixu (spleen deficient). Use with care in cases of pregnancies.",
        "Research": "Soft shell turtle shell powder for oral use of 280 mg/kg in mice with transplanted cancer MH134 inhibited tumors with reduced diameter and significantly reduced tumor weight; but for ascites carcinoma there was no significant effect.\n\nIn nude mice with transplanted human colon cancer cells, given daily dose of 800mg/kg of soft shell turtle shell powder for 35 days, the inhibitory rate was 92.15%, and tumor necrosis area was 67%. Compared to using the drug 5-fluorouracil (5-Fu), the advantage was that it did not cause white blood cell count to decrease. This indicates that the turtle shell powder can inhibit colorectal cancer in humans, with only small side effect and bone marrow suppression effect is much less than that of 5-Fu.\n\n(Source: Zhong Hua Ben Cao)",
        "Notes": "Those bie jia (soft turtle shells) sold, if they are clean and white in color, most of them have been extracted for bie jia jiao (gelatin). They are waste product and do not have medicinal value. Unprocessed bie jia should still contain some skin and flesh.\n\nsheng bie jia is raw shell, mainly used in nourishing yin (in yinxu (yin deficient) condition).\n\nzhi bie jia is baked shell, mainly used for swollen liver or spleen.\n\nChronic malaria or repeated occurrence of malaria can cause enlargement of liver and spleen, also known as nüe mu (malaria-mother) or nüe pi (malaria-splenomegaly).\n\nSoftening hardness and dispersing clumps refers to the TCM concepts of 'ji ju' (accumulation), 'jie' (knot), and 'jian' (firmness), which are terms found in classical Chinese medical texts to describe breast tumors. Commonly used TCM herbs for softening hardness and dispersing clumps include ao jia (turtle shell), xia ku cao (selfheal), kun bu (kelp), hai zao (seaweed), mu li (oyster shell), etc.",
        "Chemical Ingredients": {
            "animal colloid": "main constituent is collagen",
            "keratin": "",
            "iodine": "",
            "vitamin D": "",
            "calcium phosphate": "",
            "calcium carbonate": ""
        },
        "References": [
            "Source: Zhong Hua Ben Cao"
        ],
        "Further Reading": [],
        "Original Text": "bie jia, Complementary and Alternative Healing UniversityComplementary and Alternative Healing University   中藥詞典  Chinese Herb Dictionary   Search this site    在本網站找資料bie jia 鱉 甲   Edited by: Joe Hing kwok ChuPharmaceutical name:英文藥名 ﹕Carapax trionycisZoological name:動物學名 ﹕Trionyx sinensis WiegmannPron. in Japanese:日語發音﹕bekkoPron. in Korean:韓語發音﹕pyolgapPron. in Cantonese:粵音﹕bit3 gaap3Other Names:別名﹕tuan yu jia 團魚甲，shui yu jia 水魚甲，Common Name:英文名﹕hard shell of soft shell turtleDistribution:產地﹕Mainly produced in Hubei, Anhui, Jiangsu, Henan, Hubei, Zhejiang, Jiangxi provinces of China.主 產 於 湖 北 ﹐ 安 徽 ﹐ 江 蘇 ﹐ 河 南 ﹐ 湖 北 ﹐ 浙 江 ﹐ 江 西 等 省 。Properties characteristics)﹕性味﹕salty, neutral.味鹹 ，性平 。Channels  meridians) entered: 歸經﹕liver, spleen, kidney.入 肝 ,   脾 ,   腎 經 。Medical functions:藥理﹕ Prevent cirrhosis of liver and spleenImproves immune system. Anti-tumor effect. Soft shell turtle shell powder, for oral of 280 mg / kg in mice with transplanted cancer MH134, inhibited tumors with reduced diameter, and significantly reduced tumor weight; but for ascites carcinoma there was no significant effect. On the nude mice with transplanted human colon cancer cells,  given the daily dose of  800mg / kg of soft shell turtle shell powder, the result was that: treatment and control group, the inhibitory rate was 92.15%, and tumor necrosis area was 67%. Compare to using the drug 5-fluorouracil (5- Fu) group, the advantage was that it did not cause white blood cell count to decrease. This indicate that the turtle shell powder can inhibit colorectal cancer in human, and with only small side effect, bone marrow suppression effect is much less than that of 5-Fu.  《source: Zhong Hua Ben Cao 》藥理﹕防 止肝,  脾硬化 (組織壞死 )有 增強身體免疫機能作用 。抗腫瘤作用。鱉甲粉末口服280mg/kg對小鼠移植實質性癌MH134具有抑制作用，使腫瘤直徑減小，腫瘤重量顯著減輕。對腹水癌則沒有顯著作用。對接種人腸癌細胞的裸鼠每日按800mg/kg劑量口服鱉甲粉，治療35 天後與對照組比較，抑瘤率為92.15%，腫瘤壞死面積達67%，與5-氟尿嘧啶(5-Fu)組比較,其優點是不引起宿主白細胞數下降，表明鱉甲粉不僅對人腸癌有抑制作用，且副反應小，對骨髓的抑制遠比5-Fu輕。(資料來源: 《 中華本草 》 Actions & Indications:主治﹕For yinxu (yin deficient)   with flashes: usually combine with qing hao, di gu pi  For yinxu with heat and pain: usually combine with gui ban, mu li, bai shao, e jiao .For chronic malaria, pain in rib and chest, amenorrhea, cirrhosis hardening and swelling of liver and spleen: usually combine with san leng , e zhu, qing pi , xiang fu zi, hong hua  ,tao ren.For enlargement of liver and spleen.For enlargement of thyroid glandsFor enlargement of lymphatic glandsBie jia should be cooked first (cook longer than other herbs) or roasted in sand.In promoting yin and and suppressing yang, bie jia should be use untreated. For treating breast tumors, it should be roasted in sand first.治陰 虛潮熱 ﹕  常配青 蒿 ,   地骨皮等同用 ；治陰虛陽亢動風 ﹕  常與龜 板  ,    牡蠣 ,    白 芍 ,   阿膠等同用 。治久瘧 ,   瘧母 ,   胸脅作痛及月經不通 ，癥瘕 積聚等症 ﹕ 可 與 三 棱 ,   莪朮  ,   青皮 ,    香附子 ,   紅花 ,  桃仁等 配 伍應用 。 治肝脾腫大、甲狀線及淋巴 腺腫大。 治再 生障礙性貧血（即骨髓不造血）。 生 品先煎或砂炙。滋陰潛陽宜生用，軟堅散結宜砂炙用。 Chemical ingredients:化學成份﹕animal colloid, among them collagen is the main constituent, keratin, iodine, vitamin D, calcium phosphate, calcium carbonate.動物膠，其中骨膠原為主要成份，角蛋白，碘質，維生素D，磷酸鈣，碳酸鈣等。Dosage:用 量﹕For internal use: 10 to 24 g in decoctionFor external use: make into powder. Use appropriate amount and apply to affected area.內服 入煎劑 ，常用具10～24克。 外用：研末撒或調敷。Samples of formulae:處方舉 例﹕For enlargement of liver and spleen: bie jia jian wan 鱉甲煎丸Modern Research:現代研究﹕ Toxicity & Cautions:毒素與禁忌﹕Not to use in cases of lack of appetite, loose stool due to pixu (spleen deficient)Use with care in cases of pregnancies脾虛,  食少便溏及 孕婦慎 服qualify of herb:飲片的質量：Those bie jia (soft turtle shells) sold, if they are clean and white in color, most of them have been extracted for bie jia jiao (gelatin). They are waste product and do have have medicinal value.市上賣的潔白， 看來很乾淨的鱉甲大多數經過熬煉鱉甲膠的廢物, 沒有藥用價值。沒經過熬煉的鱉甲應該還帶有一些皮肉的。sheng bie jia is raw shell, mainly used in nourishing yin (in yinxu (yin deficient)  condition).zhi bie jia is baked shell, mainly used for swollen liver or spleen.生 鱉 甲 ，即  鱉 甲生 用 。 主 要 用 於 滋 陰 潛 陽 。炙 鱉 甲 ，即 砂 炙之  鱉 甲   . 主 要 用 於 軟 堅 散 結 。瘧母即慢性瘧疾或瘧疾反復發作所致的肝脾腫大。亦稱瘧痞。軟堅散結：乳癌腫瘤在中醫古典著作中稱為「積聚」, 「結」, 「堅」等。軟堅散結常用的中藥有鰲甲, 夏枯草, 昆布, 海藻, 牡蠣等 等。Search this siteProblems with website? Please Click here for comment. (Not for inquiry )    Click here for inquiryCopyright Notice 按此看關於版權問題Sponsors' Ads by Google 以下為谷歌 所提供之廣告A manuscript... writing, translating and proofreading  in progress List of Health ProblemsQigong (chi kung)Toxicity of Some HerbsSide Effect of Some HerbsHerbs that can be toxic to kidneysTraditional Chinese Medicine TCM Diagnosis Samples of FormulaeTerms of Traditional Chinese MedicineAcupunctureChinese Herb Dictionary Qigong classesPrescribed Drug DictionaryEmail our web master for  your suggestion (not for inquiry)Biochemistry Dictionary Qigong classes Research Librarian copy right 版權所有HomeWeather ReportDisclaimerLast update: Sept 25, 2014; 4:25 p.m. LAH   ",
        "original_url": "http://alternativehealing.org/bie_jia.htm"
    },
    {
        "Names": {
            "Name": [
                "dan shen",
                "丹參"
            ],
            "Pharmaceutical": [
                "Radix Salvia miltiorrhizae"
            ],
            "Biological": [
                "Salvia miltiorrhiza Bge."
            ],
            "Common": [
                "salvia root"
            ],
            "Other name": [
                "chi shen 赤參",
                "zi dan shen 紫丹參",
                "chao dan shen",
                "bie xue dan shen 鱉血丹參"
            ],
            "Chinese": [],
            "Pronunciation in Korean": [
                "daan1 sam"
            ],
            "Pronunciation in Japanese": [
                "tanjin"
            ],
            "Pronunciation in Cantonese": [
                "tan sam1"
            ],
            "Pinyin Pronunciation": []
        },
        "Type": "Herb",
        "Geography": [
            "Hebei",
            "Shanxi",
            "Inner Mongolia",
            "Liaoning",
            "Jilin"
        ],
        "Properties": [
            "bitter",
            "slightly cold"
        ],
        "Meridians": [
            "heart",
            "liver"
        ],
        "Maladies Treated": [
            "clot blood",
            "pain",
            "dysmenorrhea",
            "amenorrhea",
            "palpable tumors",
            "angina",
            "heat bi",
            "restlessness and insomnia",
            "irritability",
            "swollen spleen",
            "pain in digestive system"
        ],
        "Medical Function": [
            "invigorate blood",
            "breakup blood stasis",
            "antithrombotic",
            "antihypertonic (lowering blood pressure)",
            "antimicrobial",
            "anti HBV effect. The anti HBV effect is stronger when combined with zhu ling (Polyporus sclerotium) [1]",
            "antipyretic",
            "anti-inflammatory",
            "hepatoprotective: inhibits fibrinogen and aids in the resorption of fibrous plaques in the liver",
            "sedative",
            "modulate cancer growth and metastases [20]",
            "Significantly increase in coronary blood flow due to reduction of vascular resistance",
            "antifibrosis of liver; enhances preservation of donor liver; removes oxygen free radicals in liver cells; reduces damage from ischemia and reperfusion, reduces fatty degeneration and necrosis of liver cells; promotes regeneration of remnant liver; prevents recurrence and metastasis of liver cancer; affects portal hypertension hemodynamics in cirrhosis patients [19]"
        ],
        "Dosage": "6 to 15 g",
        "Samples of Formulae": "tian wang bu xin dan (Tian Wang Bu Xin Dan, Heavenly Emperor Heart-Nourishing Pill)",
        "Contraindications": "Administration of tinctures of this herb can lead to severe itching, stomachache, or reduced appetite.\nWhile taking dan shen do not use soy milk or soy product because milk or soy product can lower the effectiveness of dan shen. Do not use with blood thinning drugs, like warfarin, heparin etc.\nThe active ingredient, tanshinone, can combine with soy product and form insoluble substance, thus lessen the effectiveness of blood thinning, pain arresting.",
        "Research": "anti-HBV effect is stronger when combined with zhu ling (Polyporus sclerotium) [1]\nPharmacologic actions include antifibrosis of liver; enhances preservation of donor liver; removes oxygen free radicals in liver cells; reduces damage from ischemia and reperfusion, reduces fatty degeneration and necrosis of liver cells; promotes regeneration of remnant liver; prevents recurrence and metastasis of liver cancer; affects portal hypertension hemodynamics in cirrhosis [19]\nModulates cancer growth and metastases [20]",
        "Notes": "",
        "Chemical Ingredients": [
            "tanshinone (丹參酮)",
            "cryptotanshinone (隐丹参酮)",
            "hydroxytanshinone (羟基丹参酮)",
            "methyl tanshinonate (丹参酸甲酯)",
            "przewatanshinquinone A (紫丹参甲素)",
            "przewatanshinquinone B (紫丹参乙素)",
            "miltirone (次甲丹参醌)",
            "dihydrotanshinone (二氢丹参酮)",
            "nortanshinone (去甲丹参酮)",
            "1,2,15,16-tetrahydrotanshiquinone (1,2,15,16-四氢丹参醌)",
            "isotanshinone (異丹參酮)",
            "isocryptotanshinone (異隐丹参酮)",
            "salviol (鼠尾草酚)",
            "tanshialdehyde (丹参醛)",
            "tanshinol A (丹參素A)",
            "tanshinol B (丹參素B)",
            "tanshinol C (丹參素C)",
            "3-α-hydroxy tanshinone (3-α-羥基丹參酮)",
            "tanshiquinone A, B, C (丹参醌A, B, C)",
            "saloilenone (二萜荼苯酮)",
            "danshen spiroketal lactone (丹参隐螺内酯)",
            "danshensuan A, B, C (丹参酸甲、乙、丙)",
            "protocatechuic acid (原兒茶酸)",
            "protocatechuic aldehyde (原兒茶醛)",
            "dihydroxybenzoic acid (二羟苯甲酸)",
            "baicalin (黄芩甙)",
            "β-sitosterol (β-轂固醇)",
            "ursolic acid (熊果酸/烏索酸/烏蘇酸)",
            "daucosterol (胡蘿蔔苷/胡蘿蔔甙/胡蘿蔔甾醇)",
            "isoferulic acid (異阿魏酸)",
            "dihydroisotanshinone (二氫異丹參酮)"
        ],
        "References": [
            "[1] Chinese journal of integrated traditional and Western medicine 1993 Sep;13(9):533-5, 516-7.",
            "[1] 中國中西醫結合雜誌，1993 年，九月 13日（9）533-5. 516-7",
            "[19] 裴蕾 任英 裴蕾(黑龍江農墾總局醫院,黑龍江,哈爾濱,150036) 任英(哈爾濱鬆江電機廠醫院,黑龍江,哈爾濱,150040) 刊 名：中醫藥學報 2002 年， 30(1) 英文刊名：ACTA CHINESE MEDICINE AND PHARMACOLOGY , 2002 30(1)",
            "[20] Carcinogeneses, vol 29, no. 10, pp. 1885-1892, 2008"
        ],
        "Further Reading": [],
        "Original Text": "dan shen, Complementary and Alternative Healing UniversityComplementary and Alternative Healing University \n  中藥詞典                 Chinese Herb Dictionary      Search this site     在本網站找資料\nSearch this siteList of Health ProblemsChinese Herb DictionaryQigongTraditional Chinese Medicine (TCM)AcupuncturePrescribed Drug DictionaryBiochemistry DictionaryLecture SlidesResearch LibrarianGeneral Online LibraryResearch SitesViagraMassage/AcupressureHypnotherapyTell us what you wantNotify Changes & New Information　\n　 dan shen      丹參  （in English and Chinese 中英文)by: Joe Hing Kwok ChuPharmaceutical name:英文藥名：Radix Salvia miltiorrhizaeBiological name:拉丁學名：Salvia miltiorrhiza Bge.Pron. in Japanese:日語發音：tanjinPron. in Korean:韓語發音：daan1 samPron. in Cantonese:粤語發音：tan sam1Other Names:別名：chi shen 赤參，zi dan shen 紫丹參，chao dan shen ，bie xue dan shen 鱉血丹參。Common Name:英文名：salvia rootDistribution:分佈：Hebei, Shanxi, Inner Mongolia, Liaoning, Jilin河北，山西，內蒙古，遼寧，吉林。Properties (characteristics)：性味：bitter, slightly cold味苦微寒。Channels (meridians) entered:歸經﹕heart and liver入心﹐ 肝二經。Actions & Indications: 主 治 ﹕rid of clot blood, pain, invigorate blood, breakup blood stasis,  for dysmenorrhea, amenorrhea, palpable tumors, angina, heat bi, restlessness and insomnia, irritability, swollen spleen, pain in digestive system,功能活瘀血, 止痛﹐ 經痛﹐ 無月經﹐可生新血,涼血,可觸知的腫瘤﹐心�けh﹐熱庳﹐煩燥不安﹐ 脾腫﹐ 消化系統疼痛。Medical Function:药理：antithromboticantihypertonic (lowering blood pressure)antimicrobial\n  anti HBV effect. The anti HBV effect is stronger when combine with\n  zhu ling [1]antipyretic anti-inflammatoryhepatoprotective: inhibits fibrinogen and aids in the resorption of fibrous plaques in the liver.sedativemodulate cancer growth and metastases [20]Significantly increase in coronary blood flow due to reduction of vascular resistance.藥理：抗血液凝结降血壓抗菌\n 抗乙型肝炎病毒；如配合豬苓其抗乙型肝炎病毒的作用會增強[1]退焼抗炎保肝作用:抗肝纖維化;提高供體肝臟的保存效果;消除肝細胞氧自由基; 減輕肝臟冷熱缺血再灌注後的損害; 減輕肝細胞脂肪變性和壞死;促進殘肝再生;防治肝癌轉移復發;對肝硬化門靜脈高壓血流動力學有影響.[19]鎮静抑制癌腫之增長與擴散 [20]可增加冠 狀動脉流量，因為丹参能减低血管阻力。Chemical ingredients:[n]化學成份：[n]tanshinone丹參酮cryptotanshinone[隐丹参酮hydroxytanshinone羟基丹参酮methyl tanshinonate丹参酸甲酯.przewatanshinquinone A紫丹参甲素przewatanshinquinone B紫丹参乙素miltirone次甲丹参醌dihydrotanshinone二氢丹参酮nortanshinone去甲丹参酮1, 2, 15, 16-tetrahydrotanshiquinone1,2,15,16-四氢丹参醌isotanshinone異丹參酮isocryptotanshinone異隐丹参酮salviol鼠尾草酚,tanshialdehyde.丹参醛tanshinol A丹參素Atanshinol B丹參素Btanshinol C丹參素C3-α-hydroxy tanshinone3-α-羥基丹參酮tanshiquinone A, B, C丹参醌 A, B, Csaloilenone二萜荼苯酮danshen spiroketal lactone丹参隐螺内酯danshensuan A, B, C丹参酸甲、乙、丙protocatechuic acid原兒茶酸protocatechuic aldehyde原兒茶醛dihydroxybenzoic acid二羟苯甲酸protocatechuic aldehyde原兒茶醛baicalin黄芩甙 β-sitosterolβ-轂固醇ursolic acid熊果酸/烏索酸/烏蘇酸daucosterol胡蘿蔔苷/胡蘿蔔甙 /胡蘿蔔甾醇isoferulic acid異阿魏酸dihydroisotanshinone 二氫異丹參酮Dosage:用量：6 to 15 g6~15克Samples of formulae:處方舉例：tian wang bu xin dan 天王補心丹Modern Research:现代研究：　　Cautions:禁忌：Administration of tinctures of this herb can lead to severe itching, stomachache, or reduced appetite.While taking dan shen do not use soy milk or soy product because milk or soy product can lower the effectiveness of dan shen. Do not use with blood thinning drugs, like warfarin, heparin etc.The active ingredient, tanshinone, can combine with soy product and form insoluble substance, thus lessen the effectiveness of blood thinning, pain arresting.服用丹参酒浸剤可能導致激烈的發癢，肚痛，食慾减退。用丹参時，不要用奶或豆類制品以免降低療效。 不可與抗凝血药物 如華法林，肝素 同用。丹參酮和豆奶容易形成不溶物，降低了丹參的活血化淤、理氣止痛的作用。\n[1] Chinese journal of integrated traditional and Western medicine 1993 \n    Sep;13(9):533-5, 516-7.[1] 中國中西醫結合雜誌，1993 年，九月 13日（9）533-5. 516-7[19]作者：裴蕾 任英 裴蕾(黑龍江農墾總局醫院,黑龍江,哈爾濱,150036) 任英(哈爾濱鬆江電機廠醫院,黑龍江,哈爾濱,150040)  刊 名：中醫藥學報 \n  2002 年， 30(1) 英文刊名：ACTA CHINESE MEDICINE AND PHARMACOLOGY , 2002 30(1)[20] Carcinogeneses, vol 29, no. 10, pp. 1885-1892, 2008 　[n] email Research LibrarianSearch this siteProblems with website? Please Click here for comment. (Not for inquiry )    Click here for inquiryCopyright Notice 按此看關於版權問題A manuscript... writing, translating and proofreading  in progressSponsors' Ads by Google 以下為谷歌 所提供之廣告 List of Health ProblemsChinese Herb DictionaryToxicity of Some HerbsSide Effect of Some HerbsHerbs that can be toxic to kidneysTraditional Chinese Medicine　TCM Diagnosis　Samples of FormulaeTerms of Traditional Chinese MedicineAcupuncturecopy right　版權所有Qigong (chi kung)Prescribed Drug DictionaryEmail our web master for  your suggestion (not for inquiry)Biochemistry DictionaryGeneral Online LibraryQigong classesFake Email WarningResearch LibrarianSearchQigong classesHomeWeather ReportDisclaimerLast update: Oct 12, 2014;\n    8 p..m. LAH　  \n",
        "original_url": "http://alternativehealing.org/dan_shen.htm"
    },
    {
        "Names": {
            "Name": [
                "dan pi",
                "mu dan pi"
            ],
            "Pharmaceutical": [
                "Cortex Moutan Radicis"
            ],
            "Biological": [
                "Paeonia suffruticosa Andr."
            ],
            "Chemical": [],
            "Common": [
                "peony root"
            ],
            "Other name": [],
            "Chinese": [
                "丹皮",
                "牡丹皮"
            ],
            "Pronunciation in Korean": [
                "moktanpi"
            ],
            "Pronunciation in Japanese": [
                "botanpi"
            ],
            "Pronunciation in Cantonese": [
                "maau5 daan1 pei4"
            ],
            "Pinyin Pronunciation": []
        },
        "Type": "Herb",
        "Geography": [
            "China (throughout, especially Anhui, Henan, Sichuan, Hunan, Shaanxi, Shandong, Gansu, Guizhou)"
        ],
        "Properties": [
            "acrid",
            "bitter",
            "mildly cool"
        ],
        "Meridians": [
            "heart",
            "liver",
            "kidney"
        ],
        "Maladies Treated": [
            "purpura due to low platelet count",
            "infectious diarrhea",
            "hypertension",
            "allergenic rhinitis",
            "cholinergic hives (hives appear in response to a rise in body temperature from exercise, overheating, or stress)"
        ],
        "Medical Function": [
            "clears heat and cools the blood",
            "clears fire of yin deficiency",
            "clear blood stasis and rid of clots",
            "drain pus and reduces swelling due to blood stasis",
            "effect on circulation",
            "anti micro organism",
            "anti inflammatory and effect on immune system",
            "effect on CNS",
            "effect on secretion of water and sodium when dosage is increased. Low dosage does not have effect on secretion of potassium. At highest dosage secretion of potassium is decreased."
        ],
        "Dosage": "6 to 12 g",
        "Samples of Formulae": "dan zhi xiao yao san (丹梔逍遙散)",
        "Contraindications": "Not to use in cold disorder, pregnancy, excessive menstruation, bleeding, yin deficiency with night sweat. Not compatible with tu si zi (Cuscuta seed), bei mu (Fritillaria), da huang (Rhubarb), and da suan (garlic).",
        "Research": "",
        "Notes": "",
        "Chemical Ingredients": {
            "": [
                "paeonol",
                "paeonoside",
                "paeonolide",
                "apiopaeonoside",
                "paeoniflorin",
                "ozypaeoniflorin",
                "benzoylpaeoniflorin",
                "benzoyl-oxypaeoniflorin",
                "gallic acid",
                "1,23,4,6-pentagalloylglucose"
            ]
        },
        "References": [],
        "Further Reading": [],
        "Original Text": "\n\n\n\n\ndan pi 丹皮, Complementary and Alternative Healing University\n\n\n\n\n\nComplementary and \n    Alternative Healing University\n    \n \n\n\n\n\n\n中藥詞典                 \n    Chinese Herb Dictionary     \n     Search this \n    site     \n\n在本網站找資料\n\n\n\n\n\n\n\n\n\n\n\n\n\n\nSearch this \n        site\n\n\nList \n        of Health Problems\n\n\n\n\n\n\n        Chinese Herb Dictionary\n\n\n\n\n\nQigong\n\n\n\n\n\n\n        Traditional Chinese Medicine (TCM)\n\n\n\n\n\n\n        Acupuncture\n\n\n\n\n\n\n        Prescribed Drug Dictionary\n\n\n\n\n\nBiochemistry Dictionary\n\n\n\n\n\nLecture Slides\n\n\n\n\n\nResearch Librarian\n\n\n\n\n\n\n        General Online Library\n\n\n\n\n\nResearch \n        Sites\n\n\n\n\n\n\n        Viagra\n\n\n\n\n\n\n        Massage/Acupressure\n\n\n\n\n\nHypnotherapy\n\n\n\n\n\nTell us what you want\n\n\n\n\n\nNotify Changes \n        & New Information\n\n\n\n　\n\n\n\n\n　\ndan pi, 丹皮; \n        mu dan pi, \n        牡丹皮 \n\n\n        (in English and Chinese 中英文)\n        \n\n\n        by: Joe Hing Kwok Chu\nClick \n        her to see picture of herb and plant. 按此看圖。\n\n\n\nPharmaceutical name:\n英文藥名：\n\n\nCortex Moutan Radicis\n\n\n\n\nBiological name:\n拉丁名：\n\n\nPaeonia suffruticosa \n            Andr.\n\n\n\n\nPron. in Japanese：\n日語發音:\n\n\nbotanpi\n\n\n\n\nPron. in Korean:\n韓語發音：\n\n\nmoktanpi\n\n\n\n\n\n\n            Pron. in Cantonese:\n\n粵語發音：\n\nmaau5 daan1 pei4\n\n\n\nCommon Name:\n英文名：\n\n\npeony root\n\n\n\n\nDistribution:\n分布：\n\n\nthroughout China, especially  \n            in Anhui, Henan, Sichuan, Hunan, Shaanxi, \n            Shandong, Gansu, Guizhou\n遍布於全國， \n            尤其在安徽，河南，四川，湖南，陕西，山東，甘肃，貴州。\n\n\n\n\nProperties (characteristics)\n性味：\n\n\nacrid, bitter, mildly cool\n辛，苦，略涼。\n\n\n\n\nChannels (meridians) \n            entered:\n歸經：\n\n\nheart, liver, kidney\n心，肝，腎。\n\n\n\n\nActions & \n            Indications:\n主治：\n\n\nclears heat and cools the \n            blood, clears fire of yin deficiency, clear blood stasis and rid of \n            clots, drain pus and reduces swelling due to blood stasis.\n清熱，涼血。去陰虛之火，排膿，消血瘀之腫。\n\n\n\n\nMedical Function:\n藥理：\n\n\n\n\n1. effect on circulation\n\n\n2. anti micro organism\n\n\n3. anti inflammatory,  \n              and effect on immune system\n\n\n4. effect on CNS\n\n\n5. effect on secretion \n              of water and sodium when dosage is increased. Low dosage does not \n              have effect on secretion of potassium. At highest dosage secretion \n              of potassium is  decreased.\n\n\n　\n\n\n對血液循環作用\n\n\n抗微生物作用\n\n\n抗炎，免疫作用\n\n\n對中區腦神經作用\n\n\n劑量增加時有排鈉與排水作用。低劑量對排鉀無作用。高劑量對排鉀作用降低。\n\n\n\n\n\n\nChemical ingredients:\n化學成分：\n\n\npaeonol, paeonoside, paeonolide, \n            apiopaeonoside\npaeoniflorin, ozypaeoniflorin, \n            benzoylpaeoniflorin, benzoyl-oxypaeoniflorin\ngallic aid, 1,23,4,6-pentagalloylglucose\n\n\n\n\n\nDosage:\n\n用量：\n\n\n6 to 12 g\n6∼12克。\n\n\n\n\n\nSamples of formulae:\n\n處方舉例：\n\n\n\ndan \n            zhi xiao yao san 丹梔逍遙散\n\n　\n\n\n\n\nModern Application:\n現代應用：\n\n\n1. purpura due to low platelet \n            count\n2. infectious diarrhea\n3. hypertension\n4. allergenic rhinitis\n5. cholinergic hives \n            （hives appear in response to a rise in body temperature from \n            exercise, overheating, or stress）.\n血小板低下所引起之紫斑\n感染性之腹瀉\n血壓高\n鼻敏感\n膽鹼功能性風疹 \n            （體溫升高時，如運動，過熱，神經壓力所引起的）。\n\n\n\n\nCautions:\n禁忌：\n\n\nnot to use in cold disorder, \n            pregnancy, excessive menstruation, bleeding,\n            \nyinxu (yin deficient)\nwith night sweat.\nNot compatible with\n            \ntu \n            si zi ,\n            \n            bei mu,\n            \n            da huang, and\n            \n            da suan\n有下列情形忌用：寒證，月經過多，出血， \n            \n 陰虛盜汗。\n反菟絲子，貝母，大黃 \n             ，大 \n            蒜。\n\n\n\n　\n　\n　\n\n   Search \n    this site \n\n\nProblems with website? Please \n\nClick \n    here for comment. (Not for inquiry )    \n    \n\n\nClick \n    here for inquiry \n\n\n\nCopyright Notice \n\n按此看關於版權問題\n\n\n\n\nA manuscript... writing, translating and proofreading  in progress\n\n\nSponsors' Ads by Google \n    以下為谷歌 所提供之廣告\n\n\n\n\n\n\n\n\nList \n        of Health Problems\n\n\n\n\n        Chinese Herb Dictionary\n\n\n\n\nToxicity of Some Herbs\n\n\n\nSide Effect of Some Herbs\n\n\n\nHerbs that can be toxic to kidneys\n\n\n\n\n        Traditional Chinese Medicine\n　\n\n\nTCM Diagnosis\n　\n\n\n        Samples of Formulae\n\n\n\n\n        Terms of Traditional Chinese Medicine\n\n\n\n        Acupuncture\n\n\n\n\n\ncopy right\n　\n\n\n版權所有\n\n\n\nQigong \n        (chi kung)\n\n\n\n\n        Prescribed Drug Dictionary\n\n\n\n\n        Email our web master for  your suggestion (not for inquiry)\n\n\n\nBiochemistry Dictionary\n\n\n\n\n\nGeneral Online Library\n\n\n\nQigong \n        classes\n\n\n\nFake \n        Email Warning\n\n\n\nResearch Librarian\n\n\n\nSearch\n\n\n\n\n\nQigong classes\n\n\n\nHome\n\n\n\n\n        Weather Report\n\n\n\n\n        Disclaimer\n\n\nLast update: Feb 10, 2014; 4 p.m. \n        LAH\n\n\n\n\n\n　\n\n\n\n\n\n\n\n\n\n",
        "original_url": "http://alternativehealing.org/dan_pi.htm"
    },
    {
        "Names": {
            "Name": [
                "hai zao"
            ],
            "Pharmaceutical": [
                "Herb Sargassi"
            ],
            "Biological": [
                "Sargassum siliquastrum Ag",
                "Sargassum pallidum (Turn.) C. Ag. (大葉海藻)",
                "Sargassum fusiforme (Harv.) Setch. (羊棲菜小葉海藻)"
            ],
            "Chemical": [],
            "Common": [
                "sea weed"
            ],
            "Other name": [],
            "Chinese": [
                "海藻",
                "大葉海藻",
                "羊棲菜小葉海藻"
            ],
            "Pronunciation in Korean": [
                "haecho"
            ],
            "Pronunciation in Japanese": [
                "kaiso"
            ],
            "Pronunciation in Cantonese": [
                "hoi2 zou2"
            ],
            "Pinyin Pronunciation": []
        },
        "Type": "Herb",
        "Geography": [
            "Cultivated in Fujian, Zhejiang, Guangdong, Liaoning, Shandong, Taiwan provinces"
        ],
        "Properties": [
            "Bitter",
            "Salty",
            "Cold"
        ],
        "Meridians": [
            "Kidney",
            "Liver",
            "Lung",
            "Stomach"
        ],
        "Maladies Treated": [
            "Goiter",
            "Scrofula (neck lymph tubercle)",
            "Cough",
            "Asthma",
            "Haemorrhoids",
            "Runny nose",
            "Discomfort in digestive tract",
            "Pain in hernia",
            "Pain and swelling of testes",
            "Edema (as diuretic)",
            "As antipyretic",
            "Urological diseases"
        ],
        "Medical Function": [
            ""
        ],
        "Dosage": "4.5 - 15 g daily.",
        "Samples of Formulae": "",
        "Contraindications": "Not to use in cases of pixu (spleen deficient).\nSome traditional sources mentioned that hai zao is not compatible with gan cao (licorice root), but in clinical application it is being used with gan cao.",
        "Research": "",
        "Notes": "",
        "Chemical Ingredients": [],
        "References": [],
        "Further Reading": [],
        "Original Text": "\n\n\nhai zao, sea weed, Complementary and Alternative Healing University\n\n\n\n\n\n\n\n\n\n\n\nComplementary and Alternative Healing University \n        Home\n\n現代中藥辭典\n\n\n\n\n\n\n\n\n\n\n\n\n\n\n\nSearch this site\n\n\n\n\n\n\nList of Health Problems\n\n\n\n\n\n\nChinese Herb Dictionary\n\n\n\n\n\nQigong\n\n\n\n\n\n\nTraditional Chinese Medicine \n            (TCM)\n\n\n\n\n\n\nAcupuncture\n\n\n\n\n\n\nPrescribed Drug Dictionary\n\n\n\n\n\nBiochemistry Dictionary\n\n\n\n\n\nLecture \n            Slides\n\n\n\n\n\nResearch Librarian\n\n\n\n\n\n\nGeneral Online Library\n\n\n\n\n\n\nSearch\n\n\n\n\n\n\nResearch Sites\n\n\n\n\n\n\nViagra\n\n\n\n\n\n\nMassage/Acupressure\n\n\n\n\n\n\nHypnotherapy\n\n\n\n\n\nTell us \n            what you want\n\n\n\n\n\n\nNotify Changes & New Information\n\n\n\n\n　\n　\n　\n \n \n \n \n　\n \n \n \n \n \n \n　\n　\n \n \n \n \n　\n　\n　\n　\n　\n \n \n \n \n \n \n \n \n\n\n\n\n\n \n\n        hai zao 海藻\n\nby: Joe Hing kwok Chu\n\n\n\nPharmaceutical name:\n英文藥名﹕\n\nHerb Sargassi\n\n\n\nBotanical name:\n學名﹕\n\n\nSargassum \n            siliquastrum Ag\n\nSargassum pallidum (Turn.) C. Ag.（大 \n            葉海藻)\n\nSargassum fusiforme (Harv.) Setch. \n            (羊棲菜小葉海藻)\n\n\n\n\nPron. in Japanese:\n日語發音﹕\n\nkaiso\n\n\n\nPron. in Korean:\n韓語發音﹕\n\nhaecho\n\n\n\n\n\n            Pron. in Cantonese::\n粵音﹕\n\nhoi2 zou2\n\n\n\nOther Names:\n別名﹕\n\n \n\n\n\nCommon Name:\n英文名﹕\n\nsea weed\n\n\n\nDistribution:\n產地﹕\n\n栽培於福建，浙江，廣東，遼寧，山東，臺灣等省。Being cultivated \n            in Fujian, Zhejiang, Guangdong, Liaoning, Shandong, Taiwan provinces.\n\n\n\n\nProperties\n(characteristics)﹕\n性味﹕\n\n苦，鹹，寒。bitter, salty, cold.\n\n\n\n\nChannels (meridians) entered:\n \n歸經﹕\n\n腎，肝，肺，胃。kidney, liver, lung, stomach.\n\n\n\nMedical functions:\n藥理﹕\n \n\n \n\n\n\nActions & \n            Indications:\n主治﹕\n\nBeing used in goiter, scrofula, cough, asthma, \n            haemorrhoids, runny nose, discomfort in digestive tract, pain in hernia, \n            pain and swelling of testes, as diuretics for edema, and as antipyretic.\n            用於甲狀腺腫，瘰歷（頸部淋巴腺結核），利尿消腫，退燒、治咳，以及治療氣喘，咳 嗽， 痔瘡、流鼻涕、腸胃不適，疝氣痛，睪丸腫痛，泌 \n            尿疾病等\n\n\n\n\nChemical ingredients:\n化學成份﹕\n\n \n\n\n\nDaly Dosage:\n每日用量﹕\n\n4.5 - 15 g\n\n\n\nSamples of formulae\n:處方舉例﹕\n\n \n\n\n\nModern Research:\n現代研究﹕\n\n \n\n\n\n\nToxicity & Cautions:\n\n毒素與禁忌﹕\n\nNot to use in cases of \npixu (spleen deficient).  \n            Some traditional sources mentioned that hai zao is not compatible with\n            \ngan cao but \n            in clinical application it is being used with\n            gan cao.\n\n 脾 \n            虛者忌用。傳統認為海 \n            藻反甘 \n            草，但臨床也每有配伍用者。。\n\n\n\n \n\nSponsors' Ads by Google 以下為谷歌所提供贊助者之廣告\n\n\n \n \n\n\n\n\n\n\n\nA manuscript... writing, translating and proofreading  \n            in progress\n\nProblems with website? Please \n\nClick here for \n            comment. (Not for inquiry )      \n            \n\n\nClick here for inquiry\n \n \n \n\nCopyright Notice 按此看關於 \n            版權問題\n\n\n\n\n\nList of Health Problems\n\n\n\nChinese Herb Dictionary\n\n\n\n\nToxicity of Some Herbs \n                \n\n\nSide Effect of Some Herbs \n                \n\n\nHerbs that can be toxic to kidneys\n\n\n\n\nTraditional Chinese Medicine\n\n\nTCM Diagnosis\n\nSamples \n                of Formulae\n\n\n\nTerms \n                of Traditional Chinese Medicine\n\n\nAcupuncture\n\n\n\n\n\ncopy right\n \n\n版權所有\n\n\n\nQigong \n                (chi kung)\n\n\n\nPrescribed Drug Dictionary\n\n\n\nEmail our web master for  \n                your suggestion (not for inquiry)\n\n\n\nBiochemistry Dictionary\n\n\n\n\n\nGeneral Online Library\n\n\n\nQigong classes\n\n\n\nLecture Slides\n\n\n\nResearch Librarian\n\n\n\n\nSearch\n\n\n\n\n\nQigong classes \n\n\n\n\n\n\n\nHome\n\n\n\nWeather Report\n\n\n Disclaimer\n\n\n\n\n\n\n\nLast update: July 11, 2009,  \n            11:37 a.m. LAH\n\n\n\n\n\n\n\n\n\nSearch \n                this site \n\n\n\n\n\n\n\n\n\n\n\n\n\n\n\n\n\n\n\n\n\n\n\n\n\n\n",
        "original_url": "http://alternativehealing.org/hai_zao.htm"
    },
    {
        "Names": {
            "Name": [
                "tie luo",
                "鐵落"
            ],
            "Pharmaceutical": [
                "Frusta ferri"
            ],
            "Biological": [],
            "Chemical": [
                "magnetite",
                "Fe3O4",
                "氧化鐵",
                "磁鐵礦"
            ],
            "Common": [
                "magnetite"
            ],
            "Other name": [
                "tie zhen hua 鐵針花",
                "tie hua 鐵花",
                "sheng tie luo 生鐵落",
                "tie jing 鐵精",
                "tie xiu 鐵鏽",
                "tie hua 鐵華"
            ],
            "Chinese": [
                "鐵落",
                "鐵針花",
                "鐵花",
                "生鐵落",
                "鐵精",
                "鐵鏽",
                "鐵華"
            ],
            "Pronunciation in Korean": [
                "saengchollak"
            ],
            "Pronunciation in Japanese": [
                "shotetsoraku"
            ],
            "Pronunciation in Cantonese": [
                "tit3 lok6"
            ],
            "Pinyin Pronunciation": []
        },
        "Type": "Mineral",
        "Geography": [
            "most parts of the world"
        ],
        "Properties": [
            "acrid",
            "cool"
        ],
        "Meridians": [
            "heart",
            "liver"
        ],
        "Maladies Treated": [
            "schizophrenia",
            "mania",
            "hallucination caused by high fever",
            "palpitation and fright",
            "rheumatoid arthritis",
            "swelling in boils",
            "anemia",
            "癲 (epilepsy)",
            "癇 (epileptic seizures)"
        ],
        "Medical Function": [
            "stabilizing mood",
            "sedative",
            "blood tonic",
            "calms the heart and spirit, clears heat and transforms phlegm"
        ],
        "Dosage": "",
        "Samples of Formulae": "For mania and schizophrenia: sheng tie luo yin (sheng tie luo decoction).\nComposition: tian men dong (Asparagus tuber, remove core), mai dong (Ophiopogon tuber, remove core), bei mu (Fritillaria bulb) 9g each, nan xing (Arisaema), ju hong (Citrus), yuan zhi (Polygala), shi chuang pu (Acorus tatarinowii), lian qiao (Forsythia), fu ling (Poria), fu shen (Poria spiritus) 3g each, xuan shen (Scrophularia root), gou teng (Uncaria), dan shen (Salvia miltiorrhiza) 4.5g each, zhu sha (cinnabar, HgS) 0.9g, tie luo (iron filings) 30g (packed separately).\nDirections: Boil tie luo for 3 hours, use the resulting water to decoct other herbs and take as prescribed. After taking, rest quietly; avoid frightening or waking abruptly, as this may cause relapse and make recovery difficult.\nExcerpted from: \"Yixue Xinwu\", Volume Four.",
        "Contraindications": "Not compatible with zao jiao (Gleditsia sinensis). According to Li Shi Zhen: \"Most tonic herbs are not compatible with tie luo.",
        "Research": "",
        "Notes": "Source of tie luo: when raw iron is heated red hot, the oxidized outer layer falls off when being pounded. The falling off particles is call tie luo.\n The particles that drop down from striking red hot iron are called tie luo. \n The dust particle produced while striking the red hot iron is called tie jing. \n rust on iron is called tie xiu \n Those from soaking with salted vinegar is called tie hua.   ",
        "Chemical Ingredients": {
            "": [
                "Fe3O4 (magnetite)",
                "magnesium",
                "manganese",
                "titanium",
                "vanadium",
                "chromium"
            ]
        },
        "References": [],
        "Further Reading": [],
        "Original Text": "tie luo, Complementary and Alternative Healing UniversityComplementary and Alternative Healing University  Home  現代中藥辭典Search this siteList of Health ProblemsChinese Herb DictionaryQigongTraditional Chinese Medicine (TCM)AcupuncturePrescribed Drug DictionaryBiochemistry DictionaryLecture SlidesResearch LibrarianGeneral Online LibrarySearchResearch SitesViagraMassage/AcupressureHypnotherapyTell us what you wantNotify Changes & New Information　　　　　　　　　　　　　　　　　　　　　　　　　　　　　　　　　　　　　　　　　　　　　　　　　　　　　　　tie luo 鐵落by: Joe Hing Kwok ChuSource of tie luo: when raw iron is heated red hot, the oxidized outer layer falls off when being pounded. The falling off particles is call tie luo.[來源]為生鐵鍛至紅赤、外層氧化時被錘落的鐵屑。 　Pharmaceutical name:英文藥名﹕Frusta ferriChemical name:化學名﹕magnetite氧化鐵﹐磁鐵礦Pron. in Japanese:日語發音﹕shotetsoraku （生铁落）Pron. in Korean:韓語發音﹕saengchollak  （生铁落）Pron. in Cantonese:粵音﹕tit3 lok6Other Names:別名﹕tie zhen hua鐵針花，tie hua鐵花，sheng tie luo生鐵落。the particles that drop down from striking red hot iron are called tie luo.生鐵煆紅放砧上，打落者名鐵落。the dust particle produced while striking the red hot iron is called tie jing敲打時如塵飛起者，名鐵精。rust on iron is called tie xiu鏽生鐵器上者，名鐵鏽。those from soaking with salted vinegar is called tie hua.鹽醋浸出者，名鐵華。　Common Name:英文名﹕magnetiteDistribution:產地﹕most parts of the worldProperties(characteristics)﹕性味﹕acrid, cool.辛，涼 。Channels (meridians) entered:　歸經﹕heart, liver.心， 肝。Medical functions:藥理﹕　　Actions & Indications:主治﹕For: stabilizing mood, as sedative, blood tonic.Being used in treating schizophrenia, mania, hallucination caused by high fever, palpitation and fright, rheumatoid arthritis, swelling in boils, and anemia.平肝鎮驚，解毒斂瘡，補血。主治癲狂，熱病譫妄，心悸易驚，風濕痺痛，瘡瘍腫毒，貧血。Chemical ingredients:化學成份﹕Main ingredient is Fe3O4, usually also contains other elements like: magnesium, manganese, titanium, vanadium, chromium etc.Fe3O4;常含有Mg，Mn，Ti，V，Cr等元素; 　Dosage:用量﹕　Samples of formulae:處方舉例﹕For mania and schizophrenia: sheng tie luo yin狂躁不安﹕ 生鐵落飲Modern Research:現代研究﹕　Cautions:禁忌﹕not compatible with zao jiao. According to Li Shi Zhen: \"Most tonic herbs are not compatible with tie luo.\"畏皂角。李時珍曰：補腎藥多忌之。　sheng tie luo yin (source: yixue xin yu) Composition: tian men dong (remove core), mai dong (remove core), bei mu 9 g, nan xing,  ju hong, yuan zhi,  shi chuang pu, lian qiao,  fu ling, fu shen, 3 g each,  xuan shen,  gou teng,  dan shen,  4.5g, each,  zhu sha (HgS)  0.9 g,  tie luo 30 g　　Sponsors' Ads by Google 以下為谷歌所提供贊助者之廣告 生鐵落飲 《醫學心語》　【功能主治】鎮 心安神，清熱化痰。治癲、狂、癇。　【處方】 天門冬（去心），麥 冬（去心），貝 母 各 9克 ，膽南 星 ，橘 紅 ，遠 志， 石菖蒲，連 翹， 茯 苓，茯 神，各3克 ，玄 參，鉤 藤  ， 丹 參 各 4.5克 ，辰砂  0.9克，  生鐵 落 30克 （另包）。  【用法用量】用生鐵落煎熬三小時，取此水煎藥服。服後安神靜睡，不可驚駭叫醒，犯之則病復 作，難乎 為力。 　  【摘錄】《醫學心悟》卷四Click here for inquiry  　More material to be loaded. If you need more information or bibliography in a hurry email our research librarian. The link is located on the left menu.There is a research fee charged.A manuscript... writing, translating and proofreading  in progressClick here for inquiry  Copyright Notice 按此看關於版權問題List of Health ProblemsChinese Herb DictionaryToxicity of Some Herbs Side Effect of Some Herbs Herbs that can be toxic to kidneysTraditional Chinese MedicineTCM DiagnosisSamples of FormulaeAcupuncturecopy right　版權所有Qigong (chi kung)Prescribed Drug DictionaryEmail our web master for  your suggestion (not for inquiry)Biochemistry DictionaryGeneral Online LibraryQigong classesFake Email WarningResearch LibrarianSearchQigong classesHomeWeather Report    DisclaimerLast update: Mar 12, 2009, 2:12  p.m. LAHSearch this site         ",
        "original_url": "http://alternativehealing.org/tie_luo.htm"
    }
]