[
  {
    "Names": {
      "Name": ["ROU CONG RONG", "rou cong rong"],
      "Pharmaceutical": ["Herba Cistanches Deserticolae"],
      "Biological": [
        "Cistance salsa Benth. et Hook",
        "Boschniakia glabra C. A. Mey. (Japanese variety)"
      ],
      "Chemical": [],
      "Common": ["cistanche", "fleshy stem of the broomrape"],
      "Other name": [],
      "Chinese": [
        "肉蓯蓉",
        "蓯蓉",
        "大芸",
        "淡大芸",
        "甜大芸",
        "寸芸",
        "梭梭大芸",
        "管花肉蓯蓉",
        "紅柳大芸",
        "鹽生肉蓯蓉",
        "白刺大芸",
        "沙蓯蓉",
        "紫蓯蓉",
        "白花鹽蓯蓉",
        "草蓯蓉"
      ],
      "Pronunciation in Korean": ["yuk chongyong"],
      "Pronunciation in Japanese": ["nkujuyo"],
      "Pronunciation in Cantonese": ["yuk6 cung6 jung4"],
      "Pinyin Pronunciation": []
    },
    "Type": "Herb",
    "Geography": ["Japan (Boschniakia glabra C. A. Mey.; Japanese variety)"],
    "Properties": ["sweet", "salty", "warm"],
    "Meridians": ["large intestine", "kidney"],
    "Maladies Treated": [
      "impotence: due to shenyangxu (kidney yang deficient) condition",
      "constipation: due to qixu (qi deficient) or blood deficient",
      "infertility",
      "excessive uterine bleeding",
      "yeast infection from cold deficient womb",
      "high blood pressure",
      "bleeding of the kidneys and/or bladder",
      "inflammation of the kidneys"
    ],
    "Medical Function": [],
    "Dosage": "9 to 21 g (9–21 克)",
    "Samples of Formulae": "",
    "Contraindications": "Not to use in case of diarrhea due to pixu (spleen deficient).\nNot to use in patient with heat sign.",
    "Research": "",
    "Notes": "Variant names and host plants:\n肉蓯蓉 also called: 蓯蓉, 大芸, 淡大芸, 甜大芸, 寸芸, 梭梭大芸; mainly parasitic on 梭梭 and 白梭梭.\n管花肉蓯蓉: also called 紅柳大芸; mainly parasitic on 檉柳屬植物 (Tamarix spp.).\n鹽生肉蓯蓉: also called 白刺大芸; parasitic on 白刺, 鹽爪爪, 紫]柴, 芨芨草 and other plants.\n沙蓯蓉: also called 紫蓯蓉; often parasitic on 四合木, 霸王, 珍珠柴, 紫柴, 綿刺, 藏錦雞兒, 沙冬青 and other plants.\n白花鹽蓯蓉: mainly parasitic on 珍珠柴.\n草蓯蓉: often parasitic on 樺木科東北楷木.",
    "Chemical Ingredients": [
      "Contains trace alkaloids and crystalline neutral substances.",
      "Mi rou cong rong (迷肉蓯蓉) contains alkaloids.",
      "Contains multiple iridoids: cistamin (肉蓯蓉素), cistachlorine (肉蓯蓉氯素), and cistanosides A, B, C, D, E, F, G (肉蓯蓉甙A–G).",
      "Contains D-mannose (D－甘露糖).",
      "Contains β-sitosterol (β－谷甾醇).",
      "Contains succinic acid (琥珀酸).",
      "Contains β-sitosterol-glucoside (β－谷甾醇葡萄糖甙).",
      "Additional isolates reported: cistanosides H and I (肉蓯蓉甙 H, I) and decaffeoylacteoside (去咖啡酰基類葉升麻苷)."
    ],
    "References": ["http://www.egi.ac.cn/ftmanager/show.php?id=275"],
    "Further Reading": [],
    "Original Text": "ROU CONG RONG, Complementary and Alternative Healing University<Complementary and Alternative Healing University  HomeSearch this site       Site MapSearch this siteList of Health ProblemsChinese Herb DictionaryQigongTraditional Chinese MedicineAcupuncturePrescribed Drug DictionaryBiochemistry DictionaryLecture SlidesResearch LibrarianGeneral Online LibrarySearchResearch SitesViagraMassage/AcupressureHypnotherapyTell us what you wantNotify Changes & New Information                                      rou cong rong        肉蓯蓉                                                     By: Joe Hing Kwok ChuPharmaceutical name:英文藥名﹕Herba Cistanches DeserticolaeBiological name:拉丁文名﹕Cistance salsa Benth. et HookBoschniakia glabra C. A. Mey. (Japanese variety)Pron. in Japanese:日語發音﹕nkujuyoPron. in Korean:韓語發音﹕yuk chongyongPron. in Cantonese:粵語發音﹕yuk6 cung6 jung4Common Name:英文名﹕cistanche, fleshy stem of the broomrapeDistribution:分佈﹕Properties (characteristics):性味﹕sweet, salty﹐ warm。甘﹐鹹﹐溫。Channels (meridians) entered:歸經﹕large intestine, kidney大腸﹐腎。Actions & Indications﹕主治﹕:for impotence: due to shenyangxu (kidney yang deficient) conditionfor constipation: due to  qixu (qi deficient) or blood deficient   for infertilityfor excessive uterine bleedingfor yeast infection from cold deficient wombfor high blood pressurefor bleeding of the kidneys and/or bladderfor inflammation of the kidneys 因 腎陽虛而有陽萎者因 氣虛 或血虛 而有便秘者不能懷孕子宮出血宮寒白帶高血壓腎臟或膀胱出血腎臟發炎Medical Function:Chemical ingredients:含有微量生物鹼及結晶性中性物質。迷肉蓯蓉含有生物鹼。本品含多種環烯醚萜類 iridoids化合物，有肉蓯蓉素（cistamin）,肉蓯蓉氯素（cistachlorine）及肉蓯蓉甙（cistanosides）A, B,C,D,E,F,G,並含D－甘露糖  D-mannose、β－谷甾醇 β-Sitosterol、琥珀酸 succinic acid、β－谷甾醇葡萄糖甙 β-Sitosterol-glucoside。另有報道，又從其中分離出肉蓯蓉甙 H, I cistanosides H, I，以及 去咖啡酰基類葉升麻苷 decaffeoylacteoside。It contains several types of iridoids. cistamin, cistachlorine, cistanosides A, B,C,D,E,F,G,  D-mannose,  β-Sitostero,  succinic acid、β-Sitosterol-glucoside,  H, I cistanosides H, I, decaffeoylacteoside.Dosage:用量﹕9 to 21 g9 ~21 克Samples of formulae:Modern Research:Cautions:禁忌﹕not to use in case of diarrhea due to pixu (spleen deficient) .not to use in patient with heat sign.脾虛 腹瀉忌用。有熱象之病人忌用。 肉蓯蓉也稱：蓯蓉、大芸、淡大芸、甜大芸、寸芸、梭梭大芸，主要寄生於梭梭、白梭梭。 管花肉蓯蓉：又稱紅柳大芸，主要寄生於檉柳屬植物。 鹽生肉蓯蓉：又稱白刺大芸，寄生於白刺、鹽爪爪、紫]柴、芨芨草等多種植物。 沙蓯蓉：又稱紫蓯蓉，常寄生於四合木、霸王、珍珠柴、紫柴、綿刺、藏錦雞兒、沙冬青等植物。 白花鹽蓯蓉：主要寄生於珍珠柴。 草蓯蓉：常寄生於樺木科東北楷木。參考：http://www.egi.ac.cn/ftmanager/show.php?id=275A manuscript... writing, translating and proofreading  in progressClick here for inquiry  Copyright Notice 按此看關於版權問題List of Health ProblemsChinese Herb DictionaryToxicity of Some Herbs  Side Effect of Some Herbs  Herbs that can be toxic to kidneysTraditional Chinese MedicineTCM DiagnosisSamples of FormulaeAcupuncturecopy right 版權所有Qigong (chi kung)Prescribed Drug DictionaryEmail our web master for  your suggestion (not for inquiry)Biochemistry DictionaryGeneral Online LibraryQigong classesFake Email WarningResearch LibrarianSearchQigong classes homeWeather Report    DisclaimerLast update:August 3, 2007, 1:07 p.m. LAH   ",
    "original_url": "http://alternativehealing.org/rou_cong_rong.htm"
  },
  {
    "Names": {
      "Name": ["ji cai", "薺菜"],
      "Pharmaceutical": ["Herba Capsellae bursa-pastoris"],
      "Biological": ["Capsella bursa-pastoris Moench."],
      "Common": ["shepherds' herb"],
      "Other name": [
        "ji cai hua 薺菜花",
        "ling jiao cai 菱角菜",
        "hu sheng cao 護生草",
        "ji ji cai 薺薺菜",
        "sha ji 沙薺",
        "zong zi cai 粽子菜",
        "xiang ji 香薺",
        "di cai 地菜",
        "di cai hua 地菜花",
        "san jiao cai 三角菜",
        "xiang shan cai 香善菜",
        "hu sheng cai 護生菜",
        "xi cai 細菜",
        "ji xin cai 雞心菜",
        "zhen tou cao 枕頭草",
        "tian er cai 田兒菜",
        "jia ji cai 家薺菜",
        "ban cai 班菜",
        "mi cao 靡草",
        "hua hua cai 花花菜",
        "yang cai 羊菜",
        "jing chang cao 淨腸草",
        "qing ming cai 清明菜",
        "xiang tian jie 香田芥",
        "di mi cai 地米菜",
        "ji jiao cai 雞腳菜",
        "jia shui cai 假水菜",
        "di di cai 地地菜",
        "yan he cao 煙盒草",
        "xi xi 西西"
      ],
      "Chinese": ["薺菜"],
      "Pronunciation in Korean": ["naengi"],
      "Pronunciation in Japanese": ["nazuna", "seisai (薺菜)"],
      "Pronunciation in Cantonese": ["cai5 coi3"],
      "Pinyin Pronunciation": []
    },
    "Type": "Herb",
    "Geography": [
      "Originated from eastern Europe",
      "Originated from Asia Minor",
      "Now found in the temperate zone of the world"
    ],
    "Properties": ["Sweet", "Neutral"],
    "Meridians": ["Liver", "Lung", "Spleen"],
    "Maladies Treated": [
      "Renal tuberculosis hematuria [2]",
      "Postpartum uterine bleeding [2]",
      "Menorrhagia [2]",
      "Pulmonary tuberculosis hemoptysis [2]",
      "Hypertension [2]",
      "Colds [2]",
      "Fever [2]",
      "Nephritis edema [2]",
      "Urinary stones [2]",
      "Chyluria [2]",
      "Enteritis [2]"
    ],
    "Medical Function": [],
    "Dosage": "10~20 g",
    "Samples of Formulae": "For chronic diarrhea: Air-dry Ji Cai (shepherds' herb), grind into powder, take 6 g each time with a decoction of Hong Zao (Red Date / Jujube). [4]",
    "Contraindications": "Not to use during pregnancy or during breast feeding. Use with care in patients with heart and lung diseases. [1]",
    "Research": "",
    "Notes": "",
    "Chemical Ingredients": [
      "Oxalic acid (草酸)",
      "Tartaric acid (酒石酸)",
      "Malic acid (蘋果酸)",
      "Pyruvic acid (丙酮酸)",
      "Sulfanilic acid (對氨基苯磺酸)",
      "Arginine (精氨酸)",
      "Aspartic acid (天冬氨酸)",
      "Proline (脯氨酸)",
      "Methionine (蛋氨酸)",
      "Leucine (亮氨酸)",
      "Glutamic acid (谷氨酸)",
      "Glycine (甘氨酸)",
      "Alanine (丙氨酸)",
      "Cystine (胱氨酸)",
      "Cysteine (半脫氨酸)",
      "Sucrose (蔗糖)",
      "Sorbose (山梨糖)",
      "Lactose (乳糖)",
      "Glucosamine (葡萄糖胺)",
      "Sorbitol (山梨糖醇)",
      "Mannitol (甘露醇)",
      "Adonitol (側金盞花醇)",
      "Potassium, calcium, sodium, iron, chlorine, phosphorus, manganese (鉀、鈣、鈉、鐵、氯、磷、錳)",
      "Dihydrofisetin (二氫非瑟素)",
      "Kaempferol-4’-methylether (山奈酚-4’-甲醚)",
      "Quercetin-3-methylether (槲皮素-3-甲醚)",
      "Gossypetin hexamethyl ether (棉花皮素六甲醚)",
      "Diosmin (香葉木甙)",
      "Garbanzol (3，4’，7-三羥基黃烷酮)",
      "Robinetin (洋槐黃素，又名刺槐乙素)",
      "Rutin (芸香甙)",
      "Luteolin-7-rutinoside (木犀草素-7-芸香糖甙)",
      "Choline (膽鹼)",
      "Acetylcholine (乙酸膽鹼)",
      "Palmitic acid (棕櫚酸)",
      "Sinigrin (黑芥子甙)",
      "Sinapine (芥子鹼)",
      "Yohimbine (育亨賓)",
      "Ergocristine (麥角克鹼)",
      "Fumaric acid (延胡索酸)"
    ],
    "References": [
      "[1] Ri Hua Ben Cao 日華本草",
      "[2] Zhong Hua Ben Cao 中華本草",
      "[3] Multilingual Nultiscript Plant Name Database",
      "[4] Ri Hua Ben Cao 日華本草"
    ],
    "Further Reading": [],
    "Original Text": "ji , Complementary and Alternative Healing UniversityComplementary and Alternative Healing University   中藥詞典   Chinese Herb Dictionary      Search this site     在本網站找資料     Discussion FormSearch this siteList of Health ProblemsChinese Herb DictionaryQigongTraditional Chinese Medicine (TCM)AcupuncturePrescribed Drug DictionaryBiochemistry DictionaryLecture SlidesResearch LibrarianGeneral Online LibrarySearchResearch SitesViagraMassage/AcupressureHypnotherapyTell us what you wantNotify Changes & New Information　　　                 　      　　 ji cai 薺菜          (in English and Chinese 中英文)Translated by: Joe Hing kwok Chu 朱興國編譯Pharmaceutical name:英文藥名﹕Herba Capsellae bursa-pastorisBotanical name:學名﹕Capsella bursa�pastoris Moench.Pron. in Japanese:日語發音﹕ nazuna, seisai (薺菜)Pron. in Korean:韓語發音﹕naengi[3]Pron. in Cantonese::粵音﹕cai5 coi3Other Names:別名﹕ji cai hua薺菜花ling jiao cai菱角菜hu sheng cao護生草ji ji cai薺薺菜sha ji沙薺zong zi cai粽子菜xiang ji香薺di cai地菜di cai hua地菜花san jiao cai三角菜xiang shan cai香善菜hu sheng cai護生菜xi cai細菜ji xin cai雞心菜zhen tou cao枕頭草tian er cai田兒菜jia ji cai家薺菜ban cai班菜mi cao靡草hua hua cai花花菜yang cai羊菜jing chang cao淨腸草qing ming cai清明菜xiang tian jie香田芥di mi cai地米菜ji jiao cai雞腳菜jia shui cai假水菜di di cai地地菜yan he cao煙盒草xi xi西西Common Name:英文名﹕shepherds' herbDistribution:產地﹕originated from eastern Europe and Asia minor. Now it can be seen in the temperate zone of the world.起源於東歐和小亞細亞, 現在世界溫帶地區都有。Properties(characteristics)﹕性味﹕sweet, neutral.甘，平。Channels (meridians) entered: 歸經﹕liver, lung, spleen.肝，肺，脾。Medical functions:藥理﹕  Actions & Indications:主治﹕For renal tuberculosis hematuria, postpartum bleeding, menorrhagia, tuberculosis hemoptysis, hypertension, colds, fever, nephritis edema, urinary stones, chyluria, enteritis. [2]用於腎結核尿血，產後子宮出血，月經過多，肺結核咯血，高血壓，感冒發熱，腎炎水腫，泌尿系結石，乳糜尿，腸炎。[2]Chemical ingredients: [2]化學成份﹕【2】 oxalic acid草酸tartaric  acid酒石酸malic acid蘋果酸pyruvic acid丙酮酸sulfanilic acid對氨基苯磺酸arginine精氨酸aspartic acid天冬氨酸proline脯氨酸methionine蛋氨酸leucine亮氨酸glutamic acid谷氨酸glycine甘氨酸alanine丙氨酸cystine胱氨酸cysteine半脫氨酸sucrose蔗糖sorbose山梨糖lactose乳糖glucosamine葡萄糖胺sorbitol山梨糖醇mannitol甘露醇adonitol側金盞花醇potassium, calcium, sodium, iron, chlorine, phosphorus, manganese鉀、鈣、鈉、鐵、氯、磷、錳dihydrofisetin二氫非瑟素kaempferol-4�-methylether山奈酚-4�-甲醚quercetin-3-methylether槲皮素-3-甲醚gossypetin hexamethyl ether棉花皮素六甲醚diosmin香葉木甙garbanzol3，4�，7-三羥基黃烷酮robinetin洋槐黃素又名刺槐乙素rutin芸香甙luteolin-7-rutinoside木犀草素-7-芸香糖甙choline膽鹼acetylcholine乙酸膽鹼palmitic acid棕櫚酸sinigrin黑芥子甙sinapine芥子鹼yohimbine育亨賓ergocristine麥角克鹼fumaric acid延胡索酸Dosage:用 量﹕10~20 gSamples of formulae:處方舉 例﹕For chronic diarrhea: air dry ji cai. Make into powder. Use 6 g each time wth decoction of hong zao. [4].治久痢: 將薺菜陰乾，研末，日服二錢，用紅棗湯送服。[4]Modern Research:現代研究﹕ Toxicity & Cautions:毒素與禁忌﹕Not to use during pregnancy or during breast feeding.Use with care in patients with heart and lung diseases.懷孕或哺乳期中忌吃。有心肺疾病者小心應用。[1]Ri Hua Ben Cao 日華本草[2] Zhong Hua Ben Cao    中華本草[3] Multilingual Nultiscript Plant Name Database[4] Ri Hua Ben Cao 日華本草Problems with website? Please Click here for comment. (Not for inquiry )      Click here for inquiry    Ads by Google:   A manuscript... writing, translating and proofreading  in progress  Copyright Notice 按此看關於 版權問題List of Health ProblemsChinese Herb DictionaryToxicity of Some HerbsSide Effect of Some HerbsHerbs that can be toxic to kidneysTraditional Chinese Medicine TCM Diagnosis Samples of FormulaeTerms of Traditional Chinese MedicineAcupuncturecopy right 版權所有Qigong (chi kung)Prescribed Drug DictionaryEmail our web master for  your suggestion (not for inquiry)Biochemistry DictionaryGeneral Online LibraryQigong classesFake Email WarningResearch LibrarianSearchQigong classesDisclaimerHomeWeather ReportLast update: July 30, 2014,  10 p.m. LAH　  ",
    "original_url": "http://alternativehealing.org/ji.htm"
  },
  {
    "Names": {
      "Name": ["xiang si zi", "相思子"],
      "Pharmaceutical": ["Semen Abri precatorii"],
      "Botanical": ["Abrus precatorius L."],
      "Chinese": ["相思子"],
      "Common": [
        "English: coralhead plant seed, rosary pea",
        "Vietnamese: Cam thảo d漧, cườm thảo đỏ, chi chi, cườm cườm, tương tư đằng, tương tư thảo, cảm sảotiếng T輇), hương tư tử"
      ],
      "Other name": [],
      "Pronunciation in Korean": ["sang sa cha"],
      "Pronunciation in Japanese": ["taw azuki"],
      "Pronunciation in Cantonese": ["soeng1 si1 zi2"],
      "Pinyin Pronunciation": []
    },
    "Type": "Herb",
    "Geography": [
      "Fujian (China)",
      "Taiwan",
      "Guangdong (China)",
      "Guangxi (China)",
      "Yunnan (China)"
    ],
    "Properties": ["Bitter", "Neutral", "Toxic"],
    "Meridians": ["Heart", "Lung"],
    "Maladies Treated": [
      "stroke (中風)",
      "scabies (疥癬)",
      "eczema (濕瘡, damp sores)"
    ],
    "Medical Function": [
      "Induces vomiting to expel wind-phlegm (湧吐風痰)",
      "Expels watery phlegm",
      "Kills parasitic worms",
      "Treats tinea / fungal infection of skin (療癬)",
      "Dries dampness (燥濕)",
      "Stops itching (止痒)"
    ],
    "Dosage": "Mainly used externally.",
    "Samples of Formulae": "External application: smash the seeds and apply to the affected area.",
    "Contraindications": "According to the book “Southern Area Toxic Vegetation,” the leaves, roots, and seeds are all toxic, with the seeds being the most toxic.\n\nPoisoning symptoms include: poor appetite, nausea, vomiting, abdominal pain, diarrhea, difficulty in breathing, skin bruising (cyanosis), circulatory failure, and oliguria; eventually hemolysis and hematuria may occur, followed by gradual respiratory suffocation and death.\n\nTreatment methods include: induce vomiting or perform gastric lavage, then catharsis; inject normal saline or 5% glucose solution; to prevent deposition of heme or its products in the kidney, take baking soda 5–15 grams per day. If hemolysis is severe with respiratory difficulty, administer oxygen, give a small amount of blood transfusion, use central nervous system stimulants, and perform artificial respiration.\n\nIf taken orally, it is very toxic and must be used with great care.",
    "Research": "",
    "Notes": "",
    "Chemical Ingredients": {
      "Seed": [
        "1-Abrine",
        "Abraline",
        "Hypaphorine",
        "Methyl ester of N, N-dimethyltrypto-phan methocation",
        "Precatorine",
        "Choline",
        "Trigonelline",
        "Abrin",
        "Squalene",
        "β-Amyrin",
        "Cycloartenol",
        "Stigmasterol",
        "β-Stigmasterol",
        "Campesterol",
        "5β-Cholanic acid",
        "Abrussic acid",
        "Flavonoids",
        "Iron",
        "Lead",
        "Calcium",
        "Silicon",
        "Magnesium",
        "Sulfates",
        "Phosphates"
      ],
      "Seed coat (skin)": [
        "Gallic acid 0.6–0.8%",
        "Abranin",
        "Precatorine",
        "Hypaphorine",
        "Methyl ester of N,N-dimethyl tryptophan",
        "Trigonelline",
        "Choline",
        "Asparagic acid",
        "L-cystine",
        "Amide",
        "Amino acid",
        "β-sitosterole",
        "Stimasterole",
        "Campesterol",
        "Brassicasterol",
        "Cycloartenol",
        "Qualene",
        "β-amyrin",
        "Gallic acid",
        "Abrin A, B",
        "Abrus agglutinin (lectin)",
        "5-β-cholamic acid",
        "Anthocyanin"
      ]
    },
    "References": [],
    "Further Reading": [],
    "Original Text": "xiang si zi, Complementary and Alternative Healing UniversityComplementary and Alternative Healing University   中藥詞典    Chinese Herb Dictionary      Search this site     在本網站找資料 See more menu at the bottom of page   xiang si zi 相思子     (in English and Chinese 中英文)Translated by: Joe Hing kwok Chu 朱興國编譯Pharmaceutical name:英文藥名﹕Semen Abri precatoriiBotanical name:拉丁生物學名﹕Abrus precatorius L.Pron. in Japanese:日語發音﹕taw azuki 紅豆，(in some Japanese books; meaning red bean)Pron. in Korean:韓語發音﹕sang sa chaPron. in Cantonese::粵音﹕soeng1 si1 zi2Other Names:別名﹕ Common Name:外文名﹕English: coralhead plant seed, rosary pea. Vietnamese: Cam thảo d漧, cườm thảo đỏ, chi chi, cườm cườm, tương tư đằng, tương tư thảo, cảm sảotiếng T輇), hương tư tửDistribution:產地﹕Fujian, Taiwan, Guangdong, Guangxi and Yunnan provinces of China.分佈福建，台灣，廣東，廣西及雲南等地。Properties(characteristics)﹕性味﹕bitter, neutral and toxic.苦，平，有毒。Channelsmeridians) entered: 歸經﹕heart, lung.心，肺。Medical functions:藥理﹕  Actions & Indications:主治﹕For expelling watery phlegm, rid of parasitic worms and fungal infection of skin, stop itchiness. For treating: strokes, scabies,  eczema. Usually for external use. Smash and apply. If taken orally, be aware it is very toxic and must be used with care.涌吐風痰，殺虫療癬，燥濕止痒。治中風，疥癬，濕瘡。外用：搗爛涂敷患處。如內服須防中毒。Chemical ingredients:化學成份﹕Seed contains:種子含:1-Abrine相思子鹼Abraline相思子靈Hypaphorine下箴刺桐鹼Methyl ester of N， N-dimethyltrypto-phan methocationN，N- 二甲基色氨酸甲酯的甲陽離子Precatorine相思豆扔Choline膽鹼Trigonelline胡蘆巴鹼Abrin相思子毒蛋白Squalene角鱉烯β-Amyrinβ-香樹脂醇Cycloartenol環木菠蘿烯醇Stigmasterol豆甾醇β-Stigmasterolβ-谷甾醇Campesterol菜油甾醇5β-Cholanic acid5β-膽烷酸Abrussic acid相思子酸Flavonoids黃酮化合物Iron, lead, calcium, silicon, magnesium, sulfates, phosphates鐵，鉛 ，鈣，硅，鎂，硫酸鹽及磷酸鹽Skin of seeds contain:種子皮含：Gallic acid0.6～0.8%沒食子酸Abranin相思子甙precatorine紅豆鹼hypaphorine海巴沸寧鹼methyl ester of N,N- dimethyl tryptophan海巴沸寧鹼甲酯trigonelline胡蘆巴鹼choline膽鹼asparagic acid天冬氨酸L-cystine胱氨酸amide酰胺Amino acid氨基酸β-sitosteroleβ-谷甾醇Stimasterole豆甾醇Campesterol菜油甾醇brassicasterol菜籽甾醇Cycloartenol環木菠蘿甾醇Qualene鯊烯β-amyrinβ-香樹脂素Gallic acid沒食子酸abrin A,B相思子毒蛋白A，Babrus agglutinin相思子凝集素lectin植物凝血素5-β-cholamic acid5-β-膽烷酸anthocyanin花色素Daily Dosage:每日用量﹕Mainly being used externally.外用。Samples of formulae:處方舉例﹕ Modern Research:現代研究﹕ Toxicity & Cautions:毒素與禁忌﹕According to the book, \"Southern Area Toxic Vegetation\", the leaves, the roots and the seeds are all toxic. The poisoning symptoms include: poor appetite, nausea, vomiting, abdominal pain, diarrhea, difficulty in  breathing, skin bruising, circulatory failure and oliguria, and eventually  hemolysis, hematuria, and gradually respiratory suffocation and death may happen. Treatment methods include vomit inducing, gastric lavage, catharsis, and injection of saline or 5% glucose solution; prevent heme deposition in the kidney or take 5 to 15 grams of baking soda per day. If hemolysis is severe with respiratory difficulty,  use oxygen, a small amount of blood transfusion and the use of CNS stimulants, and artificial respiration. \"《南方主要有毒植物》：\"相思豆，葉，根，種子有毒，以種子最毒。中毒症狀：表現為食欲不振，惡心，嘔吐，腹痛，腹瀉，呼吸困難，皮膚青紫，循環系統衰竭和少尿，最後出現溶血現象，尿血，逐漸呈現呼吸性窒息而死亡。解救方法：催吐或洗胃，然後導瀉，並注射生理鹽水或5%葡萄糖鹽水；防止血紅素或其產物在腎中沉澱，可每日服小蘇打5～15克；如溶血嚴重並有呼吸窒息現象時，要給氧，小量輸血及使用中樞興奮劑，行人工呼吸。\" Search this siteProblems with website? Please Click here for comment. (Not for inquiry )    Click here for inquiryCopyright Notice 按此看關於版權問題Sponsors' Ads by Google 以下為谷歌 所提供之廣告A manuscript... writing, translating and proofreading  in progressMenu: List of Health ProblemsQigong (chi kung)Toxicity of Some HerbsSide Effect of Some HerbsHerbs that can be toxic to kidneysTraditional Chinese Medicine TCM Diagnosis Samples of FormulaeTerms of Traditional Chinese MedicineAcupunctureChinese Herb DictionaryQigong classesPrescribed Drug DictionaryEmail our web master for  your suggestion (not for inquiry)Biochemistry Dictionary Qigong classes Research Librarian copy right 版權所有HomeWeather ReportDisclaimerLast update: Dec 23, 1014; 6 p.m. LAH   ",
    "original_url": "http://alternativehealing.org/xiang_si_zi.htm"
  },
  {
    "Names": {
      "Name": ["zhui di feng", "di feng pi"],
      "Pharmaceutical": ["Cortex Illicii"],
      "Botanical": ["Illicium difengpi K.I.B. et K.I.M"],
      "Chinese": ["地楓皮", "追地風", "鑽地風", "南寧地楓皮", "地風"],
      "Common": [],
      "Other name": [
        "zhui di feng 追地風",
        "zuan di feng 鑽地風",
        "nan ning di feng pi 南寧地楓皮",
        "di feng 地風",
        "di feng pi 地楓皮"
      ],
      "Pronunciation in Korean": [],
      "Pronunciation in Japanese": ["sanjifu"],
      "Pronunciation in Cantonese": ["zeoi1 dei6 fung1"],
      "Pinyin Pronunciation": []
    },
    "Type": "Herb",
    "Geography": [
      "China: southwestern Guangxi province; southern Guangdong province"
    ],
    "Properties": ["Slightly acrid", "Astringent", "Warm", "Slightly toxic"],
    "Meridians": ["Bladder", "Kidney"],
    "Maladies Treated": [
      "Arthritis",
      "Numbness with pain",
      "Abdominal pain due to qi stagnation (氣滯腹痛)",
      "Menstrual abdominal pain in women (婦人經期腹痛)"
    ],
    "Medical Function": [],
    "Dosage": "Internal: decoction 9–15 g per day.\nExternal: boil with water and wash affected areas.",
    "Samples of Formulae": "Postpartum arthritis (產後身疼，關節紅腫灼痛)\nName of formula: Qing Re Chu Bi Tang (Rid of heat and arthritis decoction)\nApplication: Pain in the body; joints red, hot, and swollen with burning pain.\nComposition (metric version): Ren Dong Teng (Honeysuckle stem) 30 g, Wei Ling Xian (Clematis root and rhizome) 9 g, Qing Feng Teng (Sinomenium stem) 15 g, Hai Feng Teng (Piper kadsura vine) 15 g, Luo Shi Teng (Trachelospermum vine) 15 g, Fang Ji (Stephania tetrandra root) 9 g, Sang Zhi (Mulberry twig) 30 g, Zhui Di Feng (Illicium difengpi bark) 9 g. Preparation: Boil with water and use as tea.\nFunctions: Qing re san shi (clears heat and disperses dampness), shu feng huo xue (disperses wind and activates blood). Postpartum body pain, joints red, swollen, and burning pain.\nComposition (original units as recorded): Ren Dong Teng 1 liang, Wei Ling Xian 3 qian, Qing Feng Teng 5 qian, Hai Feng Teng 5 qian, Luo Shi Teng 5 qian, Fang Ji 3 qian, Sang Zhi 1 liang, Zhui Di Feng 3 qian.\nSource: Gynecology Experience of Liu Feng Wu (劉奉伍婦科經驗).\n\nBronchitis (支氣管炎)\nIngredients and preparation: Hai Feng Teng (Piper kadsura vine) 2 liang, Zhui Di Feng (Illicium difengpi bark) 2 liang. Soak in 1 jin of white liquor for 1 week. Dosage: Take twice daily, 10 mL each time, in the morning and evening on an empty stomach. Do not warm when taking; otherwise it will be ineffective. Contraindications: Patients with heart disease and pregnant women are forbidden; suspend during common cold and menstruation. Source: 《全展選編‧內科》.",
    "Contraindications": "There are two types of di feng pi recorded: Nanning di feng pi (real; from Illicium difengpi B.N. Chang et al.) and Guilin di feng pi (false; from Illicium jiadifengpi B. N. Chang var. jiadifengpi and Illicium majus Hook. f. et Thomas). The latter are false substitutes that may cause serious poisoning and must not be used as substitutes for di feng pi. Identification: Nanning di feng pi is small tubular or finger-shaped, aromatic, crisp and easily broken, with a granular fractured surface; after soaking in water, no mucus oozes out. The adulterants are generally plate-like, groove-like, or half-cylinder-like; after drying they show slight camphor aroma, are hard and not easy to break, with a flat cross-section; thick mucus oozes out after soaking in water.\nThis herb is slightly toxic.\nSpecific to the bronchitis tincture formula: Do not warm the dose before taking; otherwise it loses efficacy. Patients with heart disease and pregnant women are contraindicated; suspend during common cold and menstruation.",
    "Research": "",
    "Notes": "",
    "Chemical Ingredients": [
      "Bark contains essential (volatile) oil 0.30%–0.71%.",
      "α-pinene",
      "β-pinene",
      "Camphene",
      "1,8-cineole",
      "Linalool (12.93%)",
      "Safrole (23.61%)",
      "Camphor",
      "Germacrene D (5.35%)",
      "Bornyl acetate",
      "Myrcene"
    ],
    "References": [
      "[1] J Insect Sci.2011 ; 11():152.",
      "[2] Gynecology Experience of Liu Feng Wu 劉奉伍婦科經驗",
      "[3] Illicium difengpi B. N. Chamg et al. in Acta Phytotax. Sin. 15: 76-77. f. 1. 1977; 中國樹木志1: 525. 1983."
    ],
    "Further Reading": [],
    "Original Text": "zhui di feng, Complementary and Alternative Healing UniversityComplementary and Alternative Healing University   中藥詞典                 Chinese Herb Dictionary      Search this site     在本網站找資料Search this siteList of Health ProblemsChinese Herb DictionaryQigongTraditional Chinese Medicine (TCM)AcupuncturePrescribed Drug DictionaryBiochemistry DictionaryLecture SlidesResearch LibrarianGeneral Online LibraryResearch SitesViagraMassage/AcupressureHypnotherapyTell us what you wantNotify Changes & New Information  di feng pi   地楓皮  ( in English and Chinese 中英文)by: Joe Hing kwok Chu    朱興國編 譯   Pharmaceutical name:英文藥名﹕Cortex IlliciiBotanical name:拉丁生物學名﹕Illicium difengpi K.I.B.et K.I.M.Pron. in Japanese:日語發音﹕sanjifuPron. in Korean:韓語發音﹕ Pron. in Cantonese::粵音﹕zeoi1 dei6 fung1Other Names:別名﹕ zhui di feng追地風zuan di feng鑽地風nan ning di feng pi南寧地楓皮di feng地風di feng pi地楓皮Common Name:英文名﹕ Distribution:產地﹕south western part of Guangxi province and southern part of Guangdong province.廣西西南部、廣東南部。Propertiescharacteristics﹕性味﹕slightly acrid, astringent, warm, slightly toxic.微辛、澀，溫；有小毒。Channels meridians entered: 歸經﹕bladder, kidney膀胱、腎。Medical functions:藥理﹕  Actions & Indications:主治﹕For treatment of arthritis, numbness with pain, abdomen pain due to qizi (qi stagnation), pain during menses in women.治療風濕痺痛、 氣滯腹痛、婦人經期腹痛。  Chemical ingredients:化學成份﹕Contain evaporating oil 0.30%-0.71%, among them:含揮發油0.30%-0.71%，內有：α and β-pineneα-和β-蒎烯camphene樟烯1,8-cineole1，8-桉葉素linalool (12.93%)芳樟醇 (12.93%)safrole  (23.61%)黃樟醚  (23.61%)camphor樟腦germacrene D (5.35%)大牛兒烯 D (5.35%)bornylacetate乙酸龍腦酯myrcene月桂烯 (香葉烯)Daly Dosage:每日用量﹕Take orally, in decoction 9 - 15 g.External application: boil with water and use it to wash affected areas.內服：煎湯，9 -15克。外用：煎水洗。Samples of formulae:處方舉例﹕For postpartum arthritis [2]Name of Formula: Qing Re Chu Bi Tang (Rid of heat and arthritis decoction)Application: Pain in the body, red, hot and swelling in jointsComposition: ren dong teng 30 g, wei ling xian 9 g, qing feng teng 15 g, hai feng teng 15 g, luo shi teng 15 g, fang ji 9 g, sang zhi 30 g, zhui di feng 9 g.Boil with water and use as tea.   方名: 清熱除痺湯 （劉奉伍婦科經驗）功效: 清熱散濕，疏風活血。 主治: 產後身疼，關節紅腫灼痛。組成: 忍冬藤1兩，威靈仙 3錢，青風藤 5錢，海風藤  5錢，絡石藤 5錢，防己 3錢，桑枝1兩， 追地風 3錢。 支氣管炎：海風藤、追地風各二兩。用白酒一斤，浸泡一周。日服二次，每次10毫升，早晚空腹服。服時不可加溫，否則失效。心臟病人及孕婦忌服，感冒及月經期暫停服。(《全展選編�內科》)Toxicity & Cautions:毒素與禁忌﹕There are two types of di feng pi: one is called Nanning di feng pi that comes from the plant Illicium difengpi BN Chang et al. Historically it has been used as di feng pi. Another is called, Guilin di feng pi, that comes from the plant Illicium jiadifengpi BN Chang var jiadifengpi and a plant called da ba jiao (literally, large octagon),  Illicium majus Hook. f. et Thomas, which are false substitutes. Using themmay cause serious poisoning. They should not be used as a substitutes for di feng pi. Users should distinguish between the real and false items. Nanning di feng pi has the traits of: small tubular or finger shape, with good aroma, crisp, easily broken, and fractured surface shows particles. After soaking the herb in water, no mucus oozing out. The adulterated herb generally shows plate-like and groove-like, half cylinder like, after drying shows some camphor aroma and the texture is hard and difficult to break, and the cross section is flat. Thick mucus oozes out after the herb is soaked in water. [3]�地楓皮�有兩種：一種叫南寧地楓皮是歷來藥用的。其原植物即地楓皮 Illicium difengpi B.N. Chang et al. ；另一種叫桂林地楓皮，其原植物為假地楓皮 Illicium jiadifengpi B. N. Chang var. jiadifengpi和大八角  Illicium majus Hook. f. et Thomas.是地楓皮的偽品。服用會引起 嚴重中毒，不能代替地楓皮入藥，應分清真偽，注意鑒別。南寧地楓皮藥材性狀為小筒狀或指狀，氣芳香、鬆脆，易折斷，折斷面顆粒性。藥材用水浸泡後，無粘液滲出，而偽品地楓皮藥材性狀一般為板狀、槽狀、半卷筒狀，干後微具樟木香氣，質地較堅硬，不易折斷，斷面較平整。藥材用水浸泡後有濃厚粘液滲出。[3][1]J Insect Sci.2011 ; 11():152.[2]Gynecology Experience of Liu Feng Wu 劉奉伍婦科經驗[3] Illicium difengpi B. N. Chamg et al. in Acta Phytotax. Sin. 15: 76-77. f. 1. 1977; 中國樹木志1: 525. 1983.Search this siteProblems with website? Please Click here for comment. (Not for inquiry )    Click here for inquiryCopyright Notice 按此看關於版權問題A manuscript... writing, translating and proofreading  in progressSponsors' Ads by Google 以下為谷歌 所提供之廣告 List of Health ProblemsChinese Herb DictionaryToxicity of Some HerbsSide Effect of Some HerbsHerbs that can be toxic to kidneysTraditional Chinese Medicine TCM Diagnosis Samples of FormulaeTerms of Traditional Chinese MedicineAcupuncturecopy right 版權所有Qigong (chi kung)Prescribed Drug DictionaryEmail our web master for  your suggestion (not for inquiry)Biochemistry DictionaryGeneral Online LibraryQigong classesFake Email WarningResearch LibrarianSearchQigong classesHomeWeather ReportDisclaimerLast update: Oct 20, 2013; 6 p.m. LAH   ",
    "original_url": "http://alternativehealing.org/zhui_di_feng.htm"
  },
  {
    "Names": {
      "Name": ["cao jue ming", "jue ming zi"],
      "Pharmaceutical": ["Semen Cassiae"],
      "Botanical": ["Cassia tora L.", "Cassia obtusifolia L."],
      "Chinese": ["草決明", "決明子", "馬蹄決明", "馬蹄草", "假綠豆"],
      "Common": ["English: cassia seed"],
      "Other": ["ma ti jue ming", "ma ti cao", "jia lu dou"],
      "Pronunciation in Korean": ["kyolmyongja"],
      "Pronunciation in Japanese": ["ketsumeishi"],
      "Pronunciation in Cantonese": ["kyut3 ming4 zi2"],
      "Pinyin Pronunciation": []
    },
    "Type": "Herb",
    "Geography": [
      "China (throughout), especially in Anhui, Jiangsu, Zhejiang, Guangdong, Guangxi, Sichuan"
    ],
    "Properties": ["Salty", "Neutral"],
    "Meridians": ["Liver", "Kidney", "Large Intestine"],
    "Maladies Treated": [
      "Eye redness and swelling pain due to liver and gallbladder constrained heat (肝膽郁熱所致的目赤腫痛)",
      "Photophobia with tearing (怕光流淚)",
      "Amaurosis (青盲)",
      "Internal cataract (內障)",
      "Conjunctivitis (結膜炎)",
      "Excessive tearing and photophobia (多淚羞明)",
      "Headache and head distention (頭痛頭脹)",
      "Chronic constipation (慢性便秘)",
      "Hypertension (高血壓)",
      "Liver diseases (肝臟疾患)"
    ],
    "Medical Function": [],
    "Dosage": "10–15 g.",
    "Samples of Formulae": "Acute conjunctivitis: Cao Jue Ming (Cassia seed), Ju Hua (Chrysanthemum flower), Huang Qin (Scutellaria root). Decoction with water; drink.\nHypertension: Cao Jue Ming (Cassia seed), Ju Hua (Chrysanthemum flower), Xia Ku Cao (Prunella spike). Add water, decoct, and drink as tea.",
    "Contraindications": "Not to use in case of diarrhea, cold or influenza.",
    "Research": "",
    "Notes": "",
    "Chemical Ingredients": {
      "Seed (general)": [
        "chrysophanol (大黃酚)",
        "physcion (大黃素甲醚)",
        "obtusifolin (美決明子素)",
        "chryso-obtusin (黃決明素)",
        "obtusin (決明素)",
        "aurantio-obtusin (橙黃決明素)",
        "gluco-obtusifolin (葡萄糖基美決明子素)",
        "gluco-chryso-obtusin (葡萄糖基黃決明素)",
        "gluco-aurantio-obtusin (葡萄糖基橙黃決明素)",
        "rubrofusarin (紅鐮玫素)",
        "cassiaside (決明子甙)",
        "torosachrysone (決明蒽酮)",
        "isotoralactone (異決明種內酯)",
        "cassialactone (決明子內酯)",
        "2,5-dimethoxy-benzoquinone (2,5-二甲氧基苯醌)",
        "toralactone (決明種內酯)",
        "emodin (大黃素)",
        "aloe-emodin (蘆薈大黃素)",
        "chrysophanol-9-anthrone (大黃酚-9-蒽酮)",
        "cassiaside B, C (決明子甙 B, C)",
        "rubrofusarin-6-O-gentiobioside (紅鐮玫素-6-O-龍膽二糖甙)",
        "alaternin-1-O-β-D-glucopyranoside (意大利鼠李蒽醌-1-O-葡萄糖甙)",
        "physcion-8-O-β-D-glucopyranoside (大黃素甲醚-8-O-葡萄糖甙)",
        "1-desmethylobtusin (1-去甲基決明素)",
        "1-desmethylaurantio-obtusin (1-去甲基橙黃決明素)",
        "1-desmethylchryso-obtusin (1-去甲基黃決明素)",
        "chrysophanol-10,10ˊ-bianthrone (大黃酚-10,10ˊ-聯蒽酮)",
        "questin (大黃素-8-甲醚)",
        "benzoic acid (苯甲酸)"
      ],
      "Oil (fixed oil) in seed (4.65%–5.79%)": [
        "palmitic acid (棕櫚酸)",
        "stearic acid (硬脂酸)",
        "oleic acid (油酸)",
        "linoleic acid (亞油酸)"
      ],
      "Volatile oil (0.014%)": [
        "dihydroactinodiolide (二氫獼猴桃內酯)",
        "m-cresol (間-甲酚)",
        "2-hydroxy-4-methoxy-acetophenone (2-羥基-4-甲氧基苯乙酮)",
        "methyl palmitate (棕櫚酸甲酯)",
        "methyl oleate (油酸甲酯)"
      ],
      "Non-saponifiable fraction": [
        "C16–C31 alkyl (C16–C31烷)",
        "cholesterol (膽甾醇)",
        "stigmasterol (豆甾醇)",
        "β-sitosterol (β-谷甾醇)",
        "1,3-dihydroxy-3-methylanthraquinone (1,3-二羥基-3-甲基蒽醌)"
      ],
      "Seed of Cassia tora (小決明種子)": [
        "chrysophanol (大黃酚)",
        "obtusin (決明素)",
        "aurantio-obtusin (橙黃決明素)",
        "emodin (大黃素)",
        "aloe-emodin (蘆薈大黃素)",
        "physcion (大黃素甲醚)",
        "toralactone (決明種內酯)",
        "rhein (大黃酸)",
        "obtusifolin (美決明子素)",
        "chryso-obtusin (黃決明素)",
        "rubrofusarin (紅鐮玫素)",
        "norrubrofusarin (去甲基紅鐮玫素)",
        "cassiaside (決明子甙)",
        "cassiaside C (決明子甙C)",
        "rubrofusarin-6-O-gentiobioside (紅鐮玫素-6-O-龍膽二糖甙)",
        "6-[α-D-apiofuranosyl-O-β-D-glucopyranosyloxy]-rubrofusarin (紅鐮玫素-6-O-芹糖葡萄糖甙)",
        "toralactone-9-β-gentiobioside (決明種內酯-9-β-龍膽二糖甙; 即是決明子甙C)",
        "chrysophanol-1-O-[β-D-glucopyranosyl(1→3)-O-β-D-glucopyranosyl(1→6)-O-β-D-glucopyranoside] (大黃酚-1-O-三葡萄糖甙)",
        "chrysophanol-1-O-β-D-glucopyranosyl-(1→3)-O-β-D-glucopyranosyl-(1→3)-O-β-D-glucopyranosyl-(1→6)-O-β-D-glucopyranoside (大黃酚-1-O-四葡萄糖甙)",
        "obtusifolin-2-O-β-D-glucopyranoside (美決明子素-2-O-葡萄糖甙)",
        "galactomannan (半乳糖配甘露聚糖)",
        "glucose (葡萄糖)",
        "galactose (半乳糖)",
        "xylose (木糖)",
        "raffinose (棉子糖)",
        "cystine (胱氨酸)",
        "aspartic acid (天冬氨酸)",
        "γ-hydroxyarginine (γ-羥基精氨酸)"
      ],
      "Seed oil (minor components)": [
        "malvalic acid (錦葵酸)",
        "sterculic acid (蘋婆酸)",
        "campesterol (萊油甾醇)",
        "β-sitosterol (β-谷甾醇)"
      ]
    },
    "References": [],
    "Further Reading": [],
    "Original Text": "cao jue ming, jue ming zi,Complementary and Alternative Healing UniversityComplementary and Alternative Healing University  Home  現代 中藥辭典Search this siteList of Health ProblemsChinese Herb DictionaryQigongTraditional Chinese Medicine (TCM)AcupuncturePrescribed Drug DictionaryBiochemistry DictionaryLecture SlidesResearch LibrarianGeneral Online LibrarySearchResearch SitesViagraMassage/AcupressureHypnotherapyTell us what you wantNotify Changes & New Information　　          　                                                                                 jue ming zi 決明子；cao jue ming 草決明by: Joe Hing kwok Chu        (in English and Chinese 中英文)Pharmaceutical name:英文藥名﹕Semen CassiaeBotanical name:學名﹕Cassia tora, L.; Cassia obtusifolia LPron. in Japanese:日語發音﹕ketsumeishiPron. in Korean:韓語發音﹕kyolmyongjaPron. in Cantonese:粵音﹕kyut3 ming4 zi2Other Names:別名﹕cao jue ming 草决明，jue ming zi 決明子，ma ti jue ming 馬蹄決明，ma ti cao 馬蹄草，jia lu dou 假綠豆。Common Name:英文名﹕cassia seedDistribution:產地﹕throughout China, especially in Anhui, Jiangsu, Zhejiang, Guangdong, Guangxi, Sichuan.全國均産，尤其在安徽，江蘇，浙江，廣東，廣西，四川等省 。Properties(characteristics)﹕性味﹕salty, neutral.鹹，平。Channels (meridians) entered: 歸經﹕liver, kidney, large intestine.入肝，腎 ，大腸。Medical functions:藥理﹕  Actions & Indications:主治﹕for treatment of amaurosis, cataract, conjunctivitis, red, swollen painful eyes, headache, chronic constipation, hypertension, liver diseases.用於肝膽郁熱所致的目赤腫痛，怕光流淚，頭痛。治青盲內障，結膜炎，目赤腫痛，多淚羞明，頭痛頭脹，慢性便秘，高血壓，肝臟疾患。Chemical ingredients:化學成份﹕ The seed contains:決明種子含:chrysophanol大黃酚physcion大黃素甲醚obtusifolin美決明子素chryso-obtusin黃決明素obtusin決明素aurantio-obtusin橙黃決明素gluco-obtusifolin葡萄糖基美決明子素gluco-chryso-obtusin葡萄糖基黃決明素gluco-aurantio-obtusin葡萄糖基橙黃決明素rubrofusarin紅鐮玫素cassiaside決明子甙torosachrysone決明蒽酮isotoralactone異決明種內酯cassialactone決明子內酯2，5-dimethoxyben-zoquinone2，5-二甲氧基苯醌toralactone決明種內酯emodin大黃素aloe-emodin蘆薈大黃素chrysophanol-9-anthro-ne大黃酚-9-蒽酮cassiaside B,C決明子甙 B,Crubrofusarin-6-O-gentiobioside紅鐮玫素-6-O-龍膽二糖甙alaternin-1-O-β-D-glucopyranoside意大利鼠李蒽醌-1-O-葡萄糖甙physcion-8-O-β-D-glucopyranoside大黃素甲醚-8-O-葡萄糖甙1-desmethylobtusin1-去甲基決明素1-desmethylaurantio-ob-tusin1-去甲基橙黃決明素1-desmethylchryso-obtusin1-去甲基黃決明素chrysophanol-10，10ˊ-bianthrone大黃酚-10，　10ˊ-聯蒽酮questin大黃素-8-甲醚benzoic acid苯甲酸Also contains oil  4.65％-5.79％另含油 4.65％-5.79％，其中主成分為:palmitic acid棕櫚酸stearic acid硬脂酸oleic acid油酸linoleic acid亞油酸Also contains oil that can be evaporated by steam, among them又含能被蒸汽揮發的油0．014％，其中:dihydroactinodiolide二氫獼猴桃內酯m-cresol間-甲酚2-hydroxy-4-methoxy-ace-tophenone2-羥基-4-甲氧基苯乙酮methyl palmitate棕櫚酸甲酯methyloleate油酸甲酯In non-saponin substance, contains在非皂化物質中，有:C16-C31alkylC16-C31烷cholesterol膽甾醇stigmasterol豆甾醇β-sitosterolβ-谷甾醇1，3-dihydroxy-3-methylanthraquinone1，3-二羥基-3-甲基蒽醌Seed of Cassia tora:小決明種子含:hrysophanol大黃酚obtusin決明素aurantio-obtusin橙黃決明素emodin大黃素aloe-emodin蘆薈大黃素physcion大黃素甲醚，toralactone決明種內酯，rhein大黃酸obtusifolin美決明子素chryso-obtusin黃決明素，rubrofusarin紅鐮玫素，norrubrofusarin去甲基紅鐮玫素cassiaside決明子甙cassiaside C決明子甙Brubrofusarin-6-O-gentiobioside紅鐮玫素-6-O-龍膽二糖甙，6-［a-D-apiofuranosyl-O-β-D-glucopyranosyloxy］-rubrofusarin紅鐮玫素-6-O-芹糖葡萄糖甙toralactone-9-β-gentiobiobioside決明種內酯-9-β-龍膽二糖甙 (即 是決明子甙C)chrysophanol-1-O-［β-D-glucopyranosyl1→3）-O-β-D-glucopyranosyl-1→6）-O-β-D-glucopyranoside］大黃酚-1-O-三葡萄糖甙，chrysophanol-1-O-β-D-glucopyranosyl-1→　 3）-O-β-D-glucopyanosyl-1→3）-O-β-D-glucopyranosyl-1→　 6）-O-β-D-glu-copyranoside大黃酚-1-O-四葡萄糖甙，obtusifolin-2-O-β-D-glucopyranoside美決明子素-2-O-葡萄糖甙galactomannan半乳糖配甘露聚糖glucose葡萄糖galactose半乳糖xylose木糖raffinose棉子糖cystine以及胱氨酸aspartic acid天冬氨酸γ-hydroxyarginineγ-羥基精氨酸Also, the oil of the seed contains small amount of:又種子油中含少量malvalic acid錦葵酸sterculic acid蘋婆酸campesterol萊油甾醇β-sitosterolβ-谷甾醇Dosage:用量﹕10～15克。Samples of formulae:處方舉例﹕Acute conjunctivitis: cao jue ming,  ju hua, huang qi. Add water and make into decoction and use as tea.Hypertension: cao jue ming, ju hua, xia ku cao.  Add water and make into decoction and use as tea.急性結膜炎: 草决明，菊 花，黃 芩。水煎服 。高血壓：草决明，菊 花，夏枯 草。水煎服。Modern Research:現代研究﹕ Toxicity & Cautions:毒素與禁忌﹕not to use in case of diarrhea, cold or influenza.泄瀉者或風寒外感者忌用。　Sponsors' Ads by Google 以 下為谷歌所提供之廣告  A manuscript... writing, translating and proofreading              in progressProblems with website? Please Click here for comment. (Not for inquiry )  Click here for inquiry   Copyright Notice 按此看關於版權問題List of Health ProblemsChinese Herb DictionaryToxicity of Some HerbsSide Effect of Some HerbsHerbs that can be toxic to kidneysTraditional Chinese MedicineTCM DiagnosisSamples of FormulaeAcupuncturecopy right 版權所有Qigong (chi kung)Prescribed Drug DictionaryEmail our web master for  your suggestion (not for inquiry)Biochemistry DictionaryGeneral Online LibraryQigong classesFake Email WarningResearch LibrarianSearchQigong classesHomeWeather Report    Disclaimer   Last update: April 8, 2013; 12 p.m. LAH  ",
    "original_url": "http://alternativehealing.org/cao_jue_ming.htm"
  }
]
