[
    {
        "Names": {
            "Name": [
                "Echinacea",
                "松果菊"
            ],
            "Pharmaceutical": [
                "Herba Echinaceae",
                "Radix Echinaceae"
            ],
            "Botanical": [
                "Echinacea angustifolia (狹葉松果菊)",
                "Echinacea purpurea (紫花松果菊)",
                "Echinacea pallida (淡紫松果菊)"
            ],
            "Chinese": [
                "松果菊",
                "紫錐菊",
                "紫錐花",
                "狹葉松果菊",
                "紫花松果菊",
                "淡紫松果菊"
            ],
            "Common": [
                "echinacea",
                "purple coneflower",
                "coneflower",
                "American coneflower"
            ],
            "Other name": [
                "zi zhui ju",
                "song guo ju"
            ],
            "Pronunciation in Korean": [],
            "Pronunciation in Japanese": [
                "shōka kiku",
                "shisuika"
            ],
            "Pronunciation in Cantonese": [
                "zi2 zeoi1 guk1"
            ],
            "Pinyin Pronunciation": []
        },
        "Type": "Herb",
        "Geography": [
            "eastern and central North America"
        ],
        "Properties": [
            "bland",
            "mildly minty"
        ],
        "Meridians": [],
        "Maladies Treated": [
            "colds",
            "flu",
            "other infections"
        ],
        "Medical Function": [
            "Echinocea extract possesses anti-viral effect.",
            "Echinocoside possesses the obvious effect of anti-oxidation, nerve protecton, liver protection, anti-inflammation, anti-tumor, improving learning and memory and stimulation of the immune system.",
            "Being used for treating or preventing colds, flu, and other infections"
        ],
        "Dosage": "dry herb: 3 g",
        "Samples of Formulae": "",
        "Contraindications": "allergic reactions include: rashes, increased asthma, anaphylaxis, and gastrointestinal side effects [1]",
        "Research": "",
        "Notes": "",
        "Chemical Ingredients": [
            "flavonoids",
            "akylamides",
            "caffeic acid derivatives",
            "polysacharrides",
            "polyacetylenes",
            "evaporating oil"
        ],
        "References": [
            "[1] http://nccam.nih.gov/health/echinacea/",
            "[2] http://xuebao.bjmu.edu.cn/fileup/PDF/20043690.pdf"
        ],
        "Further Reading": [],
        "Original Text": "echinacea,Complementary and Alternative Healing UniversityComplementary and Alternative Healing University  Home  現代 中藥辭典Search this siteSearch this siteList of Health ProblemsChinese Herb DictionaryQigongTraditional Chinese Medicine (TCM)AcupuncturePrescribed Drug DictionaryBiochemistry DictionaryLecture SlidesResearch LibrarianGeneral Online LibrarySearchResearch SitesViagraMassage/AcupressureHypnotherapyTell us what you wantNotify Changes & New Information　　                             　         Echinacea 松果菊 （in English and Chinese 中英文)by: Joe Hing Kwok Chu Pharmaceutical name:英文藥名﹕Herba Echinaceae,  Radix EchinaceaeBotanical name:學名﹕Echinacea angustifolia  (狹葉松果菊)Echinacea purpurea   (紫花松果菊)Echinacea pallida   (淡紫松果菊)Pron. in Japanese:日語發音﹕shōka kiku (松果菊 )shisuika (紫錐花, (紫花松果菊))Pron. in Korean:韓語發音﹕ Pron. in Cantonese:粵音﹕zi2 zeoi1 guk1Other Names:別名 ﹕zi zhui ju 紫錐菊，song guo ju 松果菊Common Name:英文名﹕echinacea, purple coneflower, coneflower, American coneflowerDistribution:產地﹕eastern and central North America.北美的東部與中部。Properties(characteristics)﹕性味﹕bland, mildly minty.淡，略有Channels (meridians) entered: 歸經﹕Medical functions:藥理﹕ Echinocea extract possesses anti-viral effect.Echinocoside possesses the obvious effect of anti-oxidation, nerve protecton, liver protection, anti-inflammation, anti-tumor, improving learning and memory and stimulation of the immune system. 松果菊苷具有顯著的抗氧化、保護神經、保護肝臟、抗炎、抗腫瘤、改善學習記憶以及激發免疫系统Actions & Indications:主治﹕Being used for treating or preventing colds, flu, and other infections See this site.西方民間用來防止傷風感冒與其他感染。Chemical ingredients:化學成 份﹕flavonoids黃酮類化合物akylamides烷醯胺類caffeic acid derivatives咖啡酸衍化物polysacharrides多糖類polyacetylenes多炔evaporating oil揮發油Daily Dosage:每日用量﹕dry herb: 3 g乾品：3 克Samples of formulae:處方舉例﹕ Modern Research:現代研 究﹕See thisToxicity & Cautions:毒素與 禁忌﹕allergic reactions include:  rashes, increased asthma, anaphylaxis, and  gastrointestinal side effects [1]過敏反應包 括: 發疹，哮喘加重，過敏性休克， 腸胃不良反應。[1] http://nccam.nih.gov/health/echinacea/[2] http://xuebao.bjmu.edu.cn/fileup/PDF/20043690.pdf　 Sponsors' Ads by Google 以下為谷歌所提供贊助者之廣告  A manuscript... writing, translating and proofreading              in progressClick here for inquiry  Copyright Notice 按此看關於版權問題List of Health ProblemsChinese Herb DictionaryToxicity of Some HerbsSide Effect of Some HerbsHerbs that can be toxic to kidneysTraditional Chinese MedicineTCM DiagnosisSamples of FormulaeAcupuncturecopy right 版權所 有Qigong (chi kung)Prescribed Drug DictionaryEmail our web master for  your suggestion (not for inquiry)Biochemistry DictionaryGeneral Online LibraryQigong classesFake Email WarningResearch LibrarianSearchQigong classesHomeWeather ReportDisclaimer Last update: July 22, 2013; 9:38 p.m. LAH  ",
        "original_url": "http://alternativehealing.org/echinacea.htm"
    },
    {
        "Names": {
            "Name": [
                "mu xiang"
            ],
            "Pharmaceutical": [
                "Radix Aucklandiae"
            ],
            "Botanical": [
                "Aucklandia lappa Deene.",
                "Saussurea lappa Clarke",
                "Inula racemosa, Hook fil.",
                "Aucklandia costus, Falk"
            ],
            "Chinese": [
                "木香",
                "廣木香",
                "雲木香",
                "土木香",
                "藏木香"
            ],
            "Common": [
                "costus root"
            ],
            "Other name": [
                "guang mu xiang (originally those that imported from India and came through Guangdong province)",
                "yun mu xiang (those grown in Yunnan province)"
            ],
            "Pronunciation in Korean": [
                "mokhyang"
            ],
            "Pronunciation in Japanese": [
                "mokko"
            ],
            "Pronunciation in Cantonese": [
                "muk6 heong1"
            ],
            "Pinyin Pronunciation": []
        },
        "Type": "Herb",
        "Geography": [
            "Yunnan (main production area)",
            "Sichuan",
            "Tibet"
        ],
        "Properties": [
            "Acrid",
            "Bitter",
            "Warm"
        ],
        "Meridians": [
            "Gallbladder",
            "Large Intestine",
            "Spleen",
            "Stomach"
        ],
        "Maladies Treated": [
            "Flatulence and pain in the abdomen",
            "Diarrhea",
            "Vomiting caused by weak digestion",
            "Qi stagnation with chest and abdominal distension and pain (氣滯胸腹脹痛)",
            "Cholera-like vomiting and diarrhea (霍亂吐瀉)",
            "Dysentery (痢疾)",
            "Tenesmus (裏急後重)",
            "Chronic gastroenteritis (bacterial or fungal infection) (慢性胃腸炎 (細菌或真菌感染))",
            "Bronchitis (支氣管炎)",
            "Lack of appetite (食慾不振)",
            "Digestive tract infection: yeast infection"
        ],
        "Medical Function": [
            "Anti fungus",
            "Improves movements of digestive tract, relieves flatulence and pain",
            "Anti HBV antigen [1]"
        ],
        "Dosage": "3 ~ 10 g.",
        "Samples of Formulae": "xiang sha liu jun zi tang (香砂六君子湯)\ngui pi tang (歸脾湯)",
        "Contraindications": "Beware of using the wrong substitute qing mu xiang (root of ma dou ling) (Aristolochia delibis Sieb.), which is toxic for the kidneys. Do not use mu xiang in cases of yinxu (yin deficient) condition; use with caution when body fluids are insufficient (津液不足). Reported allergic reactions: mild abdominal pain, itchiness, chest tightness, and diarrhea.",
        "Research": "Anti HBV antigen [1]",
        "Notes": "Qing mu xiang (青木香) is a wrong substitute that belongs to the Aristolochia family (root of ma dou ling) and is nephrotoxic; it should not be used as mu xiang.",
        "Chemical Ingredients": [
            "Evaporating oil (essential oil): Aplotaxene (雲木香烯; 單紫杉烯)",
            "Evaporating oil (essential oil): (+)-β-costol ((+)-β-木香醇)",
            "Evaporating oil (essential oil): Dehydrocostus lactone (脫氫木香內酯)",
            "Evaporating oil (essential oil): Dihydrodehydrocostus lactone (二氫脫氫木香內酯)",
            "Evaporating oil (essential oil): α-ionone (α-紫羅蘭酮)",
            "Evaporating oil (essential oil): β-selnene",
            "Evaporating oil (essential oil): saussure alactone (風毛菊內酯)",
            "Evaporating oil (essential oil): Costic acid (木香酸)",
            "Evaporating oil (essential oil): Castunolide (木香烯內酯)",
            "Evaporating oil (essential oil): β-costene (α-木香烴)",
            "Evaporating oil (essential oil): α-costene (α-木香烯; α-木香烴)",
            "Evaporating oil (essential oil): β-elemene (欖香烯)",
            "Evaporating oil (essential oil): β-selinene (芹子烯)",
            "Evaporating oil (essential oil): Dihydrocostunolide (二氫木香內酯)",
            "Evaporating oil (essential oil): Costus lactone (木香內酯)",
            "Evaporating oil (essential oil): Friedelin (無羈帖)",
            "Terpenoids type essential oil (烯帖類精油)",
            "Organic ingredient: Palmitic acid (棕櫚酸)",
            "Organic ingredient: Linderic acid (天台烏藥酸)",
            "Also contains: Calcium oxalate (草酸鈣)"
        ],
        "References": [
            "[1] Antiviral Res. 1995 May;27(1-2):99-109."
        ],
        "Further Reading": [],
        "Original Text": "mu xiang, Complementary and Alternative Healing UniversityComplementary and Alternative Healing University   中藥詞典                 Chinese Herb Dictionary      Search this site     在本網站找資料Search this siteList of Health ProblemsChinese Herb DictionaryQigongTraditional Chinese Medicine (TCM)AcupuncturePrescribed Drug DictionaryBiochemistry DictionaryLecture SlidesResearch LibrarianGeneral Online LibraryResearch SitesViagraMassage/AcupressureHypnotherapyTell us what you wantNotify Changes & New Information  mu xiang 木香 Edited by: Joe Hing kwok ChuQing mu xiang （青木香）a wrong substitute, belongs to Aristolochia family, which is toxic to the kidneys.Pharmaceutical name:英文藥名﹕Radix AucklandiaeBotanical name:學名﹕Aucklandia lappa Deene.Saussurea lappa ClarkeInula racemosa, Hook fil. (土木香，藏木香)Aucklandia costus, FalkPron. in Japanese:日語發音﹕mokkoPron. in Korean:韓語發音﹕mokhyangPron. in Cantonese:粵音﹕muk6 heong1Other Names:別 名﹕guang mu xiang (orginally those that imported from India and came through Guangdong province), yun mu xiang (those grown in Yunnan province)廣木香(原為印度產木香﹐經廣東人口)﹐雲木香(於雲南種 植的木香)Common Name:英文名﹕costus root.Distribution:產地﹕mainly in Yunnan, also in Sichuan and Tibet.主產於云南。四川﹐ 西藏也有生產。Properties(characteristics)﹕性味﹕acrid, bitter, warm.辛﹐苦﹐溫。Channels (meridians) entered: 歸經﹕gallbladder, large intestine, spleen, stomach膽﹐大腸﹐脾﹐胃。Medical functions:藥理﹕ anti fungusimproves movements of digestive tract, relieves flatulence and pain.anti HBV antigen[1]抗真菌 促進胃腸蠕動，緩解胃腸氣脹疼痛抗乙型肝炎病毒， Actions & Indications:主治﹕flatulence and pain in the abdomen, diarrhea, vomiting caused by weak digestion. For bronchitis, digestive tract infection: yeast infection, dysentery, and lack of appetite.氣滯胸腹脹痛，霍亂吐瀉，痢疾 ，裏急後重，慢性胃腸炎 (細菌或真菌感染)，支氣管炎﹐食慾不振。Chemical ingredients:化學成份﹕Evaporating oil:揮發油：Aplotaxene雲木香烯 (單紫杉烯)(+)-β-costol(+)-β-木 香醇Dehydrocostus lactone脫氫木香內酯Dihydrodehydrocostus lactone二氫脫 氫木香內酯α- iononeα- 紫 羅蘭酮β-selneneβ-芹子烯saussure alactone風毛菊內酯Costic acid木香酸Castunolide木香烯內酯β-costeneβ-木香烯 (α- 木 香烴)α- costeneα- 木 香烯 (α- 木 香烴)β-elemene欖香烯β-selinene芹子烯Dihydrocostunolide二氫木香內酯Costus lactone木香內酯Friedelin無羈帖terpenoids type essential oil 烯帖類精油Organic ingredients:有機成份：Palmitic acid棕櫚酸Linderic acid天台烏藥酸Also contains:另含：calcium oxalate草酸鈣Dosage:用 量﹕3 ~ 10 g.Samples of formulae:處方舉 例﹕xiang sha liu jun zi tang 香砂六君子湯gui pi tang  歸脾湯　Modern Research:現代研究﹕ Toxicity & Cautions:毒素與禁忌﹕Beware of using the wrong substitute,  qing mu xiang (root of ma dou ling) (Aristolochia delibis Sieb.) is toxic for the kidneys.Do not use mu xiang in cases of yinxu (yin deficient) condition.Allergic reaction: mild abdominal pain, itchiness, tightness in chestarea, and diarrhea.青木香有毒﹐為 馬兜鈴之根﹐對腎 臟有大毒。不可用。  陰虛， 津液不足 者 慎服木香。 不良反應包括：輕微腹痛，發痒，胸悶，腹瀉。[1] Antiviral Res. 1995 May;27(1-2):99-109.For complete bibliography of chemical ingredients email our research librarian. Problems with website? Please email: Click here for comment. (Not for inquiry )Click here for inquiry  Search this siteProblems with website? Please Click here for comment. (Not for inquiry )    Click here for inquiryCopyright Notice 按此看關於版權問題A manuscript... writing, translating and proofreading  in progressSponsors' Ads by Google 以下為谷歌 所提供之廣告 List of Health ProblemsChinese Herb DictionaryToxicity of Some HerbsSide Effect of Some HerbsHerbs that can be toxic to kidneysTraditional Chinese Medicine TCM Diagnosis Samples of FormulaeTerms of Traditional Chinese MedicineAcupuncturecopy right 版權所有Qigong (chi kung)Prescribed Drug DictionaryEmail our web master for  your suggestion (not for inquiry)Biochemistry DictionaryGeneral Online LibraryQigong classesFake Email WarningResearch LibrarianSearchQigong classesHomeWeather ReportDisclaimerLast update: Sept 21, 2014; 1 p.m. LAH   ",
        "original_url": "http://alternativehealing.org/mu_xiang.htm"
    },
    {
        "Names": {
            "Name": [
                "ze xie"
            ],
            "Pharmaceutical": [
                "Alismatis Rhizoma"
            ],
            "Biological": [
                "Alisma orientale (Sam.) Juzep.",
                "Alisma plantago-aquatica L.var. orientale Sam."
            ],
            "Chemical": [],
            "Common": [
                "English: alisma"
            ],
            "Other name": [
                "fu ze xie 福 澤 瀉",
                "jiang ze xie 建澤瀉"
            ],
            "Chinese": [
                "澤瀉"
            ],
            "Pronunciation in Korean": [
                "t'aeksa"
            ],
            "Pronunciation in Japanese": [
                "takusa"
            ],
            "Pronunciation in Cantonese": [
                "zaak1 se3"
            ],
            "Pinyin Pronunciation": [
                "ze xie"
            ]
        },
        "Type": "Herb",
        "Geography": [
            "Fujian province (China)"
        ],
        "Properties": [
            "Sweet",
            "Bland",
            "Cold"
        ],
        "Meridians": [
            "Kidney",
            "Bladder"
        ],
        "Maladies Treated": [
            "Edema caused by damp heat in the lower burner (xia jiao).",
            "Painful and difficult urination (dysuria) caused by damp heat in the lower burner (xia jiao).",
            "Diarrhea (urinary system or digestive system infection) caused by damp heat in the lower burner (xia jiao).",
            "Leucorrhagia caused by damp heat in the lower burner (xia jiao), which include vaginal yeast infection or vaginal bacteria infection.",
            "Lin zhuo (淋濁; turbid lin) due to damp heat in the lower burner (xia jiao).",
            "Lin syndrome with turbid urine, leukorrhea (vaginal discharge), and phlegm-retention."
        ],
        "Medical Function": [
            "Lowers blood lipids: total cholesterol; inhibits hardening of main artery.",
            "Diuretic.",
            "Prevents fatty liver.",
            "Anti-pyretic (lowering fever).",
            "Anti-bacterial (inhibits mycobacterium tuberculosis).",
            "Hypoglycemic.",
            "Hypotensive.",
            "Galactagogue (promote milk secretion).",
            "Anti tumor.",
            "Induces interferon.",
            "Anti-allergic."
        ],
        "Dosage": "5–10 g.",
        "Samples of Formulae": "shi quan da bu tang 十全大補湯\nze xie tang 澤瀉湯\nlong dan xie gan tang 龍膽瀉肝湯\nlong dan xie gan wan 龍膽瀉肝丸",
        "Contraindications": "Do not use in case of damp cold, spermatorrhea or leukorrhagia due to kidney yang deficiency.\nBecause ze xie possesses diuretic effect, might not suitable for yin deficient condition.\nSee modern research above.\nMay cause intestinal irritation with prolonged usage.\nLarge dosages might be harmful to liver and kidney.",
        "Research": "Infusion of water extract of ze xie into abdomen cavities of laboratory mice at 36.36g/kg and those with venous injection of ze xie extract of .098g/kg and also those fed with 4g/kg did not show any mortality. Feeding 1 g and 2 g/kg (equals 20 and 40 times the amount of clinical usage) for 3 months, the animals were healthy. Their blood level of ALT and hemoglobin did show any differences with the control group. But, in examination, the cells of livers and kidney showed different degree of murkiness and mutation. The results of large dosages were more obvious. It showed that it might be the result of administered of the herb. The heart tissues did not show any changes.[3]",
        "Notes": "",
        "Chemical Ingredients": [
            "alisol A",
            "alisol B",
            "alisol C",
            "alisol A monoacetate",
            "alisol B monoacetate",
            "alisol C monoacetate",
            "epialisol A",
            "alismol",
            "alismoxide",
            "16β-methocyal-isol B monoacetate",
            "16β-hydroxyal-isol B monoacetate",
            "sitosterol-3-O-steroyl-β-D-glucopyranoside",
            "choline",
            "sugar",
            "K",
            "Ca",
            "Mg"
        ],
        "References": [
            "[3]"
        ],
        "Further Reading": [],
        "Original Text": "ze xie, Complementary and Alternative Healing UniversityComplementary and Alternative Healing University  Home   中藥詞典                 Chinese Herb Dictionary               Search this siteSearch this siteList of Health ProblemsChinese Herb DictionaryQigongTraditional Chinese MedicineAcupuncturePrescribed Drug DictionaryBiochemistry DictionaryLecture SlidesResearch LibrarianGeneral Online LibrarySearch this siteResearch SitesViagraMassage/AcupressureHypnotherapyTell us what you wantNotify Changes & New Information　　                                              　Sponsored Ads by Google　 　     　                  ze xie  澤瀉        (in English and Chinese 中英文)by: Joe Hing Kwok ChuClick here to see picture of ze xie. 按此看圖。Pharmaceutical name:英文药名：Alismatis RhizomaBiological name:拉丁學名：Alisma orientale (Sam.) Juzep.﹔Alisma plantago-aquatica L.var. orientale Sam.Pron. in Japanese:日語發音: takusaPron. in Korean:韓語發音：t'aeksaPron. in Cantonese:粤語發音：zaak1 se3Other Names:別名：fu ze xie 福 澤 瀉, jiang ze xie 建澤瀉Common Name:英文名：alismaDistribution:分布：It is mainly produced in Fu Jian province, so it is also called fu ze xie or jian ze xie.主產於福建。所以也稱 為福澤瀉或建瀉。Properties (characteristics)：性味：sweet, bland, cold甘 ，淡，寒。Channels (meridians) entered:歸經：kidney, bladder歸腎，膀胱經。Actions & Indications：主治：for edema, painful and difficult urination (dysuria), diarrhea , leucorrhagia, caused by damp heat in the lower burner (xia jiao) which include urinary tract infection, vaginal yeast infection or vaginal bacteria infection.下焦濕熱以致水腫、 小便不利、 泄瀉(泌尿系統或消化系統感染)、淋濁帶 下及痰飲等。Medical Function:药理：(1) lowers blood lipids: total cholesterol, inhibits hardening of main artery(2) diuretic(3) prevents fatty liver(4) anti-pyretic (lowering fever)(5) anti-bacterial (inhibits mycobacterium tuberculosis)(6) hypoglycemic(7) hypotensive(8) galactagogue (promote milk secretion)(9) anti tumor(10) induces interferon(11)  anti-allergic (1)降血脂，可使血清總膽固醇及甘油三酯含量降 低﹐能抑制主動脈粥樣硬化斑的 形成 (2)利尿 (3)抗脂肪肝(4) 退熱(5) 抗菌 ( 抗肺癆菌)(6) 降血糖(7) 降血壓(8) 促奶分泌(9) 抗癌(10) 增加干擾素(11) 抗過敏 Chemical ingredients:化学成份：  alisol A、B、C瀉醇 A、B、Calisol A monoacetate澤瀉醇A單乙酸酯alisol B monoacetate澤瀉醇B單乙酸酯alisol C monoacetate澤瀉醇C單乙酸醋epialisol A表澤瀉醇 Aalismol澤瀉薁醇alismoxide澤瀉薁醇氧化物16β-methocyal-isol B monoacetate16β-甲氧基澤瀉醇B單乙酸酯16β-hydroxyal-isol B monoacetate16β-羥基澤瀉醇B單乙酸酯sitosterol-3-O-steroyl-β-D-glucopyranoside谷甾醇-3-O-硬脂酰基 -β-D-吡喃葡萄糖甙choline膽鹼sugar糖K, Ca, Mg etc鉀、鈣、鎂等元素。Dosage:用量：5- 10 g.5~10克。Samples of formulae:處方舉例：shi quan da bu tang 十全大補湯ze xie tang  澤瀉湯long dan xie gan tang 龍膽瀉肝湯long dan xie gan wan 龍膽瀉肝丸Modern Research:Infusion of water extract of ze xie into abdomen cavities of laboratory mice at 36.36g/kg and those with venous injection of ze xie extract of .098g/kg and also those fed with 4g/kg did not show any mortality. Feeding 1 g and 2 g/kg (equals 20 and 40 times the amount of clinical usage) for 3 months, the animals were healthy. Their blood level of ALT and hemoglobin did show any differences with the control group. But, in examination, the cells of livers and kidney showed different degree of murkiness and mutation. The results of large dosages were more obvious. It showed that it might be the result of administered of the herb. The heart tissues did not show any changes.[3]Cautions：禁忌： Do not use in case of damp cold, spermatorrhea or leukorrhagia due to kidney yang deficiency.Because of ze xie possesess diuretic effect, might not suitable for yin deficient condition.See modern research above.May cause intestinal irritation with prolonged usage.因腎陽虛而致白帶﹐精滑者忌服。長期服用可能刺激腸臟。大劑量可能對肝臟與腎臟有害。澤瀉有利尿作用，可能不利於陰虛者。　Sponsors' Ads by Google 以下為谷歌所提供贊助者之廣告 A manuscript... writing, translating and proofreading  in progressClick here for inquiry  Copyright Notice 按此看關 於版權問題List of Health ProblemsChinese Herb DictionaryToxicity of Some HerbsSide Effect of Some HerbsHerbs that can be toxic to kidneysTraditional Chinese MedicineTCM DiagnosisSamples of FormulaeTerms of Traditional Chinese MedicineAcupuncturecopy right 版權所有Qigong (chi kung)Prescribed Drug DictionaryEmail our web master for  your suggestion (not for inquiry)Biochemistry DictionaryGeneral Online LibraryQigong classesFake Email WarningResearch LibrarianSearchQigong classesHomeWeather Report    DisclaimerLast update: Sept 22, 2013;  11:10 p.m. LAH　  　            ",
        "original_url": "http://alternativehealing.org/ze_xie.htm"
    },
    {
        "Names": {
            "Name": [
                "ya dan zi",
                "鴉膽子"
            ],
            "Pharmaceutical": [
                "Fructus Bruceae"
            ],
            "Biological": [
                "Brucea javanica (L.) Merr."
            ],
            "Chemical": [],
            "Common": [
                "brucea fruit"
            ],
            "Other name": [
                "lao ya dan 老鴉膽(《生草藥性備要》)",
                "ya dan 鴉膽",
                "ku qin zi 苦榛子(《吉雲旅鈔》)",
                "ku shen zi 苦參子(《綱目拾遺》)",
                "ya dan zi 鴉蛋子(《植物名實圖考》)",
                "ya dan zi 鴨蛋子(《醫學衷中參西錄》)",
                "ya dan zi 鴨膽子(《中藥志》)",
                "jie ku lian 解苦楝(《廣西中藥志》)",
                "xiao ku lian 小苦楝(《廣西中草藥》)"
            ],
            "Chinese": [
                "鴉膽子",
                "老鴉膽",
                "鴉膽",
                "苦榛子",
                "苦參子",
                "鴉蛋子",
                "鴨蛋子",
                "鴨膽子",
                "解苦楝",
                "小苦楝"
            ],
            "Pronunciation in Korean": [
                "adancha"
            ],
            "Pronunciation in Japanese": [
                "atanshi"
            ],
            "Pronunciation in Cantonese": [
                "aa1 daam2 zi2"
            ],
            "Pinyin Pronunciation": [
                "ya dan zi"
            ]
        },
        "Type": "Herb",
        "Geography": [
            "Guangdong (China)",
            "Guangxi (China)"
        ],
        "Properties": [
            "Bitter",
            "Cold",
            "Toxic"
        ],
        "Meridians": [
            "Large Intestine",
            "Liver"
        ],
        "Maladies Treated": [
            "dysentery especially due to protozoans",
            "malaria (especially the 3 day or alternate day types)",
            "External use: warts",
            "External use: corns"
        ],
        "Medical Function": [],
        "Dosage": "Internal: Adult 5–12 seeds each time, 3 times per day; in some cases 4 seeds each time. Small children: 1–2 seeds per year of age, not to exceed 12 seeds. Usually swallowed wrapped in Long Yan Rou (longan aril) or in capsules; can also be used as tablets after pressing out the oil.\n\nExternal: appropriate amount.",
        "Samples of Formulae": "For treatment of malaria: Ya Dan Zi (brucea fruit) 10 kernels; wrap each in Long Yan Rou (longan aril) and swallow, 3 times daily; after 3 days reduce to half dose (5 kernels), continue for 5 days. Source: Guangxi Chinese Herb (《廣西中草藥》).",
        "Contraindications": "Contraindicated in pixu (spleen deficient), nausea or vomiting, gastrointestinal bleeding, liver disease, kidney disease, pregnancy, and in children.",
        "Research": "",
        "Notes": "Protozoans: any of a large group of single-celled, usually microscopic, eukaryotic organisms, such as amoebas, ciliates, flagellates, and sporozoans. (American Heritage Dictionary)",
        "Chemical Ingredients": [
            "bruceine A",
            "bruceine B",
            "bruceine C",
            "bruceine D",
            "bruceine E",
            "bruceine F",
            "bruceine G",
            "bruceine H",
            "brusatol",
            "bruceoside A (yatanoside)",
            "bruceoside B (yatanoside)",
            "brucamarin",
            "bruceolic acid",
            "quassin"
        ],
        "References": [],
        "Further Reading": [],
        "Original Text": "\n\n\nya dan zi, Complementary and Alternative Healing University\n\n\n\n\n\n\n\n\n\n\n\nComplementary and Alternative Healing University \n        \nHome  \n\n\n現代 中藥辭典\n\n\n\n\n\n\n\n\n\n\n\n\n\n\n\nSearch this site\n\n\n\n\n\n\n\n            List of Health Problems\n\n\n\n\n\n\n\n            Chinese Herb Dictionary\n\n\n\n\n\n\nQigong\n\n\n\n\n\n\n\n            Traditional Chinese Medicine (TCM)\n\n\n\n\n\n\n\n            Acupuncture\n\n\n\n\n\n\n\n            Prescribed Drug Dictionary\n\n\n\n\n\n\n            Biochemistry Dictionary\n\n\n\n\n\n\nLecture Slides\n\n\n\n\n\nResearch Librarian\n\n\n\n\n\n\nGeneral \n            Online Library\n\n\n\n\n\n\nSearch this site\n\n\n\n\n\n\nResearch \n            Sites\n\n\n\n\n\n\n\n            Viagra\n\n\n\n\n\n\n\n            Massage/Acupressure\n\n\n\n\n\n\nHypnotherapy\n\n\n\n\n\n\nTell us what you want\n\n\n\n\n\n\nNotify Changes \n            & New Information\n\n\n\n\n　\n　\n \n \n \n \n \n \n \n \n \n \n　\n \n \n \n \n \n \n \n \n \n \n\n\n\n\n\n\n\n\n\n\n\nya dan zi 鴉 \n            膽子  (in English and Chinese \n            中英文)\nby \n            Joe Hing Kwok Chu\n\n\n\n\n\nPharmaceutical \n                name:\n英文藥名﹕\n\n\nFructus \n                Bruceae\n\n\n\n\n\nLatin name:\n學名﹕\n\n\n\nBrucea javanica (L.)Merr.\n\n\n\n\nPron. in Japanese:\n日語發 音﹕\n\n\n\natanshi\n\n\n\n\nPron. in Korean:\n韓語發 音﹕\n\n\n\nadancha\n\n\n\n\n\n\n\n                Pron. in Cantonese:\n \n粵音﹕\n\n\n\naa1 daam2  \n                zi2\n\n\n\n\nOther \n                Names:\n別名﹕\n\n\n\n                1. lao ya dan 老鴉膽(《 生 草藥性備要》)、\n                2. ya dan 鴉膽、ku qin zi 苦榛子(《吉雲旅鈔》)、\n                3. ku shen zi 苦參子(《綱目拾遺》)、\n                4. ya dan zi 鴉蛋子(《植物名實圖考》)、\n                5. ya dan zi 鴨蛋子(《醫學衷中參西錄》)、\n                6. ya dan zi 鴨膽子(《中藥志》)、\n                7. jie ku lian 解苦楝(《廣西中藥志》)、\n                8. xiao ku lian 小苦楝(《廣西中草藥》)\n\n\n\n\nCommon Name:\n英文名 ﹕\n\n\n\nbrucea fruit\n\n\n\n\nDistribution:\n產地 \n                ﹕\n\n\n\nMainly produced in Guangdong, Guangxi.\n主 \n                產於廣東﹐ 廣西。\n\n\n\n\nProperties\n characteristics)﹕\n性味﹕\n\n\n\nbitter, cold, toxic\n\n苦﹐寒﹐有毒。\n\n\n\n\nChannels  \n                meridians) entered:\n \n歸經﹕\n\n\n\nlarge intestine, liver\n\n大腸﹐肝。\n\n\n\nMedical \n                functions:藥理﹕\n \n\n\n \n\n\n\n\n\nActions & Indications:\n\n主治﹕\n\n\n\nfor dysentery especially due to\n                protozoans, \n                malaria (especially the 3 day or alternate day types). External \n                uses: warts and corns.\n 用 於痢疾 (尤其原蟲感染) \n                , 瘧疾 (各種瘧疾，尤以間日虐及三日虐為優)。 ；外治腐蝕贅疣, 雞眼。\n\n\n\n\n\nChemical ingredients:\n\n化學成份﹕\n\n\n\n\n\n\nbruceine A,  \n                    B,  C,  D,  E,  F,  G,  H\n\n\n\n鴉膽子苦素\n\n\n\n\n\nbrusatol\n\n\n\n鴉膽子苦醇\n\n\n\n\n\nbruceoside A,  \n                    B，(yatanoside)\n\n\n\n鴉膽子甙\n\n\n\n\n\nbrucamarin\n\n\n\n鴉膽子碱\n\n\n\n\n\nbruceolic acid\n\n\n\n鴉膽子酸\n\n\n\n\n\nquassin\n\n\n\n苦木素\n\n\n\n\n\n\n\n\n\n\n                Dosage:\n\n                用量﹕\n\n\n\nAdult: 5 to 12 seeds each time, 3 times \n                per day. Also in some cases. 4 seeds each time. Small children 1 \n                to 2 seed per year old (not to exceed 12 seeds). Usually taken with \n                long gan rou as wrapping or in capsules. Also can be taken as tablet \n                with oil pressed out.\n\nExternal use: appropriate amount.\n口 \n                服每日3次，成人每次用鴉膽子仁5～12粒，也有少至4粒的；小兒每歲1-2粒 。多以 龍眼肉包裹或裝膠囊吞服。亦可壓去油後作丸,  \n                片劑服。外用適量。\n\n\n\n\nSamples \n                of formulae:\n處 \n                方舉例﹕\n\n\nFor treatment of malaria: \n                use 10 pieces of ya dan zi and wrap each in long yan meat. Swallow. \n                After 3 days, lessen the dosage to half (5 pieces). Continue taking \n                for 5 days. (source: Guangxi Chinese Herb)\n治瘧疾：鴉膽子果仁十粒，入桂圓肉內吞服， \n                日三次，第三日後減半量，連服五日。（《廣西中草藥》）\n\n\n\n\n\nModern Research:\n\n現代研究﹕\n\n\n \n\n\n\n\n\nToxicity & Cautions:\n\n毒素與禁忌﹕\n\n\n\nnot to use in cases of \n\npixu (spleen deficient)\n or \n                where there is nauseas or vomiting, or in those with gastrointestinal \n                bleeding, liver or kidney diseases. \n                Use with caution during pregnancy and in children﹐\n\n脾虛 \n                或作嘔﹐ 懷孕期間﹐ 小兒﹐ 消化道出血﹐ 肝臟病者﹐ 腎臟病者忌用。\n\n\n\n\nProtozoans: \nany of a large group of single-celled, usually microscopic, \n            eukaryotic organisms, such as amoebas, ciliates, flagellates, and sporozoans. \n            (American Heritage Dictionary)\n\n\n\n\n\n\nSponsors' Ads by Google 以下為谷歌 \n    所提供之廣告\n\n\n \n\n\n\n\n\n\n\nA manuscript... writing, translating and proofreading              \n        in progress\n\nProblems with website? Please \n\nClick \n        here for comment. (Not for inquiry ) \n        \n\n\nClick \n        here for inquiry\n \n \n\n\nCopyright Notice 按此看關 \n        於版權問題\n\n\n\n\n\n\n            List of Health Problems\n\n\n\n\n\n            Chinese Herb Dictionary\n\n\n\n\n\nToxicity of Some Herbs\n\n\n\nSide Effect of Some Herbs\n\n\n\nHerbs that can be toxic to kidneys\n\n\n\n\n\n            Traditional Chinese Medicine\n\n\nTCM Diagnosis\n\n\nSamples \n            of Formulae\n\n\n\n\n\n            Acupuncture\n\n\n\n\n\n\ncopy right\n \n\n\n版權所有\n\n\n\n\nQigong \n            (chi kung)\n\n\n\n\n\n            Prescribed Drug Dictionary\n\n\n\n\n\n            Email our web master for  your suggestion (not for inquiry)\n\n\n\n\nBiochemistry Dictionary\n\n\n\n\n\n\nGeneral Online Library\n\n\n\n\nQigong classes\n\n\n\n\nFake \n            Email Warning\n\n\n\n\nResearch Librarian\n\n\n\n\nSearch\n\n\n\n\n\n\nQigong classes\n\n\n\n\n\n\n\n\n\nHome\n\n\n\n\n\n            Weather Report\n\n\n\n    \n\nDisclaimer\n\n\n\n\n\n\n\n         \n\n \n\n\n\n\n\n\n\n\n\n\n\n\n\n\n\n\n\n\n\n\n\n\n\n\n\n\n\n\n\n\n\n\n\n\n\n\n\n\n\n\n\nLast \n        update: April 23, 2011; 4:49 p.m. LAH\n\n\n\n\n\n\n\n\n\n\n\n\n\n\n\n",
        "original_url": "http://alternativehealing.org/ya_dan_zi.htm"
    },
    {
        "Names": {
            "Name": [
                "ba ji tian"
            ],
            "Pharmaceutical": [
                "Radix Morindae Officinalis"
            ],
            "Botanical": [
                "Morinda officinalis How"
            ],
            "Chinese": [
                "巴戟天"
            ],
            "Common": [
                "morinda root"
            ],
            "Other name": [],
            "Pronunciation in Korean": [
                "p'agukch'on (파극천)"
            ],
            "Pronunciation in Japanese": [
                "hagekiten (はげきてん)"
            ],
            "Pronunciation in Cantonese": [
                "baa1 gik1 tin1"
            ],
            "Pinyin Pronunciation": []
        },
        "Type": "Herb",
        "Geography": [
            "Guangdong (Quangdong), Guangxi (Quangxi), Fujian, Sichuan, Jiangxi provinces of China"
        ],
        "Properties": [
            "Acrid",
            "Sweet",
            "Warm"
        ],
        "Meridians": [
            "Kidney",
            "Liver"
        ],
        "Maladies Treated": [
            "shenyangxu (kidney yang deficiency) that causes impotence",
            "infertility due to shenyangxu (kidney yang deficiency)",
            "premature ejaculation due to shenyangxu (kidney yang deficiency)",
            "spermatorrhea due to shenyangxu (kidney yang deficiency)",
            "frequent urination due to shenyangxu (kidney yang deficiency)",
            "incontinence (大小便失禁) due to shenyangxu (kidney yang deficiency)",
            "irregular menses (月經不調) associated with shenyangxu (kidney yang deficiency)",
            "cold and painful lower abdomen (下腹冷痛) associated with shenyangxu (kidney yang deficiency)",
            "weak and achy loin and knees (腰膝痿軟疼痛)",
            "chronic inflammation of nerves, especially the sciatica nerves (坐骨神經痛)",
            "muscular atrophy (肌肉萎縮)",
            "painful rheumatoid arthritis (痺痛)",
            "lower limb cold-damp impediment pain (下肢寒濕痺痛)",
            "ridding of damp cold"
        ],
        "Medical Function": [
            "Used as tonic for kidneys, improving yang",
            "Assists kidney yang, strengthens sinews and bones",
            "Warm but not drying; tonifying without stagnation",
            "Disperses cold-damp"
        ],
        "Dosage": "4–10 grams",
        "Samples of Formulae": "For impotence, spermatorrhea, and yang-impotence with seminal emission caused by Kidney Yang deficiency affecting sexual function: Combine with Rou Cong Rong (Cistanche) and Tu Si Zi (Dodder seed) to warm Kidney Yang, nourish essence, and improve sexual function.\n For weakness, soreness, and flaccidity of the lower back and knees or chronic lower back pain due to Kidney Yang deficiency:Combine with Xu Duan (Teasel root) and Du Zhong (Eucommia bark) to tonify Kidney and Liver, strengthen sinews and bones, and relieve pain. \n For cold-damp bi-pain and rheumatoid arthritis–like joint pain (pain aggravated by cold and dampness): Combine with Fu Zi (Processed Aconite) and Gou Ji (Cibotium rhizome) to warm the channels, dispel cold, and unblock painful obstruction.",
        "Contraindications": "Contra-indicated for damp heat or heat caused by yin deficiency.\nUse caution in patients with difficulty in urination; shenyangxu (kidney yang deficiency) patients have a tendency to develop enlargement of the prostate, leading to difficulty in urination.\nSome old literatures mentioned not to use it with dan shen (Radix Salviae miltiorrhizae).",
        "Research": "ba ji tian extract can be used to counter-act the adverse effect of hydrocortisone on the atrophy of thymus gland, and adrenal cortex, and the increase level of SGPT (ALT).",
        "Notes": "",
        "Chemical Ingredients": [
            "morindin",
            "vitamin C",
            "asperuloside tetraacetate",
            "resin",
            "monotrpein",
            "methyl isoalizarin",
            "methylisoalizarin 1-methylether",
            "rubiadian",
            "rubiadin-1-methyl-ether",
            "2-methylanthraquinone",
            "2-hydroxy-3- (hydroxymethyl)-anthraquinone",
            "1-hydroxy, antraquinone",
            "anthraquinone",
            "1,6-dihydroxy-2-methoxy-anthraquinone",
            "1-hydroxy-2-methoxyanthraquinone",
            "elements: lead, iron, magenese, zinc, potassium, calcium, magnesium, nickel, barium, sodium, phosphorus, aluminium, etc.",
            "Organic acid: 24-ethycholesterol",
            "non-adecane",
            "glucose",
            "mannose"
        ],
        "References": [],
        "Further Reading": [],
        "Original Text": "\n\n\nba ji tian, Complementary and Alternative Healing University\n\n\n\n\n\nComplementary \n    and Alternative Healing University\n\n\n\n\n\n\n\n中藥詞典                 \n    Chinese Herb Dictionary    \n     Search \n    this site    \n    在本網站找資料\n\n\n\n\n\n\n\n\n\n\n\n\n\n\n\n\nSearch this \n        site\n\n\nList \n        of Health Problems\n\n\n\n\n\n\nChinese \n        Herb Dictionary\n\n\n\n\n\n\nQigong\n\n\n\n\n\n\n\n        Traditional Chinese Medicine (TCM)\n\n\n\n\n\n\n\n        Acupuncture\n\n\n\n\n\n\n\n        Prescribed Drug Dictionary\n\n\n\n\n\n\nBiochemistry Dictionary\n\n\n\n\n\n\nLecture Slides\n\n\n\n\n\n\nResearch Librarian\n\n\n\n\n\n\nGeneral \n        Online Library\n\n\n\n\n\n\nResearch Sites\n\n\n\n\n\n\n\n        Viagra\n\n\n\n\n\n\nMassage/Acupressure\n\n\n\n\n\n\nHypnotherapy\n\n\n\n\n\n\nTell us what you want\n\n\n\n\n\n\nNotify Changes \n        & New Information\n\n\n\n\n \n\n\n\n\n\n\n \nba ji tian \n巴戟天  \n     \n    (in English and Chinese 中英文)\nBy:\n    \n    Joe Hing Kwok Chu\n\nSee picture here \n    按此看圖\n \n\n\n\n\n\nPharmaceutical name:\n\n英 文 藥 名 :\n\n\nRadix \n          Morindae Officinalis\n\n\n\n\n\nLatin botanical name﹕\n拉 丁 \n          學 名 :\n\n\n\nMorinda officinalis How\n\n\n\n\nPron. \n          in Japanese﹕\n日 語 \n          發 音 :\n\n\nhagekiten \n          （はげきてん）\n\n\n\n\nPron. \n          in Korean:\n韓 語 \n          發 音 ﹕\n\n\np'agukch'on \n          (파극천)\n\n\n\n\n\n\n\n          Pron. in Cantonese:\n粵 語 \n          發 音 ﹕\n\n\nbaa1 \n          gik1 tin1\n          \n\n\n\n\n\nCommon \n          Name﹕\n英 文 \n          名 :\n\n\nmorinda \n          root\n\n\n\n\nDistribution﹕\n產 地 \n          :\n\n\nQuangdong, \n          Quangxi, Fujian, Sichuan, Jiangxi provinces of China.\n\n主產於廣東、廣西、福建、四川、江西等地。\n\n\n\n\nProperties \n          (characteristics)\n性 味 \n          ﹕\n\n\nacrid \n          sweet and warm\n辛 \n          ﹐ 甘 ﹐ 溫 。\n\n\n\n\n\nChannels (meridians) entered:\n歸 經 \n          ﹕\n\n\nkidney \n          and liver channels\n腎 \n          ﹐ 肝 。\n\n\n\n\n\nActions & Indications:\n主 \n          治 ﹕\n\n\n\n\n\nUsed as tonic for kidneys, improving yang, \n            especially for\n            \n            shenyangxu (kidney yang deficiency) that causes\n            \n            impotence, infertility, premature ejaculation, spermatorrhea, frequent \n            urination, incontinence, irregular menses, cold and painful lower abdomen﹐ \n            weak and achy loin and knees,  and chronic inflammation of nerves \n            (especially the sciatica nerves).\n\n\n\nUsed for muscular atrophy, painful rheumatoid \n            arthritis, ridding of damp cold.\n\n\n \n\n\n\n用於腎虛陽痿，遺精﹐ 早泄，多 \n            尿 ﹐大 小 便 失 禁 ﹐ 月 經 不 調 ﹐ 下 腹 冷 痛 。 2.  腰膝痿軟疼 痛 ﹐ \n            坐 骨 神 經 痛 等症。\n\n\n\n用於肌 肉 萎 \n            縮 ﹐ 下肢寒濕痺痛等症。\n\n\n\n\n\n\n\nDosage:\n用 \n          量 ﹕\n\n\n4 \n          ~ 10 grams\n4 \n          ~ 10 克 。\n\n\n\n\nSamples \n          of Applications:\n應 \n          用 舉 例 ﹕\n\n\n\n\n\nFor impotence, spermatorrhea: ba ji tian,\n            \nrou cong rong, \n tu \n            si zi.\n\n\n\nFor weak and achy loin and knees: ba ji tian,\n            \nxu duan,\n            \ndu zhong.\n\n\n\nFor painful rheumatoid arthritis: ba ji tian,\n            fu zi, \n\ngou jii.\n\n\n \n\n\n\n巴戟天溫而不燥， \n            補而不滯，能補腎陽、強筋骨。用於陽痿遺泄，常與肉 \n            蓯蓉、菟 \n            絲子等同用；\n\n\n\n治療腰膝痿軟，常 \n            與續 \n            斷、杜 \n            仲等 \n            藥配伍應用。\n\n\n\n巴戟天能助腎陽、 \n            散寒濕，治痺痛，常與附 \n            子、狗 \n            脊等同 用 。\n\n\n\n\n\n\n\nChemical ingredients﹕\n化 \n          學 成 份 :\n\n\nmorindin, \n          vitamin C,asperuloside tetraacetate, resin, monotrpein, methyl isoalizarin, \n          methylisoalizarin 1-methylether, rubiadian, rubiadin-1-methyl-ether, 2-methylanthraquinone, \n          2-hydroxy-3- (hydroxymethyl)-anthraquinone, 1-hydroxy, antraquinone, anthraquinone, \n          1,6-dihydroxy-2-methoxy-anthraquinone, 1-hydroxy-2-methoxyanthraquinone; \n          elements: lead, iron, magenese, zinc, potassium, calcium, magnesium, nickel \n          , barium, sodium, phosphorus, aluminium, etc. Organic acid: 24-ethycholesterol, \n          non-adecane, glucose,  and mannose.\n\n\n\n\n\nModern Research:\n\n\nba \n          ji tian extract can be used to counter-act the adverse effect of hydrocortisone \n          on the atrophy of thymus gland, and\n          \n          adrenal cortex, and the increase level of\n          SGPT \n          (ALT).\n\n\n\n\n\nCautions﹕\n禁 \n          忌 :\n\n\nContra-indication \n          for damp heat or heat caused by\n          \n          yin deficiency. Use caution in patients with difficulty in urination \n          but usually\n          \n          shenyangxu patients have tendency to develop enlargement of prostate.\n3. \n          Some old literatures mentioned not to use it with\n          dan shen (Radix \n          salivae miltiorrhizae).\n\n濕 熱 或  \n          \n          陰 虛  有 熱  者 忌 用 。 小 便 困 難 者 小 心 應 用 。但  \n          \n          腎 陽 虛 者 常 常 引 起 前 列 腺 增 大﹐以 至 小 便 困 難  。\n有說巴戟天不可與丹參同用 \n          。\n\n\n\n\n \n \n\n\n\n\nSearch this site\n\n\n\nProblems with website? Please \n\nClick here \n    for comment. (Not for inquiry )    \n    \n\n\nClick \n    here for inquiry \n\n\n\nCopyright Notice \n\n按此看關於版權問題\n\n \nSponsors' Ads by Google 以下為谷歌 所提供之廣告\n\n\n\n\n\n\n\n\nList \n        of Health Problems\n\n\n\n\nChinese \n        Herb Dictionary\n\n\n\n\n\nToxicity of Some Herbs\n\n\n\nSide Effect of Some Herbs\n\n\n\nHerbs that can be toxic to kidneys\n\n\n\n\n\n        Traditional Chinese Medicine\n\n\nTCM Diagnosis\n\nSamples \n        of Formulae\n\n\n\n\n\n        Terms of Traditional Chinese Medicine\n\n\n\n        Acupuncture\n\n\n\n\n\n\ncopy right\n \n\n\n版權所有\n\n\n\n\nQigong \n        (chi kung)\n\n\n\n\n\n        Prescribed Drug Dictionary\n\n\n\n\nEmail \n        our web master for  your suggestion (not for inquiry)\n\n\n\n\nBiochemistry Dictionary\n\n\n\n\n\n\nGeneral Online Library\n\n\n\n\nQigong classes\n\n\n\n\nFake Email \n        Warning\n\n\n\n\nResearch Librarian\n\n\n\n\nSearch\n\n\n\n\n\n\nQigong classes\n\n\n\n\n\n\n\n\nHome\n\n\n\n\n\n        Weather Report\n\n\n\n\nDisclaimer\n\n\n\n\n\n\nLast \nupdate: Sept 28, 2013; 10 P.m. LAH\n \n\n\n\n\n\n\n\n\n\n",
        "original_url": "http://alternativehealing.org/ba_ji_tian.htm"
    }
]
