[
    {
        "Names": {
            "Name": [
                "ji ning",
                "薺寧"
            ],
            "Pharmaceutical": [
                "Radix Moslae grosseserratae"
            ],
            "Biological": [
                "Mosla grosseserrata Maxim.",
                "Orthodon grosseserratus (Maxim.) Kudo"
            ],
            "Chemical": [],
            "Common": [],
            "Other name": [
                "臭蘇",
                "青白蘇"
            ],
            "Chinese": [
                "薺寧",
                "臭蘇",
                "青白蘇"
            ],
            "Pronunciation in Korean": [],
            "Pronunciation in Japanese": [],
            "Pronunciation in Cantonese": [],
            "Pinyin Pronunciation": []
        },
        "Type": "Herb",
        "Geography": [
            "Jilin, Liaoning, Shandong, Jiangsu, Anhui"
        ],
        "Properties": [
            "Acrid",
            "Warm"
        ],
        "Meridians": [],
        "Maladies Treated": [
            "Asthma",
            "Ascites and edema",
            "Diarrhea",
            "Hyper gastric acidity",
            "Parasites with abdominal pain",
            "Swelling of hemorrhoids"
        ],
        "Medical Function": [
            ""
        ],
        "Dosage": "Oral: 9-15 g for decoction. \nExternal application: appropriate amount. Smash and apply.",
        "Samples of Formulae": "",
        "Contraindications": "",
        "Research": "",
        "Notes": "",
        "Chemical Ingredients": {
            "Stem and leaves": [
                "0.3%-0.5% oil content",
                "Thymol",
                "Carvacrol",
                "Phellandrene",
                "Thymoquinone"
            ],
            "Whole herb": [
                "0.11%-0.17% oil content",
                "Bisabolene",
                "α-caryophyllene",
                "Methyleugenol"
            ]
        },
        "References": [
            "Anthology of Chinese Herb of Whole Nation",
            "Zhong Hua Ben Cao"
        ],
        "Further Reading": [],
        "Original Text": "\n\n\nji ning ,Complementary and Alternative Healing University\n\n\n\n\n\n\n\n\nComplementary and Alternative Healing \n    University\n\nDiscussion \n    Form\n\n\n中藥詞典 Chinese Herb Dictionary \n    Search this site\n       \n    在本網站找資料   \n     \n\n\n\n\n\n\n\n\n\n\n\n\n\n\n\n\nSearch this site\n\n\n\n\n\n\nList \n        of Health Problems\n\n\n\n\n\n\nChinese \n        Herb Dictionary\n\n\n\n\n\n\nQigong\n\n\n\n\n\n\n\n        Traditional Chinese Medicine (TCM)\n\n\n\n\n\n\n\n        Acupuncture\n\n\n\n\n\n\n\n        Prescribed Drug Dictionary\n\n\n\n\n\n\nBiochemistry Dictionary\n\n\n\n\n\n\nLecture Slides\n\n\n\n\n\n\nResearch Librarian\n\n\n\n\n\n\nGeneral \n        Online Library\n\n\n\n\n\n\nSearch\n\n\n\n\n\n\nResearch Sites\n\n\n\n\n\n\n\n        Viagra\n\n\n\n\n\n\nMassage/Acupressure\n\n\n\n\n\n\nHypnotherapy\n\n\n\n\n\n\nTell us what you want\n\n\n\n\n\n\nNotify Changes \n        & New Information\n\n\n\n\n\n　\n\n　\n\n　\n \n \n \n \n \n \n \n \n \n \n \n \n \n \n \n \n \n\n　\n \n \n \n \n \n \n\n　\n\n　\n\n\n\n\n\n\n\n\n\n\n\n\n\n\n\n \n\nji ning \n    薺寧  (in English and Chinese 中英文)\n\n\nTranslated\n    by: \n    Joe Hing kwok Chu 朱興國編譯\n \n\n\n\n\nPharmaceutical \n        name:\n英文藥名﹕\n\nRadix\n        \nMoslae grosseserratae\n\n\n\nBotanical name:\n學名﹕\n\n\n\nMosla grosseserrata Maxim.\n\nOrthodon grosseserratus （Maxim.） \n        Kudo\n\n\n\n\nPron. in Japanese:\n日語發音﹕\n\n \n\n\n\nPron. in Korean:\n韓語發音﹕\n\n \n\n\n\n\n\n\n        Pron. in Cantonese::\n粵音﹕\n\n \n\n\n\nOther \n        Names:\n別名﹕\n\n臭蘇、青白蘇。\n\n\n\nCommon Name:\n外文名﹕\n\n \n\n\n\nDistribution:\n產地﹕\n\n分佈於吉林、遼寧、山東、江蘇和安徽等地。\n\n\n\nProperties\n(characteristics)﹕\n性味﹕\n\nacrid, warm.辛，溫。\n\n\n\n\nChannels (meridians) \n        entered:\n \n歸經﹕\n\n\n\n\nMedical functions:\n藥理﹕\n \n\nfor treatment of asthma\n\n\n\n\nActions & Indications:\n\n主治﹕\n\nIndications: ascites and edema; diarrhea; \n        hyper gastric acidity; parasites with abdominal pain; swelling of \n        hemorrhoids.利水消腫；和胃制酸。主治腹水水腫；泄瀉；胃酸過多；虫積腹痛；痔瘡腫痛。\n\n\n\n\nChemical ingredients: [2]\n\n化學成份﹕【2】\n\n \n\nStem and leaves contain 0.3%-0.5% of oil, mainly are \n            :\n\n\n\n\n            莖葉含油率為0.3%-0.5%, 主要為：\n\n\n\n\n\n            thymol\n\n\n\n            百里香酚\n\n\n\n\n\n            carvacrol\n\n\n\n            香荊芥酚\n\n\n\n\n\n            phellandrene\n\n\n\n            水芹烯\n\n\n\n\n\n            thymoquinone\n\n\n\n\n            百里香醌\n\n\nWhole herb contains\n    \n\n\n\n\n            0.11%-0.17% of oil, mainly are:\n\n\n\n\n            全草含油率為0.11%-0.17%，主要成份為：\n\n\n\n\n\n            bisabolene\n\n\n\n            左旋甜沒藥烯\n\n\n\n\n\n\n\n            α-caryophyllene\n\n\n\n            α-丁 香烯\n\n\n\n\n\n            methyleugenol\n\n\n\n            甲基丁香油酚\n\n\n\n\n\n\n\n\nDosage:\n用 \n        量﹕\n\nOral: 9 -15 g for decoction.\n        External application: appropriate amount. Smash and apply.\n內服，煎湯：9~15 克。  \n外用：適量，搗敷。\n\n\n\n\nSamples \n        of formulae:\n處方舉 \n        例﹕\n\n \n\n\n\n\nModern Research:\n\n現代研究﹕\n\n \n\n\n\n\nToxicity & Cautions:\n\n毒素與禁忌﹕\n\n\n\n\n\n \nSource:\n    \nAnthology \n    of Chinese Herb of Whole Nation; Zhong Hua Ben Cao\n資料來源：全國中草藥匯編；中華本草\n \n \n\n\n\n\nProblems with website? Please \n\nClick here \n    for comment. (Not for inquiry )      \n    \n\n\nClick \n    here for inquiry \n \n \n Ads \n    by Google:\n\n\n \n \n\n\n\n\n\n\n\n\n\n\nA manuscript... writing, translating and proofreading  in \n        progress\n \n \n\nCopyright Notice \n        按此看關於 版權問題\n\n\n\n\n\n\n\n            List of Health Problems\n\n\n\n\n\n\n            Chinese Herb Dictionary\n\n\n\n\n\n\nToxicity of Some Herbs\n\n\n\nSide Effect of Some Herbs\n\n\n\nHerbs that can be toxic to kidneys\n\n\n\n\n\n\n            Traditional Chinese Medicine\n \n\n\nTCM Diagnosis\n \n\nSamples \n            of Formulae\n\n\n\n\n\n\n            Terms of Traditional Chinese Medicine\n\n\n\n            Acupuncture\n\n\n\n\n\n\n\ncopy right\n \n\n\n版權所有\n\n\n\n\n\nQigong \n            (chi kung)\n\n\n\n\n\n\n            Prescribed Drug Dictionary\n\n\n\n\n\n\n            Email our web master for  your suggestion (not for inquiry)\n\n\n\n\n\nBiochemistry Dictionary\n\n\n\n\n\n\n\nGeneral Online Library\n\n\n\n\n\nQigong classes\n\n\n\n\n\nFake \n            Email Warning\n\n\n\n\n\nResearch Librarian\n\n\n\n\n\nSearch\n\n\n\n\n\n\n\nQigong classes\n\n\n\n\n\n\n\n\n\n\n\n\n\n\nDisclaimer\n\n\n\n\n\nHome\n\n\n\n\n\n\n            Weather Report\n\n\n\n\n\n\n\n\n\n\nLast update: Jan 1, \n            2013,  10 a.m. LAH　\n\n\n\n\n\n\n\n\n\n\n\n\n\n\n\n\n\n",
        "original_url": "http://alternativehealing.org/ji_ning.htm"
    },
    {
        "Names": {
            "Name": [
                "shi liu pi",
                "pomegranate peel"
            ],
            "Pharmaceutical": [
                "Pericarpium Granati"
            ],
            "Biological": [
                "Punica granatum L."
            ],
            "Chemical": [],
            "Common": [
                "pomegranate peel",
                "pomegranate husk"
            ],
            "Other name": [
                "xie liu pi 榭榴皮",
                "an shi lu pi 安石榴皮",
                "shi lu ke 石榴殼",
                "xi lu pi 西榴皮",
                "suan lu pi 酸榴皮"
            ],
            "Chinese": [
                "石榴皮"
            ],
            "Pronunciation in Korean": [
                "songnyupi"
            ],
            "Pronunciation in Japanese": [
                "sekiryuhi"
            ],
            "Pronunciation in Cantonese": [
                "sek6 lau4 pei4"
            ],
            "Pinyin Pronunciation": []
        },
        "Type": "Herb",
        "Geography": [
            "throughout China"
        ],
        "Properties": [
            "sour",
            "tart",
            "warm",
            "slightly toxic"
        ],
        "Meridians": [
            "large intestine"
        ],
        "Maladies Treated": [
            "chronic diarrhea",
            "chronic dysentery, with bleeding",
            "bleeding: Use charred Pericarpium Granati (pomegranate peel) to arrest bleeding",
            "parasite and abdomen pain: Being used as anthelmintics",
            "external application for neurodermatitis",
            "yeast infection of the mouth (oral Candida infection)",
            "the root of shi liu tree (Punica granatum L.) is being used more frequently for getting rid of parasites"
        ],
        "Medical Function": [
            "the alkaloid of Pericarpium Granati can kill tape worms",
            "Pericarpium Granati can lower the rate of pregnancy of animals",
            "the water extract of Pericarpium Granati and root can promote blood coagulation",
            "Pericarpium Granati possesses antibiotic effect: Salmonella typhi, Shigella, Mycobacterium tuberculosis, Pseudomonas aeruginosa, and various skin fungi",
            "Pericarpium Granati can inhibit the virus of influenza",
            "Pericarpium Granati can inhibit candida albicans"
        ],
        "Dosage": "3~9 g",
        "Samples of Formulae": "For treatment of neurodermatitis: charred Pericarpium Granati 1 part, sesame oil 2 parts. Mix into paste and apply with a brush to affected area, twice a day. [1]\n\nFor treatment of thrush (oral infection of Candida): Pericarpium Granati (pomegranate peel) 10 g, beng da wan 15 g. Add 800 c.c. of water and simmer for 45 minutes. Rinse mouth with decoction.\n\nFor scalding and burns: Pericarpium Granati grind into powder, add bing pian (borneol) and sesame oil. Mix into paste and apply with a brush. [2]",
        "Contraindications": "Occasionally with normal dosage of Pericarpium Granati (pomegranate peel) it can cause nausea, vomiting, diarrhea, headache, dizziness, tinnitus, spasm in the lower legs. Long term usage can cause necrosis of the center of lobule of liver, fatty liver, cirrhosis.\n\nIn clinical application, if the above symptoms appear, stop using the herb. If the symptoms are serious, apply symptomatic treatment.\n\nThis herb is not suitable for long term usage.\n\nOver dosage of Pericarpium Granati (pomegranate peel) can also cause dilated pupils (mydriasis), serious headache, exhaustion, convulsions, respiratory paralysis and death.\n\nContraindication: this herb should not be used in diarrhea, abdomen pain, dysentery with blood, constipation caused by acute infection.\n\nBecause normal dosage of Pericarpium Granati (pomegranate peel) can also cause toxic reaction, the herb should not be the first choice in treatment selection.",
        "Research": "Toxicity of the fruit hydroalcoholic extract only occurred at a higher traditional dosage in folk medicine. [4]\n\nThe fruit extract or compounds derived from it may inhibit cartilage degradation in osteoarthritis and may also be a useful nutritive supplement for maintaining joint integrity and function. [5]",
        "Notes": "",
        "Chemical Ingredients": {
            "chemicals": [
                "pelltierine",
                "isoquercetrin",
                "inulin",
                "mannitol",
                "tanin",
                "mallic acid",
                "calcium oxalate"
            ]
        },
        "References": [
            "[1] Edittion of Whole China New Therapy of Chinese herb Exhibition Material Selection 《全國中草藥新醫療法展覽會技術資料選編》",
            "[2] Shaanxi, Gansu, Ningxie, Qinghai Selected Chinese Herb《陝甘寧青中草藥選》",
            "[3] Indian J Dent Res. 2010 Jul-Sep;21(3):334-6.",
            "[4] J Ethnopharmacol. 2003 Dec;89(2-3):295-300.",
            "[5] J Nutr. 2005 Sep;135(9):2096-102."
        ],
        "Further Reading": [],
        "Original Text": "\n\n\nshi liu, pomegranate,Complementary and Alternative Healing University\n\n\n\n\n\n\n\n\n\n\n\n\nComplementary and Alternative Healing University \n        \nHome \n\n\n現代中藥辭典\n\n\n\n\n\n\n\n\n\n\n\n\n\n\n\nSearch this site\n\n\n\n\n\n\n\n            List of Health Problems\n\n\n\n\n\n\n\n            Chinese Herb Dictionary\n\n\n\n\n\n\nQigong\n\n\n\n\n\n\n\n            Traditional Chinese Medicine (TCM)\n\n\n\n\n\n\n\n            Acupuncture\n\n\n\n\n\n\n\n            Prescribed Drug Dictionary\n\n\n\n\n\n\n\n            Biochemistry Dictionary\n\n\n\n\n\n\nLecture Slides\n\n\n\n\n\n\nResearch Librarian\n\n\n\n\n\n\nGeneral \n            Online Library\n\n\n\n\n\n\nSearch this site\n\n\n\n\n\n\nResearch \n            Sites\n\n\n\n\n\n\n\n            Viagra\n\n\n\n\n\n\n\n            Massage/Acupressure\n\n\n\n\n\n\nHypnotherapy\n\n\n\n\n\n\nTell us what you want\n\n\n\n\n\n\nNotify Changes \n            & New Information\n\n\n\n\n\n　\n\n　\n\n　\n \n \n \n \n\n　\n \n \n \n \n \n \n\n　\n\n　\n \n \n \n \n\n　\n\n　\n\n　\n\n　\n\n　\n \n \n \n \n \n \n \n \n \n \n \n \n \n \n \n \n \n \n \n \n \n \n \n \n \n \n \n \n \n \n \n \n \n \n \n \n \n \n \n \n \n \n \n \n \n \n \n \n \n \n \n \n \n \n \n \n \n \n \n \n \n \n \n \n \n \n \n \n \n \n \n \n \n \n \n \n \n \n \n \n \n \n \n \n \n \n \n \n \n \n\n\n\n\n\n\n\n\n\n\n\n\n\n \n\nPomegranate \n        Peel, shi liu pi 石榴皮 \n  (in \n        English and Chinese 中英文)\nTranslated \n        and edited \n\n        by: Joe Hing kwok Chu\n\n\n\n\nPharmaceutical \n            name:\n英文藥名﹕\n\n\n\nPericarpium \n            Granati \n\n\n\nBotanical name:\n學名﹕\n\n\nPunica granatum L.\n\n\n\nPron. in Japanese:\n日語發音﹕\n\nsekiryuhi\n\n\n\nPron. in Korean:\n韓語發音﹕\n\nsongnyupi\n\n\n\n\n\n            Pron. in Cantonese: \n粵音﹕\n\nsek6 lau4 pei4\n\n\n\nOther \n            Names:\n別名﹕\n\n\nxie liu pi 榭榴皮，an \n            shi lu pi 安石榴皮，shi lu ke 石榴殼，xi lu pi 西榴皮，suan lu pi 酸榴皮。\n\n\n\nCommon Name:\n英文名﹕\n\npomegranate peel, pomegranate \n            husk.\n\n\n\nDistribution:\n產地﹕\n\nthroughout China.全中國各地。\n\n\n\n\nProperties\n(characteristics)﹕\n性味﹕\n\nsour, tart, warm, slightly \n            toxic. \n酸，澀，溫，有小毒。\n\n\n\n\nChannels (meridians) \n            entered:\n \n歸經﹕\n\nlarge intestine.\n大腸經。\n\n\n\nMedical functions:\n藥理﹕\n \n\nthe alkaloid of Pericarpium \n            Granati  can kill tape worms.Pericarpium \n            Granati  can lower the rate of pregnancy of animals.\nThe water extract of Pericarpium Granati  \n            and root can promote blood coagulation.\nPericarpium Granati  possesses antibiotic \n            effect :Salmonella typhi, Shigella, Mycobacterium tuberculosis, Pseudomonas \n            aeruginosa, and various skin fungi\nPericarpium Granati  can  inhibit the \n            virus of influenza.\nPericarpium Granati  can inhibit candida \n            albicans [3]\n石榴皮鹼對絛虫有殺滅作用。\n石榴的果皮粉可減少動物受孕率。\n根皮水浸泡液可促進血液凝固。\n石榴皮有抗菌作用：傷\n            寒杆菌，痢疾杆菌，結核杆菌，綠膿杆菌及各種皮膚真菌均有抑制作用\n石榴皮有抗流感病毒作用。\n石榴皮有抑制白色念珠球菌作用。【3】\n\n\n\n\n\nActions & Indications:\n\n主治﹕\n\n\n\nbeing used in chronic diarrhea, chronic dysentery, with bleeding. \n              Use charred Pericarpium Granati  to arrest bleeding.\nparasite and abdomen pain. Being used as anthelmintics.\nexternal application for neurodermatitis, yeast infection of the \n              mouth.\nthe root of shi liu tree (Punica \n              granatum L.) is being used more frequently in getting rid \n              of parrasites.\n\n \n\n 治久瀉久痢，腸滑不禁，而有\n              崩漏出血。治出血用石\n              榴皮炭。\n 用於虫積腹痛，常用為驅蟲藥。\n 外用可治牛皮癬，口部念\n              珠球菌感染等。\n石榴根較為常用於驅蟲。\n\n\n\n\n\n\nChemical ingredients:\n\n化學成份﹕\n\npelltierine, isoquercetrin, inulin, mannitol, \n            tanin, mallic aid, calcium oxalate\n\n\n\nDosage:\n用\n            量﹕\n\n3~9 g\n\n\n\nSamples \n            of formulae:\n處方舉\n            例﹕\n\nFor treatment of neurodermatitis: charred \n            Pericarpium Granati  1 part, sesame oil 2 parts. Mix into paste \n            and apply with a brush to affected area., twice a day. [1]For treatment \n            of trush (oral infection of Candida): Pericarpium Granati  (promegranate \n            peel) 10 g, beng da wan 15 g. Add 800 c.c. of water and simmer for 45 \n            minute. Rinse mouth with decoction.\nPomegranate has proven fungicidal and wound-healing properties.\nTopically applied extracts of pomegranate peel:\nFor scalding and burns: Pericarpium Granati  grind into powder, \n            add bing pian and sesame oil. Mix into paste and apply with a brush.[2]\n治牛皮癬：石榴皮（炒炭），研細末1份，麻油2份，調成糊狀。用時將藥油搖勻，以毛筆蘸藥勻塗患處，每日2次。[1]\n治口部念珠球菌感染：石榴皮10 克，崩大腕 15 克，加水800 毫升。慢火煎45分鐘。用煎汁嗽口。\n治湯火傷：石榴皮研末，加冰片，麻油調勻外敷。 [2]\n\n\n\n\n\nModern Research:\n\n現代研究﹕\n\nToxicity of the fruit hydroalcoholic extract \n            only occurred at a higher traditional dosage in folk medicine. [4]\n            The fruit extract  or compounds derived from it may inhibit cartilage \n            degradation in osteoarthritis and may also be a useful nutritive supplement \n            for maintaining joint integrity and function.[5]\n石榴的酒精與水的提取物的有毒的劑量是比傳統的劑量大。[4]\n石榴的提取物或其化合物能抑制關節炎之軟骨退化，也可能是一種有用的營養補充食品作為維持關節的完整與功能。【5】\n\n\n\n\n\nToxicity & Cautions:\n\n毒素與禁忌﹕\n\nOccasionally with normal \n            dosage of  Pericarpium Granati  (promegranate \n            peel) it can cause nausea, vomiting, diarrhea, \n            headache, dizziness, tinnitus, spasm in the lower legs. Long term usage \n            can cause necrosis of the center of lobule of liver, fatty liver, cirrhosis.\nIn clinical application,  if the above symptoms \n            appear, stop using the herb. If the symptoms are serious, apply symptomatic \n            treatment.\nThis herb is not suitable for long term usage.\nOver dosage of Pericarpium Granati  \n            (promegranate peel) can also cause dilated pupils \n            mydriasis), serious headache, exhaustion, and respiratory paralysis \n            and death.\nContraindication: this herb should not be used \n            in diarrhea, abdomen pain, dysentery with blood, constipation caused \n            by acute  infection.\nBecause of normal dosage of Pericarpium \n            Granati  (promegranate peel) can also cause \n            toxic reaction, the herb should not be the first choice in treatment \n            selection.\n石榴皮常規用量服用偶\n            可出現惡心，嘔吐，腹瀉，頭痛，眩暈，耳鳴，小腿痙攣。\n            長期服用會造成肝小葉中心壞死，脂肪肝，肝硬化。臨床使用注意服用後的反應。如有上述症狀應停藥，重者須對症治療。本品不宜久服。\n用量過大 除上述症狀外還會出現瞳孔散大，劇烈頭痛，衰竭\n            ，驚厥，呼吸麻痺而死亡。\n藥不對証: \n            本品不宜用於邪熱盛，感染明顯的大便泄瀉，腹痛，痢疾膿血便以及大便秘結者。\n因常規用量使用也會出現中毒反應，故臨床上盡量不首選該藥\n            。\n \n\n\n\n[1] Edittion of Whole China New Therapy \n        of Chinese herb Exhibition Material Selection 《全國中草藥新醫療法展覽會技術資料選編》\n[2] Shaanxi, Gansu, Ningxie, Qinghai Selected \n        Chinese Herb《陝甘寧青中草藥選》\n[3]\n        \n        Indian J Dent Res. 2010 Jul-Sep;21(3):334-6.\n[4]\n        \n        J Ethnopharmacol. 2003 Dec;89(2-3):295-300.\n[5]\n        \n        J Nutr. 2005 Sep;135(9):2096-102.\n \n  Sponsors' Ads by Google 以下為谷歌所提供贊助者之廣告\n\n\n\n\n\n\n\n\nA manuscript... writing, translating and proofreading  \n            in progress\n \n\n\n\nClick here for inquiry \n            \n\n\nCopyright \n            Notice 按此看關於版權問題\n\n\n\n\n\n\n                List of Health Problems\n\n\n\n\n\n                Chinese Herb Dictionary\n\n\n\n\n\nToxicity \n                of Some Herbs \n                \n\n\nSide Effect of Some Herbs \n                \n\n\n\n                Herbs that can be toxic to kidneys\n\n\n\n\n\n                Traditional Chinese Medicine\n\n\nTCM Diagnosis\n\n\n\n                Samples of Formulae\n\n\n\n\n\n                Acupuncture\n\n\n\n\n\n\ncopy \n                right\n \n\n\n版權所\n                有\n\n\n\n\n\nQigong \n                (chi kung)\n\n\n\n\n\n                Prescribed Drug Dictionary\n\n\n\n\n\n                Email our web master for  your suggestion (not for inquiry)\n\n\n\n\nBiochemistry Dictionary\n\n\n\n\n\n\nGeneral Online Library\n\n\n\n\nQigong \n                classes\n\n\n\n\nLecture Slides\n\n\n\n\nResearch Librarian\n\n\n\n\nSearch\n\n\n\n\n\n\nQigong classes \n\n\n\n\n\n\n\n\n\nHome\n\n\n\n\n\n                Weather Report\n\n\n Disclaimer\n\n\n\n\n\n\n\nLast update: \nAug 27, 2013, 11:58 p.m. \nLAH\n\n\n\n\n\n\n\n\n\n\nSearch this site \n\n\n\n\n\n\n\n\n\n\n\n\n\n\n\n\n\n\n\n\n\n\n\n\n\n",
        "original_url": "http://alternativehealing.org/shi_liu_pi.htm"
    },
    {
        "Names": {
            "Name": [
                "du zhong"
            ],
            "Pharmaceutical": [
                "Cortex Eucommiae Ulmoidis"
            ],
            "Biological": [
                "Eucommia ulmoide Oliv."
            ],
            "Chemical": [],
            "Common": [
                "eucommia bark"
            ],
            "Other name": [
                "si lian pi 絲連皮",
                "che si pi 扯絲皮",
                "si mian pi 絲棉皮",
                "yu xi pi 玉絲皮",
                "si zhong 思仲"
            ],
            "Chinese": [
                "杜仲"
            ],
            "Pronunciation in Korean": [
                "tuch'unmg"
            ],
            "Pronunciation in Japanese": [
                "tochu"
            ],
            "Pronunciation in Cantonese": [
                "dou6 zung6"
            ],
            "Pinyin Pronunciation": []
        },
        "Type": "Herb",
        "Geography": [
            "western part of Henan",
            "southern part of Shaanxi",
            "eastern part of Gansu",
            "Sichuan",
            "Guizhou",
            "Hubei",
            "Hunan (scattered distribution)"
        ],
        "Properties": [
            "Sweet",
            "Slightly acrid",
            "Warm"
        ],
        "Meridians": [
            "Liver",
            "Kidney"
        ],
        "Maladies Treated": [
            "Chronic pain in lower back and knees due to liver and kidney deficiency",
            "Lack of strength due to liver and kidney deficiency",
            "Dizziness due to liver and kidney deficiency",
            "Impotence due to liver and kidney deficiency",
            "Irregular menses due to liver and kidney deficiency",
            "Frequent urination due to liver and kidney deficiency",
            "Weakness during pregnancy manifested as chronic pain in lower back",
            "Unstable pregnancy with excessive fetal movements",
            "Hypertension",
            "Rheumatoid arthritis",
            "Sciatica"
        ],
        "Medical Function": [
            "Tonic for the liver and kidney",
            "Strengthening muscles and bones",
            "Stabilizing pregnancy",
            "Effect on circulatory system",
            "Effect on immune system",
            "Anti-inflammatory effect",
            "Sedative and anesthesia effect",
            "Effect on stress",
            "Effect on uterus",
            "Diuretic effect",
            "Anti-aging effect",
            "Lowering blood pressure effect",
            "Antibiotic effect: it can inhibit Shigella flexneri, Escherichia coli, Pseudomonas aeruginosa, Staphylococcus aureus, Streptococcus pneumoniae, Bacillus anthracis"
        ],
        "Dosage": "12 to 15 g in decoction.\n12 ~ 15 克，煎服。",
        "Samples of Formulae": "du huo ji sheng tang (獨活寄生湯)\ntian ma gou teng yin (天麻鉤藤飲)\nyou gui wan (右歸丸)\ngu shen an tai yin (固腎安胎飲)",
        "Contraindications": "Not suitable for patients with yinxu (yin deficient) with heat.\nAccording to Ben Cao Jing Shu, this herb is not suitable for those who are kidney deficient with high heat. If to use it, it should be used with huang bai (phellodendron) and zhi mu (anemarrhena).",
        "Research": "",
        "Notes": "Parabarium spp. and Euonymus spp. are also used as substitutes for this herb.",
        "Chemical Ingredients": {
            "": [
                "(+)-pinoresinol O-Beta-D-glucopyranoside",
                "[+]-pinoresinol di-O-Beta-D-glucopyranoside",
                "pinoresinol di-beta-D-glucoside",
                "(+)-1-hydroxypinoresinol 4',4\"-di-O-Beta-D-glucopyranoside",
                "(+)-1-hydroxypinoresinol 4'-O-Beta-D-glucopyranoside",
                "(+)-1-hydroxypinoresinol 4\"-O-Beta-D-glucopyranoside",
                "(+)-epipinoresinol",
                "liriodendrin",
                "(+)-syringaresinol-di-O-Beta-D-glucopyranoside",
                "(+)-syringa resinol O-Beta-D-glucopyranoside",
                "syringylglycerol-Beta-syringaresinol ether 4\",4\"'-di-O-Beta-D-glucopyranoside",
                "(+)-syringaresinol monoglucoside",
                "syringin",
                "(-)-olivil 4',4\"-di-O-Beta-D-glucopyranoside",
                "(-)-olivil",
                "(+)-cyclo-olivil",
                "(-)-olivil 4'-O-Beta-D-glucopyranoside",
                "(-)-olivil 4\"-O-Beta-D-glucopyranoside",
                "Medioresinol (+)-Medioresinol di-O-Beta-D-glucopyranoside",
                "Eucommin A[(+)-medioresinol 4'-O-Beta-D-glucopyranoside",
                "(+)-Medioresinol monoglucoside",
                "Hedyotol C 4\",4\"'-di-O-Beta-D-glucopyranoside (guaiacylglycerrol-Beta-medioresinol ether 4\",4\"' di-O-Beta-D-glucopyranoside)",
                "cpmoferom",
                "dehydrodiconife4ryl alcohol-4, gamma'-di-O0betta-D-glucopyranoside",
                "erytho-dihydroxydehydrodiconiferyl alcohol",
                "threo-dihydroydehydrodiconiferyl alcohol",
                "eucommiol",
                "eucommioside",
                "eucommioside-I"
            ]
        },
        "References": [],
        "Further Reading": [],
        "Original Text": "du zhong, Cortex Eucommiae Ulmoidis, Complementary and Alternative Healing UniversityComplementary and Alternative Healing University   中藥詞典    Chinese Herb Dictionary      Search this site     在本網站找資料 See more menu at the bottom of pagedu zhong 杜仲  (in English and Chinese 中英文)by: Joe Hing Kwok ChuClick here to see picture.Pharmaceutical name:英文藥 名 ﹕Cortex Eucommiae UlmoidisBiological name:學名﹕Eucommia ulmoide Oliv.Parabarium spp. and Euonymus spp. are also used as substitutes for this  herbPron. in Japanese:日 語  發 音 ﹕tochuPron. in Korean:韓 語 發 音 ﹕tuch'unmgPron. in Cantonese:粤語發音：dou6  zung6Common Name:英 文普通名﹕eucommia barkOther Name:別 名 ﹕si lian pi 絲連皮，che si pi 扯絲皮，si mian pi 絲棉皮，yu xi pi 玉絲皮，si zhong 思仲Distribution:分 佈 ﹕western part of Henan, southern part of Shaanxi, eastern part of Gansu, Sichuan, Guizhou, Hubei, and some scattered part of Hunan.河南西部，陜西南部，甘肅東部，四川，貴州，湖北，湖南亦都有零星分 佈。Properties (characteristics)性 味﹕sweet, slightly acrid, and warm甘，略辛，溫 。Channels (meridians) entered:歸經﹕liver and kidney channels入肝，腎經。Actions & Indications:功用﹕    Tonic for liver and kidney; strengthening  muscles and bones; and stabilizing pregnancyuse in liver and kidney deficiency: chronic pain in lower back and knees, lack of strength, dizziness, impotence, irregular menses and frequent urination.use in weakness during pregnancy, unstable pregnancy, chronic pain in lower back and excessive movements of fetus.use in hypertension補 肝 腎，強筋骨，安胎。用於肝腎不足，腰膝疼痛，乏力，眩暈，陽痿，月經不調 ﹐小便頻數等症。用於孕婦體虛，胎元不固，腰痠，胎動。用於血壓高:  Medical Function:藥 理 ﹕ effect on circulatory system effect on immune system anti inflammatory effect sedative and anesthesia effect effect on stress effect on uterus diuretic  effect anti-aging effect lowering blood pressure effect. antibiotic effect:.it can inhibit Shigella flexneri, Escherichia coli, Pseudomonas aeruginosa, Staphylococcus aureus, Streptococcus pneumoniae, Bacillus anthracis對血液循環作用對免疫作用抗炎作用鎮靜止痛作用抗心理壓力作用排水作用抗老作用抗菌作用：杜仲水煎劑對結核桿菌，福氏痢疾桿菌，大腸桿菌， 綠膿桿菌，金黃色葡萄球菌，肺炎球菌，炭疽桿菌等有明顯抑制作用降血壓作用Chemical ingredients:化 學 成 份 ﹕1. (1)[(+) -pinoresinol O-Beta-D-glucopyranoside], [+ - pinoresinol di-O-Beta-D-glucopyranoside] [1], (pinoresinol di-beta-D-glucoside) [2], [+) -1-hydroxypinoresinol 4', 4\" - di-O-Beta-D-glucopyranoside][3,8],[(+)-1-hydroxypinoresinol 4'-O-Beta-D-glucopyranoside][4], [(+)-1-hydroxypinoresinol 4\"-O-Beta-D-glucopyranoside][4,8],[(+)-epipinoresinol][9].(2)  [liriodendrin, (+) -syringaresinol-di-O-Beta-D-glucopyranoside][1], [(+)-syringa resinol  O-Beta-D-glucopyranoside][3], (syringylglycerol-Beta-syringaresinol ether 4\", 4'\"-di-O-Beta-Dglucopyranoside0[6,8], [(+)-syringaresinol monoglucoside][9], (syringin)[7].(3) [- -olivil 4', 4\"-di-O-Beta-D-glucopyranoside][3], [(-) -olivil], [(+)-cyclo-olivil][4], [(-) -olivil 4'-O-Beta-D-glucopyranoside], [(-) -olivil 4\"-O-Beta-D-glucopyranoside][5], [(-) -olivil 4', 4\"-di-O-Beta-D-glucopyranoside][8].(4)Medioresinol (+) -Medioresinol di-O-Beta-D-glucopyranoside [1,8], Eucommin A[(+) -medioresinol 4'-O-Beta-D-glucopyranoside][3.8], (+) -Medioresinol monoglucoside [9], Hedyotol C 4\", 4'\"-di-O-Beta-D-glucopyranoside (guaiacylglycerrol-Beta-medioresinol ether 4\", 4'\" di-O-Beta-D-glucopyranoside)[5, 8].(5) (cpmoferom)[7], (dehydrodiconife4ryl alcohol-4, gamma'-di-O0betta-D-glucopyranoside[6,8]erytho-dihydroxydehydrodiconiferyl alcohol, threo-dihydroydehydrodiconiferyl alcohol.2. eucommiol [10,11], eucommioside [11], eucommioside-I [8,12] Dosage:用量﹕12  to 15 g in decoction.12 ~ 15 克， 煎服。  Samples of formulae:處 方 舉 例 ﹕du huo ji sheng tang 獨活寄生湯tian ma gou teng yin 天麻鉤藤飲you gui wan  右歸丸　gu shen an tai yin 固腎安胎飲Modern Usage:  現 代 應 用 ﹕ for rheumatoid arthritis for sciatica for hypertension風 濕 性 關 節 炎坐 骨 神 經 痛血 壓 高 Cautions: 禁忌﹕Not suitable for  patients with yinxu (yin deficient) with heat.According to Ben Cao Jing Shu, this herb is not suitable for those who are kidney deficient with high heat. If to use it, it should be used with huang bai and zhi mu. 陰 虛火旺者不宜。《 本草經疏 》︰\" 腎虛火 熾者不宜用。即用當與黃 柏 ，知 母同入。\"[n] see Research LibrarianSearch this siteProblems with website? Please Click here for comment. (Not for inquiry )    Click here for inquiryCopyright Notice 按此看關於版權問題Sponsors' Ads by Google 以下為谷歌 所提供之廣告A manuscript... writing, translating and proofreading  in progressMenu: List of Health ProblemsQigong (chi kung)Toxicity of Some HerbsSide Effect of Some HerbsHerbs that can be toxic to kidneysTraditional Chinese Medicine TCM Diagnosis Samples of FormulaeTerms of Traditional Chinese MedicineAcupunctureChinese Herb DictionaryQigong classesPrescribed Drug DictionaryEmail our web master for  your suggestion (not for inquiry)Biochemistry Dictionary Qigong classes Research Librarian copy right 版權所有HomeWeather ReportDisclaimerLast update: June 8, 2016; 5 p.m. LAH   ",
        "original_url": "http://alternativehealing.org/du_zhong.htm"
    },
    {
        "Names": {
            "Name": [
                "yu jin",
                "Curcuma aromatica"
            ],
            "Pharmaceutical": [
                "Rhizoma Curcumae domesticae",
                "Tuber Curcumae domesticae"
            ],
            "Biological": [
                "Curcuma aromatica Salisb. (yu jin 鬱金)",
                "Curcuma wenyujin Y. H. Chen et C. Ling (温鬱金)"
            ],
            "Chinese": [
                "鬱金",
                "温鬱金"
            ],
            "Common": [
                "curcuma (yu jin)",
                "wild turmeric"
            ],
            "Other name": [],
            "Pronunciation in Korean": [
                "ukkum (鬱金)"
            ],
            "Pronunciation in Japanese": [
                "kyoo (鬱金)",
                "ukon (yu jin 鬱金)"
            ],
            "Pronunciation in Cantonese": [
                "wat1 gam1(鬱金)"
            ],
            "Pinyin Pronunciation": []
        },
        "Type": "Herb",
        "Geography": [
            "Sichuan province of China",
            "Guangdong province of China",
            "Guangxi province of China",
            "Yunnan province of China",
            "Fukien (Fujian) province of China",
            "Guizhou province of China",
            "Taiwan province of China"
        ],
        "Properties": [
            "acrid",
            "bitter",
            "cool"
        ],
        "Meridians": [
            "heart",
            "liver",
            "gall bladder"
        ],
        "Maladies Treated": [
            "high lipids",
            "angina pectoris",
            "rheumatoid arthritis",
            "inflammation after surgery",
            "periodontitis",
            "tumor",
            "acid dyspepsia",
            "flatulent dyspepsia",
            "atonic dyspepsia",
            "shingles/herpes zoster",
            "herpes simplex",
            "hepatitis caused by viral infection",
            "cerebral embolism",
            "coronary atherosclerosis",
            "for inhibiting building up of b-amyloid",
            "wind chill induced shoulder pain",
            "mood fluctuations",
            "schizophrenia",
            "fever with dizziness",
            "vomiting blood",
            "nose bleeding",
            "blood in urine",
            "bleeding not during menses",
            "jaundice",
            "lower back pain",
            "chest and abdomen pain caused by blood stasis",
            "flatulence",
            "pain during period of menses",
            "injuries",
            "bruises and swelling",
            "gallbladder stones",
            "pain in the rib area"
        ],
        "Medical Function": [
            "lowers blood lipids",
            "anti coagulation of platelets",
            "protects cardiac muscle from lack of oxygen",
            "protects liver from toxin",
            "against hepatitis virus replica",
            "promotes secretion of bile",
            "promotes flow of menses and relieves pain",
            "anti tumor [enhances fibrinolysis (the process that breaks down fibrin (fibrous proteins), such as those that protect tumors from the immune system)]",
            "anti inflammatory",
            "anti-oxidation",
            "promotes metabolism of alcohol",
            "antibiotic",
            "antivirus",
            "helps intestinal peristalsis (intestinal movements that help evacuation)"
        ],
        "Dosage": "3 ~ 9 g per day. 3 ~ 9 克。",
        "Samples of Formulae": "ping xiao san (平消散), bu jin wan (補金丸)",
        "Contraindications": "Not to use in case of yin deficient with losing blood and those without qi stagnation and blood stasis. Contraindicated in yin deficiency with bleeding and absence of qi stagnation or blood stasis. Use with caution during pregnancy.",
        "Research": "",
        "Notes": "See the differentiation of jiang huang (turmeric), yu jin (Curcuma aromatica), and e zhu (Curcuma zedoaria). Also see shu gu jiang huang (a type of turmeric rhizome).\n看姜黄，鬱金，莪术 ，束骨薑黃之分別。",
        "Chemical Ingredients": [
            "curcumin 0.3--0.5%",
            "demethoxycurcumin 0.01--0.02%",
            "bisdemethoxycurcumin 0.005--0.015%",
            "starch (30-40%)",
            "borneol",
            "zingberene (C15H24)",
            "Arabic gum",
            "glucose",
            "fructose",
            "curcumol",
            "fat (脂肪油)",
            "phellandrene",
            "eucalyptol"
        ],
        "References": [],
        "Further Reading": [],
        "Original Text": "\n\n\n\nyu jin, Curcuma aromatica, Complementary and Alternative Healing University\n\n\n\n\n\n\n\n\n\n\nComplementary and Alternative \n        Healing University \n        \n\nHome  中 \n        藥詞典\n\n\n\n\n\n\n\n\n\n\n\n\n\n\n\n\n\n\n\n\n\n\n\n\n\n                  Search this site powered by\n                  \n                  FreeFind\n\n\n\n\n\n\n\n\n\n\n\n\n\nSearch this site\n\n\n\n\n\n\nList \n        of Health Problems\n\n\n\n\n\n\nChinese \n        Herb Dictionary\n\n\n\n\n\n\nQigong\n\n\n\n\n\n\n\n        Traditional Chinese Medicine (TCM)\n\n\n\n\n\n\n\n        Acupuncture\n\n\n\n\n\n\n\n        Prescribed Drug Dictionary\n\n\n\n\n\nBiochemistry \n        Dictionary\n\n\n\n\n\n\nLecture Slides\n\n\n\n\n\nResearch Librarian\n\n\n\n\n\n\nGeneral \n        Online Library\n\n\n\n\n\n\nSearch this site\n\n\n\n\n\n\nResearch Sites\n\n\n\n\n\n\n\n        Viagra\n\n\n\n\n\n\nMassage/Acupressure\n\n\n\n\n\n\nHypnotherapy\n\n\n\n\n\n\nTell us what you want\n\n\n\n\n\n\nNotify Changes \n        & New Information\n\n\n\n\n \n\n\n\n\n\n\n\n\n\n\n\n\n\nyu jin 鬱金\n\n\n            by: Joe Hing kwok Chu\n\n\nToday's \n                Application:現代應用﹕\n\n\n\nToday's Application:\n\nfor:\n\n\n\nhigh lipids\n\n\n\nangina pectoris\n\n\n\nrheumatoid arthritis\n\n\n\ninflammation after surgery\n\n\n\nperiodontitis\n\n\n\ntumor\n\n\n\nacid dyspepsia,\n\n\n\nflatulent dyspepsia,\n\n\n\natonic dyspepsia\n\n\n\nshingles/herpes zoster\n\n\n\nherpes simplex\n\n\n\nhepatitis \n                  caused by viral infection\n\n\n\ncerebral embolism\n\n\n\ncoronary\n                  atherosclerosis\n\n\n\n\n                  for inhibiting building up of \n\n\nb-amyloid\n\n\n現代應用﹕\n\n高血脂症，心绞痛狹心症 \n                ，風濕性關節炎，術後炎症，牙周炎， 腫瘤，胃酸過多，胃脹，胃施鬆，带狀疱疹，單純性一般疱疹,  病毒性肝炎, 腦栓塞, \n                冠狀動脈粥樣硬化，防止 \n\nb-類 \n                澱粉蛋白之 \n                形成。\n\n\n\n\n\nPharmaceutical name:\n\n                英文藥名﹕\n\n\n\n                Rhizoma Curcumae domesticae\n\n\n                Tuber Curcumae domesticae\n\n\n\n\n\n\nBiological name:\n\n拉丁學名﹕\n\n\n\n\n\n\nCurcuma aromatica Salisb. (yu jin 鬱金 \n                  )\n\n\n\nCurcuma wenyujin Y. H. Chen et C. Ling \n                  (温鬱金)\n\n\n\n\n\n\n\nPron. in Japanese:\n\n日語發音﹕\n\n\n\nkyoo (鬱 金)\n\nukon (yu jin 鬱 金)\n\n\n\n\n\nPron. in Korean:\n\n韓語發音﹕\n\n\n\nukkum (鬱 金)\n\n\n\n\n\nOther Names:\n\n別名﹕\n\n\n \n\n\n\n\n\nPron. in Cantonese:\n\n\n粵音﹕\n\n\n\n\n                wat1 gam1(鬱 金)\n\n\n\n\n\nCommon Name:\n\n                常用英文名﹕\n\n\n\n                curcuma (yu jin), wild turmeric.\n\n\n\nDistribution:\n產地分佈﹕\n\n\n\n                Sichuan, Guangdong, Guangxi, Yunnan, Fukien, Guizhou, \n                and Taiwan provinces of China.\n\n                四川， 廣東廣西， 雲南， 福建， 貴州， 台灣.\n\n\n\n\n\nProperties (characteristics):\n\n性 味﹕\n\n\n\nyu jin: acrid, bitter, cool.\n\n鬱金：辛，苦，性凉。\n\n\n\n\n\nChannels (meridians) entered:\n\n歸經﹕\n\n\n\nyu jin: \n                heart, liver, gall bladder\n\n鬱金：心，肝，膽。\n\n\n\nActions \n                & Indications:\n                主治﹕\n\n\n\nActions & Indications:\nImproves \n                circulation of blood and qi, promotes flow of menses and relieves \n                pain. For wind chill induced shoulder pain, mood fluctuations, schizophrenia, \n                fever with dizziness, vomiting blood, nose bleeding, blood in urine, \n                bleeding not during menses, jaundice, lower back pain, chest and \n                abdomen pain caused by\n                blood stasis, \n                flatulence, pain during period of menses, injuries, bruises and \n                swelling. gallbladder stones,  pain \n                in the rib area.\n\n                主治﹕行氣破瘀， 通經止痛。主治風寒肩臂， 腰背疼痛， 血滞胸腹脹痛， 失心癫狂， 熱病神昏， 吐血 ， 衄血， \n                尿血， 血淋， 婦女倒經， 黄疸，痛 經，跌打損傷， 瘀血腫，腫痛，膽結石，各種胸腹脅肋痛 \n\n\n。\n \n\n\n\nMedical \n                Function:藥理﹕\n\n\n\nMedical Function:\n\n\n\nlowers blood lipids\n\n\n\nanti coagulation of platelets\n\n\n\nprotects cardiac muscle from lack of oxygen\n\n\n\nprotects liver from toxin\n\n\n\nagainst\n                  \n                  hepatitis \n                  virus replica\n\n\n\npromotes secretion of bile\n\n\n\npromotes flow of menses and relieves pain\n\n\n\nanti tumor\n[enhances \n                  fibrinolysis (the process that breaks down fibrin (fibrous proteins), \n                  such as those that protect tumors from the immune system) \n                  ]\n\n\n\nanti inflammatory\n\n\n\n                  anti-oxidation\n\n\n\n                  promotes metabolism of alcohol\n\n\nantibiotic\n\n\n\nantivirus\n\n\n\nhelps intestinal peristalsis (intestinal \n                  movements that help evacuation)\n\n\n \n\n藥理﹕\n\n\n\n降血脂作用\n\n\n\n抑制血小板聚集和抗血拴形成\n\n\n\n保護心肌缺血性損傷\n\n\n\n保肝作用\n\n\n\n抑制 B 乙型肝炎病毒之複製\n\n\n\n\n利胆作用\n\n\n\n通經止痛\n\n\n\n抗腫瘤\n\n\n\n抗炎作用\n\n\n\n抗氧化作用\n\n\n\n促進酒精代謝\n\n\n\n抗病原微生物,\n\n\n\n抗病毒\n\n\n\n\n帮助腸蠕動以助排空\n\n\n\n\n\nChemical \n                ingredients:化學成份﹕\n\n\n\n\n\ncurcumin \n0.3--0.5% \n                    ,\n\n薑黄素\n\n0.3--0.5%\n\n\n\ndemethoxycurcumin\n                    \n0.01--0.02%\n\n\n                    去甲氧基薑黄素 \n0.01--0.02%\n\n\n\nbisdemethoxycurcumin\n                    0.005--0.015%\n\n\n                    去二甲氧基薑黄素0.005--0.015% \n \n\n\nstarch (30-40%)\n澱粉(30-40%)\n\n\n\n \n          borneol \n\n\n龍腦 \n\n\nzingberene\n薑烯\n\n\nArabic gum\n阿拉伯膠\n\n\nglucose\n葡萄糖\n\n\nfructose\n果糖\n\n\n\ncurcumol\n莪朮 醇\n\n\n\nfat\n\n\n\n脂肪油\n\n\n\n\n                    zingiberen \n                    (C15H24)\n\n薑烯 (C15H24)\n\n\n\nphellandrene\n\n水芹烯\n\n\n\neucalyptol \n\n\n按油精\n\n\n\n\n\n\nDosage\n                per day \n                :每日劑量﹕\n\n\n\n                3 ~ 9 g\n3 ~ 9 克。\n\n\n\n\n                margin-left:\nSamples of formulae:\n處方舉例：\n\n\n\n\nping \n                xiao san \n\n平消散\nbu jin wan 補金丸 　\n\n\n\nModern \n                Research:\n\n\n \n\n\n\n\nCautions:\n禁忌：\n\n\n\n\nNot to use in case of\n                yin deficient\n                with losing blood and those without\n                \n\nqi stagnation \n                and  \nblood stasis\n\n陰虛失 \n                血及無\n\n\n氣滯\n                血淤 \n者忌服，孕婦慎服。\n\n\n\n\n\nNote:\n\n註 ﹕\n\n\n\n\n\n\n                see the differentiation of jiang huang, yu jin and e zhu.,\n                \n\nshu gu jiang huang.\n\n\n\n                看姜黄，鬱金，莪术 ，束 \n                骨薑黃之 \n                分別。\n\n\n\n\n\n\n\n\n\n\n\n\n  Sponsors' Ads by Google 以下為谷歌所提供之 \n        廣告\n \n\n\n\n\n\n\n\n\nA manuscript... writing, translating and proofreading  \n            in progress\n\n\nCopyright Notice \n            按此看關於版權問題\n\n\n\n\n\n\n                List of Health Problems\n\n\n\n\n\n                Chinese Herb Dictionary\n\n\n\n\n\nToxicity of Some Herbs\n\n\n\nSide Effect of Some Herbs\n\n\n\nHerbs that can be toxic to kidneys\n\n\n\n\n\n                Traditional Chinese Medicine\n\n\nTCM Diagnosis\n\n\n\n                Samples of Formulae\n\n\n\n\n\n                Terms of Traditional Chinese Medicine\n\n\n\n                Acupuncture\n\n\n\n\n\n\ncopy \n                right\n \n\n\n版權所 \n                有\n\n\n\n\nQigong \n                (chi kung)\n\n\n\n\n\n                Prescribed Drug Dictionary\n\n\n\n\n\n                Email our web master for  your suggestion (not for inquiry)\n\n\n\n\nBiochemistry Dictionary\n\n\n\n\n\n\nGeneral Online Library\n\n\n\n\nQigong \n                classes\n\n\n\n\nFake \n                Email Warning\n\n\n\n\nResearch Librarian\n\n\n\n\nSearch\n\n\n\n\n\n\nQigong classes\n\n\n\n\n\n\n\n\n\nHome\n\n\n\n\n\n                Weather Report\n\n\n\n\n\nDisclaimer\n\n\n\n\n\n\n\n\nLast update:\n            Feb 1, 1012; 4:12 p.m. \n            LAH.\n\n\n\n\n\n\n\n\n\n\n\n\n\n\n\n                Search this site powered by\n                \n                FreeFind\n\n\n\n\n\n\n\n\n\n\n\n\n\n\n\n\n\n\n\n\n\n\n\n\n\n",
        "original_url": "http://alternativehealing.org/yu_jin.htm"
    },
    {
        "Names": {
            "Name": [
                "sang ye"
            ],
            "Pharmaceutical": [
                "Folium Mori Albae"
            ],
            "Biological": [
                "Morus alba L.",
                "Morus bombycis Koidz.",
                "Morus australis Poir.",
                "Morus multicaulis"
            ],
            "Common": [
                "white mulberry leaf"
            ],
            "Other name": [
                "dong sang ye (冬桑葉)"
            ],
            "Chinese": [
                "桑葉"
            ],
            "Pronunciation in Korean": [
                "sangyop"
            ],
            "Pronunciation in Japanese": [
                "soyo"
            ],
            "Pronunciation in Cantonese": [
                "song1 jip6"
            ],
            "Pinyin Pronunciation": []
        },
        "Type": "Herb",
        "Geography": [
            "throughout China"
        ],
        "Properties": [
            "bitter",
            "sweet",
            "cold"
        ],
        "Meridians": [
            "Lung",
            "Liver"
        ],
        "Maladies Treated": [
            "common cold and influenza with feng re (wind heat type syndrome)",
            "dizziness and blurry vision due to liver yang ascending",
            "beriberi and edema",
            "vomiting blood",
            "cough due to lung heat (baked with honey)",
            "pain and numbness of shoulders, arms and joints when using sang zhi (young branches)",
            "rheumatoid arthritis (sang zhi, young branches)",
            "cough and dry throat due to heat in the lungs (Sang xin tang formula)"
        ],
        "Medical Function": [
            "After being consumed, the rich fibre of sang ye will be released. It slows down the absorption of monosaccharide in the stomach and lowers the blood sugar after meals. It also helps maintain healthy body weight.",
            "Eating sang ye can prevent and slow down the formation of diabetes: According to Tokyo Agriculture and Industry University of Japan, rats with type I diabetes, after being fed with sang ye, the symptoms of diabetes obviously decreased by 5%.",
            "According to an experiment by an institute of nutrition and insect research and by South Korean Qing Xi (慶熙) University, the weight and blood sugar of those who ate sang ye became lower.",
            "Sang bai pi (root bark of mulberry): getting rid of heat in the lung to calm wheezing.",
            "sang zhi (young branches): for pain and numbness of shoulders, arms and joints; for treatment of rheumatoid arthritis.",
            "sang shen (fruits/mulberry): used as blood tonic and as yin tonic."
        ],
        "Dosage": "sang ye: 3 to 9 g\nsang bai pi (root bark): 6 to 12 g\nsang zhi (young branches): 6 to 12 g\nsang zhi (other dosage mentioned): 9 to 15 g",
        "Samples of Formulae": "1. For common cold and flu with fever, headache, cough, pain in the throat:\nName of Formula: sang ju yin (桑菊飲)\nComposition: sang ye (mulberry leaf) 3 qian (11.25 g), ju hua (chrysanthemum flower) 3 qian (11.25 g), xin ren (apricot seed) 2 qian (7.5 g), jie geng (platycodon root) 2 qian (7.5 g), lian qiao (forsythia fruit) 2 qian (7.5 g), bo he (peppermint/field mint) 1 qian (3.75 g), lu gen (reed rhizome) 2 qian (7.5 g), gan cao (licorice root) 2 qian (7.5 g). Make into decoction and drink while warm.\n\n2. For cough and dry throat due to heat in the lungs:\nName of Formula: Sang xin tang (桑杏湯)\nComposition: sang ye (mulberry leaf) 3 qian (11.25 g), xin ren (apricot seed) 3 qian (11.25 g), bei mu (fritillaria bulb) 2 qian (7.5 g), sha shen (glehnia root) 2 qian (7.5 g), xiang shi (fermented soybean) 1 qian (3.75 g), zhi zi (gardenia fruit) 1 qian (3.75 g). Make decoction and drink while warm.\n\nNote: 1 qian = 3.75 g (old measurement).\n\nIf cough is due to lung heat, use the leaves that have been baked with honey.",
        "Contraindications": "",
        "Research": "Decoction of fresh sang ye possesses the inhibiting effect on Staphylococcus aurcus, β-Hemolytic streptococcus and many other kinds of bacteria in vitro. Consuming the decoction can inhibit Leptospira interrogans.",
        "Notes": "",
        "Chemical Ingredients": [
            "rutin (芸香甙)",
            "quercetin (槲皮素)",
            "isoquercitrin (異槲皮甙)",
            "morocetin (桑甙, moracetin)",
            "quercetin-3-Triglucoside (槲皮素-3-三葡萄糖甙)",
            "astraglin (黄芪黄酮)",
            "inokosterone (牛膝甾酮)",
            "ecdysterone (脫皮甾酮)",
            "β-sitosterol (β-穀甾醇)",
            "umbelliferone (繖形花內酯)",
            "scopolin (東莨菪甙)",
            "α-hexenal (α-已烯醛)",
            "β-hexenal (β-已烯醛)",
            "trigonelline (葫蘆巴鹼)",
            "vitamin B1",
            "vitamin B2",
            "vitamin C",
            "vitamin E",
            "trace amount of essential oil",
            "inorganic compound",
            "sugar",
            "protein",
            "tannin"
        ],
        "References": [],
        "Further Reading": [],
        "Original Text": "sang ye, Complementary and Alternative Healing UniversityComplementary and Alternative Healing University  Home  現代中藥辭典Search this siteList of Health ProblemsChinese Herb DictionaryQigongTraditional Chinese Medicine (TCM)AcupuncturePrescribed Drug DictionaryBiochemistry DictionaryLecture SlidesResearch LibrarianGeneral Online LibrarySearchResearch SitesViagraMassage/AcupressureHypnotherapyTell us what you wantNotify Changes & New Information　　　                                                                               sang ye 桑葉   (in English and Chinese 中英文)sang bai pi 桑白皮， sang zhi 桑枝 Translated and Edited by: Joe Hing kwok ChuPharmaceutical name:英文藥名﹕Folium Mori AlbaeBotanical name:學名﹕Morus alba L.Morus bombycis, Koidz.;Morus australis Poir.;Morus multicaulis,  Pron. in Japanese:日語發音﹕soyoPron. in Korean:韓語發音﹕sangyopPron. in Cantonese:粵音﹕song1 jip6Other Names:別名﹕dong sang ye冬桑葉Common Name:英文名﹕white mulberry leafDistribution:產地﹕throughout ChinaProperties(characteristics)﹕性味﹕bitter, sweet, cold.味苦，甘，寒。Channels (meridians) entered: 歸經﹕lung, liver歸肺﹐肝二經。Medical functions:藥理﹕ (1) After being consumed, the rich fibre of sang ye will be released. It slows down the absorption of monosaccharide in the stomach and lower the blood sugar after meals. It also helps maintain the health body weight.(2) According to Tokyo Agriculture and Industry University of Japan, rats with type I diabetes, after being fed with sang ye, the symptoms of diabetes obviously decreased by 5%. This shows that eating sang ye can prevent and slow down the formation of diabetes. Another study by an institute of nutrition and insect research and by South Korean Qing Xi (慶熙) University, the weight and blood sugar of those who ate sang ye became lower. (1) 食用時，其豐富的纖維被釋出，有助於延緩胃部對單糖的吸收，使得進餐後的血糖值降低，亦有助於健康體重的維持。   (2) 日本東京農工大學的研究顯示，糖尿病一型的老鼠在餵食桑葉後，糖尿病症狀明顯減少5%，這結果表明，食用桑葉可能有助於防止和減緩糖尿病的形成；另一個由國家養蠶和昆蟲研究所和南韓慶熙大學主持的抗糖尿病實驗顯示，食用桑葉粉者體重和血糖都明顯下降。Actions & Indications:主治﹕ for treatment of:common cold and influenza with feng re (wind heat type syndrome)dizziness and blurry vision due to liver yang ascending ;beriberi and edema;vomiting blood.Normally it is use in raw form. In cases of cough due to lung heat, use the those that have been baked with honey. 主治外感風熱﹐肝陽上亢之頭暈目眩﹐除腳氣水腫吐血一般多生用，若肺熱咳宜蜜炙用Chemical ingredients:化學成份﹕rutin芸香甙quercetin槲皮素isoquercitrin異槲皮甙morocetin桑甙moracetin，quercetin-3-Triglucoside槲皮素-3-三葡萄糖甙，astraglin黄芪黄酮inokosterone牛膝甾酮ecdysterone脫皮甾酮β-sitosterolβ-穀甾醇umbelliferone繖形花內酯scopolin東莨菪甙α-，β-hexenalα-﹐β- 已烯醛trigonelline葫蘆巴鹼vitamin B1﹐B2﹐C，E維生素 B1﹐B2﹐C，Etrace amount of essential oil微量揮發油inorganic compound無機成分sugar糖類protein蛋白質tannin鞣質Dosage:用量﹕3 to 9 g3 ~ 9 克Samples of formulae:處方舉例﹕1. For and flu with fever, headache, cough, pain in the throat:Name of Formula: sang ju yin 桑菊飲2. For cough and dry throat due to heat in the lungs,Name of Formula: Sang xin tang  (Xue Sheng Bai - Wen Bing Tiao Bian)Composition: sang ye 3 qian, xin ren 2 qian, bei mu 2 qian, sha shen 2 qian, xiang shi 1 qian, zhi zi 1 qian.Make into decoction and drink while warm.Note: qian = 3.75 g (old measurement)(1)治外感風熱﹐發熱﹐頭痛﹐咳嗽﹐咽痛:桑菊飲 (薛生白-溫病條辨):桑葉三錢﹐菊 花三錢﹐杏仁二錢﹐桔 梗二錢﹐連翹二錢﹐薄荷一錢﹐蘆根二錢﹐  甘 草二錢，水煎服.(2) 治燥熱傷肺之咳嗽﹐咽乾等證桑杏湯 (溫病條辨):桑葉三錢﹐杏仁三錢﹐貝母二錢﹐沙參二錢﹐香豉一錢﹐梔子一錢水煎服.Modern Research:現代研究﹕decoction of fresh sang ye possesses the inhibiting effect on Staphylococcus aurcus,  β-Hemolytic streptococcus and many other kinds of bacteria in vitro. Consuming the decoction can inhibit Leptospira interrogans.鮮桑葉煎劑體外試驗對金黃色葡萄球菌, 乙型溶血性鏈球菌等多種致病菌有抑制作用，煎劑有抑制鉤端螺旋體的作用。Toxicity & Cautions:毒素與禁忌﹕　Note:附註：sang bai pisang bai pi,  is the bark. IApplication: being used for getting rid of theheat in the lung to calm down wheezing.Characteristics: sweet, cold.Channel (meridian) entered: lungDosage:  6～12 g桑白皮桑白皮是桑的根皮。功能主治：瀉肺平喘。性味：甘，寒。歸經：肺。用量： 6～12 克。 sang zhiSang zhi is the young branches.Application: for treatment of rheumatoid arthritis,being used in pain and numbness of shoulders, arms and joints.Characteristics: slightly bitter, neutral.Channel (meridian) entered: lungDosage: 6~12 g桑枝：桑枝是桑樹的嫩枝。性味： 微苦，平。 歸經： 肝。 功能主治： 祛風濕，利關節。用於肩臂，關節酸痛麻木。 用量： 9～15 克。sang shen are the fruits. They are being used as blood tonic and as yin tonic.桑椹是桑樹的果穗，補血滋陰。Sponsors' Ads by Google 以下為谷歌所提供贊助者之廣告  A manuscript... writing, translating and proofreading  in progressEmail our web master for  your suggestion (not for inquiry)     Click here for inquiry  Copyright Notice 按此看關於版權問題List of Health ProblemsChinese Herb DictionaryToxicity of Some Herbs  Side Effect of Some Herbs  Herbs that can be toxic to kidneysTraditional Chinese MedicineTCM DiagnosisSamples of FormulaeTerms of Traditional Chinese MedicineAcupuncturecopy right 版權所有Qigong (chi kung)Prescribed Drug DictionaryEmail our web master for  your suggestion (not for inquiry)Biochemistry DictionaryGeneral Online LibraryQigong classesLecture SlidesResearch LibrarianSearchQigong classes HomeWeather Report DisclaimerLast update: Nov 23, 2012; 9:36 p.m. LAHSearch this site         ",
        "original_url": "http://alternativehealing.org/sang_ye.htm"
    }
]