[
    {
        "Names": {
            "Name": [
                "da feng zi"
            ],
            "Pharmaceutical": [
                "Semen Hydnocarpi"
            ],
            "Biological": [
                "Hydnocarpus alpina Wright.",
                "Hydnocarpus anthellmintica Pierre ex Laness"
            ],
            "Common": [
                "Chaulmoogra seeds",
                "hydnocarpus"
            ],
            "Other name": [
                "Ma bo luo (Thai name)",
                "Krabao",
                "Mai krabao (Burmese name)"
            ],
            "Chinese": [
                "大楓子"
            ],
            "Pronunciation in Korean": [
                "Taepungja"
            ],
            "Pronunciation in Japanese": [
                "dafushi"
            ],
            "Pronunciation in Cantonese": [
                "dai3 fung1 zi2"
            ],
            "Pinyin Pronunciation": []
        },
        "Type": "Herb",
        "Geography": [
            "China",
            "Guangdong",
            "Guangxi",
            "Taiwan",
            "Southeast Asia",
            "India"
        ],
        "Properties": [
            "Hot",
            "Acrid",
            "Toxic"
        ],
        "Meridians": [
            "Liver",
            "Spleen",
            "Kidney"
        ],
        "Maladies Treated": [
            "Leprosy",
            "Scabies",
            "Elephantiasis",
            "Urticaria",
            "Rosacea"
        ],
        "Medical Function": [],
        "Dosage": "1 g or less.",
        "Samples of Formulae": "For treatment of leprosy: Name of Formula: da feng wan. Composition: da feng zi 900 g, fang feng, chuan xiong 30 g each, can tui, qiang huo, xi xin, he shou wu, du huo, ku shen, dang gui, niu xi, quan xie, huang qi, bo he 60 g each, bai zhi, gou ji, niu huang, xue jie 15 g each. Grind into powder. Make into pills with rice glue, into the size of black pepper. Take 15 pills each time with tea on empty stomach. Take 3 times per day.",
        "Contraindications": "Intra-muscular injection can lead to necrosis. Intravenous or subcutaneous injection can cause hemolytic anemia, hematuria and proteinuria. This herb is very toxic. It is mainly for external use. If it is to be taken orally, it should be diluted in the formula. Do not overdose or use for a long period. When it is used externally, it also should not be used in large amounts or for prolonged use. Patients with yinxu (yin deficient) condition, gastro-enteritis, or eye diseases should not use this herb.",
        "Research": "Should be cooked for a long time to get rid of the oil to prevent toxicity. Large dosage and long term usage can cause blindness. Side effects include dizziness, headache, chest pain, fever, weakness, insomnia, and loss of appetite.",
        "Notes": "This herb is generally only used for external applications due to its high toxicity.",
        "Chemical Ingredients": [
            "D-fructose",
            "D-glucose",
            "D-sucrose",
            "Ethyl-β-D-fructofuranoside",
            "Taraktophyllin",
            "Epival kenin",
            "Cyclopentenyl glycine",
            "Cyclopentenyl fatty acid"
        ],
        "References": [
            "[1] Jie Wei Yuan Sou 《解 圍元藪》",
            "[2] Zhong Hua Ben Cao 中華本草"
        ],
        "Further Reading": [],
        "Original Text": "da feng zi, Complementary and Alternative Healing University  現代中藥辭典Complementary and Alternative Healing University   中藥詞典    Chinese Herb Dictionary      Search this site     在本網站找資料 See more menu at the bottom of page  da feng zi    大楓子by: Joe Hing kwok Chu Pharmaceutical name:英文藥名﹕Semen HydnocarpiBiological name:拉丁文學名﹕Hydnocarpus alpina Wright.Hydnocarpus anthellmintica Pierre ex LanessPron. in Japanese:日語發音﹕dafushiPron. in Korean:韓語發音﹕Taep�ungjaPron. in Cantonese:粵音﹕ dai3 fung1 zi2Other Names:別名﹕Ma bo luo (Thai name) 碼菠蘿（傣族名）.Krabao, Mai krabao. (Burmese name)Common Name:英文名﹕Chaulmoogra seeds, hydnocarpusDistribution:產地﹕Guangdong, Guangxi, Taiwan, southeast Asia and India.中國處處均有, 尤其廣東﹐廣西出產較多。東南亞﹐印度均有生產。Properties(characteristics)﹕性味﹕Hot, acrid, toxic.性熱，味辛，有毒。Channels (meridians) entered: 歸 經﹕Liver, spleen, kidney肝,  脾,  腎Medical functions:藥理﹕ Actions & Indications:主治﹕for treatment of leprosy, scabies, elephantiasis, urticaria, rosacea用于麻 風病,疥 癬,象 皮病,蕁 麻疹,酒 渣 鼻.。Chemical ingredients:[2]化學成份﹕【2】 D-果糖（D-fructose） ，D-葡萄糖（D-glucose），D-蔗糖（D-sucrose），乙基-β-D-呋喃果糖甙（ethyl-β-D-fructofuranoside） ，異葉大風於腈甙（taraktophyllin），表-異葉大風子睛甙（epival kenin），環戊烯基甘氨酸（cyclopentenyl glycine） 及環戊烯脂肪酸（cyclopentenyl fatty acid）。Dosage:用量﹕1 g or less.1 克﹐或 少於1克。Samples of formulae:處 方舉例﹕For treatment of leprosy :Name of Formula: da feng wanComposition: da feng zi 900 g,fang feng, chuan xiong  30 g each,can tui, qiang huo, xi xin,  he shou wu,  du huo, ku shen, dang gui, niu xi, quan xie, huang qi, bo he 60 g each,bai zhi,  gou ji, niu huang, xue jie 15 g each.Grind into powder. Make into pills with rice glue, into the size of black pepper,Take 15 pills each time with tea on empty stomach. Take 3 times per day.[1]藥方名：大風丸主治：大瘋眉目遍身穢爛者組成：大楓子肉三十兩， 防 風、川 芎各十兩，蟬 退、 羌 活、 細 辛、 何 首烏、 獨 活、 苦 參、 當 歸、 牛 膝、 全 蠍、黃 芪、薄荷各二兩，白 芷、 狗 脊、牛 黃、 血 竭各五錢。為末，米糊丸，桐子大，每服十五丸 ，茶下，空心服，日進三次。[1] 注：桐子大小與胡椒粒差不多。Modern Research:現代研究﹕ Toxicity:毒性:Should be cooked for a long time to get rid of the oil to prevent toxicity. Large dosage and long term usage can cause blindness.Side effects include dizziness, headache, chest pain, fever, weakness, insomnia and loss of appetite.須久煎 去其表面浮油,以 防中毒。多 服本藥會失明。其他副作用包 括頭暈﹐頭痛﹐胸痛﹐發熱﹐無力﹐失眠﹐食慾減少。Cautions:禁忌﹕Intra-muscular injection can lead to necrosis. Intravenous or subcutaneous injection can cause hemolytic anemia, hematuria and proteinuria.This herb is very toxic. It is mainly for external use. If it is to be taken orally, it should be diluted in the formula. Do not overdose or use for long period. When it is used externally, it also should not be used in large amounts or for prolonged use. Patients with yinxu (yin deficient) condition, gastro-enteritis, or eye diseases should not use this herb.本品毒性很大，一般只作外 用，內服宜慎。必須作內服時，當稀釋於復方中用，不可過量或持續服用。外用也不得過量或久用。 陰虛血熱、胃腸炎症、目症患者均忌服。不可作肌肉注射以免引 起肌肉壞死。靜脈或皮下注射能引起溶血性貧血﹐血尿, 蛋白尿。[1] Jie Wei Yuan Sou 《解 圍元藪》[2] Zhong Hua Ben Cao 中華本草Search this siteProblems with website? Please Click here for comment. (Not for inquiry )   Click here for inquiryCopyright Notice 按此看關於版權問題Sponsors' Ads by Google 以下為谷歌 所提供之廣告A manuscript... writing, translating and proofreading  in progressMenu: List of Health ProblemsQigong (chi kung)Toxicity of Some HerbsSide Effect of Some HerbsHerbs that can be toxic to kidneysTraditional Chinese Medicine TCM Diagnosis Samples of FormulaeTerms of Traditional Chinese MedicineAcupunctureChinese Herb DictionaryQigong classesPrescribed Drug DictionaryEmail our web master for  your suggestion (not for inquiry)Biochemistry Dictionary Qigong classes Research Librarian copy right 版權所有HomeWeather ReportDisclaimerLast update: Sept. 4, 2015; 9 p.m. LAH   ",
        "original_url": "http://alternativehealing.org/da_feng_zi.htm"
    },
    {
        "Names": {
            "Name": [
                "shui fei ji"
            ],
            "Pharmaceutical": [
                "Herba silybi",
                "Fructus silybi"
            ],
            "Biological": [
                "Silybum marianum (L.) Gaerth"
            ],
            "Common": [
                "milk thistle",
                "all-grass of St. Marys",
                "all-grass of blessed thistle",
                "all-grass of holy thistle"
            ],
            "Other name": [
                "cai ji 菜薊",
                "shui fei zhi 水飛雉",
                "nai ji 奶薊",
                "lao shu le 老鼠勒"
            ],
            "Pronunciation in Korean": [
                "Huin-mu-nui-eong-geong-kwi",
                "keun-eong-geong-kwi"
            ],
            "Pronunciation in Japanese": [
                "suihikei"
            ],
            "Pronunciation in Cantonese": [
                "seoi2 fei1 gai3"
            ],
            "Pinyin Pronunciation": []
        },
        "Type": "Herb",
        "Geography": [
            "Western Europe",
            "northern Africa",
            "Shaanxi (China)",
            "Gansu (China)",
            "Heilongjiang (China)",
            "Hebei (China)"
        ],
        "Properties": [
            "Bitter",
            "Cold"
        ],
        "Meridians": [],
        "Maladies Treated": [
            "Boils and erysipelas: Whole herb is used.",
            "Chronic hepatitis: Herb and seed extracts are used.",
            "Cirrhosis of liver: Herb and seed extracts are used.",
            "Fatty liver: Herb and seed extracts are used.",
            "Gallbladder stones: Herb and seed extracts are used.",
            "Spleen diseases: Herb and seed extracts are used.",
            "Chronic cough: Herb and seed extracts are used."
        ],
        "Medical Function": [
            "Improves liver function",
            "Lactagogues (promoting the flow of breast milk)",
            "Anti-depression",
            "Cholagogue (promotes bile secretion)",
            "Lowers AST and ALT in chronic alcohol drinkers with chronic or mild acute hepatitis",
            "Inhibits T-cell activation (useful in psoriasis)",
            "Lowers virus load of hepatitis C",
            "Protects against genomic injury: Clinical trial results[2]",
            "Increases hepatocyte protein synthesis: Clinical trial results[2]",
            "Decreases activity of tumor promoters: Clinical trial results[2]",
            "Stabilizes mast cells: Clinical trial results[2]",
            "Chelates iron: Clinical trial results[2]",
            "Slows calcium metabolism: Clinical trial results[2]"
        ],
        "Dosage": "In powder form: 12-15g (equivalent to 720-900 mg of silymarin). Not effective in decoction since the silymarin has very low water solubility.",
        "Samples of Formulae": "",
        "Contraindications": "It may cause nausea, diarrhea, abdominal bloating, and pain, and can produce allergic reactions (especially in those allergic to plants in the same family, such as ragweed, chrysanthemum, marigold, and daisy).",
        "Research": "[2] Am J Gastroenterol. 1998 Feb;93(2):139-43.",
        "Notes": "",
        "Chemical Ingredients": {
            "The whole herb": [
                "flavonoid",
                "fumaric acid"
            ],
            "Seed": [
                "about 6% silymarin",
                "silybin",
                "isosilybin",
                "dehydrosilybin",
                "silydianin",
                "silychristin",
                "cinnamic acid",
                "myristic acid",
                "palmitelaidic acid",
                "arachidic acid"
            ]
        },
        "References": [
            "[1] http://nccam.nih.gov/health/hepatitisc/",
            "[2] Am J Gastroenterol. 1998 Feb;93(2):139-43."
        ],
        "Further Reading": [],
        "Original Text": "shui fei ji, Complementary and Alternative Healing University\nComplementary and Alternative Healing University \n  中藥詞典                 Chinese Herb Dictionary      Search this site     在本網站找資料Search this siteList of Health ProblemsChinese Herb DictionaryQigongTraditional Chinese Medicine (TCM)AcupuncturePrescribed Drug DictionaryBiochemistry DictionaryLecture SlidesResearch LibrarianGeneral Online LibraryResearch SitesViagraMassage/AcupressureHypnotherapyTell us what you wantNotify Changes & New Information  shui fei ji  水飛薊  milk thistle   (in English and Chinese 中英文)  by: Joe Hing kwok ChuPharmaceutical name:英文藥名﹕Herba silybi, Fructus silybiBotanical name:學名﹕Silybum marianum (L.) GaerthPron. in Japanese:日語發音﹕suihikeiPron. in Korean:韓語發音﹕Huin-mu-nui-eong-geong-kwi; keun-eong-geongkwiPron. in Cantonese:粵音﹕seoi2  fei1 gai3 \n    \nOther Names:別名 ﹕cai ji 菜薊，shui fei zhi 水飛雉，nai ji 奶薊，lao shu le 老鼠勒。Common Name:英文名﹕milk thistle, all-grass of St.Marys, all-grass of blessed thistle, all-grass of holy thistleDistribution:產地﹕origin: Western Europe and northern Africa. Now it is cultivated in Shaanxi, Gansu, Heilongjiang provinces of China.原產於西歐和北非。中國在陝西、甘肅、黑龍江和河北等省栽培。Properties(characteristics)﹕性味﹕bitter, cold.性寒，味苦。Channels (meridians) entered: 歸經﹕Medical functions:藥理﹕ Improves liver function,lactagogues (promoting the flow of breast milk),anti depression, cholagogue (promotes bile secretion).It can lower the value of  chronic alcohol drinkers' AST and ALT, caused by chronic or mild acute hepatitis.Inhibits  T-cell activation, (T-cell activation occurs in psoriasis.).lowers virus load of hepatitis C.protect against genomic injury, [2]increase hepatocyte protein synthesis, [2]decrease the activity of tumor promoters, [2]stabilize mast cells, [2]chelate iron,  [2]slow calcium metabolism.[2]改善肝臓機能，促進胆汁分泌，抗鬱，促進母乳分泌，能降低長期用 酒精者所引起的輕急性及次急性肝病患者血中 AST 與 ALT值，可抑制T细胞活動性。（銀痟病者有T细胞活性增加情况。）降低丙型肝炎之病毒，防止基因損傷，[2] 增加肝細胞蛋白質的合成，[2] 降低腫瘤啟動子的活性，[2] 穩定肥大細胞，[2] 螯合鐵，[2] 減慢鈣的代謝[2]。Actions & Indications:主治﹕being used in boils and erysipelas. The extract of herb and fruit is being used in chronic hepatitis, cirrhosis of liver,  fatty liver, gallbladder stones, spleen diseases,  and chronic cough.  功能主治　全草用於腫瘍及丹毒；種子及提取物用於慢性肝炎，肝硬化，脂肪肝，膽石症，膽管炎脾臟病，和長期性的咳嗽。Chemical ingredients:化學成份﹕The whole herb contains flavonoid and fumaric acid. Seed contain about 6% of silymarin. Silymarin is composed primarily of silybin (also referred to as silibin or silibinin), accompanied by isosilybin, dehydrosilybin, silydianin and silychristin. It also contains cinnamic acid, myristic acid, palmitelaidic acid, arachidic acid.全草含有黃酮類及延胡索酸；種子含一群特殊的類黃酮叫水飛薊素（silymarin）主要組成為水飛薊賓，連同異水飛薊賓，脫氫水飛薊賓，水飛薊寧，水飛薊亭。又含肉桂酸，肉豆蔻酸，棕櫚烯酸，花生酸等。Dosage:用量﹕In powder form: 12～15ｇ; (equivalent to 720�900 mg of silymarin). Not effective in decoction since the effective ingredient of silymarin has a very low water solubility.作粉剤用： 12～15克 （相當於 水飛薊素 720 ～ 900 豪克）。 水煮作湯無效，因為水飛薊素不易溶於水，所於水煮不容易把有效成份提出。Samples of formulae:處方舉例﹕ Modern Research:現代研究﹕See this.Toxicity & Cautions:毒素與禁忌﹕It may cause nausea, diarrhea, abdominal bloating, and pain, and it can produce allergic reactions (especially who are allergic to plants in the same family, such as ragweed, chrysanthemum, marigold, and daisy).[1]有報導說水飛薊瀉下作用。可能引起作嘔，腹瀉，腹脹，疼痛，也能引起敏感反應，尤其對同類植物有敏感的，如豕草類，菊花，金盞菊，雛菊等。[1] [1] \nhttp://nccam.nih.gov/health/hepatitisc/ [2] Am J Gastroenterol. 1998 Feb;93(2):139-43.  Search this siteProblems with website? Please Click here for comment. (Not for inquiry )    Click here for inquiryCopyright Notice 按此看關於版權問題A manuscript... writing, translating and proofreading  in progressSponsors' Ads by Google 以下為谷歌 所提供之廣告 List of Health ProblemsChinese Herb DictionaryToxicity of Some HerbsSide Effect of Some HerbsHerbs that can be toxic to kidneysTraditional Chinese Medicine TCM Diagnosis Samples of FormulaeTerms of Traditional Chinese MedicineAcupuncturecopy right 版權所有Qigong (chi kung)Prescribed Drug DictionaryEmail our web master for  your suggestion (not for inquiry)Biochemistry DictionaryGeneral Online LibraryQigong classesFake Email WarningResearch LibrarianSearchQigong classesHomeWeather ReportDisclaimerLast update: Oct 18, 2013; 1 p.m. LAH   \n",
        "original_url": "http://alternativehealing.org/shui_fei_ji.htm"
    },
    {
        "Names": {
            "Name": [
                "wei ling xian",
                "Clematis chinensis"
            ],
            "Pharmaceutical": [
                "Radix Clematidis"
            ],
            "Biological": [
                "Clematis chinensis Osbeck",
                "Clematis terniflora DC. var. mandshurica (Rupr.) Ohwi",
                "Clematis hexapetala Pall.",
                "Clematis uhcinata Champ.",
                "Clematis manshurica Rupr."
            ],
            "Common": [
                "clematis"
            ],
            "Other name": [
                "tie pi wei ling xian 鐵皮威靈仙",
                "shan mu tong 山木通",
                "ling xian 靈仙",
                "tie jiao wei ling xian 鐵腳威靈仙"
            ],
            "Chinese": [
                "威靈仙"
            ],
            "Pronunciation in Korean": [
                "Wojoksum"
            ],
            "Pronunciation in Japanese": [
                "ireisen"
            ],
            "Pronunciation in Cantonese": [
                "wai1 leng4 sin1"
            ],
            "Pinyin Pronunciation": [
                ""
            ]
        },
        "Type": "Herb",
        "Geography": [
            "Clematis uhcinata Champ. ex Benth.: Guangdong, Guangxi, Guizhou, Sichuan, Fujian, Zhejiang, Jiangx provinces of China.",
            "Clematis hexapetala Pall.: northeastern provinces, northern provinces, Shandong Jiangxu provinces.",
            "Clematis manshurica Rupr: northeastern provinces of China"
        ],
        "Properties": [
            "Acrid",
            "Salty",
            "Warm",
            "Slightly bitter",
            "Mildly toxic"
        ],
        "Meridians": [
            "Bladder",
            "Liver"
        ],
        "Maladies Treated": [
            "Rheumatoid arthritis",
            "Gouts",
            "Pain in the lower back and limbs",
            "Strokes",
            "Headaches",
            "Rids of phlegm",
            "Promotes urination",
            "Helps menses",
            "Treatment of deeply lodged fish bones in the throat",
            "Tonsillitis",
            "Tetanus",
            "Beriberi"
        ],
        "Medical Function": [
            "Increases bile secretion and relaxes the muscles of the bile tract.",
            "Anti-malaria",
            "Lowers blood pressure",
            "Promotes urination",
            "Relieves pain"
        ],
        "Dosage": "6 - 12 g",
        "Samples of Formulae": "1. For treating acute hepatitis with jaundice: wei ling xian 9 g made into fine powder, mixed with 1 chicken egg, scrambled. Take 3 times a day for 3 consecutive days.\n2. For treating calculus in the gall bladder: wei ling xian 30 to 60 g made into 2 decoctions.\n3. For treating bones lodged in the throat: wei ling xian 30 g, add bai zhi 3 g, wu mei 5 g, gan cao 4 g. Make into thick decoction, can use with table vinegar. Swallow slowly for half hour to one hour. One or two prescriptions a day.\n4. For treating bone spurs: wei ling xian 30 g, ku shen 10 g, chuan shan jia 10 g, xiang fu zi 10 g, tou gu cao 10 g. One prescription a day, boil with water and make into 2 servings.",
        "Contraindications": "Not to be used in cases of qixu (qi deficient) and blood deficient or during pregnancy. Large dosages and/or long term usage can be toxic to kidneys.",
        "Research": "",
        "Notes": "",
        "Chemical Ingredients": {
            "Clematis manshurica": [
                "Isoferulic acid",
                "Clematoside A, B, C",
                "3,4-Dimethoxycinnamic acid",
                "3-O-acetyloleanolic acid",
                "D-Mannitol",
                "Daucos-terol",
                "β-Sitosterol"
            ],
            "Root": [
                "Minecoside",
                "Catalpol",
                "6-O-veratrylcatalpolester",
                "Aucubin",
                "6-Deoxy-8-isofer-uloylharpagide",
                "β-Sitosteryl3-O-D-glucoside",
                "Campesteryl3-O-D-glucoside",
                "β-Sitosterol",
                "Campesterol",
                "Stigmasterol",
                "Mannitol"
            ],
            "Seeds": [
                "Palmitic acid",
                "Stearic acid",
                "Oleic acid",
                "Linoleic acid"
            ],
            "Clematis chinensis": [
                "Anemonol",
                "Protoanemonin",
                "Prosapogenine",
                "Aristolochic acid"
            ]
        },
        "References": [
            "[1] 15 patients. Healed: 14 patients.",
            "[2] Take one dose prescription a day. Result: 35 patients. Healed: 22 patients, Effective: 7 patients. Better: 5 patients.",
            "[4] 120 patients. Total effectiveness: 87%.",
            "[6] Result: 104 patients. Got rid of fish bone: 90 patients. Effectiveness: 87.6%.",
            "[9] Total 369 cases. Result: 128 healed; 112 became better; 7 cases had no effect. Total effectiveness 98.1%.",
            "《上海中醫藥雜志》1983；（5）：30",
            "蒲秀山，中國骨傷，1992，5 (6) 32"
        ],
        "Further Reading": [],
        "Original Text": "\n\n\n\n\nwei ling xian, Clematis chinensis, Complementary and Alternative Healing \nUniversity\n\n\n\n\n\n\nComplementary \n        and Alternative Healing University  \nHome  \n\n\n現代 中藥辭典\n\n\n\n\n\n\n\n\n\n\n\n\n\n\n\n\nSearch \n            this site\n\n\n\n\n\n\n\n            List of Health Problems\n\n\n\n\n\n\n\n            Chinese Herb Dictionary\n\n\n\n\n\n\nQigong\n\n\n\n\n\n\n\n            Traditional Chinese Medicine (TCM)\n\n\n\n\n\n\n\n            Acupuncture\n\n\n\n\n\n\n\n            Prescribed Drug Dictionary\n\n\n\n\n\n\n\n            Biochemistry Dictionary\n\n\n\n\n\n\nLecture Slides\n\n\n\n\n\n\nResearch Librarian\n\n\n\n\n\n\nGeneral \n            Online Library\n\n\n\n\n\n\nSearch\n\n\n\n\n\n\nResearch \n            Sites\n\n\n\n\n\n\n\n            Viagra\n\n\n\n\n\n\n\n            Massage/Acupressure\n\n\n\n\n\n\nHypnotherapy\n\n\n\n\n\n\nTell us what you want\n\n\n\n\n\n\nNotify Changes \n            & New Information\n\n\n\n\n　\n　\n　\n　\n　\n　\n　\n　\n　\n　\n　\n　\n　\n　\n　\n　\n　\n　\n　\n　\n　\n　\n　\n　\n　\n　\n　\n　\n　\n　\n　\n　\n　\n　\n　\n　\n　\n　\n　\n　\n　\n　\n　\n　\n　\n　\n　\n　\n　\n　\n　\n　\n　\n　\n　\n　\n　\n　\n　\n　\n　\n　\n　\n　\n　\n　\n　\n　\n　\n　\n　\n　\n　\n　\n　\n　\n　\n　\n　\n　\n　\n　\n　\n　\n　\n　\n　\n　\n　\n　\n　\n　\n　\n　\n　\n　\n　\n　\n　\n　\n　\n　\n　\n　\n　\n　\n　\n　\n　\n　\n　\n　\n　\n　\n　\n　\n　\n　\n　\n　\n　\n　\n　\n　\n　\n　\n　\n　\n　\n　\n　\n　\n　\n　\n　\n　\n　\n　\n\n\n\n\n\n\n　\n\n\nwei ling xian 威靈仙\n  (in English and Chinese 中英文)\nTranslated\n        \n\n        by: Joe Hing kwok Chu 朱興國譯成英文\n\n\n\n\n\n\n\n\n\n\nToday's Applications:\n\nToday's Applications:\n            1. for treating acute hepatitis with jaundice\nCase 1: wei ling xian 9 \n            g make into fine powder, 1 chicken egg, mixed. Make scrambled egg. Take \n            3 times a day for 3 consecutive days. Avoid \n            beef, pork and sour or spicy food. Result: 15 patients. Healed: 14 patients.[1]\n\nCase 2: wei ling xian 15 \n            g, gan cao 15 g. Make into decoction. Take one dose prescription a day. \n            Result: 35 patients. Healed: 22 patients, Effective: 7 patients. Better: \n            5 patients.\n        \n\n\n[2]\n\n2. for treating calculus in the urinary tract\n(therapy method to be\n            loaded)\n3. for treating calculus in the gall bladder\nwei ling xian 30 to \n            60 g. Make into 2 decoctions. Result: 120 \n            patients. Total effectiveness: 87%.\nIt was especially effective for the mud- \n            and sand-like kind of calculus. Among the \n            120 patients, 26 were with mud-  and \n            sand- like kind of calculus, \n            and 23 were clinically healed and 3 were better. The rate of being healed \n            was 88.5% and total effectiveness was 100%.\n        \n\n\n[4]\n\n4. for treating tonsillitis\n(therapy method to be \n            loaded)\n5. for treating bones lodged in the throat\nwei ling xian 30 g, can \n            be used with\n        \n\nor add the following herb\n            \nbai zhi 3 g,\n            wu mei 5 g, \n\ngan cao \n            4 g. Make into thick decoction. Can be used \n            with table vinegar. Swallow slowly, for half hour to one hour. One or \n            two prescription a day.\n            Result: 104 patients. Got \n            rid of fish bone: 90 patients. Effectiveness: 87.6%.[6]\n\n            　\n\n\n治膽囊結石\n\n威靈仙 30 ~ 60 克。水煎分二次服。每天一劑。\n\n效果﹕120 病例。總有效率﹕87%。\n\n此方對泥沙樣膽結石尤其有效。120病例﹐ 26 例為泥沙樣結石﹔ 23例痊癒﹔3例較好。治癒率為88.5%。總有效率為100%。\n\n\n            　\n\n\n            治尿路結石\n 威靈仙60∼90g，金錢草\n50∼60g。每日1劑，煎服。（《上海中醫藥雜志》1983；（5）：30）\n            \n\n            　\n\n\n治療骨鯁\n\n威靈仙\n            30 克。或加 白芷 \n            3 克，烏梅 5克， \n            甘草\n            4 克 \n            。\n            \n            製成濃煎劑。或與醋同用。用半小時至一小時慢慢飲下。每日一二剤。\n            \n            結果：治骨鯁喉104例。服藥後骨鯁消除90例。有效率為87.6%。\n\n            如服藥四劑無效，應結合異物種類、梗阻部位，考慮採用手術取出，以免貽誤病情 。(中華本草)\n註：白\n            芷 ，烏梅 ， \n            甘草\n            \n            之用量是編者個人之意見。應随証加减。\n            \n　\n\n6. for treating the inflammation of the \n            mammary glands\n(therapy method to be\n            loaded)\n7. for treating the inflammation of the glands \n            of children\n(therapy method to be\n            loaded)\n8. for treating bone spurs\nwei ling xian 30 g,\n        \n\n ku \n            shen 10 g, \n\n            chuan shan jia 10 g, \n\nxiang fu zi 10 g,\n            tou gu cao  10 g. One prescription a day. Boil with water and make \n            into 2 servings. Add water to the residue and boil down to 800 c.c. \n            and use it for steaming, washing or soaking for 30 minutes. Or use the \n            above prescription to make into powder. Take 10 to 20 g a day and soak \n            the powder in boiling water. Make into 2 servings. A period of \n            10 days is one treatment cycle. Rest for 5 days between treatment periods. \n            Treat for 1 to 4 periods.\n            Total 369 cases of bones \n            spurs were treated. Result: 128 healed; 112 became better; 7 cases had \n            no effect.  Total effectiveness 98.1%.[9]\n\n\n\n威靈仙 30 \n            克﹐苦 \n            參 10 克﹐穿山 \n            甲 10 克﹐香 \n            附子10克﹐\n            透骨草10 \n            克。\n\n水煎。分二次服。藥渣加水再煎。洗患處。每日30 分鐘。\n\n也可以製成粉劑。每日用10~20 克。泡入沸水內。作 \n            二次服。十日為一療程。\n\n休息五日。1~5 療程。\n\n療效﹕369 病例。128 例痊癒。112有進步。7 例無效。總有效率為98.1%。\n\n\n蒲秀山，中國骨傷，1992，5 (6) 32\n\n　\n9. for treating \n            hemorrhoids\nwei\nling xian 60 g, \n\n\n\nfang feng \n            60 g. Make into decoction for washing affected part.\nEditor's \n            Note: Do not overdose or use for long time\n\n\n\n\n\n\n\n\n\n\n\nPharmaceutical name:\n\n英文藥名：\n\nRadix Clematidis\n\n\n\n\nBiological name:\n\n拉丁學名：\n\n\n\n\nClematis chinensis Osbeck\n(威靈仙)\n\nClematis \n            terniflora DC. var. mandshurica \n(Rupr.) Ohwi (東北鐵線蓮)\n\n\n\nClematis hexapetala \n            Pall., (綿團鐵線蓮, 黑薇, 山蓼.)\n\n\nClematis uhcinata Champ. \n            (柱果鐵線蓮)\n\n\nClematis \n\n\nmanshurica \n            Rupr. (東北鐵線蓮)\n\n\n\n\n\nPron. \n            in Japanese:\n\n日語發音：\n\nireisen\n\n\n\nPron. \n            in Korean:\n\n韓語發音：\n\nWojoksum\n\n\n\n\n\n\n            Pron. in Cantonese\n\n粤語發音：\n\nwai1 leng4 \n            sin1\n\n\n\nCommon \n            Name:\n\n英文名：\n\nclematis\n\n\n\n\nOther Names:\n\n別名﹕\n\n　\n\n\ntie pi wei ling xian\n            鐵皮威靈仙﹐shan mu tong 山木通﹐ling \n            xian 靈仙, tie jiao wei ling xian 鐵腳威靈仙。\n\n\n\nDistribution:\n\n分佈：\n\n\nClematis uhcinata \n            Champ. ex Benth.is being used in Guangdong, Guangxi, Guizhou, \n            Sichuan, Fujian, Zhejiang, Jiangx provinces of China.\nClematis hexapetala \n            Pall. is being used in northeastern provinces, northern \n            provinces, and Shandong Jiangxu provinces.\n\nClematis manshurica Rupr is being used \n            in northeastern \n            provinces.\n柱果鐵線蓮 又名老虎師藤，使用於廣東、廣西、貴州、四川、福建、浙江、江西。\n山蓼 又名綿團鐵線蓮、黑薇。使用於東北、華北、山東、江蘇。\n東北鐵線蓮使用於東北。\n\n\n\n\nProperties \n            (characteristics)：性味：\n\nacrid, salty, warm, slightly \n            bitter, mildly toxic.味辛咸,\n            微苦, 溫﹐有小毒.\n\n\n\n\n\nChannels (meridians) entered:\n歸經:\n\nbladder, liver\n膀胱﹐肝\n\n\n\nActions & Indications:\n主治：\n\n\n\nfor rheumatoid arthritis, gouts, pain in\nthe lower back and limbs, strokes, \n            headaches, rids of phlegm, promotes urination, \n            helps\n\nmenses, for treatment of deeply lodged fish\nbones in the throat, tonsillitis, tetanus, and\nberiberi.\n\n\n\n風濕，痛風，腰膝四肢疼痛，中風，頭風，， \n            消痰涎 ， 利尿 ， 通 經 ， 魚骨鯁\n\n喉 ， 扁 桃 體 炎 ， 破傷風 ， 腳氣 。\n\n\n\n\nMedical Function:藥理:\n\n\n1. increases bile secretion \n            and relaxes the muscles of the bile tract.\n2. anti-malaria\n3. lowers blood pressure\n4. promotes urination\n5. relieves pain.\n\n　\n\n\n\n增進膽汁分泌與使膽管的肌肉放鬆。\n\n\n\n抗瘧疾\n\n\n\n降血壓\n\n\n\n利尿\n\n\n\n止痛\n\n\n\n\n\n\n\nChemical Ingredients:\n化學成份:\n\n\n\n\n\nClematis\n                manshurica:\n東北鐵線蓮:\n\n\nisoferulic\nacid\n異阿魏酸\n\n\nclematoside A,  B, C\n\n鐵線蓮甙 A,B,C\n\n\n3,4-dimethoxycinnamic\nacid\n3,4-二甲氧基桂皮酸\n\n\n3-O-acetyloleanolic\nacid\n3-O-乙酰齊墩果酸\n\n\nD-mannitol\nD-甘露醇\n\n\ndaucos-terol\n胡蘿卜甙\n\n\nβ-sitosterol\n β-谷甾醇\n\n\n\nRoot contains:\n\n根中含:\n\n\nminecoside\n米內甙\n\n\ncatalpol\n梓醇\n\n\n6-O-veratrylcatalpolester\n6-O-藜蘆基梓醇酯\n\n\naucubin\n桃葉珊瑚甙\n\n\n6-deoxy-8-isofer-uloylharpagide\n6-去氧-8-異阿魏酸哈帕甙\n\n\nβ-sitosteryl3-O-D-glucoside\nβ-谷甾醇-3-O-D-葡萄糖甙\n\n\ncampesteryl3-O-D-glucoside\n菜油甾醇3-O-D-葡萄糖甙\n\n\nβ-sitosterol\nβ-谷甾醇\n\n\ncampesterol\n菜油甾醇\n\n\nstigmasterol\n豆甾醇\n\n\nmannitol\n甘露醇\n\n\n\nSeeds contain:\n\n種子含：\n\n\n\npalmitic\nacid\n\n棕櫚酸\n\n\nstearic\nacid\n硬脂酸\n\n\noleic\nacid\n油酸\n\n\nlinoleic\nacid\n亞油酸\n\n\nClematis \n                chinensis:：\n\n威靈仙：\n\n\n\nanemonol\n\n白頭翁腦\n\n\n\nprotoanemonin\n\n原白頭翁腦,（原白頭翁素,原銀蓮花素）\n\n\n\nprosapogenine\n\n次皂苷元\n\n\naristolochic \n                acid\n\n馬兜鈴酸\n\n\n\n\n\n\nDosage:\n用量﹕\n\n6 - 12 g\n\n\nCommonly Used formulae:\n            常用配方:\n\nsee\n            \nthe modern application above.\n\n\nModern Research:\nto be loaded\n\n\nCautions:\n禁忌：\n\nNot to \n            be used in cases of\n            qixu (qi deficient) \n            and blood deficient\nor during pregnancy.\nLarge dosages and/or long term usage \n            can be\n            toxic \n            to kidneys.\n\n　\n\n大劑量或長期服用可能對腎臟有毒因為本品含兜鈴酸。氣虛﹐血虛體弱者，或懷孕者忌用。\n\n\n\n\n\n[n] for bibliography consult\n        Research Librarian\n\n\nSponsors' Ads by Google 以下為谷歌所提供贊助者之廣告\n\n\n　\n\n\n\nA manuscript... writing, translating and proofreading              \n        in progress\n\n        　\n\nProblems with website? Please \n\nClick \n        here for comment. (Not for inquiry )\n\n\n\nClick \n        here for inquiry  \n\n        　\n\n\nCopyright Notice 按此看關於版權問題\n\n\n\n\n\n\n            List of Health Problems\n\n\n\n\n\n            Chinese Herb Dictionary\n\n\n\n\n\nToxicity of Some Herbs\n\n\n\nSide Effect of Some Herbs\n\n\n\nHerbs that can be toxic to kidneys\n\n\n\n\n\n            Traditional Chinese Medicine\n\n\nTCM Diagnosis\n\n\nSamples \n            of Formulae\n\n\n\n\n\n            Acupuncture\n\n\n\n\n\n\ncopy right\n\n            　\n\n\n版權所有\n\n\n\n\nQigong \n            (chi kung)\n\n\n\n\n\n            Prescribed Drug Dictionary\n\n\n\n\n\n            Email our web master for  your suggestion (not for inquiry)\n\n\n\n\nBiochemistry Dictionary\n\n\n\n\n\n\nGeneral Online Library\n\n\n\n\nQigong classes\n\n\n\n\nFake \n            Email Warning\n\n\n\n\nResearch Librarian\n\n\n\n\nSearch\n\n\n\n\n\n\nQigong classes\n\n\n\n\n\n\n\n\n\nHome\n\n\n\n\n\n            Weather Report\n\n\n\n \n\n\nDisclaimer\n\n\n\n\n\n\n\n\n\n\n\n\n\n\n\n\n\n\n\n\n\n\n\n\n\n\n\nLast \n        update: Sept 10,  2013;  9 \n        a.m. \n        LAH\n\n\n\n\n\n\n\n\n\n\n\n\n",
        "original_url": "http://alternativehealing.org/wei_ling_xian.htm"
    },
    {
        "Names": {
            "Name": [
                "fu zi",
                "chuan wu",
                "tian xiong",
                "bai fu zi"
            ],
            "Pharmaceutical": [
                "Radix Aconiti Lateralis Preparata"
            ],
            "Biological": [
                "Aconitum carmichaeli Debx.",
                "Aconitum coreanum (Lėvl.) Raipaics",
                "Aconitum kusnezoffii Reichb.",
                "Typhonium giganteum Engl."
            ],
            "Common": [
                "aconite"
            ],
            "Other name": [],
            "Chinese": [
                "附子",
                "川烏",
                "天雄",
                "白附子"
            ],
            "Pronunciation in Korean": [
                "puja"
            ],
            "Pronunciation in Japanese": [
                "bushi"
            ],
            "Pronunciation in Cantonese": [
                "fu6 zi3"
            ],
            "Pinyin Pronunciation": []
        },
        "Type": "Herb",
        "Geography": [
            "Sichuan",
            "Shaanxi"
        ],
        "Properties": [
            "acrid",
            "hot",
            "toxic"
        ],
        "Meridians": [
            "Heart",
            "Kidney",
            "Spleen"
        ],
        "Maladies Treated": [
            "sweating profusely with body temperature dropping",
            "muscle spasm in cholera",
            "instant sweating, afraid of cold in cases of yangxu (yang deficient)",
            "pain and cold in chest and abdomen",
            "chronic diarrhea due to pixu (spleen deficient)",
            "chronic muscle or joint pain due to wind cold dampness",
            "tightness and pain in joints and muscles",
            "edema and coldness in the lower legs due to shenyangxu (kidney yang deficient)"
        ],
        "Medical Function": [
            "sedative effect",
            "analgesic effect",
            "anti inflammatory effect",
            "anti cancer effect",
            "heart stimulating effect"
        ],
        "Dosage": "1.5 to 12 g per day. If using large dosage, boil this herb first before adding other herbs to lessen the toxicity.",
        "Samples of Formulae": "For weakness with shenyangxu syndrome: jin gui shen qi wan.\nFor cardiac exhaustion: si ni tang.",
        "Contraindications": "This is a very toxic herb, especially in raw form. Do not use if the syndrome is not cold and weak. Ingesting it is fatal if it is re jue syndrome. Not to use in case of pregnancy. Not compatible with ban xia, gua lou, Large dosage may damage kidney and liver.",
        "Research": "The acute oral toxicity of aconitine in rats was significantly reduced by paeoniflorin [1].",
        "Notes": "Today many fu zi growers use a speed up method in processing the herb, rendering it not very effective. Many practitioners avoid using them. Usually, the translucent and clear and beautiful looking slices of the herb are the ones to avoid. According to preparation processes, the end products are: yan fu zi, hei shun pian, bai fu pian (not bai fu zi). Bai fu zi is from the root of Typhonium giganteum Engl. It is mainly used in Bell's Palsy and does not have the effect of increasing kidney yang or alleviating cold like chuan fu zi. Now, the names chuan wu and fu zi are used interchangeably in most herb stores. Tian xiong is fu zi or cao wu that is long and thin and is also called bai mu.",
        "Chemical Ingredients": [
            "hypaconitine",
            "aconitine",
            "mesaconitine",
            "talatisamine",
            "chuan-wu-base A",
            "chuan-wu-base B",
            "carmichaeline",
            "atisines",
            "aminophenols",
            "demethylcoclaurine (higenamine)"
        ],
        "References": [
            "[1] J Ethnopharmacol. 2012 Jun 1;141(2):701-8. doi: 10.1016/j.jep.2011.09.005. Epub 2011 Sep 10.",
            "[2] Hum Exp Toxicol. 1995 Jun;14(6):489-93."
        ],
        "Further Reading": [],
        "Original Text": "fu zi, Complementary and Alternative Healing UniversityComplementary and Alternative Healing University   中藥詞典                 Chinese Herb Dictionary      Search this site     在本網站找資料Search this siteList of Health ProblemsChinese Herb DictionaryQigongTraditional Chinese Medicine (TCM)AcupuncturePrescribed Drug DictionaryBiochemistry DictionaryLecture SlidesResearch LibrarianGeneral Online LibraryResearch SitesViagraMassage/AcupressureHypnotherapyTell us what you wantNotify Changes & New Information　　fu zi 附子;   chuan wu 川烏；tian xiong 天雄Translated by: Joe Hing Kwok Chu 朱興國編譯     (in English and Chinese 中英文)Click here to see picture of fu zi. 按此看圖。bai fu zi 白附子 (Typhonium giganteum Engl.) is another herb.Pharmaceutical name:英文药名：Radix  Aconiti  Lateralis PreparataBiological name:拉丁學名：Aconitum carmichaeli Debx.(fu zi, chuan wu 附子﹐川烏)Aconitum coreanum (Lėvl.) Raipaics  ( 黃花烏頭(關白附) )Aconitum kusnezoffii Reichb.  (草烏 )Pron. in Japanese:日語發音：bushiPron. in Korean:韓語發音：pujaPron. in Cantonese:粤語發音：fu6 zi3Common Name:aconiteDistribution:分佈：Sichuan, Shaanxi四川，陕西。Properties (characteristics)﹕性味﹕acrid, hot, toxic辛﹐熱﹐有毒。Channels (meridians) entered:歸經﹕heart, kidney , spleen心﹐腎﹐脾。Actions & Indications:主治：to restore yang, to improve fire, and to disperse cold.Being used in:  sweating profusely with body temperature dropping; muscle spasm in cholera; instant sweating, afraid of cold in cases of yangxu (yang deficient); pain and cold in chest and abdomen, chronic diarrhea due to pixu (spleen deficient), chronic muscle or joint pain due to wind cold dampness, tightness and pain in joints and muscles; edema and coldness in the lower legs due to shenyangxu (kidney yang deficient).大 汗 亡 陽 ， 四 肢 厥 逆 ; 霍 亂 轉 筋 ;陽 虛 畏 寒 自 汗 , 心 腹 冷 痛 ; 脾 虛久泄;風 寒 濕 痺 ， 拘 攣 疼 痛 ; 腎 陽 不 足 以致 腳 氣 ，水 腫 等  。　將附片用細砂炒炮，研細粉備用。凡遇身涼脈絕的垂危病人，急將附片粉5克開水沖服，與此同時另用復方煎劑回陽固脫，益氣救急，這是治療急証的有效方法 (《長江醫話》\"附子煎藥方法談\") 。Medical Function:藥理﹕Medical Function:sedative effectanalgesic effectanti inflammatory effectanti cancer effectheart stimulating effect藥理﹕鎮痛鎮靜抗癌腫抗炎強心Chemical ingredients:hypaconitine次烏頭鹼aconitine烏頭鹼mesaconitine中烏頭鹼talatisamine人血草鹼chuan-wu-base A川烏鹼甲chuan-wu-base B川烏鹼乙carmichaeline卡米鹼atisines阿替生aminophenols氨基酚demethylcoclaurine (higenamine)去甲烏頭鹼　　Dosage:用量﹕1.5 to 12 g per day. If using large dosage, boil this herb first before adding other herbs to lessen the toxicity..五分至三錢。如用大劑量，先煎可減低毒性。*Samples of formulae:For weakness with shenyangxu syndrome: jin gui shen qi wanFor cardiac exhaustion: si ni tangshu jin li an san 舒筋立安散腎陽虛者用： 金櫃腎氣丸心臟衰竭用： 四逆湯Modern Research:The acute oral toxicity of aconitine in rats was significantly reduced by paeoniflorin[1].在大鼠口服烏頭鹼的激烈毒性反應被芍藥甙懸著地減低.[1]Cautions:注意﹕This is a very toxic herb, especially in raw form.When using large dosage, to lessen toxicity, soak herb in water till thoroughly wet and simmer herb in water for 4 to 6 hours. But, simmering the herb for long time also can reduce it cardiac stimulating effect.Do not use if the syndrome  is not cold and weak. Ingesting it is fatal if it is  re jue syndrome. *Not to use in case of pregnancy.  Not compatible with ban xia, gua lou,Large dosage may damage kidney and liver. [2]附子有大毒。用大劑量時，可先將附子以水浸透﹐慢火煎4 ~ 6 小時﹐以減低毒性。但煎久後， 會降低其强心作用。凡非虛寒證﹐寒濕證者忌用（陰虛陽盛或假寒真熱﹐陰虛內熱者）熱厥入咽即斃*﹐孕婦忌服。 反半 夏﹐瓜蔞﹐白 蘞﹐白芨﹐貝 母，畏犀角。 如以生品外用，皮膚潰破者忌用。大劑量可能損壞腎臟與肝臟。【2】[1] J Ethnopharmacol. 2012 Jun 1;141(2):701-8. doi: 10.1016/j.jep.2011.09.005. Epub 2011 Sep 10.[2] Hum Exp Toxicol. 1995 Jun;14(6):489-93.*Today many fu zi growers are using a speed up method in processing the herb and render it not very effective. Many practitioners are avoid using them. Usually the translucent and clear and beautiful looking slices of the herb are the ones to avoid.*近代不少種附子的農家為了减 短附子上市時間，用速成處理加工法，其成品效力 大减，以致很多中醫避免用附子。一般半透明，樣子好看的附子片，可能是用速成加工的。According to the preparation processes, the end products are:yan fu zi, 鹽附片hei shun pian, 黑順片bai fu pian 白附片 (not bai fu zi).Bai fu zi is from the root of Typhonium giganteum Engl. It is mainly being used in Bell's Palsy. It does not has the effect of increasing kidney yang in alleviating cold like chuan fu zi.Now, the name chuan wu and fu zi are being used interchangeably in most of the herb stores.Tian xiong (天雄) is fu zi or cao wu that are long and thin. It is also call bai mu (白幕).　川烏，與附子來自同一植物，性味功用均相近。現在藥房中已不分開。天雄: 異名白幕。為附子或草烏頭之形長而細者。 　根據炮制加工工藝不同﹐產品有﹕“鹽附子”﹐“黑 顺片”和“白附片”三種。白附子是另外一種植物。其學名為 Typhonium giganteum Engl. 。其性能祛風燥痰，偏用於頭面風痰之疾，如顏面神經麻痹口眼歪斜（吊線風）等。白附子無助腎陽的作用。其不同於 川附子。川附子能助腎陽﹐而有回陽逐寒作用。 按此看白附子篇。手足厥逆:  又稱厥冷,是指四肢由於手足冷至肘,膝的症狀。一般冷至 手腕,足踝的稱手足厥冷;冷至肘,膝的手足厥逆。熱厥症状：神昏惊悸，身熱氣粗，汗出如油，手足厥冷， 脉洪大而数或脉伏；寒厥症状：大汗淋漓，畏寒厥冷， 氣微神昧，面白唇青， 脉散大無倫，或沉 细欲绝。附子應用注意：*使用制附子小劑量(15-20克)，不需先煎久煎，與它藥同煎3O分鐘即可，經過臨床應用，\"未發現中毒現象，而且療效較好。\"  當然大劑量使用時，仍以先煎久煎為好 (《中醫雜志》87年12期) 。編者按：久煎後其 强心有效成份降低。    search this siteProblems with website? Please Click here for comment. (Not for inquiry )    Click here for inquiryCopyright Notice 按此看關於版權問題A manuscript... writing, translating and proofreading  in progressSponsors' Ads by Google 以下為谷歌 所提供之廣告 List of Health ProblemsChinese Herb DictionaryToxicity of Some HerbsSide Effect of Some HerbsHerbs that can be toxic to kidneysTraditional Chinese Medicine　TCM Diagnosis　Samples of FormulaeTerms of Traditional Chinese MedicineAcupuncturecopy right　版權所有Qigong (chi kung)Prescribed Drug DictionaryEmail our web master for  your suggestion (not for inquiry)Biochemistry DictionaryGeneral Online LibraryQigong classesFake Email WarningResearch LibrarianSearchQigong classesHomeWeather ReportDisclaimerLast update: Jan 13, 2014; 10 p.m. LAH　  ",
        "original_url": "http://alternativehealing.org/fu_zi.htm"
    }
]