[
  {
    "Names": {
      "Name": ["zi jiang"],
      "Pharmaceutical": ["Rhizoma zingiberis purpurei"],
      "Biological": ["Zingiber purpureum Roscoe", "Zingiber cassumunar Roxb."],
      "Chemical": [],
      "Common": [
        "English: Cassumunar ginger",
        "Thai: Plai",
        "Indonesian: Panglai (Sunda), bengle (Jawa), pandhiyang (Madura); mugle, bungle, baglai, baniai, banglai, bunglai; bangle; kunit bolai, kunyit bolai (Sumatera); banggele (Bali); bale, panini, manglai, manguiai, bangerei, wangelei, walegai; kukuniran, kukundiren, unin makei, unin pakei; bongle"
      ],
      "Other name": ["ka sa meng na jiang 卡薩蒙納薑"],
      "Chinese": ["紫薑"],
      "Pronunciation in Korean": [],
      "Pronunciation in Japanese": ["shikyou"],
      "Pronunciation in Cantonese": ["zi2 goeng1"],
      "Pinyin Pronunciation": []
    },
    "Type": "Herb",
    "Geography": [
      "Tropical Asia",
      "India",
      "Thailand",
      "Malaysia",
      "Indonesia",
      "Yunnan province of China"
    ],
    "Properties": ["fragrant", "slightly spicy", "slightly bitter"],
    "Meridians": ["liver", "spleen", "lung"],
    "Maladies Treated": [
      "pain relief after surgery",
      "muscle pain",
      "painful menstruation",
      "pain due to inflammation of the ears, throat, and nose",
      "fever (Indonesian folk medicine)",
      "headache (Indonesian folk medicine)",
      "cough (Indonesian folk medicine)",
      "stomachache (Indonesian folk medicine)",
      "common cold (Indonesian folk medicine)",
      "constipation (Indonesian folk medicine)",
      "jaundice (Indonesian folk medicine)",
      "worm parasites (Indonesian folk medicine)",
      "rheumatism (Indonesian folk medicine)",
      "obesity (Indonesian folk medicine)",
      "shrinking abdomen after giving birth (Indonesian folk medicine)"
    ],
    "Medical Function": [
      "anti-inflammatory effect",
      "antirheumatic",
      "analgesic",
      "antipyretic",
      "as tonic",
      "Inhibits cyclooxygenase-2 (COX-2)"
    ],
    "Dosage": "15 g (fresh root).",
    "Samples of Formulae": "For inflammation of the mucous membrane of the eye: zi jiang (Cassumunar ginger rhizome) 15 g and jiang huang (Turmeric) 15 g and Cumin 13 pieces. Wash and cut into pieces as needed. Boil with 1 cup water and render till half a cup is left. After the decoction has cooled down, filter and take orally.",
    "Contraindications": "Avoid mixing this herb with warfarin, hypertension drugs or cholesterol drugs. [2]\n避免與抗凝血素香豆素或與治血壓高西藥，或降膽固醇西藥同用。",
    "Research": "Anti-inflammatory effect of Zingiber cassumunar Roxb. and its active principles.\nZingiber cassumunar rhizome showed more than 30% increase of CYP3A4 inhibition [1]\nInhibits cyclooxygenase-2 (COX-2)\nhttp://www.ncbi.nlm.nih.gov/pmc/articles/PMC1312247/table/TU1/",
    "Notes": "CYP3A4: an enzyme that makes up part of the liver’s cytochrome P450 system. P450 is a system that metabolizes drugs and other foreign substances in the liver by means of enzymes (e.g., CYP3A4) that inhibit or promote metabolic reactions.\ncyclooxygenase-2, Cox-2 is an enzyme that makes prostaglandins that cause inflammation and pain and fever.",
    "Chemical Ingredients": {
      "Components": [
        "sabinene 27–34%",
        "γ-terpinene (G-terpinene) 6–8%",
        "α-terpinene 4–5%",
        "terpinen-4-ol 30–35%",
        "E-1-(3,4-dimethoxyphenyl)butadiene (DMPBD) 12–19%",
        "resin",
        "starch",
        "tannin"
      ]
    },
    "References": [
      "[1] J Ethnopharmacol. 2006 May 24;105(3):449-55. Epub 2006 Jan 18.",
      "[2] Proc (Bayl Univ Med Cent). 2000 October; 13(4): 421–423.",
      "http://www.ncbi.nlm.nih.gov/pmc/articles/PMC1312247/table/TU1/"
    ],
    "Further Reading": [],
    "Original Text": "Zingiber purpureum Roscoe, Complementary and Alternative Healing University\nComplementary and Alternative Healing University \n  中藥詞典                 Chinese Herb Dictionary      Search this site     在本網站找資料Search this siteList of Health ProblemsChinese Herb DictionaryQigongTraditional Chinese Medicine (TCM)AcupuncturePrescribed Drug DictionaryBiochemistry DictionaryLecture SlidesResearch LibrarianGeneral Online LibraryResearch SitesViagraMassage/AcupressureHypnotherapyTell us what you wantNotify Changes & New Information  zi jiang 紫薑    （in English and Chinese 中英文) by: Joe Hing kwok ChuPharmaceutical name:英文藥名﹕Rhizoma zingiberis purpureiBotanical name:學名﹕Zingiber purpureum RoscoeSynonim: Zingiber cassumunar Roxb.  Pron. in Japanese:日語發音﹕shikyouPron. in Korean:韓語發音﹕ Pron. in Cantonese:粵音﹕zi2 goeng1Other Names:別名﹕ka sa meng na jiang 卡薩蒙納薑Common Name:外文名﹕English: Cassumunar gingerThai: PlaiIndonesian: Panglai (Sunda), bengle (Jawa), pandhiyang (Madura).; mugle, bengle, bungle, baglai, baniai, banglai, bunglai,; bangle, kunit bolai, kunyit bolai (Sumatera), banggele (Bali),; bale, panini, manglai, manguiai, bangerei, wangelei, walegai,; kukuniran, kukundiren, unin makei, unin pakei, bangle, bongleDistribution:產地﹕Tropical Asia: India, Thailand, Malaysia, Indonesia, Yunnan province of China etc.Properties(characteristics)﹕性味﹕fragrant, slightly spicy, slightly bitter.香，微辛，微苦。Channels (meridians) entered: 歸經﹕liver, spleen and lung.肝﹐脾﹐肺經。Medical functions:藥理﹕anti-inflammatory effect抗炎Actions & Indications:主治﹕For pain relief after surgery; muscle pain, painful menstruation, pain due to inflammation of the ears, throat, and nose, as antipyretics. Usage in Indonesian folk medicine: for treatment of fever, headache, cough, stomachache, common cold, constipation; jaundice, worm parasites, rheumatism, obesity; for shrinking abdomen after giving birth and as tonic. 抗風濕、抗發炎、鎮痛解熱。常用於手術後疼痛控制、消炎、肌肉疼痛，經痛，耳鼻喉發炎引起的疼痛。 印尼民間用於治療發熱，頭痛，咳嗽，胃痛，感冒，便秘，黃疸，寄生蟲，風濕，肥胖; 作生完孩子後之食補，產後收縮腹部。Chemical ingredients:化學 成份﹕sabinene 27-34% G-terpinene 6-8% α-terpinene 4-5% terpinene-4-ol 30-35% E-1-(3,4-dimethoxyphenyl)butadiene as DMPBD 12-19%resin, starch, tannin. 檜27-34％ G-松油烯（g-不旋松油精) 6-8％ a-萜烯4-5％ 萜品烯-4 - 醇的30-35％的 E-1-（3,4 - 二甲氧基苯基）丁二烯，即 DMPBD12-19％樹脂，澱粉，單寧。Dosage:用量﹕15 g (fresh root)Samples of formulae:處方舉例﹕For treatment of: Inflammation of the mucous membrane of the eye: zi jiang and jiang huang  15 g each and Cumin13 pieces of  , washed and cut into pieces as needed. Boiled with 1 cup water and render till half a cup is left. After the decoction has cooling down, filter and take orally..眼睛的粘膜發炎症： 紫姜，姜黃各15克，孜然13枚。 洗淨，切成片。加水1杯煎成半杯。放涼，過濾後內服..Modern Research:現代 研究﹕Anti-inflammatory effect of Zingiber cassumunar Roxb. and its active principles.Zingiber cassumunar rhizome showed more than 30% increase of CYP3A4 inhibition [1]Inhibits cyclooxygenase-2 (COX-2)http://www.ncbi.nlm.nih.gov/pmc/articles/PMC1312247/table/TU1/Toxicity & Cautions:毒素與禁忌﹕Avoid mixing this herb with warfarin, hypertension drugs or cholesterol drugs.[2]避免與抗凝血素香豆素或與治血壓高西藥，或降膽固醇西藥同用。 [1] J Ethnopharmacol. 2006 May 24;105(3):449-55. Epub 2006 Jan 18.[2] Proc (Bayl Univ Med Cent). 2000 October; 13(4): 421�423.CYP3A4: an enzyme that makes up part of the liver�s cytochrome P450 system. P450 is a system that metabolizes drugs and other foreign substances in the liver by means of enzymes (e.g., CYP3A4) that inhibit or promote metabolic reactions.cyclooxygenase-2, Cox-2 is an enzyme that makes prostaglandins that cause inflammation and pain and fever.Search this siteProblems with website? Please Click here for comment. (Not for inquiry )    Click here for inquiryCopyright Notice 按此看關於版權問題A manuscript... writing, translating and proofreading  in progressSponsors' Ads by Google 以下為谷歌 所提供之廣告 List of Health ProblemsChinese Herb DictionaryToxicity of Some HerbsSide Effect of Some HerbsHerbs that can be toxic to kidneysTraditional Chinese Medicine TCM Diagnosis Samples of FormulaeTerms of Traditional Chinese MedicineAcupuncturecopy right 版權所有Qigong (chi kung)Prescribed Drug DictionaryEmail our web master for  your suggestion (not for inquiry)Biochemistry DictionaryGeneral Online LibraryQigong classesFake Email WarningResearch LibrarianSearchQigong classesHomeWeather ReportDisclaimerLast update: Dec 2, 2013; 11:59 a.m. LAH   \n",
    "original_url": "http://alternativehealing.org/Zingiber_purpureum.htm"
  },
  {
    "Names": {
      "Name": ["man tuo luo", "angle's trumpet"],
      "Pharmaceutical": ["Flos Daturae"],
      "Biological": [
        "Datura stramonium L. (歐曼陀羅)",
        "Datura suaveolens (大花曼陀羅)",
        "Datura sanguinea Ruiz (紅花曼陀羅)",
        "Datura metel L. (白曼陀羅)",
        "Datura tatula L. (紫花曼陀羅)",
        "Datura innoxia mill (毛曼陀羅)"
      ],
      "Chemical": [],
      "Common": [
        "Jimson weed",
        "thorn apple",
        "angel's trumpet",
        "devil's trumpet",
        "Jamestown weed",
        "Downy thorn apple"
      ],
      "Other name": [
        "nan yang jin hua 南洋金花",
        "shan qie zi 山茄子",
        "feng qie zi 鳳茄花",
        "guangdong nao yang hua 廣東鬧洋花 (not the same as Rhododendron molle G. Don)",
        "feng qie hua 風茄花"
      ],
      "Chinese": [
        "曼陀羅",
        "歐曼陀羅",
        "大花曼陀羅",
        "紅花曼陀羅",
        "白曼陀羅",
        "紫花曼陀羅",
        "毛曼陀羅"
      ],
      "Pronunciation in Korean": ["mantara"],
      "Pronunciation in Japanese": ["kalu-attana"],
      "Pronunciation in Cantonese": ["maan4 to4 lo4"],
      "Pinyin Pronunciation": ["man tuo luo"]
    },
    "Type": "Herb",
    "Geography": ["China (Jiangsu, Guangdong, Zhejiang, Anhui)"],
    "Properties": ["Very toxic"],
    "Meridians": [],
    "Maladies Treated": ["Rheumatoid arthritis (leaves)"],
    "Medical Function": [
      "The active ingredient scopolamine possesses the anesthesia effect, relaxes muscles, and inhibit secretion of sweat.",
      "Flowers: anaesthesia, sedative, inducing sleep.",
      "Leaves: used in rheumatoid arthritis.",
      "Seeds: promoting blood circulation, ridding of pain, dispels wind (袪風)."
    ],
    "Dosage": "Oral: 0.3–0.6 g. Also used as cigarettes several times per day but not over 1.5 g per day. External application: wash with decoction using appropriate amount or make into paste and apply.",
    "Samples of Formulae": "",
    "Contraindications": "The whole plant is toxic, especially the seeds. Toxicity is caused by the atropine type of alkaloids. Clinical symptoms include: dry mouth, dry tongue, difficulty in swallowing, excitement, hallucination, flushing without sweat, dilation of pupils, vomiting, dizziness, manic and delirium. Late-stage symptoms include slowing down in breathing, rising body temperature but with cold extremities, spasm, coma and even death.\nLarge dosages and/or long term usage can be toxic to kidneys.\nThe antidote to atropine is physostigmine or pilocarpine.",
    "Research": "",
    "Notes": "Man tuo luo (曼陀羅) flower can inhibit sweat gland secretion; therefore the anesthetic prepared from this flower was called “蒙汗藥” in ancient times.\n“鬧洋花” is the flower of Rhododendron molle G. Don; note that the listing “廣東鬧洋花 (not the same as Rhododendron molle G. Don)” appears separately under Other Names.",
    "Chemical Ingredients": [
      "Primary tropane alkaloids: atropine, scopolamine, hyoscyamine, apoatropine, daturine, tigloidine.",
      "Additional constituents listed: scopoletin, 曼陀蘿鹼, skimmianine, 2,6-dihydroxyhoscyamine, 紅古豆鹼, 7-羟基-3,6-二惕各酰氧托院.",
      "Seeds and flowers contain the highest concentration of alkaloids, but all parts of the plant are active.",
      "Total alkaloid content is highest during the maturing period of the flowers and rapidly decreases when the seeds are matured.",
      "Seeds also contain hemaglutinin."
    ],
    "References": [],
    "Further Reading": [],
    "Original Text": "\n\n\nman tuo luo, angle's trumpet, Complementary and Alternative Healing University     \n現代中藥辭典\n\n\n\n\n\n\n\n\nComplementary and Alternative Healing\nUniversity\n Home\n         中 \n        藥詞典\n\n\n\n\n\n\n\n\n\n\n\n\n\n\n\n\n\n\n\n\n\n\n\n\n\n                  Search this site powered by\n                  \n                  FreeFind\n\n\n\n\n\n\n\n\n\n\n\n\n\nSearch this site\n\n\n\n\n\n\nList \n        of Health Problems\n\n\n\n\n\n\nChinese \n        Herb Dictionary\n\n\n\n\n\n\nQigong\n\n\n\n\n\n\n\n        Traditional Chinese Medicine (TCM)\n\n\n\n\n\n\n\n        Acupuncture\n\n\n\n\n\n\n\n        Prescribed Drug Dictionary\n\n\n\n\n\nBiochemistry \n        Dictionary\n\n\n\n\n\n\nLecture Slides\n\n\n\n\n\nResearch Librarian\n\n\n\n\n\n\nGeneral \n        Online Library\n\n\n\n\n\n\nSearch this site\n\n\n\n\n\n\nResearch Sites\n\n\n\n\n\n\n\n        Viagra\n\n\n\n\n\n\nMassage/Acupressure\n\n\n\n\n\n\nHypnotherapy\n\n\n\n\n\n\nTell us what you want\n\n\n\n\n\n\nNotify Changes \n        & New Information\n\n\n\n\n \n\n\n\n\n\n\n \n \nman tuo luo \n    \n\n\n曼陀 \n    羅  (in English and Chinese 中英文)\n \nTranslated \n    and edited\n    by: \n    Joe Hing kwok Chu\n \n\n\n\n\n\n        See other pictures\n\n\n\n\n\n\nPharmaceutical name:\n英文藥名﹕\n\nFlos Daturae\n\n\n\nBiological \n        name:\n拉丁文學名﹕\n\n\n\nDatura stramonium L. (歐曼 \n        陀羅)\n\nDatura suaveolens, (大 \n        花曼 \n        陀羅)\n\nDatura sanguinea Ruiz \n        (紅花曼陀羅)\n\nDatura metel L.(白曼陀羅)\n\nDatura tatula L. (紫花 \n        曼陀羅)\nDatura innoxia mill (毛曼陀羅)\n\n\n\n\nPron. in Japanese:\n日語發音﹕\n\nkalu-attana\n\n\n\nPron. in Korean:\n韓語發音﹕\n\n\n\nmantara\n\n\n\n Pron. \n        in Cantonese: \n粵音﹕\n\nmaan4 to4 lo4\n\n\n\nOther Names:\n別名﹕\n\n\nnan yang jin hua 南洋金花﹐shan qie zi 山茄子﹐feng qie \n        zi  鳳茄花﹐guangdong nao yang hua 廣東鬧洋花 (not the same as \n        Rhododendron molle G. Don) \n﹐feng qie hua 風茄花\n\n\n\nCommon Name:\n英文名﹕\n\nJimson \n        weed, thorn apple, angel's trumpet, devil's trumpet, Jamestown weed, \n        Downy thorn apple.\n\n\n\nDistribution:\n產地﹕\n\nMainly produced in Jiangsu, \n        Guangdong, Zhejiang, Anhui provinces of China\n主產江蘇， 廣東﹐浙江﹐安徽。\n\n\n\n\nProperties\n(characteristics)﹕\n性味﹕\n\nvery toxic\n有劇毒\n\n\n\n\nChannels (meridians) entered:\n \n歸經﹕\n\n\n\n\nMedical functions:\n藥理﹕\n \n\nThe active ingredient scopolamine \n        possesses the anesthesia effect, relaxes muscles, and inhibit secretion \n        of sweat.東莨菪鹼有麻醉作用，可使肌肉鬆馳，抑制汗腺分泌。\n\n\n\n\nActions \n        & Indications:\n主治﹕\n\nThe flowers are being used \n        in anaesthesia, as sedative and for inducing sleep. The leaves are being \n        used in rheumatoid arthritis. The seeds are being used in promoting blood \n        circulation and in ridding of pain.花可麻醉止痛﹐鎮 \n        靜和催眠;葉可治風濕痛;種子能行血﹐袪風等。\n\n\n\n\nChemical \n        ingredients:\n化學成份﹕\n\nPrincipal active biochemicals \n        are the primary tropane alkaloids: atropine, and scopolamine, hyoscyamine, \n        atropine, apoatropine, daturine,\n        tigloidine . The seeds and flowers contain the \n        highest concentration of alkaloids but all parts of the plant are active. \n        The total alkaloid is highest during the maturing period of the flowers \n        and lower when the seeds are matured. The seeds also contain hemaglutinin.\n其主要生物化學成份為顛茄烷生物鹼 (tropane \n        alkaloids)。 主要含東莨菪鹼 (scopolamine﹐scopoletin),莨 \n        菪鹼 (hyoscyamine)，其次有阿托品 (atropine),阿 \n        朴阿托品（apoatropine）,降 \n        阿托品,曼陀羅素 \n        （daturine）,惕 \n        各酰莨菪鹼（tigloidine）,曼 \n        陀蘿鹼,茵 \n        芋鹼 (skimmianine), \n        2，6-二 \n        惕莨菪鹼（2，6-dihydroxyhoscyamine）,紅 \n        古豆鹼和7-羟基-3，6-二 \n        惕各酰氧托院。總生物鹼含量開花末期最高，到種子成熟時迅速下降。從種子 還分出血球凝集素。 \n\n\n\n\nDosage:\n用量﹕\n\nTo take \n        orally: 0.3～0.6g. Also being used as cigarettes \n        for several times per day but not over 1.5 g per day.\nFor external application: wash with \n        decoction using appropriate amount or make into paste and apply.\n內服：0.3～0.6g；亦可作捲煙燃吸多次。但每 \n        日不超過1.5g。外用：煎水洗或研末調敷。\n\n\n\n\nSamples of formulae:\n處方舉例﹕\n\n \n\n\n\nModern \n        Research:\n現代研究﹕\n\n \n\n\nToxicity:毒 \n        素﹕\n\nThe whole plant is toxic, \n        especially the seeds. Its toxicity is caused by the atropin type of akaloids.\nClinical symptoms include: dry mouth, dry tongue, difficulty \n        in swallowing, excitement, hallucination, flushing but without sweat, dilation \n        of pupils, vomiting, dizziness, manic and delirium. The late stage symptoms \n        include slowing down in breathing, rising body temperature but with cold \n        extremities, spasm, coma and even death.\n\nLarge dosages and/or long term usage can \n        be toxic \n        to kidneys.\nThe\n        antidote to atropine is physostigmine \n        or pilocarpine\n大劑量或長期 \n        服用可能對腎 \n        臟有毒。\n全 \n        株植物含根,莖,葉,花皆含有毒素，尤其 種子毒性最強。\n其 \n        毒性作用主要是來自類似阿托平作用的生物 鹼。臨床症狀在初期會有口 \n        乾舌燥, 吞嚥困難,興奮, 幻覺, 皮膚潮紅無汗, 瞳孔散大及嘔吐, 眩暈, 狂躁, \n瞻妄等 \n        症狀。晚期會有呼吸慢, 體溫升高但手腳發冷﹐ \n        全身抽搐,昏迷，甚至死亡發生。\n大劑量或長期服用可能對腎臟有毒。\n解藥可用毛果芸香碱。\n\n\n\n\nCautions:\n禁忌﹕\n\nsee toxicity above.\n看上條﹕毒素\n\n\n\n註：曼 \n    陀羅花 \n    能抑制汗 \n    腺分泌，故古人将此花所制的麻醉药稱之為�蒙汗藥�。\n         \n    鬧洋花是杜鵑花科植物羊躑躅 Rhododendron molle G. Don 的花。\n Sponsors' Ads by Google 以下為谷歌所提供贊助者之廣告\n\n\n\n\n\n\n\n\n\nA manuscript... writing, translating and proofreading  in \n        progress\n \n\nProblems with website? Please \n\nClick \n        here for comment. (Not for inquiry )     \n        \n\n\nClick \n        here for inquiry \n\n \n\n\nCopyright Notice 按此看關於 版權問題\n\n\n\n\n\n\n            List of Health Problems\n\n\n\n\n\n            Chinese Herb Dictionary\n\n\n\n\n\nToxicity of Some Herbs\n\n\n\nSide Effect of Some Herbs\n\n\n\nHerbs that can be toxic to kidneys\n\n\n\n\n\n            Traditional Chinese Medicine\n\n\nTCM Diagnosis\n\n\nSamples \n            of Formulae\n\n\n\n\n\n            Terms of Traditional Chinese Medicine\n\n\n\n            Acupuncture\n\n\n\n\n\n\ncopy right\n \n\n\n版權所有\n\n\n\n\nQigong \n            (chi kung)\n\n\n\n\n\n            Prescribed Drug Dictionary\n\n\n\n\n\n            Email our web master for  your suggestion (not for inquiry)\n\n\n\n\nBiochemistry Dictionary\n\n\n\n\n\n\nGeneral Online Library\n\n\n\n\nQigong classes\n\n\n\n\nFake \n            Email Warning\n\n\n\n\nResearch Librarian\n\n\n\n\nSearch\n\n\n\n\n\n\nQigong classes\n\n\n\n\n\n\n\n\n\nHome\n\n\n\n\n\n            Weather Report\n\n\n\n    \n\nDisclaimer\n\n\n\n\n\n\n\n\n\nLast update: \nApril 22, 2013; 9:48 p.m. LAH\n \n\n\n\n\n\n\n\n\n\n",
    "original_url": "http://alternativehealing.org/man_tuo_luo.htm"
  },
  {
    "Names": {
      "Name": ["qian niu zi", "牽牛子"],
      "Pharmaceutical": ["Semen Pharbitidis"],
      "Botanical": [
        "Pharbitis nil (L.) Choisy",
        "Pharbitis purpurea (L.) Voigt (圓葉牽牛)",
        "Ipomoea nil (L.) Roth"
      ],
      "Chinese": [
        "牽牛子",
        "黑丑",
        "白丑",
        "二丑",
        "丑牛子",
        "黑牽牛子",
        "白牽牛子",
        "喇叭花",
        "圓葉牽牛"
      ],
      "Common": ["morning glory seeds"],
      "Other name": [
        "hei chou 黑丑",
        "bai chou 白丑",
        "er chou 二丑",
        "chou niu zi 丑牛子",
        "hei qian niu zi 黑牽牛子",
        "bai qian niu zi 白牽牛子",
        "la ba hua (trumptet flower) 喇叭花"
      ],
      "Pronunciation in Korean": ["kyonuja"],
      "Pronunciation in Japanese": ["kengoshi"],
      "Pronunciation in Cantonese": ["hin1 ngau4 zi2"],
      "Pinyin Pronunciation": ["qian niu zi"]
    },
    "Type": "Herb",
    "Geography": ["China (throughout; especially Liaoning)"],
    "Properties": ["Bitter", "Cold", "Toxic"],
    "Meridians": ["Lung", "Kidney", "Large Intestine"],
    "Maladies Treated": [
      "edema",
      "ascites",
      "constipation",
      "difficulty in urination",
      "berberi",
      "flatulence",
      "abundance of phlegm, cough, asthma",
      "abdomen pain with parasite"
    ],
    "Medical Function": [],
    "Dosage": "4.5 to 9 g in decoction. 0.3~1.5 g in powder form.",
    "Samples of Formulae": "For edema of limbs and ascites:\nName of formula: qian niu san (pu ji fang)\nComposition: qian niu zi (morning glory seed), mu tong (akebia stem), bai zhu (Atractylodes macrocephala rhizome), sang gen bai pi (mulberry root bark), mu xiang (costus root), rou gui (cinnamon bark), chen pi (tangerine peel).\nTreats: water swelling of limbs, dysuria with difficult urination, upward qi panting and shortness of breath.\n\nFor worm parasites:\nName of formula: qian niu san (Sheng's zhun sheng)\nComposition: qian niu zi (morning glory seed), da huang (rhubarb root and rhizome), bing lang (areca nut), xiong huang (realgar).\nTreats: parasite accumulation.",
    "Contraindications": "This is a strong herb. Using small amount can help bowel movements. Using large amount can cause heavy diarrhea. It can be used temporary for cough with abundance of phlegm and asthma but do not use for long time or in large amount. Do not use in cases pixu (spleen deficient), qixu (qi deficient) or during pregnancies.\nThe raw seed is toxic and its smell is pungent and strong, and its laxative effect is drastic. After stir frying, its toxicity is less and the laxative effect is mild. After stir frying, the herb is loose and brittle and easier to smash and easier to decoct to extract the effective ingredients.",
    "Research": "",
    "Notes": "",
    "Chemical Ingredients": {
      "Seeds": [
        "Palmitic acid (棕櫚酸)",
        "Gibberellin A3 (赤霉素甲3)",
        "Gibberellin A20, 26, 27 (赤霉素甲20, 26, 27)",
        "glucoside (配糖物)",
        "Pharbitic acid C, D (牽牛子酸丙, 丁)",
        "pharbitin (牽牛子甙)",
        "tiglic acid (順芷酸)",
        "nilic acid (尼裏酸)"
      ]
    },
    "References": [],
    "Further Reading": [],
    "Original Text": "\n\n\nqian niu zi, Complementary and Alternative Healing University\n\n\n\n\n\n\n\n\n\n\n\nComplementary and Alternative Healing University\n Home\n \n        現代中藥辭典\n\n\n\n\n\n\n\n\n\n\n\n\n\n\n\n\nSearch \n            this site\n\n\n\n\n\n\nList of Health Problems\n\n\n\n\n\n\nChinese Herb Dictionary\n\n\n\n\n\nQigong\n\n\n\n\n\n\nTraditional Chinese Medicine \n            (TCM)\n\n\n\n\n\n\nAcupuncture\n\n\n\n\n\n\nPrescribed Drug Dictionary\n\n\n\n\n\nBiochemistry Dictionary\n\n\n\n\n\nLecture \n            Slides\n\n\n\n\n\nResearch Librarian\n\n\n\n\n\n\nGeneral Online Library\n\n\n\n\n\n\nSearch\n\n\n\n\n\n\nResearch Sites\n\n\n\n\n\n\nViagra\n\n\n\n\n\n\nMassage/Acupressure\n\n\n\n\n\n\nHypnotherapy\n\n\n\n\n\nTell us \n            what you want\n\n\n\n\n\n\nNotify Changes & New Information\n\n\n\n\n　\n　\n　\n \n \n \n \n　\n \n \n \n \n \n \n　\n　\n \n \n \n \n　\n　\n　\n　\n　\n \n \n \n \n \n \n \n \n \n \n \n \n \n \n \n \n \n \n \n \n \n \n \n \n \n \n \n\n\n\n\n\n\n\n\n\n\n\n\n\n \nqian niu zi 牽牛子\n\n\nby: Joe Hing kwok Chu\n\n\n\n\nPharmaceutical \n            name:\n英文藥名﹕\n\nSemen Pharbitidis\n\n\n\nBotanical name:\n學名﹕\n\n\n\nPharbitis nil\n(L.) Choisy;\n\nPharbitis purpurea \n            (L.) Voigt (圓葉牽牛)\n\nIpomoea\nnil (L.) Roth\n\n\n\n\nPron. in Japanese:\n日語發音﹕\n\nkengoshi\n\n\n\nPron. in Korean:\n韓語發音﹕\n\nkyonuja\n\n\n\n\n\n            Pron. in Cantonese: \n粵音﹕\n\nhin1 ngau4 zi2\n\n\n\nOther Names:\n別名﹕\n\nhei \n            chou 黑 丑， bai chou 白丑，er chou 二丑，chou niu zi 丑牛子，hei qian niu zi 黑牽牛 \n            子，bai qian niu zi 白牽牛子，la ba hua (trumptet flower) \n喇叭花。\n\n\n\nCommon Name:\n英文名﹕\n\nmorning glory seeds\n\n\n\nDistribution:\n產地﹕\n\nthroughout China, especially \n            Liaoning.全國均有。 主產於遼寧。\n\n\n\n\nProperties\n(characteristics)﹕\n性味﹕\n\nbitter, cold, toxic.\n苦, 寒。有毒。\n\n\n\n\nChannels (meridians) \n            entered:\n \n歸經﹕\n\nlung, kidney, large intestine.\n入肺，腎 ，大腸經。\n\n\n\nMedical functions:\n藥理﹕\n \n\n \n\n\n\n\nActions & Indications:\n\n主治﹕\n\n\n\nedema\nascites\nconstipation\ndifficulty in urination\nberberi\nflatulence\nabundance of phlegm, cough, asthma\nabdomen pain with parasite\n\n \n\n水腫\n腹水，\n二便不利，\n腳氣,\n腹脹,\n痰壅氣滯，咳逆喘滿,\n蟲積腹痛.\n\n\n\n\n\n\nChemical ingredients:\n\n化學成份﹕\n\n\n\n\nPalmitic acid\n棕櫚酸\n\n\nGibberellin A3\n赤霉素甲3\n\n\nGibberellin A20, \n                26, 27\n赤霉素甲20 , 26, 27\n\n\nglucoside\n\n配糖物\n\n\n\nPharbitic acid C, \n                D\n牽牛 子酸丙， 丁\n\n\n\n\n                pharbitin\n牽牛子甙\n\n\n\n\n                tiglic acid\n\n順芷酸\n\n\n\n\n                nilic acid\n\n尼裏酸\n\n\n\n\n\n\nDosage:\n用 量﹕\n\n\n4.5 \n            to 9 g in decoction\n0.3 \n            ~1.5 g in powder form.\n入煎劑﹕4.5 \n            克 ~ 9 克。\n入粉劑﹕0.3~1.5克 \n            。\n\n\n\n\nSamples \n            of formulae:\n處方舉 例﹕\n\n\nFor \n            edema of limbs and escites:\nName \n            of formula: qian niu san (pu ji fang)\nComposition:\nqian \n            niu zi, mu tong, bai zhu, sang gen bai pi, mu xiang, rou gui, chen pi.\n \nFor \n            worm parasites:\nName \n            of formula: qian niu san (Sheng's zhun sheng)\nComposition:\nqian \n            niu zi, da huan, bing nang, xiong huang.\n牽牛散《普濟方》：牽牛子，木通，白朮，桑根白皮，木香，肉桂，陳皮。治水氣肢體浮腫，大小便澀， \n            上氣喘促。\n牽牛散《沈氏尊生》：牽牛子，大黃，檳榔，雄黃。治蟲積。\n\n\n\n\n\nModern Research:\n\n現代研究﹕\n\n \n\n\n\n\nToxicity & Cautions:\n\n毒素與禁忌﹕\n\nThis is a strong herb. \n            Using small amount can help bowel movements. Using large amount can \n            cause heavy diarrhea. It can be used temporary for cough with abundance \n            of phlegm and asthma but do not use for long time or in large amount. \n            Do not use in cases pixu \n            (spleen deficient), \nqixu (qi deficient)\nor during pregnancies.The raw seed \n            is toxic and it smell is pungent and strong, and its laxative effect \n            if drastic. After stir frying, it toxicity is less and the laxative \n            effect is mild. After stir frying, the herb is loose and brittle and \n            easier to smash and easier to decoct to extract the effective ingredients.\n牽牛子為峻下的藥品，少用\n            則通大便，多用則瀉下如水。於用治痰壅氣滯，咳 逆喘滿，則只宜暫用，不可久服。孕婦及\n脾虛 或 \n            氣虛 者忌服。\n生牽牛子有毒，氣味峻烈而瀉下力猛。炒牽牛子之毒性較小，瀉下作用較緩\n            和。且炒過後藥材質地變鬆脆，而易於粉碎和煎出有效成分\n\n\n\n　\n  Sponsors' Ads by Google \n        以下為谷歌所提供贊助者之廣告\n\n\n\n\n\n\nA manuscript... writing, translating and proofreading  \n            in progress\n\n\nClick here for inquiry\n \n\nCopyright Notice 按此看關於 \n            版權問題\n\n\n\n\n\nList of Health Problems\n\n\n\nChinese Herb Dictionary\n\n\n\n\nToxicity of Some \n                Herbs\n\n\n\nSide Effect of Some Herbs\n\n\n\nHerbs \n                that can be toxic to kidneys\n\n\n\n\nTraditional Chinese Medicine\n\n\nTCM Diagnosis\n\nSamples \n                of Formulae\n\n\n\n\nAcupuncture\n\n\n\n\n\ncopy right\n \n\n版權所有\n\n\n\nQigong \n                (chi kung)\n\n\n\nPrescribed Drug Dictionary\n\n\n\nEmail our web master for  \n                your suggestion (not for inquiry)\n\n\n\nBiochemistry Dictionary\n\n\n\n\n\nGeneral Online Library\n\n\n\nQigong classes\n\n\n\nLecture Slides\n\n\n\nResearch Librarian\n\n\n\nSearch\n\n\n\n\n\nQigong classes\n\n\n\n\n\n\n\n\nHome\n\n\n\nWeather Report\n\n\n\nDisclaimer\n\n\n\n\n\n\n\nLast update: \n            Dec 20, 2011; 12:14 a.m.\n            LAH\n\n\n\n\n\n\n\n\n\n\nSearch this site\n\n\n\n\n\n\n\n\n\n\n\n\n\n\n\n\n\n\n\n\n\n\n\n\n\n\n\n",
    "original_url": "http://alternativehealing.org/qian_niu_zi.htm"
  },
  {
    "Names": {
      "Name": ["tu bie chong"],
      "Pharmaceutical": ["Eupolyphaga seu Opisthoplatia"],
      "Biological": [
        "Eupolyphaga sinensis",
        "Opsithoplatia orientalis Burmeiter"
      ],
      "Chinese": ["土蟞蟲"],
      "Common": ["wingless cockroach", "eupolyphaga"],
      "Other name": [
        "Prescription names: jie chong 蟅蟲",
        "Prescription names: di bie chong 地鱉蟲",
        "Prescription names: tu bie chong 土鱉蟲",
        "Prescription names: tu yan 土元",
        "Di Bie (地鱉, Ben Jing)",
        "Tu Bie (土鱉, Bie Lu)",
        "Guo Jie (過街, Pi Ya)",
        "Bo Ji Chong (簸箕虫, Ben Cao Yan Yi)",
        "Ke Bo Chong (蚵蚾蟲, Xiu Zhen Fang)",
        "Di Bi Chong (地婢虫, Bao Shi Xiao Er Fang)",
        "Shan Zhang Lang (山蟑螂, Ben Cao Qiu Yuan)",
        "Di Wu Gui (地烏龜, Fen Lei Cao Yao Xing)",
        "Tu Yuan (土元, Zhong Yao Xing Xing Jing Yan Jian Bie Fa)",
        "Chou Chong Mu (臭蟲母, Hebei Yao Cai)",
        "Gai Zi Chong (蓋子蟲, Hebei Yao Cai)",
        "Tu Chong (土蟲, Jilin Zhong Cao Yao)",
        "Jie Jie Chong (節節蟲, Jiangsu Yao Cai Zhi)",
        "Ma Yi Hu (螞蟻虎, Jiangsu Yao Cai Zhi)"
      ],
      "Pronunciation in Korean": ["t'obyoch'ung"],
      "Pronunciation in Japanese": ["shachu"],
      "Pronunciation in Cantonese": ["tou2 bi1 cung4"],
      "Pinyin Pronunciation": [
        "tu bie chong",
        "jie chong",
        "di bie chong",
        "tu yan"
      ]
    },
    "Type": "Animal",
    "Geography": ["Jiangsu", "Anhui", "Henan", "Hubei", "Hunan", "Sichuan"],
    "Properties": ["salty", "cold", "slightly toxic"],
    "Meridians": ["liver", "heart", "spleen"],
    "Maladies Treated": [
      "Blood stasis with amenorrhea.\n\n癥瘕結塊 (zheng jia jie kuai) masses and aggregations.\n\n跌仆傷痛 (injuries from falls and impact) with pain.\n\n筋傷骨折 (tendon injury and bone fracture).\n\n腰部扭傷 (sprain in the loin/waist area)."
    ],
    "Medical Function": [],
    "Dosage": "4 to 12 g (4~12克).",
    "Samples of Formulae": "Being used in leukemia: shen zhu wan (參朮丸).",
    "Contraindications": "Do not use in cases of weak body or pregnancies.",
    "Research": "",
    "Notes": "",
    "Chemical Ingredients": [],
    "References": [],
    "Further Reading": [],
    "Original Text": "tu bie chong,Complementary and Alternative Healing UniversityComplementary and Alternative Healing University   中藥詞典                 Chinese Herb Dictionary      Search this site     在本網站找資料     Discussion FormSearch this siteList of Health ProblemsChinese Herb DictionaryQigongTraditional Chinese Medicine (TCM)AcupuncturePrescribed Drug DictionaryBiochemistry DictionaryLecture SlidesResearch LibrarianGeneral Online LibraryResearch SitesViagraMassage/AcupressureHypnotherapyTell us what you wantNotify Changes & New Information  tu bie chong 土蟞蟲   (in English and Chinese 中英文) by: Joe Hing kwok ChuPharmaceutical name:英文藥名﹕Eupolyphaga seu OpisthoplatiaZoological name:動物學名﹕Eupolyphaga sinensisOpsithoplatia orientalis BurmeiterPron. in Japanese:日語發音﹕shachuPron. in Korean:韓語發音﹕t'obyoch'ungPron. in Cantonese:粵音﹕tou2 bi1 cung4Other Names:別名﹕prescription names: jie chong  蟅蟲, di bie chong 地鱉蟲, tu bie chong 土鱉蟲, tu yan 土 元.處 方 名 ﹕ 蟅蟲、地鱉蟲、土鱉蟲﹐ 土 元 。按此看其他別名。Common Name:英文名﹕wingless cockroach, eupolyphagaDistribution:產地﹕Jiangsu, Anhui, Henan, Hubei, Hunan, Sichuan.江 蘇 ﹐  安 徽 ﹐  河 南 ﹐  湖 北 ﹐  湖 南 ﹐  四 川 等 地 。Properties(characteristics)﹕性味﹕salty, cold, slightly toxic.鹹﹐寒﹐有小毒 。Channels (meridians) entered: 歸經﹕liver, heart, spleen.肝 ﹐ 心 ﹐ 脾 。Medical functions:藥理﹕  Actions & Indications:主治﹕Forblood stasis, amenorrhea,  injuries of bones and muscles from impact, sprain in loin area.用於:血淤 經閉，癥瘕結塊 等症，跌仆傷痛，筋傷骨折，以及腰部扭傷等症。Chemical ingredients:化學成份﹕ Dosage:用量﹕4  to 12 g.4~12克 。Samples of formulae:處方舉例﹕Being used in leukemia: shen zhu wan用於白血病：參 朮丸Modern Research:現代研究﹕ Toxicity & Cautions:毒素與禁忌﹕Do not use in cases of weak body or pregnancies.體虛與 孕婦忌用。其他別名：地鱉(《本經》)， 土鱉(《別錄》)，過街(《埤雅》)，簸箕虫(《本草衍義》)，蚵蚾蟲(《 袖珍方》)，地婢虫(《鮑氏小兒方》)，山蟑螂(《本草求原》)，地烏龜(《分類草藥 性》)，土元(《中藥形性經驗鑒別法》)，臭蟲母 、蓋子蟲(《 河北藥材》)，土蟲(《 吉林中草藥》)，節節蟲、 螞蟻虎(《江蘇藥材志》)。   Search this siteProblems with website? Please Click here for comment. (Not for inquiry )    Click here for inquiryCopyright Notice 按此看關於版權問題A manuscript... writing, translating and proofreading  in progressSponsors' Ads by Google 以下為谷歌 所提供之廣告 List of Health ProblemsChinese Herb DictionaryToxicity of Some HerbsSide Effect of Some HerbsHerbs that can be toxic to kidneysTraditional Chinese Medicine TCM Diagnosis Samples of FormulaeTerms of Traditional Chinese MedicineAcupuncturecopy right 版權所有Qigong (chi kung)Prescribed Drug DictionaryEmail our web master for  your suggestion (not for inquiry)Biochemistry DictionaryGeneral Online LibraryQigong classesFake Email WarningResearch LibrarianSearchQigong classesHomeWeather ReportDisclaimerLast update: Mar 26, 2014; 850 a.m. LAH   ",
    "original_url": "http://alternativehealing.org/tu_bie_chong.htm"
  },
  {
    "Names": {
      "Name": ["tu si zi"],
      "Pharmaceutical": ["Semen Cuscutae Chinensis"],
      "Biological": ["Cuscuta chinensis Lam.", "C. japonica Choisy"],
      "Chemical": [],
      "Common": ["English: cuscuta; Chinese dodder seed (英文名)"],
      "Other name": [],
      "Chinese": ["菟絲子"],
      "Pronunciation in Korean": ["tosacha"],
      "Pronunciation in Japanese": ["toshishi"],
      "Pronunciation in Cantonese": ["tou3 si1 zi2"],
      "Pinyin Pronunciation": []
    },
    "Type": "Herb",
    "Geography": [
      "Jiangsu",
      "Liaoning",
      "Jiling",
      "Hebei",
      "shandong",
      "Henan provinces of China"
    ],
    "Properties": ["acrid (辛)", "sweet (甘)", "neutral (平)"],
    "Meridians": ["kidney", "liver"],
    "Maladies Treated": [
      "shenyangxu",
      "pixu",
      "neurasthenia",
      "habitual miscarriage",
      "mouth bitterness and dry thirst (口苦躁渴)",
      "impotence (陽痿)",
      "spermatorrhea/seminal emission (遺精)",
      "hematuria (血尿)",
      "dribbling urination (小便淋瀝)",
      "loose stool (大便溏薄)"
    ],
    "Medical Function": [
      "Tonifies kidneys, liver and spleen; improves yin; calms fetus",
      "Anti-aging effect. [1]",
      "Hepatoprotective effects in carbon tetrachloride injury in mice: 20% water decoction by oral administration at 50 g crude drug/kg body weight lowered blood lactate, pyruvate, and SGPT, and increased glycogen and adrenal ascorbic acid. [2]",
      "Yang-supporting and enhancement of sexual vitality: 20% water decoction 0.5 ml/day orally improved yang deficiency symptoms in mice; culture medium containing tu si zi water decoction at 0.5%, 1.0%, and 2.0% enhanced drosophila sexual vitality. [2]",
      "Increases non-specific resistance: water decoction extended weight-loaded swimming time in mice and enhanced hypoxic tolerance under normal pressure. [2]",
      "Other roles: anti-tumor, anti-viral, anti-inflammatory, anti-infertility, lapactic, and central nervous system suppression. [2]"
    ],
    "Dosage": "9 to 15 g.",
    "Samples of Formulae": "For improving sperm quality: Wu Zi Yan Zong Wan (Five-Seed Progeny Pill).\n\nFor treatment of threatened abortion: Composition: Tu Si Zi (Chinese dodder seed) + Xu Duan (teasel root / Dipsaci radix) + E Jiao (donkey-hide gelatin) + Dang Shen (codonopsis root) + Bai Zhu (white atractylodes rhizome). Treated 110 patients. Take herb once a day for 10 days. Effective rate: 96.36%.\n\nFor treatment of impotence: Tu Si Zi (Chinese dodder seed), She Chuang Zi (cnidium fruit), Wu Wei Zi (schisandra fruit), equal amounts. Grind into powder and mix with cooked honey. Form pills the size of a soybean. Take 30 pills each time, 3 times a day. [3]",
    "Contraindications": "not to use in blood deficient and yinxu with fire. 血虛及火熱者忌服。“腎家多火，強陽不痿，大便燥結者忌菟絲子。”《 本草從新 》",
    "Research": "Anti-aging effect. [1]\n\nHepatoprotective effects: tu si zi20% water decoction on carbon tetrachloride injury in mice: providing orally 50g crude drug / kg body weight, can lower the blood lactate, pyruvate, and SGPT decline, and can increase glycogen adrenal ascorbic acid significantly, and shows the protective activity of damaged liver. [2]\n\nYang and enhance sexual vitality role: 20% the tu si zi water decoction of 0.5ml /  day orally, corrected yang deficiency symptoms in mice. Culture medium containing the tu si zi water decoction of three concentration 0.5,1. O and 2.O% can enhance the drosophila (fruit flies) sexual vitality. [2]\n\nIncrease the role of non-specific resistance: tu si zi water decoction can extend swimming time of mice, enhanced hypoxic tolerance under normal pressure, improve its non-specific resistance. [2]\n\nOther role: tu si zi: anti-tumor, anti-viral, anti-inflammatory, anti-infertility, lapactic, and suppress the central nervous system. [2]",
    "Notes": "Identification test: Take a small amount of this product and soak in sufficient distilled water; the soak becomes yellow, and transparent semi-mucilage can be seen on the surface of the seeds; when rubbed it feels sticky and smooth. Boiling makes it easy to rupture; after rupture a white spiral shape is exposed, resembling silk extrusion. This is genuine tu si zi.\n\nAdulterant note: Counterfeits use “茛菪子” (seeds of a Solanaceae plant) to pass as tu si zi. The counterfeit (dried mature seeds of a Solanaceae plant) are ovate or slightly kidney-shaped, slightly flattened, with a protruding hilum. The surface is grayish-yellow or brownish-yellow; the seed coat is rough with densely raised striations. Odorless and slightly pungent. Using the same identification method, soaking a small amount of seeds in water does not change color.",
    "Chemical Ingredients": {},
    "References": [
      "[1] 首席医学网，2005年10月09日 14:47:05",
      "[2] Zhong Hua Ben Cao 中華本草",
      "[3] Qian Jin Fang 千金方；中國時報 第39版 2000.3.15(三)",
      "[1] 殷林茂，等•中西醫結合治療幼小子宮46例•河北中醫1992; 14(4):40 Yan Linmao, ed. Integrating Chinese and western medicine to treat Infantile uterus, Herbal Journal of Traditional Chinese Medicine1992;14(4):40.*"
    ],
    "Further Reading": [],
    "Original Text": "tu si zi, Complementary and Alternative Healing University  現代醫藥詞典\n\n\n\nComplementary and \n    Alternative Healing University\n    \n \n\n\n\n\n\n中藥詞典                 \n    Chinese Herb Dictionary     \n     Search this \n    site     \n\n在本網站找資料\n\n\n\n\n\n\n\n\n\n\n\n\n\n\nSearch this \n        site\n\n\nList \n        of Health Problems\n\n\n\n\n\n\n        Chinese Herb Dictionary\n\n\n\n\n\nQigong\n\n\n\n\n\n\n        Traditional Chinese Medicine (TCM)\n\n\n\n\n\n\n        Acupuncture\n\n\n\n\n\n\n        Prescribed Drug Dictionary\n\n\n\n\n\nBiochemistry Dictionary\n\n\n\n\n\nLecture Slides\n\n\n\n\n\nResearch Librarian\n\n\n\n\n\n\n        General Online Library\n\n\n\n\n\nResearch \n        Sites\n\n\n\n\n\n\n        Viagra\n\n\n\n\n\n\n        Massage/Acupressure\n\n\n\n\n\nHypnotherapy\n\n\n\n\n\nTell us what you want\n\n\n\n\n\nNotify Changes \n        & New Information\n\n\n\n　\n\n\n\n\n　tu si zi   菟絲子by: Joe Hing Kwok Chu　\n\nPharmaceutical name:英文药名：Semen Cuscutae ChinensisBiological name:拉丁名：Cuscuta chinensis Lam.,C. japonica ChoisyPron. in Japanese:日語發音：toshishiPron. in Korean:8韩語發音：tosachaPron. in Cantonese: 粤語發音：tou3  si1  zi2Common Name:英文名：cuscuta, Chinese dodder seedDistribution:分佈：Jiangsu, Liaoning, Jiling, Hebei, shandong, Henan provinces of China.江蘇、遼寧、吉林、河北、山東、河南省等地區。Properties (characteristics)：性味：acrid, sweet, neutral辛，甘，平。Channels (meridians) entered:歸經：kidney, liver肝，腎Actions & Indications:主治:tonifies kidneys, liver and spleen, improve yin; for shenyangxu, pixu, neurasthenia, calming fetus, for habitual miscarriage.口苦躁渴，陽痿，遺精，血尿，小便淋瀝，大便溏薄，神經衰弱，習慣性流產。Medical Function:To be editedAnti-aging effect. [1]Hepatoprotective effects: tu si zi20% water decoction on carbon tetrachloride injury in mice: providing orally 50g crude drug / kg body weight, can lower the blood lactate, pyruvate, and SGPT decline, and can increase glycogen adrenal ascorbic acid significantly, and shows the protective activity of damaged liver. [2]  Yang and enhance sexual vitality role: 20% the tu si zi water decoction of 0.5ml /  day orally, corrected yang deficiency symptoms in mice. Culture medium containing the tu si zi water decoction of three concentration 0.5,1. O and 2.O% can enhance the drosophila (fruit flies) sexual vitality. [2]  Increase the role of non-specific resistance: tu si zi water decoction can extend swimming time of mice, enhanced hypoxic tolerance under normal pressure, improve its non-specific resistance. [2]  Other role: tu si zi: anti-tumor, anti-viral, anti-inflammatory, anti-infertility, lapactic, and suppress the central nervous system. [2]具有延緩衰老作用。[1]保肝作用：菟絲子20%的水煎劑給四氯化碳損傷小鼠灌胃，50g生藥/kg體重，能使血液中增加的乳酸、丙酮酸及 SGPT 下降，而使下降的肝糖元和腎上腺抗壞血酸上升，有顯著的保護肝損傷活性。[2]  助陽和增強性活力作用：20%菟絲子水煎劑 0.5ml/隻/天 灌胃，對陽虛小鼠的症狀有一定的恢復作用。用含菟絲子水煎劑的培養基培養，在0.5、1.O和2.O%三個濃度下均能提高果蠅的性活力。[2]  增加非特異性抵抗力作用：菟絲子水煎劑，能延氏小鼠負重游泳時間，增強小鼠在常壓下的耐缺氧能力，提高其非特異性抵抗力。[2]  其它作用：菟絲子尚具有抗腫瘤、抗病毒、抗炎、抗不育、致瀉、及抑制中樞神經系統的作用。[2]Chemical ingredients:化学成分：to be loadedDosage:9 to 15 g.Samples of formulae:\n\n\n        For improving sperm quality: wu zi yan zong wan\n\nFor treatment of threatened abortion: Prescription:  tu zi zi , xu duan, e jiao, dang shen, bai zhu. Treated 110 patients. Take herb once a day for 10 days. Effective rate: 96.36%\n\n\nFor treatment of impotence: \n\n        tu si zi, \n        she chuang zi, \n wu wei zi, equal amount, make into \n        powder and mix with cooked honey. Make  into pills like size of \n        soybean. Take 30 pills each time, 3 times a day. [3]\n\n\n　\n\n\n        增加精子質量：五子衍宗丸\n\n治療先兆流產的作用：菟絲子與續 斷、阿膠、黨 參、白 朮等配伍，治療先兆流產110例，病人每日服藥一次，共10天，總有效率為96.36%。[1]\n\n治陽痿：菟絲子、蛇床子、五味子各等分。上三味，末之，蜜丸如梧子。飲服三十丸，日三。《方源：千金方 》\n\n\nModern Research:to be loadedCautions:not to use in blood deficient  and yinxu with fire. 血虛及火熱者忌服。“腎家多火，強陽不痿，大便燥結者忌菟絲子。”《 本草從新 》[1] 首席医学网      2005年10月09日 14:47:05[2]   Zhong Hua Ben Cao 中華本草\n[3] \n\nQian Jin Fang 千金方中國時報  第39版  2000.3.15(三)鑑定試驗方法：取本品少量，加準水適量浸泡，浸泡呈黃色，其種子表面可見透明的半粘液，用用捻有粘滑感。煮之易破裂，破裂後露出白色卷旋狀﹐形如吐絲。此才是真品菟絲子。偽品是用「茛菪子」混充使用。按茛菪子屬茄科植物茛菪的乾燥成熟種子偽充菟絲子。該品性狀如卵圖形或略象腎形﹐稍有扁平，臍點處突出。面灰黃色或棕黃色，種皮粗糙，具細密隆起的紋路。無臭味微辛。鑑驗方法同上，取種子少量泡在水中不變色，[1] 殷林茂，等•中西醫結合治療幼小子宮46例•河北中醫1992; 14(4):40 Yan Linmao, ed. Integrating Chinese and western medicine to treat Infantile uterus, Herbal Journal of Traditional Chinese Medicine1992;14(4):40.* \n　\n\n   Search \n    this site \n\n\nProblems with website? Please \n\nClick \n    here for comment. (Not for inquiry )    \n    \n\n\nClick \n    here for inquiry \n\n\n\nCopyright Notice \n\n按此看關於版權問題\n\n\n\n\nA manuscript... writing, translating and proofreading  in progress\n\n\nSponsors' Ads by Google \n    以下為谷歌 所提供之廣告\n\n\n\n\n\n\n\n\nList \n        of Health Problems\n\n\n\n\n        Chinese Herb Dictionary\n\n\n\n\nToxicity of Some Herbs\n\n\n\nSide Effect of Some Herbs\n\n\n\nHerbs that can be toxic to kidneys\n\n\n\n\n        Traditional Chinese Medicine\n　\n\n\nTCM Diagnosis\n　\n\n\n        Samples of Formulae\n\n\n\n\n        Terms of Traditional Chinese Medicine\n\n\n\n        Acupuncture\n\n\n\n\n\ncopy right\n　\n\n\n版權所有\n\n\n\nQigong \n        (chi kung)\n\n\n\n\n        Prescribed Drug Dictionary\n\n\n\n\n        Email our web master for  your suggestion (not for inquiry)\n\n\n\nBiochemistry Dictionary\n\n\n\n\n\nGeneral Online Library\n\n\n\nQigong \n        classes\n\n\n\nFake \n        Email Warning\n\n\n\nResearch Librarian\n\n\n\nSearch\n\n\n\n\n\nQigong classes\n\n\n\nHome\n\n\n\n\n        Weather Report\n\n\n\n\n        Disclaimer\n\n\nLast update: Feb 11, 2014; \n        7 p.m. \n        LAH\n\n\n\n\n\n　\n\n\n\n\n\n\n\n\n",
    "original_url": "http://alternativehealing.org/tu_si_zi.htm"
  }
]
