[
    {
        "Names": {
            "Name": [
                "lai fu",
                "萊菔"
            ],
            "Pharmaceutical": [
                "Radix Raphani sativi"
            ],
            "Biological": [
                "Raphanus sativus L."
            ],
            "Common": [
                "daikon"
            ],
            "Other name": [
                "lu 蘆",
                "luo fu 蘿蔔",
                "zi hua song 紫花菘",
                "wen song 溫菘",
                "tu su 土酥",
                "wen song 温松",
                "qin song 秦松",
                "zi hua song 紫花松"
            ],
            "Chinese": [
                "萊菔",
                "蘆",
                "蘿蔔",
                "紫花菘",
                "溫菘",
                "土酥",
                "温松",
                "秦松",
                "紫花松"
            ],
            "Pronunciation in Korean": [
                "mu"
            ],
            "Pronunciation in Japanese": [
                "daikon (大根)"
            ],
            "Pronunciation in Cantonese": [
                "loi4 fuk6",
                "loi4 baak6"
            ],
            "Pinyin Pronunciation": []
        },
        "Type": "Herb",
        "Geography": [
            "Most part of China"
        ],
        "Properties": [
            "Acrid",
            "Sweet",
            "Warm",
            "Neutral",
            "Nontoxic"
        ],
        "Meridians": [],
        "Maladies Treated": [
            "Expelling phlegm",
            "Diabetes",
            "Atrophic lung disease with vomiting blood",
            "Xiao ke (wasting and thirsting disorder)",
            "Constipation (see formula for method: use stir fried lai fu with zao jia powder)"
        ],
        "Medical Function": [
            "Alcohol extract possesses antibiotic property, especially toward Gram positive bacteria; but in serum, the viability is only 50%",
            "Antifungal (able to resist fungus)",
            "The juice of the radix of this plant can prevent the forming of gall stones and being used in gall stone disease"
        ],
        "Dosage": "15 g to 40 g (15 ~ 40 克)",
        "Samples of Formulae": "For atrophic lung disease with vomiting blood: use lai fu (萊菔) with goat meat or carp to make soup. Take frequently.\n\nConstipation: stir fry one cup of lai fu (萊菔). Add water and blend into paste. Add zao jia (皂夾, gleditsia fruit) 7.5 g (make into powder). Take orally.",
        "Contraindications": "Do not use with he shou wu (何首烏, polygonum multiflorum) or di huang (地黃, rehmannia root).",
        "Research": "Using the acid substance of lai fu (萊菔) of 3g/kg for hypodermic injection or 2g/kg for abdominal cavity injection to mice did not show toxicity. Using 1g/kg for hypodermic injection on rabbits only showed mild, temporary toxic reaction.",
        "Notes": "",
        "Chemical Ingredients": {
            "": [
                "Energy: 16 Kcal per 100g",
                "Carbohydrates: 3.40 g per 100g",
                "Protein: 0.68 g per 100g",
                "Total Fat: 0.10 g per 100g",
                "Cholesterol: 0 mg per 100g",
                "Dietary Fiber: 1.6 g per 100g",
                "Folates: 25 mcg per 100g",
                "Niacin: 0.254 mg per 100g",
                "Pyridoxine (Vitamin B6): 0.071 mg per 100g",
                "Riboflavin: 0.039 mg per 100g",
                "Vitamin A: 7 IU per 100g",
                "Vitamin C: 14.8 mg per 100g",
                "Vitamin E: 0 mg per 100g",
                "Vitamin K: 1.3 mcg per 100g",
                "Sodium: 39 mg per 100g",
                "Potassium: 233 mg per 100g",
                "Calcium: 25 mg per 100g",
                "Copper: 0.050 mg per 100g",
                "Iron: 0.34 mg per 100g",
                "Magnesium: 10 mg per 100g",
                "Manganese: 0.069 mg per 100g",
                "Zinc: 0.28 mg per 100g",
                "Carotene-β: 4 mcg per 100g",
                "Carotene-α: 0 mcg per 100g",
                "Lutein-zeaxanthin: 10 mcg per 100g"
            ]
        },
        "References": [
            "[1] Ben Cao Gang Mu 本草綱目",
            "[2] Ben Cao Bei Yao 本草備要，卷五。"
        ],
        "Further Reading": [],
        "Original Text": ", Complementary and Alternative Healing UniversityComplementary and Alternative Healing University  Home 現代中藥辭典Search this siteList of Health ProblemsChinese Herb DictionaryQigongTraditional Chinese Medicine (TCM)AcupuncturePrescribed Drug DictionaryBiochemistry DictionaryLecture SlidesResearch LibrarianGeneral Online LibrarySearchResearch SitesViagraMassage/AcupressureHypnotherapyTell us what you wantNotify Changes & New Information　　　    　      　　    　　　　　                                      lai fu 萊菔                (in English and Chinese 中英文）Translated and edited by: Joe Hing kwok ChuPharmaceutical name:英文藥名﹕Radix Raphani sativiBotanical name:拉丁生物學名﹕Raphanus sativus L.Pron. in Japanese:日語發音﹕daikon (大根)Pron. in Korean:韓語發音﹕muPron. in Cantonese::粵音﹕loi4 fuk6;  loi4 baak6Other Names:別名﹕lu 蘆，luo fu 蘿蔔，zi hua song 紫花菘，wen song 溫菘，tu su 土酥，wen song 温松，qin song 秦松，zi hua song 紫花松。Common Name:英文名﹕daikonDistribution:產地﹕Most part of China.全中國之大部份地區。Properties(characteristics)﹕性味﹕辛，甘，温，平，無毒。acrid, sweet, warm, neutral, nontoxic.Channels (meridians) entered: 歸經﹕Medical functions:藥理﹕ alcohol extract possesses antibiotic property, especially toward Gram positive bacteria; but in serum, the viability is only 50%. There is another report that the juice of the radix of this plant can prevent the forming of gall  stones and being used in gall stone disease. 醇提取物有抗菌作用，特別是對革蘭氏陽性細菌較敏感；有血清時，活力降低一半； 亦能抗真菌。另據報告，根搗碎後，榨取之汁液，可防止膽石形成而應用於膽石症。Actions & Indications:主治﹕expelling phlegm,  diabetes, atrophic lung disease with vomiting blood, 去痰，消渴，治肺痿吐血。Chemical ingredients:化學成份﹕Radish (Raphanus sativus), Fresh, raw, Nutrition Value per 100 g,  (Source: USDA National Nutrient data base)Principle養份Nutrient Value 营養價值Percentage of RDA每天所須之%Energy热量16 Kcal1%Carbohydrates碳水化合物3.40 g3%Protein蛋白質0.68 g1%Total Fat脂肪總量0.10 g<1%Cholesterol膽固醇0 mg0%Dietary Fiber食用籤維1.6 g4%Vitamins維生素  Folates葉酸鹽25 mcg6%Niacin菸酸0.254 mg1.5%Pyridoxine維生素 B60.071 mg5.5%Riboflavin核黃素0.039 mg3%Vitamin A維生素A7 IU<1%Vitamin C維生素C14.8 mg25%Vitamin E維生素E0 mg9%Vitamin K 維生素K1.3 mcg1%Electrolytes電解質  Sodium鈉39 mg2.5%Potassium鉀233 mg5%Minerals礦物質  Calcium鈣25 mg2.5%Copper酮0.050 mg5%Iron鐵0.34mg4%Magnesium鎂10 mg2.5%Manganese錳0.069 mg2.5%Zinc 0.28 mg2%Phyto-nutrients植物营養  Carotene-�胡蘿蔔素-�4 mcg--Carotene-α胡蘿蔔素-α0 mcg--Lutein-zeaxanthin葉黃素-玉蜀黍黄素10 mcg--  Daly Dosage:每日用量﹕15 g to 40 g15 ~ 40 克。Samples of formulae:[1]處方舉例﹕[1]For atrophic lung disease with vomiting blood: use lai fu with goat meat or carp to make soup. Take frequently.Constipation: stir fry one cup of lai fu. Add water and blend into paste. Add zao jia 7.5 g (make into powder). Take orally.肺痿咳血。用蘿蔔和羊肉或鯽魚煮熟，頻食之。便秘：用蘿蔔切碎。炒一合，加水搗爛，和皂 夾末7.5 克。服之可通。   Modern Research:現代研究﹕ Toxicity & Cautions:毒素與禁忌﹕Do not use with he shou wu or di huang. 【2】Using the acid substance of lai fu of 3g/kg for hypodermic injection or 2g/kg for abdominal cavity injection to mice did not show toxicity. Using 1g/kg for hypodermic injection on rabbits only showed mild, temporary toxic reaction.萊菔根中的酸性物質對小鼠皮下注射3克/公斤或腹腔注射2克/公斤，皆無 毒性，對兔皮下注射1克/公斤僅有輕微，短暫之毒性反應。服何 首烏或地 黃者不可食。【2】[1] Ben Cao Gang Mu 本草綱目[2] Ben Cao Bei Yao 本草備要，卷五。 Sponsors' Ads by Google 以下為谷歌所提供贊助者之廣告   A manuscript... writing, translating and proofreading  in progressProblems with website? Please Click here for comment. (Not for inquiry )      Click here for inquiry    Copyright Notice 按此看關於 版權問題List of Health ProblemsChinese Herb DictionaryToxicity of Some Herbs Side Effect of Some Herbs Herbs that can be toxic to kidneysTraditional Chinese MedicineTCM DiagnosisSamples of FormulaeTerms of Traditional Chinese MedicineAcupuncturecopy right 版權所有Qigong (chi kung)Prescribed Drug DictionaryEmail our web master for  your suggestion (not for inquiry)Biochemistry DictionaryGeneral Online LibraryQigong classesLecture SlidesResearch LibrarianSearchQigong classesHomeWeather Report DisclaimerLast update: Nov 25, 2012; 9:10 p LAH　Search this site         ",
        "original_url": "http://alternativehealing.org/lai_fu.htm"
    },
    {
        "Names": {
            "Name": [
                "yan fu mu",
                "鹽膚木"
            ],
            "Pharmaceutical": [
                "Radix Rhus",
                "Fructus Rhus",
                "Flos Rhus",
                "Folium Rhus"
            ],
            "Biological": [
                "Rhus chinensis Mill",
                "Rhus chinensis Mill. var. roxburghii (DC) Rehd (濱鹽膚木)"
            ],
            "Chinese": [
                "鹽膚木",
                "鹽麩樹",
                "木鹽",
                "天鹽",
                "鹽膚子木",
                "鹽霜柏",
                "枯鹽萁",
                "夫煙樹",
                "濱鹽膚木",
                "五倍子樹",
                "泡木樹",
                "山杜仲",
                "飛天蜈蚣",
                "破涼傘",
                "報木樹",
                "鋪林鹽",
                "猴鹽柴",
                "鹽白木",
                "鹽桶甏",
                "鹽子樹",
                "蓮蓬柴",
                "鹽樹苗",
                "烏煙桃",
                "麩楊樹",
                "芙蓮樹",
                "鹽酸樹",
                "女木",
                "五倍柴",
                "酸桶",
                "酢桶"
            ],
            "Common": [
                "Chinese sumac",
                "Chinese gall",
                "nutgall",
                "nutgall tree"
            ],
            "Other name": [
                "suan tong 酸桶",
                "zuo tong 酢桶",
                "yan fu shu 鹽麩樹",
                "fu mu 膚木",
                "mu yan 木鹽",
                "tian yan 天鹽",
                "yan fu zi mu 鹽膚子木",
                "yan xiang bai 鹽霜柏",
                "ku yan qi 枯鹽萁",
                "fu yan shu 夫煙樹",
                "bin yan fu mu 濱鹽膚木",
                "wu bei zi shu 五倍子樹",
                "pao mu shu 泡木樹",
                "shan du zhong 山杜仲",
                "fei tian wu gong 飛天蜈蚣",
                "po kiang san 破涼傘",
                "bao mu shu 報木樹",
                "pu lin yan 鋪林鹽",
                "hou yan chai 猴鹽柴",
                "yan bai mu 鹽白木",
                "鹽桶甏",
                "yan zi shu 鹽子樹",
                "lian peng chai 蓮蓬柴",
                "yan shu miao 鹽樹苗",
                "wu yan tao 烏煙桃",
                "fu yan shu 麩楊樹",
                "fu lian shu 芙蓮樹",
                "yan suan shu 鹽酸樹",
                "nu mu 女木",
                "wu bei chai 五倍柴"
            ],
            "Pronunciation in Korean": [
                "punamu"
            ],
            "Pronunciation in Japanese": [
                "nurude",
                "fushinoki",
                "hamyeongju (咸平樹)"
            ],
            "Pronunciation in Cantonese": [
                "jim4 fu1 muk6"
            ],
            "Pinyin Pronunciation": []
        },
        "Type": "Herb",
        "Geography": [
            "In China, found in all provinces except Inner Mongolia, Qinghai, and Xinjiang.",
            "India",
            "Indo-China peninsula",
            "Malaysia",
            "Indonesia",
            "Japan",
            "Korea"
        ],
        "Properties": [
            "Sour",
            "Salty",
            "Slightly cold",
            "Non-toxic",
            "Wu bei zi: Neutral, sour"
        ],
        "Meridians": [],
        "Maladies Treated": [
            "Cough due to lung deficiency",
            "Excessive sweating",
            "Edema",
            "Diarrhea",
            "Dysentery",
            "Blood in stool",
            "Prolapse of anus",
            "Hemorrhoids",
            "External application: injuries from scalding",
            "External application: burns and local bleeding",
            "Accumulation and stagnation (化積滯)",
            "Bone hardening (消骨硬)",
            "Toxin (detoxification) (解毒)",
            "Eye nebula (退目翳)"
        ],
        "Medical Function": [
            "Wu bei zi (galla chinensis): Astringes to stop bleeding, astringes the lungs and descends fire, astringes sweating and binds the intestines"
        ],
        "Dosage": "Root: 10 to 35 g. \nWu bei zi (galla chinensis): 2 to 7 g. \nFlower and leaves for external application: use appropriate amount.",
        "Samples of Formulae": "",
        "Contraindications": "",
        "Research": "",
        "Notes": "Parts being used in medicine: roots, leaves, flowers, fruit and wu bei zi (galla chinensis). They are collected in summer and fall.",
        "Chemical Ingredients": {},
        "References": [],
        "Further Reading": [],
        "Original Text": "yan fu mu, Complementary and Alternative Healing University\n\n\n\n\nComplementary and Alternative Healing University \n    \nHome  \n\n\n現代 中藥辭典\n\n\n\n\n\n\n\n\n\n\n\n\n\n\n\nSearch this site\n\n\n\n\n\n\n        List of Health Problems\n\n\n\n\n\n\n        Chinese Herb Dictionary\n\n\n\n\n\nQigong\n\n\n\n\n\n\n        Traditional Chinese Medicine (TCM)\n\n\n\n\n\n\n        Acupuncture\n\n\n\n\n\n\n        Prescribed Drug Dictionary\n\n\n\n\n\n        Biochemistry Dictionary\n\n\n\n\n\nLecture Slides\n\n\n\n\nResearch \n        Librarian\n\n\n\n\n\n\n        General Online Library\n\n\n\n\n\nSearch\n\n\n\n\n\nResearch \n        Sites\n\n\n\n\n\n\n        Viagra\n\n\n\n\n\n\n        Massage/Acupressure\n\n\n\n\n\nHypnotherapy\n\n\n\n\n\nTell us what you want\n\n\n\n\n\nNotify \n        Changes & New Information\n\n\n\n　\n　\nTo post your discussion \n        click here.\n \n \n \n \n \n \n \n \n \n \n \n \n \n \n \n \n \n \n \n \n \n \n \n \n \n \n \n \n \n \n \n \n \n \n \n \n \n \n\nLast update: Feb 18, 2011; 5:36 p \n        LAH\n \n\n\n\n\n \n\n \nyan fu mu 鹽膚木 \nEdited \nby: Joe Hing kwok ChuA manuscript... writing and translation in progress\nPharmaceutical name:\n英文藥名﹕Radix Rhus, Fructus Rhus,  \nFlos Rhus, Folium Rhus.\nBotanical name:\n學名﹕Rhus chinensis Mill\nRhus chinensis Mill. var. roxburghii (DC) Rehd (濱鹽膚木)Pron. in Japanese:日語發音﹕\n        nurude; fushinoki; hamyeongju (咸平樹)Pron. in Korean:韓語發音﹕\n        punamu\nPron. in Cantonese:粵音﹕jim4 fu1 muk6Other Names:別名﹕suan tong 酸桶，zuo tong 酢桶，yan fu shu 鹽麩樹，fu mu 膚木，mu yan 木鹽，tian yan 天鹽，yan fu zi mu 鹽膚子木，yan xiang bai 鹽霜柏，ku yan qi 枯鹽萁，fu yan shu 夫煙樹，bin yan fu mu 濱鹽膚木，wu bei zi shu 五倍子樹，pao mu shu 泡木樹，shan du zhong 山杜仲，fei tian wu gong 飛天蜈蚣，po kiang san 破涼傘，bao mu shu 報木樹，pu lin yan 鋪林鹽，hou yan chai 猴鹽柴，yan bai mu 鹽白木，鹽桶甏，yan zi shu 鹽子樹，lian peng chai 蓮蓬柴，yan shu miao 鹽樹苗，wu yan tao 烏煙桃，fu yan shu 麩楊樹，fu lian shu 芙蓮樹，yan suan shu 鹽酸樹，nu mu 女木，wu bei chai 五倍柴.。Common Name:英文名﹕Chinese sumac, Chinese gall, nutgall, nutgall tree.Distribution:產地﹕In China, except Inner Mongolia, Qihai, Xinjiang, it exists in all provinces. Outside China, it exists in India, Indo-China peninsula, Malaysia, Indonesia, Japan and Korean.我國除東北，內蒙古，青海，新疆外，其餘省區都有分佈。 國外分佈：分佈於印度，中南半島，馬來西亞，印度尼西亞，日本和朝鮮。Properties(characteristics)﹕性味﹕Fruit and roots: sour, salty, slighly cold and non-toxic.果、根性味酸、鹹、微寒，無毒。\nChannels (meridians) entered: \n歸經﹕\nMedical functions:藥理﹕  \nActions & Indications:\n主治﹕Parts being used in medicine: roots, leaves, flowers, fruit and \n        wu bei zi. They are collected in summer and fall. 　Application: cough due to lung deficient, sweating, edema, diarrhe, blood in stool, prolapse of anus, haemorrhoids.External application for :injuries from scalding, and local bleeding.藥用部分：根、葉、花、果及五倍子均供藥用，夏秋採收。能化積滯，消骨硬，解毒，退目翳。五倍子性味平，酸。收斂止血，斂肺降火，斂汗澀腸。治肺虛咳嗽，多汗，水腫，瀉痢，下血，脫肛，痔疾等。外用於燙傷及局部出血。\nChemical ingredients:\n化學成份﹕ Dosage:用量﹕Root: 10 to 35 g. \nwu bei zi.2 to 7 g. Flower and leaves in external application: use appropriate amount. 根 10 ~ 35 克。 \n五倍子2 ～ 7克。 花、葉外用適量。Samples of formulae:\n        處方舉例﹕ \nModern Research:\n現代研究﹕ \nToxicity & Cautions:\n毒素與禁忌﹕　\n\n \n\n\n\n\n\n\n\n\n          Search this site powered by\n          \n          FreeFind\n\n\n\n\n\n\n\n\n\n\n\n\n\n\n\n\n\n\n\n\n\n\n\n\n\n\n\n\n\n\n\n\n\n\n\n\nSponsors' Ads by Google 以 \n    下為谷 歌所提供之廣告\n\n\n \n\n\n\nA manuscript... writing, translating and proofreading              in progress\n\n\nClick \n    here for comment. (Not for inquiry )        \n    \n\n    Click here for inquiry\n \n \n\n\nCopyright Notice 按此看關 於版權 \n    問題\n\n\n\n\n\n\n        List of Health Problems\n\n\n\n\n        Chinese Herb Dictionary\n\n\n\n\nToxicity of Some Herbs\n\n\n\nSide Effect of Some Herbs\n\n\n\nHerbs that can be toxic to kidneys\n\n\n\n\n        Traditional Chinese Medicine\n\n\nTCM Diagnosis\n\n\n\n        Samples of Formulae\n\n\n\n\n        Terms of Traditional Chinese Medicine\n\n\n\n        Acupuncture\n\n\n\n\n\ncopy right\n \n\n\n版權所有\n\n\n\nQigong \n        (chi kung)\n\n\n\n\n        Prescribed Drug Dictionary\n\n\n\n\n        Email our web master for  your suggestion (not for inquiry)\n\n\n\nBiochemistry Dictionary\n\n\n\n\n\nGeneral Online Library\n\n\n\nQigong \n        classes\n\n\n\nFake \n        Email Warning\n\n\n\nResearch Librarian\n\n\n\nSearch\n\n\n\n\n\nQigong classes\n\n\n\n\n\n\n\nHome\n\n\n\n\n        Weather Report\n\n\n    \n\nDisclaimer\n\n\n\n\n\n \n\n\n\n\n\n\n\n\n\n\n",
        "original_url": "http://alternativehealing.org/yan_fu_mu.htm"
    },
    {
        "Names": {
            "Name": [
                "yang qi shi",
                "陽起石"
            ],
            "Pharmaceutical": [
                "Actinolitum"
            ],
            "Biological": [],
            "Chemical": [
                "It is not a simple compound. The actinolite containing silicate (SiO4) of minerals in general (including other silicon-containing salt, such as metasilicate, wollastonite CaSiO3 example). Can be seen as SiO2 and other oxides (mostly a combination of metal oxides)."
            ],
            "Common": [
                "tremolite",
                "actinolite",
                "actinolite asbestus"
            ],
            "Other name": [
                "bai shi 白石",
                "yang qi shi 羊起石",
                "shi sheng 石生",
                "yang shi 陽石",
                "qi yang shi 起陽石"
            ],
            "Chinese": [
                "陽起石",
                "白石",
                "石生",
                "陽石",
                "起陽石"
            ],
            "Pronunciation in Korean": [
                "yanggisok"
            ],
            "Pronunciation in Japanese": [
                "yokisheki"
            ],
            "Pronunciation in Cantonese": [
                "jeong4 hei2 sek6"
            ],
            "Pinyin Pronunciation": []
        },
        "Type": "Mineral",
        "Geography": [],
        "Properties": [
            "Warm",
            "Salty"
        ],
        "Meridians": [
            "Kidney"
        ],
        "Maladies Treated": [
            "shenyangxu (kidney yang deficient)",
            "spermatorrhea",
            "impotence",
            "infertility due to cold womb",
            "uterine bleeding due to cold and deficiency",
            "下焦虛寒 (lower energizer deficiency-cold pattern)",
            "aching and weakness in loin and knees"
        ],
        "Medical Function": [
            "Untreated yang qi shi is being used in shenyangxu (kidney yang deficient)."
        ],
        "Dosage": "Daily dosage: 3–5 g.",
        "Samples of Formulae": "",
        "Contraindications": "Not to use in case of yin deficient with heat.\nAccording to the medical classics Ben Cao Jing Ji Zhu, use with sang piao xiao (mantis egg-case). Not compatible with ze xie (Alisma tuber), rou gui (cinnamon bark), lei wan (Omphalia fungus), she tui (snake molt skin). Counteracts with tu si zi (dodder seed).\nAccording to the medical classics, Yao Xing Lun (Theory on herb characteristics), it antagonizes shi kui (Bryophyllum pinnatum), goat and lamb meat.\nAccording to the medical classics, Ben Cao Jing Su, not to use in case of yin deficient with heat. In case of impotence caused by emotional injuries and those with heavy bleeding not during menses and those with vaginal discharge due to heat and not cold and weakness.\nAccording to the medical classics, Ben Cao Hui Yan, those with yinxu (yin deficient) blood with heat syndrome should not take the herb. 陰虚火旺者忌服。《本草經集注》：「桑螵蛸為之使。惡澤瀉、肉桂、雷丸、蛇蛻皮。畏菟絲子。」《藥性論》：「惡石葵。忌羊血。」《本草經疏》：「陰虚火旺者忌之。陽痿屬於失志，以致火氣閉密不得發越而然，及崩中帶下由於火盛而非虛寒者，並不得服。」《本草匯言》：「yinxu (yin deficient)  陰虛  血熱者不宜服。」",
        "Research": "",
        "Notes": "",
        "Chemical Ingredients": [
            "Ca2 (Mg,Fe++)5[Si4O11]2[OH]2 (actinolite/tremolite)",
            "FeO 6–13%",
            "CaO 13.8%",
            "MgO 24.6%",
            "SiO2 58.8%",
            "H2O 2.8%",
            "mainly calcium, magnesium, and iron hydroxyl silicate Ga2 (Mg,Fe2+)5[Si4O11]2(OH)2 (tremolite)",
            "contains a small amount of calcite, or a combination of amphibole and chlorite (magnesium iron aluminum silicon aluminate)"
        ],
        "References": [],
        "Further Reading": [],
        "Original Text": "yang qi shi, Complementary and Alternative Healing UniversityComplementary and Alternative Healing University   中藥詞典                 Chinese Herb Dictionary      Search this site     在本網站找資料Search this siteList of Health ProblemsChinese Herb DictionaryQigongTraditional Chinese Medicine (TCM)AcupuncturePrescribed Drug DictionaryBiochemistry DictionaryLecture SlidesResearch LibrarianGeneral Online LibraryResearch SitesViagraMassage/AcupressureHypnotherapyTell us what you wantNotify Changes & New Information  yang qi shi 陽起石   ( in English and Chinese 中英文)Translated by: Joe Hing kwok Chu    朱興國編 譯   Pharmaceutical name:英文藥名﹕ActinolitumChemical name:化學名﹕It is not a simple compound. The actinolite containing silicate (SiO4) of minerals in general (including other silicon-containing salt, such as metasilicate, wollastonite CaSiO3 example). Can be seen as SiO2 and other oxides (mostly a combination of metal oxides).它不是單純的化合 物。陽起石含有硅酸根（SiO4)的礦物的總稱（也包括其它的含硅鹽，如偏硅酸鹽，硅灰石CaSiO3即一例）。可看作SiO2與其它氧化物（多為金屬氧 化物）的結合體。Pron. in Japanese:日語發音﹕yokishekiPron. in Korean:韓語發音﹕yanggisokPron. in Cantonese::粵音﹕jeong4 hei2 sek6Other Names:別名﹕bai shi 白石，yang qi shi 羊起石，shi sheng 石生 yang shi 陽石，qi yang shi 起陽石Common Name:英文名﹕tremolite, actinolite, actinolite asbestusDistribution:產地﹕ characteristics﹕性味﹕warm, salty.溫，鹹。Channels meridians entered: 歸經﹕kidney腎Medical functions:藥理﹕  Actions & Indications:主治﹕Untreated yang qi shi is being used in shenyangxu (kidney yang deficient) , weak loin and knees, spermatorrhea, impotence, uterine bleeding, infertility due to cold womb, .生用於治腎陽虛。用於下焦虛寒，腰膝酸軟，遺精，陽痿，宮冷不孕，崩漏。Chemical ingredients:化學成份﹕Composition of actinolite is: Ca2 (Mg, Fe + +) [Si4O11] 2 [OH] 2, in which: of FeO 6 ~ 13% of CaO 13.8%, of MgO 24.6%, SiO2 58.8%, H2O 2.8%. The main calcium, magnesium, iron, hydroxyl silicate Ga2 (Mg, Fe2 +) 5 [Si4O11] 2 (OH) 2 (tremolite), and also contains a small amount of calcite, calcite, or a combination of amphibole and chlorite (magnesium iron aluminum silicon aluminate).陽起石的組成是Ca2 (Mg，Fe++)5〔Si4O11〕2〔OH〕2，其中：FeO 6～13%，CaO 13.8% ，MgO 24.6%，SiO2 58.8%，H2O 2.8%。主含鈣、鎂、鐵的羥硅酸鹽 Ga2 (Mg,Fe2+)5[Si4O11]2(OH)2 (透 閃石)，尚含少量方解石calcite或兼有角閃石和綠泥石(含鎂鐵鋁的硅(矽)鋁酸鹽)等。Daly Dosage:每日用量﹕3～5 gSamples of formulae:處方舉例﹕ Modern Research:現代研究﹕ Toxicity & Cautions:毒素與禁忌﹕Not to use in case of yin deficient with heat.According to the medical classics Ben Cao Jing Ji Zhu use with sang piao xiao. Not compatible with ze xie, rou gui,  lei wan, she tui. Counteracts with tu si zi.According to the medical classics, Yao Xing Lun (Theory on herb characteristics), It antagonizes shi kui, goat and lamb meat.According to the medical classics, Ben Cao Jing Su, not to use in case of yin deficient with heat. In case of impotence cause by emotional injuries and those with heavy bleeding not during menses and those with vagina discharge due to heat and not cold and weaknessAccording to the medical classics, Ben Cao Hui Yan, those with yinxu (yin deficient) blood with heat syndrome should not take the herb.陰虚火旺者忌服。①《本草經集注》：�桑螵蛸為之使。惡澤瀉、肉桂、雷丸、蛇 蛻皮。畏菟絲子。�②《藥性論》：�惡石葵。忌羊血。�③《本草經疏》：�  陰虚火旺者忌之。 陽痿屬於失志，以致火氣閉密不得發越而然，及崩中帶下由於火盛而非虛寒者，並不得服。�《本草匯言》：�yinxu (yin deficient)  陰虛  血熱者不宜服。�  Search this siteProblems with website? Please Click here for comment. (Not for inquiry )    Click here for inquiryCopyright Notice 按此看關於版權問題A manuscript... writing, translating and proofreading  in progressSponsors' Ads by Google 以下為谷歌 所提供之廣告 List of Health ProblemsChinese Herb DictionaryToxicity of Some HerbsSide Effect of Some HerbsHerbs that can be toxic to kidneysTraditional Chinese Medicine TCM Diagnosis Samples of FormulaeTerms of Traditional Chinese MedicineAcupuncturecopy right 版權所有Qigong (chi kung)Prescribed Drug DictionaryEmail our web master for  your suggestion (not for inquiry)Biochemistry DictionaryGeneral Online LibraryQigong classesFake Email WarningResearch LibrarianSearchQigong classesHomeWeather ReportDisclaimerLast update: Oct 14, 2013; 11 a.m. LAH   ",
        "original_url": "http://alternativehealing.org/yang_qi_shi.htm"
    },
    {
        "Names": {
            "Name": [
                "quan shen",
                "拳參"
            ],
            "Pharmaceutical": [
                "Rhizoma Bistortae"
            ],
            "Biological": [
                "Polygonum bistorta L.",
                "Polygonum Lapidosum Kitag."
            ],
            "Chemical": [],
            "Common": [
                "meadow bistort"
            ],
            "Other name": [
                "zi shen 紫參",
                "shan xia 山蝦",
                "dao gen cao 倒根草"
            ],
            "Chinese": [
                "拳參",
                "紫參",
                "山蝦",
                "倒根草"
            ],
            "Pronunciation in Korean": [],
            "Pronunciation in Japanese": [
                "kenjin"
            ],
            "Pronunciation in Cantonese": [
                "kyun4 sam1"
            ],
            "Pinyin Pronunciation": []
        },
        "Type": "Herb",
        "Geography": [
            "Liaoning, China",
            "Hebei, China",
            "Shanxi, China",
            "Inner Mongolia, China",
            "Shaanxi, China",
            "Gansu, China",
            "Ningxia, China",
            "Xinjiang, China",
            "Shandong, China",
            "Jiangsu, China",
            "Anhui, China",
            "Zhejiang, China",
            "Henan, China",
            "Hubei, China",
            "Hunan, China"
        ],
        "Properties": [
            "bitter",
            "tart",
            "slightly cold"
        ],
        "Meridians": [
            "liver",
            "lung",
            "large intestine"
        ],
        "Maladies Treated": [
            "enteritis",
            "dysentery",
            "hepatitis",
            "hemorrhoid",
            "appendicitis",
            "tonsillitis",
            "tracheitis",
            "convulsion",
            "edema",
            "urination difficulty",
            "ulcers in the mouth (external application)",
            "ulcers in the throat (external application)"
        ],
        "Medical Function": [
            "Antibiotic effect: In vitro experiments showed that ethanol, petroleum ether, ethyl acetate extract of quan shen (拳參) and polygonum glycosides, gallic acid and other monomer components possessed the inhibition activities on Staphylococcus aureus, Escherichia coli, Bacillus subtilis and Pseudomonas aeruginosa, etc. Among them the extract of ethyl acetate and that of gallic acid possessed the strongest antibiotic activity.",
            "Anti-inflammatory effect: Oral administration of the ethanol extract of quan shen (拳參) and the substances isolated from quan shen, 5-glutinen-3-one and friedelanol could inhibit the edema of rat paws induced by carrageenan.",
            "Analgesic effect: In mice experiment, using acetic acid writhing, pain caused by hot plate method and by electrical shock method, showed that quan shen (拳參) butanol extract and water extract when injected intraperitoneally produced significant analgesic effect.",
            "Sedative effect: Intraperitoneal injection of quan shen (拳參) butanol extract in mice significantly inhibited the spontaneous activity, and could also significantly enhance the sedative effect of sodium pentobarbital on central nervous system.",
            "The chemical ingredient of quan shen (拳參) L-epicatechin can significantly reduce acetylcholinesterase activity, and can reduce serum and liver cholesterol.",
            "Quan shen (拳參) also possesses the effect of anti-mutation, anti-cancer, inhibition of tumor necrosis factor (TNF), anti-endotoxin."
        ],
        "Dosage": "4.5 to 9 g. External application: use appropriate amount. 4.5～9g。外用適量，煎湯含漱。",
        "Samples of Formulae": "",
        "Contraindications": "Use with care if there is not strong heat syndrome. 無實火實熱者慎服。",
        "Research": "Antibiotic effect: In vitro experiments showed that ethanol, petroleum ether, and ethyl acetate extract of quan shen (拳參) and polygonum glycosides, gallic acid and other monomer components possessed inhibitory activities on Staphylococcus aureus, Escherichia coli, Bacillus subtilis and Pseudomonas aeruginosa, etc. Ethyl acetate extract and gallic acid possessed the strongest antibiotic activity.\n\nAnti-inflammatory effect: Oral administration of the ethanol extract of quan shen (拳參) and substances isolated from quan shen, 5-glutinen-3-one and friedelanol could inhibit the edema of rat paws induced by carrageenan.\n\nAnalgesic effect: In mice experiments, using acetic acid writhing, hot plate method, and electrical shock method, it was shown that quan shen (拳參) butanol extract and water extract injected intraperitoneally produced significant analgesic effect.\n\nSedative effect: Intraperitoneal injection of quan shen (拳參) butanol extract in mice significantly inhibited spontaneous activity, and significantly enhanced the sedative effect of sodium pentobarbital on the central nervous system.\n\nThe chemical ingredient L-epicatechin from quan shen (拳參) can significantly reduce acetylcholinesterase activity, and reduce rat serum and liver cholesterol.\n\nQuan shen (拳參) also has demonstrated effects as anti-mutation, anti-cancer, inhibition of tumor necrosis factor (TNF), and anti-endotoxin.",
        "Notes": "quan shen (拳參) is not qi ye yi zhi hua (七葉一枝花, Paris polyphylla Smith var. chinensis (Franch.) Hara) and is not chong lou (重樓, Paris polyphylla Smith var. yunnanensis (Franch.) Hand. Mazz.). quan shen is the rhizome of Polygonum bistorta L. or Polygonum Lapidosum Kitag.",
        "Chemical Ingredients": [
            "tannin 8.7 - 25% (root)",
            "starch 12 - 45.81%",
            "sugar 5.7 - 7.5%",
            "gallic acid",
            "succinic acid",
            "3,4-dihydroxybenzoic acid",
            "D-catechol",
            "L-epicatechol",
            "6-galloylglucose",
            "3,6-digalloylglucose",
            "2,6-dihydroxybenzoic acid",
            "(-)-epicatechin-5-O-β-D-glucopyranoside",
            "(+)-catechin-7-O-β-D-glucopyranoside",
            "5-glutinen-3-one",
            "friedelanol",
            "umbelliferone",
            "scopoletin",
            "quercetin",
            "rutin",
            "quercetin-5-O-β-D-glucopyranoside",
            "pyrogallol",
            "4-hydroxybenzaldehyde",
            "syringin",
            "mururin A",
            "bistortaside",
            "The whole plant contains: chlorogenic acid, caffeic acid, protocatechuic acid, hyperin"
        ],
        "References": [
            "[1] http://www.hkjcicm.org/cm_database/plants/detail.aspx?herb_id=65 (香港賽馬會，中藥研究院）"
        ],
        "Further Reading": [],
        "Original Text": "quan shen, Complementary and Alternative Healing UniversityComplementary and Alternative Healing University  Home  現代 中藥辭典Search this siteList of Health ProblemsChinese Herb DictionaryQigongTraditional Chinese Medicine (TCM)AcupuncturePrescribed Drug DictionaryBiochemistry DictionaryLecture SlidesResearch LibrarianGeneral Online LibrarySearchResearch SitesViagraMassage/AcupressureHypnotherapyTell us what you wantNotify Changes & New Information　　To post your discussion click here.                                                                              quan shen 拳參  Translated by: Joe Hing Kwok Chu          Click here to see picture. 按此看圖。Pharmaceutical name:英文藥名﹕Rhizoma BistortaeBotanical name:學名﹕Polygonum bistorta L.Polygonum Lapidosum Kitag.Pron. in Japanese:日語發音﹕kenjinPron. in Korean:韓語發音﹕ Pron. in Cantonese: 粵音﹕kyun4 sam1Other Names:別名﹕zi shen 紫參，quan shen 拳參，zi shen 紫參，shan xia 山蝦，dao gen cao 倒根草。Common Name:英文名﹕meadow bistortDistribution:產地﹕Liaoning, Hebei, Shanxi, Inner Mongolia, Shaanxi, Gansu, Ningxia, Xinjiang, Shandong, Jiangsu, Anhui, zhejiang, Henan, Hubei, Hunan provinces of China.分佈於遼寧，河北，山西，內蒙古，陝西，甘肅，寧夏，新疆，山東，江蘇，安徽，浙江，河南，湖北，湖南等地。Properties(characteristics)﹕性味﹕bitter, tart, slightly cold.味苦，澀，性微寒。Channels (meridians) entered: 歸經﹕liver, lung, large intestine.肝，肺，大腸。Medical functions[1]:藥理﹕[1] 1. Antibiotic effect In vitro experiments showed that ethanol, petroleum ether, ethyl acetate extract of quan shen and polygonum glycosides, gallic acid and other monomer components possessed the inhibition activities on Staphylococcus aureus, Escherichia coli, Bacillus subtilis and Pseudomonas aeruginosa, etc. Among them the extract of ethyl acetate and that of gallic acid  possessed the strongest antibiotic activity . 2. Anti-inflammatory effect Oral administration of the ethanol extract of quan shen and the substances isolated from quan shen,  5-glutinen-3-one and friedelanol could inhibit the edema of rat paws induced by carrageenan [4, 8] .3. Analgesic effect In mice experiment, using acetic acid writhing, pain caused by hot plate method and by electrical shock method, showed that quan shen  butanol extract and water extract when injected intraperitoneally produced significant analgesic effect. 4. Sedative effect Using  Intraperitoneal injection of quan shen butanol extract in mice significantly inhibited the spontaneous activity, and could also significantly enhance the sedative effect of sodium pentobarbital on CNS . 5. Other The chemical ingredient of quan shen L-epicatechin can  significantly reduce acetylcholinesterase activity, and can reduce serum and liver cholesterol. Quan shen also possesses the effect of anti-mutation, anti-cancer,  inhibition of tumor necrosis factor (TNF), anti-endotoxin ..1. 抗菌 體外實驗表明，拳參乙醇，石油醚，乙酸乙酯等提取物及拳參苷，沒食子酸等單體成分對金黃色葡萄球菌，大腸桿菌，枯草芽孢桿菌及綠膿桿菌等均有一定的抑制作用，以乙酸乙酯提取物和沒食子酸抑菌活性最強。 2. 抗炎 拳參的乙醇提取物以及從拳參中分離得到的5-粘霉烯-3酮和木栓烷醇經口給藥對角叉菜膠引起的大鼠足蹠腫脹有抑制作用。 3. 鎮痛 醋酸扭體法，熱板致痛法和電刺激致痛實驗表明，拳參正丁醇提取物和水提取物腹腔注射對小鼠均有明顯的鎮痛作用。 4. 鎮靜 拳參正丁醇提取物腹腔注射對小鼠的自發活動有明顯的抑制作用，能明顯增強戊巴比妥鈉的中樞抑制作用。 5. 其他 拳參根莖中所含的左旋表兒茶精可顯著降低膽鹼酯酶活性，並能降低大鼠血清和肝臟中的膽固醇。拳參還有抗突變，抗癌，抑制腫瘤壞死因子 (TNF)，抗內毒素 等作用。Actions & Indications:主治﹕Being used in enteritis, dysentery, hepatitis.hemorrhoid, appendicitis, tonsillitis, tracheitis, convulsion, edema, urination difficulty.External application: for ulcers in the mouth or throat.有清熱，解毒，收斂的功用。用於腸炎，痢疾，肝炎，痔瘡，闌尾炎;，扁桃體炎，氣管炎，驚厥，水腫，排尿困難。。外治口腔糜爛，咽喉潰瘍。Chemical ingredients [1]:化學成份[1]﹕ tannin 8.7 - 25% （root)丹寧 8.7 - 25% (根)starch 12 - 45.81%澱粉 12 - 45.81%sugar 5.7 - 7.5%糖 5.7- 7.5%gallic acid沒食子酸succinic acid丁二酸3,4-dihydroxybenzoic acid3.4-二羟基苯甲酸D-catechol右旋兒茶酚L-epicatecho左旋表兒茶酚6-galloylglucose6- 沒食子酰葡萄糖3,6-digalloylglucose3,6- 二沒食子酰葡萄糖2,6-dihydroxybenzoic acid2,6- 二羥基苯甲酸[(-)-epicatechin-5-O-β-D-glucopyranoside(-)- 表兒茶素-5-O-β-D- 吡喃葡萄糖甙(+)-catechin-7-O-β-D-glucopyranoside(+)- 兒茶素-7-O-β-D- 吡喃葡萄糖甙5-glutinen-3-one5-粘霉烯-3酮friedelanol木栓烷醇umbelliferone傘形花內酯　scopoletin東莨菪內酯quercetin槲皮素rutin蘆丁quercetin-5-O-β-D-glucopyranoside槲皮素-5-O-β-D- 葡萄糖甙pyrogallol聯苯三酚4-hydroxybenzaldehyde4- 羥基苯醛syringin丁香苷mururin A bistortaside拳參甙The whole plant contains:拳參全草含chlorogenic acid綠原酸caffeic acid咖啡酸protocatechuic acid原兒茶酸hyperin金絲桃甙Dosage:用量﹕4.5 to 9 g.External application: use appropriate amount4.5～9g。外用適量，煎湯含漱。Samples of formulae:處方舉例﹕ Modern Research:現代研究﹕ Toxicity & Cautions:毒素與禁忌﹕Use with care if there is not strong heat syndrome.無實火實熱者慎服。[1]http://www.hkjcicm.org/cm_database/plants/detail.aspx?herb_id=65 (香港賽馬會，中藥研究院）Note:quan shen is not qi ye yi zhi hua and also is not chong lou.qi ye yi zhi hua is the rhizome of Paris polyphylla Smith var. chinensis (Franch.) Harachong lou is the rhizome of  Paris polyphylla Smith var. yunnanensis (Franch.) Hand. Mazz.quan shen is the rhizome of  Polygonum bistorta L. 或 Polygonum Lapidosum Kitag. 註：拳参不是 七葉一枝花也不是重樓。七葉一枝花 是 Paris polyphylla Smith var. chinensis (Franch.) Hara 的根莖。拳参是 Polygonum bistorta L. 或 Polygonum Lapidosum Kitag. 的根莖。重樓 是 Paris polyphylla Smith var. yunnanensis (Franch.) Hand. Mazz. 的根莖。  Search this site       Sponsors' Ads by Google 以下為谷歌所提供贊助者之廣告  A manuscript... writing, translating and proofreading                          in progressClick here for comment. (Not for inquiry )      Click here for inquiry   Copyright Notice 按此看關於版權問題List of Health ProblemsChinese Herb DictionaryToxicity of Some HerbsSide Effect of Some HerbsHerbs that can be toxic to kidneysTraditional Chinese MedicineTCM DiagnosisSamples of FormulaeTerms of Traditional Chinese MedicineAcupuncturecopy right 版權所有Qigong (chi kung)Prescribed Drug DictionaryEmail our web master for  your suggestion (not for inquiry)Biochemistry DictionaryGeneral Online LibraryQigong classesFake Email WarningResearch LibrarianSearchQigong classesHomeWeather Report    Disclaimer   Last update: May 26, 2011; 11 a.m. LAH  ",
        "original_url": "http://alternativehealing.org/quan_shen.htm"
    },
    {
        "Names": {
            "Name": [
                "pu huang",
                "蒲黃"
            ],
            "Pharmaceutical": [
                "Pollen Typhae"
            ],
            "Biological": [
                "Typha angustifolia L. 水燭香蒲",
                "Typha angustata Bory et Chauberd 長苞香蒲",
                "Typha orientalis Pres"
            ],
            "Chemical": [],
            "Common": [
                "cattail pollen"
            ],
            "Other name": [
                "pu li hua fen 蒲厘花粉",
                "pu hua 蒲花",
                "pu bang hua fen 蒲棒花粉",
                "pu cao huang 蒲草黃",
                "shui la zhu 水蠟燭",
                "mao la zhu 毛蠟燭"
            ],
            "Chinese": [
                "蒲黃"
            ],
            "Pronunciation in Korean": [
                "pohwang"
            ],
            "Pronunciation in Japanese": [
                "hoo"
            ],
            "Pronunciation in Cantonese": [
                "poh wang"
            ],
            "Pinyin Pronunciation": []
        },
        "Type": "Herb",
        "Geography": [
            "Jiangsu",
            "Zhejiang",
            "Shandong",
            "Anhui",
            "Hubei"
        ],
        "Properties": [
            "sweet",
            "neutral",
            "炒味澀 (slightly astringent taste when fried)"
        ],
        "Meridians": [
            "liver",
            "pericardium"
        ],
        "Maladies Treated": [
            "coronary diseases",
            "angina",
            "blood clot in the brain",
            "high blood lipids",
            "inflammation of the intestine and difficulty in urination: use pu huang 50 g, xiong huang (realgar) 10 g, bing pian (borneol) 3 g, fresh white part of green onion 200 g (wash the part of green onion and boil in water for 3 minutes. Smash all herb and paste it to the lower abdomen while still warm)",
            "bleeding and abdomen ache due to chronic colitis: pu huang 3 g, wu ling zhi (Trogopterus dung) 3 g (wrap in cloth), baked ge gen (kudzu root) 10 g, baked rou dou kou (nutmeg) 3 g. Make into decoction and use as tea",
            "external injury of the head with swelling: use raw pu huang and apply to the injury, 3 times a day",
            "bleeding in external injuries",
            "hemorrhoids",
            "boils",
            "inflammation of the rib cartilage (without pus)",
            "rash in babies"
        ],
        "Medical Function": [
            "constricts uterus",
            "stops bleeding; shortens blood coagulation time",
            "lowers blood cholesterol",
            "anti-coagulation",
            "promotes urination",
            "raw pu huang possesses double effects of stopping bleeding and promoting circulation",
            "hei pu huang (pu huang that has been stir fried till dark color) is used in stopping bleeding"
        ],
        "Dosage": "3 to 10 g. Wrap and boil with water. 3～10克，包煎。",
        "Samples of Formulae": "Inflammation of the intestine and difficulty in urination: pu huang 50 g, xiong huang (realgar) 10 g, bing pian (borneol) 3 g, fresh white part of green onion 200 g (wash green onion, boil in water 3 minutes, smash all herb and apply as a warm paste to the lower abdomen).\n\nBleeding and abdomen ache due to chronic colitis: pu huang 3 g, wu ling zhi (Trogopterus dung) 3 g (wrap in cloth), baked ge gen (kudzu root) 10 g, baked rou dou kou (nutmeg) 3 g. Make into decoction and use as tea.\n\nExternal injury of the head with swelling: use raw pu huang and apply to injury, 3 times a day.",
        "Contraindications": "Not to use in cases of bleeding due to blood stasis and during pregnancy. Because raw pu huang can constrict uterus, pregnant women should avoid using it; but it can be used in bleeding due to lack of constriction after giving birth.\n\nThe herb can be toxic to the liver.\n\n瘀滯出血及孕婦忌服。 生蒲黄有收缩子宫的作用，故孕婦忌服， 但可用于產後子宫收缩不良的出血。\n\n本品對肝臟有毒。",
        "Research": "",
        "Notes": "",
        "Chemical Ingredients": {
            "": [
                "icosanoic acid (二十烷酸)",
                "stearic acid (十八烷酸)",
                "β-sitosterol (β-谷甾醇)",
                "vanillic acid (香草酸)",
                "pyrimidine-2,4(1H, 3H)-DIONE (嘧啶-2,4（1H,3H）-二酮)"
            ]
        },
        "References": [
            "http://www.cmstar.com.tw/C08_MeduserView.asp?InfoNo=124&selOpt="
        ],
        "Further Reading": [],
        "Original Text": "\n\n\n\npu huang, Complementary and Alternative Healing University\n\n\n\n\n\n\n\n\nComplementary and Alternative Healing University\n    \n \n\n\n\n\n\n中藥詞典    Chinese Herb Dictionary    \n     \n\n\nSearch this site\n       \n    在本網站找資料\n\n\n\n\n\n\n \n\npu huang \n蒲黃\n \n\nTranslated\n    by: Joe Hing kwok Chu \n    朱 興 國 編 譯\n\n\nA manuscript... writing and translation in progress\n\n\n\n\n\nPresent Day Applications:\n\n現代應用﹕\n\n\n\nFor coronary diseases, angina.\n\n現代用於冠心病,  心絞痛。\n\n\n\n\n\nPharmaceutical name:\n\n英文藥名﹕\n\n\n\nPollen Typhae\n\n\n\n\n\nBiological name:\n\n拉丁文學名 ﹕\n\n\nTypha angustifolia \n        L. 水燭香蒲\n\n\n        Typha angustata Bory et Chauberd \n        長苞香蒲\nTypha orientalis \n        Pres\n\n\n\n\n\n        Pron. in Japanese:\n\n        日語發音﹕\n\n\n\nhoo\n\n\n\n\n\n        Pron. in Korean:\n\n        韓語發音﹕\n\n\n\npohwang\n\n\n\n\n\n        Pron. in Cantonese:\n\n        粵音﹕\n\n\n\npoh wang\n\n\n\n\n\nOther Names:\n\n別名﹕\n\n\n\n　　\n\n\n\n\npu li hua fen\n\n\n\n蒲厘花粉\n\n\n\n\n\npu hua\n\n\n\n蒲花\n\n\n\n\n\npu bang hua fen\n\n\n\n蒲棒花粉\n\n\n\n\n\npu cao huang\n\n\n\n蒲草黃\n\n\n\n\n\nshui la zhu\n\n\n\n水蠟燭\n\n\n\n\n\nmao la zhu\n\n\n\n毛蠟燭\n\n\n\n\n\n\n\n\n        Common Name:\n\n        英文名﹕\n\n\n\ncattail pollen\n\n\n\n\n\nDistribution:\n\n產地﹕\n\n\n\nJiangsu, Zhejiang, Shandong, Anhui, Hubei\n\n\n\n\nProperties\n(characteristics)﹕\n性\n        味﹕\n\n\n\nsweet, neutral.\n\n味甘，性平。 炒味澀。\n\n\n\n\n\nChannels (meridians) \n        entered:\n \n\n歸經﹕\n\n\n\nliver, pericardium.\n\n肝,  心包经\n\n\n\n\nMedical functions:\n藥理﹕\n \n\n\n\nMedical functions:\n\n\n\nconstricts uterus\n\n\n\nstops bleeding; shorten blood coagulation \n          time\n\n\n\nlowers blood cholesterol\n\n\n\nanti-coagulation\n\n\n\npromotes urination\n\n\n\n藥理﹕\n \n\n\n\n收縮子宮\n\n\n\n止血，能縮短凝血時間\n\n\n\n降低血清膽固醇\n\n\n\n抗凝\n\n\n\n利尿\n\n\n \n\n\n\n\n\nActions & Indications:\n\n主治﹕\n\n\n\nhei pu huang is pu huang that \n        has been stir fried till dark color. It is being used in stopping bleeding.\n        Raw pu huang possesses double effects of \n        stopping bleeding and promoting circulation.\n\nFor treatment of :\n\n\n\nAngina\n\n\n\nblood clot in the brain\n\n\n\nhigh blood lipids\n\n\n\nInflammation of the intestine \n          and difficulty in urination: pu huang \n          50 g, xiong huang 10 g, bing pian 3 g, fresh white part of green onion \n          200 g,(wash the part of green onion and boil in water for 3 minutes. Smash \n          all herb past it to the lower abdomen while still warm.\n\n\n\nBleeding and abdomen \n          ache due to chronic colitis: pu huang 3 g, wu ling zhi 3 g (wrap \n          in cloth), baked ge gen 10 g, baked rou dou kou 3 g. Make into decoction \n          and use as tea.\n\n\n\nExternal injury of the head \n          with swelling: use raw pu huang and \n          apply to the injury, 3 times a day.\n\n\nBleeding in external injuries\n\n\n\nHemorrhoids\n\n\n\nBoils\n\n\n\nInflammation of the rib \n          cartilage (without pus)\n\n\n\nRash in babies\n\n\n\n\n\n\n\n\n\n\n\n\n\n\n\n\n\n\n\n \n\n\n\n\n\nChemical ingredients:\n\n化學成份﹕\n\n\nicosanoic acid, stearic acid, β-sitostterol,  vanillic acid, pyrimidine-2,4(1H, 3H)-DIONE.\n二十烷酸、十八烷酸、β-谷甾醇、香草酸、嘧啶-2,4（1H,3H）-二酮。\n\n\n\n\n\nDosage:\n\n用量﹕\n\n\n\n3 to 10 g. Wrap and boil with water.\n\n3～10克。包煎。\n\n\n\n\n\nSamples of formulae\n\n:處方舉例﹕\n\n \n\n\n\n\nModern Research:\n\n現代研究﹕\n\n \n\n\n\n\nCautions:\n\n禁忌﹕\n\n\n\nNot to use in cases of  bleeding due \n        to blood stasis and during pregnancy. Because of raw pu huang can constrict \n        uterus, so pregnant women should avoid using it; but it can be used in bleeding \n        due to lack of constriction after giving birth.\n\nThe herb can be toxic to the liver.\n\n瘀滯出血及孕婦忌服。 生蒲黄有收 縮子宫的作用，故孕婦忌服， 但可用于產後子宫收 縮 \n        不良的出血。\n\n\n        本品對肝臟有毒。\n\n\n可參考﹕　\nhttp://www.cmstar.com.tw/C08_MeduserView.asp?InfoNo=124&selOpt=\n \n\n\nSearch this site\n\n\n\nProblems with website? Please \n\nClick here \n    for comment. (Not for inquiry )    \n    \n\n\nClick \n    here for inquiry \n\n\n\nCopyright Notice \n\n按此看關於版權問題\n\n\n\n\nSponsors' Ads by Google \n    以下為谷歌 所提供之廣告\n\n\n\nA manuscript... writing, translating and proofreading  in progress\n\n\n\n\n\n\n\n\nList \n        of Health Problems\n\n\n\n\n\nQigong \n        (chi kung)\n\n\n\n\n\nToxicity of Some Herbs\n\n\n\nSide Effect of Some Herbs\n\n\n\nHerbs that can be toxic to kidneys\n\n\n\n\n\n        Traditional Chinese Medicine\n \n\n\nTCM Diagnosis\n \n\n\nSamples \n        of Formulae\n\n\n\n\n\n        Terms of Traditional Chinese Medicine\n\n\n\n        Acupuncture\n\n\n\n\n\n\ncopy right\n \n\n\n版權所有\n\n\n\n\n\nQigong classes\n\n\n\n\n\n        Prescribed Drug Dictionary\n\n\n\n\nEmail \n        our web master for  your suggestion (not for inquiry)\n\n\n\n\nBiochemistry Dictionary\n\n\n\n\n \n\n\n\n\nQigong classes\n\n\n \n\n\n\n\nResearch Librarian\n\n\n \n\n\n\n\n \n\n\n\n\nHome\n\n\n\n\n\n        Weather Report\n\n\n\n\nDisclaimer\n\n\n\nLast update: Sept 8, 2014; 10:50  \n        p.m. LAH\n\n\n\n\n\n\n \n\n\n\n\n\n\n\n\n\n",
        "original_url": "http://alternativehealing.org/pu_huang.htm"
    }
]