[
  {
    "Names": {
      "Name": ["wu jia pi", "nan wu jia pi (southern wu jia pi)"],
      "Pharmaceutical": ["Cortex Acanthopanacis Gracilistyli Radicis"],
      "Biological": [
        "Acanthopanax spinosus Mig.",
        "Acanthopanax gracilistylus Smith."
      ],
      "Common": ["acanthopanax root bark"],
      "Other name": [""],
      "Chinese": ["五加皮", "南五加皮"],
      "Pronunciation in Korean": ["ogap'i"],
      "Pronunciation in Japanese": ["gokahi"],
      "Pronunciation in Cantonese": ["ng5 gaa1 pei4"],
      "Pinyin Pronunciation": ["wu jia pi", "nan wu jia pi"]
    },
    "Type": "Herb",
    "Geography": [
      "Henan",
      "Sichuan",
      "Hunan",
      "Guangdong",
      "Hebei",
      "Shanxi",
      "Shandong"
    ],
    "Properties": ["warm", "spicy", "bitter"],
    "Meridians": ["kidney", "liver"],
    "Maladies Treated": [
      "rheumatism",
      "weakness in joints and muscles",
      "urination difficulty",
      "edema"
    ],
    "Medical Function": [
      "dispels cold dampness pain",
      "aids in development of walking in toddlers",
      "for reducing swelling"
    ],
    "Dosage": "4.5~15 grams; 4.5～15 克。",
    "Samples of Formulae": "",
    "Contraindications": "Herb gatherers in the northern part of China usually use gang liu pi (xiang jia pi) (Asclepiadaceae) as “northern wu jia pi.” Most herb stores use northern wu jia pi in making wu jia pi wine.According to research of Zhao Zi Huang, long term use of wu jia pi wine causes death. Toxic reactions of wu jia pi wine made from northern wu jia pi include blindness, numbness in limbs, dizziness, and headache.\nUse caution in patients with yinxu (yin deficient) and excessive heat.",
    "Research": "northern wu jia pi is a heart stimulant which is toxic for the heart.",
    "Notes": "Also see Siberian Ginseng (刺五加).",
    "Chemical Ingredients": [
      "syringin (紫丁香甙)",
      "(-)ent-kaur-16-en-19-oic acid",
      "16 aplpha hydroxy-I-kauran-19-oic acid",
      "stearic acid (硬脂酸)",
      "d-sesamin (d-芝麻素)",
      "vitamins A and B (维生素 甲，乙)",
      "calcium oxalate (草酸鈣)",
      "palmic acid (棕櫚酸)",
      "Root bark: obtained six compounds (diterpenoids, etc.): wu jia acid (五加酸, I); kaurenoic acid (異貝殼杉烯酸, II); l-sesamin (l-芝麻素, III); stigmasterol (豆甾醇, IV); β-sitosterol (β-谷甾醇, V); eleutheroside B (刺五加苷B, VI)"
    ],
    "References": [
      "[A]",
      "劉向前[1] 陸昌洙[3] 張承燁[2]",
      "[1] 中南大學化學化工學院制藥工程系, 湖南長沙 410008",
      "[2] 韓國食品醫藥品安全廳, 韓國漢城",
      "[3] 慶熙大學藥學院生藥學研究室, 韓國漢城"
    ],
    "Further Reading": ["Also see Siberian Ginseng (刺五加)"],
    "Original Text": "wu jia pi,Acanthopanax spinosus Mig., Acanthopanax gracilistylus Smith., Complementary and Alternative Healing UniversityComplementary and Alternative Healing University  Home  現代 中藥辭典Search this siteList of Health ProblemsChinese Herb DictionaryQigongTraditional Chinese Medicine (TCM)AcupuncturePrescribed Drug DictionaryBiochemistry DictionaryLecture SlidesResearch LibrarianGeneral Online LibrarySearchResearch SitesViagraMassage/AcupressureHypnotherapyTell us what you wantNotify Changes & New Information　To post your discussion, click here           　　                     wu jia pi  五加皮nan wu jia pi (southern wu jia pi)By: Joe Hing Kwok ChuClick here to see picture of herb.  按此看五加皮飲片圖。Pharmaceutical name:英文药名：Cortex Acanthopanacis Gracilistyli RadicisBiological name:拉丁名：Acanthopanax spinosus Mig. (Acanthopanax gracilistylus Smith.)Pron. in Japanese:日語發音：gokahiPron. in Korean:韓語發音：ogap'iPron. in Cantonese:粤語發音：ng5 gaa1 pei4Common Name:英文名：acanthopanax root barkDistribution:分佈：Henan, Sichuan, Hunan, Guangdong, Hebei, Shanxi, Shandong provinces of China.河南，四川，湖南，廣東，河北，山西，山東等省。Properties (characteristics)：性味：warm, spicy. bitter温，辣，苦。Channels (meridians) entered:歸經：kidney, liver腎，肝。Actions & Indications:主治：dispels cold dampness pain, rheumatism, weakness in joints and muscles, aids in development of walking in toddlers, for urination difficulty, edema, and for reducing swelling.驅寒湿風痛，風濕，關結肌肉無力，帮助小兒學走路，治小便困难，水腫。Dosage:用量： 4.5~15 grams4.5 ～15 克。Chemical Ingredients:化學成份：syringin 紫丁香甙, (-)ent-kaur-16-en-19-oic acid, 16 aplpha hydroxy-I-kauran-19-oic acid, stearic acid 硬脂酸, d-sesamin d-芝麻素, vitamins A and B 维生素 甲，乙, calcium oxalate 草酸鈣, palmic acid 棕櫚酸 從根皮中得到二萜類等6個化合物：五加酸(Ⅰ)，異貝殼杉烯酸 kaurenoic acid (Ⅱ)，l-芝 麻素 l-sesamin(Ⅲ)，豆甾醇 stigmasterol(Ⅳ)，β-谷 甾醇  β-sitosterol(Ⅴ)和刺五加苷B eleutheroside B(Ⅵ)。[A]Modern Research:现代研究：northern wu jia pi is a heart stimulant which is toxic for the heart.北五加皮能刺激心臟，對心臟有毒。Caution:禁忌：Herb gatherers in the northern part of China usually use gang liu pi (xiang jia pi) (belongs to the Asclepiadaceae family) as \"northern wu jia pi.\" Most herb stores use northern wu jia pi in making wu jia pi wine. According to research of Zhao Zi Huang, long term use of  wu jia pi wine causes death. Toxic reactions of wu jia pi wine made from northern wu jia pi include blindness, numbness in limbs, dizziness, and headache; long term use may cause death.Use caution in patients with yinxu (yin deficient) and excessive heat.北五加皮（香加皮）有毒。屬於摩科植物杠柳 很多药店用來制五加皮酒。有毒反應包括致盲，四肢麻木，眩晕，頭痛，久服能致死。陰虛有熱者须小心應用。 Also see Siberian Ginseng    按此看刺五加  .[A] 劉向前[1] 陸昌洙[3] 張承燁[2] [1]中南大學化學化工學院制藥工程系,湖南長沙410008 [2]韓國食品醫藥品安全廳,韓國漢城 [3]慶熙大學藥學院生藥學研究室,韓國漢城Sponsors' Ads by Google 以 下為谷歌所提供之廣告 A manuscript... writing, translating and proofreading              in progress Click here for inquiry  Copyright Notice 按此看關於版權問題List of Health ProblemsChinese Herb DictionaryToxicity of Some HerbsSide Effect of Some HerbsHerbs that can be toxic to kidneysTraditional Chinese MedicineTCM DiagnosisSamples of FormulaeAcupuncturecopy right 版權所有Qigong (chi kung)Prescribed Drug DictionaryEmail our web master for  your suggestion (not for inquiry)Biochemistry DictionaryGeneral Online LibraryQigong classesFake Email WarningResearch LibrarianSearchQigong classesHomeWeather Report    DisclaimerLast update: Oct 1, 2010; 3 p.m. LAH  \n",
    "original_url": "http://alternativehealing.org/wu%20jia%20pi.htm"
  },
  {
    "Names": {
      "Name": ["e zui hua (鱷嘴花)"],
      "Pharmaceutical": ["Herba Clinacanthus"],
      "Botanical": ["Clinacanthus nutans (Burm. f.) Lindau"],
      "Common": ["English: Drooping Clinacanthus; snake plant"],
      "Chinese": [
        "鱷嘴花",
        "憂遁草",
        "扭序花",
        "暹羅蛇草",
        "小接骨",
        "青箭《廣西藥植名錄》",
        "柔刺草",
        "竹枝黃",
        "竹黃",
        "剽黃",
        "竹葉青",
        "竹兒王",
        "竹節王",
        "竹節黃《中草藥植物》",
        "拔彈藤",
        "柔枝節骨草",
        "雅配牙鈞（泰族名）"
      ],
      "Other name": [
        "you dun cao 憂遁草",
        "you dun cao 優遁草",
        "niu xu hua 扭序花",
        "Siam snake grass 暹羅蛇草",
        "xiao jie gu 小接骨",
        "qing jian 青箭《廣西藥植名錄》",
        "rou ci cao 柔刺草",
        "zhu zhi huang 竹枝黃",
        "zhu huang 竹黃",
        "piao huang 剽黃",
        "zhu qing ye 竹葉青",
        "zhu er wang 竹兒王",
        "zhu jie wang 竹節王",
        "zhu jie huang 竹節黃《中草藥植物》",
        "ba tan teng 拔彈藤",
        "rou zhi jie gu cao 柔枝節骨草",
        "雅配牙鈞（泰族名）",
        "Belalai gajah (Malaysia)",
        "ki tajam (Sunda)",
        "dandang gendis (Jawa)",
        "salet",
        "phangphong (Thailand)",
        "mảnh cộng (Vietnam)",
        "lá cầm (Vietnam)",
        "bìm bịp (Vietnam)",
        "xương khỉ (Vietnam)",
        "Sabah snake grass (Singapore, Malaysia)"
      ],
      "Pronunciation in Korean": ["yōuduncho (優遁草)"],
      "Pronunciation in Japanese": ["yudunsou (優遁草)"],
      "Pronunciation in Cantonese": ["ngok6 zeoi2 faa1 (鱷嘴花)"],
      "Pinyin Pronunciation": ["you dun cao", "e zui hua"]
    },
    "Type": "Herb",
    "Geography": [
      "Yunnan; Guangxi; Guangdong; Hainan provinces of China",
      "Thailand",
      "Vietnam",
      "Malaysia",
      "Indonesia",
      "other parts of southern Asia"
    ],
    "Properties": ["sour", "sweet", "light bitter and acrid", "bland", "cool"],
    "Meridians": ["Liver", "Kidney"],
    "Maladies Treated": [
      "Hematoma (whole plant)",
      "Contusion (whole plant)",
      "Strains and sprains of injuries (whole plant)",
      "Rheumatism (whole plant)",
      "Dysuria (whole plant)",
      "Dysentery (whole plant)",
      "Poisonous snake bites",
      "Insect bites",
      "Herpes simplex II [3]",
      "Varicella-zoster virus [3] [6]",
      "Allergic responses",
      "Jaundice type of hepatitis",
      "Lymphoma",
      "Breast cancer",
      "Prostate cancer",
      "Uterus cancer",
      "Kidney failure",
      "High uric acid",
      "Lung cancer",
      "Diarrhea (Indonesia folk use: fresh herb preparation)"
    ],
    "Medical Function": [
      "Anti-inflammatory effect: inhibition of neutrophil responsiveness [2] [7]",
      "Antioxidant [8]",
      "Against antiproliferative affect on cultured cancer cells [8]"
    ],
    "Dosage": "Whole dry herb 15–30 g, decoction, take orally. External application: use fresh whole herb, smash and apply on affected area.",
    "Samples of Formulae": "Hepatitis with jaundice, or acites caused by hepatitis: dry herb 30 g. Add water, make into decoction and take orally. If fresh herb is used, use about 120 g, add drinking water, smash to make juice, take orally.\n\nHepatitis with jaundice: Xi shu guo (noni fruit) 30 g, You dun cao (Sabah snake grass) 30 g, Xiang lin tou (pandan leaves) 60 g. Boil with water and take orally. (Source: Hulu.com, Section of Experienced Formulae) * See Possible Toxicity and Cautions.\n\nDiarrhea (Indonesia folk use): fresh herb one handful, water five cups decoct to three cups; divide into three doses and take.",
    "Contraindications": "Caution on Noni fruit:\nThe Panel on Dietetic Products, Nutrition and Allergies of European Food Safety Authority concludes that “Morinda citrifolia (Noni) fruit puree and concentrate as novel food ingredients” under the specified conditions are considered safe for the general population. However the Panel considers that the increasing number of case reports might indicate that some individuals have a particular sensitivity for hepatotoxic effects to noni fruit products.\n\nNoni fruit (and its products) are listed by the U.S. State Food and Drug Administration (FDA) as toxic items. There are reports that:\n(1) those with renal dysfunction had higher chance for renal damage.\n(2) more cases of acute hepatitis have been reported after consumption of noni products.",
    "Research": "Modern Research: See bibliography.\n(more to be uploaded)",
    "Notes": "Literally: crocodile mouth flower.",
    "Chemical Ingredients": [
      "Lupeol (羽扇豆醇)",
      "Betulin (白樺脂醇)",
      "Pentacyclic triterpenoids (五環三萜化合物)",
      "Sulfur-containing glycosides (硫配糖体) [1]",
      "132-hydroxy-(132-R)-phaeophytin a",
      "132-hydroxy-(132-R)-phaeophytin b",
      "132-hydroxy-(132-S)-phaeophytin a",
      "132-hydroxy-(132-S)-phaeophytin b",
      "132-hydroxy-(132-R)-chlorophyll b",
      "132-hydroxy-(132-S)-chlorophyll b",
      "Stigmasteryl-3-O-β-D-glucopyranoside"
    ],
    "References": [
      "[1] http://jglobal.jst.go.jp/public/20090422/200902107598739863",
      "[2] Journal of Ethnopharmacology Volume 116, Issue 2, 5 March 2008, Pages 234-244",
      "[3] http://thaiherbinfo.com/en/herb_in_product.php?id_pro=3697",
      "[4] Bioorganic & Medicinal Chemistry Volume 17, Issue 5, 1 March 2009, Pages 1857-1860",
      "[5] [6]J Med Assoc Thai. 1995 Nov;78(11):624-7.",
      "[7] Journal of ethnopharmacology, 2008 Mar. 5, v. 116, no. 2",
      "[8] Evid Based Complement Alternat Med. 2013;2013:462751. doi: 10.1155/2013/462751. Epub 2013 Feb 27."
    ],
    "Further Reading": [],
    "Original Text": "\n\n\ne zui hua, Sabah snake grass, Complementary and Alternative Healing University\n\n\n\n\n\n\n\n\nComplementary \n    and Alternative Healing \nUniversity\n Home\n     \n\n\n中藥詞典  \n\nChinese \n    Herb Dictionary        \n    \n\n    Search this site\n\n\n\n\n\n\n\n\n\n\n\n\n\n\n\n\nSearch this \n        site\n\n\n\n\n\n\nList \n        of Health Problems\n\n\n\n\n\n\nChinese \n        Herb Dictionary\n\n\n\n\n\n\nQigong\n\n\n\n\n\n\n\n        Traditional Chinese Medicine TCM\n\n\n\n\n\n\n\n        Acupuncture\n\n\n\n\n\n\n\n        Prescribed Drug Dictionary\n\n\n\n\n\n\nBiochemistry Dictionary\n\n\n\n\n\n\nLecture Slides\n\n\n\n\n\n\nResearch Librarian\n\n\n\n\n\n\nGeneral \n        Online Library\n\n\n\n\n\n\nSearch\n\n\n\n\n\n\nResearch Sites\n\n\n\n\n\n\n\n        Viagra\n\n\n\n\n\n\nMassage/Acupressure\n\n\n\n\n\n\nHypnotherapy\n\n\n\n\n\n\nTell us what you want\n\n\n\n\n\n\nNotify Changes \n        & New Information\n\n\n\n\n\n　\n\n　\n \nTo post your \n        discussion \n        click here.\n\n　\n \n \n \n \n\n　\n \n \n \n \n \n \n\n　\n\n　\n \n \n \n \n\n　\n\n　\n\n　\n\n　\n\n　\n \n \n \n \n \n \n \n \n \n \n \n \n \n \n \n \n \n \n \n \n \n \n \n \n \n \n \n \n \n \n \n \n \n \n \n \n \n\nLast update: Oct 16, 2013; 10:00 P.M. \n        LAH\n \n\n\n\n\n\ne zui hua \n    鱷嘴花 (literally: \n    crocodile mouth flower) \n ( \n    in English and Chinese 中英文)\n\n\nby: \n    Joe Hing kwok Chu  \n  \n朱興國編\n    譯  \n\n\n\n\nPharmaceutical \n        name:\n\n英文藥 \n        名﹕\n\n\nHerba Clinacanthus\n\n\n\n\n\nBotanical \n        name:\n拉丁生物學 \n        名﹕\n\n\nClinacanthus \n        nutans (Burm. f.) Lindau\n\n\n\n\nPron. in Japanese:\n日語發音﹕\n\n\nyudunsou(優遁草)\n\n\n\n\nPron. in Korean:\n韓語發音﹕\n\n\nyōuduncho \n        (優遁草)\n\n\n\n\n\n\n\n        Pron. in Cantonese::\n粵音﹕\n\n\nngok6 zeoi2 \n        faa1 (鱷嘴花)\n\n\n\n\nOther Names:\n別名﹕\n\n\nyou dun cao 憂遁草，you dun cao \n        優遁草，niu xu hua 扭序花，Siam snake grass 暹羅蛇草，xiao \n        jie gu 小接骨 ，qing jian 青箭《廣西藥植名錄》，rou ci cao 柔刺草，zhu zhi huang 竹枝黃，zhu huang \n        竹黃，piao huang 剽黃，zhu qing ye 竹葉青，zhu er wang 竹兒王，zhu jie wang 竹節王，zhu jie \n        huang 竹節黃 《中草藥植物》， ba tan teng 拔彈藤，rou zhi jie gu cao 柔枝節骨草，雅配牙鈞（泰族名）。\nBelalai gajah (Malaysia), ki \n        tajam (Sunda), dandang gendis (Jawa), salet\nphangphong (Thailand), \n        mảnh cộng; l� cầm; b骻 bịp; xương khỉ (Vietnam)\nSabah snake \n        grass (Singapore, Malaysia).\n\n\n\n\nCommon Name:\n英文名﹕\n\n\nDrooping Clinacanthus, snake plant\n\n\n\n\nDistribution:\n產地﹕\n\n\n\nYunnan; Guangxi; Guangdong; Hainan provinces of China,  \n        also in Thailand, Vietnam,  Malaysia, Indonesia. and other parts of \n        southern Asia.\n中國的雲南，廣西，廣 \n        東，海南，等省，泰國，越南，馬來西亞，印尼與亞洲南部各地等。\n\n\n\n\nProperties\ncharacteristics﹕\n性味﹕\n\n\n\nsour, sweet, light bitter and acrid, bland, cool.\n\n酸，甘，微苦澀，淡，涼。\n\n\n\n\nChannels meridians \n        entered:\n \n歸經﹕\n\n\n\nliver, kidney.\n\n肝，腎。\n\n\n\n\n\nMedical \n        functions:\n\n藥 \n        理﹕\n \n\n\n\n\nanti-inflammatory effect: inhibition \n          of neutrophil responsiveness [2] [7]\n\n\n\nantioxidant [8]\n\n\n\nagainst antiproliferative \n          affect on cultured cancer cells  [8]\n\n\n \n\n\n抗氧化劑[8]\n\n\n\n有抗培養的癌細胞增殖的作用[8]\n\n\n抗炎作用：抑制中性粒 \n          細胞 (過度的) 反應 [2] [7]\n\n\n(more to be \n        uploaded)\n\n\n\n\n\nActions \n        & Indications:\n\n主 \n        治﹕\n\n\nThe whole plant is used to treat inflammatory conditions like hematoma, contusion, strains and sprains of injuries\n and rheumatism; also for dysuria, dysentery.\nIn Thailand the plant is famous for treatment of poisonous snake bites; also for insect bites, herpes simplex II [3], \nvaricella-zoster virus [3] [6], allergic responses.\nNow it is being used in treating jaundice type of hepatitis,  lymphoma, breast cancer, \nprostate cancer, uterus cancer, kidney failure, high uric acid, lung cancer.\n \n全草用於治療發炎如 \n        ：血腫，挫傷，拉傷，扭傷，風濕病；並用於排尿痛苦，下痢。\n在泰國此是出名治毒 \n        蛇咬傷之草藥，並用來治生殖器皰疹[3]，水痘 (帶狀疱疹病毒)[3][6]，腹瀉。\n\n在印尼民間用本品治腹瀉：新鮮藥草一握，水五杯煎成三杯。分作三次服。\n\n現代還用於治療黃疸型肝炎，淋巴癌，乳癌，前列腺癌，子宮癌，肺癌，高尿酸症，腎臟功能衰竭。\n\n\n\n\n\nChemical \n        ingredients:\n\n化 \n        學成份﹕\n\n\nlupeol (羽扇豆醇). betulin (白樺脂醇);\n        pentacyclic triterpenoids (五環三萜化合物); sulfur-containing \n        glycosides(硫配糖体)[1]' \nCompounds \n        with structures related to chlorophyll A and chlorophyll B,  namely 132-hydroxy-(132-R)-phaeophytin \n        a, 132-hydroxy-(132-R)-phaeophytin \n        b, 132-hydroxy-(132-S)-phaeophytin a,  132-hydroxy-(132-S)-phaeophytin b, 132-hydroxy-(132-R)-chlorophyll  b,  132-hydroxy-(132-S)-chlorophyll  b.  \n\nAlso contain: stigmasteryl-3-O-B-D-glucopyranoside.\n\n\n\n\nDaly Dosage:\n每日用量﹕\n\n\nUse the the \n        whole dry herb of15~30 g for decoction and take orally. External application: \n        use fresh herb. Smash and apply on affected area.\n全草15~30 克， \n        水煎服。外用鮮全草搗爛外敷。\n\n\n\n\nSamples of \n        formulae:\n處方舉例﹕\n\n\nHepatitis \n        with jaundice, or acites caused by hepatitis: dry herb 30 g. Add water and \n        make into decoction and take orally. If fresh herb is being used, use about \n        120 g, add drinking water. Smash and make juice. Take orally.\n\n\n\n        Hepatitis with jaundice: xi shu guo (noni fruit) 30 g,\n        sabah \n        snake grass (you dun cao) 30 克，\n\n\n\nfresh pandan \n        leaves 60 克. Boil with water and take orally. (Source: Hulu.com, \n        Section of Experienced Formulae)* See \n        Possible Toxicity and Cautions:.\n黃疸型肝炎，或肝炎引 \n        起腹水：乾品30克，水煎服。如用鮮品，取120 克加開水搗爛取汁服用。\n\n\n\n黃疸型肝炎：諾利果30gm，沙巴蛇草(憂遁草)30gm，香林投鮮葉60gm，水煎服。(葫蘆網．驗方組)* \n        看可能對肝臟有毒條。\n\n\n\n\n\nModern \n        Research:\n\n現 \n        代研究﹕\n\n\nSee \nbibliography.\n\n看以下參考書目.\n\n\n\n\n\nToxicity \n        & Cautions:\n\n毒 \n        素與禁忌﹕\n\n\n\n\n\n\n\n\nCaution on Noni fruit:\nThe Panel on Dietetic Products, Nutrition and Allergies of European Food Safety Authority concludes that �Morinda \ncitrifolia (Noni) fruit puree and concentrate as novel food \ningredients� under the specified conditions are considered safe for the general population. \nHowever the Panel considers that the increasing number of case reports might indicate that some individuals have \na particular sensitivity for hepatotoxic effects to noni fruit products. \n \nNoni fruit (and its products) are listed by the U.S. State Food and Drug Administration (FDA) as toxic items.\nThere are reports that:\n(1) those with renal dysfunction had higher chance for renal damage.\n(2) more cases of acute hepatitis have been reported after consumption of noni products.\n \n諾利果可能對肝臟有毒\n歐洲食品安全局的飲食產品，營養和過敏專家小組得出結論認為諾麗諾麗果漿和濃縮新型食品\n對於一般人群，在特定條件下被認為是安全的。\n然而，小組認為，越來越多的病例報告可能表明，一些人對諾麗果產品的肝毒性作用特別敏感。\n\n\n \n本品(及其產品)被美國國家藥物食品管理局(FDA)列為有毒植物。\n有報告指出：\n(1)腎功能低下的人，更會造成腎功能的傷害。\n(2)多例在食用諾麗產品後，造成急性肝炎。\n \n \nBibliography：\n[1] http://jglobal.jst.go.jp/public/20090422/200902107598739863\n[2]\n    \n    Journal of Ethnopharmacology\n\n    Volume 116, Issue 2, 5 March 2008, Pages 234-244\n[3] http://thaiherbinfo.com/en/herb_in_product.php?id_pro=3697\n[4]\n    \n    Bioorganic & Medicinal Chemistry\n\n    Volume 17, Issue 5, 1 March 2009, Pages 1857-1860\n[5] [6]J \n    Med Assoc Thai. 1995 Nov;78(11):624-7.\n[7] Journal of ethnopharmacology, \n    2008 Mar. 5, v. 116, no. 2\n[8] \n\n    Evid Based Complement Alternat Med. 2013;2013:462751. doi: 10.1155/2013/462751. \n    Epub 2013 Feb 27.\n  \n \n \n\n\nSponsors' Ads by Google 以下為谷歌所提供贊助者之廣告\n\n\n \n \n\n\n\n\nA manuscript... writing, translating and proofreading  in progress\n\nProblems with website? Please \n\nClick here \n    for comment. Not for inquiry  \n    \n\n\nClick \n    here for inquiry \n \n \n \n\nCopyright Notice \n    按此看關於 版權問題\n\n\n\n\n\nList \n        of Health Problems\n\n\n\nChinese \n        Herb Dictionary\n\n\n\n\nToxicity of Some \n        Herbs\n\n\nSide Effect of Some Herbs\n\n\nHerbs \n        that can be toxic to kidneys\n\n\n\n\n\n        Traditional Chinese Medicine\n\n\nTCM Diagnosis\n\n\nSamples \n        of Formulae\n\n\n\n\nTerms of Traditional Chinese Medicine\n\n\n\n        Acupuncture\n\n\n\n\n\n\ncopy right\n \n\n\n版權所有\n\n\n\n\nQigong \n        chi kung\n\n\n\n\n        Prescribed Drug Dictionary\n\n\n\nEmail \n        our web master for  your suggestion ，not for inquiry\n\n\n\n\nBiochemistry Dictionary\n\n\n\n\n\n\nGeneral Online Library\n\n\n\n\nQigong classes\n\n\n\nLecture Slides\n\n\n\n\nResearch Librarian\n\n\n\n\nSearch\n\n\n\n\n\n\nQigong classes\n\n\n \n\n\n\nHome\n\n\n\n\n        Weather Report\n\n\n Disclaimer\n\n\n\n\n\n\n\n\n\n\n\n\n\n\n",
    "original_url": "http://alternativehealing.org/e_zui_hua.htm"
  },
  {
    "Names": {
      "Name": ["jiu xiang chong", "九香蟲"],
      "Pharmaceutical": ["Aspongopus"],
      "Botanical": ["Aspongopus chinensis Dallas", "Coridius chinensis Dallas"],
      "Chinese": [
        "九香蟲",
        "黑兜虫",
        "瓜黑蝽",
        "屁板虫",
        "蜣螂虫",
        "打屁虫",
        "屁巴虫"
      ],
      "Common": ["kamemushi"],
      "Other": [
        "hei dou chong 黑兜虫",
        "gua hei chong 瓜黑蝽",
        "pi ban chong 屁板虫",
        "jiang lang chong 蜣螂虫",
        "da pi chong 打屁虫",
        "pi ba chong 屁巴虫"
      ],
      "Pronunciation in Korean": ["guhyangchung"],
      "Pronunciation in Japanese": ["kyukocho"],
      "Pronunciation in Cantonese": ["gau2 heong1 cung4"],
      "Pinyin Pronunciation": []
    },
    "Type": "Animal",
    "Geography": [
      "Anhui",
      "Jiangsu",
      "Zhejiang",
      "Jiangxi",
      "Fujian",
      "Taiwan",
      "Hubei",
      "Hunan",
      "Guangxi",
      "Guangdong",
      "Sichuan",
      "Yunnan",
      "Guizhou"
    ],
    "Properties": ["salty", "warm"],
    "Meridians": ["liver", "spleen", "kidney"],
    "Maladies Treated": [
      "liver and spleen disharmony or cold constraint in the middle burner causing chest, flank, and epigastric distention and pain",
      "coldness in chest and stomach resulting in bulging and pain in the stomach area",
      "lumbar pain due to insufficient kidney yang",
      "achy loin due to lack of circulation",
      "impotence (陽痿)",
      "chest pain",
      "hemangioma; the content of the abdomen of jiu xiang chong applied externally 3–4 times daily for several days",
      "aneurysm; the content of the abdomen of jiu xiang chong applied externally 3–4 times daily for several days",
      "chronic asthmatic bronchitis; jiu xiang chong baked to brown, powdered, mixed with chicken egg and pan-fried with sesame oil for oral intake",
      "pain in stomach and intestines; jiu xiang chong combined with guang mu xiang to make an analgesic preparation",
      "gallbladder colic; jiu xiang chong combined with guang mu xiang to make an analgesic preparation",
      "ulcerative chronic colitis; decoction based on jiu xiang chong with bu gu zhi, wu wei zi, bai zhu, san qi, rou dou kou; total effective rate 87%",
      "geriatric atrophic gastritis (type A gastritis)"
    ],
    "Medical Function": [
      "Promotes circulation (行氣)",
      "Arrests pain (止痛)",
      "Warms the kidney and strengthens yang; corrects kidney yang deficient (溫腎壯陽)",
      "Strong inhibiting effect on Staphylococcus aureus, Salmonella typhi, Bacillus paratyphosus, Shigella dysenteriae",
      "Promotes metabolism"
    ],
    "Dosage": "For decoction: 3–9 g. In powder form: 1.5–3 g.",
    "Samples of Formulae": "For chest pain: Jiu Xiang Chong (Aspongopus) 90 g, baked Quan Xie (Scorpion) 60 g. Grind into powder. Mix with refined honey and form pills of 3 g each. Take orally half a pill each time, twice a day. Source: Jilin Chinese Herb.",
    "Contraindications": "According to Ben Cao Cong Xin: not suitable for decoction because its slippery characteristic may increase bowel movements. Use with care in case of yinxu with fire (陰虚火旺慎服).",
    "Research": "Clinical studies:\nHemangioma or aneurysm: use the content of the abdomen of live jiu xiang chong to smear on the hemangioma, 3–4 times daily; consecutive use for a few days can cure. (Jiangxu Traditional Chinese Medicine, 1996, 6: 24)\n\nChronic asthmatic bronchitis: bake jiu xiang chong till brown and grind into powder; mix with chicken egg, then pan-fry with sesame oil for eating. Treated 21 cases; total effective rate 100%. (Henan School of Traditional Chinese Medicine Journal, 1979, 4: 66)\n\nPain in stomach and intestines, or in gall bladder area: use jiu xiang chong with guang mu xiang to make an analgesic preparation; showed good effect for arresting pain. (Hunan School of Traditional Chinese Medicine Journal, 1990, 3: 157)\n\nUlcerated chronic colitis: use a decoction with jiu xiang chong as the main ingredient, adding bu gu zhi, wu wei zi, bai zhu, san qi, rou dou kou; total effective rate 87%. (Shaanxi Traditional Chinese Medicine, 1999, 4: 168)\n\nThere are reports of using a jiu xiang chong compound to treat geriatric atrophic gastritis (type A gastritis).",
    "Notes": "",
    "Chemical Ingredients": [
      "Jiu xiang chong oil: contains stearic acid, palmitic acid, oleic acid",
      "Protein (from the insect body)",
      "Chitin (甲殼質)",
      "The foul odor is attributed to aldehyde or ketone; the English text mentions flavonoid as a possible source of the odor"
    ],
    "References": [
      "[1] 《Zhong Hua Ben Cao 中華本草》",
      "Jiangxu Traditional Chinese Medicine, 1996, 6: 24",
      "Henan School of Traditional Chinese Medicine Journal, 1979, 4: 66",
      "Hunan School of Traditional Chinese Medicine Journal, 1990, 3: 157",
      "Shaanxi Traditional Chinese Medicine, 1999, 4: 168"
    ],
    "Further Reading": [],
    "Original Text": "jiu xiang chong, Complementary and Alternative Healing UniversityComplementary and Alternative Healing University  Home 現代中藥辭典Search this siteList of Health ProblemsChinese Herb DictionaryQigongTraditional Chinese Medicine (TCM)AcupuncturePrescribed Drug DictionaryBiochemistry DictionaryLecture SlidesResearch LibrarianGeneral Online LibrarySearchResearch SitesViagraMassage/AcupressureHypnotherapyTell us what you wantNotify Changes & New Information　　　    　      　　    　　　　　                              jiu xiang chong 九香蟲 by: Joe Hing kwok ChuPharmaceutical name:英文藥名﹕AspongopusBotanical name:學名﹕Aspongopus chinensis Dallas; Coridius chinensis DallasPron. in Japanese:日語發音﹕kyukochoPron. in Korean:韓語發音﹕\n  guhyangchungPron. in Cantonese::粵音﹕gau2 heong1 cung4Other Names:別名﹕hei dou chong 黑兜虫，gua hei chong 瓜黑蝽，pi ban chong 屁板虫，jiang lang chong 蜣螂虫，da pi chong 打屁虫，pi ba chong 屁巴虫Common Name:英文名﹕kamemushiDistribution:產地﹕\n  Anhui, Jiangsu, Zhejiang, Jiangxi, Fujian, Taiwan, Hubei, Hunan, Guangxi, \n  Guangdong, Sichuan, Yunnan, Guizhou provinces of China.\n  分佈於安徽，江蘇，浙江，江西，福建，台灣，湖北，湖南，廣西，廣東，四川，雲南，貴州等省。Properties(characteristics)﹕性味﹕salty, warm鹹，溫。Channels (meridians) entered: 歸經﹕liver, spleen, kidney.肝 ，脾，腎。Medical functions:藥理﹕ jiu xiang chong possesses a strong inhibiting effect on  Staphylococcus aureus, Salmonella typhi,  Bacillus paratyphosus, Shigella dysenteriae, and also promote metabolism.九香虫對金黃色葡萄球菌，傷寒杆菌，副傷寒杆菌，福氏痢疾杆菌有較強的抗菌作用；並有促進機體新陳代謝作用。Actions & Indications:主治﹕\n  Promotes circulation, arrests pain, corrects \n\n  kidney yang deficient.\n\nBeing used inliver and spleen inharmony or \n  coldness in chest and stomach resulting in bulging and pain in the stomach \n  area, also in achy loin due to lack of circulation, and in impotence.\n行氣止痛；溫腎壯陽。主 肝脾失和或寒郁中焦所致的胸歷脅胃脘脹痛以及堅陽不足之腰痛，陽痿 \n  [1]Chemical ingredients:化學成份﹕Contains: iu xiang chong oil. The oil contains stearic acid, palmitic acid, oleic acid. protein chitin aldehyde or flavonoid (where the foul smell originated)九香虫油，油中含硬脂酸，棕櫚酸，油酸，其臭味來源於醛或酮，還含蛋白質，甲殼質等。Daly Dosage:每日用量﹕For decoction: 3 to 9 g.  In powder form: 1.5 to 3 g.煎服，3～9 g。入丸，散劑服，1.5～3 g。Samples of formulae:\n  處方舉例﹕For chest pain: jiu xiang chong 90 g,\n  bake \n  quan xie 60 g. Grind into powder. Mix with refined honey and make into \n  pills of 3 g each. Take orally half a pill each time, twice a day.  \n  (Source: Jilin Chinese Herb)Also see modern \n  research item below.\n治胸脘脅痛：九香虫三兩，炙全蠍二兩。研末，蜜丸，每丸一錢重。每次半丸，日服二次。（《吉林中草藥》）\n看下面現代研究條。Modern Research:現代研究﹕Clinical studies:Hemangioma or aneurysm: use the content of the abdomen of jiu xiang chong to smear on the hemangioma consecutively for a few days. (Jiangxu Traditional Chinese Medicine, 1996, 6: 24)Chronic asthmatic bronchitis: bake jiu xiang chong till brown and grind into powder. Mix with chicken egg, pan fry with sesame oil. (for eating).(Henan School of Traditional Chinese Medicine Journal, 1979, 4: 66)Pain in stomach and intestines, or in gall bladder area: use jiu xiang chong, guang mu xiang. It showed good effect for arresting pain. (Hunan School of Traditional Chinese Medicine, 1990, 3: 157)Ulcerated chronic colitis: use jiu xiang chong as main ingredient, add bu gu zhi, wu wei zi, bai zhu, san qi, rou dou kou. Make into decoction. Effective rate was 87%. (Shaanxi Traditional Chinese Medicine, 1999, 4: 168)There are report jiu xiang chong is being used in geriatric atrophic gastritis (type A gastritis)臨床研究：血管瘤：以活體九香虫腹腔內容物均勻塗布血管瘤上，每日3～4次，外治血管瘤，連用數日可愈（江蘇中醫，1996，6：24）；慢性喘息性支氣管炎：將九香虫用火焙焦研细，與雞蛋攪勻，在用芝麻油煎雞蛋食用，治療慢性喘息性支氣管炎21例，總有效率100％（河南中醫學院學報，1979，4：66）；胃腸疼痛，膽絞痛等：用九香虫，廣木香等制成止痛靈，臨床用於胃腸疼痛，膽絞痛等，止痛效果良好（湖南中醫學院學報，1990，3：157）；潰瘍性慢性結腸炎：以潰瘍湯（以九香虫為主，加補骨脂，五味子，白朮，三 七，肉荳蔻），用治潰瘍性慢性結腸炎，其療效顯著，總有效率高達87％（陝西中醫，1999，4：168）。另有用九香虫復方治療老年萎縮性胃炎等。   Cautions:禁忌﹕According to Ben Cao Cong Xin this herb may not suitable for decoction because of its slippery characteristics may increase bowel movements. \n  Use with care in case of \n\n  yinxu with fire  \n據《 本草從新 》：「不宜入於湯劑。以其性滑，恐動大便耳。」\n\n  陰虚火旺慎服。\n  [1]   《Zhong \n  Hua Ben Cao 中華本草 \n》Sponsors' Ads by Google 以下為谷歌所提供贊助者之廣告   A manuscript... writing, translating and proofreading  in progressProblems with website? Please Click here for comment. (Not for inquiry )      Click here for inquiry    Copyright Notice 按此看關於 版權問題List of Health ProblemsChinese Herb DictionaryToxicity of Some Herbs Side Effect of Some Herbs Herbs that can be toxic to kidneysTraditional Chinese MedicineTCM DiagnosisSamples of FormulaeTerms of Traditional Chinese MedicineAcupuncturecopy right 版權所有Qigong (chi kung)Prescribed Drug DictionaryEmail our web master for  your suggestion (not for inquiry)Biochemistry DictionaryGeneral Online LibraryQigong classesLecture SlidesResearch LibrarianSearchQigong classesHomeWeather Report DisclaimerLast update: \n  Nov 23, 2011; 12:51 a.m. LAH　Search this site         \n",
    "original_url": "http://alternativehealing.org/jiu_xiang_chong.htm"
  },
  {
    "Names": {
      "Name": ["tian hu sui"],
      "Pharmaceutical": ["Herba Hydrocotyle"],
      "Botanical": [
        "Hydrocotyle sibthorpioides Lam. [H. rotudifolia Roxb.]",
        "Hydrocotyle sibthorpioides Lam. Var. batrachium (Hance) Hand.-Mazz.ex Shan"
      ],
      "Chinese": ["天胡荽"],
      "Common": ["English: Lawn pennywort herb"],
      "Other": [
        "jin qian cao (in Jiangxi) 金錢草[江西]",
        "man tian xing (Sichuan) 滿天星[四川]",
        "po tong qian 破銅錢",
        "ming jing cao 明鏡草",
        "pu di jin (in Guangdong, Hunan) 鋪地錦[廣東、湖南]",
        "pen shang yuan qian 盆上芫茜",
        "xing xiu cao 星秀草",
        "ji chang cai 雞腸菜",
        "di di jin 滴滴金",
        "yi cao 翳草",
        "pu di jin 鋪地錦",
        "fei feng cao 肺風草",
        "man tian xing 滿天星",
        "yi zi cao 翳子草",
        "pan shang yuan qian 盤上芫茜",
        "xi ye qian miao kou 細葉錢苗口",
        "luo di jin qian 落地金錢",
        "guo lu wu gong 過路蜈蚣草",
        "yu zha zi cao 魚察子草",
        "hua bian deng zhan 花邊燈盞",
        "tian xing cao 天星草",
        "mao zhao cao 貓爪草",
        "di xing su 地星宿",
        "shang han cao 傷寒草",
        "po qian cao 破錢草",
        "qian li guang 千里光",
        "qian li cao 千光草",
        "te chong cao 慝蟲草",
        "jing mian cao 鏡面草",
        "bian di qing 扁地青",
        "si pian kong 四片孔",
        "pen shang yuan sui 盆上芫荽",
        "shu ji cao 鼠跡草",
        "pen sui 盆荽",
        "bian di jin 扁地金",
        "xiao ye jin qian cao 小葉金錢草",
        "xiao ye po tong qian 小葉破銅錢",
        "ke ma teng 克麻藤",
        "bian di jin 遍地錦",
        "cai da cao 蔡達草",
        "di qian cao 地錢草",
        "ye qin cai 野芹菜",
        "xiao jin qian 小金錢"
      ],
      "Pronunciation in Korean": ["cheonhosui"],
      "Pronunciation in Japanese": ["tenkosui"],
      "Pronunciation in Cantonese": ["il gosu"],
      "Pinyin Pronunciation": []
    },
    "Type": "Herb",
    "Geography": [
      "Southwest China",
      "Shaanxi",
      "Jiangsu",
      "Anhui",
      "Zhejiang",
      "Jiangxi",
      "Fujian",
      "Taiwan",
      "Hunan",
      "Hubei",
      "Guangdong",
      "Guangxi"
    ],
    "Properties": ["Bitter", "Acrid", "Cold"],
    "Meridians": [],
    "Maladies Treated": [
      "swellings",
      "jaundice",
      "red and white dysentery",
      "gonorrhea",
      "dysuria",
      "stuffy head",
      "throat swelling",
      "痈疽疔疮 (ulcer boils/carbuncles and boils)",
      "injuries from impact",
      "bruises",
      "acute jaundice hepatitis",
      "acute nephritis",
      "whooping cough",
      "urinary tract stones",
      "athlete's foot",
      "shingles",
      "conjunctivitis",
      "erysipelas",
      "目翳 (eye nebula/corneal opacity)"
    ],
    "Medical Function": [
      "Clears heat and toxin (清熱解毒)",
      "Diuretic (利尿)",
      "Reduces swelling (消腫)",
      "Clearing infection"
    ],
    "Dosage": "Internal (oral): Decoction 9–10 g; or smash and make juice.\nExternal application: Smash and apply; or stuff into nostrils; or smash and make juice for ear drops.",
    "Samples of Formulae": "",
    "Contraindications": "",
    "Research": "Anti pathogenic microorganism effect: 1:1 tian hu sui decoction, in vitro tests, showed strong inhibiting effect against Staphylococcus aureus. It also showed various degrees of inhibition of Proteus, Shigella, and Salmonella typhi.\n\nResult of plague model test: rat-mode inhibition of 54%. For antimalarial screening using the whole plant of tian hu sui at 100 g/kg, the inhibition rate was 54%.\n\nOral coumarin 250 mg/kg produced a significantly hypoglycemic effect in normal diabetic rats.",
    "Notes": "",
    "Chemical Ingredients": [
      "Whole plant: flavonoids – quercetin",
      "Whole plant: flavonoids – quercetin-3-galactoside",
      "Whole plant: flavonoids – isorhamnetin",
      "Whole plant: flavonoids – quercetin-3-O-β-D-(6-caffeoylgalactoside)",
      "Whole plant: lignan – sesamin (levorotatory; 左旋芝麻素)",
      "Whole plant: sterol – stigmasterol (豆甾醇)",
      "Whole plant: coumarin"
    ],
    "References": ["[1] Zhong Hua Ben Cao 中華本草"],
    "Further Reading": [],
    "Original Text": "tian hu sui, uses, side effects, drug interaction, toxicity and caution ,Complementary and Alternative Healing UniversityComplementary and Alternative Healing University   中藥詞典                 Chinese Herb Dictionary      Search this site     在本網站找資料Search this siteList of Health ProblemsChinese Herb DictionaryQigongTraditional Chinese Medicine (TCM)AcupuncturePrescribed Drug DictionaryBiochemistry DictionaryLecture SlidesResearch LibrarianGeneral Online LibrarySearchResearch SitesViagraMassage/AcupressureHypnotherapyTell us what you wantNotify Changes & New Information　　　                               　　 tian hu sui    天胡荽            (in English and Chinese 中英文)Translated by: Joe Hing kwok Chu 朱興國編譯Pharmaceutical name:英文藥名﹕Herba HydrocotyleBotanical name:學名﹕1.Hydrocotyle sibthorpioides Lam.[H. rotudifolia Roxb.]2.Hydrocotyle sibthorpioides Lam. Var. batrachium (Hance) Hand.-Mazz.ex ShanPron. in Japanese:日語發音﹕tenkosuiPron. in Korean:韓語發音﹕cheonhosuiPron. in Cantonese::粵音﹕il gosuOther Names:別名﹕See other names here.按此看天胡荽的別名Common Name:英文名﹕Lawn pennywort herbDistribution:產地﹕distributed in southwest China and Shaanxi, Jiangsu, Anhui, Zhejiang, Jiangxi, Fujian, Taiwan, Hunan, Hubei, Guangdong, Guangxi provinces and other places. 分佈於中國的西南部及陝西、江蘇、安徽、浙江、江西、福建、台灣、湖南、湖北、廣東、廣西等地。Properties(characteristics)﹕性味﹕bitter, acrid, cold.苦，辛，寒。Channels (meridians) entered: 歸經﹕Medical functions:[1]藥理﹕[1] Anti pathogenic microorganism effect: 1:1 tian hu sui decoction, in vitro tests, showed strong inhibiting effect against Staphylococcus aureus. It also showed at various degrees of inhibition of Proteus, Shigella, Salmonella typhi.Result of plague model test: rat-mode rejection of 54%, while the whole plant of tian hu sui  100g/kg  for antimalarial screening results, the inhibition rate was 54%.Oral Coumarin  250mg/kg, normal diabetic rats significantly hypoglycemic effect 抗病原微生物作用: 天胡荽1：1水煎劑，體外試驗對金黃色葡萄球菌有較強抑制作用，對變形杆菌，福氏痢疾杆菌、傷寒杆菌也有不同程度的抑制作用。鼠疫模型試驗結果，鼠模抑制為54%，用天胡荽全草100g/kg時行抗瘧篩選結果，抑制率為54%。口服香豆素250mg/kg，對正常糖尿病大鼠有顯著降血糖作用Actions & Indications:主治﹕For clearing infection, as diuretic. For treatment of swellings, jaundice, red and white dysentery, gonorrhea, dysuria, stuffy head, throat swelling, ulcer boils, injuries from impact,  bruises, acute jaundice hepatitis, acute nephritis, whooping cough, urinary tract stones, athlete's foot, shingles, conjunctivitis, erysipelas.[1]清熱解毒 ，利尿，消腫。治黃疸，赤白痢疾，淋病，小便不利，目翳，喉腫，癰疽疔瘡，跌打瘀腫。用於急性黃疸型肝炎、急性腎炎、百日咳、尿路結石、腳癬、帶狀疱疹、結膜炎、丹毒。【1】Chemical ingredients:[1]化學成份﹕[1] The whole plant contains flavonoids:全草含黃酮類成分:quercetin槲皮素quercetin-3-galactoside槲皮素-3-半乳糖甙isorhamnetin異鼠李素quercetin-3-O-β（6-caffeoygalactoside)[1]槲皮素-3-O-β-D-（6-咖啡酰半乳糖甙）Also contains lignan:又含木質體成分:sesamin左旋芝麻素Sterols:甾體成分:stigmasterol豆甾醇Also contains:又含：coumarin香豆素Dosage:用量﹕Oral：for decoction; 9 to 10 g, or smash and make juice.External Application: smash and apply, or stuff into nostrils, or smash and make juice for ear drop.內服：煎湯，9~10 克；或搗汁。外用：搗敷、塞鼻或搗汁滴耳。Samples of formulae:處方舉例﹕ Modern Research:現代研究﹕ Toxicity & Cautions:毒素與禁忌﹕[1]  Zhong Hua Ben Cao 中華本草Problems with website? Please Click here for comment. (Not for inquiry )      Click here for inquiry    Ads by Google 谷歌所提供的廣告:   A manuscript... writing, translating and proofreading  in progress  Copyright Notice 按此看關於 版權問題List of Health ProblemsChinese Herb DictionaryToxicity of Some HerbsSide Effect of Some HerbsHerbs that can be toxic to kidneysTraditional Chinese Medicine TCM Diagnosis Samples of FormulaeTerms of Traditional Chinese MedicineAcupuncturecopy right 版權所有Qigong (chi kung)Prescribed Drug DictionaryEmail our web master for  your suggestion (not for inquiry)Biochemistry DictionaryGeneral Online LibraryQigong classesFake Email WarningResearch LibrarianSearchQigong classesDisclaimerHomeWeather ReportLast update: Jan 1, 2013,  10 a.m. LAH　  ",
    "original_url": "http://alternativehealing.org/tian_hu_sui.htm"
  },
  {
    "Names": {
      "Name": ["wu zhu yu", "吳 茱 萸"],
      "Pharmaceutical": ["Fructus Evodiae Rutaecarpae"],
      "Biological": [
        "Evodia rutaecarpa (Juss.) Benth.",
        "Evodia rutaecarpa (Juss.) Benth. var. officinalis (Dode) Huang"
      ],
      "Chemical": [],
      "Common": ["evodia fruit"],
      "Other name": [
        "wu yu 吳萸",
        "qu yao zi 曲藥子",
        "fu la zi 伏辣子",
        "cha la 茶辣",
        "chou pao zi 臭泡子"
      ],
      "Chinese": ["吳茱萸"],
      "Pronunciation in Korean": ["osuyu"],
      "Pronunciation in Japanese": ["goshuyu"],
      "Pronunciation in Cantonese": ["ngu chu yu"],
      "Pinyin Pronunciation": []
    },
    "Type": "Herb",
    "Geography": [
      "Guizhou",
      "Sichuan",
      "Guangxi",
      "Hunan",
      "Yunnan",
      "Shaanxi",
      "Zhejiang"
    ],
    "Properties": ["acrid", "bitter", "hot", "mildly toxic"],
    "Meridians": ["Kidney", "Liver", "Spleen", "Stomach"],
    "Maladies Treated": [
      "vomiting (嘔吐)",
      "excess acid of stomach/acid regurgitation (吞酸)",
      "epigastric pain/pain in solar plexus (胃脘痛)",
      "cramping abdominal pain (腹內絞痛)",
      "diarrhea (泄瀉)",
      "cold-type hernia pain (寒疝痛)",
      "cold-damp swelling/beriberi-like leg condition (寒濕腳氣)",
      "jueyin headache; headaches caused by vasomotor (vasoneurotic) dysfunction (厥陰頭痛/血管神經性頭痛)"
    ],
    "Medical Function": [
      "warms the middle, lower qi (溫中下氣)",
      "dispels cold of the Liver and Stomach; warms and scatters cold of the Liver and Stomach (溫散肝胃之寒)",
      "analgesic; relieves pain (止痛)",
      "dispels dampness (除濕)",
      "leads fire downward (降火下行/Lead fire downward)",
      "lowering blood pressure (降血壓)",
      "relaxes blood vessels by promoting excitement of the vascular endothelium, clearing the pathway of calcium ion, and releasing nitric oxide; inhibits platelet aggregation; inhibits formation of platelet thrombi and fibrin thrombi",
      "analgesic effect; raises body temperature; in large amounts excites the central nervous system and causes visual impairment and illusions"
    ],
    "Dosage": "3 to 9 g. Use with gan cao to reduce side effects.",
    "Samples of Formulae": "For headaches caused by vasomotor dysfunction (jueyin headache): Name of formula: Wu Zhu Yu Tang. Composition: Wu Zhu Yu (Evodia fruit) 1 part, Ren Shen (Ginseng root) 1 part, Da Zao (Jujube fruit) 1 part, Sheng Jiang (Fresh ginger) 1 part.",
    "Contraindications": "Not suitable for shi zheng (strong/excess pattern), yinxu (yin deficient) with exuberant fire (陰虛火旺), and high fire body type.\nYin-deficiency fire exuberance symptom pattern: persistent strong penile erection (陰莖強硬不倒), spontaneous seminal discharge (精液自流), dizziness with fatigue of spirit (頭暈神疲), insomnia with many dreams (失眠多夢), soreness and weakness of the lumbar and knees (腰膝酸軟), vexing heat in the five centers (五心煩熱), dry mouth with night sweating (口乾盜汗), red tongue with little coating (舌紅少苔), thin rapid pulse (脈細數).",
    "Research": "\"Antidementic Drug Discovery from Oriental Herb Medicine: Dehydroevodiamine.HCl (DHED) extracted from Evodia Rutaecarpa Bentham prevents Impairment of Learning and Memory and Neuronal loss\" – Cheol Hyoung Park (Korea).\nFeeding the decoction to dogs showed that it lowered the blood pressure, but when combined with gan cao the effect disappeared. The lowering of blood pressure is the result of the expansion of the peripheral blood vessels and is caused by the secretion of histamine.\nThe decoction affected the activities of the small intestine of rabbits. Higher concentration inhibited the activities and lower concentration enhanced the activities.",
    "Notes": "",
    "Chemical Ingredients": [
      "limonin 檸檬內酯 [1]",
      "rutaevine 吳茱萸苦素 [2]",
      "evodol 吳茱萸內酯醇 [3]",
      "obacunone 黃柏酮 [4]",
      "rutaevine acetate 吳茱萸苦素乙酯 [5]",
      "12 alpha-hydroxylimonin 12 a-羥基檸檬內酯",
      "12 alpha-hydroxyevodol 12 a-羥基吳茱萸內酯醇 [6]",
      "6alpha-acetoxy-5-epilimonin [6,7]",
      "Jangomolide [8]",
      "GraucinA [9]",
      "evocarpine 吳茱萸卡品鹼 [10]",
      "dihydroevocarpine",
      "1-methyl-2-undecyl-4 (1H)-quinolone",
      "1-methyl-2-pentadecenyl-4(1H)-quinolone [11]",
      "1-methyl-2-[(Z) -6 -undecenyl]-4 (1H)-quinolone",
      "1-methyl-2-[Z) -6-pentadecenyl]-4 (1H) -quinolone",
      "1-methyl-2-[(Z)-10-pentadeceny;]-4 (1H)-quinolone",
      "1-methyl-2-(6Z, 9Z)-6, 9-pentadecadienyl) -4 (1H) -quinolone",
      "1-methyl-2-([4Z, 7Z]) -4, 7-tridecxadienyl) -4 (1H)-quinolone [6]",
      "evodiamine",
      "rutaecarpine",
      "wuchuyine",
      "hydroxyevodiamine 羥基吳茱萸鹼",
      "dihydrorutaecarpine",
      "14-formyldihydrorutaecarpine [12]",
      "Goshuyuamide-I [13]",
      "Goshuyuamide-II [13]",
      "evodiamide [14]",
      "N, N-diumethyl-5-methoxy tryptamine",
      "N-methylanthranylamide",
      "disynephrine [15]",
      "cGMP [16]",
      "arachidoside",
      "isopentenyl-flavone [17]",
      "evoden",
      "alpha-ocimene",
      "cis-beta-ocimene",
      "evodinone",
      "evogin [18]"
    ],
    "References": [],
    "Further Reading": [],
    "Original Text": "wu zhu yu, Complementary and Alternative Healing University  現代醫藥詞典Complementary and Alternative Healing University  Home    現代醫藥詞典Search this siteList of Health ProblemsChinese Herb DictionaryQigongTraditional Chinese Medicine (TCM)AcupuncturePrescribed Drug DictionaryBiochemistry DictionaryLecture SlidesResearch LibrarianGeneral Online LibrarySearchResearch SitesViagraMassage/AcupressureHypnotherapyTell us what you wantNotify Changes & New Information　　　　　　　　　　　　　　　　　　　　　　　　　　　　　　　　　　　　　　　　　　　　　　　　　　　　　　　　wu zhu yu 吳 茱 萸by: Joe Hing Kwok ChuPharmaceutical name:英文藥名：Fructus Evodiae RutaecarpaeBiological name:拉丁學名：Evodia rutaecarpa (Juss.) Benth.,Evodia rutaecarpa (Juss.) Benth. var. officinalis (Dode) Huang,Pron. in Japanese:日語發音：goshuyuPron. in Korean:韓語發音：osuyuPron. in Cantonese:粤語發音：ngu chu yuCommon Name:英文名：evodia fruitOther Names:別名：wu yu 吳萸，qu yao zi 曲藥子，fu la zi 伏辣子，cha la 茶辣，chou pao zi 臭泡子。Distribution:分佈：Guizhou, Sichuan, Guangxi, Hunan, Yunnan, Shaanxi, Zhejiang贵州， 四川，廣西，湖南，云南， 陝西， 浙江。Properties (characteristics)：性味：acrid, bitter, hot, mildly toxic.辛，苦，熱，有小毒。Channels (meridians) entered:歸經：kidney, liver, spleen, stomach腎，肝，脾，胃。Actions & Indications:主治：warms the middle, lower qi, rids of cold of stomach, lower blood pressure, for vomiting, excess acid of stomach, pain in solar plexus, cold type of hernia, cold and dampness of swelling of legs. Lead fire downward.溫 中 下 氣 ， 止 痛 除 濕 ， 善 於 溫 散 肝 胃 之 寒 ， 降 血 壓。嘔 吐 吞 酸 ， 胃 脘 痛 ， 腹 內 絞 痛 ， 泄 瀉 ， 寒 疝 痛 ， 寒 濕 腳 氣 。Medical Function:药理：Relaxes blood vessels by promoting the excitement of the inner skin of blood vessels, clearing the pathway of calcium ion, and releasing nitrogen oxide. 促進血管內皮興奮，打通鈣離子的通道，釋放出一氧化氮，以致放鬆血管。 抑制血小板聚集。抑制血小板血栓及纖維蛋白血栓形成。 鎮痛，升高體溫作用，大量時能興奮中樞，並引起視力障礙﹐錯覺。Chemical ingredients:化學成份：1.limonin 檸檬內酯 [1];rutaevine 吳茱萸苦素[2]; evodol吳茱萸內酯醇[3]; obacunone 黃柏酮[4]; rutaevine acetate 吳茱萸苦素乙酯[5]; 12 alpha-hydroxylimonin 12 a-羥基檸檬內酯; 12 alpha-hydroxyevodol 12 a-羥基吳茱萸內酯醇[6]; 6alpha-acetoxy-5-epilimonin; 6alpha-acetoxy-5-epilimonin[6,7]; Jangomolide[8]; GraucinA[9].2. (1).evocarpine 吳茱萸卡品鹼[10]; dihydroevocarpine; 1-methyl-2-undecyl-4 (1H)-quinolone; 1-methyl-2-pentadecenyl-4(1H)-quinolone[11]; 1-methyl-2-[(Z) -6 -undecenyl]-4 (1H)-quinolone; 1-methyl-2-[Z) -6-pentadecenyl]-4 (1H) -quinolone;1-methyl-2-[(Z)-10-pentadeceny;]-4 (1H)-quinolone; 1-methyl-2-(6Z, 9Z)-6, 9-pentadecadienyl) -4 (1H) -quinolone; 1-methyl-2-([4Z, 7Z]) -4, 7-tridecxadienyl) -4 (1H)-quinolone[6].(2). evodiamine; rutaecarpine; wuchuyine; hydroxyevodiamine 羥基吳茱萸鹼; dihydrorutaecarpine; 14-formyldihydrorutaecarpine[12];Goshuyuamide-I, Goshuyuamide-II[13]; evodiamide[14].(3).N, N-diumethyl-5-methoxy tryptamine; N-methylanthranylamide; disynephrine[15]; cGMP[16].3. arachidoside; isopentenyl-flavone[17].4. evoden; alpha-ocimene; cis-beta-ocimene.5. evodinone; evogin[18].Dosage:用量：3 to 9 g. Use with gan cao to reduce side effects.3∼9克。加 甘草可以减輕其副作用。Samples of formulae:For headaches caused by vasomotor dysfunction:Name of formula: wu zhu yu tangComposition: wu zhu yu, ren shen, da zao, shen jian.治的厥陰頭痛，即血管神經性 頭痛。吳茱萸湯﹕由吳茱萸﹐人 參﹐大棗﹐生薑四味所組成。Modern Research:现 代研究：\"Antidementic Drug Discovery from Oriental Herb Medicine: Dehydroevodiamine.HCl (DHED) extracted from Evodia Rutaecarpa Bentham prevents Impairment of Learning and Memory and Neuronal loss\" - Cheol Hyoung Park (Korea).Feeding the decoction to dogs, showed that it lowered the blood pressure but when combined with gan cao, the effect disappeared. The lowering of blood pressure is the result of the expansion of the peripheral blood vessels and it is caused by secretion of histamine. The decoction showed that it affect the activities of the small intestine of rabbits. Higher concentration of decoction inhibited the activities and lower concentration of it enhanced the activities.用其煎劑給狗灌胃，有明顯的降壓作用，但與甘草配伍，其降壓作用消失。其壓降作用主要是擴張外周血管所致，且與組織胺釋放有關。其煎劑對家兔小腸活動的影響。低濃度時興奮，高濃度時抑制。 　Cautions:禁忌：not suitable for shi zheng (strong pattern) , yinxu (yin deficient) and high fire body type.不適用於實證, 陰虛火旺之體質。　陰虛火旺症 状： 陰莖強硬不倒，精液自流，頭暈神疲，失眠多夢，腰膝酸軟，五心煩熱，口乾盜汗，舌紅少苔，脈細數。　Sponsors' Ads by Google 以下為谷歌所提供贊助者之廣告 A manuscript... writing, translating and proofreading  in progress　Email our web master for  your suggestion (not for inquiry)                 Click here for inquiry  Copyright Notice 按此看關於版權問題List of Health ProblemsChinese Herb DictionaryToxicity of Some Herbs Side Effect of Some Herbs Herbs that can be toxic to kidneysTraditional Chinese MedicineTCM DiagnosisSamples of FormulaeTerms of Traditional Chinese MedicineAcupuncturecopy right　版權所有Qigong (chi kung)Prescribed Drug DictionaryEmail our web master for  your suggestion (not for inquiry)Biochemistry DictionaryGeneral Online LibraryQigong classesFake Email WarningResearch LibrarianSearchQigong classesHomeWeather Report    DisclaimerLast update: Jan 1, 2012;  11:51 p.m. LAH　Search this site         ",
    "original_url": "http://alternativehealing.org/wu_zhu_yu.htm"
  }
]
