[
  {
    "Names": {
      "Name": ["song ren"],
      "Pharmaceutical": ["Semen Pini koraiensis"],
      "Biological": [
        "Pinus koraiensis Sieb. et Zucc.",
        "Pinus mandschurica Rupr.",
        "Apinus koraiensis (Sied. et Zucc.) Moldenke"
      ],
      "Chemical": [],
      "Common": ["pine nut"],
      "Other name": ["song zi", "song zi ren", "xin luo song zi"],
      "Chinese": ["松仁", "松子", "松子仁", "新羅松子"],
      "Pronunciation in Korean": ["jas", "macheukoin"],
      "Pronunciation in Japanese": ["Shōshijin"],
      "Pronunciation in Cantonese": ["cung5 zi2"],
      "Pinyin Pronunciation": [
        "song ren",
        "song zi",
        "song zi ren",
        "xin luo song zi"
      ]
    },
    "Type": "Herb",
    "Geography": [],
    "Properties": ["Sweet", "Slightly warm"],
    "Meridians": ["Liver", "Lung", "Large Intestine"],
    "Maladies Treated": [
      "Chronic arthritis (風痺)",
      "Dizziness",
      "Dry cough",
      "Vomiting blood",
      "Constipation",
      "Wind bi due to cold qi (風痺寒氣)",
      "Deficiency emaciation with shortness of qi (虛羸少氣)",
      "Five zang taxation injury (五臟勞傷)",
      "Coughing with expectoration of phlegm (咳嗽吐痰)",
      "Bone steaming with night sweats (骨蒸盜汗)",
      "Absentmindedness (心神恍惚)",
      "Lack of appetite (飲食不甘)",
      "Spermatorrhea and seminal leakage (遺精滑泄)",
      "Lung dryness cough (肺燥咳嗽)"
    ],
    "Medical Function": [],
    "Dosage": "Oral, decoction: 10–15 g; or add to pill or to cream.",
    "Samples of Formulae": "Formula 1 (attributed to Su Shi) — Indications: wind bi due to cold qi; deficiency emaciation with shortness of qi; five zang taxation injury; coughing with expectoration of phlegm; bone steaming with night sweats; absentmindedness; lack of appetite; spermatorrhea and seminal leakage.\nPrescription (version A): song zi (pine nut) 1 portion; mai dong (Ophiopogon tuber; cores not removed) 2 portions; jin ying zi (Cherokee rose fruit) 1 portion; gou qi zi (goji berry) 1 portion. Preparation: Cook with water and render into paste. Add refined honey as preservative. Dosage: Take about 10–20 tablespoonful with drinking water every morning and evening.\n\nFeng Sui Tang (鳳髓湯) — Application: lung dryness cough (肺燥咳嗽).\nComposition: song zi (pine nut) 30 g; hu tao ren (walnut kernel) 60 g; mix with refined honey (about half a liang). Grind into a paste, mix with refined honey to form a conserve. Dosage: 6 g each dose; take after meals, dissolve in boiling water.",
    "Contraindications": "",
    "Research": "",
    "Notes": "",
    "Chemical Ingredients": {
      "Seed": [
        "Abscisic acid",
        "Volatile oil composed of 26 hydrocarbons, 17 esters, 16 aldehydes, 12 ketones, 31 alcohols, 11 alkalis, and 2 acids"
      ],
      "Seed oil": [
        "Linoleic acid",
        "cis-5,9-octadecadienoic acid",
        "cis-5,9,12-octadecatrienoic acid",
        "11,14-eicosatrienoic acid",
        "cis-5"
      ]
    },
    "References": [],
    "Further Reading": [],
    "Original Text": "song zi, Complementary and Alternative Healing UniversityComplementary and Alternative Healing University  Home 現代中藥辭典Search this siteList of Health ProblemsChinese Herb DictionaryQigongTraditional Chinese Medicine (TCM)AcupuncturePrescribed Drug DictionaryBiochemistry DictionaryLecture SlidesResearch LibrarianGeneral Online LibrarySearchResearch SitesViagraMassage/AcupressureHypnotherapyTell us what you wantNotify Changes & New Information　　　    　      　　    　　　　　                   Last update: Feb 23, 2013,  10 a.m. LAH song ren 松仁   (in English and Chinese 中英文)by: Joe Hing kwok ChuPharmaceutical name:英文藥名﹕Semen Pini koraiensisBotanical name:拉丁生物學名﹕Pinus koraiensis Sieb.et Zucc.Pinus mandschurica Rupr.;Apinus koraiensis (Sied.et Zucc.)Moldenke]Pron. in Japanese:日語發音﹕ShōshijinPron. in Korean:韓語發音﹕jas; macheukoinPron. in Cantonese::粵音﹕cung5 zi2Other Names:別名﹕song zi 松子，song ren 松仁，song zi ren 松子仁，xin luo song zi 新羅松子。Common Name:英文名﹕pine nutDistribution:產地﹕ Properties(characteristics)﹕性味﹕sweet, slightly warm.甘，微溫。Channels (meridians) entered: 歸經﹕liver, lung, large intestine.肝，肺，大腸。Medical functions:藥理﹕  Actions & Indications:主治﹕for treatment of chronic arthritis, dizziness, dry cough, vomiting blood, constipation.治風痺，頭眩，燥咳，吐血，便秘。Chemical ingredients:化學成份﹕ Seed contains:種子含:abscisic acid止杈酸evaporating oil, composed of 26 hydrocarbons, 17 esters, 16 aldehydes, 12 ketones, 31 alcohol, 11 alkali, the two acid etc揮發油 (由26個 烴類、17個酯類、16個醛類、12個酮、31個醇、11個鹼、2個酸等組成)Oil of seed contains:linoleic acid:種子油含亞油酸:cis-5,9-octadecadienoic acid,須-5，9-十八碳二烯酸cis-5,9,12-octadecatrienoic acid須-5，9，12-十八碳三烯酸11,14-eicosatrienoic acid,須-5，11，14-二十碳三烯酸cis-5Daly Dosage:每日用量﹕take orally in decoction: 10-15 g; or add to pill or to cream.內服：煎湯 10～15 克。或入丸，膏中。Samples of formulae:處方舉例﹕For treatment of chronic arthritis, weakness and shot of breath, consumption, coughing and spitting phlegm, gu zheng and sweating absentminded, lack of appetite, spermatorrhea.Prescription: song zi 1 portion, mai dong (do not remove cores) 2 portions, jin yin zi 1 portion, gou qi zi 1 portion.Cook with water and render into paste. Add refined honey as preservative.  Dosage: Take about 10 to 20 table spoonful with drinking water every morning and evening. Feng Sui TangApplication: Coughing with heat in lungComposition: song zi 30 g, walnut 60 g. Grind into paste. Mix with refined honey. Use 6 g each time. Put in boiling water. Take after meal. 治風痺寒氣，虛羸 少氣，及五臟勞傷，咳嗽吐痰，骨蒸盜汗，心神恍惚，飲食不甘，遺精滑泄：松仁八兩，麥 冬（不去心）一斤，金櫻子、枸杞子 各八兩，熬膏，少加煉蜜收。每早晚白湯調服十余茶匙。（蘇軾） 鳳髓湯: 治肺燥咳嗽：松子仁一兩，胡桃仁二兩。研膏，和熟蜜半兩收之。每服二錢 ，食後沸湯點服。（《玄感傳尸方》鳳髓湯）Modern Research:現代研究﹕ Toxicity & Cautions:毒素與禁忌﹕ Sponsors' Ads by Google 以下為谷歌所提供贊助者之廣告   A manuscript... writing, translating and proofreading  in progressProblems with website? Please Click here for comment. (Not for inquiry )      Click here for inquiry    Copyright Notice 按此看關於 版權問題List of Health ProblemsChinese Herb DictionaryToxicity of Some Herbs Side Effect of Some Herbs Herbs that can be toxic to kidneysTraditional Chinese MedicineTCM DiagnosisSamples of FormulaeTerms of Traditional Chinese MedicineAcupuncturecopy right 版權所有Qigong (chi kung)Prescribed Drug DictionaryEmail our web master for  your suggestion (not for inquiry)Biochemistry DictionaryGeneral Online LibraryQigong classesLecture SlidesResearch LibrarianSearchQigong classesHomeWeather Report Disclaimer　Search this site          ",
    "original_url": "http://alternativehealing.org/song_ren.htm"
  },
  {
    "Names": {
      "Name": ["zi bei tian kui"],
      "Pharmaceutical": ["Herba Begoniae"],
      "Botanical": ["Begonia fimbristipula Hance"],
      "Chinese": [
        "紫背天葵",
        "血皮菜",
        "天葵",
        "天葵子",
        "天葵草",
        "千年老鼠屎",
        "金耗子屎",
        "夏無蹤",
        "散血球",
        "觀音莧",
        "紅背菜",
        "兩色三七草",
        "玉枇杷",
        "葉下紅",
        "紅天葵",
        "天葵秋海棠",
        "丹葉"
      ],
      "Common": ["begonia"],
      "Other": [
        "xue pi cai 血皮菜",
        "tian kui 天葵",
        "tian kui zi 天葵子",
        "tian kui cao 天葵草",
        "qian nian lao shu shi 千年老鼠屎",
        "jin hao zi shi 金耗子屎",
        "xia wu zong 夏無蹤",
        "san xue qiu 散血球",
        "guan yin xian 觀音莧",
        "hong bei cai 紅背菜",
        "liang she san qi cao 兩色三七草",
        "yu pi pa 玉枇杷",
        "ye xia hong 葉下紅",
        "hong tian kui 紅天葵",
        "tian kui qiu hai tang 天葵秋海棠",
        "dan ye 丹葉"
      ],
      "Pronunciation in Korean": ["chabaecheonggyu"],
      "Pronunciation in Japanese": ["shinhaitenki"],
      "Pronunciation in Cantonese": ["zi2 bui6 tin1 kwai4"],
      "Pinyin Pronunciation": ["zǐ bèi tiān kuí"]
    },
    "Type": "Herb",
    "Geography": [
      "Xizang",
      "Sichuan",
      "Guangdong",
      "Guangxi",
      "yunnan",
      "Guizhou",
      "Hunan",
      "Jiangxi",
      "Fujian"
    ],
    "Properties": ["Acrid", "Cold", "Slightly toxic"],
    "Meridians": ["liver", "stomach"],
    "Maladies Treated": [
      "irregular menses",
      "vaginal discharge",
      "rheumatism",
      "internal and external injuries from impacts",
      "hemoptysis (coughing blood)",
      "bleeding not during menses (血崩)",
      "bronchitis",
      "inflammation of the pelvic area (pelvic inflammatory disease/盆腔炎)",
      "heat stroke (中暑)",
      "dysentery caused by amoeba infection (阿米巴痢疾)",
      "bleeding from external injuries",
      "scrofula (cervical lymph node tuberculosis/頸部淋巴結核)"
    ],
    "Medical Function": [
      "rid of blood stasis (祛瘀)",
      "promoting blood circulation (活血)",
      "regulating menstruation (調經)",
      "antibiotic effect: inhibits Staphylococcus aureus (金黃色葡萄球菌有抑制作用)",
      "external application to stop bleeding for wounds (外用創傷止血)"
    ],
    "Dosage": "Take orally as decoction: 9–15 g.",
    "Samples of Formulae": "wu wei xiao du yin 五味消毒飲\ntian kui wan 天葵丸",
    "Contraindications": "It contains high level of oxalic acid.\nDo not overdose, especially those with kidney problems or with hypertension or with diabetes.",
    "Research": "",
    "Notes": "",
    "Chemical Ingredients": [
      "Alkaloid (生物鹼)",
      "3α,6β-bis(angeloyloxy)-furanoeremophilane-15-carboxylic acid (3α,6β-雙(當歸酰氧基)呋喃佛術烷-15-羧酸)",
      "γ-humulene (γ-葎草烯)",
      "Oxalic acid (草酸)"
    ],
    "References": [],
    "Further Reading": [],
    "Original Text": "zi bei tian kui , Complementary and Alternative Healing UniversityComplementary and Alternative Healing University  Home 現代中藥辭典Search this siteList of Health ProblemsChinese Herb DictionaryQigongTraditional Chinese Medicine (TCM)AcupuncturePrescribed Drug DictionaryBiochemistry DictionaryLecture SlidesResearch LibrarianGeneral Online LibrarySearchResearch SitesViagraMassage/AcupressureHypnotherapyTell us what you wantNotify Changes & New Information　　 To post your discussion click here.　    　      　　    　　　　　      \nLast update: April 30, 2011; 9:47 p.m. LAH zǐ b鋱 tiān ku� 紫背天葵Translated by: Joe Hing kwok Chu    朱興國編 譯     (in English and Chinese 中英文)Pharmaceutical name:英文藥名﹕Herba BegoniaeBotanical name:拉丁生物學名﹕Begonia fimbristipula HancePron. in Japanese:日語發音﹕shinhaitenkiPron. in Korean:韓語發音﹕chabaecheonggyuPron. in Cantonese::粵音﹕zi2 bui6 tin1 kwai4Other Names:別名﹕xue pi cai 血皮菜，tian kui 天葵，tian kui zi 天葵子，tian kui cao 天葵草，qian nian lao shu shi 千年老鼠屎，jin hao zi shi 金耗子屎，xia wu zong 夏無蹤，san xue qiu 散血球，guan yin xian 觀音莧，hong bei cai 紅背菜，liang she san qi cao 兩色三七草，yu pi pa 玉枇杷，ye xia hong 葉下紅，hong tian kui 紅 天葵，tian kui qiu hai tang 天葵秋海棠，dan ye 丹葉。Common Name:英文名﹕begoniaDistribution:產地﹕Xizang, Sichuan, Guangdong, Guangxi, yunnan, Guizhou, Hunan, Jiangxi, Fujian.西藏、四川、廣東、廣西，貴州、云南，湖南，江西，福建。Properties(characteristics)﹕性味﹕acrid, cold, slightly toxic.辛，寒，有小毒。Channels (meridians) entered: 歸經﹕liver, stomach.肝，胃。Medical functions:藥理﹕ \nantibiotic effect: inhibits Staphylococcus aureus抗菌作用：金黄色葡萄球菌有抑制作用。Actions & Indications:主治﹕rid of blood stasis, promoting blood circulation. For treatment of irregular menses, vagina discharge, rheumatism, internal and external injuries from impacts, hemoptysis (coughing blood), bleeding not during menses, bronchitis, inflammation of the pelvic area, dysentery caused by amoeba infection, bleeding from external injuries, scrofula..祛瘀，活血，調經。治月經不調，白帶過多，風濕，跌打內外傷 ，咳血、血崩、支氣管炎、盆腔炎、中暑、阿米巴痢疾和外用創傷止血，頸部淋巴結核。Chemical ingredients:化學成份﹕ alkaloid\n  生物鹼3α,6β-bis(angeloyloxy)-furanoeremophilane-15-carboxylic-acid3α,6β-雙(當歸酰氧基)呋喃佛術烷-15-羧酸γ-humuleneγ-葎草烯\n  oxalic acid草酸Daly Dosage:每日用量﹕Take orally as decoction: 9 to 15 g.内服：煎湯 ，9～15 克。Samples of formulae:處方舉例﹕wu wei xiao du yin 五味消毒飲 \ntian kui wan 天葵丸Modern Research:現代研究﹕ Toxicity & Cautions:毒素與禁忌﹕\n  It contains high level of oxalic acid. Do not overdose, especially those with \n  kidney problems or with hypertension or with \n  diabetes.\n  含有高量的草酸。不可服食過量，尤其是有腎臟病或血壓高或糖尿病患者。 Sponsors' Ads by Google 以下為谷歌所提供贊助者之廣告   A manuscript... writing, translating and proofreading  in progressProblems with website? Please Click here for comment. (Not for inquiry )   Click here for inquiry    Copyright Notice 按此看關於 版權問題List of Health ProblemsChinese Herb DictionaryToxicity of Some Herbs Side Effect of Some Herbs Herbs that can be toxic to kidneysTraditional Chinese MedicineTCM DiagnosisSamples of FormulaeTerms of Traditional Chinese MedicineAcupuncturecopy right 版權所有Qigong (chi kung)Prescribed Drug DictionaryEmail our web master for  your suggestion (not for inquiry)Biochemistry DictionaryGeneral Online LibraryQigong classesLecture SlidesResearch LibrarianSearchQigong classesHomeWeather Report Disclaimer　Search this site          \n",
    "original_url": "http://alternativehealing.org/zi_bei_tian_kui.htm"
  },
  {
    "Names": {
      "Name": ["bing pian", "mei pian"],
      "Pharmaceutical": ["Borneol"],
      "Botanical": [
        "Dryobalanops aromatica Gaertn. or Blumen (龍腦香)",
        "Blumea balsamifera DC (艾纳香（大艾）)"
      ],
      "Common": ["English: borneol"],
      "Other name": [
        "long nao 龍腦",
        "nao zi 腦子",
        "rui long nao 瑞龍腦",
        "mei hua nao zi 梅花腦子",
        "mei hua pian nao 梅花片腦",
        "pian nao 片腦",
        "mei hua nao 梅花腦",
        "bing pian nao 冰片腦",
        "mei pian 梅片",
        "mei bing 梅冰"
      ],
      "Chinese": [
        "冰片",
        "梅片",
        "龍腦",
        "腦子",
        "瑞龍腦",
        "梅花腦子",
        "梅花片腦",
        "片腦",
        "梅花腦",
        "冰片腦",
        "梅冰",
        "龍腦香",
        "艾納香（大艾）"
      ],
      "Pronunciation in Korean": ["pingpyon (冰片)"],
      "Pronunciation in Japanese": ["ryuno (龍腦)"],
      "Pronunciation in Cantonese": ["bing1 pin1"],
      "Pinyin Pronunciation": ["bing pian"]
    },
    "Type": "Herb",
    "Geography": [
      "Southeast Asia",
      "Taiwan",
      "Guangdong (China)",
      "Yunnan (China)",
      "Guizhou (China)",
      "Hainan (China)",
      "Hunan (China)"
    ],
    "Properties": ["Acrid", "Slightly warm", "Toxic"],
    "Meridians": ["Heart", "Spleen", "Liver", "Lung"],
    "Maladies Treated": [
      "Fainting due to strokes or heat (中風厥，溫熱昏倒)",
      "Furuncle (瘡腫)",
      "Joint pain (關節疼痛)",
      "Ulceration of the cornea; red eyes with corneal nebula (目赤翳膜)",
      "Mouth sores with erosion (口瘡糜爛)",
      "Eczema (濕疹)",
      "Angina: chest discomfort and tension because of lack of circulation to the heart muscle; using su bing di wan containing bing pian"
    ],
    "Medical Function": [
      "Anti–myocardial ischemia: main components borneol and isoborneol exhibit tolerance to hypoxia; su bing di wan containing bing pian increased coronary sinus blood flow, slowed heart rate, and reduced myocardial oxygen consumption in animal experiments",
      "Relieves angina: in clinical experience, su bing di wan containing bing pian relieved chest discomfort and tension due to inadequate circulation to the heart muscle",
      "Antibacterial and preservative: 0.5% bing pian solution inhibited Staphylococcus aureus, streptococci including pneumococcus, and Escherichia coli; inhibited some pathogenic skin fungi; mild preservation effect",
      "Local analgesic: mild local pain-arresting effect with slight stimulation of sensory nerve endings on external use",
      "Promotes delivery: induced delivery in mid-term or late-term pregnant mice (animal)",
      "Sedative: borneol and isoborneol have sedative effects; slight stimulation to sensory nerves; rapid intestinal absorption; crosses the blood–brain barrier within 5 minutes and accumulates for a long time, providing preliminary experimental basis for its aromatic ‘opening the orifices’ effect"
    ],
    "Dosage": "Internal: 0.15 g to 0.3 g, usually in pills or powder; seldom used in decoction.\nExternal: apply as fine powder or make into a paste; for washing or added in external medication.",
    "Samples of Formulae": "Bing Pian San (Borneol Powder) [Source: National Patent Chinese Medicines Formulary, Hohhot]\nIndications: Mouth and throat pain (口齒咽喉痛).\nComposition and preparation: Gypsum (石膏) 60 g (2 liang), Borneol (冰片) 0.3 g (3 fen). Grind into a fine powder.\n\nUsage notes: Internally, mainly used in pills; seldom in decoction. For external application, used for washing formulas or added into external medications.\n\nSu Bing Di Wan (蘇冰滴丸): Composed of equal parts Su He Xiang Zhi (蘇合香脂, storax resin) and Bing Pian (冰片).",
    "Contraindications": "Contraindicated during pregnancy and in patients with qi deficiency (氣虛) or blood deficiency (血虛).",
    "Research": "Anti–myocardial ischemia (animal): Containing bing pian, su bing di wan significantly increased coronary sinus blood flow in experimental myocardial infarction dogs, slowed heart rate, and reduced myocardial oxygen consumption; against the decrease in myocardial nutritive blood flow and myocardial ultrastructural changes caused by posterior pituitary hormone, su bing di wan had antagonistic and protective effects.\n\nClinical observation: In clinical experience, su bing di wan containing bing pian relieved angina, alleviating chest discomfort and tension due to insufficient circulation to the heart muscle.\n\nAntibacterial and preservation: A 0.5% bing pian solution inhibited bacteria and had a mild preservation effect. It inhibited Staphylococcus aureus, streptococci, pneumococcus (Streptococcus pneumoniae), and Escherichia coli. It also showed obvious inhibitory effects against some pathogenic skin fungi.\n\nLocal analgesia and sensory effects: For external application, it produces a mild local analgesic effect and slight stimulation of sensory nerve endings.\n\nObstetric effect (animal): It induced delivery in mid-term and late-term pregnant mice.\n\nSedative and CNS penetration: Borneol and isoborneol have sedative effects. With local application, bing pian provides slight stimulation to sensory nerves. It is rapidly absorbed through the intestine; 5 minutes after administration a large amount can cross the blood–brain barrier, remains for a long time, and the amount is quite high. This provides preliminary experimental evidence for the aromatic ‘opening the orifices’ (芳香開竅) effect.",
    "Notes": "",
    "Chemical Ingredients": {
      "Longnao bingpian (from Dryobalanops aromatica; 龍腦冰片)": [
        "D-borneol (右旋龍腦)",
        "Humulene (葎草烯)",
        "β-Elemene (β-欖香烯)",
        "Caryophyllene (石竹烯)",
        "Sesquiterpenoids (倍半萜)",
        "Oleanolic acid (齊墩果酸)",
        "Alphitolic acid (麥珠子酸)",
        "Asiatic acid (積雪草酸)",
        "Dipterocarpol (Hydroxy-dammarenone II; 龍腦香醇酮)",
        "Dryobalanone (龍腦香二醇酮)",
        "Erythrodiol (古柯二醇)",
        "Other triterpenes (三萜化合物)"
      ],
      "Ai pian (from Blumea balsamifera; 艾片)": ["L-borneol (左旋龍腦)"]
    },
    "References": [],
    "Further Reading": [],
    "Original Text": "bing pian, Complementary and Alternative Healing University\nComplementary and Alternative Healing University \n  中藥詞典                 Chinese Herb Dictionary      Search this site     在本網站找資料Search this siteList of Health ProblemsChinese Herb DictionaryQigongTraditional Chinese Medicine (TCM)AcupuncturePrescribed Drug DictionaryBiochemistry DictionaryLecture SlidesResearch LibrarianGeneral Online LibraryResearch SitesViagraMassage/AcupressureHypnotherapyTell us what you wantNotify Changes & New Information  bing pian 冰片, mei pian 梅片by: Joe Hing kwok Chu  朱興國譯。Pharmaceutical name:英文藥名﹕BorneolBotanical name:學名﹕Dryobalanops aromatica Gaertn. or Blumen  (龍腦香)Blumea balsamifera DC (艾纳香（大艾）)Pron. in Japanese:日語發音﹕ryuno (龍腦)Pron. in Korean:韓語發音﹕pingpyon (冰片)Pron. in Cantonese::粵音﹕bing1 pin1Other Names:別名﹕long nao龍腦,nao zi 腦子, rui long nao 瑞龍腦, mei hua nao zi 梅花腦子, mei hua pian nao 梅花片腦, pian nao 片腦, mei hua nao 梅花腦, bing pian nao 冰片腦, mei pian 梅片, mei bing 梅冰。Common Name:英文名﹕borneolDistribution:產地﹕Southeast Asia, Taiwan, Guangdong, Guangdong, Yunnan, Guizhou, Hainan, Hunan provinces of China.Properties(characteristics)﹕性味﹕acrid, slightly warm, toxic.辛，微温， 有毒。Channels (meridians) entered: 歸經﹕heart, spleen, liver, lung.心，脾，肝，肺。Medical functions:藥理﹕ anti lack of oxygen of cardiac musclerelieve angina: in clinical experience, the prepared herb su bing di wan which contain bing pian can relieve discomfort and tension in the chest because of lack of circulation to the heart muscle.anti-biotic effect: 0.5% bing pian solution can inhibit bacteria and can have preservation effect. It inhibits Staphylococcus aureus, Streptococcus pneumoniae, Escherichia coli. It also can inhibit some of the fungi that cause skin diseases.localized pain arresting effectpromote delivery effect: it can induce the delivery of mid term or late term pregnant mice to deliver.sedative effect: borneol and isoborneol possess sedative effect. Bing pian can provide slight stimulating effect to sensory nerves. It can be rapidly absorbed by the intestine. After 5 minutes of taking the herb, a large amount can pass through the blood brain barrier and can stay there for long time.抗心肌缺血作用：冰片中的主要成份龍腦、異龍腦均有耐缺氧的作用。 動物實驗，含冰片的蘇冰滴丸，可使實驗心肌梗塞犬的冠竇 血流量明顯增加，並減慢心率，降低心肌耗氧量；對垂體后葉素所致心肌營養性血流量降低和心肌超微結構改變，蘇冰滴丸有對抗和保護作用。  緩解心絞痛的作用：臨床上，含冰片的蘇冰滴丸有緩解心絞痛的作用。  抗菌作用：0.5%冰片可抑菌，有溫和的防腐作用， 對葡萄球菌、鏈球菌，肺炎雙球菌、大腸杆菌等有抑制作用。對部分致病性皮膚真 菌亦有明顯抑制作用。  止痛：局部鎮痛作用，外用時對感覺神經末梢有輕微刺激作用，同時呈現局部溫和的止痛效果。  防腐作用引產作用：對中、晚期妊娠小鼠有引產作用。鎮靜作用；龍腦、異龍腦有鎮靜作用；冰片局部應用對感覺神經有輕微刺激，經腸系膜吸收迅速，給藥5分鐘即可通過血腦屏障，且在腦蓄積時間長，量也相當高，此為冰片的芳香開竅作 用提供了初步實驗依據。Actions & Indications:主治﹕For fainting due to strokes or heat, bunacle, pain in joints, ulceration of the cornea, sores in the mouth, eczema,Taking internally: Mainly being used in pills; seldom in decoction.External application: for washing or added in external medication.中風厥，溫熱昏倒，瘡腫，關節疼痛，目赤翳膜，口瘡糜爛，濕疹等。 用法：內服，常入丸藥；外用， 配入外洗方或加入外用藥中。Chemical ingredients:化學成份﹕龍腦冰 片含右旋龍腦 D-borneol，葎草烯 Humulene、β-欖香烯 β-Elemene、石竹 烯 Caryophyllene等倍半萜 Sesquiterpenoids，以及齊墩果 酸 Oleanolic acid、麥珠子酸 Alphitolic acid、積雪草酸 Asiatic acid、龍腦香醇酮（Dipterocarpol，Hydroxy-dammarenone Ⅱ）、龍腦香二醇酮（Dryobalanone） 、古柯二醇（Erythrodiol）、古柯二醇等三萜化合物。艾片含左旋龍腦 L-borneol。Dosage:用量﹕Taking orally: 0.15 g to 0.3 g.External application: make into powder or paste and apply.内服：入丸、散，0.15 克～0.3克。外用：研末撒或调敷。Samples of formulae:處方舉例﹕Prescription Name: bing pian san (borneol powder) \"Source: national patent Chinese medicines formulary\"  Indications: articulate a sore throat. Prescription: Gypsum 60 g, borneol 0.3g. Make into fine powder藥方名： 冰片散 《全國中藥成藥處方集》（呼和浩特方）主治: 口齒咽喉痛。 處方: 石膏2兩，冰片3分。 制法: 上為細末。  Modern Research:現代研究﹕ Toxicity & Cautions:毒素與禁忌﹕Do not use during pregnancy or on patients with qixu (qi deficient)  or xue xu (blood deficient) 。孕婦或氣 虛 或 血虛 者忌服。 蘇冰滴丸：是由蘇合香脂，冰片各等份製成的。Search this siteProblems with website? Please Click here for comment. (Not for inquiry )    Click here for inquiryCopyright Notice 按此看關於版權問題 Sponsors' Ads by Google 以下為谷歌 所提供之廣告 List of Health ProblemsChinese Herb DictionaryToxicity of Some HerbsSide Effect of Some HerbsHerbs that can be toxic to kidneysTraditional Chinese MedicineTCM DiagnosisSamples of FormulaeTerms of Traditional Chinese MedicineAcupuncturecopy right 版權所有Qigong (chi kung)Prescribed Drug DictionaryEmail our web master for  your suggestion (not for inquiry)Biochemistry DictionaryGeneral Online LibraryQigong classesFake Email WarningResearch LibrarianSearchQigong classesHomeWeather ReportDisclaimerLast update: Sept 28, 2013; 9:25 P.m. LAH   \n",
    "original_url": "http://alternativehealing.org/bing_pian.htm"
  },
  {
    "Names": {
      "Name": ["hai long"],
      "Pharmaceutical": ["Solenognathus hardwickii"],
      "Biological": [
        "Solenognathus hardwickii (Gray) (刁海龍)",
        "Syngnathoides biaculeatus (Bloch) (擬海龍)",
        "Syngnathus acus Linnaeus (尖海龍)"
      ],
      "Chinese": ["海龍", "刁海龍", "擬海龍", "尖海龍", "粗吻海龍", "海鱰魚"],
      "Common": ["pipe fish", "sea dragon"],
      "Other": ["yang zhi yu 楊枝魚", "qian chuan zi 錢串子", "shui yan 水雁"],
      "Pronunciation in Korean": ["haeryong"],
      "Pronunciation in Japanese": ["hairyu"],
      "Pronunciation in Cantonese": ["hoi2 lung4"],
      "Pinyin Pronunciation": []
    },
    "Type": "Animal",
    "Geography": ["Along the sea in the southern part of China near the coast"],
    "Properties": ["Sweet", "Salty", "Warm", "Slightly fishy smell"],
    "Meridians": ["Liver", "Kidney"],
    "Maladies Treated": [
      "Impotence",
      "Spermatorrhea",
      "Cysts",
      "Swelling of the lymph nodes",
      "Luoli tanhe (scrofula and phlegm nodules)",
      "Diepu sunshang (traumatic injury)",
      "External application: boils, swelling, abscess, carbuncles"
    ],
    "Medical Function": [
      "Warms the Kidney and fortifies yang",
      "Disperses nodules and reduces swelling",
      "Sex hormone-like effect on the uterus; increases uterine excitability and uterine weight in animals",
      "Immunological activity: promotes normal human peripheral blood lymphocyte proliferation",
      "Anticancer activity in vitro: water extract inhibits human cancer cell lines and induces dose-dependent cancer cell dissolution",
      "Reproductive effects in mice: increases sperm count and motility; mitigates cyclophosphamide-induced declines"
    ],
    "Dosage": "Internal: 3–9 g. External: appropriate amount; grind to powder and apply to affected areas.",
    "Samples of Formulae": "",
    "Contraindications": "Do not use during pregnancy, or in yinxu (yin deficient) with heat, or in pixu (spleen deficient) conditions, or during colds. Long-term usage may be toxic to the kidney.",
    "Research": "Sex hormone-like effect: adding 50% of the sea dragon infusion 0.5–1.0 ml or 20% of infusion 1.0–2.0 ml in 30 ml Rockwell solution induced rats, mice and rabbits in vitro uterine excitability with enhanced contraction and frequency. A 20% sea dragon intravenous infusion at 2.0 ml/kg to the rabbit excited the in situ rabbit uterus. Compared to vasopressin, sea dragon's uterine-exciting effect is weaker and longer lasting, and unlikely to cause a strong contraction, and in different sexual cycles of the uterus the stimulating effects are similar. The active ingredient that excites the uterus is easily damaged by heat. For Syngnathus acus, the alcohol extract oil solution, the alcohol extract water solution and the water decoction all significantly increased uterine weight in mice; among them the oil solution with alcohol extract was strongest, followed by the water decoction.\n\nEthanol extracts of Solenognathus hardwickii (刁海龍), Syngnathoides biaculeatus (擬海龍), Syngnathus acus (尖海龍), Cuwen hailong (粗吻海龍), and Hairu yu (海鱰魚), each given by gastric gavage to mice at a daily dose of 3 g/kg, increased mouse sperm count and sperm motility to varying degrees; among these, Solenognathus hardwickii and Syngnathoides biaculeatus had significant effects. The above preparations had no significant effect on weight changes of the genital organs and accessory genital organs of normal male mice. Each preparation inhibited, to varying degrees, the cyclophosphamide-induced decrease in sperm count and decline in sperm motility; among these, Solenognathus hardwickii, Syngnathoides biaculeatus, and Syngnathus acus had significant effects; Solenognathus hardwickii, Syngnathus acus, and Cuwen hailong also significantly increased the prostate weight of the cyclophosphamide model mice.\n\nImmune system effects: 20% hai long gel (20% 海龍膠) at 0.5 ml/animal by gastric gavage in mice significantly increased mouse thymus weight and significantly elevated mouse leukocyte counts; the effect on increasing hemoglobin content in mice was not obvious. The water extract of Syngnathoides biaculeatus promoted proliferation of normal human peripheral blood lymphocytes; the optimal drug amount response was concentrated between 10–20 μl/well, and when the dose increased to 40 μl/well, the stimulatory effect gradually weakened.\n\nAnticancer effects: water decoction of hai long promoted normal human peripheral blood lymphocyte transformation and inhibited human cancer cell lines. Under low-power microscopy, after cancer cells contacted different doses of hai long extract, varying numbers of cell dissolution phenomena were observed; the larger the dose, the higher the rate of cell dissolution, and the leaching out of some intrinsic contents of the cancer cells was more obvious. The water extract of Syngnathoides biaculeatus exhibited inhibitory effects of varying degrees on human cervical cancer cell line (HeLa), ECA190, lung squamous carcinoma, and HCT8 rectal cancer. Hai long showed a certain inhibitory effect on mouse monoamine oxidase B activity and reduced lipid peroxides, but there was no significant difference compared with the control group.",
    "Notes": "",
    "Chemical Ingredients": {
      "Syngnathus acus (尖海龍)": [
        "cholesterol",
        "cholesten-3-one",
        "N-phenyl-β-phenylamine"
      ],
      "Syngnathus acus (尖海龍) - fat-soluble portion": [
        "myristic acid",
        "palmitic acid",
        "stearic acid"
      ]
    },
    "References": [
      "[1] Zhong Hua Ben Cao. 藥理, 與化學成份：中華本草.",
      "[2] Zhong Hua Ben Cao. 藥理, 與化學成份：中華本草."
    ],
    "Further Reading": [],
    "Original Text": "hai long, Complementary and Alternative Healing UniversityComplementary and Alternative Healing University  Home  現代 中藥辭典Search this siteList of Health ProblemsChinese Herb DictionaryQigongTraditional Chinese Medicine (TCM)AcupuncturePrescribed Drug DictionaryBiochemistry DictionaryLecture SlidesResearch LibrarianGeneral Online LibrarySearchResearch SitesViagraMassage/AcupressureHypnotherapyTell us what you wantNotify Changes & New Information　　　    　                                            　　       　  　                                    hai long 海龍   (in English and Chinese 中英文) Translated by: Joe Hing kwok ChuPharmaceutical name:英文藥名﹕Solenognathus hardwickiiZoological name:動物學名﹕Solenognathus hardwickii (Gray) (刁 海龍)Syngnathoides biacu leatus（Bloch) (擬 海龍)Syngnathus acus Linnaeus (尖海龍)Pron. in Japanese:日語發音 ﹕hairyuPron. in Korean:韓語發音 ﹕haeryongPron. in Cantonese:粵音﹕hoi2 lung4Other Names:別名 ﹕yang zhi yu 楊枝魚， qian chuan zi 錢串子，shui yan 水雁。Common Name:英文名﹕pipe fish, sea dragonDistribution:產地﹕along the sea in southern part of China near the coast.產於中國南方沿海地帶。Properties(characteristics)﹕性味﹕sweet, salty, warm and slightly fishy in smell,氣微腥，味微咸，甘 ，溫。Channels (meridians) entered: 歸經﹕liver, kidney.歸肝、腎經。Medical functions:藥理[1]﹕ Sex hormone like effect: adding 50% of the sea dragon infusion 0.5-1.0ml or 20% of infusion 1.0-2.0ml in 30ml Rockwell solution  , can induce  rats, mice and rabbits in vitro uterine excitability with enhanced contraction  and frequency. 20% of the sea dragon intravenous infusion 2.0ml/kg to the rabbit, the rabbit uterus in place are excited. Compared to  vasopressin, sea dragon the uterus exciting effect is weaker and longer lasting, and unlikely to cause a strong contraction, and in different sexual cycle of the uterus the stimulating effects are similar. The active ingredient that excite  the uterus excited, is easily damaged by heat. Sea dragon solution of alcohol extract,  water decoction of alcohol extract significantly increased the uterine weight in mice. Among them the oil solution with alcohol extract was strongest, followed by water decoction.  Circulation effectAuto-immune system effectanti cancer effect: water decoction of hai long (sea dragon) can promote normal people peripheral lymphocyte transformation, and can inhibit human cancer cells. It is possible to observe with low power microscope the dissolving of the cancer cells after contacting the extract of hai long (sea dragon). The larger the dosage the larger was the rate of dissolving of the cells and the more obvious was the leaching out of the content of the cancer cells.  The following to be translated:1.性激 素樣作用，在30ml洛氏液中加入50%海龍浸劑0.5-1.0ml或20%浸劑1.0-2.0ml，可使大鼠、小鼠和家兔的離體子宮興奮，收縮 加強，頻離加快。20%海龍浸劑2.0ml/kg給家兔靜脈注射，對在位家兔子宮有興奮作用。海龍興奮子宮的作用遠較垂體後葉素弱，作用較溫和持 久，不易引起強收縮，並且對不同性周期的子宮均有相似的興奮作用。其興奮子宮的有效成分，易被加熱破壞。尖海龍的醇提油溶液，醇提水溶液和水煎液 均可明顯增加小鼠子宮重量，其中以醇提油狀物作用最強，水煎液次之。 　　刁海龍、擬海龍、尖海龍、粗吻海龍和海鱰魚各自的乙醇提取物，分別以每日3g/kg劑量給小鼠灌胃，均能不同程度增加小鼠精子數和精子活率， 其刁海龍中擬海龍作用顯著。上述各制劑對正常雄性小鼠性器官司和附性器官司的重量變化均無顯著影響。各制劑均能不同程度地抑制由環磷酰胺引起的小 鼠精子數降低和精子活率下降，其刁海龍中擬海龍和尖海龍作用顯著；刁海龍、尖海龍和粗吻海龍還能顯著增加環磷酰胺造模小鼠的前列腺重量。 2.對免疫系統的影響。20%海龍膠以0.5ml/隻劑量給小鼠灌胃，能明顯增加小鼠胸腺重量，顯著升高小鼠白細胞民數量，對小鼠血紅蛋白含量的 增加作用不明顯。擬海龍水提取物對正常人外周血淋巴細胞具有增殖作用，最佳藥物量反應集中在10-20μl/孔之間，劑量增大至40μl/孔後， 刺激作用可逐漸減弱。 3.抗癌作用：海龍水提取物有促進正常人外周血淋巴細胞轉化作用，抑制人癌細胞株作用。此外在低倍顯微鏡下觀察到當癌細胞與不同劑量的海龍提取物 接觸後均發現數量不等的細胞溶解現象, 劑量越大細胞溶解率越高, 細胞中的一些內含物溢出現象也越明顯。擬海龍水提物對人宮頸癌細胞株（HeLa） 、ECA190、肺鱗癌、HCT8直腸癌有各度不等的抑制作用。海龍對小鼠B型單胺氧化酶活性有一定抑制作用，也使過氧化脂質減少，但與對照組比較無顯著性差異。Actions & Indications:主治﹕ being used in impotence, spermatorrhea, cysts, swelling of the lymph nodes. External application: for boils, swelling and abscess.溫腎壯陽，散結消腫。用於陽痿遺精，瘰疬痰核，跌扑損傷；外治癰腫疔瘡。  Chemical ingredients:[2]化學成份﹕[2] Syngnathus acus L. contains:尖海龍含:cholesterol膽甾醇cholesten-3-one膽甾烯-3-酮N- phenyl-β-phenylamineN-苯基-β-苯胺Fat solution contains large amount of free fatty acid:脂溶性部分含有大量的游離脂肪酸:myristic acid肉蔻酸palmitic acid棕櫚酸stearic acid硬脂酸Dosage:用量﹕For taking  internally:　3 to 9 g. For externally use: grind into powder and apply to affected areas. 內服：3～9g； 外用適量，研末敷患處。Samples of formulae:處方舉例﹕ Modern Research:現代研究﹕ Toxicity & Cautions:毒素與禁忌﹕Not to use during pregnancy, or in yinxu (yin deficient)  with heat, or in pixu (spleen deficient)  condition or during colds. Long term usage can be toxic to the kidney.懷孕期間，或陰 虛有熱，或脾 虛，或傷風未愈忌服。長期服用可能對腎臟有毒。[1] [2] source of medical function and Chemical ingredients: Zhong Hua Ben Cao [1] [2] 藥 理,與化學成份：中 華本草 Sponsors' Ads by Google 以 下為谷歌所提供之廣告  A manuscript... writing, translating and proofreading  in progressEmail our web master for  your suggestion (not for inquiry)             Click here for inquiry List of Health ProblemsChinese Herb DictionaryToxicity of Some HerbsSide Effect of Some HerbsHerbs that can be toxic to kidneysTraditional Chinese MedicineTCM DiagnosisSamples of FormulaeTerms of Traditional Chinese MedicineAcupuncturecopy right 版權所 有Qigong (chi kung)Prescribed Drug DictionaryEmail our web master for  your suggestion (not for inquiry)Biochemistry DictionaryGeneral Online LibraryQigong classesLecture SlidesResearch LibrarianSearchQigong classesHomeWeather Report    DisclaimerLast update: Aug 28, 2013; 5 p.m. LA  ",
    "original_url": "http://alternativehealing.org/hai_long.htm"
  },
  {
    "Names": {
      "Name": ["hua shu pi", "樺樹皮"],
      "Pharmaceutical": ["CortexBetulae platyphyllae"],
      "Botanical": [
        "Betula platyphylla Suk.",
        "Betula mandshurica Nakai (東北白樺)",
        "Betula pendula Roth (新疆白樺)"
      ],
      "Chinese": ["樺樹皮"],
      "Common": ["Japanese white birch"],
      "Other": [
        "bai hua 白樺",
        "hua shu 樺樹",
        "hua mu 樺木",
        "fen hua 粉樺",
        "hua pi shu 樺皮樹"
      ],
      "Pronunciation in Korean": ["hwasupi"],
      "Pronunciation in Japanese": ["kaba juhi"],
      "Pronunciation in Cantonese": ["waa6 syu6 pei4"],
      "Pinyin Pronunciation": []
    },
    "Type": "Herb",
    "Geography": [
      "Temperate and subarctic areas of Asia",
      "Northeast China",
      "North China",
      "Henan",
      "Shaanxi",
      "Ningxia",
      "Gansu",
      "Qinghai",
      "Sichuan",
      "Yunnan",
      "Southeastern Tibet",
      "Russia",
      "Mongolia",
      "North Korea",
      "Japan"
    ],
    "Properties": ["bitter", "neutral", "toxic"],
    "Meridians": ["lung", "stomach", "large intestine"],
    "Maladies Treated": [
      "acute tonsilitis",
      "bronchitis",
      "pneumonia",
      "enteritis",
      "dysentery",
      "hepatitis",
      "oliguria with yellow urine",
      "acute mastitis",
      "burns (topical)",
      "swollen carbuncles (topical)"
    ],
    "Medical Function": [
      "Clearing damp-heat; detoxification.",
      "Arresting cough, expectorant and anti-asthmatic effects.",
      "Betulin can inhibit the synthesis of cholesterol and triglycerides, and can effectively prevent obesity, atherosclerosis and type II diabetes.",
      "Anti-cough activity of intraperitoneally injected water, methanol, ether and acid ethanol extracts in mice."
    ],
    "Dosage": "Daily dosage: 9 to 15 g, make into powder and mix with liquid. Take orally. External use: appropriate amount.",
    "Samples of Formulae": "For treatment of dysentery: calcine hua shu pi (birch bark) into charcoal. Grind into fine powder. Take 3 g each time, twice a day. 《林氏家抄方》 [1]\nFor treatment of hot and small amount of urine: use hua shu pi (birch bark) to make a strong decoction. Take orally. 《吉林中草藥》",
    "Contraindications": "Plants can cause systemic toxicity varying from mild abdominal cramping to serious cardiac complications. [3]\n[1] Editor note: the original formula mentions using sugar. Sugar can actually induce diarrhea. Sugar should not be use in case of diarrhea.",
    "Research": "Betulin can inhibit the synthesis of cholesterol and triglycerides, and can effectively prevent obesity, atherosclerosis and type II diabetes. [2]\nArresting cough, expectorant and anti-asthmatic effects. Intraperitoneal injection of water, methanol, ether and acid ethanol extracts of hua shu pi possesses anti-cough effect in mice.",
    "Notes": "",
    "Chemical Ingredients": {
      "Bark": [
        "Betulin (β-Amyrin) ~35%",
        "Betuloside",
        "Tannin 7%",
        "Oleanolic Acid",
        "Different types of higher fatty acid, about 35%",
        "Phenol",
        "Saponin",
        "Polysaccharide",
        "Protein",
        "Triterpenoids",
        "Total glucoside",
        "Resin",
        "Fat"
      ],
      "Fresh leaves": [
        "Betuldafolienetriol 0.25%",
        "Betulafolienetetraol",
        "Betulatetrol",
        "Triterpenoid saponin about 3%",
        "Flavonoids 2%",
        "Gallic acid",
        "Coumarin",
        "Carotene",
        "Vitamin C"
      ],
      "Dry immature fruit (per 100 g)": ["Carotene 52.41 mg"],
      "Fresh fruit": ["Carotene 19.55 mg"],
      "Unspecified/General": ["Xylan"]
    },
    "References": [
      "[1] 編者按：原方有�糖為引 。用糖能導致腹瀉。應該不可用糖。 Editor note: the original formula mentions using sugar. Sugar can actually induce diarrhea. Sugar should not be use in case of diarrhea.",
      "[2] http://chn.chinamil.com.cn/ylws/2011-01/06/content_4546064.htm",
      "[3] http://www.aragriculture.org/horticulture/ornamentals/toxic_plants.htm"
    ],
    "Further Reading": [],
    "Original Text": "hua shu pi, Complementary and Alternative Healing UniversityComplementary and Alternative Healing University   中藥詞典    Chinese Herb Dictionary      Search this site     在本網站找資料 See more menu at the bottom of page hua shu pi 樺樹皮  (in English and Chinese 中英文)Translated by: Joe Hing kwok ChuPharmaceutical name:英文藥名﹕CortexBetulae platyphyllaeBotanical name:拉丁生物學名﹕Betula platyphylla Suk.Betula mandshurica Nakai (東北白樺)Betula pendula Roth (新疆白樺)Pron. in Japanese:日語發音﹕kaba juhiPron. in Korean:韓語發音﹕hwasupiPron. in Cantonese::粵音﹕waa6 syu6 pei4Other Names:別名﹕bai hua白樺hua shu樺樹hua mu樺木fen hua粉樺hua pi shu樺皮樹Common Name:外文名﹕Japanese white birchDistribution:產地﹕亞洲溫帶和亞北極的地方如：中國東北、華北、河南、陝西、寧夏、甘肅、青海、四川、雲南、西藏東南部；俄羅斯、蒙古、朝鮮、日本。Temperate and subarctic areas of Asia, such as: Northeast China, North China, Henan, Shaanxi, Ningxia, Gansu, Qinghai, Sichuan, Yunnan and southeastern Tibet; Russia, Mongolia, North Korea, Japan.Properties(characteristics)﹕性味﹕bitter, neutral, toxic苦，平，有毒。Channels (meridians) entered: 歸經﹕lung, stomach, large intestine.肺，胃，大腸。Medical functions:藥理﹕ Betulin can inhibit the synthesis of cholesterol and triglycerides, and can effectively prevent obesity, atherosclerosis and type II diabetes.Arresting cough, expectorant and anti-asthmatic effects. Intraperitoneal injection of water, methanol, ether and acid ethanol extracts of hua shu pi possesses anti-cough effect in mice.白樺酯醇能抑制膽固醇和甘油三酯合成，有效預防肥胖症、動脈粥樣硬化症和II型糖尿病。[2]止咳、祛痰與平喘作用。小鼠腹腔注射白樺樹皮的水、甲醇、乙醚及酸性乙醇的提取物以及乙醚析出物，都有一定的止咳作用。Actions & Indications:主治﹕For clearing damp-heat  and detoxification. For acute tonsilitis, bronchitis, pneumonia, enteritis, dysentery, hepatitis, oliguria with yellow urine, acute mastitis; topical treatment of burns, and swollen carbuncles.清 濕熱，解毒。用於急性扁桃體炎，支氣管炎，肺炎，腸炎，痢疾，肝炎，尿少色黃，急性乳腺炎；外用治燒燙傷，癰癤腫毒。Chemical ingredients:化學成份﹕　Bark contians:樹皮含:Betulin (β-Amyrin)～35％白樺酯醇~35％Betuloside白樺甙Tannin  7%鞣質(7％)Oleanolic Acid齊墩果酸Different types of higher fatty acid, about 35%各種高級脂肪酸約35％Phenol酚性物質Saponin皂甙類Polysaccharide多糖類Protein蛋白質Triterpenoids三萜類化合物Total glucoside總甙類Resin樹脂Fat油脂Fresh leaves contain:鮮葉含：Betuldafolienetriol 0.25％樺葉烯三醇 0.25％Betulafolienetetraol樺葉烯四醇Betulatetrol樺木烯四醇Triterpenoid saponin about 3%三萜皂甙 約3％Flavonoids 2%黃酮類 2％Gallic acid沒食子酸Coumarin香豆素Carotene胡蘿卜素Vitamin C維生素CPer 100 grams of dry immature fruit contains carotene 52.41 mg.; fresh fruit contains 19.55 mg每100克未成熟乾果實中含胡蘿卜素52.41毫克；鮮品含19.55毫克Xylan木聚糖Daly Dosage:每日用量﹕9 to 15 g, make into powder mix with liquid. Take orally..External use: appropriate amount.3～5錢，研末調服。外用適量，Samples of formulae:處方舉例﹕For treatment of dysentery: calcine hua shu pi into charcoal. Grind into fine powder. Take 3 g each time, twice a day.For treatment of hot and small amount of urine: use hua shu pi to make into strong decoction. Take orally.治痢疾：樺樹皮煅炭，研成細末。每次一錢，日服二次。《林氏家抄方》【1】治小便熱短：樺皮濃煮汁飲。《吉林中草藥》Modern Research:現代研究﹕ Toxicity & Cautions:毒素與禁忌﹕Plants can cause systemic toxicity varying from mild abdominal cramping to serious cardiac complications.[3]可引起全身毒性變化從輕度腹部痙攣至嚴重的心臟並發症。[3][1] 編者按：原方有�糖為引\" 。用糖能導致腹瀉。應該不可用糖。[2]http://chn.chinamil.com.cn/ylws/2011-01/06/content_4546064.htm[1] Editor note: the original formula mentions using sugar. Sugar can actually induce diarrhea. Sugar should not be use in case of diarrhea.[3] http://www.aragriculture.org/horticulture/ornamentals/toxic_plants.htmSearch this siteProblems with website? Please Click here for comment. (Not for inquiry )    Click here for inquiryCopyright Notice 按此看關於版權問題Sponsors' Ads by Google 以下為谷歌 所提供之廣告A manuscript... writing, translating and proofreading  in progressMenu: List of Health ProblemsQigong (chi kung)Toxicity of Some HerbsSide Effect of Some HerbsHerbs that can be toxic to kidneysTraditional Chinese Medicine TCM Diagnosis Samples of FormulaeTerms of Traditional Chinese MedicineAcupunctureChinese Herb DictionaryQigong classesPrescribed Drug DictionaryEmail our web master for  your suggestion (not for inquiry)Biochemistry Dictionary Qigong classes Research Librarian copy right 版權所有HomeWeather ReportDisclaimerLast update: Feb 12, 2015; 2 p.m. LAH   ",
    "original_url": "http://alternativehealing.org/hua_shu_pi.htm"
  }
]
