[
    {
        "Names": {
            "Name": [
                "xian mao",
                "仙茅"
            ],
            "Pharmaceutical": [
                "Rhizoma curculiginis"
            ],
            "Biological": [
                "Curculigo orchioides Gaertn."
            ],
            "Common": [
                "golden eye-grass rhizome"
            ],
            "Other": [
                "xiao xian mao",
                "du jiao si mao",
                "shan zong",
                "di zong",
                "qian nian zong",
                "fan long cao",
                "小仙茅",
                "獨腳絲茅",
                "山棕",
                "地棕",
                "千年棕",
                "番龍草"
            ],
            "Chinese": [
                "仙茅",
                "小仙茅",
                "獨腳絲茅",
                "山棕",
                "地棕",
                "千年棕",
                "番龍草"
            ],
            "Pronunciation in Korean": [
                "sinmo"
            ],
            "Pronunciation in Japanese": [
                "sembo"
            ],
            "Pronunciation in Cantonese": [
                "sin1 maau4"
            ],
            "Pinyin Pronunciation": []
        },
        "Type": "Herb",
        "Geography": [
            "Sichuan",
            "Yunan",
            "Guizhou"
        ],
        "Properties": [
            "acrid",
            "hot",
            "mildly toxic"
        ],
        "Meridians": [
            "Kidney",
            "Liver",
            "Spleen"
        ],
        "Maladies Treated": [
            "yangxu (yang deficiency)",
            "impotence due to kidney deficiency",
            "lower back and knee pain due to kidney deficiency",
            "cold chest and abdomen due to kidney deficiency",
            "urinary incontinence due to kidney deficiency",
            "pain or numbness due to cold in the waist and legs",
            "carbuncles and sores with fire toxin (癰疽火毒)"
        ],
        "Medical Function": [
            "Tonifies kidneys, improves yang xu (yang deficiency), strengthens muscles.",
            "xian mao alcohol extract possesses effects of: resistance to high temperature, resistance to lack of oxygen, adaptation to high altitude, calming effect, antioxidant, liver protection, anti-seizure properties, androgen-like effects."
        ],
        "Dosage": "3 to 10 g",
        "Samples of Formulae": "",
        "Contraindications": "not to use in case of yinxu (yin deficient) and heat. Not for long term use.",
        "Research": "Modern Research: antioxidant, hepatoprotective effect.",
        "Notes": "",
        "Chemical Ingredients": {},
        "References": [],
        "Further Reading": [],
        "Original Text": "xian mao, Complementary and Alternative Healing UniversityComplementary and Alternative Healing University   中藥詞典                 Chinese Herb Dictionary      Search this site     在本網站找資料Search this siteList of Health ProblemsChinese Herb DictionaryQigongTraditional Chinese Medicine (TCM)AcupuncturePrescribed Drug DictionaryBiochemistry DictionaryLecture SlidesResearch LibrarianGeneral Online LibraryResearch SitesViagraMassage/AcupressureHypnotherapyTell us what you wantNotify Changes & New Information　　xian mao 仙茅By: Joe Hing Kwok Chu　Pharmaceutical name:英文药名：Rhizoma curculiginisBiological name:拉丁學名：Curculigo orchioides Gaertn.Pron. in Japanese:日語發音：semboPron. in Korean:韓語發音：sinmoPron. in Cantonese:粤語發音：sin1 maau4Other Names:別名:xiao xian mao, du jiao si mao, shan zong, di zong, qian nian zong, fan long cao小仙茅﹐獨腳絲茅﹐山棕﹐地棕﹐千年棕﹐番龍草。.Common Name:英文名：golden eye-grass rhizomeDistribution:分佈：Sichuan, Yunan, Guizhou四川，云南，贵州。Properties (characteristics):性味:acrid, hot, mildly toxic辛，熱。有微毒。Channels (meridians) entered:歸經:kidney, liver, spleen.腎﹐肝﹐脾。Actions & Indications:主治：Tonifies kidneys, and improve yangxu (yang deficient),  strengthen muscles; for impotence,  lower back and knee pain, cold chest and abdomen, urinary incontinence due to kidney deficient.溫腎陽，壯筋骨。 陽萎精冷，遺尿崩漏，心腹冷痛，腰腳冷痺，癰疽火毒。Medical Function:藥理:xian mao alcohol extract possesses effects of: resistance of high temperature, lack of oxygen, adapting high altitude, calming, antioxidant, liver protection, anti-seizures, effect of androgen.仙茅醇浸劑有: 抗高溫，耐缺氧，適應高原，以及鎮靜﹐抗 氧 化 ﹐  保 肝 作 用 ﹐ 抗驚厥﹐雄性激素樣作用。Chemical Ingredients:化學成份:to be loadedDosage:3 to 10 g,3-10 克。Commonly Used formulae:常用配方:to be loadedModern Research:现代研究：antioxidanthepatoprotective effect　Cautions:禁忌﹕not to use in case of yinxu (yin deficient)  and heat. Not for long term use.陰虛有熱者忌用。不能長期服用。　Search this siteProblems with website? Please Click here for comment. (Not for inquiry )    Click here for inquiryCopyright Notice 按此看關於版權問題　Sponsors' Ads by Google 以下為谷歌 所提供之廣告 List of Health ProblemsChinese Herb DictionaryToxicity of Some HerbsSide Effect of Some HerbsHerbs that can be toxic to kidneysTraditional Chinese Medicine　TCM Diagnosis　Samples of FormulaeTerms of Traditional Chinese MedicineAcupuncturecopy right　版權所有Qigong (chi kung)Prescribed Drug DictionaryEmail our web master for  your suggestion (not for inquiry)Biochemistry DictionaryGeneral Online LibraryQigong classesFake Email WarningResearch LibrarianSearchQigong classesHomeWeather ReportDisclaimerLast update: Oct 4, 2013; 12:25 a.m. LAH　  ",
        "original_url": "http://alternativehealing.org/xian_mao.htm"
    },
    {
        "Names": {
            "Name": [
                "xi jiao"
            ],
            "Pharmaceutical": [
                "Cornu Rhinoceri"
            ],
            "Biological": [
                "Rhinoceres unicornis L.",
                "Rhinoceres sondaicus Desmarest",
                "Rhinoceres sumatrensis Cuvier",
                "Rhinoceres sinus Burchell",
                "Rhinoceres bicornis L."
            ],
            "Common": [
                "Rhinoceros horn"
            ],
            "Other": [
                "Guang xi jiao 廣犀角",
                "tian ma jiao 天馬角"
            ],
            "Chinese": [
                "犀角",
                "廣犀角",
                "天馬角"
            ],
            "Pronunciation in Korean": [
                "sogak"
            ],
            "Pronunciation in Japanese": [
                "saikaku"
            ],
            "Pronunciation in Cantonese": [
                "sai1 gok3"
            ],
            "Pinyin Pronunciation": []
        },
        "Type": "Animal",
        "Geography": [
            "India",
            "Nepal",
            "Burma",
            "Thailand",
            "Malaysia",
            "Indonesia",
            "East and Southeast Africa"
        ],
        "Properties": [
            "bitter",
            "salty",
            "cold"
        ],
        "Meridians": [
            "heart",
            "liver",
            "stomach"
        ],
        "Maladies Treated": [
            "High fever, delirium, and convulsions associated with warm febrile diseases",
            "Loss of consciousness and delirium accompanied by spitting blood, nose bleeding, or bruises",
            "Infantile convulsion"
        ],
        "Medical Function": [
            "Sedative effect",
            "Anticonvulsant",
            "Antibiotic",
            "Anti-inflammatory",
            "Anti-viral",
            "Shortens bleeding time",
            "Lowers the penetrating quality of capillaries"
        ],
        "Dosage": "Oral intake: grind with water or powder form, 0.9 g to 1.8 g; in decoction form: 1.5 g to 6 g. External application: grind with water and apply.",
        "Samples of Formulae": "Xi jiao di huang tang (犀角地黃湯). For high fever, delirium, and convulsions associated with warm febrile diseases: combine xi jiao with ling yang jiao (antelope horn). For treatment of loss of consciousness and delirium with spitting blood, nose bleeding, or bruises: combine xi jiao with dan pi (moutan bark), da qing ye (indigo leaf), zi cao (lithospermum). Or combine xi jiao with huang lian (coptis), xuan shen (figwort root). Add water and make into decoction and take orally. For infantile convulsion: raw xi jiao added to water and ground into paste form or powdered form mixed with drinking water, taken orally.",
        "Contraindications": "Not to be used during pregnancy or in sickness without high fever. Do not use in cases of spleen deficiency.",
        "Research": "Buffalo horn can be used as a substitute for xi jiao in clinical practice.",
        "Notes": "",
        "Chemical Ingredients": {
            "Chemical Components": [
                "Cholesterol",
                "Amino acids: Alanine, Arginine, Aspartate, Cystine, Leucine, Proline, Tyrosine, Histidine, Valine",
                "Peptide"
            ]
        },
        "References": [],
        "Further Reading": [],
        "Original Text": "xi jiao , Complementary and Alternative Healing UniversityComplementary and Alternative Healing University   中藥詞典                 Chinese Herb Dictionary      Search this site     在本網站找資料Search this siteList of Health ProblemsChinese Herb DictionaryQigongTraditional Chinese Medicine (TCM)AcupuncturePrescribed Drug DictionaryBiochemistry DictionaryLecture SlidesResearch LibrarianGeneral Online LibraryResearch SitesViagraMassage/AcupressureHypnotherapyTell us what you wantNotify Changes & New Information     xi jiao 犀角      （ in English and Chinese 中英文）by: Joe Hing kwok Chu    朱興國編 譯    Pharmaceutical name:英文藥名﹕Cornu RhinoceriZoological  name of source animal::動物來源之學名﹕Asian species are mainly used: Rhinoceres unicornis L. R. sondaicus Desmarest, R sumatrensis Cuvier,Sometimes the African species are also used:R. sinus Burchell, R bicornis L.Pron. in Japanese:日語發音﹕saikakuPron. in Korean:韓語發音﹕sogakPron. in Cantonese::粵音﹕sai1 gok3Other Names:別名﹕Guang xi jiao 廣犀角，tian ma jiao 天馬角。Common Name:英文名﹕Rhinoceros hornDistribution:產地﹕India, Nepal, Burma, Thailand, Malaysia, Indonesia, east and southeast Africa.印度，尼泊爾，緬甸，泰國，馬來西亞，印尼，非洲東南部等地。Propertiescharacteristics﹕性味﹕bitter. salty, cold.苦，鹹，寒。Channels meridians entered: 歸經﹕heart, liver, stomach.心，肝，胃。Medical functions:藥理﹕ sedative effect, anticonvulsant, antibiotic, anti-inflammatory, anti-virus, shortens bleeding time, lowers the penetrating quality of capillaries.鎮靜，鎮驚 ，抗菌， 抗炎，抗病毒，縮短出血，降低毛细血管通透性等。Actions & Indications:主治﹕For treatment of high fever, delirium, and convulsions associated with warm febrile diseases: combine xi jiao with ling yang jiaoFor treatment of loss of consciousness and delirium with spitting blood, nose bleeding or bruises: combine with dan pi, da qing ye, zi cao. Or use combination of xi jiao, huang lian, xuan shen. Add water and make into decoction and take orally.For infantile convulsion: use raw xi jiao add water and grind into paste or make into powder form and mix with drinking water and talk orally.治療因溫病而發高熱，譫妄，抽搐： 犀角加羚羊角。或配黃連，玄參。治療意識喪失和精神錯亂兼吐血，鼻出血或瘀痕：配牡丹皮，大青葉，紫 草小兒驚風。用犀角磨水取濃汁服下。服犀角末亦可。Chemical ingredients:化學成份﹕Cholesterol膽甾醇Amino acids氨基酸:Alanine丙氨酸Arginine精氨酸Aspartate天冬氨酸Cystine胱氨酸Leucine亮氨酸Proline脯氨酸Tyrosine酪氨酸Histidine組氨酸Valine纈氨酸Peptide肽類Daly Dosage:每日用量﹕For taking orally: grind with water or make into powder: 0.9 g to 1.8 g. to use in decoction: 1.5 g to 6 g.External application: grind with water and apply.內服：磨汁或研末，3～6分；煎湯，0.5～2錢；或入丸、散。外用：磨汁塗患處。Samples of formulae:處方舉例﹕xi jiao di huang tang 犀角地黃湯Modern Research:現代研究﹕Buffalo horn can be used as a substitute.藥用可以水牛角代替犀角。Toxicity & Cautions:毒素與禁忌﹕Not to use during pregnancy or in sickness without high fever Do not use in cases of spleen deficient.孕婦慎用。 非實熱者不宜用。脾虛者不宜使用。現在臨床上用水牛角作為犀牛角的代用品Search this siteProblems with website? Please Click here for comment. (Not for inquiry )    Click here for inquiryCopyright Notice 按此看關於版權問題A manuscript... writing, translating and proofreading  in progressSponsors' Ads by Google 以下為谷歌 所提供之廣告 List of Health ProblemsChinese Herb DictionaryToxicity of Some HerbsSide Effect of Some HerbsHerbs that can be toxic to kidneysTraditional Chinese Medicine TCM Diagnosis Samples of FormulaeTerms of Traditional Chinese MedicineAcupuncturecopy right 版權所有Qigong (chi kung)Prescribed Drug DictionaryEmail our web master for  your suggestion (not for inquiry)Biochemistry DictionaryGeneral Online LibraryQigong classesFake Email WarningResearch LibrarianSearchQigong classesHomeWeather ReportDisclaimerLast update: Dec 18, 2013; 4 p.m. LAH   ",
        "original_url": "http://alternativehealing.org/xi_jiao.htm"
    },
    {
        "Names": {
            "Name": [
                "shan zha"
            ],
            "Pharmaceutical": [
                "Crataegi Fructus"
            ],
            "Biological": [
                "Crataegus pinnatifida var.major",
                "C. pinnatifida Bge.ver. major N.E.Br. (山裏紅)",
                "C. hupensis SARG. (湖北山楂)"
            ],
            "Chemical": [],
            "Common": [
                "hawthorn fruit"
            ],
            "Other": [
                "chi gua zi 赤瓜子",
                "shu zha 鼠楂",
                "hou zha 猴楂",
                "miao zha 茅楂",
                "yang huan qiu 羊還球",
                "tang qiu zi 棠球子",
                "shan li guo 山裏果",
                "chi zao zi 赤棗子"
            ],
            "Chinese": [
                "山楂"
            ],
            "Pronunciation in Korean": [
                "sanza"
            ],
            "Pronunciation in Japanese": [
                "shanzashi"
            ],
            "Pronunciation in Cantonese": [
                "saan1 zaa1"
            ],
            "Pinyin Pronunciation": []
        },
        "Type": "Herb",
        "Geography": [
            "grown in northeastern and northern parts of China and Shaanxi, Henan, Shandong, Jiangsu provinces",
            "Mainly produced in Hebei, Henan, Shandong, Liaoning provinces of China"
        ],
        "Properties": [
            "sour",
            "sweet",
            "slightly warm"
        ],
        "Meridians": [
            "spleen",
            "stomach",
            "liver"
        ],
        "Maladies Treated": [
            "protein indigestion",
            "flatulence",
            "diarrhea due to pixu (spleen deficient)",
            "amenorrhea due to blood stasis",
            "postpartum blood stasis",
            "acute pain in chest and abdomen area",
            "pain in hernia",
            "high lipids",
            "small children malnutrition due to erratic feeding, Syndrome: yellowish face color, bulging abdomen, lack of appetite, or vomiting after meal, or diarrhea with undigested food. Use shan zha with bian dou, mu xiang, rou dou kou to strengthen digestion and rid of the syndrome.",
            "early stage dysentery, passing mucus and blood in stool, abdominal pain, tenesmus, no chills or fever, use alone or cook with black tea",
            "postpartum stagnated blood, incomplete discharge of lochia, lower abdominal pain, combine with yi mu cao (motherwort), dang gui (angelica root), chuan xiong (ligusticum root) for moving blood and dispersing stagnation, combine with pu huang (bulrush pollen), qian cao (madder root) to move blood and stop bleeding",
            "amenorrhea with abdominal pain, commonly combined with dang gui wei (tail of angelica), hong hua (safflower), xiang fu (cyperus) for moving blood and qi stagnation",
            "modernly beneficial for treatment of high lipids, arteriosclerosis, and hypertension",
            "tapeworm infection, folk usage: eat large amounts of fresh shan zha as snack, next morning take decoction of bing lang (areca nut) to expel whole tapeworm"
        ],
        "Medical Function": [
            "cardiac stimulant effect",
            "smaller dosages possess hypotensive effect",
            "total flavonoids can improve coronary circulation",
            "anti lack of oxygen of cardiac muscles in experimental setting (animal experiment)",
            "anti-arrhythmia effect",
            "shan zha solution significantly lowers blood cholesterol and triglyceride levels",
            "lipase of shan zha promotes resolution of fat, aids digestion",
            "crataegolic acid in shan zha promotes protein-decomposing enzyme activity aiding digestion",
            "shan zha decoction and alcohol extract have antimicrobial activity against Shigella flexneri, Shigella sonnei, Proteobacteria, and Escherichia coli [1]",
            "being used in high lipids, arteriosclerosis, and hypertension"
        ],
        "Dosage": "Generally 10 to 15 g. Large dosage can be 30 to 120g.",
        "Samples of Formulae": "Indigestion (also called dyspepsia). Symptoms: fullness, bloating, burping, nausea, lack of appetite, or difficulty defecating, foul-smelling stool. Make decoction with shan zha or make it into powder. Combining shan zha with shen qu (medicated leaven), mai ya (barley sprout), zhi ke (bitter orange), bai zhu (atractylodes) enhances digestion. \n For small children's malnutrition due to erratic feeding, symptoms include yellowish facial color, bulging abdomen, lack of appetite, vomiting after meals, or diarrhea with undigested food, combine shan zha with bian dou (hyacinth bean), mu xiang (aucklandia root), rou dou kou (nutmeg) to strengthen digestion and treat syndrome. \n For early dysentery syndrome with mucus and blood in stool, abdominal pain, urgency without chills or fever, use shan zha alone or with black tea. \n Postpartum stagnation of blood, incomplete lochia discharge, lower abdominal pain treated by combining shan zha with yi mu cao (motherwort), dang gui (angelica root), chuan xiong (ligusticum root) to activate blood circulation, or with pu huang (bulrush pollen), qian cao (madder root) to stop bleeding. \n For amenorrhea and abdominal pain, shan zha is commonly combined with dang gui wei (angelica tail), hong hua (safflower), xiang fu (cyperus). \n In modern clinical use for high blood lipids, arteriosclerosis, and hypertension. \n Folk usage: large quantity of fresh shan zha taken as snack, then next morning taking a decoction of bing lang (areca nut) can expel entire tapeworm; dosage for decoction usually 9-12g, single decoction up to 30g, powdered form 3-6g.",
        "Contraindications": "Do not use in case of pixu (spleen deficient) without indigestion. Use with caution in cases of excess stomach acid, peptic ulcers, and pregnancies (to avoid premature delivery).",
        "Research": "Shan zha solution significantly lowers blood cholesterol and triglyceride levels. Decoction and alcohol extract have antibacterial activity against Shigella flexneri, Shigella sonnei, Proteobacteria, and Escherichia coli. [1]",
        "Notes": "",
        "Chemical Ingredients": [
            "malic acid",
            "caffeic acid",
            "oleanolic acid",
            "crataegolic acid",
            "epicatechin",
            "quercetin",
            "hyperoside",
            "chlorogenic acid",
            "citric acid",
            "citric acid symmetrical monomethyl ester",
            "citric acid symmetrical dimethyl ester",
            "citric acid trimethyl ester",
            "cane sugar",
            "flavan polymers",
            "ursolic acid",
            "vitamin C",
            "riboflavin (vitamin B2)",
            "carotene"
        ],
        "References": [
            "[1] 山楂煎劑和乙醇提取物有抗菌作用對：福氏 (Shigella flexneri)痢疾桿菌，宋內氏(Shigella sonnei)痢疾桿菌, 變形杆菌 (Proteobacteria), 大腸桿菌 (Escherichia coli) 均有抗菌作用。"
        ],
        "Further Reading": [],
        "Original Text": "\n\n\nshan zha, hawthorn fruit,Complementary and Alternative Healing University\n\n\n\n\n\n\n\n\nComplementary and \n        Alternative Healing University\n        \n \n\n\n\n\n\n中藥詞典                 \n        Chinese Herb Dictionary    \n         Search \n        this site    \n        \n        在本網站找資料\n\n\n\n\n\n\n\n\n\n\n\n\n\n\nSearch \n            this site\n\n\n\n            List of Health Problems\n\n\n\n\n\n\n            Chinese Herb Dictionary\n\n\n\n\n\nQigong\n\n\n\n\n\n\n            Traditional Chinese Medicine (TCM)\n\n\n\n\n\n\n            Acupuncture\n\n\n\n\n\n\n            Prescribed Drug Dictionary\n\n\n\n\n\nBiochemistry Dictionary\n\n\n\n\n\nLecture Slides\n\n\n\n\n\nResearch Librarian\n\n\n\n\n\n\n            General Online Library\n\n\n\n\n\nResearch \n            Sites\n\n\n\n\n\n\n            Viagra\n\n\n\n\n\n\n            Massage/Acupressure\n\n\n\n\n\n\n            Hypnotherapy\n\n\n\n\n\nTell us what you \n            want\n\n\n\n\n\nNotify \n            Changes & New Information\n\n\n\n \n\n\n\n\n\n \nshan zha 山楂   \n        (in English and Chinese 中英文)\n\ntranslated\n        \n        by: Joe Hing kwok Chu\n\n\n\n\nPresent \n            day application:\n現 代應\n            用：\n\n\n\nbeing used in high lipids, arteriosclerosis, and \n            hypertension.\n\n現代用於高血脂症，動脈硬化性心臟病，高血壓病。\n\n\n\n\nPharmaceutical \n            name:\n英文藥名﹕\n\n\n\nCrataegi Fructus\n\n\n\n\nBotanical name:\n學名﹕\n\n\n\nCrataegus pinnatifida var.major\n\nC. pinnatifida \nBge.ver. \n            major N.E.Br. \n            (山裏紅)\n\nC. hupensis SARG. (湖北山楂)\n\n\n\n\nPron. in Japanese:\n日語發音﹕\n\n\nshanzashi\n\n\n\n\nPron. in Korean:\n韓語發音﹕\n\n\nsanza\n\n\n\n\n\n\n            Pron. in Cantonese:\n粵音﹕\n\n\n\nsaan1 zaa1\n\n\n\n\nOther Names:\n別名 ﹕\n\n\n\n\nchi gua zi 赤瓜子，shu \n            zha 鼠楂，hou zha 猴楂，miao zha 茅楂，\n\n\nyang huan qiu 羊還 \n            球，tang qiu zi 棠球子，shan li guo 山裏果，\n\n\nchi zao zi\n            赤棗子。\n\n\n\n\nCommon Name:\n英文名﹕\n\n\n\nhawthorn fruit\n\n\n\n\nDistribution:\n產地﹕\n\n\n\ngrown in northeastern and northern parts of China \n            and Shaanxi,\n\nHenan, Shandong, Jiangsu provinces. Mainly produced \n            in Hebei,\n\nHenan, Shandong, Liaoning provinces of China.\n\n在中國東北，華北及陝西，河南，山東，江蘇等省區廣為栽培﹐\n\n主產於河北，河南，山東，遼寧等省。\n\n\n\n\nProperties\n(characteristics)﹕\n性味﹕\n\n\n\nsour, sweat, and slightly warm.\n\n味酸，甘﹐性微溫。\n\n\n\n\nChannels (meridians) \n            entered:\n \n歸經﹕\n\n\n\nspleen, stomach and liver.\n\n歸脾，胃，肝經。\n\n\n\n\n\nMedical functions:\n\n藥理﹕\n \n\n\nMany \n            types of extract from shan zha possess：\n\n\ncardiac \n              stimulant effect. \n\n\nsmaller \n              dosages possess hypotensive effect. \n\n\ntotal \n              flavonoid can improve the amount of coronary circulation, \n\n\nanti \n              lack of oxygen of cardiac muscles, \n\n\nanti-arrhythmia.\n              \n\n\nShan \n            zha solution can clearly lowering the blood cholesterol and triglyceride \n            also is obviously lower after using shan zha solution. The lipase of \n            shan zha can promote the resolution of fat and can help digestion.\nThe \n            decoction and alcohol extract of shan zha possess the effect of anti \n            the following bacteria: Shigella flexner, Shigella flexneri, Shigella \n            sonnei, protecbacteria and Escherichia coli. [1]\n \n山楂的多種提取物有:\n\n\n強心作用﹔\n\n\n較小劑量有降血壓作用。\n\n\n總黃\n              酮可增加冠脈流量﹐\n\n\n抗實驗性心肌缺氧﹐\n\n\n抗心律失常。\n\n\n山楂浸膏:可使 血中膽固醇, 甘油三酯含量有明顯下降。\n山楂中脂肪酸脢: 可促進脂肪分解﹔\n山楂酸等:可\n            提高蛋白分解脢的活性﹐有幫助消化的作用。\n \n山楂煎劑\n            和乙醇提取物有抗菌作用對 ：\n\n\n福氏\n              (Shigella flexneri) 痢疾桿菌\n\n\n宋內氏(Shigella sonnei) \n              痢疾桿菌, \n\n\n變形杆菌 (Proteobacteria), \n\n\n大腸\n              桿菌Escherichia coli\n\n\n\n            均有抗菌作用。[1]\n\n\n\n\nActions & Indications:\n主治﹕\n\n\n\nbeing used in protein indigestion, flatulence, diarrhea \n            due to \n \n\n\npixu (spleen deficient), \n            amenorrhea due to \n            blood stasis \n, postpartum  blood \n            stasis, acute pain in chest and abdomen \n            area, pain in hernia, high lipids. For improving \n            digestion, use baked (stir fried) shan zha.\n\nFor getting rid of  blood \n            stasis use raw shan zha.\n\n用於肉食積滯，胃脘賬滿，瀉痢腹痛 \n            ，血\n            淤經閉，產後血 \n            淤，\n\n心腹刺痛，疝氣作痛；高血脂症。消 \n            食化積﹐炒焦用﹐活血散瘀\n\n宜生用。\n\n\n\n\nChemical ingredients:\n化學成份﹕\n\n\n\n蘋果酸 (malic acid)，咖啡酸 \n            (caffeic acid)，齊墩果酸 (oleanolic acid) ，山\n            楂酸 (crataegolic acid), 表兒茶精 (epicatechin), 槲皮素 (quercetin), 金絲桃甙 \n            (hyperoside), 綠原酸 (chlorogenic acid), 枸櫞酸 (citric acid) 及其單甲酯 (citric \n            acid symmetrical monomethyl ester), 二甲酯 (citric acid symmetrical dimethyl \n            ester) 和三甲酯 (citric acid trimethyl ester), 蔗糖 (cane \n            sugar), 黃烷聚合物 (flavan polymers), 熊果酸 (ursolic acid)\n            ，維生素C \n            (vitamin C)，\n            核黃素 (riboflavin (vitamin B2))，胡蘿蔔素 \n            (carotene)等。 \n \n\n\n\n\nDosage:\n用量﹕\n\n\n\nGenerally 10 to 15 g. Large dosage can be 30 to 120g.\n一般10～15g，\n            大剤量可用至30～120g\n\n\n\n\nSamples of formulae:\n \n \n \n \n \n \n \n \n \n \n \n \n \n \n \n處方舉例﹕\n\n\n\nIndigestion (also called dyspepsia). Symptoms: fullness, \n            bloating,\n\nburping, nausea, lack of appetite, or not easy to \n            defecate, foul\n\nsmelling stool. Make decoction with shan zha or make \n            into powder.\n\nWhen combine shan zha with\n            shen qu, \n            mai ya, \n            zhi ke, bai zhu, the\n\neffect on digestion can be stronger.\n \nFor \n            small children malnutrition due to erratic feeding. Syndrome: \n            yellowish face color, bulging abdomen, lack of appetite, or vomiting \n            after meal, or diarrhea with undigested food. Use shan zha with bian \n            dou, mu xiang, rou dou kou to strengthen digestion and rid of the \n            syndrome. \n\n若飲食停滯﹐脘腹脹滿﹐嘈雜﹐噯氣﹐噁心厭食﹐或大便不爽﹐糞出臭穢﹐可單用山楂煮汁飲或研末吞服﹐如配 \n            伍神\n            麴，麥\n            芽，枳\n            殼，白\n            朮等可加強消積化滯作用。\n\n             \n\n治小兒疳積﹐因乳食不節﹐損傷脾胃日久而面黃腹膨﹐不思飲食﹐或食入即吐﹐或瀉下挾有完穀﹐可與扁豆，木 \n            香，肉荳蔻等配用以健脾消疳。\n\n             \n\n本品用於痢疾初起﹐下痢膿血﹐腹痛後重而無寒熱者﹐有消瘀化滯之功﹐可單用或與紅茶同煎服。\n\n             \n\n治產後瘀滯﹐惡露不淨﹐少腹疼痛﹐或與益母草，當\n            歸，川\n            芎等活血散瘀藥配用﹐或與蒲黃，蒨草\n            等活血止血藥 同用。\n\n             \n\n本品亦治經閉腹痛﹐常與當歸尾，紅花，香附等活血行氣藥配伍應用。\n\n             \n\n現代用於高血脂症，動脈硬化性心臟病，高血壓病都有一定療效。民間用鮮山楂大量零食﹐次晨再以檳榔煎服﹐ \n            可排出完整絛蟲﹐治療絛蟲病。內服入煎劑用量9～12克﹐單味煎服可用至30克﹐研末吞服﹐3～6克。\n\n\n\n\nModern Research:\n現代研究﹕\n\n\n \n\n\n\n\nToxicity & Cautions:\n毒素與禁忌﹕\n\n\n\nDo not use in case of\n            pixu (spleen deficient) \n            without indigestion. Use with \ncare in cases of  over abundance of stomach \n            acid, peptic \n            ulcers or \npregnancies (to avoid premature delivery).\n\n\n 脾\n            虛無食積不化者忌用。胃酸\n            過多及胃潰\n            瘍胃潰瘍患者慎服。孕婦慎服，以\n            避免早產。\n\n\n\n　\n\n\n\n\nSearch this \n        site \n\n\nProblems with website? Please \n\n\n        Click here for comment. (Not for inquiry )    \n        \n\n\n\n        Click here for inquiry\n\n\n\nCopyright Notice \n\n按此看關於版權問題\n\n\n\n\nA manuscript... writing, translating and proofreading  in progress\n\n\nSponsors' Ads by Google \n        以下為谷歌 所提供之廣告\n\n\n\n\n\n\n\n\n\n            List of Health Problems\n\n\n\n\n            Chinese Herb Dictionary\n\n\n\n\nToxicity of Some Herbs\n\n\n\nSide Effect of Some Herbs\n\n\n\nHerbs that can be toxic to \n            kidneys\n\n\n\n\n            Traditional Chinese Medicine\n \n\n\nTCM \n            Diagnosis\n \n\n\n            Samples of Formulae\n\n\n\n\n            Terms of Traditional Chinese Medicine\n\n\n\n            Acupuncture\n\n\n\n\n\ncopy \n            right\n \n\n\n版權所有\n\n\n\n\n            Qigong (chi \n            kung)\n\n\n\n\n            Prescribed Drug Dictionary\n\n\n\n\n            Email our web master for  your suggestion (not for inquiry)\n\n\n\nBiochemistry Dictionary\n\n\n\n\n\nGeneral Online Library\n\n\n\nQigong \n            classes\n\n\n\nFake \n            Email Warning\n\n\n\nResearch Librarian\n\n\n\nSearch\n\n\n\n\n\nQigong classes\n\n\n\nHome\n\n\n\n\n            Weather Report\n\n\n\n\nDisclaimer\n\n\nLast update: Oct 12, 2013; 9 p.m. \n            LAH\n\n\n\n\n\n \n\n\n\n\n\n\n\n\n\n\n\n",
        "original_url": "http://alternativehealing.org/shan_zha.htm"
    },
    {
        "Names": {
            "Name": [
                "ban lan gen",
                "da qing ye"
            ],
            "Pharmaceutical": [
                "Radix Isatidis seu Baphicacanthi",
                "Radix Isatidis",
                "Foleum Isatidis"
            ],
            "Biological": [
                "Baphicacanthus cusia (Nees) Brem.",
                "Strobilanthes cusia (Nees) O. Ktze (nan ban lan 南板蓝根, 青黛 馬蓝)",
                "Isatis tinctoria L.",
                "Isatis indigotica Fort. (bei ban lan 北板藍)",
                "Strobilanthes divaricatus (Nees) T. Anders.(shu hua ma lan 疏花馬藍)"
            ],
            "Common": [
                "indago woad root",
                "indago woad leaves"
            ],
            "Other": [
                "ban lan 板藍",
                "da ding 大靛",
                "shan lan 山藍",
                "tu long gen 土龍根",
                "da lan gen 大蘭根",
                "lan long gen 蘭龍根"
            ],
            "Chinese": [
                "板藍根",
                "大青葉"
            ],
            "Pronunciation in Korean": [
                "p'alamguri"
            ],
            "Pronunciation in Japanese": [
                "banrankon"
            ],
            "Pronunciation in Cantonese": [
                "baan2 laam4 gan1"
            ],
            "Pinyin Pronunciation": []
        },
        "Type": "Herb",
        "Geography": [],
        "Properties": [
            "bitter",
            "cold"
        ],
        "Meridians": [
            "heart",
            "lung",
            "stomach"
        ],
        "Maladies Treated": [
            "rose-colored skin rash caused by diseases such as measles, syphilis, scarlet fever and toxic heat",
            "skin eruption due to wind-heat and other external skin diseases",
            "excessive thirst",
            "nose bleeding",
            "vomiting of blood",
            "chicken pox",
            "chronic myelogenous leukemia",
            "digestive tract ulcer/infection",
            "diptheria",
            "epilepsy",
            "erysipelas",
            "gum alveolitis",
            "hepatitis with jaundice",
            "herpes simplex II",
            "herpes zoster",
            "influenza",
            "keratitis",
            "measles with pneumonia",
            "meningitis B",
            "meningococcal meningitis",
            "psoriasis",
            "middle ear infection",
            "ulcer of the mouth in children",
            "SARS (Severe Acute Respiratory Syndrome)",
            "sinus infections of children",
            "tonsillitis"
        ],
        "Medical Function": [
            "anti microorganism",
            "anti cancer",
            "immune system enhancement",
            "anti inflammation and antipyretic",
            "inhibition of platelet aggregation: ban lan gen significantly inhibited platelet aggregation induced by adenosine diphosphate on domesticated rabbits. Uridine, hypoxanthine, pyrimidine, salicylic acid extracted from ban lan gen also exhibited inhibitory activity on adenosine triphosphate (ATP)-induced platelet aggregation in rabbits at concentration of 0.21mg/kg. Inhibition rates were 18.2%, 24.2%, 10.8% and 20% respectively.",
            "effect on cardiovascular system: Increase in perfusion of isolated rabbit ear blood vessels and lower limbs of lab rats, improved rabbit mesenteric microcirculation, reduced the blood pressure in anesthetized rabbits, reduced capillary permeability, and lowered myocardial oxygen consumption in mice.",
            "effect on smooth muscle",
            "antiviral action",
            "liver protection",
            "detoxification action: It has been reported that pre-administration with ban lan gen, huanglian powder (coptis), and li lu (veratrum) for dogs (dosage each 2.0g/kg) can detoxify li lu poisoning and decrease mortality. However, if administered after li lu poisoning, it is ineffective. Single use of either ban lan gen powder or huanglian powder was also found less effective."
        ],
        "Dosage": "15 to 30 g",
        "Samples of Formulae": "Acute hepatitis with jaundice: ban lan gen 30 g, zhi zi root 45 g. Make into concoction. Total patients treated: 53. All patients healed. Duration of therapy: 10 to 50 days [7].",
        "Contraindications": "Not to use in absence of fire toxin or in weak patients. Reports indicated prolonged usage may cause internal bleeding and injury to blood-producing function. Injections have reportedly caused allergic reactions and blood in urine. Allergic reactions include dizziness, rash, purple lips and face, numbness in limbs, serious cases may result in shock. Large dosages or long-term usage can be toxic to kidneys.",
        "Research": "Study of ban lan gen herb distinguishing 南板蓝根，青黛（馬蓝）原文：Baphicacanthus cusia（Nees） Bremek（169页，207页）補正：Strobilanthes cusia（Nees）O. Ktze.注解：《藥典》所載其學名為異名。出處：《中華人民共和國藥典》1995年版一部藥材部分内容補正 沈保安（安徽省蕪湖市藥品檢驗所 241001）",
        "Notes": "",
        "Chemical Ingredients": [
            "Leaves contain: tryptophan, isatan B, glucobrassicin, glucobrassicin-1-sulfonate, indigotin, 1-thiocyano-2-hydroxy-3-butene, adenosine, tryptanthrin, β-sitosterol, gamma-sitosterol, palmitic acid, sucrose, evaporating oil",
            "Amino acids: arginine, proline, glutamate, tyrosine, γ-amino butyric acid, leucine, valine",
            "Fresh leaves contain: 3-Indolylmethyl glucosinolate, isatan B (Glucobrassicin), 1-Methoxy-3-indolylmethyl glucosinolate (Neoglucobrassicin), 1-Sulpho-3-indolylmethyl glucosinolate"
        ],
        "References": [
            "[7] Acute hepatitis research trial (patients:53, therapy:10-50 days)",
            "《中華人民共和國藥典》1995年版一部藥材部分内容補正 沈保安（安徽省蕪湖市藥品檢驗所 241001）"
        ],
        "Further Reading": [],
        "Original Text": "ban lan gen, Complementary and Alternative Healing UniversityComplementary and Alternative Healing University \n  中藥詞典    Chinese Herb Dictionary      Search this site     在本網站找資料 ban lan gen  板藍根;  da qing ye  大青葉by: Joe Hing Kwok Chu                 (in English and Chinese 中英文)Click here to see pictures.Today's Applications:現代應用：Today's Applications:            现代應用：  chicken pox 水痘  chronic myelogenous leukemia 慢性骨隨性白血病  digestive tract ulcer / infection 消化道潰瘍  diptheria 白喉  epilepsy 癲癇  erysipelas 丹 毒  gum alveolitis 牙槽炎  hepatitis with jaundice  黄疸肝炎  herpes simplex II  單純皰疹II型病毒  herpes zoster 帶 狀泡疹  influenza 感冒  keratitis  角 膜炎  measles with pneumonia  德國麻疹兼 肺炎  meningitis B 已型脑膜炎  meningococcal meningitis 流行性腦脊髓膜炎  psoriasis  銀 痟 病  middle ear infection 中 耳感染  ulcer of the mouth in children  小孩口部潰瘍  SARS  嚴重急性呼吸系統綜合症  sinus infections of children 小兒鼻竇炎  tonsillitis  扁桃腺炎Pharmaceutical name:英文药名：Radix Isatidis seu Baphicacanthi （ban lan gen 板藍根）Radix Isatidis （ban lan gen 板\n  藍根）Foleum Isatidis  (da qing ye 大青葉）Biological name:拉丁植物學名：Baphicacanthus cusia (Nees) Brem.Strobilanthes cusia (Nees) O. Ktze (nan ban lan（南板蓝根，青黛（馬蓝）)Isatis tinctoria L.Isatis indigotica Fort. (bei ban lan 北板藍)Strobilanthes divaricatus (Nees) T. Anders.(shu hua ma lan 疏花馬藍)Pron. in Japanese:日語發音：banrankonPron. in Korean:韓語發音：p'alamguriPron. in Cantonese:粤語發音：baan2  laam4 gan1Common Name:英文名：indago woad root, indago woad leavesOther Names: 別名﹕ban lan 板藍,da ding 大靛,shan lan 山藍，tu long gen 土龍根，da lan gen 大蘭根，lan long gen  蘭龍根.Distribution:分佈： Properties (characteristics)性味：bitter, cold苦，寒。Channels (meridians) entered:歸經：heart, lung, stomach  肺，心，胃。Actions & Indications:主治：For1. rose-colored skin rash caused by diseases such as measles, syphilis, or scarlet fever and toxic heat,2. skin eruption due to wind-heat, other skin and external diseases,3. excessive thirst,4. nose bleeding and vomiting of blood.5. see today's applications主治：麻疹，梅毒，猩紅熱 （爛喉痧），熱毒。熱毒而致皮膚發疹 。口渴極。鼻血，吐血。看现 代應用。\n  ． \n\n\n Medical Function:藥理：1. anti micro organism,2. anti cancer,3. effect on immune system,4. anti inflammation, and antipyretic\n\ninhibition of platelet aggregation:\n    ban lan gen significantly \n    inhibited platelet aggregation induced by\nadenosine diphosphate on \n    domesticated rabbits. Uridine,\n    hypoxanthine, pyrimidine, \n    salicylic acid that separated from ban lan gen\nalso exhibited\nsome inhibitory activity on \n    adenosine triphosphate (ATP)-induced platelet\naggregation  in \n    concentration of  0.21mg/kg. \n    Inhibition rates were \n    18.2%, 24.2%, 10.8% and 20% respectively..5. effect on heart and blood vessel6. liver protection7. effect on smooth muscle8. antivirus抗微生物抗癌免疫作用抗炎，退 热\n      抑制血小板聚集作用: 板藍根對腺苷二磷酸Adenosine diphosphate誘導的家兔血小板聚集有顯著抑制作用．從板藍根中分得尿苷、次黃嘌呤、嘧啶、水楊酸等對ATP \n      (adenosine triphosphate) \n      誘導的家兔血小板聚集也都表現一定的抑制活性，在0.21mg/kg濃度時其抑制率分別為18.2%、24.2%、10.8%和20%．\n      對心血管的作用 ：\n      能使離體兔耳和大鼠下肢灌流量增加，改善家兔腸系膜微循環， \n      降低麻醉家兔的血壓，\n      減少毛細血管通透性， \n      使小鼠心肌耗氧量下降． 對平滑肌 作用抗病毒\n      解毒作用 有報道認為， 犬用板藍根、黃連粉與藜蘆同服（各2.0g/kg），能解藜蘆毒， \n      降低死亡率；若藜蘆中毒後再用之，則無效；分別單用板藍根粉或黃連粉， 效果亦不好Chemical ingredients:化學成份：The leaves contain tryptophan , isatan B, glucobrassicin, glucobrassicin-1-sulfonate, indigotin, 1-thiocyano-2-hydroxy-3-butene, adenosine, tryptanthrin, β-sitosterol, gama-sitosterol, palmitic acid, sucrose, evaporating oil etc.sucrose蔗糖amino acid氨基酸:arginine精氨酸proline脯氨酸glutamate穀氨酸tyrosine酪氨酸γ-amino butyric acidγ-氨基丁酸leucine亮氨酸valine纈氨酸Fresh leaves contain:新鲜頁中含：3-Indolylmethyl glucosinolate3-吲哚甲基葡萄糖異硫氰酸鹽Isatan B (Glucobr-assicin)大青素B(芸 苔甙)1-Methoxy-3- indolylmethylglu-cosinolate (Neoglucobrassicin)1-甲氧基-3-吲哚甲基葡萄糖異硫氰酸鹽(新 芸苔甙)1-Sulpho-3-indolymethyl glucosinolate1-磺酰-3-吲哚甲基葡萄糖異硫氰酸鹽 (1-磺 基-芸苔甙)Dosage:用量：15 to 30 g15～30克 。Samples of formulae:處方舉例：Acute hepatitis with jaundice: ban lan gen 30 g, zhi zi root 45 g. Make into concoction. Total patients: 53. Result: all healed. Duration of therapy: 10 to 50 days [7]Cautions:禁忌：Not to use in absence of fire toxin or in weak patients.There are report of prolong usage can cause internal bleeding and injury to blood producing function.  There are reports that injectiones have caused allergic reactions and blood in urine.Allergic reactions included: dizziness, rash, purple lips and face,  numbness in the limbs and in serious condition, shock.Large dosages and/or long term usage can be toxic to kidneys.大劑量或長期 服用可能對腎 臟有毒。　　板 藍根藥材之鑒別研究 Study of ban lan gen herb distinguishing (in Chinese)南板蓝根，青黛（馬蓝） 　　　原文：Baphicacanthus cusia（Nees）Bremek（169页，207页）     　　補正：Strobilanthes cusia（Nees）O. Ktze.  　　　注解：《藥典》所載其學名為異名。出處﹕《中華人民共和國藥典》1995年版一部藥材部分内容補正 沈保安（安徽省蕪湖市藥品 檢驗所 241001） Search this siteProblems with website? Please Click here for comment. (Not for inquiry )    Click here for inquiryCopyright Notice 按此看關於版權問題Sponsors' Ads by Google 以下為谷歌 所提供之廣告A manuscript... writing, translating and proofreading  in progress List of Health ProblemsQigong (chi kung)Toxicity of Some HerbsSide Effect of Some HerbsHerbs that can be toxic to kidneysTraditional Chinese Medicine TCM Diagnosis Samples of FormulaeTerms of Traditional Chinese MedicineAcupuncturecopy right 版權所有Qigong classesPrescribed Drug DictionaryEmail our web master for  your suggestion (not for inquiry)Biochemistry Dictionary Qigong classes Research Librarian  HomeWeather ReportDisclaimerLast update: June 27, 2014; 3 p.m. LAH   \n",
        "original_url": "http://alternativehealing.org/ban_lan_gen.htm"
    },
    {
        "Names": {
            "Name": [
                "yu yu liang",
                "禹餘粮"
            ],
            "Pharmaceutical": [
                "Limonite"
            ],
            "Chemical": [
                "2Fe2O3.3H2O"
            ],
            "Common": [
                "limonite",
                "limonitum"
            ],
            "Other": [
                "yu liang shi 禹粮石"
            ],
            "Pronunciation in Korean": [
                "uryangsok"
            ],
            "Pronunciation in Japanese": [
                "uyoryo"
            ],
            "Pronunciation in Cantonese": [
                "jyu5 jyu4 loeng4"
            ],
            "Pinyin Pronunciation": []
        },
        "Type": "Mineral",
        "Geography": [
            "Widely distributed. Produced in Henan, Jiangsu, Zhejiang, Sichuan provinces."
        ],
        "Properties": [
            "sweet",
            "acrid",
            "slightly cold"
        ],
        "Meridians": [
            "spleen",
            "stomach",
            "large intestine"
        ],
        "Maladies Treated": [
            "chronic diarrhea",
            "bleeding not during menses",
            "vaginal discharge (red, white, or yellow, chronic, causing emaciation and weakness, lack of appetite, potentially leading to infertility)",
            "hemorrhoids",
            "hemorrhoids accompanied by bleeding or pus"
        ],
        "Medical Function": [
            "Used for treating chronic diarrhea, bleeding outside menstruation periods, vaginal discharge, hemorrhoids and hemorrhoids accompanied by bleeding or pus."
        ],
        "Dosage": "Taking orally, in decoction: 9 to 15 g. or mix into pill or powder. External application: use appropriate amount in powder form or make into paste.",
        "Samples of Formulae": "For chronic vaginal discharge (red, white, or yellow), emaciation and weakness, lack of appetite which may lead to infertility: Prescription: mo li (oyster shell), fu long gan (terra flava usta), chi shi zhi (halloysite), bai long gu (white fossil bone), gui xin (cinnamon bark), wu ze gu (cuttlefish bone), yu yu liang (limonite), each ingredient in equal amount. Make into powder. Take 2 grams each time with rice wine on an empty stomach twice a day. If discharge is predominantly white, increase the amount of mo li (oyster shell), long gu (fossil bone), wu ze gu (cuttlefish bone). If predominantly red, increase the amount of chi shi zhi (halloysite), yu yu liang (limonite). If predominantly yellow, increase amount of fu long gan (terra flava usta), gui xin (cinnamon bark). Adjust formula according to syndrome. (source: Qian Jin Fang 《千金方》)",
        "Contraindications": "Use care in case of pregnancy.",
        "Research": "",
        "Notes": "",
        "Chemical Ingredients": [
            "The mineral yu yu liang contains sand and gravels, organic matter. It contains approximately 20 to 78% 2Fe2O3.3H2O.",
            "Often contains large amounts of phosphate.",
            "Those sold in the Qingdao city marketplace mainly contain Fe2O3 and also contain Al, Mg, K, Na, PO4."
        ],
        "References": [
            "Qian Jin Fang 《千金方》"
        ],
        "Further Reading": [],
        "Original Text": "yu yu liang, Complementary and Alternative Healing University, 現代中藥辭典Complementary and Alternative Healing University  Home  現 代中藥辭典Search this site       Search this siteList of Health ProblemsChinese Herb DictionaryQigongTraditional Chinese Medicine (TCM)AcupuncturePrescribed Drug DictionaryBiochemistry DictionaryLecture SlidesResearch LibrarianGeneral Online LibrarySearchResearch SitesViagraMassage/AcupressureHypnotherapyTell us what you wantNotify Changes & New InformationLast update: Sept 5; 2010;  9:40 p.m. LAHyu yu liang 禹餘粮  by: Joe Hing Kwok Chu     朱興國編 譯     (in English and Chinese 中英文)Pharmaceutical name:英文藥名﹕LimoniteChemical formula:化學程式﹕2Fe2O3.3H2OPron. in Japanese:日語發音﹕uyoryoPron. in Korean:韓語發音﹕uryangsokPron. in Cantonese::粵音﹕jyu5 jyu4 loeng4Other Names:別名﹕yu liang shi 禹粮石Common Name:英文名﹕limonite, limonitumDistribution:產地﹕Widely distributed. Produced in Henan, Jiangsu, Zhejiang, Sichuan provinces.分佈很廣。產河南、江蘇、浙江、四川等地Properties(characteristics)﹕性味﹕sweet, acrid, slightly cold甘，澀，微寒Channels (meridians) entered:　歸經﹕spleen, stomach, large intestine.脾，胃，大腸。Medical functions:藥理﹕　　Actions & Indications:主治﹕being used in treatment of chronic diarrhea, bleeding not during menses, vagina discharge, hemorrhoids and hemorrhoids with bleeding or with pus.治久瀉久痢，婦人崩漏帶下，痔漏。Chemical ingredients:化學成份﹕The mineral contains sand and gravels, organic matter. It contains about 20 to 78% of 2Fe2O3.3H2O. Often it contain large amount of phosphate. Those sold in the market place of Qingdao city, also contain Al，Mg，K，Na，PO4. 但因夾雜砂石、有機物等，含20∼78％之2Fe2O3.3H2O。常含多量的磷酸鹽。青島市售的禹余糧，主要成分為Fe203，又含Al，Mg，K，Na，PO4等。Daly Dosage:每日用量﹕Taking orally, in decoction: 9 to 15 g. or mix into pill or powder.External application: use appropriate amount in powder form or make into paste.內服：煎湯，3∼5錢；或入丸、散。外用：研末撒或調敷。Samples of formulae:處方舉例﹕For chronic vagina red, white, or yellow discharge, emaciating  and weak, lack of appetite. This may cause infertility.Prescription: mo li, fu long gan, chi shi zhi, bai long gu, gui xin, wu ze gu, yu yu liang of equal amount. Make into powder. Take 2 grams each time with rice wine during empty stomach, twice a day.  If the discharge consists of more white substance increase the amount of mo li, long gu, wu ze gu. If the discharge consists of more red substance, add more chi shi zhi, yu yu liang. If the discharge consists of more yellow substance, add more fu long gan, gui xin. Adjust the formula according to the syndrome.《source:Qian Jin Fang  》 治女人漏下，或瘥或劇，常漏不止，身體羸瘦，飲食減少，或赤或白或黃，使人無子者：牡蠣、伏龍肝、赤石脂、白龍骨、桂心、烏賊骨、禹余糧各等分。上七味，治下篩。空心酒服方寸匕，日服二次。白多者加牡蠣、龍骨、烏賊骨，赤多者加赤石脂、禹余糧，黃多者加伏龍肝、桂心，隨病加之。《方源：千金方  》  Modern Research:現代研究﹕　Toxicity & Cautions:毒素與禁忌﹕Use care in case of pregnancy.孕婦慎用　Sponsors' Ads by Google 以下為谷歌所提供贊助者之廣告  　Copyright Notice 按此看關於版權問題A manuscript... writing, translating and proofreading  in progress　Click here for inquiry  List of Health ProblemsChinese Herb DictionaryToxicity of Some HerbsSide Effect of Some HerbsHerbs that can be toxic to kidneysTraditional Chinese MedicineTCM DiagnosisSamples of FormulaeAcupuncturecopy right　版權所有Qigong (chi kung)Prescribed Drug DictionaryEmail our web master for  your suggestion (not for inquiry)Biochemistry DictionaryGeneral Online LibraryQigong classesFake Email WarningResearch LibrarianSearchQigong classesHomeWeather Report    Disclaimer  ",
        "original_url": "http://alternativehealing.org/yu_yu_liang.htm"
    }
]