[
    {
        "Names": {
            "Name": [
                "hai dai",
                "kun bu",
                "kelp"
            ],
            "Pharmaceutical": [
                "Thallus Laminariae"
            ],
            "Biological": [
                "Laminaria japonica Arsch."
            ],
            "Chemical": [],
            "Common": [
                "kelp"
            ],
            "Other name": [
                "hai dai 海帶",
                "qun dai cai 裙帶菜",
                "jiang bai cai 江白菜",
                "kun bu 昆布"
            ],
            "Chinese": [
                "海帶",
                "昆布"
            ],
            "Pronunciation in Korean": [
                "kompo"
            ],
            "Pronunciation in Japanese": [
                "konbu"
            ],
            "Pronunciation in Cantonese": [
                "hoi2 daai3",
                "kwan1 bou3"
            ],
            "Pinyin Pronunciation": []
        },
        "Type": "Herb",
        "Geography": [
            "Liaoning (遼寧)",
            "Shandong (山東)",
            "Fujian (福建)"
        ],
        "Properties": [
            "salty",
            "cold"
        ],
        "Meridians": [
            "liver",
            "kidney"
        ],
        "Maladies Treated": [
            "tumor of the thyroids (癭瘤, including adenoma and nodular goiter)",
            "tumor of the lymph glands (瘰疬, swollen lymph nodes)",
            "swollen testes (睪丸腫痛)",
            "edema (痰飲水腫)"
        ],
        "Medical Function": [
            ""
        ],
        "Dosage": "10-15 g (10 ～ 15 克)",
        "Samples of Formulae": "For treatment of tumor of thyroids: use kun bu (10 g), hai zao (Sargassum, 10 g), tu bei mu (Fritillaria thunbergii bulb, 10 g), tian kui zi (Echinocystis lobata seed, 10 g), dang gui (Chinese angelica root, 6 g), chuan xiong (Ligusticum wallichii rhizome, 6 g), wu yao (Lindera root, 6 g), ba ye za (Aralia elata root bark, 9 g), xuan shen (Scrophularia root, 12 g), hai fu shi (Pumice, 12 g). Boil with water. One package a day.",
        "Contraindications": "Use with care in cases of yangxu (yang deficient). (陽虛者慎服)",
        "Research": "",
        "Notes": "",
        "Chemical Ingredients": {
            "": [
                "algin (藻膠素)",
                "mannitol (甘露醇)",
                "galactan (半乳聚糖)",
                "laminine (海帶氨酸)",
                "laminarin (海帶聚糖)",
                "glutamic acid (谷氨酸)",
                "aspartic acid (天冬氨酸)",
                "proline (脯氨酸)",
                "vitamin B1",
                "vitamin C",
                "vitamin P",
                "sulphur (硫磺)",
                "potassium (鉀)"
            ]
        },
        "References": [],
        "Further Reading": [],
        "Original Text": "kun bu, kelp ,Complementary and Alternative Healing UniversityComplementary and Alternative Healing University  Home  現代 中藥辭典Search this siteList of Health ProblemsChinese Herb DictionaryQigongTraditional Chinese Medicine (TCM)AcupuncturePrescribed Drug DictionaryBiochemistry DictionaryLecture SlidesResearch LibrarianGeneral Online LibrarySearchResearch SitesViagraMassage/AcupressureHypnotherapyTell us what you wantNotify Changes & New Information　　　    　              　　     hai dai 海帶， kun bu 昆布(kelp)by: Joe Hing kwok ChuPharmaceutical name:英文藥名﹕Thallus LaminariaeBotanical name:學名﹕Laminaria japonica Arsch.Pron. in Japanese:日語發音﹕konbuPron. in Korean:韓語發音﹕kompoPron. in Cantonese:粵音﹕hoi2 daai3;kwan1 bou3Other Names:別名 ﹕qun dai cai 裙帶菜, jiang bai cai 江白菜. hai dai 海帶，kun bu 昆布。Common Name:英文名﹕kelpDistribution:產地﹕Liaoning, Shandong, Fujian遼寧，山東，福建。Properties(characteristics)﹕性味﹕salty, cold.鹹，寒。Channels (meridians) entered: 歸經﹕liver, kidney.歸肝、腎經。Medical functions:藥理﹕  Actions & Indications:主治﹕being used in tumor of the thyroids, tumor of the lymph glands,  swollen testes, edema.用於癭瘤(甲狀腺腺瘤、結節性甲狀腺腫)，瘰疬 （淋巴結腫大），睪丸腫痛，痰飲水腫。Chemical ingredients:化學成份﹕含藻膠素（algin），甘露醇（mannitol） ，半乳聚糖（galactan），海帶氨酸（laminine），海帶聚糖（laminarin），谷氨酸 （glutamic acid)，天 冬氨酸 (aspartic acid)，脯氨酸(proline)，維生素B1, C, P (viatimin B1, C, P)  硫磺 (sulphur)，鉀(potassium)等 etc.Dosage:用 量﹕10-15 g.10 ～ 15 克。Samples of formulae:處方 舉例﹕For treatment of tumor of thyroids: kun bu 10 g, hai zao, tu bei mu  10 g, tian kui zi 10 g, dang gui 6 g, chuan xiong 6 g, wu yao 6 g, ba ye za 9 g, xuan shen 12 g, hai fu shi 12 g.  Boil with water. One package a day.治甲狀腺腺瘤，用昆布10克，海藻10克，土貝母10克，天葵子10克，全當歸 6克，川芎 6克 ，烏藥 6克，八月扎 9克，玄參12克，海浮石12克，用水煎服，每日一劑。Modern Research:現代研究﹕ Toxicity & Cautions:毒素與禁忌﹕Use with care in cases of yangxu (yang deficient).陽虛者慎服。　 Sponsors' Ads by Google 以下為谷歌所提供贊助者之廣告A manuscript... writing, translating and proofreading  in progress Click here for inquiry  List of Health ProblemsChinese Herb DictionaryToxicity of Some HerbsSide Effect of Some HerbsHerbs that can be toxic to kidneysTraditional Chinese MedicineTCM DiagnosisSamples of FormulaeAcupuncturecopy right 版權所 有Qigong (chi kung)Prescribed Drug DictionaryEmail our web master for  your suggestion (not for inquiry)Biochemistry DictionaryGeneral Online LibraryQigong classesLecture SlidesResearch LibrarianSearchQigong classesHomeWeather Report DisclaimerLast update: Sept 29, 2009; 5:11 p.m. LAHSearch this site         ",
        "original_url": "http://alternativehealing.org/kun_bu.htm"
    },
    {
        "Names": {
            "Name": [
                "wan nian hao",
                "萬年蒿"
            ],
            "Pharmaceutical": [
                "Herba Artemisiae"
            ],
            "Biological": [
                "Artemisia sacrorum Ledeb"
            ],
            "Chemical": [],
            "Common": [],
            "Other name": [
                "wan nian hao (by Chinese Medical Journal)",
                "yin chen hao (in Heilongjiang province)",
                "bai lian hao (in Jiangsu province)",
                "tie gan hao (in Beijing)"
            ],
            "Chinese": [
                "萬年蒿",
                "茵陳蒿 (黑龍江)",
                "白蓮蒿 (江蘇)",
                "鐵桿蒿 (北京)"
            ],
            "Pronunciation in Korean": [
                "deo-wi-ji-gi"
            ],
            "Pronunciation in Japanese": [
                "iwayomogi"
            ],
            "Pronunciation in Cantonese": [
                "maan6 nin4 hou1"
            ],
            "Pinyin Pronunciation": []
        },
        "Type": "Herb",
        "Geography": [
            "Except cold and high altitude areas, it almost can be found in all China",
            "Japan",
            "Korea",
            "Mongolia",
            "Afghanistan",
            "India",
            "Pakistan",
            "Nepal",
            "Russia",
            "Kashmir"
        ],
        "Properties": [
            "bitter",
            "acrid",
            "neutral"
        ],
        "Meridians": [],
        "Maladies Treated": [
            "Hepatitis",
            "Appendicitis",
            "Children epilepsy",
            "Yinxu with hot flashes",
            "Injuries and bleeding (external use)"
        ],
        "Medical Function": [
            "Clears heat and toxin, cools blood and stops pain"
        ],
        "Dosage": "Taking orally: 9 to 12 g. External application: use appropriate amount. Use fresh or dry herb. Smash or grind into powder and apply to affected area.",
        "Samples of Formulae": "",
        "Contraindications": "",
        "Research": "",
        "Notes": "",
        "Chemical Ingredients": {},
        "References": [],
        "Further Reading": [],
        "Original Text": "\n\n\nwan nian hao, Complementary and Alternative Healing University\n\n\n\n\n\n\n\n\n\n\n\nComplementary and Alternative Healing University \n        Home \n\n現代中藥辭典\n\n\n\n\n\n\n\n\n\n\n\n\n\n\n\nSearch this site\n\n\n\n\n\n\nList of Health Problems\n\n\n\n\n\n\nChinese Herb Dictionary\n\n\n\n\n\nQigong\n\n\n\n\n\n\nTraditional Chinese Medicine \n            (TCM)\n\n\n\n\n\n\nAcupuncture\n\n\n\n\n\n\nPrescribed Drug Dictionary\n\n\n\n\n\nBiochemistry Dictionary\n\n\n\n\n\nLecture \n            Slides\n\n\n\n\n\nResearch Librarian\n\n\n\n\n\n\nGeneral Online Library\n\n\n\n\n\n\nSearch\n\n\n\n\n\n\nResearch Sites\n\n\n\n\n\n\nViagra\n\n\n\n\n\n\nMassage/Acupressure\n\n\n\n\n\n\nHypnotherapy\n\n\n\n\n\nTell us \n            what you want\n\n\n\n\n\n\nNotify Changes & New Information\n\n\n\n\n　\n　\n　\n \n \n \n \n　\n \n \n \n \n \n \n　\n　\n \n \n \n \n　\n　\n　\n　\n　\n \n \n \n \n \n \n \n \n\n\n\n\n\n\n\n\n\n\n\n\n\n \n\n        wan nian hao \n\n        \n        萬年蒿\n\n\nby: Joe Hing kwok Chu\n\n\n\nPharmaceutical name:\n英文藥名﹕\n\nHerba Artemisiae\n\n\n\nBotanical name:\n學名﹕\n\n\nArtemisia sacrorum Ledeb \n\n\n\nPron. in Japanese:\n日語發音﹕\n\n\n            iwayomogi\n\n\n\nPron. in Korean:\n韓語發音﹕\n\n\n            deo-wi-ji-gi \n\n\n\nPron. in Cantonese::\n粵音﹕\n\nmaan6 nin4 hou1\n\n\n\nOther Names:\n別名﹕\n\n\n\n\nwan nian hao (by Chinese Medical Journal)\n\n萬年蒿(中藥誌)\n\n\nyin chen hao (in Heilongjiang province)\n\n茵陳蒿 (黑龍江)\n\n\nbai lian hao (in Jiangsu province)\n\n白蓮蒿 (江蘇)\n\n\ntie gan hao (in Beijing)\n\n鐵桿蒿 (北京)\n\n\n\n\n\n\nCommon Name:\n英文名﹕\n\n\n         \n\n\n\nDistribution:\n產地﹕\n\n\n        Except cold and high altitude areas, it almost can be found in all \n        China. Also it is distributed in Japan, Korea, Mongolia, Afghanistan, \n        India, Pakistan, Nepal, Russia, Kashmir etc.\n除高寒地區外，幾遍布全中國；日本，朝鮮，蒙古，阿富汗，印度，巴基斯坦，尼泊爾，俄羅斯，克什米爾地區也有。\n\n\n\nProperties\n(characteristics)﹕\n性味﹕\n\n\n        bitter, acrid, neutral.\n苦，辛，平。\n\n\n\nChannels (meridians) entered:\n \n歸經﹕\n\n\n\n\nMedical functions:\n藥理﹕\n \n\n \n\n\n\nActions & \n            Indications:\n主治﹕\n\n\n        Being used in hepatitis, appendicitis, children epilepsy, yinxu with hot \n        flashes. External use in injuries and bleeding.\n清熱解毒，涼血止痛。用於肝炎，闌尾炎，小兒驚風，陰虛潮熱；外用治創傷出血。\n\n\n\nChemical ingredients:\n化學成份﹕\n\n\n         \n\n\n\nDosage:\n用量﹕\n\nTaking orally: 9 to 12 g. \n            External application: use appropriate amount. Use fresh or dry \n            herb. Smash or grind into powder and apply to affected area.\n内服： \n            9 ～ 12 克。外用適量，鮮品搗爛敷或乾品研粉撒患處。\n\n\n\nSamples of formulae\n:處方舉例﹕\n\n \n\n\n\nModern Research:\n現代研究﹕\n\n \n\n\n\n\nToxicity & \n            Cautions:\n\n毒素與禁忌﹕\n\n\n\n\n\n　【摘錄】《全國中草藥匯編》\n\n        Sponsors' Ads by Google 以下為谷歌所提供贊助者之廣告\n\n\n \n \n\n\n\n\n\n\n\nA manuscript... writing, translating and proofreading  \n            in progress\n\nProblems with website? Please \nClick here for \n            comment. (Not for inquiry )      \n            \n\n\nClick here for inquiry\n \n\n             \n\n             \n\nCopyright Notice 按此看關於\n            版權問題\n\n\n\n\n\nList of Health Problems\n\n\n\nChinese Herb Dictionary\n\n\n\n\nToxicity of Some Herbs \n                \n\n\nSide Effect of Some Herbs \n                \n\n\nHerbs that can be toxic to kidneys\n\n\n\n\nTraditional Chinese Medicine\n\n\nTCM Diagnosis\n\nSamples \n                of Formulae\n\n\n\nTerms \n                of Traditional Chinese Medicine\n\n\nAcupuncture\n\n\n\n\n\ncopy right\n \n\n版權所有\n\n\n\nQigong \n                (chi kung)\n\n\n\nPrescribed Drug Dictionary\n\n\n\nEmail our web master for  \n                your suggestion (not for inquiry)\n\n\n\nBiochemistry Dictionary\n\n\n\n\n\nGeneral Online Library\n\n\n\n\nQigong classes\n\n\n\nLecture Slides\n\n\n\nResearch Librarian\n\n\n\n\nSearch\n\n\n\n\n\nQigong classes \n\n\n\n\n\n\n\nHome\n\n\n\nWeather Report\n\n\n\n                 Disclaimer\n\n\n\n\n\n\n\nLast update: Mar 20, 2009,  \n            11:37\n            a.m. LAH\n\n\n\n　\n\n\n\n\n\n\n\nSearch \n                this site \n\n\n\n\n\n\n\n\n\n\n\n\n\n\n\n\n\n\n\n\n\n\n\n\n\n\n\n",
        "original_url": "http://alternativehealing.org/tie_gan_hao.htm"
    },
    {
        "Names": {
            "Name": [
                "ju hong"
            ],
            "Pharmaceutical": [
                "Exocarpium citrl maximae",
                "Exocarpium citrl Grandis"
            ],
            "Biological": [
                "Citrus maxima (Burm.) Merr. cv. Tomentosa",
                "Citrus grandis (L.) Osbeck",
                "Citrus grandis var. Tomentosa Hort."
            ],
            "Common": [
                "pamelo skin"
            ],
            "Other name": [
                "you pi ju hong 柚皮橘紅",
                "Hua ju hong 化橘紅",
                "Hua Zhou ju hong 化州橘紅",
                "you zi pi 柚子皮"
            ],
            "Chinese": [
                "橘紅"
            ],
            "Pronunciation in Korean": [
                "gyulhong"
            ],
            "Pronunciation in Japanese": [
                "kikko"
            ],
            "Pronunciation in Cantonese": [
                "gwat1 hung4"
            ],
            "Pinyin Pronunciation": []
        },
        "Type": "Herb",
        "Geography": [
            "Produced in Hua Zhou, Mao Ming districts of Guangdong province; Bo Bai, Lu Chuan districts of Guangxi; Qian Yang district of Hunan, China"
        ],
        "Properties": [
            "acrid",
            "bitter",
            "warm"
        ],
        "Meridians": [
            "stomach",
            "spleen"
        ],
        "Maladies Treated": [
            "Wind cold type of cold and cough",
            "Itchy throat with abundance of phlegm",
            "Indigestion and over eating",
            "Over consumption of alcohol",
            "Chronic stomachache",
            "Flatulence",
            "Burping bad smell and tightness in stomach",
            "Chronic bronchitis",
            "Asthma",
            "Food accumulation",
            "Nausea and feeling of oppression in the chest",
            "Long term stomach pain",
            "Qi pain"
        ],
        "Medical Function": [
            "Clears cold by expressing exterior, descends qi and resolves phlegm",
            "Promotes descending movement of qi and resolves phlegm while clearing cold on the surface"
        ],
        "Dosage": "5 ~ 10 g",
        "Samples of Formulae": "Sheng tie luo yin (生鐵落飲)",
        "Contraindications": "Do not use in cases of hot phlegm with qi deficiency (qixu) and/or yin deficiency (yinxu) condition.",
        "Research": "According to the official record of the district of Hua Zhou of Guangdong province, the herb ju hong produced there is especially effective because the soil contains meng shi (Lapis Micae seu Chloriti) which possesses the effect of arresting cough. Ju hong that grows there absorbs the mineral, thus is good for treating cough.",
        "Notes": "",
        "Chemical Ingredients": {
            "fruit": [
                "naringin",
                "naringenin"
            ],
            "peel": [
                "citral",
                "geraniol",
                "linalool",
                "anthranilic acid",
                "methyl ester"
            ]
        },
        "References": [],
        "Further Reading": [],
        "Original Text": "ju hong,Complementary and Alternative Healing UniversityComplementary and Alternative Healing University   中藥詞典                 Chinese Herb Dictionary      Search this site     在本網站找資料Search this siteList of Health ProblemsChinese Herb DictionaryQigongTraditional Chinese Medicine (TCM)AcupuncturePrescribed Drug DictionaryBiochemistry DictionaryLecture SlidesResearch LibrarianGeneral Online LibraryResearch SitesViagraMassage/AcupressureHypnotherapyTell us what you wantNotify Changes & New Information  ju hong 橘紅by: Joe Hing Kwok ChuPharmaceutical name:英文藥名﹕Exocarpium citrl maximaeExocarpium citrl GrandisBotanical name:學名﹕Citrus maxima (Burm.) Merr. cv. TomentosaCitrus grandis (L.) OsbeckCitrus grandis var. Tomentosa Hort.Pron. in Japanese:日語發音 ﹕kikkoPron. in Korean:韓語發音 ﹕gyulhongPron. in Cantonese:粵音﹕gwat1 hung4Other Names:別名﹕you pi ju hong 柚皮橘紅，Hua ju hong 化橘紅，Hua Zhou ju hong 化州橘紅，you zi pi 柚子皮。Common Name:英文名﹕pamelo skinDistribution:產地﹕The herb is produced in Hua Zhou, Mao Ming districts of Guangdong province and Bo Bai, Lu Chuan districts of Guangxi, Qian Yang district of Hunan or China.產廣東（化州，茂名），廣西（博白，陸川等），湖南（黔陽）。Properties(characteristics)﹕性味﹕acrid, bitter, warm.溫，味辛，苦。Channels (meridians) entered: 歸經﹕stomach, spleen.胃，脾。Medical functions:藥理﹕  Actions & Indications:主治﹕Being used in wind cold type of cold and cough, itchy throat with abundance of phlegm, indigestion and over eating, over consumption of alcohol, chronic stomachache, flatulence, burping bad smell and tightness in stomach功能下氣消痰兼除寒發表。用於風寒咳嗽, 喉痒痰多, 食積傷酒, 哎惡痞悶，慢性氣管炎，哮喘，飲食積滯，食積傷酒，嘔惡痞悶， 長期胃痛，氣痛等。Chemical ingredients:化學成份﹕fruit contains naringin, naringenin. Peel contians citral, geraniol, linalool, anthranilic acid), methyl ester.果實含柚皮甙（naringin）、柚皮甙元（naringenin） ；果皮含枸櫞醛（citral）、香葉醇（geraniol）、芳樟醇（linalool）、磷氨基苯甲酸 (anthranilic acid),甲 酯 (methyl ester ）等Dosage:用量﹕5 ~ 10 gSamples of formulae:處方舉例﹕sheng tie luo yin 生鐵落飲,Modern Research:現代研究﹕ Toxicity & Cautions:毒素與禁忌﹕Do not use in cases hot phlegm with qixu (qi deficient)  and/or  yinxu (yin deficient) condition.氣虛及 陰虛有燥痰者不宜服。　According to the official record of the district of Hua Zhou of Guangdong province. The herb ju hong produced there is especially effective because in the area the soil contains meng shi (Lapis Micae seu Chloriti) which possesses the effect of arresting cough. Ju hong that grows there absorbs the mineral thus is good for treating cough.據《化州縣志》載：化州鎮賴家園所產的橘紅，稱為正品化州橘紅，藥效特別好，主要原因是該地蘊藏著礞 石(礞石具有化痰止咳作用)，土層深厚，橘紅生長吸收了土壤裡礞石所致。ch this siteProblems with website? Please Click here for comment. (Not for inquiry )    Click here for inquiryCopyright Notice 按此看關於版權問題A manuscript... writing, translating and proofreading  in progressSponsors' Ads by Google 以下為谷歌 所提供之廣告 List of Health ProblemsChinese Herb DictionaryToxicity of Some HerbsSide Effect of Some HerbsHerbs that can be toxic to kidneysTraditional Chinese Medicine TCM Diagnosis Samples of FormulaeTerms of Traditional Chinese MedicineAcupuncturecopy right 版權所有Qigong (chi kung)Prescribed Drug DictionaryEmail our web master for  your suggestion (not for inquiry)Biochemistry DictionaryGeneral Online LibraryQigong classesFake Email WarningResearch LibrarianSearchQigong classesHomeWeather ReportDisclaimerLast update: Dec 29, 2013; 11:30 p.m. LAH   ",
        "original_url": "http://alternativehealing.org/ju_hong.htm"
    },
    {
        "Names": {
            "Name": [
                "wu zhi mao tao gen"
            ],
            "Pharmaceutical": [
                "Radix Fici simplicissimae"
            ],
            "Biological": [
                "Ficus hirta Vahl",
                "Ficus simplicissima Lour.var.hira (Vahl) Migo",
                "Ficus hibiscifolia Champ.ex Benth. (粗葉榕)"
            ],
            "Common": [
                "hairy fig",
                "fairy mountain fig"
            ],
            "Chinese": [
                "五指毛桃根",
                "五指牛奶",
                "火龍葉",
                "土黄芪",
                "土五加皮",
                "五爪龍",
                "野枇杷",
                "母猪奶",
                "南芪",
                "佛掌榕",
                "粗葉榕"
            ],
            "Other name": [
                "wu zhi niu nao (five finger breast of cow)",
                "huo long ye (fire dragon leaf)",
                "tu huang qi (local astralagus root)",
                "tu wu jia pi (local acanthopanax root bark)",
                "wu zhao long (five finger dragon)",
                "ye pi pa (wild loquat)",
                "mu zhu nao (female pig's breasts)",
                "nan qi (southern acanthopanax root bark)",
                "fo zhang rong (Buddha's finger ficus)",
                "cu ye rong (coarse leaf ficus)"
            ],
            "Pronunciation in Korean": [],
            "Pronunciation in Japanese": [
                "go so ryu (五爪龍)"
            ],
            "Pronunciation in Cantonese": [
                "ng5 zaau2 lung4 (五爪龍)"
            ],
            "Pinyin Pronunciation": []
        },
        "Type": "Herb",
        "Geography": [
            "Fujian province (China)",
            "Guangdong province (China)",
            "Hainan province (China)",
            "Guangxi province (China)",
            "Guizhou province (China)",
            "Yunnan province (China)",
            "Bhutan",
            "Northeastern India",
            "Nepal",
            "Malaysia",
            "Indonesian islands of Java and Sumatra",
            "Myanmar",
            "Thailand",
            "Vietnam"
        ],
        "Properties": [
            "acrid",
            "sweet",
            "warm"
        ],
        "Meridians": [
            "Spleen",
            "Lung",
            "Liver"
        ],
        "Maladies Treated": [
            "Cirrhosis and ascites",
            "Chronic hepatitis",
            "Liver and spleen ache",
            "Spleen deficient with edema",
            "Lack of appetite with no energy",
            "Rheumatoid arthritis",
            "Tuberculosis with cough",
            "Chronic bronchitis",
            "Night sweating",
            "Weakness after the illnesses",
            "Postpartum lack of mother's milk",
            "Leucorrhea",
            "Stomach pain",
            "Chest pain",
            "Acute cellulitis",
            "Acute suppurative osteomyelitis",
            "Mumps",
            "Superficial phlebitis",
            "Erythema nodosum"
        ],
        "Medical Function": [
            "Arresting cough",
            "Antibiotic",
            "Anti-virus",
            "Anti blood coagulation",
            "Anti-tumor",
            "Regulate immune system: this herb can improve the immune system weakened by cyclophosphamide (Cytoxan®, Neosar®, Procytox®)"
        ],
        "Dosage": "For decoction: 4.5–9 g (4.5 g to 9 g) daily.",
        "Samples of Formulae": "Lack of mother's milk after birth: wu zhi mao tao gen (五指牛奶, five finger breast of cow) 60 g. Make stew with pig feet. Use with meals. [2]\n\nLeucorrhea: wu zhi mao tao gen (五指牛奶, five finger breast of cow) 30 g, bai he teng (白鹤藤, white crane vine) 60 g. Boil with water and use as tea. [2]",
        "Contraindications": "",
        "Research": "",
        "Notes": "\"Booklet on Commonly Used Herbs\" by Guangzhou airforce. \"Booklet on Commonly Used Herbs\" by Guangzhou armforces.",
        "Chemical Ingredients": {
            "": [
                "diisobutyl phthalate",
                "amino acid",
                "saccharides",
                "β-sitosterol",
                "coumarin",
                "psoralen",
                "bergapten"
            ]
        },
        "References": [
            "[1] http://www.efloras.org/florataxon.aspx?flora_id=2&taxon_id=242322269 (Missouri Botanical Garden)",
            "[2] \"Guangxi Zhong Cai Yao\" 《廣西中草藥》"
        ],
        "Further Reading": [],
        "Original Text": "wu zhi mao tao, Complementary and Alternative Healing UniversityComplementary and Alternative Healing University  Home 現代中藥辭典Search this siteList of Health ProblemsChinese Herb DictionaryQigongTraditional Chinese Medicine (TCM)AcupuncturePrescribed Drug DictionaryBiochemistry DictionaryLecture SlidesResearch LibrarianGeneral Online LibrarySearchResearch SitesViagraMassage/AcupressureHypnotherapyTell us what you wantNotify Changes & New Information　　 To post your discussion click here.　    　      　　    　　　　　                        Last update: Mar 31, 2011 11:09 a.m. LAH  w� zhǐ m嫪 t嫪 gen 五指毛桃根Translated by: Joe Hing kwok Chu    朱興國編 譯     (in English and Chinese 中英文)Pharmaceutical name:英文藥名﹕Radix Fici simplicissimaeBotanical name:拉丁生物學名﹕Ficus hirta VahlFicus simplicissima Lour.var.hira (Vahl) MigoFicus  hibiscifolia Champ.ex Benth. (粗葉榕)Pron. in Japanese:日語發音﹕go so ryu (五爪龍)Pron. in Korean:韓語發音﹕ Pron. in Cantonese::粵音﹕ng5 zaau2 lung4  (五爪龍)Other Names:別名﹕wu zhi niu nao (five finger breast of cow)五 指牛奶huo long ye (fire dragon leaf)火龍葉tu huang qi (local astralagus root)土黄芪tu wu jia pi (local acanthopanax root bark)土五加皮wu zhao long (five finger dragon)五爪龍ye pi pa (wild loquat)野枇杷mu zhu nao (female pig's breasts)母猪奶nan qi (southern acanthopanax root bark)南芪fo zhang rong (Buddha's finger ficus)佛掌榕cu ye rong (coarse leaf ficus)粗葉榕 （Ficus  hibiscifolia Champ.ex Benth. )[1]Common Name:英文名﹕hairy fig, fairy mountain figDistribution:產地﹕Fujian, Guangdong, Hainan, Guangxi, Guizhou, Yunnan provinces of China; also in Bhutan, N. E. India, Nepal, Malaysia, Indonesian islands of Java and Sumatra, Myanmar, Thailand, Vietnam.福建，廣東，海南，廣西，貴州，雲南等地。馬來西亞，不丹，印度 之東北部，泰國，越南也有。Properties(characteristics)﹕性味﹕acrid, sweet, warm.辛，甘，温。Channels (meridians) entered: 歸經﹕spleen, lung, liver.脾，肺，肝。Medical functions:藥理﹕ arresting cough antibiotic anti-virus anti blood coagulation anti-tumor regulate immune system: this herb can improve the immune system weakened by cyclophosphamide (Cytoxan�, Neosar�, Cytoxan�, Procytox�) 止咳 抗菌 抗病毒 抗凝血 抑制腫瘤 免疫調節Actions & Indications:主治﹕Cirrhosis and acites, chronic hepatitis, liver and spleen ache, spleen deficient with edema, lack of appetite with no energy, rheumatoid arthritis, tuberculosis with cough, chronic bronchitis, night sweating, weakness after the illnesses, postpartum lack of mother's milk, leucorrhea, stomach pain, chest pain, acute cellulitis, acute suppurative osteomyelitis, mumps, and superficial phlebitis, erythema nodosum. 治肝硬 化腹水，慢性肝炎，肝脾作痛， 脾虛浮腫，食少無力，風濕性關節炎，勞傷咳嗽，慢性支氣管炎，盜汗，病後體弱， 産後無乳，白帶，胃痛，胸痛，無名腫毒 如急性蜂窩組織炎， 急性化膿性骨髓炎，腮腺炎及淺靜脈炎，結節性紅斑。Chemical ingredients:化學成份﹕diisobutyl phthalate鄰苯二甲酸二異丁酯amino acid氨基酸saccharides糖類β-sitosterolβ-谷甾醇coumarin香豆精psoralen補骨脂素bergapten佛手柑內酯Daly Dosage:每日用量﹕For decoction: 4.5 g煎湯内服：4.5-9g。Samples of formulae:處方舉例﹕Lack of mother's milk after birth: wu zhi mao tao gen 60 g. Make stew with pig feet. Use with meals.[2]Leucorrhea: wu zhi mao tao gen 30 g, bai he teng 60 g. Boil with water and use as tea.[2]產後無乳：五指牛奶 (五指毛桃根) 2兩，燉豬腳服。(《廣西中草藥》) 白帶：五指牛奶 (五指毛桃根)1兩，一 匹綢 (白鹤藤) 2兩，水煎服。(《廣西中草藥》)Modern Research:現代研究﹕ Toxicity & Cautions:毒素與禁忌﹕[1] http://www.efloras.org/florataxon.aspx?flora_id=2&taxon_id=242322269 (Missouri Botanical Garden)[2] \"Guangxi Zhong Cai Yao\" 《廣西中草藥》Source:\"Booklet on Commonly Used Herbs\" by Guangzhou airforce.\"Booklet on Commonly Used Herbs\" by Guangzhou armforces.  参考：廣州空軍《常用中草藥手冊》。廣州部隊《常用中草藥手冊》 Sponsors' Ads by Google 以下為谷歌所提供贊助者之廣告   A manuscript... writing, translating and proofreading  in progressProblems with website? Please Click here for comment. (Not for inquiry ) Click here for inquiry   Copyright Notice 按此看關於 版權問題List of Health ProblemsChinese Herb DictionaryToxicity of Some HerbsSide Effect of Some HerbsHerbs that can be toxic to kidneysTraditional Chinese MedicineTCM DiagnosisSamples of FormulaeTerms of Traditional Chinese MedicineAcupuncturecopy right 版權所有Qigong (chi kung)Prescribed Drug DictionaryEmail our web master for  your suggestion (not for inquiry)Biochemistry DictionaryGeneral Online LibraryQigong classesLecture SlidesResearch LibrarianSearchQigong classesHomeWeather Report DisclaimerSearch this site          ",
        "original_url": "http://alternativehealing.org/wu_zhi_mao_tao.htm"
    },
    {
        "Names": {
            "Name": [
                "chuan lian zi",
                "Melia toosendan"
            ],
            "Pharmaceutical": [
                "Fructus Meliae Toosendan"
            ],
            "Biological": [
                "Melia azedarach L. sub. var. Toosendan Makino",
                "Melia toosendan Sieb. et Zucc."
            ],
            "Chemical": [],
            "Common": [
                "melia"
            ],
            "Other name": [
                "jin ling zi",
                "ku lian zi (bitter lian zi)",
                "ku lian pi (bitter lian bark)"
            ],
            "Chinese": [
                "川楝子",
                "苦楝子",
                "苦楝皮",
                "金鈴子"
            ],
            "Pronunciation in Korean": [
                "ch'onnyonja"
            ],
            "Pronunciation in Japanese": [
                "senrenshi"
            ],
            "Pronunciation in Cantonese": [
                "cyun1 lin6 zi2"
            ],
            "Pinyin Pronunciation": []
        },
        "Type": "Herb",
        "Geography": [
            "Gansu province, China",
            "Sichuan province, China",
            "Yunnan province, China",
            "Guizhou province, China",
            "Hubei province, China"
        ],
        "Properties": [
            "bitter",
            "cold",
            "slightly toxic"
        ],
        "Meridians": [
            "Bladder",
            "Liver",
            "Small Intestine",
            "Stomach"
        ],
        "Maladies Treated": [
            "dampness-heat",
            "liver fire",
            "pain",
            "heat syncope heart pain",
            "cooperative pain",
            "hernia pain",
            "parasite accumulation abdominal pain",
            "fungus infections of scalp (external use)",
            "stomach pain",
            "gastric ulcers",
            "inflammation of the stomach",
            "inflammation of the gall bladder",
            "round worms in the gall bladder and bile duct",
            "diarrhea",
            "mastitis",
            "mastic tumors",
            "chronic inflammation of pelvic area",
            "appendicitis",
            "contraction of testes into the cavities",
            "inflammation of the testes",
            "pain in the testes",
            "fungus of the scalp (external use)",
            "frost bites"
        ],
        "Medical Function": [
            "promotes qi flow",
            "clears liver fire",
            "regulates qi",
            "promotes urination",
            "kills parasites",
            "rids of pain",
            "used externally to inhibit fungi, such as Trichophyton, Candida albicans, Cryptococcosis",
            "toosendanin has anthelmintic effect (rids worms)",
            "inhibits pain",
            "used in combination with ye ju hua (wild chrysanthemum) for treatment of cirrhosis of the liver",
            "kulinone (melianone) inhibits pain",
            "antifungal action: inhibits Trichophyton, Candida albicans, Cryptococcosis"
        ],
        "Dosage": "3~9 g, smashed",
        "Samples of Formulae": "Ku lian pi (bitter lian bark) should be cooked longer than other herbs in the formula, because the active ingredients are more difficult to dissolve in water. When preparing decoction with other herbs, simmer ku lian pi first.",
        "Contraindications": "The effective dosage is very close to toxic dosage. Five or six pieces of fruit can cause death.\nChildren taking 0.3~0.4 g have experienced toxic reactions. 2~4 g has caused death.",
        "Research": "",
        "Notes": "Chuan lian zi means lian zi produced in Sichuan province of China. Li Shi Zhen mentioned that lian zi produced in Sichuan are the best. All lian zi sold in Chinese herb stores are called chuan lian zi. Ku lian zi literally means bitter lian zi.",
        "Chemical Ingredients": {
            "": [
                "tridecane",
                "toosendanin (also called chuanliansu)",
                "neoazedarachin A",
                "neoazedarachin B",
                "neoazedarachin D",
                "toosendansterol A (in leaves)",
                "toosendansterol B (in leaves)",
                "loliolide",
                "toosendanoside",
                "kulinone (melianone)",
                "kulactone",
                "kulolactone",
                "meliantriol",
                "β-Sitosterol",
                "isotoosendanin (isochuanliansu)",
                "21-O-methyltoosendapentol",
                "lipomelianol",
                "lipomelianyl 3-O-stearate",
                "palmitate",
                "myristate",
                "laurate",
                "21-O-acetyltoodendantriol",
                "meliaionoside A",
                "meliaionoside B"
            ]
        },
        "References": [],
        "Further Reading": [],
        "Original Text": "chuan lian zi, Melia toosendan, Complementary and Alternative Healing UniversityComplementary and Alternative Healing University   中藥詞典    Chinese Herb Dictionary      Search this site     在本網站找資料　chuan lian zi  川楝子 ku lian zi  苦 楝 子ku lian pi  苦 楝 皮　Edited by: Joe Hing Kwok Chu　　　Pharmaceutical name:英文藥名：Fructus Meliae ToosendanBiological name:拉丁学名：Melia azedarach L. sub. var. Toosendan MakinoMelia toosendan Sieb. et Zucc.Pron. in Japanese:日語發音：senrenshiPron. in Korean:韓語發音：ch'onnyonjaPron. in Cantonese: 粤語發音：cyun1  lin6  zi2Common Name:英文名：meliaOther Name:別名:jin ling zi, ku lian zi金鈴子，苦楝子。Distribution:分佈：Gansu, Sichuan, yunnan, Guizhou, Hubei provinces of China.甘肃，四川，雲南，貴州，湖北等省。Properties (characteristics):性味：bitter, cold slightly toxic苦，寒，有小毒。 　Channels (meridians) entered:歸經：bladder, liver, small intestine, stomach膀胱，肝，小腸，胃。Actions & Indications:功用主治:promote qi flow,  rid of dampness-heat, clear liver fire, rid of pain, promote urination, regulates qi, kills parasites.Also used externally for fungus infections of scalp.ku lian pi should be cooked longer than other herbs in the formula, because the active ingredients are more difficult to dissolve in water.除濕熱，清肝火，止痛，利小便，殺蟲。治熱厥心痛，協痛，疝痛，蟲積腹痛。 苦楝皮有效成分難溶於水所以與一般藥同入湯劑時，需先煎。Medical Functions:藥理：toosendanin can rid of wormsinhibits painchuan lian zi with ye ju hua for treatment of cirrhosis of the liverinhibits fungi, like Trichophyton, Candida albicans , Cryptococcosis　川楝素有驅蟲作用鎮痛作用川楝子加野菊花治肝硬化抗真菌作用：如白癬菌，白色念珠菌，新月形隱球菌Chemical ingredients:化學成份：tridecane正十三烷toosendanin苦楝素，(即川楝素)neoazedarachin A, B, D新楝皮素A, B, Dtoosendansterol A, B (in leaves)川楝子甾醇 A, B (葉中）loliolide黑麥草內酯toosendanoside川楝子甙kulinone (melianone)苦楝酮kulactone苦楝内酯kulolactone苦洛内酯meliantriol苦楝子三醇β-Sitosterolβ-穀 甾醇isotoosendanin (isochuanliansu)異苦楝素 (異川楝素)21-O-methyltoosendapentol21-O-甲基川楝子五醇lipomelianol脂苦楝子醇lipomelianyl 3-O-stearate脂川楝醇3-氧硬脂酸palmitate棕櫚酸鹽myristate荳蔻酸鹽laurate月桂酸鹽21-Oacetyltoodendantriol21-O-乙醯川楝子三醇 meliaionoside A,B苦楝子紫羅醇甙 A及BDosage:3~9 g, smashed3∼9 克，捣碎。Modern Application:現代應用：Modern Application:    現代應用：1. stomach pain 胃痛2. gastric ulcers  胃潰瘍3. inflammation of the stomach 胃炎4. inlfammation of the gall bladder 胆囊炎5.round worms in the gall bladder and bile duct 胆囊，輸膽管蛔虫6. diarrhea 腹瀉7. mastitis 乳腺炎8. mastic tumors 乳腺癌9. chronic inflammation of pelvic area 慢性盆腔炎10. appendicitis 盲腸炎11. contraction of testes into the cavities 睾丸縮入腹腔12. inflammation of the testes 睾丸發炎13. pain in the testes 睾丸痛14. fungus of the scalp (external use) 頭皮廯（外用）15. frost bites 凍傷Cautions:注意﹕The effective dosage is very close to toxic dosage.  Five or six pieces of fruit can cause death. Children taking 0.3~0.4 g had experience toxic reactions.  2~4 g had caused death.川楝子有效劑量接近中毒的劑量。五﹐六顆川楝子可為致死劑量。小兒服 0.3~0.4 克 曾經有中毒記錄。 2~4 克 曾經有致死記錄。　Note: chuan lian zi means lian zi produced in Sichuan province of China. Li Shi Zhen mentioned in his works that lian zi produced in Sichuan are the best. So all lian zi sold in the Chinese herb stores are called chuan lian zi. Ku lian zi literally means bitter lian zi.　　Search this siteProblems with website? Please Click here for comment. (Not for inquiry )    Click here for inquiryCopyright Notice 按此看關於版權問題Sponsors' Ads by Google 以下為谷歌 所提供之廣告A manuscript... writing, translating and proofreading  in progress List of Health ProblemsQigong (chi kung)Toxicity of Some HerbsSide Effect of Some HerbsHerbs that can be toxic to kidneysTraditional Chinese Medicine　TCM Diagnosis　Samples of FormulaeTerms of Traditional Chinese MedicineAcupuncturecopy right　版權所有Qigong classesPrescribed Drug DictionaryEmail our web master for  your suggestion (not for inquiry)Biochemistry Dictionary　Qigong classes　Research Librarian　　HomeWeather ReportDisclaimerLast update: June 27, 2014; 7 p.m. LAH　  ",
        "original_url": "http://alternativehealing.org/chuan_lian_zi.htm"
    }
]