[
  {
    "Names": {
      "Name": ["lao guan cao", "lǎo gu跣 cǎo"],
      "Pharmaceutical": ["Herba Gerani"],
      "Biological": [
        "Geranium wilfordii Maxim.（老鹳草）",
        "Erodium stephanianum Willd.（牻牛兒苗）",
        "Geranium carolinianum L.（西伯利亞老鹳草）"
      ],
      "Chemical": [],
      "Common": [],
      "Other name": [
        "lao guan jui 老鸛嘴",
        "ao ya jui 老鴉嘴",
        "guan jun 貫筋",
        "ao guan jun 老貫筋",
        "ao niu jun 老牛筋",
        "lao guan cao 老觀草",
        "lao he cao 老鶴草"
      ],
      "Chinese": ["老鸛草"],
      "Pronunciation in Korean": ["Se-ip-jwi-son-i (세잎쥐손이)"],
      "Pronunciation in Japanese": ["mitsubafuuro"],
      "Pronunciation in Cantonese": ["lou5 gun3 cou2"],
      "Pinyin Pronunciation": ["lǎo gu跣 cǎo"]
    },
    "Type": "Herb",
    "Geography": [
      "Northeastern China",
      "Eastern China",
      "Northern China",
      "Central China",
      "Shaanxi",
      "Gansu",
      "Sichuan",
      "Guizhou",
      "Yunnan"
    ],
    "Properties": ["Acrid", "Bitter", "Neutral"],
    "Meridians": ["Liver", "Kidney", "Spleen"],
    "Maladies Treated": [
      "rheumatoid arthritis",
      "muscle spasm",
      "numbness",
      "carbuncles",
      "gangrenes",
      "impact injuries",
      "colitis",
      "diarrhea",
      "dysentery"
    ],
    "Medical Function": [],
    "Dosage": "9～15 g daily.",
    "Samples of Formulae": "For chronic diarrhea: Lao Guan Cao (Herba Gerani) 18 g, Hong Zao (red jujube / Chinese date) 4 pieces. Make into thick decoction. Use as 3 servings per day. （《現代實用中藥》）\nFor muscle paralysis: Lao Guan Cao (Herba Gerani), Jun Gu Cao (Herba Ajugae decumbens), Shu Jin Cao (Herba Lycopodiastri casuarinoides). Stew with meat and take as soup. （《四川药誌》）",
    "Contraindications": "",
    "Research": "It is rich in potential sources of natural antioxidants. [2]",
    "Notes": "",
    "Chemical Ingredients": [
      "3 hydrolyzable tannins [1]: geraniin（老鹳草素）; corilagin（鞣料云實素; 1-┢酰-3,6-六羟基联苯二甲酰基葡糖）; gallic acid（五倍子酸 / 没食子酸）"
    ],
    "References": [
      "[1] J Sep Sci. 2010 Aug;33(15):2266-71.",
      "[2] Molecules. 2010 Aug 30;15(9):5988-97."
    ],
    "Further Reading": [],
    "Original Text": "lao guan cao, Complementary and Alternative Healing UniversityComplementary and Alternative Healing University   中藥詞典    Chinese Herb Dictionary      Search this site     在本網站找資料 lǎo gu跣 cǎo 老鸛草by: Joe Hing kwok Chu    朱興國編 譯     (in English and Chinese 中英文)Pharmaceutical name:英文藥名﹕Herba GeraniBotanical name:拉丁生物學名﹕Geranium wilfordii Maxim., （老鹳草）Erodium stephanianum Willd.,（牻牛兒苗）Geranium carolinianum L.（西伯利亞老鹳草）Pron. in Japanese:日語發音﹕ mitsubafuuro 【漢字名】三葉風露Pron. in Korean:韓語發音﹕Se-ip-jwi-son-i (세잎쥐손이)Pron. in Cantonese::粵音﹕lou5 gun3 cou2Other Names:別名﹕lao guan jui 老鸛嘴，ao ya jui 老鴉嘴，guan jun 貫筋，ao guan jun 老貫筋，ao niu jun 老牛筋 ，lao guan cao 老觀草 ，lao he cao 老鶴草。Common Name:外文名﹕ Distribution:產地﹕Northeastern, eastern, northern, central parts of China, provinces of Shaanxi, Gansu, Sichuang, Guizhou, Yunnan etc.東北，華北，華東，華中，陝西，甘肅和四川，貴州，雲南等地。Properties(characteristics)﹕性味﹕acrid, bitter, neutral.辛，苦，平。Channels (meridians) entered: 歸經﹕liver, kidney, speen.肝，腎，脾。Medical functions:藥理﹕   Actions & Indications:主治﹕Being used in rheumatoid arthritis, muscle spasm and numbness, carbuncles, gangrenes, impact injuries, colitis, diarrhea用於風濕疼痛，拘攣麻木，癰疽，跌打，腸炎，痢疾。Chemical ingredients:化學成份﹕3 hydrolyzable tannins:[1]3 種可水解之鞣質：【1】geraniin老鹳草素corilagin鞣料云實素; （1-┢酰-3,6-六羟基联苯二甲酰基葡糖）gallic acid五倍子酸 （没食子酸）Daly Dosage:每日用量﹕9～15 gSamples of formulae:處方舉例﹕for chronic diarrhea: lao guan cao 18 g, hong zao 4 pieces. Make into thick decoction. Use as 3 serving per day.for muscle paralysis: lao guan cao, jun gu cao (Herba Ajugae decumbens ), shu jin cao (herba Lycopodiastri casuarinoides) )with meat make into stew use as soup.治急慢性腸炎下痢：牻牛兒苗六錢，紅棗四枚。煎濃湯，一日三回分服。（《現代實用中藥》）治筋骨瘫痪：老鹳草，筋骨草，舒筋草，炖肉服。（《四川药誌》）Modern Research:現代研究﹕It is rich in potential sources of natural antioxidants. [2]含有豐富抗氧化剤。【2】Toxicity & Cautions:毒素與禁忌﹕[1] J Sep Sci. 2010 Aug;33(15):2266-71.[2] Molecules. 2010 Aug 30;15(9):5988-97.  Search this siteProblems with website? Please Click here for comment. (Not for inquiry )    Click here for inquiryCopyright Notice 按此看關於版權問題Sponsors' Ads by Google 以下為谷歌 所提供之廣告A manuscript... writing, translating and proofreading  in progress List of Health ProblemsQigong (chi kung)Toxicity of Some HerbsSide Effect of Some HerbsHerbs that can be toxic to kidneysTraditional Chinese Medicine TCM Diagnosis Samples of FormulaeTerms of Traditional Chinese MedicineAcupuncturecopy right 版權所有Qigong classesPrescribed Drug DictionaryEmail our web master for  your suggestion (not for inquiry)Biochemistry Dictionary Qigong classes Research Librarian  HomeWeather ReportDisclaimerLast update: July 10, 2014; 11 a.m. LAH   ",
    "original_url": "http://alternativehealing.org/lao_guan_cao.htm"
  },
  {
    "Names": {
      "Name": ["da ma", "cannabis sativa", "cannabis plant", "大麻"],
      "Pharmaceutical": ["Semen cannabis sativa"],
      "Botanical": ["Cannabis sativa L."],
      "Common": [
        "Marijuana (North America)",
        "ganja (Indonesia, Malaysia, India)"
      ],
      "Other name": [],
      "Chinese": ["大麻"],
      "Pronunciation in Korean": [],
      "Pronunciation in Japanese": [],
      "Pronunciation in Cantonese": ["tai ma"],
      "Pinyin Pronunciation": []
    },
    "Type": "Herb",
    "Geography": ["Throughout China", "Southeast Asia", "USA"],
    "Properties": [
      "Seed: oily.",
      "Seed (after stir-frying): fragrant; slightly sweet; bland.",
      "Bud: tasteless at first, then acrid, numbing, and toxic; bad odor."
    ],
    "Meridians": [],
    "Maladies Treated": [
      "Dry cough (general).",
      "Asthma (buds: bud paste used).",
      "Insomnia (buds: bud paste used).",
      "Pain (general; seeds also used).",
      "Menstrual pain (soothing).",
      "Pain caused by uterus not getting back in place.",
      "Ovarian pain.",
      "Mania.",
      "Itchy skin.",
      "Dry stool (seeds).",
      "Cough (seeds)."
    ],
    "Medical Function": [
      "Anesthetic effect.",
      "Calming nerves.",
      "Stopping spasms.",
      "Seeds: promote urination.",
      "Buds: analgesic qualities.",
      "Prevent brain damage after injury."
    ],
    "Dosage": "Seeds: 12–18 g. Used in decoction, pill, or powder.\nBuds: 3–6 g. Used in decoction.\nBud paste: daily dosage 0.5 cc, taken in 2 or 3 servings; for asthma and insomnia.",
    "Samples of Formulae": "Bud paste (for asthma and insomnia):\nPreparation: Chop buds 500 g into fine particles; add water 1000 cc; simmer; strain; then simmer the filtrate until 30 cc remain to form a paste.\nSource: Yang Teem Hua.",
    "Contraindications": "Do not overdose.\nChronic usage can cause amotivational syndrome (aimlessness and un-communication) and incoherent speech.\nWithdrawal symptoms can include anorexia, insomnia, anxiety, and depression.\nSmoking during pregnancy may cause miscarriage or underweight fetus.\nAdverse reactions can include dysphoria, tachycardia, orthostatic hypotension/low blood pressure, and may abruptly develop into latent schizophrenia.\nLong-term use may cause weight gain.",
    "Research": "",
    "Notes": "",
    "Chemical Ingredients": [
      "Protein",
      "Fat",
      "Ash",
      "Essential oil",
      "Lecithin",
      "Phytin (inositol hexaphosphate; calcium magnesium salt)",
      "Phytosterine",
      "Linoleic acid",
      "Glycuronic acid",
      "Inosite (inositol)",
      "Edestin",
      "Mascarin",
      "Choline",
      "Trigonelline",
      "Tetrahydrocannabinol (THC)"
    ],
    "References": [],
    "Further Reading": [],
    "Original Text": "da ma, marijuana, cannabis sativa, Complementary and Alternative Healing University\n\n\n\n\nComplementary and \n    Alternative Healing University\n    \n \n\n\n\n\n\n中藥詞典                 \n    Chinese Herb Dictionary    \n     Search \n    this site    \n    在本網站找資料\n\n\n\n\n\n\n\n\n\n\n\n\n\n\nSearch this \n        site\n\n\nList \n        of Health Problems\n\n\n\n\n\n\n        Chinese Herb Dictionary\n\n\n\n\n\nQigong\n\n\n\n\n\n\n        Traditional Chinese Medicine (TCM)\n\n\n\n\n\n\n        Acupuncture\n\n\n\n\n\n\n        Prescribed Drug Dictionary\n\n\n\n\n\nBiochemistry Dictionary\n\n\n\n\n\nLecture Slides\n\n\n\n\n\nResearch Librarian\n\n\n\n\n\n\n        General Online Library\n\n\n\n\n\nResearch \n        Sites\n\n\n\n\n\n\n        Viagra\n\n\n\n\n\n\n        Massage/Acupressure\n\n\n\n\n\nHypnotherapy\n\n\n\n\n\nTell us what you want\n\n\n\n\n\nNotify Changes \n        & New Information\n\n\n\n　\n\n\n\n\n\n　\n     \nda ma, cannabis sativa, cannabis plant, marijuana 大麻Edited by: Joe Hing Kwok Chu         \n    （in English and Chinese 中英文)Pharmaceutical name:英文藥名﹕Semen cannabis sativaBotanical name:學名﹕Cannabis sativa L.Pron. in Japanese:日語發音﹕　Pron. in Korean:韓語發音﹕　Pron. in Cantonese:粵音﹕tai maOther Names:別名﹕　Common Name:外文名﹕Marijuana (in North America), ganja (Indonesia, Malaysia India)Distribution:產地﹕Throughout China, SE Asia, and USA.Properties(characteristics)﹕性味﹕Seed is oily. After stir frying, it is fragrant, a little sweet and bland. The bud is tasteless at first, and then acrid, numbing,  and toxic. It smells bad.Channels (meridians) entered:　歸經﹕Medical functions:藥理﹕　　Actions & Indications:主治﹕\n\n      Anesthetic effect; used in dry cough, asthma; calming nerves; stopping \n      spasms, pain; for insomnia; for soothing menstrual pain; for pain caused \n      by uterus not getting back in place; for pain in ovaries; mania; itchy \n      skin； prevent brain damage after injury. \n      Seeds can be used for dry stool and cough and pain. They promote \n      urination. Long-term usage can cause weight gain. Dosage: Seeds:12-18 \n      gm. Buds--3-6 gm. Buds are used in decoction. Seeds are used in decoction, \n      pill, or powder form.\n\n      有麻醉作用。用於乾咳，哮喘; 鎮靜安神;停止痙攣，疼痛，失眠，舒緩經痛，由子宮沒有恢復原處引起的疼痛; 卵巢疼痛; 癲狂; 皮膚瘙癢； \n      防止受傷後腦部損壞。\n      種子可用於大便乾燥和咳嗽和疼痛;促進排尿。長期使用可導致體重增加。 【用法用量】：種子 - 12-18克。芽 - 3 - \n      6克。芽用於煎服。種子被用於湯劑，丸劑，或粉末狀。Chemical ingredients:化學成份﹕Protein, fat, ash, essential oil, lecithin, phytin, phytosterine, linoleic acid, glycuronic acid, inosite, edestin, mascarin, choline, trigonelline﹐ tetrahydrocannabinol (THC)\n\n        蛋白質，脂肪，灰分，揮發油，卵磷脂，肌醇六磷酸鈣鎂，phytosterine，亞油酸，葡萄糖醛酸，肌醇，麻仁，mascarin，膽鹼，葫蘆巴鹼，四氫大麻酚（THC）Dosage:用量﹕Bud paste: Daily dosage: 0.5 cc can be taken in 2 or 3 servings. For asthma and insomnia. Samples of formulae:處方舉例﹕Bud paste: 500gm chopped into fine particles, water 1000 cc. Simmer. Strain. And then simmer until 30cc left in paste form. The source of the formula: Yang Teem HuaModern Research:現代研究﹕　Toxicity & Cautions:毒素與禁忌﹕The buds possess analgesic qualities. Do not overdose.Chronic usage can cause :Amotivational syndrome ( aimlessness and un-communication).Withdrawal Symptoms can include: anorexia,  insomnia, anxiety, and depression .Smoking marijuana (da ma) during pregnancy may cause miscarriage or underweight fetus.It can cause dysphoria, tachycardia, orthostatic hypotension, and may abruptly develop into latent schizophrenia.大麻含麻醉作用。不可多用。   長期服用可能造成語無倫次。懷孕婦女吸食大麻常會造成早產、胎兒體重偏低。大麻可致煩躁不安，心跳加速，體味低血壓，并可能突然發展為 潛伏性的神經分裂症。　 \n\n\n\n\nSearch this \n    site \n\n\nProblems with website? Please \n\nClick \n    here for comment. (Not for inquiry )    \n    \n\n\nClick \n    here for inquiry \n\n\n\nCopyright Notice \n\n按此看關於版權問題\n\n\n\n\nA manuscript... writing, translating and proofreading  in progress\n\n\nSponsors' Ads by Google \n    以下為谷歌 所提供之廣告\n\n\n\n\n\n\n\n\nList \n        of Health Problems\n\n\n\n\n        Chinese Herb Dictionary\n\n\n\n\nToxicity of Some Herbs\n\n\n\nSide Effect of Some Herbs\n\n\n\nHerbs that can be toxic to kidneys\n\n\n\n\n        Traditional Chinese Medicine\n　\n\n\nTCM Diagnosis\n　\n\n\n        Samples of Formulae\n\n\n\n\n        Terms of Traditional Chinese Medicine\n\n\n\n        Acupuncture\n\n\n\n\n\ncopy right\n　\n\n\n版權所有\n\n\n\nQigong \n        (chi kung)\n\n\n\n\n        Prescribed Drug Dictionary\n\n\n\n\n        Email our web master for  your suggestion (not for inquiry)\n\n\n\nBiochemistry Dictionary\n\n\n\n\n\nGeneral Online Library\n\n\n\nQigong \n        classes\n\n\n\nFake \n        Email Warning\n\n\n\nResearch Librarian\n\n\n\nSearch\n\n\n\n\n\nQigong classes\n\n\n\nHome\n\n\n\n\n        Weather Report\n\n\n\n\n        Disclaimer\n\n\nLast update: Nov 30, 2013; 9 p.m. \n        LAH\n\n\n\n\n\n　\n\n\n\n\n\n\n\n\n",
    "original_url": "http://alternativehealing.org/da_ma.htm"
  },
  {
    "Names": {
      "Name": ["chai hu"],
      "Pharmaceutical": ["Radix Bupleuri"],
      "Biological": [
        "Bupleurum chinense DC. (北柴胡)",
        "Bupleurum falcatum L. (銀柴胡)",
        "Bupleurum scorzonerifolium Willd. (紅柴胡，南柴胡，細柴胡，軟柴胡)"
      ],
      "Chemical": [],
      "Common": ["thorowax root", "hare's ear root"],
      "Other name": [
        "chun chai hu (spring chai hu) 春柴胡",
        "chai hu 柴胡",
        "di xun 地熏",
        "zi hu 茈胡",
        "shan cai 山菜",
        "ru cao 茹草",
        "chai cao 柴草",
        "ruan chai hu 軟柴胡",
        "ying chai hu 硬柴胡",
        "ya hu 芽胡",
        "ya chai hu 芽柴胡",
        "chun hu 春胡",
        "nan hu 南胡",
        "chai hu 才胡",
        "di xun 地薰",
        "yun gao 芸蒿",
        "Bupleurum chinense: bei chai hu (northern chai hu 北柴胡), ying chai hu (hard chai hu 硬柴胡)",
        "Bupleurum scorzonerifolium: nan chai hu (southern chai hu 南柴胡), xi chai hu (thin chai hu 細柴胡), ruan chai hu (soft chai hu 軟柴胡)"
      ],
      "Chinese": [
        "柴胡",
        "北柴胡",
        "南柴胡",
        "硬柴胡",
        "細柴胡",
        "軟柴胡",
        "紅柴胡",
        "銀柴胡"
      ],
      "Pronunciation in Korean": ["siho"],
      "Pronunciation in Japanese": ["saiko"],
      "Pronunciation in Cantonese": ["caai4 wu4"],
      "Pinyin Pronunciation": []
    },
    "Type": "Herb",
    "Geography": [
      "Bupleurum chinense DC. (north chai hu) is mainly produced in Liaoning, Gansu, Hebei, Henan.",
      "Bupleurum scorzonerifolium Willd. (south chai hu / xi chai hu / ruan chai hu) is mainly produced in Hubei, Jiangsu, Sichuan."
    ],
    "Properties": ["Bitter", "Slightly cold"],
    "Meridians": ["liver", "gall bladder", "pericardium", "triple fire"],
    "Maladies Treated": [
      "cold and influenza",
      "alternating chill and fever",
      "malaria",
      "liver qi stagnation",
      "qi stagnation with fullness in chest and rib cage",
      "irregular menses",
      "prolapse of uterus",
      "prolapse of rectum",
      "cough",
      "viral infection of the liver",
      "high lipids of blood",
      "globus hystericus (梅核氣)"
    ],
    "Medical Function": [
      "calming effect on CNS",
      "analgesic (pain relieving)",
      "antipyretic (reducing heat)",
      "anti-inflammatory",
      "promotes immune function",
      "effects on digestive system",
      "effects on heart and blood vessels",
      "diuretic effect: small amount improves urination; large amount does not have this effect",
      "anti-tumor",
      "anti-bacteria, anti-influenza virus, and anti-amoeba",
      "effects on metabolism",
      "anti-HBV",
      "improves liver function",
      "lowers ALT and AST [6]",
      "fried chai hu: after stir-frying, reduces the herb's cold nature and enhances the effect of lifting clear yang",
      "wine-treated chai hu (酒柴胡): enhances blood circulation and enhances yang function",
      "vinegar stir-fried chai hu (醋炒柴胡): directs action to the liver channel; enhances soothing the liver and harmonizing the blood; arrests pain"
    ],
    "Dosage": "3–12 g",
    "Samples of Formulae": "Xiao Chai Hu Tang (小柴胡湯).\n\nChai Hu Gui Zhi Gan Jiang Tang (柴胡桂枝乾薑湯).\n\nFormula for Eye Viral Infection (眼睛病毒感染).\n\nFried chai hu (炒柴胡): Place chai hu slices in a frying pan and dry-fry to slightly charred. Aged wine or wheat bran can be added for stir-frying. After frying, the herb is less cold in nature and enhances the effect of lifting clear yang when taken. Wine-treated chai hu (酒柴胡) enhances blood circulation and yang function.\n\nVinegar stir-fried chai hu (醋炒柴胡; cu chao chai hu): Mix chai hu slices evenly with rice vinegar (100 kg chai hu to 10 kg rice vinegar), let sit briefly, then place in a pot and gently stir-fry over low heat until slight charring appears; spread out to dry before storage. After processing, it especially enters the liver channel and enhances soothing the liver and harmonizing the blood, and stops pain.\n\nSoft shell turtle blood chai hu (鱉血柴胡): Evenly mix chai hu slices with soft shell turtle blood and yellow rice wine (per 1 kg chai hu, use 100 g turtle blood and 150 g yellow rice wine diluted and mixed with chai hu), then stir-fry over low heat until dry; remove, spread out to cool, and store. After processing, it enhances the nourishing-yin antipyretic action; nourishes yin and clears heat; eliminates malaria; disperses lumps; especially suitable for liver stagnation with yin deficiency, and appropriate for bone-steaming tidal fever (骨蒸勞熱).\n\nSee list of other chai hu formulae (其他柴胡方劑).",
    "Contraindications": "Mildly toxic. Not for use in cases of yin deficiency cough or headache due to ascending liver fire.\n\nOverdose may cause headache, dizziness, vomiting, tremors, gastroenteritis, and pathogenic erections.\n\nThere were reported cases of mortality from broncho-interstitial pneumonia suspected to be caused by combined use of chai hu formulae and interferon (有將柴胡製劑與干擾素併用，引發間質性肺炎而死亡的案例).\n\nLarge dosages and/or long-term usage may be toxic to the kidneys (大劑量或長期服用可能對腎臟有毒).",
    "Research": "",
    "Notes": "Ruan chai hu (軟柴胡; soft chai hu): After harvesting the above-ground stems and leaves, remove the old stalks, sun-dry, and tie into bundles; this product is sold as ruan chai hu (also called miao chai hu 苗柴胡).",
    "Chemical Ingredients": {
      "Vaporizing oils (volatile oils)": [
        "2-methyl cyclopentaone",
        "limonene",
        "myrcene",
        "(+)-carvone",
        "trans-terraced carveol (trans-tarved carveol)",
        "pulegone",
        "myrtenol",
        "α-terpineol",
        "linalool",
        "geraniol",
        "n-tridecane",
        "(E)-geranylacetone",
        "α-cubebene",
        "humulene",
        "trans-caryophyllene",
        "longifolene",
        "nootkatone",
        "hexadecanoic acid",
        "hexahydrofarnesylacetone",
        "pentanic acid",
        "caproic acid",
        "heptylic acid",
        "2-heptenic acid",
        "caprylic acid",
        "2-octenic acid",
        "pelargonic acid",
        "2-nonenic acid",
        "phenol",
        "O-methoxy phenol",
        "gamma-heptalactone",
        "gamma-decalactone",
        "eugenol",
        "gamma-undecalactone",
        "methyl phenol",
        "ethyl phenol",
        "thymol",
        "messoia lactone",
        "vanillin acetate",
        "β-terpinene",
        "β-fenchene",
        "isoborneol",
        "β-terpineol",
        "α-copaene",
        "a-farnesene",
        "aromadendrene",
        "cis-caryophyllene",
        "β-elemene",
        "gamma-muurolene",
        "patchoulane",
        "ledol"
      ],
      "Saponins": ["saikosaponin", "saikogenin", "longispinogenin"],
      "Organic acids": [
        "oleic acid",
        "linolenic acid",
        "palmitic acid",
        "stearic acid",
        "lignoceric acid"
      ],
      "Ethanol group and related sterols/sugars": [
        "α-spinasterol",
        "delta7-stimasteneol",
        "delta22-stigmaastenol",
        "stigmasterol",
        "adonitol",
        "bupleuromol"
      ],
      "Others": ["angelicin", "calcium", "potassium", "aluminum", "oxalic acid"]
    },
    "References": [],
    "Further Reading": [],
    "Original Text": "chai_hu, Complementary and Alternative Healing University\n\n\n\n\nComplementary and Alternative Healing \n    University \n \n\n\n\n\n\n中藥詞典    Chinese Herb Dictionary    \n     \n\n\nSearch this \n    site    \n    在本網站找資料\n\n\n\n\n\n \n\nchai hu 柴胡\n\nby: Joe Hing Kwok Chu\n\nClick here to see picture of chai hu herb.  按此看柴胡飲片圖。\nPharmaceutical name:\n\n藥 名 ﹕\n\nRadix Bupleuri\n\nBiological name:\n\n拉 丁 學 名 ﹕\nBupleurum chinense DC. (北柴胡)\nBupleurum falcatum L. (銀柴胡)\nBupleurum scorzonerifolium Wild.(紅柴胡，南柴胡，細柴胡，軟柴胡)\n\nPron. in Japanese:\n\n日 語 發 音 ﹕\n\nsaiko\n\nPron. in Korean:\n\n韓 語 發 音 ﹕\n\nsiho\nPron. in Cantonese: 粵 音 ﹕\n\ncaai4 wu4\n\nCommon Name:\n\n英 文 ﹕\n\nthorowax root, hare's ear root\n\nOther names:\n\n別名：\n\nchun chai hu (literally spring chai hu)春柴胡, chai hu 柴胡, di xun 地熏, zi hu 茈胡, shan cai 山菜, ru cao 茹草, chai cao  柴草, ruan chai hu 軟柴胡, ying chai hu硬柴胡, ya hu芽胡, ya chai hu 芽柴胡, chun hu 春胡, nan hu 南胡, chai hu 才胡, di xun 地薰, yun gao 芸蒿\n\nBupleurum chinense: bei chai hu (literally northern chai hu), ying chai hu (literally hard chai hu)\n\nBupleurum scorzonerifolium:  nan chai hu (literally southern chai hu), xi chai hu (literally thin chai hu), ruan chai hu (literally soft chai hu)\n \n\n北柴胡（ 硬柴胡 [Bupleurum chinense]） ，\n\n 南柴胡（ 細柴胡，軟柴胡[Bupleurum scorzonerifolium]）\n \n\nDistribution:\n\n分 佈 ﹕\n\nBupleurum chinense DC. (north chai hu) is mainly produced in Liaoning, Gansu, Hebei, Henan.\n\nBupleurum scorzonerifolium Wild.(south chai hu or xi chai hu or ruan chai hu) is mainly produced in Hubei, Jiangsu, Sichuan.\n \n\n北柴胡（硬柴胡）主產 遼 寧 、甘 肅 、 河北、河南。\n\n南柴胡（細柴胡，軟柴胡）主產 湖北、江 蘇 、四川。\n\nProperties (characteristics)﹕\n\n性 味 ﹕\n\nbitter, slightly cold.\n\n苦 ﹐ 略 寒 。\n\nChannels (meridians) entered:\n\n歸 經 ﹕\n\nliver, gall bladder, pericardium, triple fire\n\nActions & Indications:\n\n主 治 ﹕\n\nto disperse heat and fever, improve yang. For cold and influenza, alternating chill and fever, malaria,\n        liver qi stagnation, \nqi stagnation, fullness in chest and rib cage, irregular menses, prolapse of uterus, and prolapse of rectum.\n\n疏散 退熱，升陽舒肝。用于感冒發熱, 寒熱往來, 瘧疾, 肝鬱 \n 氣滯, 胸脅脹痛, 脱肛, 子宫脱垂, 月經不不調。\n\nMedical Function:\n\n藥理﹕\n\nMedical Function:\n\ncalming effect on CNS\n\npain relieving,\n\nantipyretic, reducing heat\n\nanti inflammation\n\neffect on immune system\n\neffect on digestive system\n\neffect on heart and blood vessels\n\neffect on excretion of urine﹕small amount improves urination and large amount does not have the effect\n\nanti tumor\n\nanti bacteria, virus, and amoeba\n\neffect on metabolism\n\nanti HBV\n\nimproves liver function\n \n\n鎮靜,\n\n解熱\n\n鎮痛\n\n抗炎\n促進免疫功能\n\n消化系統作用\n\n心血管作用\n\n抗癌作用\n\n利尿作用﹕小量有利尿作用﹔大劑量無此作用\n\n抗菌及抗流感病毒\n\n新陳代謝作用\n\n改善肝功能\n\nChemical ingredients:\n\n化 學 成 份 ﹕\n\n1. Vaporizing oils: 2-methyl cyclopentaone, limonene, myrcene, (+)-carvone, trans-tarved carveol, pulegone, myrtenol, α-terpineol, linalool, geraniol, n-tridecane, (E) - geranylacetone, α-cubebene, humulene, trans-caryophyllene, longifolene, nootkatone, hexadecanoic acid, hexahydrofarnesylacetone, pentanic acid, caproic acid, heptylic acid, 2-heptenic acid, caprylic acid, 2-octenic acid, pelargonic acid, 2-nonenic acid, phenol, O-methoxy phenol, gamma-heptalactone, gamma-decalactone, eugenol, gamma-undecalactone, methyl phenol, ethyl phenol, thymol, messoia lactone, vanillin acetate.\n\nβ-terpinene, limonene, β-fenchene, pulegone, isoborneol, β-terpineol, α-copaene, humulene, a-farnesene, aromadendrene, cis-caryophyllene, trans-caryophyllene, β-elemene, gamma-muurolene, patchoulane, nootkatone, ledol.\n\n2. Saponins: Saikosaponin, saikogenin, longispinogenin.\n\n3. Organic acids: Oleic acid, linolenic acid, palmitic acid, steaeric acid, lignoceric acid.\n\n4. Ethanol  group: α-spinasterol, delta7-stimasteneol, delta22-stigmaastenol, stigmasterol, adonitol, bupleuromol.\n\n5. Others: Angelicin, calcium, potassium, aluminum, oxalic acid.\n\nDosage:\n\n用 量 ﹕\n\n3 to 12 g\n\n3~12 克 。\n\nSamples of formulae:\n\n處方舉 例﹕\n\nxiao chai hu tang 小柴胡湯,\n\nchai hu gui zhi gan jiang tang 柴胡桂枝乾薑湯\n\nFormula for Eye Viral Infection 眼睛病毒感染\n\nSee list of  other chai hu formulae 其他柴胡方劑\n\nModern Application:\n\n現代應用﹕\n\nModern Application:\n\n to reduce fever\n\n cough\n\n viral infection of the liver\n\n to lower ALT and AST : [6]\n\n for high lipids of blood\n\n globus hystericus\n\n現代應用﹕\n\n解熱\n\n止咳嗽\n\n肝臟病毒感染\n\n降肝臟 ALT 與  AST\n\n高血脂\n\n梅核氣\n\nMore to upload\n \n\nCautions:\n\nIt is mildly toxic. Not for use in cases of yin deficiency cough or headache due to ascending liver fire.\n\nOverdose causes headaches, dizziness, vomiting, tremors, gastroenteritis, and pathogenic erections.\n\nThere were report of cases of mortality of  broncho-interstitial pneumonia suspected were being caused by the combined use of chai hu formulae and interferon.\n\nLarge dosages and/or long term usage can be toxic to kidneys.\n\n有將 柴胡製劑與干擾素併用，引發間質性肺炎而死亡的案例。\n\n大劑 量或長期服用可能對 腎臟有毒。\n\nFried chai hu: put chai hu pieces in frying pan and fry to slightly charred. Aged wine or wheat bran can also be added for the stir-frying. After stir frying, the characteristics of the herb will be not be so cold and can enhance the yang characteristics of the body when taken. Jiu chai hu (wine treated chai hu) can enhance blood circulation, and enhance yang function.\n\nCu chao chai hu (vinegar stir fried chai hu): Mix chai hu slicess with vinegar (chai hu 100 kg to 10 kg), let sit for a short time, and set the pot and the mixture on the stove and gently stir-fry until slightly charred. Spread out to dry. After this process, cu chai hu is known for entering the liver channel and also in arresting pain.\n\nSoft shell turtle blood chai hu: Evenly mix chai hu slices with soft shell turtle blood and rice wine (100 Kg of turtle blood and 150 Kg of rice wine). Stir. Pan fry till dry. Take out and spread out to air cool. After this process, the function of the herb is enhanced in its antipyretic effect in nourishing yin and removing heat, ridding of malaria, removing lumps, especially effective for liver stagnation with yin deficient, particularly appropriate gu zhen lao re condition.\n\nRuan chai hu (soft chai hu): after harvesting the above ground stems and leaves, removing the old stalks, dry, tie into bundle, it is sold as ruan chai hu (soft Bupleurum) also call miao chai hu (sprout Bupleurum).\n \n\n炒柴胡： 以柴胡片於鍋中清炒至微焦為度，亦可加陳酒或麩皮拌炒，炒後可避其涼性，而增升舉清陽之效。 酒柴胡增強活血，升陽通經作用。\n\n醋炒柴胡： 取柴胡片，用米醋拌勻(柴胡100公斤用米醋10公斤)，稍悶，置鍋內用文火炒至略見焦斑時，取出攤開晾干收貯。經製後獨入肝經 ，增強舒肝和血、止痛之功。\n\n鱉血柴胡： 取柴胡片用鱉血和黃酒拌勻(每公斤柴胡，用鱉血100克與黃酒150克和勻稀釋後拌柴胡)，入鍋內用文火炒干。取出攤晾收貯，炮 制後增強其滋陽退熱作用，能養陰制瘧，消痞塊，對肝郁而陰虧者尤宜應用，適用於骨蒸勞熱等症。\n\n軟柴胡：收割地上莖葉，去掉老莖稈，晒乾，捆扎成把，即為軟柴胡（苗柴胡）\n\n\nSearch this \n    site \n\n\nProblems with website? Please \n\n\n\nClick \n    here for comment. (Not for inquiry )    \n    \n\n\nClick \n    here for inquiry \n\n\n\n\n\nCopyright Notice \n\n按此看關於版權問題\n\n\n\n\nSponsors' Ads by Google \n    以下為谷歌 所提供之廣告\n\n\nA manuscript... writing, translating and proofreading  in progress\n\n\n\n\n\n\n\n\nList \n        of Health Problems\n\n\n\n\nQigong \n        (chi kung)\n\n\n\n\nToxicity of Some Herbs\n\n\n\nSide Effect of Some Herbs\n\n\n\nHerbs that can be toxic to kidneys\n\n\n\n\n        Traditional Chinese Medicine\n \n\n\nTCM Diagnosis\n \n\n\n\n        Samples of Formulae\n\n\n\n\n        Terms of Traditional Chinese Medicine\n\n\n\n        Acupuncture\n\n\n\n\n\ncopy right\n \n\n\n版權所有\n\n\n\n\nQigong classes\n\n\n\n\n        Prescribed Drug Dictionary\n\n\n\n\n        Email our web master for  your suggestion (not for inquiry)\n\n\n\nBiochemistry Dictionary\n\n\n\n \n\n\n\nQigong \n        classes\n\n \n\n\n\nResearch Librarian\n\n \n\n\n\n \n\n\n\nHome\n\n\n\n\n        Weather Report\n\n\n\n\n        Disclaimer\n\n\nLast update: Jan 13, 2016; 12:06 \n        a.m. LAH\n\n\n\n\n\n \n\n\n\n\n\n\n\n\n",
    "original_url": "http://alternativehealing.org/chai_hu.htm"
  },
  {
    "Names": {
      "Name": ["hai tong pi", "海桐皮"],
      "Pharmaceutical": ["ErythrinaeCortex"],
      "Biological": ["Erythrina variegata L. var. orientalis (L.) MERR."],
      "Chemical": [],
      "Common": ["English: coral bean bark, erythrina bark"],
      "Other name": [
        "ding tong pi 釘桐皮",
        "gu tong pi 鼓桐皮",
        "ci tong pi 刺桐皮",
        "ci tong 刺通",
        "jie gu yao 接骨藥"
      ],
      "Chinese": ["海桐皮"],
      "Pronunciation in Korean": ["haedongp'i"],
      "Pronunciation in Japanese": ["kaitohi"],
      "Pronunciation in Cantonese": ["hoi tong peh"],
      "Pinyin Pronunciation": []
    },
    "Type": "Herb",
    "Geography": [
      "Guangxi (China)",
      "Yunnan (China)",
      "Fujian (China)",
      "Hubei (China)"
    ],
    "Properties": ["Bitter", "Acrid", "Neutral"],
    "Meridians": ["Liver", "Spleen"],
    "Maladies Treated": [
      "Bark: achy loin and knees",
      "Bark: rheumatoid arthritis (風濕痺痛)",
      "Bark: jiao qi (leg qi/beriberi) (腳氣)",
      "Bark: scabies (疥癬)",
      "Bark: tooth ache",
      "Bark: chronic and cold type of rheumatoid arthritis (from formula context)",
      "Bark: fungal infection of skin (from formula context)"
    ],
    "Medical Function": [],
    "Dosage": "6 to 12 g. Use appropriate amount for external application.",
    "Samples of Formulae": "For chronic and cold type of rheumatoid arthritis: Composition: hai tong pi (Erythrina bark), xu duan (Teasel root), du zhong (Eucommia bark), dang gui (Angelica sinensis root), wu jia pi (Acanthopanax bark). Preparation: Make into decoction. Use as tea. Indication: chronic and cold type of rheumatoid arthritis.\nFor fungal infection of skin: Composition: hai tong pi (Erythrina bark), di fu zi (Kochia fruit), she zhuang zi (Cnidium seed), huang bai (Phellodendron bark). Preparation: Make into decoction. Use as tea. Indication: fungal infection of skin.",
    "Contraindications": "Not to use in cases of blood deficiency (血虛).",
    "Research": "",
    "Notes": "",
    "Chemical Ingredients": {
      "Bark": [
        "erythraline (刺桐靈鹼)",
        "hypaphorine (下緘刺桐鹼)",
        "amino acids"
      ]
    },
    "References": [],
    "Further Reading": [],
    "Original Text": "\n\n\n\n\n\nhai tong pi, Complementary and Alternative Healing University\n\n\n\n\n\n\n\n\n\n\n\n        Complementary and Alternative Healing University \n        \nHome  \n\n\n現代 中藥辭典\n\n\n\n\n\n\n\n\n\n\n\n\n\nSearch this site\n\n\n\n\n\n\n            List of Health Problems\n\n\n\n\n\n\n            Chinese Herb Dictionary\n\n\n\n\n\nQigong\n\n\n\n\n\n\n            Traditional Chinese Medicine (TCM)\n\n\n\n\n\n\n            Acupuncture\n\n\n\n\n\n\n            Prescribed Drug Dictionary\n\n\n\n\n\n            Biochemistry Dictionary\n\n\n\n\n\nLecture Slides\n\n\n\n\nResearch \n            Librarian\n\n\n\n\n\n\n            General Online Library\n\n\n\n\n\nSearch this site\n\n\n\n\n\nResearch \n            Sites\n\n\n\n\n\n\n            Viagra\n\n\n\n\n\n\n            Massage/Acupressure\n\n\n\n\n\n\n            Hypnotherapy\n\n\n\n\n\nTell us what you \n            want\n\n\n\n\n\nNotify \n            Changes & New Information\n\n\n\n　\n　\nTo post your\n            \n            discussion click here.\n \n \n \n \n \n \n \n \n \n \n \n \n \n \n \n \n \n \n \n \n \n \n \n \n \n \n \n \n \n\n\n\n\n \n\n\nhai tong pi \n海桐皮  \n        (in English and Chinese 中英文）\n\n         \n\n\n        Edited \n\nby: Joe Hing kwok Chu\n\n\n\n\n\n    Pharmaceutical name:\n    英文藥名﹕\n\n    ErythrinaeCortex\n\n\n\nBotanical name:\n\n    學名﹕\n\nErythrina variegata L. var. orientalis (L.) MERR.\n\n\n\nPron. in Japanese:\n日語發音﹕\n\n    kaitohi\n\n\n\nPron. in Korean:\n韓語發音﹕\n\n    haedongp'i\n\n\n\nPron. in Cantonese:\n粵音﹕\n\n    hoi tong peh\n\n\n\n\n        \n        Other Names:\n\n        \n        別名﹕\n\nding tong pi 釘桐皮，gu tong pi\n    鼓桐皮，ci tong pi 刺桐皮，ci \n    tong 刺通，jie gu yao 接骨藥。\n\n\n\nCommon Name:\n英文名﹕\n\n    coral bean bark, erythrina bark\n\n\n\nDistribution:\n產地﹕\n\n    Guangxi, Yunnan, Fujian, Hubei provinces of China\n中國廣西, 雲南, 福建, 湖北等地。\n\n\n\nProperties\n(characteristics)﹕\n性味﹕\n\n            bitter, acrid, neutral.\n\n        \n            苦，辛，平。\n\n\n\nChannels (meridians)\n      entered:\n \n\n    歸經﹕\n\n\n    liver, spleen.入肝, 脾二經。\n\n\n\n\n        Medical functions:\n\n        藥理﹕ \n\n             \n\n\n\nActions & Indications:\n\n    主治﹕\n\n        \n        achy loin and knees, rheumatoid arthritis, scabies, tooth ache.腰 膝 疼 痛 ， 風 濕 痺 痛 ， 腳 氣 ， 疥 癬 ， 牙 痛 。\n\n\n\n\n\n    Chemical ingredients:\n\n    化學成份﹕\n\n刺桐靈鹼(erythraline)，下緘刺桐鹼(hypaphorine)，氨基酸 (amino \n    acids)\n\n\n\nDosage:\n用量﹕\n\n        6 to 12 g. Use appropriate amount for external application.\n6~12 g。外用適量。\n\n\n\nSamples \n    of formulae:處方舉例﹕\n\n        For chronic and cold type of rheumatoid arthritis: hai tong pi, \n        \n        xu duan,\n\ndu zhong, \n dang \n        gui,  wu \n        jia pi.. Make into decoction. Use as tea.For \n        fungal infection of skin: hai tong pi, \n        \n        di fu zi, \n she \n        zhuang zi, \n\nhuang bai. Make into decoction. Use as tea.\n\n\n      \n          風濕性關節炎,\n      \n          慢性而偏寒者:\n      \n        \n        海桐皮, \n          \n      \n續斷,\n杜\n        仲,\n當\n        歸,\n五加皮。\n\n      \n          皮膚癬菌: \n        \n海桐皮,\n      \n          \n      地膚子,\n\n蛇床子,黃柏 \n        。\n\n\n\n\n\nModern Research:\n\n    現代研究﹕\n\n     \n\n\n\n\nToxicity & Cautions:\n\n毒素與禁忌﹕\n\n    not to use in cases of\n\n        Blood deficient.\n \n  血虛者﹐忌用。\n\n\n\n        　\n\n         \n \n\n\n\n\n\n\n\n              Search this site powered by\n              \n              FreeFind\n\n\n\n\n\n\n\n\n\n\n\n\n\n\n\n\n\n\n\n\n\n\n\n\n\n\n\n\n\n\n\n\n\n\n\n\n\nSponsors' Ads by Google 以 \n        下為谷歌所提供之廣告\n\n\n \n\n\n\n\n\n\nA manuscript... writing, translating and proofreading                          in progress\n\n\n\n            Click here for comment. (Not for inquiry )     \n            \n\nClick here for inquiry\n \n \n\n\nCopyright Notice 按此看關於版權問題\n\n\n\n\n\n\n                List of Health Problems\n\n\n\n\n                Chinese Herb Dictionary\n\n\n\n\nToxicity of Some Herbs\n\n\n\nSide Effect of Some Herbs\n\n\n\nHerbs that can be toxic to kidneys\n\n\n\n\n                Traditional Chinese Medicine\n\n\nTCM \n                Diagnosis\n\n\n\n                Samples of Formulae\n\n\n\n\n                Terms of Traditional Chinese Medicine\n\n\n\n                Acupuncture\n\n\n\n\n\n\n                copy right\n \n\n\n版權所 \n                有\n\n\n\nQigong \n                (chi kung)\n\n\n\n\n                Prescribed Drug Dictionary\n\n\n\n\n                Email our web master for  your suggestion (not for inquiry)\n\n\n\nBiochemistry Dictionary\n\n\n\n\n\nGeneral Online Library\n\n\n\n\n                Qigong classes\n\n\n\n\n                Fake Email Warning\n\n\n\nResearch Librarian\n\n\n\nSearch\n\n\n\n\n\nQigong classes\n\n\n\n\n\n\n\n\nHome\n\n\n\n\n                Weather Report\n\n\n    \n\n\n                Disclaimer\n\n\n\n\n\n\n\n \n\n\n\n\n\n\n\n\n\n\n\n\n\n\n\n\n\n\n\n\n\n\n\n\n\n\n\n\n\n\n\n\n\n\n\n\n\n\n\n\n\n\n        Last update: Nov 9, 2011; 11:33 a.m. LAH\n\n\n\n\n\n\n\n\n\n\n\n\n\n",
    "original_url": "http://alternativehealing.org/hai_tong_pi.htm"
  },
  {
    "Names": {
      "Name": ["huo xiang"],
      "Pharmaceutical": ["Herba Agastaches seu Pogostemi"],
      "Biological": [
        "Agastache rugosa (Fisch.et Mey.) O. Ktze",
        "Pogostemon cablin (Blanco) Benth."
      ],
      "Chemical": [],
      "Common": [
        "English: agastache; patchouli; pogostemon (P. cablin); Korean mint"
      ],
      "Other name": [
        "tu huo xiang 土藿香",
        "guang huo xiang (Pogostemon) 廣藿香"
      ],
      "Chinese": ["藿香", "土藿香", "廣藿香"],
      "Pronunciation in Korean": ["kwakhyang"],
      "Pronunciation in Japanese": ["kakko"],
      "Pronunciation in Cantonese": ["fok3 heong1"],
      "Pinyin Pronunciation": []
    },
    "Type": "Herb",
    "Geography": [
      "Agastache: throughout China",
      "Pogostemon: Guangdong, Guangxi, Taiwan, Yunnan"
    ],
    "Properties": ["Acrid", "Slightly warm"],
    "Meridians": ["Spleen", "Stomach", "Lungs"],
    "Maladies Treated": [
      "Weak digestion",
      "Lack of appetite",
      "Diarrhea/vomiting",
      "Dysentery",
      "Coughing",
      "Bad breath",
      "Throat Bi (喉痺)",
      "Choleraic vomiting (霍亂吐逆)",
      "Vomiting and diarrhea due to spleen deficiency with stomach cold (pixu, wei han)",
      "Chest or abdomen tightness due to pixu (spleen deficient)"
    ],
    "Medical Function": [],
    "Dosage": "5 to 10 g.\nFresh herb: 10 to 20 g.\nDo not boil too long or the effective ingredients of essential oil may be lost.",
    "Samples of Formulae": "See pregnancy nausea formula #2.\nhuo xiang zheng qi san 藿香正氣散.",
    "Contraindications": "Contraindicated in yinxu (yin deficiency) with heat and in Stomach fire.",
    "Research": "The decoction of huo xiang possesses antibiotic effect in vitro on many pathogenic fungi and leptospirosis.",
    "Notes": "",
    "Chemical Ingredients": {
      "Essential oil / aerial parts": [
        "Evaporating oil 0.28%",
        "Methylchavicol >80%",
        "D-limonene",
        "α-β Pinene",
        "Anisaldehyde",
        "Anethole",
        "Caryophyllene",
        "P-Pmethoxycinnamaldehyde (para-methoxycinnamaldehyde)",
        "3-octanone",
        "1-octen-3-ol",
        "Linalool",
        "1-carypholene",
        "β-elemene",
        "β-humulene",
        "α-ylangene",
        "β-farnesene",
        "γ-cadinene",
        "Calamenene",
        "cis-β,γ-hexenal"
      ],
      "Flavonoids": [
        "Acacetin",
        "Tilianin",
        "Linarin",
        "Agastachoside",
        "Isoagastachoside",
        "Agastachin",
        "agastacho黃鹼素類藿香苷"
      ],
      "Root": [
        "Maslinic acid (crateglic acid)",
        "Oleanolic acid",
        "3-O-acetyl oleanolic aldehyde",
        "Robinin",
        "Tilianin",
        "Agastachoside",
        "Daucostero",
        "β-sitosterol",
        "Dehydroagastol",
        "1-methylene-2,4a-dimethyl-6,8-dihydroxy-5-methoxy-7-(1,1-dimethyl-hydroxy methyl)-1,2,3,4,10,10a-heptahydro-9-phenanthroxe"
      ],
      "Guang huo xiang (Pogostemon cablin)": ["Sesquiterpene", "Pogostol"]
    },
    "References": ["[1] Zhong Hua Ben Cao 中華本草"],
    "Further Reading": [],
    "Original Text": "huo xiang, Complementary and Alternative Healing UniversityComplementary and Alternative Healing University   中藥詞典    Chinese Herb Dictionary      Search this site     在本網站找資料 huo xiang 藿香   (in English and Chinese 中英文) Edited by: Joe Hing kwok ChuPharmaceutical name:英文藥名﹕Herba Agastaches seu PogostemiBotanical name:學名﹕ Agastache rugosa (Fisch.et Mey.) O. KtzePogostemon  cablin (Blanco) Benth.Pron. in Japanese:日語發音﹕kakkoPron. in Korean:韓語發音﹕kwakhyangPron. in Cantonese:粵音﹕fok3 heong1  Other Names:別名﹕tu huo xiang 土 藿香, guang huo xiang (Pogostemon) 廣藿香。Common Name:英文名﹕agastache, patchouli, pogostemon (P. cablin), Korean mint Distribution:產地﹕throughout Chinaa (Agastache); Guangdong, Guangxi, Taiwan, Yunnan (Pogostemon)Properties(characteristics)﹕性味﹕acrid, slightly warm.辛，微温。Channels (meridians) entered: 歸經﹕spleen, stomach, lungs.脾，胃，肺。Medical functions:藥理﹕  Actions & Indications:主治﹕weak digestion, lack of appetite,  diarrhea/vomiting, dysentery, coughing, bad breath, vomiting and diarrhea or chest or abdomen tightness caused by pixu (spleen deficient) .消化 不良 ，食慾不振﹐霍亂吐 逆 ，痢疾 ，喉痺 ，咳嗽 ，口臭 ， 脾虛胃寒而引起之吐瀉 、 腹或胸悶等 。Chemical ingredients:[1]化學成份﹕[1] Contains evaporating oil 0.28%含揮發油0.28%methylchavicol >80%甲基胡椒酚, 佔80%以上D-limoneneD-香芹烯α-β Pineneα-β 蒎烯anisaldehyde茴香醛anethole茴香腦Also contains:並含有d-limoneneD - 檸檬烯caryophyllene石竹烯P-Pmethoxycinnamaldehyde對甲氧基桂皮醛3-octanone3-辛酮1-octen-3-ol1-辛烯-3-醇linalool芳樟醇1-carypholene1-丁香烯β-elemeneβ-欖香烯β-humuleneβ-葎草烯α-ylangeneα-衣蘭烯β-farneseneα-金合歡烯γ-cadineneγ-畢澄茄烯calamenene菖蒲烯cis-β，γ-hexenal順式-β，γ-已烯醛flavonoids:黃酮類化合物：acacetin刺槐素tilianin椴樹素linarin蒙花甙agastachoside藿香甙isoagastachoside異藿香甙agastachin藿香精agastacho黃鹼素類藿香苷Root contains:根含maslinic acid (crateglic acid)馬斯裡酸（山楂酸)oleanolic acid齊墩果酸3-O-acetyl oleanolic aldehyde3-O-乙酰基齊墩果醛robinin刺槐素tilianin椴樹素agastachoside藿香甙daucostero胡蘿卜甙β-sitosterolβ-谷甾醇dehydroagastol去氫藿香酚1-methylene-2，4a-dimethyl-6，8-dihydroxy-5-methoxy-7-(1，1-dimethyl-hydroxy methyl)-1，2，3，4，10，10a-heptahydro-9-phenanthroxe1-亞甲基-6，8-二羥基-5-甲氧基-7-（1，1-二 甲基羥甲基）-1，2，3，4，9，10，10，a-七氫-9-菲酮guang huo xiang contains:廣藿香含:sesquiterpene倍半萜烯pogostol廣藿香奧醇Dosage:用量﹕5  to 10 g. Fresh herb: 10 to 20 g. Do not boil too long or may lose the effective ingredients of essential oil.5～10g；鲜品加倍。不宜久煎 以免損失其有效成份之揮發性之精油。Samples of formulae:處方舉例﹕See pregnancy nausea formula #2huo xiang zheng qi san 藿香正氣散Modern Research:現代研究﹕The decoction of huo xiang possesses antibiotic effect in vitro on many pahogenic fungi and leptospirosis.藿香製劑對體外 試驗的 各種病害黴菌與鉤端螺旋體病抑制作用。Toxicity & Cautions:毒素與禁忌﹕not to use in yinxu (yin deficient)  with heat and stomach fire.陰虛 有熱或胃有熱者忌用。 　[1]Zhong Hua Ben Cao  中華本草  Search this siteProblems with website? Please Click here for comment. (Not for inquiry )    Click here for inquiryCopyright Notice 按此看關於版權問題Sponsors' Ads by Google 以下為谷歌 所提供之廣告A manuscript... writing, translating and proofreading  in progress List of Health ProblemsQigong (chi kung)Toxicity of Some HerbsSide Effect of Some HerbsHerbs that can be toxic to kidneysTraditional Chinese Medicine TCM Diagnosis Samples of FormulaeTerms of Traditional Chinese MedicineAcupuncturecopy right 版權所有Qigong classesPrescribed Drug DictionaryEmail our web master for  your suggestion (not for inquiry)Biochemistry Dictionary Qigong classes Research Librarian  HomeWeather ReportDisclaimerLast update: June 16, 2014; 10 p.m. LAH   ",
    "original_url": "http://alternativehealing.org/huo_xiang.htm"
  }
]
