[
    {
        "Names": {
            "Name": [
                "hai ma",
                "sea horse",
                "hippocamus"
            ],
            "Pharmaceutical": [
                "Hippocampus"
            ],
            "Biological": [
                "Hippocampus kelloggi Jordanet Snvder (克氏海馬)",
                "Hippocampus histrix Kaup (刺海馬)",
                "Hippocampus kuda Bleeker (大海馬)",
                "Hippocampus trimaculatus Leach (三班海馬)",
                "Hippocampus japonicus Kaup (日本海馬)"
            ],
            "Common": [
                "sea horse",
                "sea horses"
            ],
            "Other name": [
                "shui ma 水馬《抱补子》",
                "xia gu 蝦姑《海南介語》",
                "long luo zi 龍落子",
                "ma tou yu 馬頭魚《動物學大辭典》"
            ],
            "Chinese": [
                "海馬",
                "刺海馬",
                "大海馬",
                "三班海馬",
                "日本海馬",
                "水馬",
                "蝦姑",
                "龍落子",
                "馬頭魚"
            ],
            "Pronunciation in Korean": [
                "haema"
            ],
            "Pronunciation in Japanese": [
                "kaiba"
            ],
            "Pronunciation in Cantonese": [
                "hoi2 maa5"
            ],
            "Pinyin Pronunciation": []
        },
        "Type": "Animal",
        "Geography": [
            "southern part of China",
            "Thailand"
        ],
        "Properties": [
            "sweet",
            "warm"
        ],
        "Meridians": [
            "liver",
            "kidney"
        ],
        "Maladies Treated": [
            "asthma",
            "impotence",
            "unable to conceive",
            "sleepiness and lack of strength",
            "infection of throat",
            "skin diseases",
            "difficulty in delivery babies",
            "insomnia due to deficiency",
            "sciatica",
            "injuries",
            "abdomen pain",
            "breast cancer",
            "waist and leg pain"
        ],
        "Medical Function": [
            "sex hormone effect",
            "anti aging effect",
            "anti cancer effect"
        ],
        "Dosage": "For decoction: 3 to 9 g. Taken in powder form: 1 to 3 g. External use: grind into fine powder.",
        "Samples of Formulae": "For impotence or unable to conceive: Hai Ma (seahorse), bake dry and make into powder. Take 3 g each time, 3 times a day with some yellow rice wine.",
        "Contraindications": "Not to use during pregnancy or in cases of yinxu (yin deficient) with high heat. Large dosage and long term usage can be toxic to kidneys.",
        "Research": "Sex hormone effect: the alcohol extract of hai ma can prolong the heat period of female rats, increases the weight of the ovaries and possesses the effect of female hormone. It also can increase the weight of the prostate gland, spermatophore, and levator ani muscles. Its effect is stronger than she chuang zi, yin yang huo, ge jie.\n\nAnti aging effect: hai ma can increase the threshold of mice in lack of oxygen, lower monoamine oxidase, and lower lipid peroxide inside the body.\n\nAnti cancer effect: water decoction of hai long can promote normal people peripheral lymphocyte transformation, can inhibit human cancer cells. It is possible to observe the dissolving of the cancer cells after contacting the extract of hai long. The larger the dosage the larger was the rate of dissolving of the cells and the more obvious was the leaching out of the content of the cancer cells.",
        "Notes": "",
        "Chemical Ingredients": [
            "Contains protease, fat, various amino acid and inorganic salt.",
            "Hippocampus histrix Kaup (刺海馬) skin pigments: yellow pigment is γ-carotene; red pigment is astaxanthin and astacene; black pigment is melanin.",
            "Hippocampus histrix Kaup (刺海馬) also contains acetylcholinesterase and cholinesterase.",
            "Hippocampus trimaculatus Leach (三班海馬) contains stearic acid, cholesterol, and 胆甾二醇."
        ],
        "References": [
            "[1] 張前進　陝西省中醫學校 (渭南714000)"
        ],
        "Further Reading": [],
        "Original Text": "hai ma, sea horses, Complementary and Alternative Healing University     現代中藥辭典Complementary and Alternative Healing University   中藥詞典    Chinese Herb Dictionary      Search this site     在本網站找資料 See more menu at the bottom of page hai ma, sea horse, hippocamus 海馬       (in English and Chinese 中英文) by: Joe Hing Kwok Chu Pharmaceutical name:英文药名：HippocampusLatin zoological name:拉丁學名： Hippocampus kelloggi Jordanet  Snvder  (克氏海馬}Hippocampus histrix Kaup (刺海馬}Hippocampus  kuda Bleeker (大海馬}Hippocampus trimaculatus Leach  (三班海馬}Hippocampus japonicus Kaup (日本海馬}Pron. in Japanese:日語發音：kaibaPron. in Korean:韓語發音：haemaPron. in Cantonese:粤語發音：hoi2 maa5Other Names:別名﹕shui ma 水馬《抱补子》﹐xia gu 蝦姑《海南介語》﹐long luo zi 龍落子﹐ma tou yu 馬頭魚《動物學大辭典》Common Name:常用英文名﹕sea horseDistribution:分佈：Produced in southern part of China, Thailand,産於中國南部，泰國等。Properties (characteristics):性 味:sweet, warm甘 ， 溫﹐Channels (meridians) entered: 歸經﹕liver, kidney入肝， 腎經Actions & Indications:主治﹕asthma, impotence, unable to conceive, sleepiness and lack of strength, infection of throat, skin diseases, difficulty in delivery babies, insomnia  due to deficiency, sciatica, injuries, abdomen pain, and breast cancer.哮喘﹐陽痿及不孕﹐嗜 眠症和體力衰竭﹐喉嚨感染﹐皮膚病﹐難產﹐ 虛煩不眠﹐腰腿痛﹐跌打損傷, 腹痛﹐乳腺癌。Medical function:藥理作用【1】﹕ sex hormone effect: the alcohol extract of hai ma can prolong the heat period of female rats, increases the weight of the ovaries and possesses the effect of female hormone. It also can increase the weight of the prostate gland, spermatophore, and levator ani muscles. Its effect is stronger than she chuang zi,  yin yang huo,  ge jie.anti aging effect: hai ma can increase the threshold of mice in lack of oxygen, lower monoamine oxidase, and lower lipid peroxide inside the body.anti cancer effect: water decoction of hai long can promote normal people peripheral lymphocyte transformation, can inhibit human cancer cells. It is possible to observe the dissolving of the cancer cells after contacting the extract of hai long. The larger the dosage the larger was the rate of dissolving of the cells and the more obvious was the leaching out of the content of the cancer cells.   性激素作用：海馬乙醇提取物能引起與延長雌鼠動情期，增加其卵巢與子宮重量而有雌性激素作用。也能增加雄鼠的前列腺，精囊，提肛肌的重量，亦有雄激素樣作用。其效力較蛇床子，淫羊藿，蛤 蚧強。  抗衰老作用：大海馬能增加小鼠耐缺氧性，降低單胺氧化酶，降低過氧化脂質體內水平。顯明有抗衰老作用。  Samples of formulae:處方舉例﹕For impotence or unable to conceive: hai ma, bake dry and make into powder. Take 3 g each time, 3 times a day with some yellow rice wine.陽萎 ﹐ 不孕﹕ 海馬焙乾研為細末 ﹐每服３克 ﹐ 每日３次 ﹐ 黃 酒 沖 服 。Chemical ingredients:化學成份﹕ Contains protease, fat, various amino acid and salt。The yellow color of the skin of Hippocampus histrix Kaup (刺海馬) is γ-carotene, and the red color is astaxanthin, astacene, and the black color is melanin. It also contain acetylcholinesterase, cholinesterase.The Hippocampus trimaculatus Leach  (三班海馬) contains stearic acid, and cholesterol .含蛋白酶 (protease), 脂肪﹐ 多種氨基酸及無機鹽。（1）刺海馬皮肤黄色素為 γ－胡萝卜素（γ-carotene）, 红色素為虾毒素（astaxanthin） 喇蛄素（astacene）,黑色素為黑素（melanin）。并含乙酰胆碱酯酶（acetylcholinesterase）﹐ 胆碱酯酶 (cholinesterase)。（2）三斑海馬  含硬脂酸 （Stearic Acid）﹐膽 固醇 (cholesterol) ﹐胆甾二醇。Dosage:用量: For decoction: 3 to 9 g. Taken in powder form: 1 to 3 g. External use: grind into fine powder．煎湯内服：3 ~ 9 克；或入散劑﹕1 ~ 3 克。外用：研末撒。Cautions:禁忌: Not to use during pregnancy or in cases of yinxu (yin deficient)  with high heat.Large dosage and long term usage can be toxic to kidneys孕婦及陰 虛火 旺者忌服。大劑量與長期服用 ﹐可能對腎臟有毒。  【1】張前進　陝西省中醫學校 (渭南714000)Search this siteProblems with website? Please Click here for comment. (Not for inquiry )    Click here for inquiryCopyright Notice 按此看關於版權問題Sponsors' Ads by Google 以下為谷歌 所提供之廣告A manuscript... writing, translating and proofreading  in progressMenu: List of Health ProblemsQigong (chi kung)Toxicity of Some HerbsSide Effect of Some HerbsHerbs that can be toxic to kidneysTraditional Chinese Medicine TCM Diagnosis Samples of FormulaeTerms of Traditional Chinese MedicineAcupunctureChinese Herb DictionaryQigong classesPrescribed Drug DictionaryEmail our web master for  your suggestion (not for inquiry)Biochemistry Dictionary Qigong classes Research Librarian copy right 版權所有HomeWeather ReportDisclaimerLast update: May 19, 2015; 3 p.m. LAH   ",
        "original_url": "http://alternativehealing.org/hai_ma.htm"
    },
    {
        "Names": {
            "Name": [
                "an xi xiang",
                "安息香"
            ],
            "Pharmaceutical": [
                "Benzoinum Styracis Benzoinis",
                "Benzoinum Styracis Tonkinensis"
            ],
            "Botanical": [
                "Styrax paralleloneurus Perkins",
                "Styrax tonkinensis (Pierre) Craib ex Hart.",
                "Styrax officinalis (Mediterranean region medicinal benzoin tree)",
                "Styrax Macrothyrsus Perk.",
                "Styrax hypoglauca Perk.",
                "Styrax Subnivea Merr. Et Chun"
            ],
            "Chinese": [
                "安息香",
                "蘇門答臘安息香（又名印尼安息香）",
                "越南安息香（又名暹羅安息香、泰國安息香）",
                "粉背安息香",
                "青山安息香",
                "白葉安息香"
            ],
            "Common": [
                "Benzoin"
            ],
            "Other": [
                "kemenyan (Indonesian and Malay name)"
            ],
            "Pronunciation in Korean": [
                "ansohyang"
            ],
            "Pronunciation in Japanese": [
                "ansokuko"
            ],
            "Pronunciation in Cantonese": [
                "on1 sik1 hoeng1"
            ],
            "Pinyin Pronunciation": []
        },
        "Type": "Herb",
        "Geography": [
            "Sumatran benzoin (Styrax paralleloneurus Perkins): mainly produced in Sumatra, Indonesia.",
            "Styrax tonkinensis (Pierre) Craib ex Hart.: mainly produced in Thailand and Vietnam.",
            "Styrax hypoglauca Perk.: mainly produced in Hainan, Yunnan, Guangxi, Guangdong provinces of China.",
            "Styrax Macrothyrsus Perk.: mainly produced in Guangxi province of China.",
            "Styrax Subnivea Merr. Et Chun: mainly produced in Hainan, Guangxi, Guangdong provinces of China."
        ],
        "Properties": [
            "Acrid",
            "Bitter",
            "Warm"
        ],
        "Meridians": [
            "Heart",
            "Spleen",
            "Lung",
            "Stomach"
        ],
        "Maladies Treated": [
            "strokes",
            "shocks",
            "chest pain",
            "epilepsy of children",
            "geriatric asthma",
            "Wind-stroke with phlegm syncope (sudden loss of consciousness due to phlegm obstruction during wind-stroke)",
            "Sudden syncope due to qi stagnation and constraint",
            "Pain of the heart and abdomen",
            "Infantile convulsions (pediatric seizure-like episodes due to wind, heat, or fright)",
            "Asthma in the elderly",
            "cold type of stomach ache of babies where the babies cries and both legs are curling up (indication of An Xi Xiang Wan)"
        ],
        "Medical Function": [],
        "Dosage": "0.6–1.5 g, mostly being used in pill and powder form.",
        "Samples of Formulae": "An Xi Xiang Wan: for cold type of stomach ache of babies where the babies cries and both legs are curling up.",
        "Contraindications": "One of the chemical ingredients of an xi xiang benzoic acid (benzene) is toxic. Prolonged exposure to benzoic acid concentrations in excess of 35–100 parts per million in air may lead to symptoms ranging from nausea and excess fatigue to anemia and leukemia.",
        "Research": "",
        "Notes": "The medicinal material is the dried resin (乾燥樹脂) of the respective Styrax species listed.",
        "Chemical Ingredients": [
            "Resin: suma resinolic acid (su men resinic acid; sumaresinolic acid).",
            "Resin: coniferyl cinnamate (桂皮酸松柏醇脂).",
            "Resin: lubanyl cinnamate.",
            "Resin: benzoic acid.",
            "Resin: cinnamic acid."
        ],
        "References": [
            "[1] 《中華本草》"
        ],
        "Further Reading": [],
        "Original Text": "an xi xiang Linn. ,Complementary and Alternative Healing University\n\n\n\n\n\n    Complementary and Alternative Healing University\n\n\n\n\n\n\n\n中藥詞典                 \n    Chinese Herb Dictionary    \n     Search \n    this site    \n    在本網站找資料\n\n\n\n\n\n\n\n\n\n\n\n\n\n\nSearch this \n        site\n\n\nList \n        of Health Problems\n\n\n\n\n\n\n        Chinese Herb Dictionary\n\n\n\n\n\nQigong\n\n\n\n\n\n\n        Traditional Chinese Medicine (TCM)\n\n\n\n\n\n\n        Acupuncture\n\n\n\n\n\n\n        Prescribed Drug Dictionary\n\n\n\n\n\nBiochemistry Dictionary\n\n\n\n\n\nLecture Slides\n\n\n\n\n\nResearch Librarian\n\n\n\n\n\n\n        General Online Library\n\n\n\n\n\nResearch \n        Sites\n\n\n\n\n\n\n        Viagra\n\n\n\n\n\n\n        Massage/Acupressure\n\n\n\n\n\nHypnotherapy\n\n\n\n\n\nTell us what you want\n\n\n\n\n\nNotify Changes \n        & New Information\n\n\n\n \n\n\n\n\n\n \nan xi xiang 安息香  \n (in English and Chinese 中英文)\nby: Joe Hing kwok Chu\nPharmaceutical name:\n英文藥名﹕\nBenzoinum Styracis Benzoinis  Benzoinum Styracis Tonkinensis\nBotanical name:\n學名﹕\nStyrax paralleloneurus Perkins\nStyrax tonkinensis (Pierre) Craib ex Hart.\nStyrax officinalis  （地中海區的藥用安息香樹）\nStyrax  Macrothyrsus  Perk.\nStyrax   hypoglauca  Perk  (粉背安息香樹)\nPron. in Japanese:\n日語發音﹕\nansokuko\nPron. in Korean:\n韓語發音﹕\nansohyang\n\nPron. in Cantonese::\n粵音﹕\non1 sik1 hoeng1\nOther Names:\n別名﹕\nkemenyan (Indonesian and Malay name)\nCommon Name:\n英文名﹕\nBenzoin\nDistribution:\n產地﹕\nSumatran benzoin (Styrax paralleloneurus Perkins): mainly produced in Sumatra, Indonesia. \nStyrax tonkinensis  (Pierre) Craib ex Hart. mainly produced in Thailand and Vietnam. \nStyrax  hypoglauca  Perk: mainly produced in Hainan, Yunnan, Guangxi, Guangdong provinces of China. \nStyrax  Macrothyrsus  Perk.: mainly produced in  Guangxi province of China. \nStyrax Subnivea  Merr. Et  Chun: mainly produced in Hainan,  Guangxi, Guangdong provinces of China. \n蘇門答臘安息香(Styrax paralleloneurus Perkins)：又名印尼安息香，為植物安息香樹的乾燥樹脂。主產于印度尼西亞。 \n越南安息香 (樹Styrax tonkinensis  (Pierre) Craib ex Hart.)：又名暹羅安息香、泰國安息香，為植物越南安息香的乾燥樹脂。主產於越南、泰國。 \n粉背安息香 (樹 Styrax  hypoglauca  Perk.) 主產于我國海南、雲南、廣西、廣東等地。 \n青山安息香 (樹Styrax  Macrothyrsus  Perk.) 主產于我國廣西等地。 \n白葉安息香 (樹Styrax Subnivea  Merr. Et  Chun) 主產于我國廣西、廣東、海南等地。\nProperties\n(characteristics)﹕\n性味﹕\nacrid, bitter, warm\n辛、苦、溫。\nChannels (meridians) entered: \n歸經﹕\nheart, spleen, lung, stomach.\n心、脾、肺、胃經\nMedical functions:\n藥理﹕  \nActions & Indications:\n主治﹕\nFor strokes, shocks, chest pain, epilepsy of children and geriatric asthma.\n用於中風痰厥，氣鬱暴厥，心腹疼痛，小兒驚風及老年哮喘\nChemical ingredients:\n化學成份﹕\n蘇門樹脂酸（sumaresinolicacid）、桂皮酸松柏醇脂（coniferyl cinnamate，lubanyl cin－namate）、苯甲酸（benzoic acid）、桂皮酸（cinnamic acid）\nDosage:\n用量﹕\n0.6～1.5g, mostly being used in pill and powder form.\n0.6～1.5g，多入丸散用。\nSamples of formulae\n:處方舉例﹕\n\nan xi xiang wan: \n for cold type of stomach ache of babies where the babies cries and both legs are curling up.\n\n安息香丸: \n治小兒寒性肚痛，雙腿卷起而哭泣。  \nModern Research:\n現代研究﹕ \nToxicity & Cautions:\n毒素與禁忌﹕\nOne of the chemical ingredients of an xi xiang benzoic acid (benzene) is toxic. Prolonged exposure to benzoic acid concentrations in excess of 35�100 parts per million in air may lead to symptoms ranging from nausea and excess fatigue to anemia and leukemia.部份资料來源：《中華本草》\n\n\n\n\nSearch this \n    site \n\n\nProblems with website? Please \n\nClick \n    here for comment. (Not for inquiry )    \n    \n\n\nClick \n    here for inquiry \n\n\n\nCopyright Notice \n\n按此看關於版權問題\n\n \n\n\nSponsors' Ads by Google \n    以下為谷歌 所提供之廣告\n\n\n\n\n\n\n\n\nList \n        of Health Problems\n\n\n\n\n        Chinese Herb Dictionary\n\n\n\n\nToxicity of Some Herbs\n\n\n\nSide Effect of Some Herbs\n\n\n\nHerbs that can be toxic to kidneys\n\n\n\n\n        Traditional Chinese Medicine\n\n\nTCM Diagnosis\n\n\n        Samples of Formulae\n\n\n\n\n        Terms of Traditional Chinese Medicine\n\n\n\n        Acupuncture\n\n\n\n\n\ncopy right\n \n\n\n版權所有\n\n\n\nQigong \n        (chi kung)\n\n\n\n\n        Prescribed Drug Dictionary\n\n\n\n\n        Email our web master for  your suggestion (not for inquiry)\n\n\n\nBiochemistry Dictionary\n\n\n\n\n\nGeneral Online Library\n\n\n\nQigong \n        classes\n\n\n\nFake \n        Email Warning\n\n\n\nResearch Librarian\n\n\n\nSearch\n\n\n\n\n\nQigong classes\n\n\n\n\n\n\nHome\n\n\n\n\n        Weather Report\n\n\n\n\n        Disclaimer\n\n\n\n\n\n\nLast update: Sept 28, 2013; 10 P.m. \nLAH\n \n\n\n\n\n\n\n\n\n",
        "original_url": "http://alternativehealing.org/an_xi_xiang.htm"
    },
    {
        "Names": {
            "Name": [
                "ma bo",
                "馬勃"
            ],
            "Pharmaceutical": [
                "Fructificatio Lasiosphaerae seu Calvatiae"
            ],
            "Botanical": [
                "Lasiosphaera fenzlii Reich.（脫皮馬勃）",
                "Calvatia gigantea（Batsch ex Pers.）Lloyd（大馬勃）",
                "Calvatia lilacina（Mont. et Berk.）Lloyd（紫色馬勃）"
            ],
            "Chinese": [
                "馬勃",
                "南馬勃",
                "止馬勃",
                "大馬勃",
                "紫色馬勃",
                "脫皮馬勃"
            ],
            "Common": [
                "Pearly puffball",
                "Warted puffball"
            ],
            "Other name": [
                "nan ma bo 南馬勃",
                "zhi ma bo 止馬勃"
            ],
            "Pronunciation in Korean": [
                "mabal"
            ],
            "Pronunciation in Japanese": [
                "babotsu"
            ],
            "Pronunciation in Cantonese": [
                "ma po"
            ],
            "Pinyin Pronunciation": []
        },
        "Type": "Herb",
        "Geography": [
            "Inner Mongolia",
            "Northeast China",
            "Gansu",
            "Guangdong",
            "Guangxi"
        ],
        "Properties": [
            "Acrid",
            "Neutral"
        ],
        "Meridians": [
            "Lung"
        ],
        "Maladies Treated": [
            "Wind-heat constraint in the Lung with throat pain (風熱郁肺咽痛).",
            "Cough (咳嗽).",
            "Hoarseness/coarse voice (音啞).",
            "Epistaxis (nose bleeding, external use) (鼻衄).",
            "Bleeding due to injuries (external use) (創傷出血)."
        ],
        "Medical Function": [
            "Clears the Lung and benefits the throat (清肺利咽).",
            "Stops bleeding (止血).",
            "Antibiotic effect (in vitro): inhibits bacteria including Staphylococcus aureus (金黃色葡萄球菌), Pseudomonas aeruginosa (綠膿桿菌), and Streptococcus pneumoniae (肺炎鏈球菌)."
        ],
        "Dosage": "1.5–6 g internally. For external application, use an appropriate amount and apply to the affected area.",
        "Samples of Formulae": "Yin Qiao San (銀翹散) [Yin Qiao Powder].",
        "Contraindications": "Not to use for loss of voice due to wind-cold.\nAllergic reactions reported: dizziness; throat feels swollen and obstructed; heaviness in chest; skin itchiness and rash.",
        "Research": "Antibiotic effect (in vitro): inhibits bacteria including Staphylococcus aureus (金黃色葡萄球菌), Pseudomonas aeruginosa (綠膿桿菌), and Streptococcus pneumoniae (肺炎鏈球菌).",
        "Notes": "",
        "Chemical Ingredients": {},
        "References": [],
        "Further Reading": [],
        "Original Text": "\n\n\n\n\nma bo, Complementary and Alternative Healing University\n\n\n\n\n\n\n\n\n\n\n\nComplementary and Alternative Healing\n        University\n Home \n        \n現代 \n        中藥辭典\n\n\n\n\n\n\n\n\n\n\n\n\n\n\nSearch this site\n\n\n\n\n\nList of Health Problems\n\n\n\n\n\nChinese Herb Dictionary\n\n\n\n\n\n            Qigong\n\n\n\n\n\nTraditional Chinese \n            Medicine (TCM)\n\n\n\n\n\nAcupuncture\n\n\n\n\n\nPrescribed Drug \n            Dictionary\n\n\n\n\nBiochemistry Dictionary\n\n\n\n\n\n            Lecture Slides\n\n\n\n\nResearch Librarian\n\n\n\n\n\nGeneral Online Library\n\n\n\n\n\nSearch\n\n\n\n\n\nResearch Sites\n\n\n\n\n\nViagra\n\n\n\n\n\nMassage/Acupressure\n\n\n\n\n\nHypnotherapy\n\n\n\n\nTell us \n            what you want \n\n\n\n\n\nNotify Changes & New Information\n\n\n\n　\n　\n \n \n \n \n \n \n \n \n \n \n　\n　\n \n \n \n \n \n \n \n \n \n \n \n \n \n \n \n \n \n\n\n\n\n\n\n\n\n\n\n\n\n\n \n\n\nma bo 馬勃\n\n         \n\n\nby: Joe Hing kwok Chu\n\n\n\n\n\n\n    Pharmaceutical name:\n\n    英文藥名﹕\n\n\nFructificatio Lasiosphaerae seu Calvatiae\n\n\n\n\nBotanical name:\n\n    學名﹕\n\n\nLasiosphaera fenzlii Reich.、脫皮馬勃\n\nCalvatia gigantea（Batsch ex \n    Pers.）Lloyd\n        大馬勃\nCalvatia Lilacina（Mont.et Berk.）Lloyd\n        紫色馬勃\n\n\n\nPron. in Japanese:\n日語發音﹕\n\n\nbabotsu\n\n\n\nPron. in Korean:\n韓語發音﹕\n\n\nmabal\n\n\n\nPron. in Cantonese:\n粵音﹕\n\n\nma po\n\n\n\n\nOther Names:\n\n別名﹕\n\n\nnan ma bo 南馬勃﹐zhi ma bo 止馬勃.\n\n\n\nCommon Name:\n英文名﹕\n\n\nPearly puffball, warted puffball  \n\n\n\n\nDistribution:\n\n產地﹕\n\n\nInner Mongolia, Gansu, Guangdong, Guangxi provinces of China.\n\n內蒙、東北、甘肅、廣東、廣西等地。\n\n\n\nProperties\n(characteristics)﹕\n性味﹕\n\n\nacrid, neutral.\n\n辛﹐平。\n\n\n\n\nChannels (meridians)\n      entered:\n \n\n\n    歸經﹕\n\n\nlung.\n\n肺經。\n\n\n\n\n        Medical functions:\n\n        藥理﹕ \n\n\nhemostatic effect: external application stops \n            nose or mouth bleeding\nantibiotic \n            effect: inhibits bacteria in vitro including Stapylococcus aureus \n            金黃色葡萄球菌 , Pseudomonas aeruginosa 綠膿桿菌 ,  and Streptococcus \n            pneumoniae ，肺炎鏈球菌 .\n\n\n\n\nActions & Indications:\n\n    主治﹕\n\n\nfor heat in the lungs and pain in the throat, \n        coarse voice. External use: nose bleeding and bleeding due to injuries.\n\n清肺利咽，止血。用於風熱郁肺咽痛，咳嗽，音啞。外治鼻衄，創傷出血。\n\n\n\n\n\n    Chemical ingredients:\n\n    化學成份﹕\n\n \n\n\n\n\nDosage:\n\n用量﹕\n\n\n\n1.5 g to 6 g. \n\nUse appropriate amount for external application.\n\n \n\n1.5～6g；\n\n外用適量，敷患处。\n\n\n\n\n\n\nSamples \n    of formulae:\n處方舉例﹕\n\n\nyin qiao san 銀翹散\n \n\n\n\n\nModern Research:\n\n\n    現代研究﹕\n\n \n\n\n\n\nToxicity & Cautions:\n\n毒素與禁忌﹕\n\n\nNot to use when loss of voice due to wind cold.\n\nAllergic reaction: \n    dizziness, throat feels swollen and obstructed, \n\n    heaviness in chest, itchiness and rash.\n\n風 寒 失 聲 忌 用 。 \n    過敏反應包括：頭暈，喉嚨感覺發腫阻塞，胸悶，皮膚發痒，發疹。\n\n\n\n　  Sponsors' Ads by Google 以下為谷歌所提供贊助者之廣告\n\n\n\n\n\n\n\n\n\n\nA manuscript... writing, translating and proofreading              in progress\nProblems with website? Please Click here for comment. (Not for inquiry )      Click here for inquiry  \n \n\n\n            Copyright Notice 按此看關於版權問題\n\n\n\n\n\nList of Health Problems\n\n\n\nChinese Herb Dictionary\n\n\n\nToxicity of Some Herbs \n                \n\n\n\nSide Effect of Some Herbs \n                \n\n\nHerbs that can be toxic to \n                kidneys\n\n\n\nTraditional Chinese \n                Medicine\n\n\n                TCM Diagnosis\n\nSamples \n                of Formulae\n\n\n\nAcupuncture\n\n\n\n\ncopy right\n \n\n版權所有\n\n\nQigong \n                (chi kung)\n\n\n\nPrescribed Drug \n                Dictionary\n\n\n\nEmail our web master for  \n                your suggestion (not for inquiry)\n\n\n\n                Biochemistry Dictionary\n\n\n\n\nGeneral \n                Online Library\n\n\nQigong classes\n\n\nFake Email \n                Warning\n\n\nResearch Librarian\n\n\n\nSearch\n\n\n\n\nQigong classes\n                \n\n\n\n\n\n\nHome\n\n\n\nWeather Report\n\n\n   \n                Disclaimer\n\n\n\n\n\n\n\nLast update: Dec 1, \n            2008;  11:33  a.m. \n            LAH\n\n\n\n\n\n\n\n\n\n\n\n\nSearch this site     \npowered by FreeFind\n\n\n\n\n\n\n\n\n\n\n\n\n\n\n\n\n\n\n\n\n\n\n\n\n\n\n\n\n\n\n\n\n\n\n\n\n\n\n\n\n\n\n\n\n\n\n\n\n\n\n\n\n",
        "original_url": "http://alternativehealing.org/ma_bo.htm"
    },
    {
        "Names": {
            "Name": [
                "wu wei zi"
            ],
            "Pharmaceutical": [
                "Fructus Schisandrae Chinensis"
            ],
            "Biological": [
                "Schisandra chinensis (Turcx.) Baill. (northern wu wei zi 北五味子)",
                "Schisandra sphenanthera Rehd. (southern wu wei zi 南五味子)"
            ],
            "Common": [
                "schisandra fruit"
            ],
            "Chinese": [
                "五味子",
                "北五味子",
                "南五味子"
            ],
            "Other name": [],
            "Pronunciation in Korean": [
                "omicha"
            ],
            "Pronunciation in Japanese": [
                "gomishi",
                "gobai"
            ],
            "Pronunciation in Cantonese": [
                "ng5 mei6 zi2"
            ],
            "Pinyin Pronunciation": []
        },
        "Type": "Herb",
        "Geography": [
            "Schisandra chinensis (Turcx.) Baill. (northern wu wei zi 北五味子): Jilin, Liaoning, Heilongjiang, Hebei provinces of China.",
            "Schisandra sphenanthera Rehd. (southern wu wei zi 南五味子): southwestern China and provinces south of the Yangtze (Yang Zi) river of China."
        ],
        "Properties": [
            "Warm",
            "Sweet",
            "Bitter",
            "Sour",
            "Acrid",
            "Salty (but prominently salty)"
        ],
        "Meridians": [
            "Lung",
            "Kidney"
        ],
        "Maladies Treated": [
            "asthmatic cough (止咳喘)",
            "shenxu (kidney deficient) condition (滋腎固精)",
            "spermatorrhea (遺精)",
            "diarrhea (收斂止瀉)",
            "spontaneous sweating (自汗); stops instant sweating",
            "thirst (生津止渴; quenches thirst)",
            "palpitation (心悸)",
            "insomnia (失眠)",
            "chronic hepatitis (慢性肝炎)",
            "respiratory exhaustion",
            "premenstrual syndrome (PMS)",
            "night sweats (盜汗)",
            "erectile dysfunction (陽痿)",
            "depression, irritability (抑鬱，煩躁不安)",
            "nerve pain (降低神經疼痛)",
            "motion sickness"
        ],
        "Medical Function": [
            "helps prevent liver damage; helps to metabolize drugs for liver; lowering ALT and AST. The chemical ingredient, lignan can help regenerate liver tissues due to harmful influence like viruses and alcohol.",
            "anti oxidant",
            "affect metabolism",
            "helps regulate CNS; improves efficiency of brain activities and improves efficiency of work process",
            "anti hypertension but during exhaustion of circulatory function, it can help to bring up blood pressure",
            "effect on respiratory system: lowers oxygen requirement, correct respiratory exhaustion; works better than Coramine or nikethamide. It helps to expectorate phlegm and sooths coughing",
            "anti ulcer effect",
            "helps the body function to adept stress",
            "antibiotic effect",
            "anti kidney illness",
            "induces vascular relaxation via activation of endothelial nitric synthase",
            "lowers cholesterol",
            "has sedative and hypnotic action; helps prevent insomnia",
            "reduces nerve pain",
            "premenstrual syndrome (PMS)",
            "night sweats , spontaneous sweating",
            "helps correct erectile dysfunction (ED)",
            "helps correct spermatorrhea",
            "helps correct depression, irritability",
            "improve memory",
            "preventing motion sickness",
            "counteracting the effects of sugar",
            "improving the health of the adrenal glands",
            "boosting energy at the cellular level",
            "promotes saliva; quenches thirst",
            "calms emotion; nourishes the Heart and calms the Shen (養心安神)"
        ],
        "Dosage": "Usual dosage: 1.5 to 9 g.\nFor chronic cough: 1.5 g ~ 3 g.\nFor tonic: 6 to 9 g.\nBoiled with water: 1.5 to 9 g.\nUsed in powder form: 1 to 3 g (per dose).",
        "Samples of Formulae": "ALT/AST lowering formula: Link was provided on the source page (details not included in the text excerpt).\n\nTo improve sperm count and sperm activity: Wu Zi Yan Zong Wan (五子衍宗丸).\n\nFor erectile dysfunction (治陽痿): Tu Si Zi (Cuscuta seed) 等分, She Chuang Zi (Cnidium fruit) 等分, Wu Wei Zi (Schisandra fruit) 等分. Grind the three ingredients to powder, bind with honey into pills the size of a wutong seed (蜜丸如梧子). Take 30 pills with drink, three times daily (飲服三十丸，日三). Source: Qian Jin Fang (《千金方》).",
        "Contraindications": "Not to be used by patients with ulcers, or epilepsy, or by those who have over-exercised, or with high pressure in the cranium. Contraindicated when exterior pathogenic factor has not yet been released (表邪未解), in the early stage of cough with internal heat (內有實熱 咳嗽初起), and in the early stage of measles (麻疹初發).\nUsing Wu Wei Zi together with sulfonamides may cause bleeding in the urinary tract (血尿).",
        "Research": "",
        "Notes": "Modern Applications: to be loaded.",
        "Chemical Ingredients": {
            "Evaporating oil": [
                "a-pinene",
                "camphene",
                "b-pinene",
                "myrcene",
                "a-terpinene",
                "limonene",
                "G-terpinene",
                "p-cymene",
                "thymold methylether",
                "bornyl acetate",
                "citronellyl acetate",
                "linalool",
                "terpinene-4-ol",
                "a-terpinol",
                "geraniol",
                "borneol",
                "citronellol",
                "benzoic acid",
                "o-cadinene",
                "b-elemene",
                "a-ylangene",
                "cuparene",
                "sesquicarene",
                "b-chamigrene",
                "a-chamigrene",
                "chamigrenol",
                "b-bisabolene",
                "ethyl benzyl ether",
                "[2, 2-dimethyl-3-methylenebicyclo (2, 2, 1) heptane]",
                "(1-methyl-4-methylethenenylcyelohexene)",
                "(phenyl-2-propanone)",
                "[2-methyl-3-methylene-2-(4-methyl-3-pentenyl)-bicyclo (2, 2, 1) heptane]",
                "longifolene",
                "[4-(1, 5-dimethyl-1, 4-hexadienyl)-1-methylcylohexene]",
                "isolongifolene",
                "a-santalene",
                "clovene",
                "b-caryophyllene",
                "trans-caryophyllene",
                "b-selinene",
                "thujopsene",
                "santalol",
                "a-santalol",
                "nonylophenol",
                "[2-(p-cyclohexylphenoxy) ethanol]",
                "[2-(2-phenyl cyclohexyloxy) ethanol]",
                "(p-nonylphenol, 4, 4a, 5, 6, 7, 8-hexahydro-4, 4a-dimethyl-6-(1-methyl ethenyl)-2 (3H)-naphthalene",
                "1, 1a, 4, 5, 6, 7, 7a, 7b-octahydro-1, 1, 7, 7a-tetramethyl-2H-cyclopropa (a) -naphthalene-2-one",
                "1, 1a, 2, 4, 6, 7, 7a-7b-octahydro-1, 1, 7, 7a-tetramethyl-5H-cyclopropa(a) -naphthalen-5-one",
                "cyclopropa (a) -naphthalen -2-one",
                "2-(5-ethenyl-5-methyl-2-tetrahydrofuranyl)-6-methyl-5-hepten-3-one",
                "1, 2, 3, 3a, 8, 8a-hexahydro-2, 2, 8-trimethyl-5, 6-azulenedimethanol",
                "1, 3, 4, 5, 6, 7-hexahydro-1, 1, 5, 5-tetramethyl-tricyclo (5, 4, 0)undec-9-ene",
                "1, 2, 4a, 5, 6, 8a-hexahydro-4, 7-dimethyl-1- (1-methylethyl)-naphthalene",
                "2, 3, 7, 7, 8, 8a hexahydro-3, 6, 8, 8-tetramethyl-1H-3a, 7-methanoazulene",
                "1, 8-dimethyl-4-(1-methylenyl)-spiro (4, 5) dec-7-ene",
                "4-phenobicyclo (2, 2, 2) pctan-1-ol"
            ],
            "Lignans": [
                "schizandrin",
                "deoxyschisandrin",
                "gamma-schisandrin",
                "schisandrol",
                "pseudo-gamma-schisandrin",
                "wuweizisu C",
                "schisandrol A",
                "schisandrol B",
                "schizandrate B",
                "gomisin A",
                "gomisin B",
                "gomisin C",
                "gomisin F",
                "gomisin G",
                "angeloylgomisin H",
                "tigloylgomisin H",
                "benzoylgomisin H",
                "epigomisin O",
                "angeloylgomisini O",
                "pregomisin",
                "angeloyisogomisin O",
                "benzoylisogomisin O",
                "isoschisandrin",
                "rubschisantherin",
                "rubschisandrin",
                "schisanhenol acetate",
                "schisanhenol B",
                "schisanhenol",
                "schisantherin",
                "neoschizanrin",
                "meso-dihydroguaiaretic acid"
            ],
            "Organic acids": [
                "malic acid",
                "citric acid",
                "tartaric acid",
                "succinic acid"
            ],
            "Others": [
                "citral",
                "chlorophyll",
                "calcium oxalate"
            ]
        },
        "References": [
            "Zhong Hua Ben Cao 中華本草",
            "Zhong Yao Da Ci Dian 中药大辞典"
        ],
        "Further Reading": [],
        "Original Text": "wu wei zi, Complementary and Alternative Healing University  現代醫藥詞典Complementary and Alternative Healing University   中藥詞典    Chinese Herb Dictionary      Search this site     在本網站找資料 See more menu at the bottom of pageWU WEI ZI 五味子   (in English and Chinese 中英文)by: Joe Hing Kwok ChuClick here to see picture of herb. 按此看圖 。Pharmaceutical name:英文药名：Fructus Schisandrae ChinensisBiological name:拉丁學名：Schisandra chinensis (Turcx.) Baill. (northern wu wei zi 北五味子)Schisandra sphenanthera Rehd. (southern wu wei zi 南五味子)Pron. in Japanese:日語發音：gomishi;gobai.Pron. in Korean:韓語發音�omichaPron. in Cantonese:粤語發音：ng5 mei6 zi2Common Name:英文名：schisandra fruitDistribution:分佈：Schisandra chinensis (Turcx.) Baill. (northern wu wei zi):in Jilin, Liaoning, Heilongjiang, Hebei provinces of China.Schisandra sphenanthera Rehd. (southern wu wei zi):in south western part of China and in provinces south of Yangtze (Yang Zi) river of China.\"北五味子\" ，主產於中國東北之吉林，遼寧，黑龍江等省與河北省； \"南五味子\"，主產於西南及長流域以南各省。 Properties (characteristics):性味：warm, sweet, bitter, sour, acrid, salty but prominently sour.性溫，五味(甘苦酸辛鹹)皆具備，但酸 鹹較多   Channels (meridians) entered:歸經：lung, kidney入 肺 ﹐腎 經。Actions & Indications:應 用﹕stops asthmatic cough, helps correct shenxu (kidney deficient)  condition, treats spermatorrhea, stops instant sweating, promotes saliva, quenches thirst, calms emotion, palpitation, helps to prevent insomnia, lower ALT and AST, treats chronic hepatitis.止咳喘 ，滋腎固精 ，治腎 虛遺精 ， 收斂止瀉 ，固 表止汗，治自汗 ，生津止渴 ，養心安神治心悸失眠 。 降轉氨脢 ，治療慢性肝炎 。Medical Function:藥理:　　　　　　　　　　　　　　　　　　　1. helps prevent liver damage; helps to metabolize drugs for liver; lowering ALT and AST. The chemical ingredient, lignan can help regenerate liver tissues due to harmful influence like viruses and alcohol.2. anti oxidant3. affect metabolism4. helps regulate CNS; improves efficiency of brain activities and improves efficiency of work process5. anti hypertension but during exhaustion of circulatory function, it can help to bring up blood pressure.6. effect on respiratory system: Lowers oxygen requirement, correct respiratory exhaustion; works better than Coramine or nikethamide. It helps to expectorate phlegm and sooths coughing.7. anti ulcer effect8. helps the body function to adept stress9. antibiotic effect10. anti kidney illness11.  induces vascular relaxation via activation of endothelial nitric synthase.12. lowers cholesterol13. helps prevent insomnia14. reduces nerve pain15. premenstrual syndrome (PMS)16. night sweats , spontaneous sweating17. helps correct erectile dysfunction (ED18. helps correct spermatorrhea19.helps correct  depression, irritability,20. improve  memory21. preventing motion sickness22. counteracting the effects of sugar23. improving the health of the adrenal glands24. boosting energy at the cellular level 　1。 抗肝臟損傷作用 誘導肝臟藥物代謝脢作用﹐ 降血清轉氨脢。其成份之一，木脂素，能修復有害外來影響，如病毒，酒精等損傷的肝臟。2。抗氧化作用3。 影響代謝4。對腦中樞作用﹕(1)能改善大腦調 節功能，增強興奮與抑制過程的靈活性；(2)能 提高智力活動及工作效率；5。對心血管系統作用: 有降壓作用﹐ 但對循環哀竭有生壓作用。6。對呼吸系統作用﹕降低耗氧量﹐增加 潮氣量﹐ 改善呼吸哀竭極為有利﹐優于可 拉明(Coramine, nikethamide).  鎮咳祛痰7。 抗潰瘍作用8。 對機體適應能力作用9。抗菌作用10。抗腎病變作用11。通 過誘導血管舒張內皮一氧化氮合成酶的激活。12。降低膽固醇 13。有鎮靜，催眠作用，而有助於防止失眠 14。降低神經疼痛 15。經前期綜合徵 16。治盜汗，自汗 17。治陽痿 18。治遺精 19。治抑鬱，煩躁不安， 20。提高記憶力 21。防止暈車 22。糖的影響抵消 23。改善腎上腺的健康 24。在細胞水平上提高能源Chemical ingredients:化學成分： 1.Evaporating oil: a-pinene  a-蒎 烯, camphene 莰烯, b-pinene -b-蒎 烯, myrcene 月桂烯, a-terpinene a-松 油烯, limonene 檸檬烯, G-terpinene, p-cymene, thymold methylether, bornyl acetate, citronellyl acetate, linalool, terpinene-4-ol, a-terpinol, geraniol, borneol, citronellol, benzoic acid, o-cadinene,  b-elemene,  a-ylangene, cuparene, sesquicarene,   b-chamigrene,  a-chamigrene, chamigrenol,   b-bisabolene, ethyl benzyl ether, [2, 2-dimethyl-3-methylenebicyclo (2, 2, 1) heptane], (1-methyl-4-methylethenenylcyelohexene), (phenyl-2-propanone), [2-methyl-3-methylene-2-(4-methyl-3-pentenyl)-bicyclo (2, 2, 1) heptane], longifolene, [4-(1, 5-dimethyl-1, 4-hexadienyl)-1-methylcylohexene], isolongifolene, a-santalene, clovene,  b-caryophyllene, trans-caryophyllene,  b-selinene, thujopsene, santalol, a-santalol, nonylophenol, [2-(p-cyclohexylphenoxy) ethanol], [2-(2-phenyl cyclohexyloxy) ethanol], (p-nonylphenol, 4, 4a, 5, 6, 7, 8-hexahydro-4, 4a-dimethyl-6-(1-methyl ethenyl)-2 (3H)-naphthalene, 1, 1a, 4, 5, 6, 7, 7a, 7b-octahydro-1, 1, 7, 7a-tetramethyl-2H-cyclopropa (a) -naphthalene-2-one, 1, 1a, 2, 4, 6, 7, 7a-7b-octahydro-1, 1, 7, 7a-tetramethyl-5H-cyclopropa(a) -naphthalen-5-one, cyclopropa (a) -naphthalen -2-one, 2-(5-ethenyl-5-methyl-2-tetrahydrofuranyl)-6-methyl-5-hepten-3-one, 1, 2, 3, 3a, 8, 8a-hexahydro-2, 2, 8-trimethyl-5, 6-azulenedimethanol, 1, 3, 4, 5, 6, 7-hexahydro-1, 1, 5, 5-tetramethyl-tricyclo (5, 4, 0)undec-9-ene, 1, 2, 4a, 5, 6, 8a-hexahydro-4, 7-dimethyl-1- (1-methylethyl)-naphthalene, 2, 3, 7, 7, 8, 8a hexahydro-3, 6, 8, 8-tetramethyl-1H-3a, 7-methanoazulene, 1, 8-dimethyl-4-(1-methylenyl)-spiro (4, 5) dec-7-ene, 4-phenobicyclo (2, 2, 2) pctan-1-ol.2. Lignans 木脂素類: schizandrin, deoxyschisandrin, gamma-schisandrin, schisandrol, pseudo-gamma-schisandrin, wuweizisu C, (schisandrol A, B), schizandrate B, gomisin A, B, C, F, G, angeloylgomisin H, tigloylgomisin H, benzoylgomisin H, epigomisin O, angeloylgomisini O, pregomisin, angeloyisogomisin O, benzoylisogomisin O, isoschisandrin, rubschisantherin, rubschisandrin, schisanhenol acetate, schisanhenol B, schisanhenol, pregomisin, schisantherin, neoschizanrin, meso-dihydroguaiaretic acid.3. Organic acids 有機酸類：malic acid 蘋果酸，citric acid 枸橼酸; tartaric acid 酒石酸，succinic acid 琥珀酸。4. citral.檸檬醛, chlorophyll 葉绿素，5. calcium oxalate 草酸鈣Dosage:用量：Usual dosage : 1.5 to 9 g. For chronic cough: 1.5 g ~ 3 g. For tonic: 6 to 9 g.Boiled with water: 1.5 to 9 g.Used in powder form: 1 to 3 g.1.5 ~ 9 克 。水煎 1.5 ~ 9 克 。久咳嗽 1.5 ~ 3 克 。研 末 服 每 次 1- 3 克 。Samples of formulae:處方舉例：Click to see ALT AST lowering formula按此看降 低 ALT 與 AST 之藥方。To improve sperm count and sperm activity: wu zi yan zong wan增加精子數量與活動 力： 五子衍宗丸治陽痿：菟 絲子、蛇 床子、五味子各等分。上三味，末之，蜜丸如梧子。飲服三十丸，日三。《 方源：千金方 》Modern Applications:to be loadedCautions:禁 忌：Not to be used by patients with ulcers, or epilepsy,  or by those over exercise, or with high pressure in the cranium, cold or flu no yet clear, early stage of cough with internal heat, and those with early stage of  measles.Use wu wei zi together with sulfonamides may cause bleeding in the urinary tract.潰瘍或 癲癇發作﹐運動過度﹐顱內高壓之病人禁用。表邪未解 ﹐內有實熱 咳嗽初起 ﹐ 麻疹初發者忌服 。五味子與磺胺類藥 (sulfonamides) 同時使用可能會引起血尿。Source: Zhong Hua Ben Cao  中華本草:；: Zhong Yao Da Ci Dian 中药大辞典Search this siteProblems with website? Please Click here for comment. (Not for inquiry )    Click here for inquiryCopyright Notice 按此看關於版權問題Sponsors' Ads by Google 以下為谷歌 所提供之廣告A manuscript... writing, translating and proofreading  in progressMenu: List of Health ProblemsQigong (chi kung)Toxicity of Some HerbsSide Effect of Some HerbsHerbs that can be toxic to kidneysTraditional Chinese Medicine TCM Diagnosis Samples of FormulaeTerms of Traditional Chinese MedicineAcupunctureChinese Herb DictionaryQigong classesPrescribed Drug DictionaryEmail our web master for  your suggestion (not for inquiry)Biochemistry Dictionary Qigong classes Research Librarian copy right 版權所有HomeWeather ReportDisclaimerLast update: June 8, 2016; 5 p.m. LAH   ",
        "original_url": "http://alternativehealing.org/wu_wei_zi.htm"
    },
    {
        "Names": {
            "Name": [
                "ci ji li",
                "bai ji li"
            ],
            "Pharmaceutical": [
                "Fructus Tribuli"
            ],
            "Biological": [
                "Tribulus terrestris Linn."
            ],
            "Chinese": [
                "白蒺藜",
                "刺蒺藜"
            ],
            "Common": [
                "Puncturevine caltrop fruit",
                "nettle fruit",
                "puncture vine fruit",
                "cathead fruit",
                "yellow vine fruit",
                "goathead fruit",
                "burra gokharu (Indian name)"
            ],
            "Other name": [
                "yin ji li 硬蒺藜",
                "ji gu zi 蒺骨子",
                "bai ji li 白蒺藜",
                "ji li 蒺藜",
                "san jiao ding 三腳丁",
                "san jiao hu 三腳虎",
                "san jiao ma zai 三腳馬仔"
            ],
            "Pronunciation in Korean": [
                "paekchillyo"
            ],
            "Pronunciation in Japanese": [
                "baikuchitsuri"
            ],
            "Pronunciation in Cantonese": [
                "ci3 zat6 lai4"
            ],
            "Pinyin Pronunciation": [
                "ci ji li",
                "bai ji li"
            ]
        },
        "Type": "Herb",
        "Geography": [
            "China: northeastern, northern, Qinghai, Xizang (Tibet), along the Yangtze River"        ],
        "Properties": [
            "Bitter",
            "Acrid",
            "Neutral"
        ],
        "Meridians": [
            "Liver"
        ],
        "Maladies Treated": [
            "achy loin due to deficiency (虛勞腰痛)",
            "spermatorrhea (遺精)",
            "leukorrhea (帶下)",
            "headache",
            "dizziness (眩暈)",
            "pink eyes with tears (目赤多淚)",
            "keratitis (角膜炎)",
            "cloudiness in cornea (角膜雲翳)",
            "chronic bronchitis with coughing (咳逆肺痿)",
            "concretions and accumulations (癥結積聚)",
            "milk not flowing (乳閉不通)",
            "skin itchiness (皮膚瘙癢)",
            "wind rash (風疹)",
            "bulging sensation in the rib cage/chest and hypochondrium distention (胸脇脹悶)",
            "vitiligo (白癜風)"
        ],
        "Medical Function": [
            "Soothes the Liver and relieves constraint to rid of depressed mood (平肝解鬱).",
            "Invigorates blood and dispels wind to rid of pain (活血袪風).",
            "Brightens the eyes (明目) and improving vision.",
            "Stops itching (止癢).",
            "Present day application: reports that body builders are using bai ji li (白蒺藜) to improve results through increasing testosterone; may increase luteinizing hormone which helps development of the corpus luteum in females and production of testosterone by interstitial cells of the testis in males."
        ],
        "Dosage": "Internal (decoction): 6–9 g.\nExternal: smash and apply, or make into powder and sprinkle on affected parts.",
        "Samples of Formulae": "For wind rash (風疹) with itchiness: commonly combined with Chan Tui (Cicada slough), Jing Jie (Schizonepeta herb), and Fang Feng (Saposhnikovia root).",
        "Contraindications": "Use with care in cases of blood deficiency and/or qixu (qi deficiency), and during pregnancy.\n\nToxic reactions: 1) Overdose can cause lack of energy, dizziness, nausea, vomiting, palpitation, rapid respiration, and skin purpura/cyanosis; in serious cases it can cause pulmonary edema and respiratory failure. It can also produce high iron hemoglobin (methemoglobinemia) leading to asphyxia. 2) Allergic reactions: there are reports of skin itchiness, papular rash, and erythema after consuming bai ji li.",
        "Research": "Anti-inflammatory: Tribulus terrestris water extract has anti-inflammatory effects; inhibitory effect on delayed-type hypersensitivity is mainly achieved through mid-term inhibition of effector cell differentiation and formation.\n\nAntihypertensive: Tribulus water extract, ethanol–water extract, and 30% ethanol leaching solution produced antihypertensive effects in anesthetized animals. The alkaloid fraction had no effect on canine blood pressure, but could inhibit frog heart; the water-soluble fraction had moderate antihypertensive effect. [1]\n\nDiuretic: Used as a diuretic in Indian folk medicine. In saline-loading experiments in rats, the diuretic effect was not ideal. The diuretic effect of the ash content water extract and plant decoction is mainly due to the presence of potassium; some consider the alkaloid fraction also has a diuretic effect. Clinically effective for patients with ascites and edema. [1]\n\nAnti-acetylcholine: Tribulus terrestris has anti-acetylcholine effect. [1]\n\nTonic/anti-aging, antibacterial, anti-allergic, vitiligo: Reported strong and anti-aging effect; antibacterial, anti-allergic effects, and effect in treatment of vitiligo. [1]\n\nAnti-ischemic: Saponins from Tribulus show significant anti-myocardial ischemic effect. [1]\n\nAntimicrobial: Tribulus extract can inhibit growth of Staphylococcus aureus and Escherichia coli. [1] The most active extract against both Gram-negative and Gram-positive bacteria was the ethanol extract from the fruits, with a minimal inhibitory concentration (MIC) of 0.15 mg/ml against Bacillus subtilis, Bacillus cereus, Proteus vulgaris, and Corynebacterium diphtheriae. The same fruit ethanol extract showed the strongest antifungal activity against Candida albicans with an MIC of 0.15 mg/ml. [2]\n\nLipid and reproductive effects (animals): Crude saponins from stems and leaves significantly reduced cholesterol levels in animals with experimental hypercholesterolemia and increased the lecithin/cholesterol ratio; significantly stimulated spermatogenesis in male rats, increased libido, and improved fertility.",
        "Notes": "",
        "Chemical Ingredients": {
            "General/unspecified part": [
                "steroidal saponins (甾體皂甙)",
                "diosgenin",
                "ruscogenin",
                "hecogenin",
                "gitoogenin",
                "tribuloside",
                "kaempferol-3-rutinoside",
                "astragalin",
                "harmine"
            ]
        },
        "References": [
            "[1] Zhong Hua Ben Cao (中華本草).",
            "[2] J Zhejiang Univ Sci B. 2008 Feb;9(2):154–159. Published online 2008 Jan 16. doi:10.1631/jzus.B0720251."
        ],
        "Further Reading": [],
        "Original Text": "ci ji li, Complementary and Alternative Healing University\nComplementary and Alternative Healing University 中藥詞典                 Chinese Herb Dictionary      Search this site     在本網站找資料 Search this siteList of Health ProblemsChinese Herb DictionaryQigongTraditional Chinese Medicine (TCM)AcupuncturePrescribed Drug DictionaryBiochemistry DictionaryLecture SlidesResearch LibrarianGeneral Online LibraryResearch SitesViagraMassage/AcupressureHypnotherapyTell us what you wantNotify Changes & New Information                                                      bai_ji_li.htm   ji_li.htm  ci_ji_li.htm    Tribulus_terrestris.htm    bai ji li 白蒺藜; ci ji li 刺蒺藜          (in English and Chinese 中英文) by: Joe Hing kwok Chu Present Day Applications:現代 應用﹕There are reports that body builders are using this herb to improve resultthrough increasing testosterone. This herb may increase the luteinizinghormone which helps the development of the corpus luteum in the femaleand the production of testosterone by the interstitial cells of the testis inmale.  See Caution.有報導說，鍛煉肌肉健身者在使用白蒺藜來增加睪酮以提高鍛煉效果。本品可能會增加女性的黃體生成， 在男性有助於睪丸間質細胞產生睪酮而促進肌肉生長。Pharmaceutical name:英文藥名﹕Fructus\nTribuliBiological name:拉丁文學名﹕Tribulus terrestris Linn.Pron. in Japanese:日語發音 ﹕baikuchitsuri  (白蒺藜)Pron. in Korean:韓語發音 ﹕paekchillyo (白蒺藜)Pron. in Cantonese:粵音﹕ci3 zat6 lai4Other Names:別名 ﹕yin ji li 硬蒺藜，ji gu zi 蒺骨子， bai ji li 白蒺藜， ji li  蒺藜，san jiao ding (literally: 3 legged nail) 三腳丁 ，san jiao hu(litterally 3 legged tiger) 三腳虎 ，san jiao ma zai(literally: 3 legged horse) 三腳馬仔。Common Name:外文名﹕Puncturevine caltrop fruit, nettle fruit, puncture vine fruit, cathead fruit ,yellow vine fruit, goathead fruit, and burra gokharu (Indian name).Distribution:產地﹕mainly produced in north eastern, northern part of China and in Qinghai,Xizang, and along the Yangtze River of China.產東北﹐華北﹐ 青海﹐西藏和長江流域等地。Properties(characteristics)﹕性味﹕ bitter, acrid, neutral.苦﹐辛，平。 Channels (meridians) entered: 歸經﹕liver.肝經。Medical functions:藥理﹕ \n\nTribulus terrestris water extract has anti-inflammatory effects. Inhibitory effect on the delayed type hypersensitivity is mainly achieved through the mid-term effect on the inhibition induced cell differentiation and formation.\nTribulus terrestris has antihypertensive effect . Tribulus water extract , ethanol - water extract and 30 % ethanol leaching solution in anesthetized animals have antihypertensive effect. Its alkaloids had no effect on canine blood pressure , but can inhibit frog heart , water-soluble fraction with moderate antihypertensive effect. [ 1 ]\nTribulus terrestris has some diuretic effect. Tribulus terrestris is being used as a diuretic used in Indian folk medicine. In saline loading experiments in rats , the diuretic effect is not ideal. The diuretic effect of water extract of its ash content of the water extract and plant decoction , is mainly due to the presence of potassium . But some people think that in addition to potassium , the alkaloids have a diuretic effect. Clinically it is effective for patients with ascites and edema . [ 1 ]\nTribulus terrestris has anti- acetylcholine effect . [ 1 ]\nTribulus terrestris has a strong and anti-aging effect.Tribulus terrestris has antibacterial, anti-allergic and treatment of vitiligo effect.\nTribulus has significant anti- ischemic effect .\nTribulus terrestris extract can inhibit the growth of Staphylococcus aureus, Escherichia coli. [ 1 ]\nThe crude saponins of Tribulus leaves can significantly reduce lab animal experimental hypercholesterolemia cholesterol levels , elevated lecithin / cholesterol ratio ; can significantly stimulate spermatogenesis in male rats , increased libido , improve fertility .\nThe most active extract against both Gram-negative and Gram-positive bacteria was ethanol extract from the fruits with a minimal inhibitory concentration (MIC) value of 0.15 mg/ml against B. subtilis, B. cereus, P. vulgaris andC. diphtheriae. In addition, the same extract from the same plant part demonstrated the strongest antifungal activity against C. albicans with an MIC value of 0.15 mg/ml. [2]\n\n 刺蒺藜水提取物有抗炎作用。對遲發型變態反應的抑制作用主要是通過對抑制誘導期中的效應細胞的分化 與形成而達致的。刺蒺藜有降壓作用。蒺藜水浸液、乙醇-水浸出液和30％乙醇浸出液對麻醉動物有降壓作用。其生物鹼部分對犬血壓無影響，但可抑制蛙心，水溶性部分有中度降 壓作用。[1]刺蒺藜有一定的利尿作用。白蒺藜在印度民間作為利尿劑用；在鹽水負荷的大白鼠實驗中，利尿作用並不理想，其灰分的水提取物及植物煎劑的利尿作用，主要是由 於鉀鹽的存在。但有人認為除了鉀鹽外，生物鹼部分有一定的利尿作用，臨床上對腹水及水腫病人有效。[1]刺蒺藜具有抗乙酰膽鹼作用。[1]刺蒺藜具有強壯與抗衰老作用。刺蒺藜具有抗菌、抗過敏及治療白癜風作用。蒺藜皂甙有明顯的抗心肌缺血作用。蒺藜提取物能抑制金黃色葡萄球菌、大腸桿菌的生長。[1]蒺藜莖葉粗皂苷能顯著降低實驗性高膽固醇症動物的膽固醇水平，升高卵磷脂/膽固醇比值；可明顯刺激雄性大鼠精子生成，增加性慾，提高生殖力。最活躍的蒺藜乙醇提取物對革蘭氏陰性和革蘭氏陽性菌的最小抑菌濃度， 0.15毫克/毫升， 對枯草桿菌，蠟樣芽胞桿菌，夏枯草和C的水果提取物。白喉。此外，同樣從蒺藜提取物表現出最強的對白色念珠菌的抗真菌活性為0.15毫克/毫升。 [2]Actions & Indications:主 治﹕\nEffective for soothing the liver to rid of depressed mood, invigorating blood \nto rid of pain, improving vision, stopping itchiness.\nBeing used in treatment of：achy loin due to deficiency, spermatorrhea,\nleukorrhea,headache, dizziness, pink eyes with tears, keratitis, cloudiness \nin cornea, chronic bronchitis with coughing, milk not flowing, itchiness, \nrash, bulging sensatiion in the rib cage, vitiligo, etc.\n \n \n \n功效：有平肝解鬱，活血袪風，明目止癢之效。\n治：虛勞腰痛 ， 遺精帶下 ， 頭痛 ，眩暈， 目赤多淚 ， 角膜炎，角膜雲翳，\n咳逆肺痿 ， 癥結積聚 ， 乳閉不通 ， 皮膚瘙癢 ， 風疹 ， 胸脇脹悶，白癜風 。\n \nChemical ingredients:化 學成份﹕steroidal saponins:甾體皂甙; 其皂甙元為:diosgenin薯蕷皂甙元ruscogenin魯期可皂甙元hecogenin海可皂甙元gitoogenin吉托皂甙元Also contains:另含:tribuloside蒺藜甙kaempferol-3-rutinoside山柰酚-3-芸香糖甙astragalin紫雲英甙harmine肉葉芸香鹼Dosage:用 量﹕\n\nfor decoction: 6 to 9 g. \nfor external use: smash and apply or make into powder and sprinkle into affected parts.\n\n \n\n內服：6～9 克。\n外用：捣敷或研末撒。\n\nSamples of formulae:處方 舉例﹕用於風疹瘙痒，常與蟬 蛻，荊 芥，防 風等同用。Modern Research:現 代研究﹕ Cautions:禁 忌﹕use care in cases of blood deficient  and/or qixu (qi deficient)  and in cases of pregnancies.Toxic re-actions:1. overdose can cause toxic reaction: lack of energy, dizziness, nausea, vomiting, palpitation, rapid respiration, skin purpura. In serious cases it can cause lung edema, and respiration exhaustion. It can also cause high iron content in red cells and result in asphyxiate.2. There are allergic reaction of skin itchiness, rash and erythema after consuming the herb.血虛,  氣虛及 孕婦慎服。1.用量過大:用量 過大 會引起 中毒反應，出現乏力﹐頭昏﹐噁心﹐嘔吐﹐心悸﹐氣急﹐皮膚青紫﹐嚴重者出現肺 水腫﹐呼吸衰竭 。 亦可產生高鐵血紅蛋白而引起窒息。2.過敏反應:有報道服用白蒺藤後，出現皮膚瘙癢﹐丘疹﹐紅斑。[1] Zhong Hua Ben Cao    中華本草[2] J Zhejiang Univ Sci B. 2008 February; 9 (2): 154�159. Published online 2008 January 16. doi:  10.1631/jzus.B0720251Search this siteProblems with website? Please Click here for comment. (Not for inquiry )   Click here for inquiryCopyright Notice 按此看關於版權問題A manuscript... writing, translating and proofreading  in progressSponsors' Ads by Google 以下為谷歌 所提供之廣告\n\n\n List of Health ProblemsChinese Herb DictionaryToxicity of Some HerbsSide Effect of Some HerbsHerbs that can be toxic to kidneysTraditional Chinese Medicine TCM Diagnosis Samples of FormulaeTerms of Traditional Chinese MedicineAcupuncturecopy right 版權所有Qigong (chi kung)Prescribed Drug DictionaryEmail our web master for  your suggestion (not for inquiry)Biochemistry DictionaryGeneral Online LibraryQigong classesFake Email WarningResearch LibrarianSearchQigong classesHomeWeather ReportDisclaimerLast update:August22, 2020; 10:58 p.m.. LAH  \n\n\n\n ",
        "original_url": "http://alternativehealing.org/ci_ji_li.htm"
    }
]
